닉네임,댓글,좋아요수,날짜
River두유,고양이도 잘그리셨는데ㅠㅜ,107개,2020. 5. 29.
NiNi,여기 진짜 개비쌈 네일스티커 동대문가면 천원퀄 파는거 2만원이고 팔찌도 몇백원하는거 몇만원씩 팜,95개,2020. 5. 29.
버키,2만원....,38개,2020. 5. 29.
보혜,4:45 건널 수 없는 강을 건너는..게 아니고 돌아올 수 없는 강을 건너는...,16개,2020. 5. 29.
BubbleBubble,수수 너무 이뻣는데... ㅠㅠㅠ 힝,23개,2020. 5. 29.
Millie,라뮤끄님은 볼때마다 정말 섬세.. 그런데 온유님은 볼때마다 너무 궁금했는데 예전에 스타일리스트하셨던 건지 원래 인맥이 좋으신건지 아티스트들이랑 많이 친하기도 하시고 유명하신 것 같은데 이유가 뭔가요?😭,1개,2020. 5. 29.
미쯔초코,헐.. 라뮤끄님 고향이 천안이라니 저두 천안인데 괜히 반갑네늉,3개,2020. 5. 29.
최해삼,며칠전에 학교선배랑 술먹다가 에크멀립스틱 추천했는데 동기라고해서 깜짝놀랬어여! 첨알았어여 ㅋㅋㅋㅋㅋ 섬세완벽한 메이크업이다했는데 역시 미대라그럴까여,1개,2020. 5. 29.
HoomieKi,Cute idea! The studio is cute. You're so good! You paint really well. I love the cats!!,0개,2020. 5. 29.
jiahs,여기 임블리가 갔던 곳이네효ㅎㅎ,18개,2020. 5. 29.
요리하고화장하는언니요화언,운동화 너무 예쁜데요?!><ㅋㅋㅋㅋ저도 흰색운동화나 기본템사서 따라해봐야겠어요~~~👍👍,4개,2020. 5. 29.
MereaniQalovakawasa,Sooo beautiful 😍💕 what a fun project! I'm gonna try this 😊🌱,0개,2020. 5. 29.
박룰루,재밌겠다ㅜㅜ,2개,2020. 5. 29.
이지은,흰색칠할때 사용하신 붓 정보 궁금해요!!! 집에서 꼭 해보고 싶어용!,2개,2020. 5. 29.
정현선,진짜 너무 이쁘네용ㅠㅠ 저두 하구싶어용,0개,2020. 5. 29.
SooYummy수야미,온유님을 여기서 뵙다니... 전직 미대생으로써 너무재밌어요 ..❤️❤️,1개,2020. 5. 29.
은밍밍,라뮤끄님 혹쉬... 귀걸이 정보 알슈있을까요...? ㅠㅠㅠㅠㅠ,0개,2020. 5. 29.
르미르미,제가 팔로우하는 두분의 콜라보라니 저도 함께하고싶어용♡,0개,2020. 5. 29.
안은별,온유님 블라우스 엄총이뿌네용 라뮤끄님두 피부존좋.. 대리만족즁,0개,2020. 5. 29.
오뉴,라뮤끄언니 슬의에 채송화(전미도 님) 많이닮으신거같아요💗!!,0개,2020. 5. 29.
ChrisKim,언니..귀여웡..❤️거기에 패션센스까지..!,0개,2020. 5. 29.
해인,커스텀 신발 너무 귀여워요!!,0개,2020. 5. 29.
정소희,아이고 예쁘다❤️ㅎㅎ,0개,2020. 5. 29.
아라라라,언니 너무 좋아효~~~~~🥰,0개,2020. 5. 29.
baebae,"오와아아 ??온유님이랑도 친분있으셔요오 ?? 
신발보고 온유님이그렸는데 했는데 진짜 온유님등장✨ 아 머쉬룸이 새 작업실이었네요 인스타에서보구 새로운 인테리어샵인줄알랐네여ㅎㅎ",0개,2020. 5. 29.
버터프레첼,헝 언니 기다렸어요ㅠ,0개,2020. 5. 29.
이승아,온유님 너무 귀여워ㅜㅜㅠ,3개,2020. 5. 29.
Angelineuwu,"No entendí casi nada, pero igual me gusto jsjs",2개,2020. 5. 29.
유니카,저거 해보고프다...,0개,2020. 5. 29.
EMiinVlogs,so cute!! w,1개,2020. 5. 29.
AngeloAngelo,제니 ❤️,1개,2020. 5. 29.
귀멸의뽕짝,1빠!!!,1개,2020. 5. 29.
Kari,Great place!!🤩👍🏻,0개,2020. 5. 29.
꾸구꾸구,따라하고싶다,1개,2020. 5. 29.
칠칠칠칠,네일스티커 2만윈 개오바,5개,2020. 5. 29.
BLACKPINKUnit,Jennie trendsetter,0개,2020. 5. 29.
,언니 슬기로운 의사생활 송화쌤 메이컵 해주시면 안될까요??,168개,2020. 5. 23.
지으니,라뮤끄언니 에크멀도 하시공 카페 사장님도 하시고 뷰티유튜버 까지 직업이 3개!!!!!?????!!!,205개,2020. 5. 23.
리애나,에크멀 사장+신제품 개발+유튜브+ 카페까지..?!  언니 무리하는 건 아니죠..?,161개,2020. 5. 23.
덤미닝,라뮤끄님 사용하신 헤어드라이기 뭔지 궁금한 사람 나아나...,46개,2020. 5. 23.
율하,영상미 진짜 대박... 항상 대박이긴 했지만 이번은 정말 대박이에요 그리고 언니도 너무 매력적이에요 언니가 뭘 하든 응원해요 사랑해요,92개,2020. 5. 23.
김땡칠,0:00 와 집에 1200만원짜리 스피커가 있다니....,87개,2020. 5. 23.
뿅아리,언니 머리 롤 방법 좀 자세히 알려주시면 안될까요?? 진짜 너무 예뻐요 ㅠㅠㅠ,19개,2020. 5. 23.
CaitlynKreklewich,"Hey you!
Yah you reading this!
You are an amazing person and I just wanted to brighten up your day.
There is only one you in the world so don't feel like you need to be someone else!
Live up your life before you're extinct, because there will never be another you ever again!
You are a beautiful, amazing person and you need to surround yourself with happiness and amazing people who treat you well :)
Amazing video darling and great channel, I just wanted to spread some love around and make peoples day better :)",4개,2020. 5. 23.
신미영,"언니 헤어롤 스타일링 더 자세히 알고싶어요.😆😆
저번에 드라이하는것도 많이 써먹었거든요.
진짜 얼굴도예쁘고 성격도 좋고 못하는것도 없으면 사기 아니에요.❤❤❤ 매일 언니영상 보는데 하루만 언니로 살고싶어요,😭😭",44개,2020. 5. 23.
유다인,언니 채송화 교수님이랑 얼굴도 그렇구 느낌이 너무 비슷해요ㅠㅠㅠㅇ엉엉,7개,2020. 5. 23.
전수민,"머리롤 여러개 하셨을 때 쿵푸허슬의 아줌마가 생각낰ㅋㅋㅋㅋㅋㅋㅋㅋ
물론 결론은 이쁘시지만..🤭👍",5개,2020. 5. 23.
이직,헤어롤은 어디제품일까윰?? ㅎㅇㅎ,12개,2020. 5. 23.
재아뷰티하다,오늘 너무 매력적인데요?? ㅋㅋ립스틱 정말 사서 써보고 싶으네요!! 색이 착붙이네요👍🏻😍,31개,2020. 5. 23.
사랑스러운HANA,왜 이렇게 오랜만인 느낌이죠? ㅠㅠ 요즘 잘 지내고 계시죠…? 항상 행복하길 바라는 마음으로 기도드릴게요,6개,2020. 5. 23.
박경태,"언니,언니는 사람들이 예쁘다 예쁘다 해주니까 진짜 언니가 예쁜 줄 알죠?립스틱도 잘 만들었다,꼭 산다!이러니까 진짜로 그럴 줄 알죠?




맞아요.잘 알고계시네요😍",20개,2020. 5. 23.
박서연,울 언니 미모가 최고다 언니 사랑해ㅜㅜㅜㅜ,11개,2020. 5. 23.
쀼야,언니 속눈썹풀 어디껀가여ㅠㅠ 투명풀쓰면 티나던데 언니꺼는 티가 하나도안나요,5개,2020. 5. 23.
전지성,아 언니 롤 말아놓은 거 보고 아따맘마가 자꾸 겹쳐보여서가지곸ㅋㄱㅋ 보는 내내 웃었어욬ㄱㄱㅋ 그나저나 그 카페 가면 언니 볼 수 있는건가요!!!!,0개,2020. 5. 23.
지현,언니 사랑해 ㅠㅠㅠㅠㅠ,7개,2020. 5. 23.
권가은,슬의생 채송화 커버 메이크업 해주세료 !!,3개,2020. 5. 23.
미쯔초코,요거 영상 헤어튜토리얼 궁금해요 ㅎㅎㅎ 간단히 나왔지만 잘 안보여서 ㅠ,8개,2020. 5. 23.
박삐순,오늘 스타일링 뭐야 너므 예쁘다ㅜㅜㅠㅜㅜ,3개,2020. 5. 23.
유영주,꺄 바리스타라니❤ 언니 담에 에크멀전제품중에 이건 꼭 사야된다 추천한다 탑5가지 추천하는 영상 보고싶어요오,9개,2020. 5. 23.
단미,주말에 알바가서 언니(사장님)하고 같이 일하고 싶어요💛💛ㅋㅋㅋㅋㅋㅋㅋㅋㅋ,5개,2020. 5. 23.
밍무,아 너무 힐링된다ㅠㅠㅠㅠ 노래두 넘 좋고 영상미도 최고,3개,2020. 5. 23.
구밍,"저번에 충공뱀 메이크업 때ㅋㅋㅋㅋㅋㅋㅋㅋㅋㅋㅋㅋㅋㅋㅋ 선세럼 쓰시는거 보고 살까말까 곻민 했는데
언니가 또 사라고 하니까 살께요 😍😍😍❤️❤️❤️❤️❤️",0개,2020. 5. 23.
호롤로,"24시간으로 사시는 거 맞나요...? 부지런함 도라방스,,,멋져요🥺 또다른 출발 응원합니다❣️",3개,2020. 5. 23.
AAZZANG아짱,카페 얼른 가보고싶어요ㅠㅠㅠㅠ💙,11개,2020. 5. 23.
GraceLum,"OMG WHAT now ypu have your own café?! that is so cool! congratulations! had no idea you were pursuing this, I thought after the release of EQUMAL that was your main dream, your cafe looks so cozy 💕🥺",0개,2020. 5. 23.
rubikim,"선세럼 저거 진짜 좋아요!  람뀨언니가 저번에 추천해줘서 이미 쓰고 있었지욥!
글구.. 카페 사장.. 에끄멀.. 유튜버.. 직업이 몇개인거람?! 멋있고 이쁘고 아주 다해ㅠㅠㅠ",1개,2020. 5. 23.
민트,"언니 립스틱배송 왜이리 빨라요 ㅋㅋㅋㅋ 목요일 저녁에 시켰던거 같은데 토요일 배송이네
가방도 이쁘고 립스틱도 조녜... 텅장은 비었지만 마음이 풍족하다...
속눈썹은 참았지만 색조는 못참겠다...!넘이뻐요 ㅠㅠ",2개,2020. 5. 23.
벼리,라뮤끄님 드라이기 어디꺼 쓰세용...?,3개,2020. 5. 23.
김민정,동인비 안그래도 현백 지하 1층 정관장 매장에 있어서 눈여겨 봤는데 구매 해야겠어용 ㅎㅎㅎ,1개,2020. 5. 23.
Phyllisxoxo,Wow that sponge 👀 I like fenty’s matchstix in amber too ! ❤️,1개,2020. 5. 23.
베이비,이 전 립 발색 영상에사 볼에 하이라이터? 빔?! 정보는 언제 올라오나요.. ㅠㅠㅠ 매일 들어와서 확인하구있어요... 너무너무 궁금해요..!!!!,2개,2020. 5. 23.
고은,와 미모 무슨 일이야... 진짜 이번 메이크업 너무 예뻐요 언니 💞💞💞,0개,2020. 5. 23.
조민하,"마르살라턴 주문해놓고 실제 색 엄하면 어떡하나 살짝 두려움에 떨고 있었는데, 오늘 영상 보니 세상 다 가진 것 같은 마음이.... 잘 샀다 나.....^^",1개,2020. 5. 23.
다혜,오늘도 퀄리티 최고 💗💗,1개,2020. 5. 23.
moonh,드라이기 뭔가요~?알랴주세염^^,5개,2020. 5. 23.
펭수,17:26 이런거 너무 좋아여,0개,2020. 5. 23.
이영차,"왤캐 멋지게 사는거임... 뷰티유튜버도 탑티어..
에끄멀 브랜드 런칭도 팁스틱 겁나 뽐뿌와...언제 카페까지 준비 하신거죠....",2개,2020. 5. 23.
기뮤댕,울언니...너무 무리하는 거 아녀요...????카페라니ㅜㅜㅜ한남동 애정하는데 우리 언니 카페오픈하면 저 당장 달려갈게요ㅜㅜ,0개,2020. 5. 23.
123Rin,LAMUQEちゃん、いつも見てます🥰大好きです！これからもいろいろ発信して下さい❤︎❤︎❤︎,0개,2020. 5. 23.
SooYummy수야미,우런니 너무 멋져.... 하고싶은거 다해 💪🏼🤍🤍,0개,2020. 5. 23.
체리오라비,뭐야...언니 썸넬 인형인둘 알고 들어왔잖아...,0개,2020. 5. 23.
최윤희,헐 대박 45초전 올라온 영상!,1개,2020. 5. 23.
해인,"오늘 메이크업 너무 이뻐요! 라뮤끄님 카페
진짜 오픈 하신간가요??",0개,2020. 5. 23.
임아기사랑,완전 착붙ㅠㅠㅠㅠ이뻐여,0개,2020. 5. 23.
꺄dana륵,언니 진짜 이뻐요ㅠㅠㅠㅠ❤❤❤❤,1개,2020. 5. 23.
새별,피부 메이크업 장난 아니에요ㅠㅠ 넘 이뿌링,0개,2020. 5. 23.
수현,"라뮤끄님 ㅠㅠ 요즘 목주름때문에 너무 고민이에요  ㅠㅠ한평생 신경쓰지 않다가 최근에 넘 신경쓰여서 , 지금부터 관리하면 주름이 옅어질수 있을까요..??목주름 케어 방법이 궁금합니당ㅇ..",0개,2020. 5. 23.
DaheeLee,화장 색조합 미쳐따 속눈썹대박..,0개,2020. 5. 23.
아린,"하하 언니 저 드디어 립스틱 사요!!!!!!계속 영상 보면서 
진짜 사고 싶었는데!!! 으아아 진짜  오늘도 너무 이쁘싶니다♡♡",0개,2020. 5. 23.
탁두둥,언니 저번처럼 이틀 브이로그도 보고싶어요 그 영상만 몇번째 돌려보는 중 ㅠㅠㅠ 언니의 차분하면서 화려한 느낌이 너무 좋고 아름다워요 ㅠㅠ ♡,0개,2020. 5. 23.
프로젝트봄,"이 언니 정말.... 멋지다...🙊
언니야 오늘 팁스틱 개시했는데 넘 예뽀요🥰🥰
맘에 들어요
동네순이인데 언니 카페 놀러가고 싶어여 정식오픈 기다립니당!!😊😊🎊🎊",0개,2020. 5. 23.
이아,하 나 썸넬 무슨 유럽 공주가 오늘 날씨는 어떤가? 서민들은 잘 지내고 있나? ㅎㅎ 하는 공주님 ㄴ계셔서 당장 들어왓습니다 언니 근데 그거 아세요...?? 광주광역시에도 송정리라는 동네 있는데 진짜 완전 이름 보고 깜짝 놀랐어요,1개,2020. 5. 23.
뉴욕데일리,언니 진짜 대단하신거같아요 ㅠㅠ 허쓸러 https://www.youtube.com/watch?v=nvSYBCddi2w&t=2s 영감을 받아서 메이크업 영상을 제작해보았어요~ 키이라 나이틀리 닮았나요? 시간날떄 봐주시고 알려주세요!!,0개,2020. 5. 23.
pearlGold,라뮤끄님 드라이기 정보 궁금해여! ㅠㅠ,0개,2020. 5. 23.
꾸뀨,아이라인 안하고 속눈썹만 붙이면 풀이 투명하게 마른게 다 보이지않나요?,0개,2020. 5. 23.
김유경,언니 영상을 볼 때는 항상 힐링이 되는 것 같아요.. 저한테 없는 깨끗하고 하얀 피부랑 잘 자리 잡힌 눈썹이랑 도톰한 입술에 화장 잘 되는 거 보면 너무 힐링이에요 거기에 언니 목소리가 한 몫 합니다...❤️,0개,2020. 5. 23.
김미진,"언니가 하고싶어하는일 하는거 같아서 제가 다 기분이 좋네요!! 진짜 한번쯤은 꿈꾸는 유투버, 화장품만드는거,카페사장 언니 보면서 대리만족 합니댜👍",0개,2020. 5. 23.
워너블이지훈,흐어..언제봐도 언니 눈썹그리기 실력은 미쳤어요 너무 이뻐,0개,2020. 5. 23.
은비,보면 볼수록 매력적이게 예쁘신듯..언니 살앙해요💕,0개,2020. 5. 23.
화연,처음에 나오는 스피커 정보좀요 ㅜㅜ,2개,2020. 5. 23.
BBo,언니 카페에서 알바하구 시퍼요 저 커피 잘뽀바여❤️헤,0개,2020. 5. 23.
두두둥,"우와..... 너무 미인이셔용
카페 분위기도 짱이구용... 꼭 한 번 들르겠습니다!",0개,2020. 5. 23.
밍기적,와아아아 2분전에 올라온 영상 처음이에요 항상 잘 보고 있어요 🥰🥰🥰,0개,2020. 5. 23.
김담이,3:29 깜쨕앙🙄🙄,0개,2020. 5. 23.
임현지,언니 오늘도 너무 이뻐요 ㅜㅜ,0개,2020. 5. 23.
억만장자,앞부분 영상미 무엇인가요?!! 메이크업 때 중전마마 같으세요ㅋㅋㅎㅎ 아 근데 라뮤끄성형외과 컨텐츠는 혹시 이제 안 하시는 건가요?,0개,2020. 5. 23.
히힣헤헿,뮤끄언니 슈가가 대취타 노래 냇어요!!! ㅋㅋ 커버메이크업 각?!,0개,2020. 5. 23.
유달링,와 24시간이 모자란언니가 요기잇네요.. 되게 부지런하게 사시는거 너무 멋져요.. 저 카페는 비오는날이 딱이네요- 라뮤끄님은 정말 정직한 사람 같아요.. 다른 유투버들 처럼 실망 하는 일 없기를 바래요 ㅠㅠ!,0개,2020. 5. 23.
임현지,한남동 카페... 간다 카페 죽순이 해보지뭐,0개,2020. 5. 23.
도른언니,스피커어디꺼인가요ㅜㅜ,0개,2020. 5. 23.
키럭,쫜쫜 쫀득쫀득 표현이 넘 기여워요...ㅎㅎ,0개,2020. 5. 23.
정사원,이태원 요즘 코로나 사건 터져서 한남도 피해가 있을텐데 ㅠㅠ 가게되면 들릴게요!!!,0개,2020. 5. 23.
BOMYO,와우 주무실 시간이 있으셨는지...;; 대박적...,0개,2020. 5. 23.
뇸뇸,혹시 헤어 튜토리얼 따로 올려주실 수 있나요?❤️,0개,2020. 5. 23.
유정,"언니 얼굴이 꾸꾸꾸라 아무리 꾸안꾸스타일해도 언니는 꾸꾸꾸예요,,, 오늘도 영상 감사해요🥰🥰",0개,2020. 5. 23.
MichaelaKwon,싱글에센스 빨간병 엄청 좋다는 얘기 많던데 언니 영상  보니 써보고싶네용,0개,2020. 5. 23.
시드,난 언니 이런 영상이 좋드라~?,0개,2020. 5. 23.
유니카,꾸안꾸지만 할거 다한..ㅎㅎㅎ,0개,2020. 5. 23.
빠마머리앤,카페도 하실 줄 몰랐는데 ㅎㅎ 한 번 가보고 싶다.. ㅎㅎ,1개,2020. 5. 23.
MEKEMEKE,헉 언니 드라이기는 어디꺼에요?,2개,2020. 5. 23.
도앵이,언니 혹시 얼굴형 관리 집에서 따로 하시는 편이신가요? 언니 볼 때마다 매번 느끼지만 얼굴형이 너무 예뻐요 ㅠㅠ,0개,2020. 5. 23.
송민주,앞치마? 너무예뻐요 정보주실수있나욤...ㅎㅎㅎㅎ,0개,2020. 5. 23.
S2,언니 너무 이뽀용😘  사룽행❤💚💙💜💗💕,1개,2020. 5. 23.
김명지,렌즈뭐에용??,1개,2020. 5. 23.
허니로그Honeylog,저 비오는날 좋아해요!! 라뮤끄님!!!!  저도 나중에 시간되면 한번 가보고싶네용 !!! 저는 집에서 브레빌로 홈카페하고있어요!! 커피너무 좋아하거든요!!! 컄ㄱ 추카드립니다!!!! 진짜 언젠가 라뮤끄님한테 화장꼭받아보는게 소원임^^,0개,2020. 5. 23.
HannahSalameh,The music and the atmosphere 💗💗💗,0개,2020. 5. 23.
안개비,앞치마 옷인줄 알았어요. 너무 이쁘네요.,1개,2020. 5. 23.
선바는술을잘마시지,썸네일 3ce 모델 수아님 닮으신거 같아요..!,0개,2020. 5. 23.
강수미,라뮤끔님 오래영상을 보다보니까 이웃집 친근한 언니같아요  찐언니 반말영상 만들어주세요 조근조근 수다떨면서 잔소리도해주고 언니가 화장 해보니 이런게 찐방법이더라. . 이런 찐언니같은 반말영상 길게 만들어주세여 제발😭,0개,2020. 5. 23.
펭수,언니 회색 니트 머무 이쁜데 정보 알려주심 안될까요~?,0개,2020. 5. 23.
lynezhou,카페 넘 이뻐요ㅠㅠ 언니두요,0개,2020. 5. 23.
드림찡,"카페이름은 무슨의미가있나요?
왜 송정리로 하셨는지 궁금해욧!~",0개,2020. 5. 23.
SojinKim,헤어롤 어디 제품인지 넘 궁금해요ㅜㅜ,0개,2020. 5. 23.
썸블리,오프닝 너무 힐링되요☕️ 카페 놀러갈게요!,1개,2020. 5. 23.
김수지,"동인비 가격은 후덜덜하지만,,라뮤끄님이 쓰시면 뭐든지 사서 써보고싶은마음이 굴뚝,,
한남동 카페 너무기대됩니당!!분위기도 넘모 예쁘고 뭣보다ㅜㅠㅜ카페가면 라뮤끄님 후광이라도 볼수있을까싶어서,,,ㅜㅠㅜㅠㅜ
카페여시면 누구보다 빠르게가보고싶ㅇㅓ요!!!!!오늘화장 넘모예쁘십ㅌ니다 사랑해요!!!!!!!!",0개,2020. 5. 23.
쏭이SSONGE,요즘에 다 코로나때문에 화장을 가볍게 하시는거 같아용!,0개,2020. 5. 23.
Surin,헤어롤 어디서 구매하셨나영,0개,2020. 5. 23.
김미선,논섹션 립스틱 화보컷이랑 실제 발색이랑 왜케 다르죠?,0개,2020. 5. 23.
허지혜,언니 정말 열일하시네요!!,0개,2020. 5. 23.
높은음자리표,"언니 완전 뷰럽 ㅠㅠ저도 인생 마지막 목표가 ㅏ페 차리기 에용 퓨ㅠㅠ아직 좀 기다려야 하지만 
노력해서 언젠가!!☘️☘️",2개,2020. 5. 23.
지니,라뮤끄님 미국가수 Lexii Alijai닮았어요 인종초월🙊구글링 해보세요,0개,2020. 5. 23.
안녕요,언늬... 드라이기 정보 좀 주세용,0개,2020. 5. 23.
루나맑음,언니 눈밑에 멍든거에요?? 다크써클 이라기엔 많이 파란고같은데 ㅠㅠ,0개,2020. 5. 23.
김선우,사용하신 헤어롤 정보가 궁금해요 !,0개,2020. 5. 23.
이이이이이,저 중독되지 재구매 하러 갑니당,0개,2020. 5. 23.
하울,언니 드라이기 뭐 사용하시는거에요.???,0개,2020. 5. 23.
응애,비오는 날 너무 좋아요..,1개,2020. 5. 23.
watwwatw,"당신은 천상 화장쟁이.
개인적바램은, K뷰티에 힘써주시길.
랑콤. 샤넬 과 어깨를나란히 K뷰티 한국이 우뚝설때까지…당신같은사람들은 노력해주시길.

사업은 허지마세요.
화장만 해주세요.

이상 개인적바램 이었읍니다.",0개,2020. 5. 23.
AureliaWijaya,what is the hair dryer's brand called?,0개,2020. 5. 23.
혜연,나중에 언니네 카페 꼭갈거야,0개,2020. 5. 23.
SoneEXOL,Your REALLY pretty 💖💖💖💖💖,0개,2020. 5. 23.
홍정원,언ㄴ닝 .... 노라조가 머리에 캔감은거랑 똑가타요.... 물론 언니는 넘예에요.... 하트,0개,2020. 5. 23.
듀히,언니 역대급 이뻐요,0개,2020. 5. 23.
보혜,"00:00 스피커 정보: 브리온베가 RadioFonografo rr-226-O 10,900,000￦",4개,2020. 5. 23.
김민정,쿠션퍼프가 궁금했는데...솔직히 쿠션퍼프도 쿠션에 맞춰서 나오는 편이라서....궁합도 보고 싶었는데 본인이 만든 브랜드(치즈퍼프) 홍보나..제품의 장점 말씀해 주시는 것도 좋지만 유료광고 받으신거 영상 찍으시는건데 이점이 좀 아쉽네요...,1개,2020. 5. 23.
사과향,언니 착용하신 앞치마는 어디꺼에용?,0개,2020. 5. 23.
권귤귤Lucca,꾸안꾸 화장해도 더 이쁘잖아용,0개,2020. 5. 23.
단쌍,대박 언제놀러갈승있나여?!!!!!,0개,2020. 5. 23.
구름은비까비,헤어롤 어디꺼예요?? 넘 궁금,2개,2020. 5. 23.
글뤼크운좋은언니,이쁘당,0개,2020. 5. 23.
라리루,오픈하면 꼭 갈게요,0개,2020. 5. 23.
XIANC,Holy crap she is so pretty....,1개,2020. 5. 23.
김미선,송정리가 송중리라고 보이는것 같은데,0개,2020. 5. 23.
아라라라,언니 넘 좋아요오오오오,0개,2020. 5. 23.
이연님,"와 처음 나오는 오디오 정말 갖고싶어서 저거 갖춘 집에서 사는게 로망인데...★ 언니 정말 성공한 신여성이세요,,, 멋죠멋죠💖",1개,2020. 5. 23.
영영,17:58,0개,2020. 5. 23.
PavlaSudan,Nice make up and I wish you the best with your coffee shop!😚☕☕☕,1개,2020. 5. 23.
,9:10,0개,2020. 5. 23.
라La,오늘 영상 인트로가 왠지 외로워 보였어요.,0개,2020. 5. 23.
DAISY0613,(♥￫▽￩♥),1개,2020. 5. 23.
김미선,에크멀 립스틱은 라뮤끄님만 쓰게 만들어진 것 같네요 ㅡㅡ,0개,2020. 5. 23.
miknuhcuy,간접광고가 있는 영상에 광고만 6개.....ㅠ,11개,2020. 5. 23.
HyjKim,그 카페 가면 메이크업 수정도 해주시나요? 그럼 좋겠어요.,0개,2020. 5. 23.
암낫언엠티멜론,헐.....언니 직업이 몇개에요??? 카페 오픈하면 찾아갈게욥♡ 구독자라고 하면 서비스도 주시나용?!! 헤헿 영상 항상 감사합니다♡,0개,2020. 5. 23.
고은,.,0개,2020. 5. 23.
안소민,근데 진짜 신기한 게 토리님이랑 씬님이랑 동일 컬러를 발랐다는 생각이 안 들어요. 그녕 다른 색 같고 뮤끄님이 중간 같은? 진짜 넘 신기하다,2개,2020. 5. 17.
방찌,진짜 뷰튜버 세계관 최강자들의 모임이다... 텅장이 웅장해진다...,28개,2020. 5. 17.
박경태,"이건 애플과,삼성과,LG가 콜라보한 느낌이다. ㄹㅈㄷ다 진짜ㅠ",25개,2020. 5. 17.
ikak이크에크,혹시 라뮤끄님 옷도 일부러 쿨톤쪽 파랑색 웜톤쪽 베이지색 반반으로 입으신건가요..!ㅋㅋㅋㅋㅋㅋㅋㅋㅋ,14개,2020. 5. 17.
다래다래,아 시끄러운 사람들 사이 차분한 사람 너무 웃겨 ㅋㅋㅋㅋㅋㅋ,1개,2020. 5. 17.
ssin씬님,🐙 문어문어 🌸,962개,2020. 5. 17.
곽토리kwaktori,드뎌💖💖🥺💖💖 나무슨톤인지 궁굼..🌝,606개,2020. 5. 17.
김은빈,혹시 토리언니만 두배속 한건가욬ㅋㅋㅋㅋㅋㅋㅋㅋㅋ목소리랑 속도가 두배속 한거 같아요 귀를 의심했어요 ㅋㅋㅋㅋㅋㅋㅋ,175개,2020. 5. 17.
양냐난,곽토리 설명 진짜 잘해준다..,506개,2020. 5. 17.
이브,"미쳐따리....거의 뷰통령들 모임. 뷰티정상회담급..
셋이 여행하는 컨텐츠나 셋이 뭔가 하는 컨텐츠 만들어주세여 제발여 결혼들 해서도 애낳고 애가 유투바 할 때까지... 너무 좋아여 단지 발색으로 모인 조합인데 벌써 힐링 됩니당 파자마파티 할 것 같고 셋이 캠핑 갈 것 같고 + 회사원, 유투르 님까지하면 거의 그럼 뷰티계아이돌😭
7:05, 13:07, 14:54, 사랑해요 🙊❤ 너머예뻐ㅠㅠ 사진으로 찍어서 방에 걸어드리고 싶다 세 분 다☺
102번 201번 203번 204번 너무 예뻐요 곧 결혼인데 신행 때 그리고 데일리에 제가 딱 발림에 따라 느낌도 다르고 바르고 싶은 색들이예요 이 밤에 갑자기 떠서 바로 봤어용.. 건강히 오래오래 계셔주세요 라뮤끄님...🥰",701개,2020. 5. 17.
도니,되게 고민 많이하고 정성들여서 만든 티가 난다... 저 블렌딩 스틱은 아이디어도 너무 좋고 엄청 활용성 있을듯! 그나저나 라뮤끄님 볼에 빔이 너무 사랑스럽고 예쁘네여 뭐 바르셨을까...,705개,2020. 5. 17.
이예림,립은 이런식으로 여러명이서 발라보는 게 다 다르니까 훨씬 더 잘 리뷰할 수 있는 거 같아요 너무 좋아용,500개,2020. 5. 17.
느그서장하고어,솔직히 화장품에 돈 많이 안 쓰는 사람이라 비싸다는 생각에 사고싶다는 생각이 안 들었었거든요.. 근데 씬님이랑 곽토리님 진짜 막 ㅋㅋㅋ 오버해서 설명해주시구 톤별 발색보고 와.. 이건 사야겠다 싶었습니다 셋다 돈독해서 너무 보기좋아요.. 서로 정말 응원하는 사이인게 보여서 저도 맴이 따떳해졌슴다.. 겨울쿨톤 나년 레드 립스틱 사러갑니당,348개,2020. 5. 17.
열,아니 라뮤끄님 오늘 화장 무슨일이에요  피부표현이랑 블러셔랑 하이라이터랑 너무 잘 섞여서 너무너무너무 예뻐요ㅠㅠ 오늘 메이크업 꼭 영상으로 찍어주셨으면 좋겠어요ㅠㅠ,210개,2020. 5. 17.
