,youtube_id,comment,like_num
0,헤이즐Heizle,"물욕없는 요즘... 이랬지만 언제 또 차오를지 모르는 물욕쓰...ㅎㅎㅎㅎㅎ😭😱
올해들어 구매했던 쇼핑템들 쫙 보여드립니당~!!
기다려 주셔서 감사해용!!🙏

랍유 헤이즐넛!!🦋💙",214개
1,호이호이잇,"와,,앞머리있으니까 진짜 안그래도 여백없는 얼굴 더 꽉꽉차보여요,,,,💙오늘도 놀라고갑니다... 갑자기 앞머리 뽐뿌오지만,,, 헤이즐언니니까 소화가능한 것...크킄,,, 솔직히 가방이랑 옷 눈에 별로 안들어와요...언니만 계속 보게돼,,,🥴💛",7개
2,박지현,믿고보는헤이즐 온니❣!! 명품하울은 사랑입니다❤ 기다리고 있었어요😂 앞머리 헤이즐 언니 넘나 알음다운거 아입니까!!?ㅎㅎ 영상 넘나 잘 보구 갑니당😄,27개
3,헤이즐Heizle,English subtitles are complete!👍😍❤️,70개
4,,흑발에 앞머리 미쳤다 영원히 박제해야돼 리틀한예슬이냐고요!!!!!@,3개
5,김호연,"진짜 언니는 루이비통 원피스 너무 잘 어울려,,, 전에도 봤지만 정말 너무너무 잘 맞앙...",6개
6,루시,"우오ㅓ 언니 영상 기다렸어요❣️
어제 인스타 라이브 넘 잘 봤어요💕
진짜 요즘 언니 미모 물 올랐어요 😦
원래도 존예였지만❣️
리즈인 듯요💖헤이즐 리즈 시절에 이렇게 있다니
행복하다💗",9개
7,구도연,아ㅠㅠ 너무 좋아ㅠㅠ 진짜 뭔가를 좋아하는 헤이즐이 너무 멋있어요ㅠㅠ 오늘도 영상 고맙습니다~~,3개
8,XIANC,I'm so early there aren't even english subtitles yet,14개
9,ASophie,물욕없는 헤이즐의 귀한 픽이라 고마워요!!💙 우리 언니가 쵝오얌!!!👍🏻👍🏻👍🏻👍🏻,68개
10,TaeinLee,앞머리 완전 잘어울려요! 5살은 더 어려보이시는듯..?!,4개
11,후르쯔테일FRUITTAIL,퐤션..하울..진짜 완전 오랜만이네욥!!!! 한창 이즐화실에..푹 빠져버린바람에...!!! 자기전에 영상 잘보구자욥!!! 마침 딱 즈하언니랑 헤이즐언니랑..오늘 영상이..ㅠㅠ 행보케... 흙..❤😘😘😍,3개
12,버블다미,"언니 사랑해유 진짜 너무 이쁘구 언니 얼굴이 명품이에오 언니 얼굴 얼마인가요



+좋아요  20 감사합니다!!!
+좋아요 30  감사해요!!!!!!",30개
13,강팔춘,"언니~ 언니 취향 옷들을 보면 다들 규칙적인 패턴이나 화려한 패턴이 있고, 악세사리들도 다들 키치 한것 같아요! 제가 그런 스타일의 옷들을 되게 좋아하는데 저한텐 뭔가 투머치해보이고 안어울리더라구요 ㅜㅜ 저런 아이템들을 매치해서 평소에 꾸안꾸처럼 입을수 있도록 매치하는 영상 한번 올려주심 좋겠어요!",9개
14,김유림,"루이비통 원피스 진짜 진짜 진짜 너무 이뻐요
 헤이즐언니한테 정말 잘 어울려영💕💕💕💕💕",2개
15,김가현,진짜 믿고보는 헤이즐하울...💕 ))언니 하울을 보면 제가 물욕이 차오른다니까용~~,3개
16,Nana나나,"Yayyy!! I love this one, thank youuu",1개
17,척추기립근,와 셀린느 가방 진짜 예쁘네요,4개
18,in,헤이즐님이 명품이셔서 아무 옷이나 입거나 가방 매고 다녀도 명품💰,2개
19,JL,"9:40 그냥.... 헤이즐 언니 또 헤이즐 했다! 언니 옷 가끔은 엥? 할 때가 있는데, 언니가 입은 사진 보면 아~ 하고 이해가 된다. 내가 입었으면 도마뱀 같았을 옷 😭 옷이 오히려 언니를 입은 느낌? 언니 너무 예뻐요.. 아니 너무 헤이즐 해요 😍",2개
20,김언지,"뭐지 이 빛이나는 이쁨은 놀라서 자동으로 눌렀다..
(물론 원래였어도 눌렀겠지만 ㅎㅎ)",27개
21,백일몽,"하...언니...이렇게 이쁘면 어떻게 안 반하냐구... 진짜... 풀뱅은 또 뭐냐구ㅠㅠㅠㅠ
진짜 이즐언니 이쁘고 매력적인걸로는 무기징역이야♡♡",17개
22,princess,내가 본 사람중에 명품이 제일 잘 어울리시는 분 ✨✨,22개
23,혜정,역시 믿고 보는 헤이즐님 하울👍🏻💛 언니 가방 몽땅 소개로 보고 싶어요~!!!!,3개
24,hnaaaK,"언니 명품하울은 단순히 부럽다,이쁘다로 끝나는것보다 되게 각 브랜드마다 가지고있는 특징속에 매번,각각 다른게 표현되는 디테일을 쉽게 설명해주니까 더 신기하구 지루하지도않구 색감 이쁘고 재밌는잡지보는 기분..? 그냥 24분이 순삭이에용..♡",2개
25,엘주,21:23 내 킬포💙,2개
26,이하연,앞머리 내린 단발 헤어스타일로 오마이걸 비니메이크업 해주세용~💙,2개
27,쏭이SSONGE,헐.. 명품옆에서 헤이즐님이 더 명품같아요.. 진짜 고급스럽게 이쁘셔요 ㅠㅠ,17개
28,euls,말레피센트 현실판은 헤이즐이다🖤,41개
29,룩쥬류,아니 이번 썸넬보고 찐텐 한예슬인줄 들어와서 앎ㅋㅋㅋㅋ,2개
30,데린이,언니 가발쓴건가요?? 넘나 잘 어울려서 가발인지 아닌지 헷갈림.. 썸넬보고 톤다운한줄알고 바로 텨왔습니다!!💞,20개
31,,앞머리 내린거 진짜 요정 그 자체🧚‍♀️,12개
32,김혜원,남자지만 여자명품하울 보는 게 재밌는 헤이즐 누나의 명품하울😊,1개
33,김유리,"아 진짜 개이뻐,,,, 사랑해요,,,,,,",3개
34,나의너,자꾸 예뻐지고 얼굴 더 작아지기 있냐고요 오늘 완전 뱀파이어같아 넘 예뻐여 언니😭,2개
35,진진,언니가 소개해줘서 더 빛나보이는것같다🥰 헤이즐언니 효과인듯ㅎ 언니 영상 볼 수 있어서 감사해옇ㅎㅎ 꽃 길만 걸어요 언니~~🌸🌸,2개
36,소망이,언니 진짜 어뜨케여 ㅠㅠㅠ̑̈ 진짜 반해버렸어 ㅠㅠ❤️언니는 어떻게̌̈ 피부관리해요 ㅠㅠ̑̈ 그리고 너무 이뻐❤️❤️,3개
37,별미다이어리,나갈 일이 줄어서 물욕이 줄어든것도 있는것같아용 오랜만에 하울 최고☆,31개
38,로리,"앞머리 완전 찰떡 언니 너무 예뻐용
+뭐지? 분명히 하트있었었는데",12개
39,은주,언니! 인스타 라이브에서 명품하울 한다고 들었는데 역시 기대를 져버리지 않는 헤이즐 언니💜💜💜 언니! 그리고 백화점에서 쇼핑하는 영상도 보고싶어요✌✌✌,2개
40,수민,10:00 원피스 너무너무이뻐요 ㅠㅠㅠ 그냥 언니랑 찰떡;; 너무이뻐,2개
41,채령,우와왘 라방에서 말하신 그영상!,3개
42,BlueEye,언니의 하울 영상을 보면서 대리만족을 너무 많이하네요!!🥰 언니 하울영상보면 너무 나도 예쁘고 신기한 제품이 많아서 넘넘 재밌어요!❤️,2개
43,체리맛우유,언니 진짜 앞머리 내린 거 너무 이뻐요😭💙,3개
44,박수연,"역시 믿고보는 헤이즐언니의 하울! ㅎㅎㅎ
진짜 언제나 언니의 하울영상 보는 재미가 쏠쏠해요 ㅎㅎㅎ",3개
45,조은빈,진짜 명품보다 예쁘다 ㅠㅠㅠ ❤️❤️,2개
46,박상희,분량 최고ㅜ 헤이즐님 최고,2개
47,오로르,헤이즐님은 진짜 소화 못시키는 패션이 없는 것 같아요 그래서 독특한 디자인 사도 역시 소화가  가능하니까 사시는거라 납득 가능!!!,1개
48,김근영,언니 얼굴은 현실성없는데 성격은 딱 옆집언니...ㅋㅋㅋㅋㅋㅋ 너무조아 헤이즐 ㅜㅜ,13개
49,지혜,"언니 저번 영상에서 말했었는지 기억이 잘 안 나지만 또 말할래요 앞머리 너무 예뻐요 ㅠㅠㅠㅠㅠㅠ 언니는 무슨 머리를 하든 다 잘 어울리지만 앞머리있으니까 정말 미모 하,, o̴̶̷̥᷅⌓o̴̶̷᷄ 저 예쁜 옷들 사이에서도 언니 얼굴밖에 안 보여요 😭 솨랑해요 ㅜㅜㅜ",2개
50,박소윤,저두 체격이 왜소해서 어깨 퍼프 없으면 얼굴이 괜히 더 커보이고 그래서 어깨 퍼프는 옷 고를 때 필수입니당.. (헤이즐님 넘 멋져유..🥰),1개
51,arim아리미,이런게 눈의 즐거움,2개
52,이은서,"헤에엥에ㅔㅇㄱ 내 최애 컨텐츠 하울!!!!!언니 오늘도 미모 열일 ㄷㄷ 💜💜💜 명품 그 자체... 
6:43 언니 원래 얼굴 조그마나자나요ㅠㅠ",6개
53,스노우화이트,오늘도 반짝반짝 거리네요❤️❤️❤️❤️,3개
54,우라미라,헤이즐님 렌즈 정보가 궁금합니더 ㅜㅠㅜㅠ,2개
55,YingShu,Can you add Vietnamese subtitles? I really like watching your channel but I don't understand anything ..,1개
56,김진표,아 진짜 항상 명품하울영상은 헤이즐님 영상밖에 못보겠다구요.. 너무 재밌고 이쁘고 ㅋㅋ 헤이즐님만의 스타일이 너무 개성있어서 조아유🥰🥰,1개
57,호야야양,아.....언니 미쳤다....... 개이쁘다......ㅠㅠㅠㅠㅠㅠㅠㅠㅠㅠㅠㅠㅠㅠㅠ,2개
58,이채림,앜ㅋㅋㅋㅋ 겁~~ 나 광팬 할때 빵터졌습니당 말투 왤케 기여우신건지❤️,2개
59,김지현,항상 대리만족...❤,2개
60,썬,언니 영상만 기다렸어요 ㅠㅠ 쇼핑하울 너무 좋아요😆 명품 아니여두 소소한 쇼핑 하울도 올려주세요!!🧡 언니가 하는건 다 좋아요 ㅎㅎ,3개
61,박서연,선댓 후 감상해요❤️ 이런 영상이면 제가 많이 고맙지요옹~! 역시 믿고보는 헤이즐언니 영상!!😆,2개
62,안온,진짜 대리만족ㅠㅠㅠ짱좋앙ᆢ,2개
63,데미,언니 하울 너무 오랜만이자나여ㅠㅠ,4개
64,로즈리,언니 진짜 웃기구 이뻐용><,2개
65,윤서,아 진짱 헤이즐 언니 하울영상 진짜 너무 좋잖나용❤,3개
66,skSk,아니 앞머리내리니까 얼굴 소멸직전 ㅜㅜㅠㅠㅠㅠㅜㅜㅜㅜㅜ예쁘다진짜 ㅜㅜ한예슬옆에잇어도 비교안되는 미모ㅠ,1개
67,이시은,진짜 이뻐요ㅠㅠ ❤️❤️돈이 없지만 다사고 싶다...😭❣️오늘도 너무 이쁜 영상 감사해요 ㅠ😘,1개
68,장온주,아앙 언니 진짜 사랑해요♥♥,2개
69,말하는껌,"하울 영상 너무 죠하ㅜ❤️❤️❤️
침대에 누워 포근한 이불덮고 아무 계획없이 
언니 영상 보는데 이렇게 행뵥할수가☺️🥰",3개
70,채은,"진짜 오랜만이다 >< 하울 너무 조하요오👍🏻❤
오늘도 헤이즐님 목소리 꿀떨어진ㄷr.....🤭😍",2개
71,담소05,오늘 진짜 젊어..🙆🏻,3개
72,김세영,하나같이 다 찰떡이다 ..진짜 자신에게 잘 어울리는 느낌을 아는 언니네요 👍❤️ 너무 예쁘다,1개
73,최수인,캬아 다다 너무 이뻐욤 언니한테 엄나 잘어울리거같유다욤 히히 셀린가방 이뻐욤 ㅠ이쀼당,1개
74,혜닝,믿.보 헤이즈하울~~ 재밌게 잘 보겠습니당😆,2개
75,최해든YouTube,언니!! 진짜 흑발 너무너무 잘어울리고 너무 예뻐요! 말레피센트 같아요!  오늘 외모 너무 레전드!(물론 원래도 레전드!),2개
76,김선주,돈진짜많은가부다 ㅋㅋ부럽다,1개
77,예원투쓰리포뮤직,아니 언니.. 앞머리 왜이렇게 잘 어울려요?!❤️ 진짜 존예여신이예요ㅠㅠ🥰,2개
78,김비글,"맞아요.!! 요즘 물욕이 없어졌어요ㅜㅠㅠ 그래도 언니 하울 영상이 제일 깔끔하고 너무 좋고 스타일도 너무 존예에요ㅜㅠ
언니 옛날 하울영상들 보고 있었는데...저도 언니 스타일링 보면서 디즈니콜라보 제품 구매했었어요.!",8개
79,서여이,21:23 앜ㅋㅋㅋㅋㅋㅋㅋ모자설명찰떡이에요ㅋㅋㅋㅋㅋ이언니 넘유쾌해~!~!,3개
80,옌이,언니는 어쩜 앞머리 있어도 존예 없어도 존예ㅠㅠ💖💖💖,3개
81,황수아,앞머리 진짜 예뻐요ㅠㅠㅠ 제품들 보고 대리만족도 하고 착장샷이나 주변에 있는거 보면 진짜 완전 언니랑 찰떡ㅠㅠㅠㅠㅠ  언니 하울에서 언니목소리톤으로 하나하나 설명들으면서 영상보는거 너무 힐링❣❣,1개
82,박수지,언니 앞 영상들과 피드에서 보았던거를 내 기억에서 하나둘 끄집어내서 보는 재미가 이써요!!! 맙쏘사🤦🏻‍♀️💗💗💗💗 귀여운 우리언니🦋,1개
83,키득키득,언니랑 구찌랑 진짜 찰떡이에요ㅜㅜㅜ,2개
84,민채,언니 머리 진짜 미쳤어요 💖,2개
85,uson,앞머리 짤라도 진짜 이뻐요!! 인형이네요~~,2개
86,Clara,"언니 진짜로 넘넘 사랑해유♡
언니 영상 너무 좋아여~~~랍유♡",2개
87,시연늬,헐 ㅜㅜㅜㅜ넘모 예뻐요ㅜㅜ역시 믿고 보는 헤이즐!!,2개
88,김엘리,"언니 영상은 힐링입니당>,< 하울도 너무 오랜만이라 더더욱 반갑네용 헤헿",2개
89,소딩,언니앞머리 미쳤고 명품들 미쳤고 그중심에  있는 살아있는 명품도 미쳤어ㅠ 오늘도 믿고봅니당  사랑하눈 헤이즐 언닝ㅠ,2개
90,지영,반짝반짝✨ 할때 언니 표정 왤케 귀여운건가여😭😭 영상 올려주셔서 감사합니다 ㅠㅠㅠ언니 정말 사랑이에융🌹❤️,1개
91,다지호,언니 자체가 명품이잖아요ㅠㅠ♥️,2개
92,,명품이 명품을 소개하다뇨..!!!,1개
93,김유림,앞머리 있는 헤이즐언니 진짜 너무 이쁘고 어려보여용😚😚,2개
94,Cherny체르니,자신의 스타일을 알고 맞는 아이템을 사는게 너무 멋져요💖💖언니의 소비를 응원합니다아,1개
95,이태경,와...엄청 기다렸는뎅!! 드디어 올리왔네용💕,2개
96,김무쌍mussang,언니덕분에ㅡ대리만족해써용,2개
97,안채원,언닝 앞머리내리고 깔끔한 포니테일도 보고싶어요ㅠㅠ,2개
98,김신디,아니 반팔에 앞모리 너무 귀여운거 아입니꺼ㅠ,2개
99,뿌잉잉,와 머리색 어두우니까 예쁜 이목구비가 확 사는구나.. 진짜 졸라이뻐요 온니 ❤️❤️,1개
100,김나영,헤이즐 언니 하울 진짜 최고예요ㅠㅠㅠ 언니 다음에는 가방말고 명품 지갑 하울도 해쥬세용 언니 지갑도 궁굼해요,1개
101,,와 텍때는거 나만하는줗알았는데ㅠㅠ 언니랑 공통점ㅇ찾았어용😳😳,1개
102,SeaWoo,언니 앞머리 평생 박제 해줘요.. 우리집 벽지로 해놀께..🙈❤️,3개
103,까꿍,루이비통 찰떡이에요 진짜 예쁘다 ㅎㄷ ㄷ,8개
104,김민영,언니는 그냥 영상으로만봐도 얼굴이 진~~짜 작은데 앞머리가 생기니까🌟  얼굴이 훨씬더 작아보여용💝💝 진짜 나는 헤이즐넛이얌ㅠ👸,1개
105,민트,역시 헤이즐님이 가지고 계신 옷들은 다 예뻐ㅠㅠ 오늘도 영상 잘 봤어요!,1개
106,monvely몬블리,언니 머리색 안정적으로 돌아왔군요😀,2개
107,제시하다Jessiehada,핫 한 아이템 한 가득🛍,2개
108,JiHan지한,꺅 오랜만의~ 근데 뭔가 볼살이 되게 홀쭉해지신것같아요 ㅠㅠ 여전히 이뿌시지만은💕건강 꼭 챙기셔용ㅎ,1개
109,임가람솔,헉! 저도 명품 가지고 싶네요...ㅠㅠ언니 너무 예뻐요!💖,1개
110,김다빈,옹오!!! 언니 오늘도 여신이야!!!!!!💓 13:38바지 노출!!!!!ㅎㅎㅎ 쇼핑 영상 너무 잘 봤에요!!!! 사랑해용 😻,1개
111,Its태희,믿고보는 울 언니 ...❤️❤️,2개
112,Jinny지니,와.. 저 자켓 행사 때 입은거 꼭 보고싶어요!!!!,2개
113,아탑,흑발이나 블랙/애쉬그레이계열로 염색하시고 앞머리에 중단발 레이어드컷 하면 진짜 잘 어울리실것같아요ㅠㅠㅠㅠㅠㅠㅠㅠ 앞머리 진짜 잘어울리세요 헤이즐님!!,1개
114,박주아,언니 이번영상 왜캐 귀여워유 ㅠㅠㅠ 😍😍  앞머리너무 잘 어울리구요 ㅠㅠ 전저 미키마우스 니트 너무 예쁜거같아요 하아 언니랑 너무 잘어울려요 💖💖💖,1개
115,하양하양,아아아아아ㅏㅇ아ㅏ 언니 너무이뻐요 사랑해여ㅠㅠㅠㅠㅠㅠ💖💖💖,1개
116,로즈말이Rose,언니 진짜 앞머리 졸귀에용ㅎㅎㅎㅎ,2개
117,이옌,언니 드레스룸 투어 해주세요!!,3개
118,슐리Sully,"딱 화려한 명품은 헤이즐언니꺼 같아요ㅋㅋㅋ
 🙋‍♀️그리구 언니 또 수다떠는 영상 올려주세용 꿀잼이에요🤠🤠",1개
119,와이엔,"언니ㅠㅠㅠㅠ 제가 그동안 가끔 추천뜨면 보고 지나갔는데 최근에 큐앤에이 영상이랑 더보기에 써놓으신 다른 영상들보고 아 이 언니는 구독안하면 손해다!!!! 하고 구독하고 영상들 정주행중인데ㅠㅠㅠㅠ 뭔가 언니 영상을보면 그때만큼은 자존감, 자신감이 만땅으로 채워지는 기분이 들더라고요!!! 오늘 영상도 잘볼게요!!!💜💜💜",1개
120,나야나,앞머리 내린거 아무리봐도 인형이 틀림없다...언니 사랑해 나 24살이야..,1개
121,전효린,우리 언니는 명품이 제일 잘 어울려요!! 진짜 믿고 보는 헤이즐 명품하울👍🏻❤️❤️,1개
122,불낙지,언니 앞머리 너무 잘어울려요 ㅠㅠㅠ❤️,1개
123,밍듀,앞머리 내린거 너무 이뻐서 들어온 사람🙋🏻‍♀️,1개
124,v현지,다 너무 헤이즐스러운 템들💜,2개
125,쀽뺙뺙,헐 앞머리...오랜만에 왔는데 우리언니 새삼 너무 이쁘다....,2개
126,k,하울영상이다!!!! 기다렸어요!!!ㅠㅠ,2개
127,러비,꺄❤️,2개
128,처돌이,언니 앞머리 보면볼수록 너무 잘어울리고 이쁜것같아요ㅠㅠ💕💕✨언니 픽 그냥 🤐하고 믿고봅니다 홀린듯이 들어오는듯...,1개
129,푱푱,엇 인트로 바꾸셨네요!! 완전 아티스트적이에요ㅠㅠ예뻐요ㅠㅠㅠ앞머리도 예쁘구뇨ㅠㅠㅠ엉어엉엉ㅇㅇ엉예뻐요ㅠㅠㅠ💗💗💗💗,2개
130,공재경,앞머리 너무 좋아요ㅠㅠㅠㅠㅠㅠ,1개
131,사포뇨,다 너무 이뻐요 ㅠㅠㅠ 보는 재미가 있는 영상이었습니다 ㅠㅠㅠ,2개
132,삼두,언니 진짜 너무 이뻐요ㅠㅠㅠㅠㅠㅠㅠㅠ,1개
133,이은채,ㅠㅠ 이쁘당,1개
134,늄늄,7:11 이부분 목소리 태연닮았어요 !! ㅋㅋㅋㅋ 암생각없이 듣다가 순간 놀랬어요,2개
135,0Z00,아 진짜 구찌 홀스빗......최애....언젠간 사겠어욧!!😤,1개
136,빠쭝뽀쭝,언니입고있는 루이비통 반팔 존예다❤️🍌,7개
137,olivialee,언니 썸네일 오마이걸 비니인줄 미쳤따따따따 따따따 따따따,3개
138,응쭈,와우♥ 이쁜 템들 가득이네요^^ 언니한테 잘어울리는 템인거갘아요^^* 이쁘게 잘입고 다니는 모습도 보고싶어요♥♥,2개
139,,헐 왜 알림이 안 뜬거죠ㅠㅠㅠㅠ 저 너무 슬퍼요ㅠㅠ 지금이라도 봅니다!!,1개
140,은서박,울언니 ㅠㅠ 앞머리 내린것까지도 잘어울리고 그러면 어떡해요ㅠㅠ 언니는 사랑입니당❤❤😉,1개
141,해인,헤이즐님 머리 너무 너무 찰떡이예요💘.             진짜 루이비통 옷들 헤이즐 아니면 누가 입어용..? 어쩜 그렇게 잘 어울리는 옷들만 사는거 같아요. 역시 안 사더라도 어울리나 안어울리나 옷을 입어보고 사야겠네요 !!,1개
142,CatherineHuh,앞머리 내렸을때 느낌이 하이틴st.....언니는 몰 하든 역시 존예에요ㅠㅠ,1개
143,요로라,",언니 하울영상 진짜 오랜만이에요ㅠㅠㅠㅠㅠ보고싶었어요🤍🤍",1개
144,LL,언니의 하울 영상은 항상 믿고 보지용👍,2개
145,이다빈,"와,,, 언니 외모 미쳐따,,, 진짜 왤케 예뻐요??? 
진짜 믿고보는 헤이즐!!
언니 진짜 사랑해여💗💗",1개
146,은조하이콩,진짜 언니 너무 보고싶었어요 ㅜ퓨,3개
147,전미경,"너무 이뻐요ㅠㅠㅠ
헤이즐 하울! 기다렸어욤ㅠ",1개
148,이희아,언니 진짜 이뻐욤,1개
149,윤재현,언니 너무 예뻐요 실제로 만나보고싶어ㅠㅠ,1개
150,신이유,"오늘 썸네일 보구 한예슬인쥴..💙
깜놀해쏘요 영상보니 더 똑디!!",7개
151,Seonmin,믿고보는헤이즐하울 . 언니 영상 보고 구찌 넘 취향저격 당해버려서 열심히 살려구요.... 꼭 성공해서 사고말테야ㅠㅠㅠ,2개
152,헤이즐사랑해헤이즐넛,언니ㅠㅠ 나 햇반 이예요 계옮 해써용,2개
153,로즈자스민티,앞머리 있는거 너무 예뻐여 ㅠㅠㅠㅠㅠ,1개
154,이미연,뭔들 헤이즐 언니 멋져요 😍 패션하울 bb,2개
155,김현정,앞머리 내린거 너무 찰떡아닙니까ㅠㅠㅠㅠ 언니 짱예뻐요ㅠㅠㅠ,1개
156,민서minseo,믿고보는 헤이즐 쇼핑하울..🤍,2개
157,와우와,언니 계속 말하다보니깐 다시 물욕생기는 것처럼 보여욬ㅋㅋㅋㅋㅋ,1개
158,써나,언닝ㅜㅜ너무 앞머리 귀여워융😘😘,0개
159,호다다다다다,악 명품하울 보고싶었어요!!!,2개
