,youtube_id,comment,like_num
144,한입만죠라,"ㅠㅠ 오늘도 영상잘보고 갑니당...미장센이랑에뛰드 많이 썼는데...😰저는 그래서 미용실가서 염색하기는하거든요 사서 하면 워낙 두피도 안좋아서ㅠㅠ
+ 두피 열도 많고 분명 찬바람으로 잘말리는데도 습해지다보니 비듬도 좀있구 여드름도 나더라구요ㅠ 😥 혹시 탈모샴푸관련도 가능하실까요...? 20대여자이지만 갑자기 탈모가 심해졌어요ㅠㅠㅠ 화해를 찾아보고는 했지만 맞는걸 찾기 어렵네용😭",1개
145,러브린,홈쇼핑 제품으로 부탁드립니다 거기가 싸고 해서요,0개
146,짱구,디렉터파이님 턱쪽에 모낭염이 자꾸 있는데 진정케어 제품을 쓰는게 맞나요??,0개
147,쑤민,카렌듈라 필오프팩 같은 바르는 팩도 해주세요!!,0개
148,이정은,저 수능끝나고 동네 미용실에서 염색하고 두피가 다 뒤집어져서 너무 충격적이었어요ㅠㅠ 주변사람들이 다 염색해도 멀쩡하길래 저도 그럴줄알았는데 두피에 진물나고 해서 진짜 충격...,0개
149,검은콩,"염색약 직접 바르는것까지 꼼꼼히 해주시다니👍  
테스트 진짜 중요해요~~  어머니들이 염색후 직접 머리 감는 그런 염색방에서 천연유례 제품이라고해서 그냥  테스트없이 했다가 알레르기 일어나서 고통스러웠던적이 있어요. 머리 감을때 마다 제 몸에 영향을 미쳐서 눈.목 피부 다 붓더라구요",0개
150,옥돌쵬,마침 셀프염색 도전해보려고 했는데... 디파님은 항상 제가 필요하다...할때쯤 컨텐츠를 분석해주셔서♡ 정말 감사합니다!! 그리고 보내주신 손 소독제 정말 잘 사용하고 있습니다! 한동안 정말 패닉상태였는데 덕분에 정신차리고 생활하는 중이에요~ 항상 감사합니다,0개
151,립립스틱,👍,0개
152,이다영,요즘 마스크쓰면서 파데프리하게되었는데용! 백탁살짝있는선크림이나 톤업크림 추천해주세용!,3개
153,빈,제 눈에만 파란색 머리로 보이나요?? 갈색으로 하셨다는데 왜케 파란빛이 보이는거죠?,0개
154,OgigoB,"왜 점점 어려지시는 거죠? 😍진짜 지금 헤어스타일 너무 잘 어울려요. 너무 유익한 영상 항상 잘 보고 있는데 정말 너무 많은 화장품 존재하구나 생각도 들어요. 이건 지구에는 도움이 안되겠죠.. 그래도 환경에 좋은.. 샴푸같은, 좀 모순적이지만 그래도 최대한 환경에 좋은 화장품도 추천해주세요 :) 혹은 비건, 동물실험 등 안하는 화장품도 추천해주세요.",0개
155,JuHyeonKim,인셀덤 화장품 성분 알고 싶어요,0개
156,피그말리온,"새치땜에 항상 염색을  해야되는데 ppd성분땜에 염색 하기 전 알러지약먹고ㅠ염색해왓는데요 
 언젠가부턴 알러지약먹고도 미용실염색약.헤나 .등 엄청난 부작용으로 고생을 했는데 우연히 알게 된
Ts착한염색약은 알러지가 안나더라구요",2개
157,ISeoon공부하는이서온,"영상 항상 너무 잘 보고 있습니다!
혹시 '주방세제'도 다뤄보실 수 있을까요?
1년에 잔류 세제 2컵을 먹는다는데, 아직까진 성분을 분석해서 추천해주시는 분이 없네요 디렉터 파이님이 분석해주시면 믿고 구매(똑똑하게 소비)할 수 있을 것 같아요",2개
158,커피,컨실러도 해주세요 3년전에하고 한번도 안해주셨어요ㅠㅠ,3개
159,윤현수,"진짜 감사해요  염색약  필요  했는데
엄마 아빠 새치 염색약  감사해요 
마스카라도좀  부탁드려요",4개
