닉네임,댓글,좋아요수,날짜
areumsongee아름송이,"매그넘 루비는 CU, GS25, 마켓컬리에서 구매 할 수 있어요!!
렌즈는 렌시스 신디 그레이에요👀✨
-
❤️챌린지 참여하고 선물받아가요 송충이들❤️",23개,2020. 5. 29.
XIANC,I honestly can't understand how someone can be this pretty I--,6개,2020. 5. 29.
Twaddlex,*당신은 너무 귀엽고 아름답습니다*🤍🤍,9개,2020. 5. 29.
risam,いつもメイク動画楽しく見させてもらっていて、ほんとにソンイちゃんはいつ見ても綺麗で同じ女性として憧れです！♡,19개,2020. 5. 29.
tasiyuso,ソンイちゃんのメイクとか参考にさせていただいてます！ほんと可愛くて大好きです！日本から応援させて頂いてます！사랑해요~♥,9개,2020. 5. 29.
TWICEonce,めっちゃ痩せたましたね！！！すごい！笑笑ウチも頑張ろwダイエット,8개,2020. 5. 29.
조혜수,아이스크림인데 색이 개예쁘다,19개,2020. 5. 29.
,か、かわいすぎる,2개,2020. 5. 29.
,きゃわいい！！！！！,5개,2020. 5. 29.
,"はぁ〜本当に可愛い⸜❤︎⸝‍
メイク相変わらずお上手です🧚🏼‍♀️",2개,2020. 5. 29.
nayeon,언니 옷 정보 좀 알려주시술 있나용 ㅜㅜ???,9개,2020. 5. 29.
tomoF,ほんとにほんっとに美しい,3개,2020. 5. 29.
riko리코,"日本から見てます！！
일본에서보고 있습니다!  아주 좋아합니다!
 당신처럼되고 싶어요!",13개,2020. 5. 29.
taichinakamura,ほんと可愛い♥️,6개,2020. 5. 29.
waa,"こんにちは！
안녕하세요!  나는 일본에 살고 있습니다!
아루무손이 씨의 동영상을 언제나 볼 수 있습니다!
아루무손이 씨의 동영상을보고 나서 정말 한국에 매혹을 느끼고 있습니다💗😉

앞으로도 사랑 해요💗😍",3개,2020. 5. 29.
KimiWu,There’s finally English subtitles!!!,1개,2020. 5. 29.
,"日本のパルムみたい!!
可愛い〜( ˊᵕˋ )",2개,2020. 5. 29.
이쿠미,언니가 하시는 메이크업 영상을 보면서 항상 저도 메이크업을 하고 있어요🥰오늘도 메이크업 잘하시고 이뻐요~~💓,0개,2020. 5. 29.
,リップかわいい！！,1개,2020. 5. 29.
한별,편집 방법 예전처럼 해주세요 ㅠㅠㅠㅠ,3개,2020. 5. 29.
이민영,"언니 진짜 대조녜,,,, ♥️♥️",1개,2020. 5. 29.
qkdrkqkdrk,인형같아여ㅠㅠ 피부화장만 했을때도 이뻐서 깜놀;;,1개,2020. 5. 29.
최라영,언니 너무 귀여워서합니다! 학생 메이크업거나 요청할 수 있습니까?,1개,2020. 5. 29.
SarahBuckley,너무 예뻐요 🌸🌸,3개,2020. 5. 29.
,服とても可愛いですね！,1개,2020. 5. 29.
rungruung,언니 리프팅 관련 영상도 찍어주시면안될까여ㅠㅠㅠㅠㅠㅠㅠㅜㅜ,1개,2020. 5. 29.
km,メイクブラシ全部、見たい！메이크업 브러쉬 다 보고 싶다！🙏🏻❤️,0개,2020. 5. 29.
빛한,언니 너무 예뻐요ㅠㅠㅠㅠ 오늘 진짜..... 💗💗💗💗💗💗💗,1개,2020. 5. 29.
강민희,"귀여워( ´,,•ω•,,`)♡",1개,2020. 5. 29.
박지수,언니야ㅠㅠㅠ오늘두 넘 이뻐워ㅠㅠㅠ🙈🍒,2개,2020. 5. 29.
뇽뇽,앞머리없는게 더더이뻐욭 ><,3개,2020. 5. 29.
미래,前髪が前よりも重くなってるのかな？凄く可愛い❤,0개,2020. 5. 29.
이민경,옷정보몬가유ㅜㅜ 이뻐여ㅜㅜ,0개,2020. 5. 29.
,めっちゃ良い人そう…！,0개,2020. 5. 29.
Silver하,오늘 영상 진짜 짱 예뻐요 역시 미모에 다 했어 💕😊 매그넘 챌린지 하러 가야겠어요 😁,2개,2020. 5. 29.
0,前回のソンイちゃんの動画見て私も昨日黒髪にしました！ソンイちゃんみたいに可愛くはなれないけど気に入ってます！そして今回のメイクもすごくかわいい💞,0개,2020. 5. 29.
김정민,진짜 매일매일 언니한테 맞는 찰떡메이크업 하는게 정말 잘어울려용.. 언니 진짜 넘 이뻐용,0개,2020. 5. 29.
두리아리,너무 이뻐요....♥ 공주야 공주 ㅠ,5개,2020. 5. 29.
hydrangea수국,누드 컬러가 어울립니다.  입술이 깨끗합니다.🤍🤍,1개,2020. 5. 29.
Ariel,"아이스크림 맛은 어때요? 사실 낮에 저 아이스크림 광고 봤는데 댓글들이 립스틱 맛 날거같대서,, 젤 궁금",1개,2020. 5. 29.
,前髪かわいい~‪︎‬︎‪( Ꙭ)‼︎,0개,2020. 5. 29.
Anna,This hair color looks great on you.  Very pretty ❤️,0개,2020. 5. 29.
StephanieRicco,loved this💜💜💜,1개,2020. 5. 29.
이지현,언니 앞머리 자르는거 찍어주세요ㅠㅠ,1개,2020. 5. 29.
LaishaSoman,Love From India ❤️❤️❤️,1개,2020. 5. 29.
이채현,넘 예쁘고 다 좋은데 마이크? 소리가 약간 답답해요.. 울린다고 해야할까 쫌 통화하는거 같아요..,0개,2020. 5. 29.
낼룽김,언니 흑발하고 완전 리즈..,0개,2020. 5. 29.
megu,日本のコスメ使ってくれて嬉しいです！最近わたしも暗めのヘアカラー にしたので、参考にさせて頂きます🥰可愛い〜💕,0개,2020. 5. 29.
김나타샤,언니 너무 예뻐요♥♥♥ - from Malaysia 🇲🇾💕,0개,2020. 5. 29.
,韓国は何でもオシャレで可愛いなぁ…,0개,2020. 5. 29.
girlieroxas,Watching from Philippines ❤️ lovin your vedeos 😘😘😘😘,0개,2020. 5. 29.
칸초만세,원피스정보좀..주세요ㅜㅜ,0개,2020. 5. 29.
,"かわいい♡♡ᵕ̈
日本語訳いつもありがとうございます！！",0개,2020. 5. 29.
,"역시 매우 귀엽다💓
일본에서 지원!번역기 사용.문화 이상하지",0개,2020. 5. 29.
,アフレコだ！！！,0개,2020. 5. 29.
밍짱,내일 바로 찍는걸로,1개,2020. 5. 29.
민서minseo,오늘 완죤 핑크굥쥬..🤍💖,0개,2020. 5. 29.
,언니 사랑해요~~~🤍🤍🤍,0개,2020. 5. 29.
전영숙,저도그런색을좋아해요 약간핑크빛도는색이 산뜻해보이네요더 마니 보여주길바라며화이팅입니다,0개,2020. 5. 29.
SkLo,립은 뭐바르신거에요~?!!!!!!,1개,2020. 5. 29.
뚜야,언니이뻐용!,0개,2020. 5. 29.
SonSummer,우앙❤️❤️저도 참여할게요,0개,2020. 5. 29.
김지현,대박 넘예...,0개,2020. 5. 29.
Ariel,오늘 영상도 핑쿠핑쿠 자막란도 공주같고 예뿌네용😘,0개,2020. 5. 29.
CelynBautista,Stunning😍,0개,2020. 5. 29.
혜린,예뽀라💘,0개,2020. 5. 29.
,언니..이고 나도 할수있어요...?????나 지금 일본인데......어떡하지......나도 언니랑 하고싶엉...ㅠㅠㅠㅠㅠㅠ,0개,2020. 5. 29.
AhhyunJung,언니 입고계신 옷 정보좀 주세용~,0개,2020. 5. 29.
AA,언니 리프팅관리영상도 찍어주세용,0개,2020. 5. 29.
모모링,매그넘 아이스크림 어디서파나욤?지에스에있나욤?,0개,2020. 5. 29.
DanielynTiquia,omaygashhhhhjdiwjwnswna you need to be a cast on the true beauty ur soo perfecttt ;c,0개,2020. 5. 29.
Manar,Hello from germany:) great video!!,1개,2020. 5. 29.
너양,피부화장 뭐 한거에요? 어떤제품 사용하셨는지 알고싶어요,0개,2020. 5. 29.
NadezhdaKim,Don't give up!! Fighting!,0개,2020. 5. 29.
MeidahMarsella,I want to participate.. but I don't understand the hashtag. 😢 I don't speak korean,0개,2020. 5. 29.
공주,언니 메르시비앙 원피스랑 신은 신발 정보좀요 이름이 너무궁그매요 원피스랑 같이사서 신고싶어요 저도ㅠ 제발 알려줘요🙏 디엠도 누락되는거같아요 자꾸 그래서 유튜브 댓글로 남겨용,0개,2020. 5. 29.
tomoF,IloveU,1개,2020. 5. 29.
Miko,Enak pasti,1개,2020. 5. 29.
,귀여워요💕💕💕,3개,2020. 5. 29.
,ほんとに可愛い、、使ってるコスメ全部欲しくなる🥺🥺,1개,2020. 5. 29.
초코비,아이스크림 광고받았나보네ㅋㅋ,0개,2020. 5. 29.
areumsongee아름송이,생각보다 저 어두운거 괜창ㅎ은거같아요...🤔🤔완전 흑발가나요...,303개,2020. 5. 24.
XIANC,She could honestly pull off any hair color I--,29개,2020. 5. 24.
leelee,흑발하니까 막 더 도도&우아&분위기폭발...샤넬원브랜드때 흑발이였으면 더더더더 골쟈스했을고같아요!!!진짜 흑발 넘이뻐요,214개,2020. 5. 24.
나이름없다,자기합리화가아니고 원래염색할때머리안감고가야두피손상없는게맞음,174개,2020. 5. 24.
Louisa,I love your relationship with your boyfriend you two are so cute💞💞,12개,2020. 5. 24.
김연우,"11:46초부터 너무 웃겨욬ㅋㅋㅋㅋㅋㅋㅋㅋㅋㅋㅋㅋㅋㅋㅋㅋㅋ 올리브영, 소개 받게? ㅋㅋㅋㅋㅋㅋㅋㅋㅋㅋㅋㅋㅋ 너무 웃기네욬ㅋㅋ 아름송이님 흑발도 너무 잘 어울리세요! 👍👍👍",65개,2020. 5. 24.
어린올리브,흑발하니까 훨씬 얼굴 하얘보이구 잘 어울려용!,87개,2020. 5. 24.
ChloeJang,11:57 ㅋㅋㅋㅋㅋㅋㅋㅋㅋㅋㅋㅋㅋㅋㅋㅋ아웃겨,63개,2020. 5. 24.
Louisa,The hair looks so good on you!!💓,4개,2020. 5. 24.
,暗髪新鮮で素敵ですよ⸜❤︎⸝‍,8개,2020. 5. 24.
,最近最初から日本語訳ついてて嬉しいです😭😭😭今日も可愛い！！❤❤❤,28개,2020. 5. 24.
서녕seonyeong,11:23 흑발에 앞머리 없고 긴생머리 진짜이쁘다,31개,2020. 5. 24.
,"シェーディングしてるときの横顔がすごい綺麗だった、、、、🥺💕
너무이뻤어요🥰",10개,2020. 5. 24.
나혜빈,11:59 개웃겨 뒤지겠슴요 ㅋㅋㄲㅋㄱㅋㄱㅋㄱㅋㄱㅋ아 ㅋㄱㅋㄱㅋㄱㅋㄲㅋㄱㅋㅋㄲㅋ,32개,2020. 5. 24.
졍이,11:49 아낰ㅋㅋㅋㅋㅋㅋㅋㅋㅋ 올리브영 ㅋㅋㅋㅋㅋㅋㅋㅋㅋㅋㅋ,20개,2020. 5. 24.
아징,"진짜 개이쁜데 흑발,,,,, 언니 파스텔룩 소개영상
글구 레드립 메이컵 존버할게염 ><",51개,2020. 5. 24.
뇽뇽,"ㅋㅋㅋㅋㅋㅋㅋ ㅋㅋㅋㅋㅋㅋ 너 소개 받게? ㅋㅋㅋㅋㅋㅋ 오늘도 재밌어요 ㅋㅋㅋ그리구 밝은 머리도 예뻤는데 어두운것도 찰떡,,,!",6개,2020. 5. 24.
김사랑,솔직히 송이언니 겟레디가 젤 보기 편함 인정?,4개,2020. 5. 24.
김초희,11:43 대존예 .. 흑발 박제하세유 ㅠㅠㅠㅠㅠ,25개,2020. 5. 24.
최어진,흑발이 더 고급지고 세련되고 이뻐보여용🤍,60개,2020. 5. 24.
KARIN,ほんとに美人😳💗,4개,2020. 5. 24.
딩듀,"댓글먼저달고 감상해야지 언뉘 사랑해요❤️
언니 너무예뻐요 공주에요 공주ㅜㅜ",6개,2020. 5. 24.
민서minseo,갠적으루 언니 갈발보다 흑발했을때 이목구비 더 뚜렸하구 진심 분위기 갑 개조녜에요...🤍,26개,2020. 5. 24.
냥이냥,이제 흑발도 했으니 흑발에 풀뱅갑시다!!,16개,2020. 5. 24.
무밍,"머리 너무 이뻐용 혹시 무슨 색으로 하셨나용??
다크 브라운 인가용??",41개,2020. 5. 24.
ha,黒髪ぱっつんだと…！見たすぎる！！！,5개,2020. 5. 24.
kjmSUHO,ほんっとにかわいい😭😭😭,3개,2020. 5. 24.
TheresaDianne,"""I will pay 'cuz your hair looks pretty"" damn! I want all that she has🥺",0개,2020. 5. 24.
,"暗い色めちゃくちゃ似合ってる！！
好きーーーー！！",13개,2020. 5. 24.
Ariel,6:50 에 노래가 갑자기 마법이 벌어질거같은? 그런 bgmㅋㅋㅋㅋㅋㅋㅋㅋ,16개,2020. 5. 24.
hau,久しぶり〜🥰🥰🥰🥰動画楽しみにしてたよ！,8개,2020. 5. 24.
미래,アルムソンイちゃんの黒髪ぱっつんも見てみたい!!💖,6개,2020. 5. 24.
낼룽김,음..? 편집이 왜케 어색한거같지 노래 왜 바뀌죠??,5개,2020. 5. 24.
leelee,11:52ㅋㅋㅋㅋㅋㅋㅋㅋㅋㅋㅋㅋㅋㅋㅋㅋㅋㅋㅋㅋㅋㅋㅋㅋㅋ올리브영ㅋㅋㅋㅋㅋㅋㅋㅋㅋㅋㅋㅋ진짜 은근히 개그캐임ㅋㅋㅋㅋㅋㅋ,21개,2020. 5. 24.
AgnieszkaLino,This colour suits you so well ~ ♥,1개,2020. 5. 24.
최예원,10:28 제일좋아하는부분,7개,2020. 5. 24.
Ariel,10:15쯤 되게 꼬북이같고 형권님 이마 챱ㅋㅋㅋㅋㅋㅋㅋㅋㅋㅋㅋ 언니 진짜 귀여워요,7개,2020. 5. 24.
IamNUABO,かかかかかわいいい、、、、,15개,2020. 5. 24.
,언니 흑발 개이뻐여ㅕㅠㅠ레전드,5개,2020. 5. 24.
현지,아 너무 좋아  아 진짜 언니ㅠㅠㅠ 제발 ㅠㅠㅠㅠㅠ언니 다 해 언니 사랑해 언니 ㅠㅠㅠㅠ 언니 ㅠㅠㅠ나 잠깐 울고 올게요 ㅠㅠㅠㅠ젤 사랑해요 젤 이뻐 우리언니가 제일 이뻐요 여러분~~,3개,2020. 5. 24.
0,髪色暗いのかわいい！決めた！私も次は暗い髪色にしよっと！,6개,2020. 5. 24.
Yukina,"すごく似合ってます❤️❤️
かわいいです😆😆😆",2개,2020. 5. 24.
,"え、めっちゃ可愛い(♥Ü♥)
黒の方がいい☺️☺️",8개,2020. 5. 24.
RaylaSantos,"Legenda em português🇧🇷🇧🇷🇧🇷, POR FAVOR 😦💌💗..
Portuguese subtitles PLEASE ,,,,,",0개,2020. 5. 24.
,暗いのもとっても似合ってる！！！！可愛い~！！！🥰🥰💖💖💖💖💖,1개,2020. 5. 24.
,超可愛い〜🥺💓💓,1개,2020. 5. 24.
momumi,本当にいつも可愛い♡,1개,2020. 5. 24.
별별이,올리브영ㅋㅋㅋㅋㅋ,3개,2020. 5. 24.
주율이,송이언니 원래도 예뿐데 흑발하니까 얼굴이 더 환해보이네여😍😍 게다가 겟레디라니~~~ 넘조아요 화장할때 봐야징 ㅎ. ㅎ,1개,2020. 5. 24.
vinegar,最後怖すぎィ！,2개,2020. 5. 24.
가을티비,"대체왜 이제야 톤다운 하신겅가유!!!!!!!
대존예 진짜 ㅠㅠㅠㅠㅠㅠㅠㅠㅠㅠㅠㅠㅠㅠㅠㅠ🖤",1개,2020. 5. 24.
DonnaHochstetler,Your hair is pretty and you two are adorable! 💓,0개,2020. 5. 24.
최애초밥,6:36 이분 화장하는거 첨봤는데 뷰러하는거 보고 깜놀 ..,0개,2020. 5. 24.
chanys,いつも楽しみにしてます^ ^日本語字幕ありがとう❣️参考にしてます,1개,2020. 5. 24.
,髪乾かすときの顔面ガード？笑すごい初めて見た😂黒髪も可愛いね！よく似合ってます❤️,0개,2020. 5. 24.
hirsj,めっちゃかわいい！！！🥺💗,0개,2020. 5. 24.
세하,아름송이 언니 백날 백년 흑발만 해주시면 좋겠다 !!,1개,2020. 5. 24.
흥이깨졌으니책임져,아름송이님 겟레디윗미 너무 좋아요ㅠㅜㅜ미용실 가시는ㄱ 영상두ㅜㅜ,1개,2020. 5. 24.
LifeisEgg,존예....언닌 흑발이다 아니다 금발 아니아니 그 핑크머리..... :@.....아녀 다 해 우리언니 다 해요 다 옙쁘고 귀엽고 사랑스럽고 귀티 철철 매력쟁이 해요,1개,2020. 5. 24.
리스앨,이뻐요ㅜㅠㅠㅠ언니 흑발처돌이 됐어요💞💞,1개,2020. 5. 24.
,"かわいすぎ😢❤️
なんか愛らしいところが、ファンジョンウムちゃんに似てるなって思った！",0개,2020. 5. 24.
19o9Kkha,きゃー！可愛すぎる…可愛いの塊しかなくて🥺❤,0개,2020. 5. 24.
,"可愛いです！！
似合ってます！😍",0개,2020. 5. 24.
행보카쟈,미친 언니 존나예뻐 사랑해,2개,2020. 5. 24.
kamo,アルムソンイちゃん暗い色似合ってます〜💖前髪も楽しみにしてますね！,0개,2020. 5. 24.
,"明るいときも可愛かったけど
黒髪も可愛い！✨",0개,2020. 5. 24.
,黒髪似合う！！！🖤,0개,2020. 5. 24.
라이온퀸,너 소개받궤 뀅엑ㄱ?? 너무 귀여우시다 ㅋㅋㅋㅋ😊😊,0개,2020. 5. 24.
별박,원래도 예쁘긴한데 ㄹㅇ 흑발하니까 확 산다 ..,0개,2020. 5. 24.
이율,존나 예쁘다....ㅠㅠㅠㅠㅠㅠㅠ,0개,2020. 5. 24.
녜진,썸네일 보고 힉 하고 들어왔어요ㅠㅠ 진짜 이뻐요ㅠㅠㅠㅠ,0개,2020. 5. 24.
,可愛い💕,0개,2020. 5. 24.
챱,왕...완전 공주같아용..❤️너무 이뻐용😭❤️,1개,2020. 5. 24.
aryepsun,왈가닥뷰티에서 진짜 예쁘심 진짜 예뻤어요ㅠㅠ,0개,2020. 5. 24.
뚜뚜,11:50 ㅋㅋㅋㅋㅋㅋㅋ 아겁나웃겨여,0개,2020. 5. 24.
지현,언니... 흑발..... 대존예... 미쳤다 진짜 💕💕,0개,2020. 5. 24.
skSk,와 흑발충동 온다ㅠㅠㅠㅠㅠㅠㅠㅠㅠ존예 ㅠㅠ,0개,2020. 5. 24.
박지윤,흑발 레전드♥️ 왜 이제서야 했어요ㅜㅜ평생 흑발 해줘요ㅠㅠㅠ,0개,2020. 5. 24.
son,"黒髪に似合うメイク早くみたい……！
アルムソンイちゃん黒髪似合いすぎ",0개,2020. 5. 24.
Hgfasdfglj,"여자는 평생 머리색때매 고민인거 같아요ㅜㅜ
흑발하면 흑발이 이쁜더같고 밝은색 하면 밝은게 이쁜거같고ㅠㅠㅠㅠㅠ",0개,2020. 5. 24.
,可愛いです！,0개,2020. 5. 24.
주은,뜬금없는 얘기지만 네이처리퍼블릭 원브랜드 해주세용 흑발 존예ㅜㅜㅜㅜ,1개,2020. 5. 24.
승현,ㅋㅋㅋㅋㅋㅋㅋㅋㅋㅋ이언니 어두운 머리 진짜 잘어울리네 브라운도 조녜였는데 다 이쁘네,0개,2020. 5. 24.
Hani,"すごく似合ってる可愛い❤️
私も暗くしたくなりました〜🥺",0개,2020. 5. 24.
,黒髪に似合うメイク楽しみにしています♡,0개,2020. 5. 24.
,今日もかわいい〜♡♡暗めも似合う！,0개,2020. 5. 24.
조혜빈,언니는 어떤색을 해도 예뻐용 오랜만에 흑발하니까 진짜 멋있어용!!!!!!!,0개,2020. 5. 24.
Jiyoung,아 진짜 예뿌다 💞,0개,2020. 5. 24.
백지윤,근데 언니는 웜톤이라 갈색계열이 잘어울리는것 같아요ㅠㅠ 그래두 여전히 이뿌세용💓💕💗,0개,2020. 5. 24.
,머리  너무 찰떡기야ㅠㅠㅠㅠㅠㅠ,0개,2020. 5. 24.
,"ぱっつん見てみたいです( ⸝⸝⸝>_<⸝⸝⸝ )‪︎❤︎‪︎
今回もすごく可愛いです~！！",1개,2020. 5. 24.
권지연,언니 흑발 진짜 게예뻐요ㅜㅠㅠㅠ👍👍역시 흑발❤❤,0개,2020. 5. 24.
,아니 너무 잘 어울려요...ㅠㅠㅠㅠ🥺💖,0개,2020. 5. 24.
이현지,와 흑발진짜 예보여 ㅠ,0개,2020. 5. 24.
황다영,너무이뻐요ㅠㅠ흑발해도 이쁠듯한데용?!!❤,0개,2020. 5. 24.
빈찌,와 진짜 개 예쁘다 .........,0개,2020. 5. 24.
도경쌤,흑발..너뮤 예뻐요💜그래도 완젼 블랙은 안됩니다!!!ㅋㅋㅋㅋㅋ,0개,2020. 5. 24.
김지은,올리브영ㅋㅋㅋㅋㅋㅋㅋㅋㅋㅋㅋㅋㅋㅌㅋㅋㅋㅋㅋㅋㅋㅋㅋㅋㅋㅋㅋㅋㅋㅋㅋ아 이런거 보고 잘안웃는데 혼자 완전 웃었넼ㅋㅋㅋㅋㅋㅋㅋㅋㅋㅋㅋㅋㅋㅋㅋ올리브영ㅋㅋㅋㅋㅋㅋㅋㅋㅋㅋㅋㅋㅋ,0개,2020. 5. 24.
예스솔이,름송언냐~~ 흑발 이뿌고 귀엽긔 >ㅁ<..☞//☜..,0개,2020. 5. 24.
김무쌍mussang,올리브영ㅋㅋㅋㅋㅋ흑발 개예뻐유ㅠ,0개,2020. 5. 24.
원채,"잘어울려욥!!! 여름쿨톤이면 흑발이 은근 진짜 베스트거든요,, 한번 도전해보심이,,",0개,2020. 5. 24.
uE,훨씬....이뻐요....😯,2개,2020. 5. 24.
NatphatsornNamsap,우와ㅏㅏ 좋아용~~~,0개,2020. 5. 24.
,언니 어두운 색 하니까 진짜 넘 이쁨.. 원래도 이뻤는데 흑발은 살짝 고급진 청순느낌? 진짜 넘 조아요ㅜㅜㅜㅜ,0개,2020. 5. 24.
유하이,하우스 투어 ㅠㅠㅠㅠㅠㅠ,0개,2020. 5. 24.
,暗い髪色すごく似合ってます！,1개,2020. 5. 24.
기억할게,"아름송이님처럼 저도 누런피부라 검정색머리가 어울리나 고민많이햇는데 생각보다 어울려서 4년째 유지중이에요 
어릴땐 탈색하고 맨날 밝은머리햇는데 ㄱ깜장하니까 미용실도 안가고 딱이에요 ㅎㅎㅎ 아름송이님 머리색 다 좋지만 
깜장머리보니까 차분하고 뭔가 차도녀같은 느낌이 들어서 .....한마디로 이쁘다구요^,^ 영상 잘 보고갑니다",1개,2020. 5. 24.
김수현,"언늬 .. 기회가 된다면 흑발일때 앞머리 풀뱅 원츄 ,, 🖤",0개,2020. 5. 24.
김지수,와 흑발이 진짜 훨씬 낫다,0개,2020. 5. 24.
백설,올리브영ㅋㅋㅋㅋㅋㅋㅋㅋㅋㅋㅋㅋㅋㅋㅋㅋㅋㅋㅋㅋㅋㅋㅋㅋㅋㅋㅋㅋ,0개,2020. 5. 24.
냥냥,언니ㅜㅜ 안색이 좀 안 좋은 것 같아서 댓글 남겨요 어디 안 좋으신 거 아니죠,0개,2020. 5. 24.
,黒髪似合ってます(   ᷇࿀ ᷆  )可愛い！！,0개,2020. 5. 24.
조민서,11:00 너무 이쁘잖아요.....,0개,2020. 5. 24.
박다은,너무 대머리라뇨 ㅋㅋㅋㅋㅋㅋㅋㅋㅋ,1개,2020. 5. 24.
WINNER,"언뉘,,진짜 흑발 너무 이뻐요,,,,",0개,2020. 5. 24.
ttiigitfkfikff,언니 진짜 흑발 박제해주시면 안돼요? 진짜 원래도 이쁘신데 흑발하니까 더 예쁘세요!!,1개,2020. 5. 24.
밍뮤먀,온니 얼굴 대유잼 진챠 세상에서 젤 예뻐여 하루종일 봐도 너무 조와,0개,2020. 5. 24.
소리,존예ㅜㅜ,0개,2020. 5. 24.
머겠따,"와언니 흑발 오래해줘용 진짜 잘어울려요ㅠㅠ근데 이번영상 왜캐 귀여움폭발인거죠..??9분 56초에 왜?? 하시는 표정 너무 귀여워요 ㅠㅠㅠㅠ마지막표정도 고양이같고다람쥐같고 다하셔 정말,,,",0개,2020. 5. 24.
MelaniAraujo,"Honestly, this vídeo make my day. Hi, areumsongee😀😀😀😀",0개,2020. 5. 24.
YumekiS,アルムソンイちゃんで「焼けた？」と言われるなら、私は「泥塗った？」っていわれる(笑),1개,2020. 5. 24.
이다인,흑발이 훠어어어얼씨이인 이뻐요ㅠㅠ💓💓 물론 밝은색도 이뿌세뇨💗💗,0개,2020. 5. 24.
,1度でいいから地雷とか量産型系のメイクをしてみて欲しいです…！！,0개,2020. 5. 24.
쩡,아 너무 예뻐요 ㅠㅠ,0개,2020. 5. 24.
소울밍,언니 파스텔 블루 찰떡 블랙 머리 메이크업 존버.,0개,2020. 5. 24.
안은정,하..더 이뻐졌구만유~~~,0개,2020. 5. 24.
혜영,올리브영 ㅋㅋㅋㅋㅋㅋㅋㅋ,0개,2020. 5. 24.
,"귀엽습니다😍
나는 일본인
항상 동영상을 기대하고 생활하고 있습니다🥰",0개,2020. 5. 24.
수연,남친분 머리 자르면 더 잘생길 듯 ㅠㅠ,0개,2020. 5. 24.
FromAri아리,으앜 언니 브릿지머리 너무 예뻣눈데 너무 금방 바꾸시는거 아닌가여ㅜㅠㅡㅠ넘 자주바꾸면 상할거 같은데ㅜㅠ언니 머릿결 넘 소듕하다구여ㅜㅜㅠ흑발 진쨔 예뿌긴 하지만 가끔은 머릿결에게도 쉴시간을 듀세여❤,0개,2020. 5. 24.
항항히,언니 뻥치는게 아니라 진짜 밝은갈색 얼굴 넘 까매보였는데 진짜 훨씬 하얘보이고 잘어울려요..제발 박제해요ㅠ,0개,2020. 5. 24.
비니비니비니,오늘따라 더 밑입술에 눈이 유난히가네요ㅠㅠ뽈록뽈록 제눈에만그런가요ㅠㅠㅠ역시 흑발이 최고!!잘어울려용!!,0개,2020. 5. 24.
,黒いほうが可愛い,0개,2020. 5. 24.
S,dark brown really suit on you. it's really good.,0개,2020. 5. 24.
koteeswari,언니 진짜 이뻐요 💜,0개,2020. 5. 24.
,와 흑발 넘 예뻐요 진짜...,0개,2020. 5. 24.
여의주,"언니 저 영상보고 개뽐뿌옴 탈색단발인데 바로 붙임머리.흑발예약잡았어요 알음송이,,책임져!!",0개,2020. 5. 24.
찌니,너무 예뻐서 썸네일보고 바로 들어와짜나유😳😳,0개,2020. 5. 24.
,헐 풀뱅 미쳤다ㅠㅠ 잘어울릴거 같은데,0개,2020. 5. 24.
YIphd,언니대머리라뇨ㅋㅋㅋㅋㅋ!! 백만불짜리이만데!! 저도 언니랑 똑같이 정수리가짧고 이마넓은편이라 매번 앞머리 내리고다녔는데 정수리에 뽕띄우니까 앞머리까고다녀도 한개도 안넓어보이게됐어요!!,0개,2020. 5. 24.
러븀Loveyum,흑발 완전 예쁘신데요...? 너무 잘어울려요 !!,1개,2020. 5. 24.
선망,언니 머리색 너무 잘 어울려요!! 그리구 스모키 메이크업이라니 ㅠㅠㅠ너무 좋아요 꼭 해주세요...,0개,2020. 5. 24.
,Thank you for Japanese sub...!!!!!!!!,1개,2020. 5. 24.
피츄,저방금 풀뱅한거 상상했는데 완전잘어울려요,1개,2020. 5. 24.
김미니,예쁜 커플 💑  보고 있으면 웃음나고 귀엽고 좋네요 ♡,0개,2020. 5. 24.
피리미리,뭔가 쿨톤이신 것 같아요..!!! 겨쿨인가?,1개,2020. 5. 24.
까뿌,아니 언니 진짜 잘 어울리잖아요... 하 백설공주메이크업도 한번 해주세요 완전 예뻐요 징차 공주님❤,0개,2020. 5. 24.
하늘,진짜 흑발이 5조5억배 이뻐요!!!!,0개,2020. 5. 24.
우유,"언니 기초영상도 보여줘요ㅠㅠ그게 안니만의
매력이던데 저는 기초하는거 넘 좋아해가지고 좀 이상한 취향이지만? 뭔가 점 나른하니 그래서 일부로 그걸영상 찾다가 언니 구독한거에요허허 그러니까 매일은 아니더라도 가끔해줘여>_<",0개,2020. 5. 24.
0819bv,흑발 넘나 찰떡❤️,0개,2020. 5. 24.
박세연,"언니 이제 풀뱅 존버하면 되나요😍
이번머리도 찰떡😘😘",0개,2020. 5. 24.
,1:13 언니 이때 같이준비해요에서 '같이' 옆에 있는 그사진 메이크업 궁금해요 너무 이쁘자나요 ㅠㅠ,0개,2020. 5. 24.
하농,얼굴도 하얘보이고 흑발 너무 이뻐여 !,0개,2020. 5. 24.
이유진,언니 ㅠㅠ여성초쿠션 나오면 제발 13호 17호 도 쓸 수 있는쿠션 색상도 만들어주실꺼죠?💗💗반드시구매할게요 😍유튜브 볼 때마다 쿠션 테스트 하는 부분부분 설명해주시니까 믿음가고 엄청 좋을 것 같아요 ㅠㅠㅠ 얼른 판매해주세요😍,0개,2020. 5. 24.
OhMeOhMy,오오오오 언니 흑발 너무 잘어울리는거 아닌가요 ?! ㅎㅎ <3,0개,2020. 5. 24.
,若返って見える,0개,2020. 5. 24.
뿅뿅,"내 기준 언니 레전드영상 ㅜ 넘 이뻐요 제가 언니 때문에 흑발 염색약까지 샀다구여,,,",0개,2020. 5. 24.
노예림,"예뻐요! 잘어울려요! 근데 ㅎㅎ 최근에 받은 시술 알여주세요 ,, 몽가 어려지셨어요",0개,2020. 5. 24.
,와 진짜 잘어울려요,0개,2020. 5. 24.
,풀뱅하면 얼짱시절같겠네요,1개,2020. 5. 24.
areumsongee아름송이,✨✨립 정정 합니다 웨이크메이크 아니고 쓰리씨이에요!!!✨✨,80개,2020. 5. 17.
