,youtube_id,comment,like_num
0,D가짜통역사주현누나,진짜.... 이분은 자기관리의 끝판왕이다 진짜 존경한다...,170개
1,안영,유나님 저 하나 추가로 알고 싶은거 있는데... 얼굴 솜털관리는 어또케 하시는지요? 잔잔한 솜털땜에 스트레스요 ㅠㅠ,134개
2,호잇윰윰,입술각질보다가 보니....발뒤꿈치 각질 너무 고질적인데...방법 알려주세요,80개
3,Laura,I so needed this video !! My lips are chipped and the lines can be seen when applying lipstick. Gonna prove this method 💓,8개
4,혜윰,설탕끊깈ㅋㅋㅋㅋㅋㅋㅋㅋㅋㅋㅋㅋㅋㅋ ㅠ ㅠ 저 엄청 기다리고 있어요!,30개
5,한주현,아토피로 인해 몸이 얼룩덜룩한데 이 색소침착?은 어떻게 되돌릴 수 있을까요..,7개
6,BitterTea,"Thank you so much for putting ENG translation, I will definitely try this",4개
7,샛별,언니 이제 여름 다가오는데 팔꿈치 같은 곳 관리는 따로 하시는 거 있나용??? 반팔 입을 때마다 자꾸 신경쓰여요ㅠㅠㅠㅠ,5개
8,PauleenGraceCaa,it was really helpful. 너무 많이 감사합니다.,6개
9,임사야,개인적으로 되게 쉽고 매일 실천 가능한 립밤 바르고 자기만 하고 있는데 각질 제거도 잘 되고 좋아요. 립밤 듬뿍 바르고 잔 뒤에 아침에 세안 하면서 입술을 마사지하듯 롤링해주세요. 밤 동안 불려있던 각질이 제대로 나옵니다. ㅋㅋ 립밤은 촉촉함이 오래 유지되는 제품을 사용해주시면 됩니다.,27개
10,TaiTai,"Thank youuuu, I’ve been wondering why my lips were so chapped after I tried my best scrubbing my lips with sugar.",0개
11,지니,유나님 혹시 요철 관련 영상은 없을까요 ㅠㅠㅠ 요철때문이 뭘 해도 피부가 너무 안 좋아보여서 미치겠어요 ㅠㅠ,2개
12,Bornthisway2000,와 나오자마자봄 ㄷ ㄷ 로또사야징 유나님 오늘도 넘 아름다우십니다 꿀팁 감사드려요!,3개
13,EunseKim,한국어 자막을 켜면 폰트코드랑 같이뜨는 것같아요 오류인지 확인해주세여,3개
14,함뮈,"입술에 안좋은 습관은 다갖고있어요..입술에 침바르기, 입술 뜯기....🤦‍♀️ 라네즈 제품 갖고있는데 매번 귀찮음이..지금 당장 따라해볼께요~ 좋은 습관으로 변할 수 있길🙏",6개
15,조연주,새치관리법도 알려주세요 제발요ㅠ,2개
16,e차안,드디어💕일주일 못 밨다고 반갑구ㅠㅠ 넘나 좋아요히히히,6개
17,오연재,"안녕하세요 유나님 제가 시스템을 잘 모르지만 한국어 자막보기에 오류가 있는것 같아서요ㅠㅠ 말씀하시는 문장 앞뒤에 컴퓨터언어? 같은게 같이 나오네요! <b><font color=""#ffffff""> 이런거에요! 저만 그런거면 살포시 무시해주세요....ㅎ",3개
18,mhLovely,저도 클라브 립 마스크 오래전부터 항상 바르는데 언니도 바르신다니 너무너무 기분 좋아요~^^ 언니 사랑해용~^^,3개
19,jwS,우와...진짜 이쁘게생기셨어요,1개
20,꼬미,틴트 어떤거 바르신건거요?? 진짜 안지워지네요!!,2개
21,취배남누마Numa,요즘 입술각질때문에 엄청 고민이였는데 감사합니다 :),2개
22,승환,감사합니다ㅠㅠ,0개
23,Elektracity20,I needed this. Thank you Una. Stay safe and healthy.,1개
24,hjX,아놔 방금 립 슬리핑 마스크 샀는데 아 ㅋㅋㅋㅋㅋㅋ,1개
25,윤진,언니는 정말.. 최고예요... ㅅㅏ랑해❤❤❤,0개
26,BBeumASMR쁨,정말 날이 갈수록 점점 피부도 더 좋아지시고 더 예뻐지시는거같아요🤩❤️,1개
27,miline,우왁~!!!!@.@  한국어 자막해주셨네요 ㅠㅡㅠ 놀람....@.@/ 한국어 자막에 글말고 코드?도보여요 ㅋㅋㅋㅋㅋ 그래도 이정도로라도 해줘서   귀가불편해서 자막아니고는 못보는 저한테 큰도움됐어요~  유나님처럼 피부 예뻐지고싶어서  구독 할까말까 고민했는데 ㅠㅡㅠ  언젠가 자막 한국어 자동말고 해주신다면  열심히 보고 따라하고싶다 해서 구독해놨었는데 ㅠㅡㅠ 해주셨네요 고맙습니다^^ 유나언니최고♡ ㅋㅋㅋ,2개
28,업무법규,좋은영상 감사합니다!!,2개
29,ChloesChannel,"정말 조곤조곤 설명이 귀에 쏙쏙 들어오네요!!
오늘 저녁에 바로 해볼게요!!!😊",1개
30,pak햄구이,비립종 안생기게 하는법 없나요 ㅠㅠ,0개
31,천유림,꺄꺄 올라왔당❣️❣️,0개
32,신혜영,"넘넘 이쁘세요~^^
닮고 싶은게 넘 많으신 분이네요💗
자주 올께요~~🥰😍",0개
33,Hanamiya,"Finally a lip care video!!
I always curious of your lip care",0개
34,민지적시점,"역시 UNA 언니 최고 ... 평생 저의 입술이  곰발바닥이었는데 ... 고질병을 해결해주셨네요 ㅠㅠ
역시 언니는 저의 롤모델입니다♡",0개
35,JoyJ,감사합니다^^,0개
36,AnushaSan,My lips are ALWAYS dry and chapped which leads to me constantly peeling them 😭 hopefully trying your tips will help,0개
37,설화,마사지 새로 배워가요 감사합니다♡,1개
38,Genuine,우왕 이거 찐이에요ㅎㅎ 저 어릴때부터 입술각질 떼는게 습관였거든요 ㅜ 요런 꿀팁을 주셔서 감사해요<33 진짜 유나님은 자기관리의 QUEEN! ㅎ 항상 고마웡요!!,1개
39,Dklee,넘나 예쁘심♡♡♡,0개
40,TWINSPLAN,Your tips are always useful. I have learnt a lot from you skincare wise.  Now I have to do lip massage as well. My maintenance routine is becoming more and more complicated and longer. But I believe that it is all worth it as I can see it from you. Thank you for sharing.,1개
41,TaehuiKong,입술 주변 피부 착색은 왜 그런건가요...? 메이크업을 해도 뭐 하나 먹으면 메이크업이 다 지워지고..ㅜㅜ,0개
42,lndaembbcsHnQucdrbunny,저도 비슷하게 바세린 바른후 살살맛사지해주는데 하는거랑 안하는거랑 정말 달라요!!! 입술 얇고 작으신 분들께 추천합니다❤,0개
43,안영,오호...혈액순환이구나 ㅡ.ㅡ 전 혈색은 좋은데 잔주름이랑 껍질발림이 심한편이여서 고민 중이엿는데 영상 잘 보고 갑니다. 서노군이랑 여행 잘 다녀오세요 💕,1개
44,ClaireLawrence,Wonderful. So pleased you made this video thank you 😊,0개
45,스꼬북,실제 따라하신분 계신가요? 손가락좀 눌러봐주세요!,1개
46,글뤼크운좋은언니,참 이쁘게 사신다💕👍🏻,3개
47,정유리,유나님 페이스왁싱이랑 스킨플래닝 어떻게 생각하시는지 궁금해요 ! 얼굴에 잔털이 많아서 너무 고민이에요ㅜㅠㅜㅠㅜ,0개
48,수문장누수전문업체,자기관리 중요성과 열정넘치는 모습 응원합니다!!!,0개
49,불빛등대,"불륨과 잔주름까지 도움이 되는군요
오늘 밤 해볼게요 
좋은 팁 배우고 갑니다
고마워요💕",1개
50,보경,오오!💗,2개
51,너콩빈,바세린은 입술에 바르는거 아니라고 들었는데 진짜인가요..??,0개
52,쑥쑥이,설탕끊기 저도 기다리고 있어요 🙏🥺,1개
53,hongmeijin,"근데 호주서  오셨나요?궁금해요 
그뒤로  영상  않올리시고  괜찮으신가요?",0개
54,박희진,왠지 공부하다가 거울 보면 입술 색이 창백하던데 혈액 순환이 안 되서 그런거였나봐여..! 종종 따라해봐야겠어요,0개
55,jaimelannister,유나님  유투버말고  본직업이  패션잡지  사장님이신지요??  직업이 궁금하네요 ^^,1개
56,SHINCHAN,Please do a video on pigmented lips😭,1개
57,선물s,유나님이랑 비슷한 방법이긴한데 저는 피지오겔 크림 입술에 떡칠하고 랩 씌운 다음에 일회용마스크 반으로 접어서 입만가리고 자요  다음날 보면 각질이 때처럼 나와욬ㅋㅋㅋㅋ 세게 문지르지않아도 이미 불어있다는.... 그리고 입술도 불어있어요 통통하게. 단점 = 귀차니즘 심하면 안함,1개
58,임회정,해봐야겠네요 고맙습니다,0개
59,LeeLee,입안이 건조하신거같아요,0개
60,JeanneWong,Cannot stop laughing at the massage part but i def will do it later lolol,0개
61,름이,"이분 볼매시네
 볼수록 빠져들어",0개
62,MegamiBTS,First. Hi UNA . I want to ask you what products can I use to make disappear a few pimples I've got. My skin is very sensitive,0개
63,김혜선,유용하면서도 간단한 팁 너무 좋아용~~~♥,4개
64,2zmfkdnstkseh,"입술 주름연고도 한번 사용해 보세요. 주름개선에 효과가 좀(?) 많은듯 합니다.
검색해 보시고 참고 하세요..볼륨도 생기는듯..
https://coupa.ng/bCeV3Q",0개
65,ThiQuyen,"hi mn a, co ai nhan vietsub chi nay k a, ai biet thi chi cho e vs ak, thanks so much",0개
66,김용구,유나님도 코로나 조심하세요,3개
67,김연수,3:15,1개
68,shine,아리따움 진저슈가 립마스크 좋아요,1개
69,다옹,"유나님 손이사포같은사람..
핸드크림으로해결되지않는사람 관리법두있을까요?",1개
70,k,"But do you know that Vaseline is not good for the skin? I have read that it is basically a byproduct that gets produced in the oil industry, the same place where they produce gas and diesel. Also, it's inaccurate to say that Vaseline gives moisture - all it does is just keep the moisture in your lips/skin from escaping. So it can have the benefit of locking in moisture, but still, applying onto skin will clog your pores and prevent the toxins from getting out!
I just wanted to share this information, please let me know if it's wrong:) but apart from that, I enjoyed this video<3",1개
71,구독자님,쌩얼 이신가?,0개
72,찬주,면봉으로 립밤을 닦아내면 주름이 더 생겨서 토너도 묻혀서 닦아보고 두드려서도 닦아보고 했는데 주름이 계속 생기면서 틴트나 립스틱을 바르면 보기가 싫은데 어떻게 해야하나요ㅜㅜ,0개
73,Jessica,Does anyone know if she is really 41? She could totally go for 18-25😱 Thats insane🧖🏻‍♀️,0개
74,왕유지,분위기 여신 ❤️,0개
75,은랑,저는 불리고 해도 안나와서 걍있으면 각질이 굳어서 완전 신경쓰여서 뜯고 구멍나고 그러다 싯을때 아파서 문지르지도 못하고 ㅜㅠ 반복이네요 맨날 바세린 하루종일 발라도 손으로 만지면 다 사라지고 ㅜㅠ 자기전에도 바르는데 안발른느낌..,0개
76,SoyoonLim,저 지금 한달째 입술주변 각질이 자극적으로 일어나요. 최근에 립밤이 떨어져서 집에 고보습밤제품인 김정문알로에 큐어 인텐시브 이엑스 크림을 좀 써봤는데. 담날아침꺼지 각질이 안일어나고 촉촉해서 좋아서 계속쓴게 다른거라면 다른거에요. 혹시 그제품의 성분이 입술에 자극을 준걸까요?  고민되서 여기 달려왔는데. 마침 입술관련 영상이라 글 남겨요. ㅠㅠ 원래 입술각질이 태생이부터 있는타입지만요. ㅠㅠ,0개
77,shruthijagannatha,I have the most arid lips ever😩 I apply the Laneige lip sleeping mask in the night but it doesn't seem to be much hydrating. There is no feeling of softness on my lips when I remove the mask. Is there any vitamin/protein deficiency that causes lip dryness? Because I hydrate myself enough even though my lip dryness doesn't seem to go🙁,0개
78,스프링쿨러,"유나님..  초기부터 꾸준히 시청하고 있는 애청자입니다. 올려주시는 영상들이 꼼꼼하여 특별하게 궁금한게 없었고, 그대로  따라만해도 얼굴과몸에 광채가 나서 더욱 챙겨보게 되네요. 그런데 머리에 건선이 생겨서 이것저것 돈도 많이 들여 시도해봤는데 특별히 나아지지않네요. 건선은  완치가 안된다하지만 이대로 손을 놓고만 있을수는 없어서 이렇게 처음으로 문의드립니다. 앞머리쪽으로 심하여 탈모가 올까 걱정이 많네요ㅜㅠ. 바쁘시겠지만 혹시 건선관련 영상을 찍어주십사 부탁드려용...",0개
79,sunjeong,"안녕하세요 유나님. 영상 정말 잘 보고 , 배우고 있는 홈케어 새내기! 팬이에요!
다름이 아니라 여쭤볼것이 있어서요. 
사실 사람의 피부라는게 마네킹처럼 완벽할 순 없잖아요.  그런데 스킨케어를 하면 할수록 완벽주의에 빠져서 단 하나의 결점도 참아내지 못하는 (..) 상태가 돼요 ㅜ ㅜ 역으로 스트레스를 받는데 . 유나님은 이런 경험 없으신가요? 있으시다면 어떻게 대처하시는지 궁금해요!",1개
80,구미주,입으로 숨 쉬는 버릇이 있어서 입술이 자주 건조한데 저한테 도움이 되는 영상인거 같아요!! 유용한 팁을 공유해주시는 유나님! 감사합니다!!!,1개
81,BruntBrunette,How old is she?,0개
82,RanggSosexyy,Annyeong notice me,0개
83,justapatoti,can someone tell me how to get rid of dark lips?,0개
84,TinaTina,How old are you ?,0개
