닉네임,댓글,좋아요수,날짜
플로리파이,반가워요  기다렸습니다. 솦님은 제게 첫번째 구독 크리에이터에요...  준하님이 이 댓글을 읽으실지 모르겠지만 늘 응원하고 있다는 마음 보냅니다~~ (from. 요리를 사랑하는 사람),3개,2020. 5. 7.
팔공,역𓂻𓂭  칼로 채를 쳐야 맛이 지대로죠!!!,8개,2020. 5. 7.
MichelleBaik,Oh! I I love Korean traditional radish Kimchi! thank you! I will try making and eating sometime soon.,0개,2020. 5. 7.
시리얼엔우유,꿀성대 소프,7개,2020. 5. 7.
한선우,ㅎㅇ,3개,2020. 5. 7.
구독안하면니미래남친,왜 안녕하세요 소프에오 (찡긋) 사라짐..?ㅠ,31개,2020. 5. 7.
서정연,"따뜻한밥에 무생채 양껏올려서 람기름넣고 와~~우 계란을4개?😁 
ㅎㅎㅎ 근데 맛없게 드시나요😁",1개,2020. 5. 7.
이정수,카메라가 좀더 고정이 됬으면 좋겠어요!,3개,2020. 5. 7.
손너굴,회사 점심밥으로 무생채나오면 고추장에 꼭 비벼먹어용! 한그릇 뚝딱임😖,2개,2020. 5. 7.
Heo갱스,"오늘 소프님의 몇년전 영상중 튀김우동, 업소용순대 보면서 소프님을 생각했었는데 이렇게 영상 올려주셔서 감사해요~~ 너무 그리웠슈~",16개,2020. 5. 7.
서아현,전 라디오 같고 좋아요! 소프님 화이팅!,2개,2020. 5. 7.
TaejinKim,8:03 응???? ㅋㅋㅋㅋㅋㅋ,0개,2020. 5. 7.
캡김틴수호,"0:22 자꾸 런닝맨에서 이광수가 ""추억이 담긴 무""가 생각나네 ㅋㅋㅋㅋㅋㅋㅋㅋㅋ",0개,2020. 5. 7.
이런날도,와 얼마전 백종원님 고구마 생채 비빔밥 생각나네요! 맛있겠다,1개,2020. 5. 7.
물보라,소프님 얼굴을 더 보고 싶습니다.,1개,2020. 5. 7.
Jangjaehee,돌아왓다!!!!,1개,2020. 5. 7.
버터누나,오 기다렸어여~! 선플 후감상ㅎㅎ,1개,2020. 5. 7.
GunnySGT,어서옵서예~~,1개,2020. 5. 7.
이진학,"내 결국 한식으로 회귀 하실 줄 알았어요. 나이가 들었다는 증거죠.
그런데 이거 계란 비빔밥 아님???",1개,2020. 5. 7.
지현,10:15 카메라 넣고 비볐나요? 소리 뭐야... 배고프게...,0개,2020. 5. 7.
그림꿈,보고싶었어요..기가막히게맛있겠어요.건강만하심먼걱정이래유. 반가워요,1개,2020. 5. 7.
이박사,오마이깟,2개,2020. 5. 7.
잔몽,"영상이 이전보다 더 깔끔해졌네요!  군 부분을 덜어낸 만큼 간략화된 부분들도 있는데
다른 사람들도 쉽게 따라할 수 있게 레시피를 영상이나 설명에 넣어주시면 더 좋을것 같아요!",0개,2020. 5. 7.
표팔제,돌아왔구나.. 솦태식이..,1개,2020. 5. 7.
따띠짱,"이 밤에 미쵸따 ㅠㅠ 
낼 꼭해묵어야디",0개,2020. 5. 7.
TARIAN테리언,"제일 소프.
제일 소프다운..
토맥사 영상보다 더 신선하고 인간적이지 않나 하는 영상 잘 보고 갑니다.",33개,2020. 5. 7.
슴향,소프님 보고싶었습니다...,1개,2020. 5. 7.
채널,와 너무 오랜만이에요 ㅜ 이제 돌아오시는건가요,1개,2020. 5. 7.
Anna,직접 만들어봤어요! 생각보다 간단하고 맛도 좋아서 종종 반찬으로 해먹을 것 같아요 :),0개,2020. 5. 7.
석제니,소프님 기다렸습니다~,1개,2020. 5. 7.
쿠키키친CookyKitchen,돌아오셨군요~ 재미있는 영상 많이 올려주세요~~^^,1개,2020. 5. 7.
민경호,컨텐츠 죽이네 너무 재밌습니다,7개,2020. 5. 7.
김철웅,"영상 연출은 한결 보기 좋은데 형
자막 편집은 좀 해야할거 같아
원래 형 컨셉은 동네 형 또는 옆집형 느낌이었는데 이렇게 농담이 적고, 자막도 없으니까 완전 그냥 교육 방송 같아 형
지금 추세는 무엇보다 재미를 원하는 사람들이 많으니까 형 ㅎㅎ 
지금 카메라 구도나 연출은 진짜 좋은 거 같아 
이제 자막이랑 형이 드립 조금씩 더 치면 영상 정말 재밌을 거 같아 
형 화이팅!",86개,2020. 5. 7.
장씨삼남매,"기가 맥히게 잘보고 가요~~
짱",0개,2020. 5. 7.
우정태,소프님 보고싶었어요 화이팅,1개,2020. 5. 7.
불사조,"오랫만에 와보니,106.회원이, 어마하네요.굿뜨👍",1개,2020. 5. 7.
박재우,소프형 come back,6개,2020. 5. 7.
bongkeekim,개란 네개 좋다. 올바르다!,0개,2020. 5. 7.
최조순,오우 전도 보기 좋지만 지금도 보기좋아졌네요 ㅋㅋㅋㅋ,0개,2020. 5. 7.
샘앤맥스,Welcome Back! 다이어트중이라 계란 4개는 드립이죠? ㅋ  확 바뀐 앵글이랑 진행 방식 & 컨텐츠 좋네요. 승승장구하시기 바랍니다. 👍🙏❤😘,1개,2020. 5. 7.
어둠빛과,이제야 소프님 영상올리셨네ㅎㅎ기다렸다고요!영상보고싶어서 얼마나 기다렸는대,1개,2020. 5. 7.
maru,소하~~~~ 뵙고싶었습니다,1개,2020. 5. 7.
미니킴,알람떠서 바로 달려왔어요 오랜만에 소프님 영상이라니 워후❤  이번 컨텐츠 대박 나길 어서 라이브도 해주세요,8개,2020. 5. 7.
정구르미,^^~~~👍,1개,2020. 5. 7.
수수일,따끈따끈,2개,2020. 5. 7.
정해인,소프형 재밌게 질봤어,0개,2020. 5. 7.
신재민,"잠깐 잊었다가 생각이 났는데
소프님 오늘 진짜 오랜만에 방송 올리시네요
얼굴 없는 영상 추억 돋습니다.
비빔밥 맛있는 한국 소울 푸드이죠ㅎㅎㅎ",6개,2020. 5. 7.
TBear,아... 배고픕니다...,0개,2020. 5. 7.
강민규,안녕하세요 소프형 아프리카 시청자 100명도 안될때 부터 본 팬입니다 군대에서도 전부는 아니지만 후임들도 추천해주고 꾸준히 시간되면 봤었어요 먹는거나 좋아했었지 요리는 아르바이트 할때나 했었는데 형 영상보면서 따라하고 하다보니 부모님이나 친구들이 요리 잘한다고 맛있다고 할때마다 너무 기분이 좋고 형한테 감사했어요 댓글이나 채팅 아예 안다는데 형이 거의 한달만에 복귀해서 너무 반가워서 댓글을 안달수가 없네요 항상 힘들거나 안좋은 일이 있어도 구독자와 팬들을 위해 노력하고 밝은 모습 보여주는 소프형이기에 이번에 공지사항과 쉬는걸 보고 마음이 너무 안좋았어요 저도 요새 형 영상 조회수 많이 떨어진거 보고 안타깝기도 하고 여러 사람들 댓글도 보는데 옛날 팬분들 대부분 형의 옛날 모습을 그리워하더라구요 저도 당연히 옛날에 편안한 형의 모습이 그리운건 마찬가집니다 영상 퀄리티나 진행이나 장비 모든 면에선 당연히 지금이 많이 발전하고 전문적으로 변했지만 그때의 푸근함과 편안함 따듯함은 지금보다 좋았어요 그렇다고 지금 아니라는것은 아니에요 이런말 저런말 해도 저는 형이 하고 싶은거 했으면 좋겠어요 컨텐츠나 유튜브 영상 때문에 스트레스도 많이 받으시고 힘들어하셨을텐데 전 그냥 오래오래 형 응원하고 좋아하는 팬이자 동생이고 싶은 사람으로서 형이 하고싶은거 하면서 언제나처럼 시청자와 팬들과 함께 소통하고 늘 웃으면서 스트레스 받지 않았으면 합니다 형이 무슨 컨텐츠를 하던 뭘 하던 언제나 응원하고 좋아하고 있을겁니다 저 한사람이 열심히 말해도 큰 도움은 안되겠지만 이렇게 꾸준히 형 응원하는 사람들이 있다는거 잊지마세요~~ 댓글 보실지 안보실진 모르겠지만 형 다시 영상 복귀해서 너무너무 기쁘고 좋네요 ㅎㅎ 형은 언젠가 정말 최고의 유튜버가 될겁니다 응원해요 소프형,3개,2020. 5. 7.
사랑홍쭈사랑,경상도에서 많이 해먹는 음식인데요. 맛나겠어요👍👍👍,0개,2020. 5. 7.
동탄고교장실틀니도둑엄준식,이 컨텐츠 너무 좋아요,0개,2020. 5. 7.
동네수의사,새로운 컨텐츠 좋아요,1개,2020. 5. 7.
오준영,오랜만이에요~!!!,1개,2020. 5. 7.
하찌,기다리고 있었어요!,1개,2020. 5. 7.
렛츠히릿,여 오소프식이 돌어왔구나?,5개,2020. 5. 7.
YTLieling,형 보고싶었어 ㅠㅠㅜ영상 올려줘서 고마워요!!,4개,2020. 5. 7.
요리하는방구석백수,보고싶었습니다,14개,2020. 5. 7.
elenaLee,반갑네요!!,1개,2020. 5. 7.
아하그렇구나,??? : 나는 개인이오,0개,2020. 5. 7.
응지콩,4:56 쪽파 데구르르 킬포ㅋㅋㅋㅋㅋㅋㅋㅋㅋ,1개,2020. 5. 7.
대장나무,"보기 불편하지 않은 화면 앵글부터 더빙 형식의 영상 진행.
지루하지 않고 깔끔하고 아주 좋습니다!",5개,2020. 5. 7.
낭만신디중국어중국vlog,"우와 올만에 소프님의 요리 근접촬영 영상 봅니당~ 
집에가서 만들어먹고싶어집니당~",3개,2020. 5. 7.
박시현,재밌다 헤헿,0개,2020. 5. 7.
everyday,얼마나 이 영상이 오기를 기다렸는지...ㅠㅠㅠ 너무 반가워요ㅠㅠㅠㅠ,2개,2020. 5. 7.
코다하우스,좀 도 얌전하고 안정된 느낌 좋습니다 ㅎㅎㅎ,4개,2020. 5. 7.
아미미,그동안 뭐하셨는지 궁금하네요  팬이예요 당근 구독자고... 승승장구하세요,0개,2020. 5. 7.
sangjeonglee,저는 무생채만들때 알배추도 같이 넣어서 만들어요. 배추를 넣으니까 무의 알싸한맛과 배추에 달달한 맛이 어우려져서 더 좋더라고. 한번 같이 넣어서 해보세요. 맛있어요,0개,2020. 5. 7.
도돋,계란 네 개인 거 너무 웃겨 ㅋㅋㅋㅋㅋ,2개,2020. 5. 7.
정보스,"소프님! 제가 고등학생 때 침대에 누워서 벽에 핸드폰 세워두고 봤던 영상 또 보고 또 보고 했을 때가 있었는데 벌써 전 대학교 졸업을 했네요. 생일상 영상보고 직접 엄마께 생신상을 해드리기도 하고, 나도 요리해볼까? 하는 생각이 날 때면 제일 맛있어보였던 팽이버섯전을 해먹을 때도 있었어요! 
아직까지도 뿌링클을 먹을 때면 소프님의 영상이 생각이 나요! 친구들한테도 이거 똑같이 만드는 유튜버가 있어! 하면서 말해주기도 하고요ㅋㅋ
매일 매일 유튜브를 보지만 구독자임에도 영상이 뜨지 않거나, 알고리즘으로 뜨지 않아서 잊고 지냈던 시간 속에 이제는 다시 일어나시는 준비를 하고 계셨네요. 
정말 소프님은 힘든 시간을 보내셨을 수도, 혹은 어려우셨을 수도 있지만 저에겐 소프님은 한결같이 밝고 무척이나 노력하시는 분이예요.
살면서 고민과 좌절에 마주하는 시간이 없다면 결코 다시 일어날 수 없는 것 같아요.
소프님의 수없는 노력과 고뇌를 구독자분들과, 새로 유입되시는 분들이 꼭 알아주었으면 하는 바람이 있네요. 정말 응원합니다! 화이팅이예요!",1개,2020. 5. 7.
JustinPark,Damn.,0개,2020. 5. 7.
공성숙,저도 일본에 있을 때 무생채 많이 해 먹었어요.  많이 해서 집주인도 주고...ㅋㅋ 김치 대용으로 참 좋은 음식이였지요ㅋ   영상보니 추억이~~ㅎ,0개,2020. 5. 7.
김옥연,"간만의 영상 넘 반가워요!!
공백기(?)동안에도 솦님 영상 복습했드랬죠. 좀 전에도 닭갈비 영상보고 내일 닭갈비 할 준비하고 잠자리에 드는 중.ㅎㅎ
그동안 뭔 일 있었길래 목소리가 더 좋아지신 거임? 달걀도 4개로 늘어난 듯...ㅋㅋ
요리에 대한 추억도 내레이션으로 깔리고, 요리 꿀팁도 잊지않고 일러주시고, 중간중간 의도치 않은?ASMR도 기가 막히네요... ^^
재밌게 영상 잘 봤습니다. 기대됩니다!!!
소프님 음식 스토리 좋아요. 그리고  스푸니들의 음식 스토리도 사연 받아서 해 주셔도 좋을 거 같아요.",4개,2020. 5. 7.
bts보라해,새삼 소프님 손이 예쁜 남자였다는걸 또 한번 느낀 화면~~~아 비빔밥 먹고싶다,0개,2020. 5. 7.
이재민,먹을때 살찐 오킹 닮았네요 소프형,0개,2020. 5. 7.
강후리,승우아빠스러운 영상이다,0개,2020. 5. 7.
PerfectstoneJ,"8:03 - 다이어트 중이니까 네개정도만 

나: ...?",2개,2020. 5. 7.
수수한,기다렸어요,1개,2020. 5. 7.
비월드,와 영상 오랜만에 올라와서 보는데 카메라 구도랑 스토리 좋네요 ㄷㄷ,2개,2020. 5. 7.
홍브로,너무 오래 기다렸어요 ㅜㅜ 뭐라도 좋으니까 많이 올려 주세요오~~!!,1개,2020. 5. 7.
이민재,ㅋㅋㅋㅋㅋㅋㅋㅋㄱㅋㅋ포동포동하니 귀엽다ㅠㅜㅠㅜ,0개,2020. 5. 7.
ZongDu,10:35 하이라이트,7개,2020. 5. 7.
조규현,"소프쟝ㅠㅠ
돌아왔구나!",4개,2020. 5. 7.
misung,아 진짜 맛있겠다ㅜㅜㅜㅜㅜㅜ,1개,2020. 5. 7.
시무룩,와 보면서 침 질질 흘리고있었는데 마지막에 김 한장 나오길래 나도 모르게 욕이나오더라 너무 맛있어보여 미춌어 형,2개,2020. 5. 7.
조창용,묘하게 중독성 있네요. 소프님 진짜 영상 이랑 소리 너무 찰떡이네여,3개,2020. 5. 7.
팟호떡,아..침고인당,0개,2020. 5. 7.
Geuyang그양,비비는 소리.. 참을수 엄성~~~,1개,2020. 5. 7.
꿀꿀이정워니,1,0개,2020. 5. 7.
NewHippie,"방향성을 이쪽으로 정하신 것 같네요.
전보단 정돈된듯한 느낌입니다.
앞으로도 힘내시길!",0개,2020. 5. 7.
쨔쨔,"친숙도가 낮아졌어요 예전엔 가까운 지인이 자기방식대로 요리하고 이런게 좋았는데
지금은 그냥 티비에서하는 흔한 요리프로그램 같아서 지루해요
1인 미디어의 느낌을 다시 살렸으면 좋겠어요",451개,2020. 4. 8.
raye,수면바지 입고 집에서 요리하시는게 젤 좋았어유 ㅋㅋㅋㅋ 사실 스튜디오 같은데서 찍은건 많이 못봤어요...,95개,2020. 4. 8.
국화빵,"소프님 13년도부터 빠돌이하고있는 사람입니다. 소프님. 설비, 컨텐츠, 편집 다 중요합니다 무조건 중요한거 압니다. 근데 저희들이 진정으로 원하는 소프님은, 그런게 아닌것같아요. 물론 그런 요소들이 힘을 실어줄 수는 있지만 저희들이 원하는건 예전 소프님만의 그 날것의 느낌인것같아요. 딱히 컨텐츠가 없어도 그냥 집에서 수육삶아놓고 가까운 소통책상 앞에 앉아서 저희랑 수다떨고.. 제철되면 좋아하시는 꽃게 삶아서 토맥사 말아먹고.. 깐풍기 튀겨먹고.. 컨텐츠는 아크릴박스 하나만 해도 저희는 엄청 행복했었던 기억이 있습니다. 소프님 다른것도 중요한거 정말 잘 알고 소프님 노력하시는것도 알고 노력하는거에 비해 성과가 잘 안나와서 속상해할 소프님도 너무 안쓰럽습니다.. 자꾸 뭘 채우고 변화를 주고 이것저것 시도하기보다는, 하나씩 비워내고 비워내서 예전처럼 동네형같은 날것의 느낌을 다시 찾아보시는건 어떨까요? 그냥 컨텐츠 신경 안쓰시면서 소프님이 그날그날 드시고싶은거 해드시면서 저희랑 두런두런 이야기나누던 그시절 소프님이 너무 그립습니다. 고퀄의 영상? 물론 중요하지만 최소한 소프님 오래 봐온 시청자들이라면 소프님이 고가의 장비, 조명으로 기가막힌 컨텐츠 촬영해서 올려주시는거보다도 그냥 폰카 세워놓고 버너에다가 달걀후라이 부쳐서 소주한잔 하는걸 더 좋아할것 같아요. 뿌링클이었나 깐풍기였나 그 영상 중간에 저희한테 방학했냐며, 방학동안 볼 영상 유튜브에 쫙 올려놓을테니 방학동안 재밌게 보라며 무심하지만 기분좋은 말들 툭툭 던지던 그런 소프님 모습이 그립습니다. 하나씩 비워내시면서 얼른 밝은 소프님 모습 되찾으셔서 다시 예전처럼 굴지의 요리유튜버의 명성을 되찾읍시다!!!! 빠이팅!!!!",726개,2020. 4. 8.
개닝깊,옛날에 요리좀 하는형+자취밥 느낌이 좋았는데 스튜디오 잡고나서 부터 약간 핀트가 엇나간 느낌이 들었습니다. 예전처럼 잠옷바지를 입고 찡끗 하면서 나타나 스튜디오가 아닌 일반부엌에서 기깔나는 요리들 보여주세요,422개,2020. 4. 8.
이경민,개인적으로 아프리카 시절에 했던 아크릴박스에서 재료 3개 뽑아서 하던걸 가장 재밌게 봤던거 같아요,433개,2020. 4. 8.
ateliJINespaodecostureira,"언제부턴가 저도 영상 안보게 되었던거 같아요, 좀 특별한게없고 지루한 느낌이 들었어요, 전 거대한 미식가를 제일 재밌게 봤었는데, 언제부터인지 소프님의 밝은 에너지가 영상에서 좀 사라진것같은 느낌적인 느낌?? 좀 휴식이 필요하실수도 있을것 같아요, 다시 즐겁고 밝은 에너지가 느껴지는 영상으로 돌아와주세여!! 화이팅 입니당!!!",239개,2020. 4. 8.
뽁뽁,하이퀄리티로 할꺼 아니면 자취방스러웠던 예전이 좋음 / 요리하기전  서론이 너무 김 특히 라면종류 리뷰는 절반이상 넘겨버림 / 요리할때도 요새 인스타보니 빨리감기로 지루함 줄이는 추세임 요리컨텐츠는 말보다 음식배우고 따라할려는 사람들이 많은데 개선이 필요할듯 더보기란에 레시피도 적어주고 ~  화이팅~,96개,2020. 4. 8.
강성환,옛날 편안한 진짜 집에서 했을때가 분위기도 더 좋았어요 ㅜ,158개,2020. 4. 8.
TRUTHIM,스튜디오에 정감 안가는건 나만 그런게 아니였군,36개,2020. 4. 8.
정인,"저는 소프님 컨텐츠중 업소용을 가장 좋아했던 구독자입니다
한번도 업소용 제품을 구매해본적은 없지만 업소용영상은 대부분 챙겨봤습니다
신박하기도 하고 재밌었어요. 오늘은 이형이 이걸로 뭘 할까? 궁금했구요
영상 초반에 말씀하신 조회수에 대한 이야기는 저도 밖으로 내뱉은 적은 없지만 팬으로써 걱정해본적은 있습니다
소프님의 새로운 컨텐츠 기대할게요! 또 응원할게요~ 밝은 모습 보기 좋아요",255개,2020. 4. 8.
송이랜드,"킹크랩에 토맥사 말아먹던 그 시절이 그립네용,,",20개,2020. 4. 8.
킁킁이,"옛날 오피스텔? 같은곳 에서 탁트인 창문넘어 고속도로가 보이던 풍경과 요리한후에 먹는게 퇴근하고 보면서 무언가 녹아내리던 느낌이었는데 지금은 스튜디오에서 하시면서 무언가 막혀있는 느낌이었어요..

정말 아프리카 오래전부터 보았던 팬입니다.

업소용 게릴라 이벤트때에 소프님이 만들어주신 양파 장아찌도 정말 맛있게도 먹었고 먹방 대신 쿡방이라며 주변사람 에도 홍보 많이 했던 채널인데 

가게 정리하신 이후로 제일 맘이 아프네요...

소프님 늘 응원하고있습니다!",111개,2020. 4. 8.
채훈,"워낙 장기간 동안 영상을 만들어오셨고, 요리메뉴는 한정되어있고, 고민이 많으실거같아요... 캠핑컨텐츠가 인기가 좋다지만 매번 캠핑만 다닐수도 없는 노릇이고.. 갠적으로 소프님 리뷰 컨텐츠 되게 좋았습니다 화이팅!!",65개,2020. 4. 8.
WritingPaper,"소프님! 서론 길게 쓰자면 끝이없으니, 하늘색 수면바지 다시 입고! 영상의 속도감을 높이고! 잔망잔망한 모습이 그립읍니다. 그리고 몸 건강도 건강이지만 마음의 건강도 챙기세요. 컨텐츠 고민하시다가 번아웃 오실까 걱정입니다.",48개,2020. 4. 8.
maru,"유튜브 영상 올리는 분들이 하나같이 입을모아서 말하는게 인기가 갑자기 확 떨어졌다가 갑자기 인기가 확 올라가고 그러는게 유튜브라고 하더라구요. 

조회수가 떨어졌다고 너무 상심하지 마시고 신인으로 돌아갔다는 마인드로 꾸준히 하시면 언젠가 다시 예전과 같은 결과가 나오리라 믿습니다.",220개,2020. 4. 8.
샘물맑은,형 그냥 스튜디오 팔고 그냥 옛날처럼 집에서하자,14개,2020. 4. 8.
박재욱,요즘 영상들은 대부분 속도가 빠른영상이 대부분인데 소프님 영상은 너무 느려서 상대적으로 재미가 없어보여서 영상이 나와도 안보는게 대부분이었어요... 다시돌아오실때에는 변화된 모습 기대할게요 !!,63개,2020. 4. 8.
잉잉오오,형 처갓집양념에 황금올리브 찍을때부터 봤어.. 항상 응원할게 힘내줘..ㅠㅜ,81개,2020. 4. 8.
MAPOVICSTAR,"집에서 소소하게 요리해서 먹고, 자취요리, 대식가 컨텐츠, 친구급불러서 술마시기 요런거 좋았었어요! 다시 해주셨으면",37개,2020. 4. 8.
엄마는외계인,표정이 안좋아보이셔서 조금 걱정되기도 하지만 언제나 늘 응원할게요!!,27개,2020. 4. 8.
오티워니,운동!!! 왜 복권을 계속 감춤니까!!! 건강히 먹방합시다!!! 라면컨텐츠는 좋긴한데~ 소프님 건강을 해치니!! 운동운동!!,12개,2020. 4. 8.
강후리,"그러네요...구독잔데 채널의 존재를 까먹고있었네요.. 요즘엔 홈에도 소프님 영상도 안뜨고 유튜브가 추천도 안해주네요.
갑자기 기억나서 검색해서 들어와봤는데 이런 고충이 있었군요.. 전그냥 옛날 집부엌에서 뿌링클 따라만들던때가 편안하고 좋았던 느낌이네요.! 힘내세요 소프님",9개,2020. 4. 8.
jjjjjjs,많은 댓글들이 말하듯이 저도 집이 아닌 스튜디오에서 방송하기 시작할 때부터 안보게 된 거 같아요,10개,2020. 4. 8.
LEOYun,솔직히 영상 좀길어 형 5분정도로 엑기스만 뽑아줬으면 좋겠음. 그리고 좀더 다양한 리뷰 컨텐츠좀 해줬으면 좋겠음. 요리 컨텐츠도 좋지만 계속 보기에는 그냥 그런것같음,22개,2020. 4. 8.
대다나다,"아프리카때부터 봐왔습니다. 제 개인적으로는 거대한미식가가 정말정말 재밌었습니다. 코로나가 괜찮아지면 거대한미식가2를 하시는건 어떠신가요? 이번에는 서울,경기지역뿐만아니라 국내 전지역에 걸쳐서 맛집과 먹거리를 소개해주세요! 그러면 저희는 맛있는먹거리를 소프님의 먹방과 함께 재밌게 볼 수있고,  자연스럽게 코로나로 인해 어려워진 자영업자분들에게 힘이 될 수도 있겠다고 생각이 들었습니다. 단지 제 개인적인 생각입니다.  항상 힘내세요 소프님!! 응원합니다!",172개,2020. 4. 8.
ButterToast,나아가기 위한 쉼표찍기,26개,2020. 4. 8.
MOMO,수많은댓글에 묻히겠지만 아주옛날 어떤사람인지도모를남자가 혼자 히히거리면서 자기맘대로 재밌게 요리하는 방송이엿는데 이제는 광고 뿐이네요 그때가 그립네요,7개,2020. 4. 8.
구독,고인물에서 벗어나야지요,9개,2020. 4. 8.
멍멍냥,그냥 자취생 시리즈 집밥 리뷰 이런것만 해도 조회수 올라올듯..스튜디오 고집만 버리면 될거같은데 그걸 못버리시네..그리구 편집자 진작에 쳐냈어야했음..,8개,2020. 4. 8.
모범,영상이 대체적으로 소리가 다 작은편인데 이것도 해결하셨으면 좋겠네요 왠만한영상들은 다 음량 두칸으로만해도 다 잘들리는데 소프님 영상만 4~5칸정도로 해야 잘들려요,13개,2020. 4. 8.
한주형,형.. 형 채널 진짜 오래전부터 봐왔는데 형한테 너무너무 미안하지만 형은 막 호텔 퀄에 막 에이급 감성이 아니였어여ㅠㅠ 막 형은 막 동네형느낌에 막 호텔 케이크 따라하기 막 이러고 막 약간 편하고 우리끼리 아는 그런 느낌이였어요ㅠㅠ 옛날 형 보고싶어요ㅠㅠ 그래도 저는 형 컨탠츠 안넘기고 다봣다요!,7개,2020. 4. 8.
KINGKA,스튜디오 잡지말고 편하게 집 부엌에서 해줘 형 편한 분위기가 좋아 우리는,3개,2020. 4. 8.
JihoKim,1:05 같이 운동하자 형,14개,2020. 4. 8.
강은진,"원래 댓글을 잘 안남기는데 도움이 될까 싶어 지극히 '개인적인' 생각 한번 써봅니다
제가 재밌게 봤던 컨텐츠는 진짜한끼(자취요리), 업소용요리, 쓸고라면 이였어요 

구독자들이 정말 따라하기 좋은 자취요리가 아니면 사실 평범한 요리영상은 안보게 되는거같아요 그런건 다른 유튜버들도 많이 올리니까요
그리고 아예 재미로 보는 쓸고라면, 업소용은 확실히 재미를 살려서 하는거니까 따라하는거 보다는 대리만족 느낌이 커서 보는거 같아요 엄청 많이 드시는 먹방 유튜버들 처럼요

이런식으로 뭔가 따라할수있거나 확실히 대리만족만 느낄 수 있는 컨텐츠가 인기가 많을거같아요 전 캠핑은 잘 안봤지만 여러 시청자 분들이 대리만족 느낄 수 있는 걸 좋아하는 것처럼요

그리고 영상의 속도. 확실히 요즘에 ㅊ이라는 요리 유튜버도 영상속도가 인기의 비결이라고 해도 과언이 아니니까요 먹는 부분은 괜찮은거 같은데 조리에서 굳이 필요없는 장면은 과감히 자르는것도 좋을것 같아요(타 유투버 언급 죄송합니다)

그리고 정말 개인적인 생각인데 영상의 첫인상이 썸네일 이라고 생각하는데 소프님이 추구하는 썸네일은 항상 음식을 들고 만든 직후 카메라 앞에 들이대는것이 대부분이더라고요 개인적으로 음식의 색감이나 텍스쳐가 더 잘보이게 밝고 화사하게 음식사진을 따로 찍어 먹음직스럽게 올리면 좋지 않을까 의견드립니다 썸네일은 개인적으로 깔끔하면 더 보고싶어지는 영상이 될거같아요",12개,2020. 4. 8.
혜민김,지루해졌어요 진짜.......,3개,2020. 4. 8.
