닉네임,댓글,좋아요수,날짜
크리스마스쿠키,사실 뭔가 집에서 스튜디오로 옮기시면서 편안한 모습보다 일하는 느낌이 들었던거 같아요! 소프님 특유의 에너지가 줄어든 느낌인데 예전의 에너지 보고싶습니다!!,6개,2020. 4. 8.
lyhkim,옛날처럼 아크릴박스에 asmr베이킹 그런거 좋았는데,11개,2020. 4. 8.
YouTube사이다,5년째 구독 중인 구독자 입니다.. ㅠㅠ 저도 옛날 방식이 그리워요 소프님만의 매력이 그리워요.. 제일 재밌게 봤던 타조알요리 업소용 스팸요리 같은 ... 이런게 보고싶어요ㅠㅠ,1개,2020. 4. 8.
OhTAKU,이어폰으로 듣기에 소리가 너무 작아용 ㅠㅠ,9개,2020. 4. 8.
JuliaKim,스튜디오 열심 준비하셨는데 너무 안타까운건 그 옛날 작은 자취방에서 잠옷바지 입구 요리해서 드시던 옆집총각 이미지가 더 친근해서 그런가 그때의 모든게 지금보다 더 재미있었어요~,6개,2020. 4. 8.
김현주,일단 이번 영상만 봐도 신경을 덜 쓰신거같아요 영상 소리가 너무 작아요.,3개,2020. 4. 8.
바디,"그냥 개인적인 이유로.
모든 컨텐츠의 도입부가 많이 길다고 느껴졌어요. 
빨리빨리 핵심만 보여주는게 트랜드가 되가는 시대인데 소프님꺼는 영상 대비 피로도가 유독 높은거같아요.",3개,2020. 4. 8.
,연예인도 이미지 소비 많이 하면 인기가 떨어지듯 자연스러운 현상 같네요. 엄청 오래하셨는데 컨텐츠는 한정 되어 있으니.. 반전해서 조회수 늘어나기는 정말 쉽지 않을 듯..,12개,2020. 4. 8.
꼴초애니메이션,집  부엌에서 요리하면서 대화하고 요리과정보여주고 하는 예전방식이 더 좋은거같아요 스튜디오에서보다.....,2개,2020. 4. 8.
이승희,목소리가왤케작게들리지?나만그런가??,5개,2020. 4. 8.
이진호,예전 집에서 음식 리뷰했을때가 좋았음,4개,2020. 4. 8.
문논리,옛날에는 자취의왕 소프 느낌이였는데 이제는 자취와는 거리가 많이 늘어진 느낌이기도 해요...,1개,2020. 4. 8.
따흑흑,지는 별이지,3개,2020. 4. 8.
야옹야옹,"다수의 댓글이 업소용이나 예전 스튜디오를 더 좋아하시는거 같은데 그럴수도 있겠지만 어느 정도는 핑계라고 봐요
만약 최근 영상이 더 재미가 있었더라면 그런 말이 덜 나오지 않았을까요 


저는 변화가 반드시 필요하다고 생각하는지라 스튜디오 바뀌고 그런거 자체에는 크게 문제가 없었는데 아쉬웠던 점은 바뀌는 과정에서 도움 주신 분들에게 같이 식사 하시는 건 좋은데
그걸 뭐랄까 제가 봐야만 하는 이유가 있나 싶더라구요
리뷰나 솔로 한끼도 마찬가지로  



제가 생각하는 가장 큰 문제점은 이제는 요리나 리뷰 영상이 엄청 많아져서 
선택지가 굉장히 많아졌는데 그 중에서 소프님 영상을 볼 메리트가 과연 얼마나 있을까 


최근 트렌드가 어느정도 재미나 신선함이 반드시 있어야 되는거같아요
업소용이 왜 재밌어나 돌아보니 일반인이 그 많은 식재료를 한번에 쓸 기회가 거의 없자나요
그래서 소프님이 대신 여러가지 해주시는걸 보고 흥미를 느끼지 않았나 저는 그렇게 생각합니다


소프님이 지향하시는 바가 정말로 조회수나 댓글 상관없이 좋은 요리소개, 소프님만의 방식소개라면 저는 지금도 괜찮다고 보지만
어느정도 꾸준한 성장세를 바란다면 소프님이 원하는 영상이 아니라 시청자들이 뭘 원하는지 고민해보시면 좋을거같아요
그렇다고 다수의 시청자의 말에 휘둘리라는게 아니고 뭘해야 다수의 시청자들이 꾸준히 볼만할 이유가 있을지


뭐가 됐든 소프님이 원하시는 바 이루셨으면 좋겠습니다",12개,2020. 4. 8.
갈릭보끔밥,"형같은 느낌이 사라짐..
너무 업으로 하는 느낌이 커짐 ㅠ",1개,2020. 4. 8.
AreumKim,소프 스타일 다이어트 음식으로~~같이 살빼요 ~~~,1개,2020. 4. 8.
SoniDaes,"저는 소프님과 동년배이고, 꽤 오랜동안 동영상을 지켜보며 즐거움을 함께했던 구독자입니다.
그어떤 첨언을 하더라도, 참견이자 꼰대같은 소리지만 이번 공지영상에 대한 피드백을 딱 한가지만 드리려고 합니다.
'새로운 것', '다양한 것'. 컨텐츠라는 말 앞에 항상 이런 부분의 갈구와 갈망을 표현하시는데.
그러한 부분에 너무 압박받고 있지 않나 싶습니다.
""새롭지 않아도 됩니다.""
꼭 새롭고 다양해야만이 소프님의 진가가 드러나는 것은 아닙니다.
소프는 정제된 레시피와, 대단한 플레이팅, 우리가 몰랐던 요리의 세계를 보여주는 사람이 아니라.
정말 친근한, 나도 해먹을 수 있고, 나도 저 맛 느껴봤던 것 같은 요리를 쉽게 풀어내주는.. 그런 친근함이 주무기이고, 단 한번만 보지 않은 소프님이지만, 괜스레 가까움이 있었습니다.
업소용 컨텐츠, 캠핑, 진자한끼, 쓸고라면... 등등(개인적으론 쓸고라면과 업소용 요리는 몇번을 재생했는지 기억도 안날정도로 재밌었습니다. 대리만족이죠)
이미도 너무도 다양해요. 그리고 재밌었고요. 
또한 확신합니다. 앞으로도 즐겁고 재밌는 컨텐츠로 해나가는 크리에이터가 되실 것을. 그리고 저 역시 구독자로 재밌게 볼 것임을 약속합니다.
그러니 압박 받지말고, 진짜 하고싶고 정말 즐거운 컨텐츠 하세요. 응원합니다.",45개,2020. 4. 8.
주현성,저도 소프님 옛날의 꾸임없는 요리영상으로 요리가 좋아졌어요,2개,2020. 4. 8.
삐쭉빼쭉,헐 소프님... 저 진짜 소프님 채널 즐겨봤는데 어느순간 피드에 안뜨더라구요? 그래서 저도 모르는새 안보고있었네요;; 이게 편집이나 컨텐츠 문제도 있지만 유튜브 알고리즘 문제도 어느정도 있는것같아요ㅠㅠ 저 맨날 봤었는데 어느시점부터 안보이다가 딱 이 영상이 떴네요..ㅠ 저도 앞으로 다시 잘 ㄹ챙겨볼게요!! 화아튕,10개,2020. 4. 8.
JudyS,긴 시간 컨텐츠를 만들어 오시면서 이제 어떤 길로 가야할 지 모르겠다는 고민보다는 아직 하고싶은게 많아서 많은 일이 밀려있다는 이야기가 반갑게 들리네요. 재밌고 유익한 영상 늘 감사해요~ 계속 응원하겠습니다 :),6개,2020. 4. 8.
EduardoSalamanca,백종원은 못 이김...ㅠㅠ,1개,2020. 4. 8.
채널,"옛날 영상보면 좀더 재밌는건 사실이야ㅜㅜ
배달음식 시켜서 재구성하는것도 재미있고
업소용도 재미있고 쓸고라면도 재미있고 
아크릴박스도 재미있고 초심에 했던 컨텐츠 다시 살려보자",9개,2020. 4. 8.
MSY,그러고보니..최근 조회수가 구독자수에 비해 적긴 하구나.. 진짜 유튜브는 구독자수가 다가 아닌거같긴 하다..,1개,2020. 4. 8.
태민,토맥사 만들던 시절이 재밋고 좋앗음,1개,2020. 4. 8.
토끼토끼,"이런 영상, 공지 올라온게 한편으로는 반갑기도 해요
오래 전부터 소프님 알고 봐왔는데 저 역시도 최근엔 영상에 흥미가 생기지 않는게 대부분이더라구요 
그래서 이 영상이, 지금의 소프님이 반가워요 고맙구요
천천히여도 좋으니 기대할게요!",5개,2020. 4. 8.
모이,재료 뽑아서 하는것도 좋지만 혼자서 하시는거니까 실패하는 영상같은걸 보여주세요 너무 잘하시는것도 Tv프로그램 스럽...,1개,2020. 4. 8.
황지환,"제가 처음 소프님 영상 본게 하와이안 피자 요리 영상 이었는데 요즘은 그런식으로 노토킹으로 요리를 정밀하게 촬영한 영상이 없더라구요(아님 제가 못본걸수도 있고) 그래서 이런류의 요리 영상 마니 올려주시면 좋겠습니다.
그리고 요즘은 영상 길이도 짦게 하면 가볍게 보기 좋아서 사람들도 많이 볼것같아요. 제 개인적인 의견입니다.

소프님 정말로 응원하구요 사랑합니다.
제가 어렸을때 처음으로 구독한 요리채널이라서 그런지 더 애착이 갑니다
진짜로 힘내시고 다시 흥하셨으면 좋겠어요 ㅎㅎ",18개,2020. 4. 8.
김현수,진짜 그냥 예전에 아프리카tv다시보기로 보는 요리컨텐츠가 가장 재밌었어요,1개,2020. 4. 8.
스윗국,집에서 파자마 입으시고 쿡방 하시던 그 그림 지금 사실 조금 그립습니다,1개,2020. 4. 8.
오유진,소프님 코로나끝나면 다이어트음식만들고 헬스장 가는 프로그램하시면 좋을듯 옛날에 엄청 잘생긴 오빠가 티비에 나와서 bj하면서 나중에 레스토랑 열고싶다했을때 멋있었는데 요즘엔 아저씨느낌,3개,2020. 4. 8.
캐르삐,조회수 너무안나와......ㅠㅠ,9개,2020. 4. 8.
훔바,당시에는 대체재가 없었고 지금은 훨씬 더 좋은 상위호환들이 많기때문임.,1개,2020. 4. 8.
iron,"아프리카로 보다가 BBQ치킨 쿠폰으로 시켜먹으면 다른지 확인하는 영상보고 구독했던 것 같아요.
'맛의 결정적인 차이가 있습니다.공짜라서 더맛있습니다. 하하하하하' 이때 재밌어서 구독했거든요.

조회수 부진원인에 대한 제 의견은
1. 방송스타일(텐션)
2. 편집스타일
정도의 문제가 있다고 생각합니다. 컨텐츠는 별로 큰문제는 아니라고 생각하구요.


일단 옛날에 제가 자주 봤던 컨텐츠들은
1. 자취요리(재미라기보단 유용함)
2. 거대한미식가(B급감성+어색한연기의 순수재미)
3. 각종 신메뉴리뷰(재미라기보단 유용함)
4. 캠핑요리(힐링+일상에서 조용하게 대화하는 느낌)
정도가 있었습니다.
근데 제가 즐겨보는 컨텐츠들 중에서도 거대한미식가 빼고 순수하게 재미를 주는 컨텐츠는 없었던 것 같아요. 하지만 거대한미식가 처럼 순수재미를 주는 컨텐츠가 베스트긴 해도 그런 컨텐츠로만 모든 영상을 구성할 순 없잖아요? 자주 영상이 올라오려면 결국 제일 많이 찍는건 요리방송 + 신메뉴 리뷰방송이 주가 될거구요.


근데 옛날에는 요리유튜버가 사실상 거의 없었기 떄문에 일반인들도 따라할 수 있는 조리법에 대한 정보영상, 신제품리뷰만 해도 조회수가 잘 나왔지만 이제는 많은 요리유튜버, 정보유튜버들이 생겼고 일반인이 따라할 수 있는 다양한 레시피 유튜브에 널려있고 신제품이 나오면 여러 유튜버들의 리뷰들이 쏟아져 나옵니다. 그러자 요즘의 요리유튜버들은 이제 영상에 정보뿐만아니라 재미를 넣기 시작했어요. 그리고 재밌게 만들어주는게 개인의 텐션이랑 드립 그리고 재미있는 편집스타일이라고 생각해요. 개인의 텐션과 재미있는 편집스타일만 완성된다면 요리와 전혀 관련없는 아무런 일상방송을 찍더라도 정말 재밌게 나올 수가 있다고 생각해요.


여러 사람들이  '스튜디오라서 전문적인 느낌으로 바뀌었다, 옛날의 날것의 느낌이 필요하다, 친숙도가 떨어졌다, 옛날 동네형 같은 이미지가 없어졌다' 여러 말이 있는데, 그냥 옛날의 젊은소프감성에 비해 텐션이 낮아졌고 그로인해 기본 라이브 방송 재미가 떨어졌는데 편집스타일도 컷편집만 하니 재미가 더 없어지고 결국 유튜브 편집 영상에서 빵터지는 장면이 없으니 영상을 안보게 되는 것 같아요.



요리유튜버도 이제 정보전달만이 목적이 아니라고 생각해요. 요리를 '웃기게' 알려주는 사람, 신제품을 '웃기게' 리뷰하는 사람이 되야 하는거죠. 타 유튜버들 처럼 광대가 되어야한다고 생각해요. 물론 모든영상에서 항상 웃길 필요는 없죠. 제가 캠핑요리 영상을 즐겨보면서 힐링했는데 캠핑요리같은 영상의 편집은 오히려 지금같이 잔잔하게 컷편집만하는게 좋다고 생각합니다. 근데 이런 영상은 기본영상들의 조회수가 잘 나와서 기반이 다져졌을 때 컨텐츠의 다양화를 위해 하는 마이너하고 취향이 갈리는 영상이고 대중을 잡아서 조회수를 높이려면 그냥 영상과 편집이 웃기게 나올 수 있는 컨텐츠를 해야한다고 생각합니다. 근데 그런 컨텐츠는 요리나 제품리뷰 일상방송에서 충분히 뽑아 낼 수 있구요.


개인적으로 여러 요리유튜버들 많이 언급됐는데 '광대가 되어야한다'는 점에서는 '승우아빠'채널이 딱 10대부터 30대까지 시청자들 공략하기에 재미요소가 좋아서 추천드리고 싶습니다.",10개,2020. 4. 8.
MichelleBaik,"Keep it up, I love your video and I love your cooking style. No matter how you cook, what you cook, I cheer you :-) and thank you for eng sub.",1개,2020. 4. 8.
BDK,처음시작되는 분홍화면에 sof로고나오는거 없애고 역동적으로 바꾸시면어떨지. 너무조용하고 정적이게 시작되어서 영상이 더 심심하게느껴져요,3개,2020. 4. 8.
최우혁,아니형 오랬만에 왔는데 왜이리 벌크업이되있어 진짜 깜짝놀랐네,1개,2020. 4. 8.
콥등이,예전엔 재미있었는데 확실히 이런 말 하기 죄송하지만 뭔가 좀 루즈해진 느낌 ㅠㅠㅠ 응원하겠습니다 소프님!,2개,2020. 4. 8.
송가람,구독자가 100만명이 넘는데 조회수는 10만도 안되는 이유가 있음 ㅇㅇ,2개,2020. 4. 8.
지밍,"영상이 너무 길고 매력포인트가 없어요 ㅠㅠ 참pd, 맛상무, 칩, 승우아빠 이분들이 잘되는 포인트가 분명있을거에요
그치만 본인만에 뚝심이있어야 할거같아요 모든 사람의 입맛에 다 맞을순 없어요",14개,2020. 4. 8.
HYUNSUYUN,"저는 소프님 자체가 좋습니다.
응원하면서 기다릴게요!!",11개,2020. 4. 8.
뀨까,공지라고해서 오프닝안할까봐 두근두근했음..  ㅎ,1개,2020. 4. 8.
오랜지,사실 조회수가 안나오는게 문제가 아니라 수익이 충분한가가 문제죠 거의 다 적자인거 같아서 걱정이죠,1개,2020. 4. 8.
JamieSEO,공지라고 해서 놀랜마음에 후딱 들어왔네 ㅠㅠ 꿋꿋하게 기다리고 있을테니 건강해져서 돌아와^^ 기다릴께요,13개,2020. 4. 8.
발리,"떌기식빵케이크에 해바라기 씨 박을 때부터 봣읍니다,, 정말 응원하고 있어요 빨리 돌아오십시오 형님",1개,2020. 4. 8.
강지훈,형 화이팅 진짜 힘냈으면 좋겠어 재밋는 영상들 기대할게!!!,0개,2020. 4. 8.
JessyLee,"오래전엔 나만아는 맛있는 백반집이였는데, 
이젠 체인점이 되버린느낌같아요",1개,2020. 4. 8.
김현자,오랜만에 봐서 반갑~☺ 좋은 모습으로 돌아온다는데 기다려야죵!!😁,1개,2020. 4. 8.
따띠짱,"집에서 요리하는 컨텐츠가 좋았어요 
요리하고 드시고 이야기 편하게하는거..",1개,2020. 4. 8.
김범준,"소프님 저는 예전에 올리시던 ASMR컨텐츠도 되게 재밌게봤었습니다
아무말없이 요리하는 과정하나하나 되게 재밌게보다가 요리 마무리되고 결과물을 (화면속에선 안보이지만) 맛있게 드시는것도 좋았어요
그리고 시청자들하고 소통하고 웃으면서 요리하시는게 소프님도 구독자들도 전부 힘나고 좋을거 같습니당
항상 힘내세요 소프님!",2개,2020. 4. 8.
섭이,일단 살빼서 예전 컨셉으로 돌아가시는게 좋을거같음 소프 초창기 팬으로서 날씬한 잘생긴 소프가  그립습니다,1개,2020. 4. 8.
BSK,도대체 왜 스튜디오 스튜디오에 목 메는지 모르겠습니다. 조회수 안 나오는 문제를 왜 스튜디오. 장비 에서 찾으시는지 모르겠습니다,5개,2020. 4. 8.
스포뚜라이뚜,"고민하긴하셔야 겠네요 
조회수들보니 대충평균내면5~6만",9개,2020. 4. 8.
yw예웡,소프님 유튭으로 보니 반갑네여 키키❤️ 구독 누르고 갑니다 화이팅!,0개,2020. 4. 8.
신원호,아 생방아니냉,2개,2020. 4. 8.
권선영,항상 응원합니다👏🏼👏🏼👏🏼,0개,2020. 4. 8.
프레스토,저도 예전이 훨씬 좋아요~,1개,2020. 4. 8.
dwR,동네친한형 느낌이었는데 분위기가 예전과달리 다가가기가 힘들어진 느낌일라나,1개,2020. 4. 8.
스그나이,1세대들은 진작에 끝났음ㅜ,7개,2020. 4. 8.
오석주,살짝 공중파 스러워졋다해야하나,1개,2020. 4. 8.
NaemoSuper,소리가 너무작아요오,1개,2020. 4. 8.
진득한곰,캠핑 컨텐츠할 때 글램핑장 가보는 것도 좋을 것 같아요!,0개,2020. 4. 8.
1326한다윤,소리가 너무 작네요,1개,2020. 4. 8.
29,아프리카부터 봤어요ㅠㅠㅠㅠㅠㅠㅠㅠㅠ 정말 잘 되셨으면 좋겠습니다ㅠㅠㅠㅠㅠ 언제나 재미있게 보고있어요 힘내시고 건강하세요ㅠㅠㅠ!!!!!,0개,2020. 4. 8.
JPKING,유명 맛집 탐방하면서 먹방도 찍고~ 그 음식들을 간편히 만들 수 있는 레시피 공유 컨텐츠도 언제 부탁드립니다~~!!,1개,2020. 4. 8.
진현천,저는 거대한 미식가를 통해서 소프님 구독하게 되었어요! 소소하게 술 한잔 하시면서 맛있는 음식 드시는게 너무 인간적이고 좋았고요 재밌었어요! 부담가지지마시고 뭐든 잘 하실수 있을거예요 응원합니다!!,0개,2020. 4. 8.
정CD,인트로 시그니쳐 포즈는 그대로 해주세요 중독되염,1개,2020. 4. 8.
youngjunyun,"옛날 스타일을 지키자고 하시는 분들 있는데, 큰 변화가 필요하다고 생각됩니다. 저도 14년도 부터 소프님 영상 봤지만 그때랑 비교해서 지금의 쿡방의 파이가 많이 커졌습니다.",2개,2020. 4. 8.
포카칩,진자한끼 재밌었는데 업소용이랑..,1개,2020. 4. 8.
낭만신디중국어중국vlog,"공지라고 하셔가지구 긴장하며 영상 봅니다. 
직접 편집을요? 우와~ 
언제나 응원합니다. 
피로도? 없어요! ^^ 
꾸준히 계속 보고싶오요~ 소프님^^*",7개,2020. 4. 8.
이종현,어 이형 마스터 셰프 코리아 나왔던 형님 아닌가요...?,1개,2020. 4. 8.
Jeonggaklol,"헐 그러네? 100만 유튜버인데 조회수가 다 만단위네 ㄷㄷ
나는 항상 올라오자마자 봐서 몰랐었는데 ㄷ;",0개,2020. 4. 8.
딸긔곤듕,"소프님 예전부터 봤는데 컨텐츠가 비슷하고 (특히 라면)
요즘 유튜브 트렌드에 비해서 편집이 재밌다기보단 너무 심플? 해서 그런 것 같아요 어떻게 보면 루즈한 느낌 ㅠ
그래서 영상도 너무 길고 재미없단 생각이 들더라구요 짜파구리 하나 끓이는데 17분이 걸리구.. 보긴 보는데 반 이상은 넘기면서 보는것같아요ㅠㅠ
영상 길이를 7분에서 10분정도로 줄이고 썸네일도 어느정도 자극적이게 바꾸시면 조회수 더 잘나오실거에요
그리고 토맥사같은 소프님만의 메뉴도 하나 유행시키고 예전느낌도 살리되 요즘 트렌드를 따라가시는 방향으로 하면 더 좋을 것 같아요!!
응원할게요! 힘내세요 ㅎㅎ",1개,2020. 4. 8.
양현경,항상 열심히 하고 매너있으신 소프님입니다 다른 요리컨텐츠 하시는 유튜버분들보다 실력도 있으시고 영상 볼때 누구보다 더 신경쓰고 노력하시는 분이라고 생각합니다 소프님으로 인해 지금 요리사라는 꿈도 가지고 있습니다 요리에 관한 지식도 많이 얻었고요 소프님은 어떤일을 하셔도 인정받으실거라 믿습니다 항상 응원하고 있겠습니다 몸조심하시길바래요!,1개,2020. 4. 8.
상큼키위,화이팅힘내세여!캠핑에와인재밌게봤습니다,0개,2020. 4. 8.
민제이,"즐겁게 지내신다니 다행입니다^^ 걱정했어요 ㅠ
소프님 항상 응원하고요  저도 즐겁게 기대하며 기다릴께요~~",0개,2020. 4. 8.
molla,전 소프님 윙크 만 봐도 ㅋㅋ 넘 좋아요,0개,2020. 4. 8.
이승현,ㅇㅅㅇ,1개,2020. 4. 8.
대장나무,이전부터 난 형 자체가 재밌어서 봤었어 자기계발하는 모습 보고 동기부여 되네 고마워  ㅠㅠ,7개,2020. 4. 8.
장미,업소용 햐주세요 ㅠㅠㅠㅠ,0개,2020. 4. 8.
갓귤탱귤,"힘을내요 소프파워💪❤
조회수가안나오는거 오늘첨 안사실..그냥 계속 보고잇어서몰랏더니!
화이팅입니다 기다리고잇을게오🙏",0개,2020. 4. 8.
쿠키키친CookyKitchen,소프님 화이팅입니다~! 원래 좋아하는 일을 위해 공부할 때가 제일 집중도가 높더라구요~ 모쪼록 전화위복이 되어서 더 재미있는 채널 소프가 될시길 기대할게요! ^^,0개,2020. 4. 8.
지원박,"형 유튜브 보면서 처음 요리에 관심을 가지게 됐습니다. 마치 유튜브계의 백종원?ㅎㅎ
형 힘내시고 건강해져서 돌아와요~~♡♡",10개,2020. 4. 8.
이가은,"일단..예전처럼 살을 조금만 빼주세요..
그 황금올리브 bbq치킨 드실때 소프님이 아른아른 거립니다...",1개,2020. 4. 8.
김형탁,전체알람 다시 켰습니다,1개,2020. 4. 8.
구독하라안하면김정은동지,이분 양팡채널에 수원 갈비 천왕에 요리쌤으로 나왔던것같은데???,1개,2020. 4. 8.
