닉네임,댓글,좋아요수,날짜
강수희,초반이나 마무리에 재료 자막으로 들어가면 좋을꺼 같아요 그리고 소프님 드시는 부분 더 보고 싶어요!,6개,2020. 5. 20.
NaemoSuper,승우아빠...,1개,2020. 5. 20.
석끼시대TheAgeofGourmetCooking,공개 된건가요??,0개,2020. 5. 20.
샘앤맥스,호박으로 꽃게를 내리치니 소분되는 부분 아이디어 좋네요 ㅎ 🦀 지난번에 이어서 추억이 서린 음식이군요. 새 컨텐츠로 더 많은 사랑 받으시길 바랍니다. 👍❤,3개,2020. 5. 20.
델리지니,소프님 기다렸어요 ㅋㅋ 꽃게탕 너무 맛있겠다 ~~ 당장 꽃게 사러 시장 가야 하나요 ㅜㅜ 너무 좋아요^^ 잘봤습니다!!! 영상이 짧다보니 2-3번  여러번 보게 되네요 묘한 매력이네요 ㅋㅋㅋ또 보러 올거예요 ㅋㅋ,4개,2020. 5. 20.
너구리,아아아 🦀 소프님 꽃게찜 먹방 참 재밋게 봤었는데. 오늘은 꽃게탕이네요~~ 게장종류말고 생물꽃게를 먹은지 진짜 오래된거같아요. 이거보니 저도 오늘 탕종류가 너무 땡기네요~! 영상 잘 보고 가요.,6개,2020. 5. 20.
정보스,아아아아아아아ㅠㅠㅠㅠ 꽃게탕 ..ㅠㅠㅠㅠㅠㅠㅠㅠㅠㅠ 내가 꽃게탕을 만들어 먹고싶게 만들다니 ㅠㅠㅠㅠ 진짜 너무 맛있겠다 ............,2개,2020. 5. 20.
훔바,형 힘내,0개,2020. 5. 20.
홍살,"형 이런 유튜브 감성의 영상도 좋지만 인방갬성 듬뿍담긴 라이브영상 조금 편집한 영상도 좋아 ㅜㅜ 둘다 부탁드리면 무리겠조?






업소용도 보고시푼데",2개,2020. 5. 20.
캐럿CR,소프형님 항상 매년 제철꽃게를 리뷰하고 모든 음식중에 가장좋아하는 음식이 갑각류쪽이란것도 알고있고 청이 한가지 있습니다. 크레이 피쉬 리뷰 가능한가요? 갑각류 요리 장인 소프형님(박준하)형님께서 갑각류에 환장하는 저와 많은 사람들에게 크레이 피쉬 리뷰를 해주시면 좋겠습니다. 항상 만수무강하세욥!!!                               (버터장조림 출시하고 전력으로 구매했는데 아직도 그맛을 잊을수가 없습니다. 한정판이라면 추가계획이 없는지 판다면 어디에 파는지 알려주실 수 있나요?),3개,2020. 5. 20.
너구리,5:53 🤤🤤🤤,9개,2020. 5. 20.
dragonkim,된장이 무슨 된장이죠?,0개,2020. 5. 20.
이도형,형 진짜 댓글다보고 댓글에서 말한 방법들 해주고 있구나!! 형 항상 응원해!!,1개,2020. 5. 20.
Neveah,소프님ㅠㅠ 오늘 영상 너무 좋아용💕💕💕,4개,2020. 5. 20.
KyoungCho,힘내요 소프~ 오늘도 영상 올리느라 수고 많이 했어요,3개,2020. 5. 20.
럭셔리주접,"제가 대학 신입생 때부터 아프리카에서 소프님 방송 봤으니까 2012년부터 본 것 같네요...완전 초대박팬 이런건 아니었지만 그래도 지난 몇달간 침체기에 빠지시는 모습 보면서 안타까웠습니다
이번 위기도 잘 극복하셔서 승승장구하시길 기원합니다",0개,2020. 5. 20.
서봉님,호박방망이ㅋㄲㅋㅋㅋ너무웃겨요 호방망이,3개,2020. 5. 20.
아하,헐 꽃게탕 메뉴선정 미쳤어ㅜㅜ 소프님 요리솜씨에 반하고 목소리에 또 반했어요 ㅋㅋㅋㅋㅋㅋㅋㅋ,1개,2020. 5. 20.
우주최강또자,집밥 다큐같아 ㅋㅋㅋㅋㅋㅋㅋㅋㅋㅋㅋㅋㅋㅋㅋㅋㅋㅋㅋㅋㅋㅋ,1개,2020. 5. 20.
한맥,형 영상 퀄리티 엄청 좋당,4개,2020. 5. 20.
여성수,영상느낌 너무좋다 진짜..,2개,2020. 5. 20.
HR,미띤,0개,2020. 5. 20.
날름,아아아... 진짜 너무.. 너무너무 맛있겠다.... 아악... 아아악아ㅏ아구ㅜㅜㅜㅜㅠㅠㅠ 내일 꽃게 세마리 정도 사와서 가족끼리 소프님 레시피대로 꽃게탕 따끈하게 저녁으로 만들어 먹어야겠어요☺️✨,3개,2020. 5. 20.
김보로미,"꽃게탕!! 이제 꽃게 시즌이 지나가고 있지만ㅋㅋ 오늘 만나러갑니다★

나랏님이 사주시겠죠?",0개,2020. 5. 20.
정옐린,꽃게가 춤을 추네요 ㅋㅋ 꿀꺽 먹고싶네요,2개,2020. 5. 20.
이기영,"소프님, 진짜 너무 맛있겠어요.
2번째 영상이 끛게라니 너무 좋은 것.
건강하세요",0개,2020. 5. 20.
YuanKIM,진짜 언젠가부터 왜 추천영상에 소프님 영상이 안뜨는거죠...;;; 그나저나 핀마이크 어디꺼 쓰시는지 여쭤봐도 될까요ㅜㅠ 무선 마이크는 너무 비싸서...,1개,2020. 5. 20.
이용,꽃게 잘 안먹는데 살 보니까 먹고싶어지네요ㅎㅎ 영상 깔끔하고 길이도 적당해서 넘 좋아요!👍,1개,2020. 5. 20.
권순익,"형님 진짜 이런 느낌 너무 좋아요 ㅠㅠ
계속 만들어주세요!!",2개,2020. 5. 20.
피망Pepper,박수 천번만번 보내드립니다 수고많으셨어요 소프님!ㅎㅎㅎ 영상 계속 보게되네요 나중에 이거보고 따라도 만들것같아요!! 라디오 듣는것같기도하고 좋아요❣️,0개,2020. 5. 20.
포포,영상 너무 조와용!,0개,2020. 5. 20.
조조,"와 소프님 2년째 구독중인데 , 진짜 무슨 한편의 공중파 영상 같아요 대박입니다 ㅋㅋㅋ
이걸로 다시 떡상했으면 좋겠습니다!",1개,2020. 5. 20.
Hamingya,내가 미쳤지 ㅜㅜ 이걸 이 새벽에 보다니.....아아아아아아 위꼴 대박 ㅜㅠ,0개,2020. 5. 20.
팟호떡,ㅋㅋㅋㅋㅋㅋㅋㅋㅋㅋㅋㅋㅋ 생강술 생략한데서 빵터짐여 ㅋㅋㅋㅋ 소주 한 잔 걸치셨네 ㅠㅠ 아 꽃게탕에 소주 진짜 땡기네요 대박..,0개,2020. 5. 20.
유키yuki,재치있는 자막이 필요합니당~~! 적당한(강조) 효과음이나 bgm도 조금 들어가도 좋을거같어요,6개,2020. 5. 20.
정묵,편집이 너무 좋아여 역시 소프님 내공이 느껴집니다!ㅎㅎㅎ,0개,2020. 5. 20.
gorilla,"문득 생각해보니 SOF님 영상을 안본지 오래됐더라구요. 
저같은 경우 유튜브에서 맞춤영상 나오는걸 보는데 SOF님껀 언제부터인가 추천이 안뜨더라구요. 그래서 보러오는일이 없었죠.
유튜브에 요리영상이 많이 추천되는건 아니지만 그래도 꽤 보이는편인데 언제부터인가 왜 추천을 안해준건지.... 잘보고있었는데 ㅎㅎ
아무튼 소프님 영상을 봤던 이유는 요리를 재미있게 잘하셔서 봤었는데,  요리채널이 요리에 집중하는것도 좋지만 결국 일반인들에겐 재미를 줘야되는거같아요.",0개,2020. 5. 20.
추리메,"마싯겟당.,. 배고파염",3개,2020. 5. 20.
한방보이,ㅋㅋㅋㅋㅋ 역시 꽃게~~ 이거 참 컨텐츠 좋네요~~잔잔 하니..,1개,2020. 5. 20.
캐럿CR,꽃게탕 다큐ㅠㅠㅠ 한국인의밥상급,0개,2020. 5. 20.
원세연,요즘 꽃게탕이 먹고싶었는데 레ㅔ시피를 ㅠㅠㅠ감사합닞당,0개,2020. 5. 20.
천사승희,"소주ㅋㅋㅋㅋ먹을것 같더라닠ㅋㅋㅋㅋ
뜨~~끄으은~~~~~~~~~한☺️",1개,2020. 5. 20.
MessinaB,"영상이 깔끔하면서도 알차요!
새로운 버전 환영합니다 ㅎㅎ",0개,2020. 5. 20.
정태윤,개인적으로 김발이가 없어져서 아쉽네요ㅋㅋㅋ,7개,2020. 5. 20.
메이나나,"1:37 술한잔 캬~ 할라구
생강 괜히 준비하신거임?
생강 너 단디 이용당해쓰~

영상보면 시간이 순삭되네요ㅋㅋ
침삼키다보면 어느새 찌인한 눈빛과 함께 영상 끝나부럿음ㅋㅋㅋㅋㅋ",0개,2020. 5. 20.
따흑흑,누구 따라한 느낌,8개,2020. 5. 20.
햇빵순이,"소프의 ""기본적으루다가~🖤""",2개,2020. 5. 20.
HanlisatvInternationalcoupleKRRU,"으아... 신선한 해산물..
러시아에서 살기 시작하며 한국에서는 그리 좋아하지도 않던 해산물이 너무나도 자주 먹고싶네요...
저와 제 여자친구도 한국 여행을 하며 다양하고 신선한 해산물 먹으며 엄청 좋아했었는데ㅠㅠ
항상 소프님 덕분에 요리 꿀팁 알아가며 여자친구한테 맛난 한국음식을 자주 해준답니다!
감사하고 더 더욱 건승하시기를 바랄게요!

마지막 소프님의 짜릿한 눈빛은 음..",0개,2020. 5. 20.
LoveTree,키야........,3개,2020. 5. 20.
설목장,공시생 찐힐링 받구 가요 영상 막바지로 갈수록 너무 엄마보고싶어짐ㅠㅠㅠㅠ,0개,2020. 5. 20.
이다람,"요리 다큐 보는 느낌이에요!
나래이션도 너무 좋아요🥰",0개,2020. 5. 20.
박상준,영상스타일이 바뀌엇는데 너무 좋습니다,0개,2020. 5. 20.
AileenK,"오랜만에반가워요 소프님
계속 영상을 보게 되네요👍
5월이 가기전에 꽃게 도전해볼께요!",2개,2020. 5. 20.
서연,영상 기다렸어요! 퀄리티 미쳐버렸다 이거 준비하느라 쉬셨군요 ㅎㅎ 앞으로 영상 자주 올려주세용 다시!,2개,2020. 5. 20.
박석현,소프형 드디어 형의 영상으로 돌아왔군요 진짜 엄청 그립고 보고싶었어요!!,0개,2020. 5. 20.
요술공주aveccello,"바뀐영상 너무 좋아요!!
군더더기 없는 소프님만의 요리영상👍👍
계속 응원할게요~^^",0개,2020. 5. 20.
GunnySGT,어서와요~~,0개,2020. 5. 20.
YKing,"안녕하세요 소프님
영상 잘 보고 갑니다~",0개,2020. 5. 20.
이재민,주말에 따라 만들어 보고 싶어졌어요 좋아하던 먹방이 줄었지만 좋아요 ㅎㅎㅎㅎ,0개,2020. 5. 20.
래미래미,오!,1개,2020. 5. 20.
EunjiChoi,무생채도 안좋아하는데 저번 영상보고 바로 무생채 만들었는데... 이번영상도 꽃게 개취아닌데 꽃게탕 재료 사러갑니다......ㅋㅋㅋ...,2개,2020. 5. 20.
EmilymitYpsilon,"정말 좋은 영상, 아니 작품이네요.",0개,2020. 5. 20.
이혜선,와....지금 내입에 꽃게탕 들어온것같아요..ㅠ 배고플때 보면 미칠듯,0개,2020. 5. 20.
설화이야기SeolhwaStory,"소프님
광어랑 싸울때부터 봤어요.
늘 화이팅!!",0개,2020. 5. 20.
SavinaSon,와오 영상 너무 좋아요!!! 역시 소프소프❤︎,0개,2020. 5. 20.
노래하는무이리,"예전 영상도 재밌었구
새로운 방식의 영상도 재밌어요!
또 어떤 시도들을 할지 벌써 기대되네요 ㄷㄷ
예전부터 지금까지 또 앞으로도 영상보면서 군침돌고, 배워서 직접 해먹어 볼 수 있는 좋은영상 많이 만들어주세요!",1개,2020. 5. 20.
거친침대기술,재료 떨어질 때 첨벙 소리 좋네요 ㅎ,0개,2020. 5. 20.
tomatopasta,처음 볼땐 몰랐는데 영상 디게 중독성 있네... 나만 그런가...?,0개,2020. 5. 20.
하느리,순가 ㅅㅇ 아빠 인줄 알았어욤🤭나만 그랬나아..?!?,1개,2020. 5. 20.
jy8686,소프님 영상 넘 좋네요!!!!! 응원 합니다 🎉🎉🎉🎉🎉,0개,2020. 5. 20.
mjk,저희 엄마도 된장넣어서 꽃게탕 해주시는데 완전 맛나거든요 매운.탕보다요 마지막에 쑥갓 넣어서 밥에 먹으면 죽음입니다,1개,2020. 5. 20.
그고,알고리즘 타구 왓습니당,0개,2020. 5. 20.
yw예웡,영상 깔끔하고 좋은데요 ㅎㅅㅎ 배고푸당... 밥을 슥 말아가지고~,0개,2020. 5. 20.
MartinQ,"와... 복귀 환영합니다!
기다린 만큼 영상 퀄리티가 장난 아니네요 :)",0개,2020. 5. 20.
meticulousensemeticulousense,진짜 개맛있겠다🤤,0개,2020. 5. 20.
황성욱,자막을 간단하게 영상에 방해되지 않는 선에서 해주셨으면 좋겠어요....ㅠㅠㅠ 뭔가 나레이션이 요약해준다는 느낌보다는 길위에 서있는데 뒤로 기차가 계속 지나가는 느낌이에요...,1개,2020. 5. 20.
이상훈,좋아요 ㅋㅋ,0개,2020. 5. 20.
연세UNIV,개인적인 시리즈 너무 좋습니다..!,0개,2020. 5. 20.
조영찬,이제 김발이 없네용 ㅜㅜ,0개,2020. 5. 20.
YoHoBeat,김발 보고싶당 ㅠ,0개,2020. 5. 20.
한량에이미TravelingAmy,"봄 꽃게! 
어디서 사셨나요?!",0개,2020. 5. 20.
콘치K,자막이 없어서 영상에 더욱 집중이 되네요. 신선하고 좋아요. 다만 소프님 특유의 재미난 화법을 들을수 없어서 아쉽습니다. 퀄리티 높은 영상 잘 봤어요.  우리 소프님 화이팅!!,0개,2020. 5. 20.
가격격,이번에 새로 바뀌신 모습이 승우아빠 유투브하고 비슷한거 같은 느낌이네요,2개,2020. 5. 20.
요리하는학생,6:07 난 소프님 이표정 지을 때가 좋드라,1개,2020. 5. 20.
슈팡,형님 많은 고민이 들어가있던 영상인거 같습니다. 기존의 소프님 영상을 완전히 탈피한 거 같습니다. 항상 화이팅입니다!,1개,2020. 5. 20.
미니킴,"소프님이 좋아하시는 갑각류... 꽃게네요.저도 너무 좋아해요. 오랜만에 소프님 영상 보니 좋으네용❤
아직 적응이 안되네요 새롭게 바꾼 영상들이 ㅎㅎ 그치만 언젠가 익숙해 지겠죠. ㅎㅎ
어서 소프님의 라이브를 보고싶어요 응원합니다",0개,2020. 5. 20.
띠용,와 화질이랑 색감 진짜 죽이는데여? 낼 해 먹어야겠어여 영상 잘봤습니다 솦님,0개,2020. 5. 20.
EunhyeJung,봄에 항상 꽃게 드신다고 하셔서ㅋㅋㅋ 올해는 드셨나 궁금했는데 꽃게탕이 올라오네요~ 저도 좋아해서 영상보고 만들어 봐야겠어요!,2개,2020. 5. 20.
JHP,영상 더 깔끔해지고 표정으로 맛을 표현해주셔서 더 맛있어 보이고 확 와닿네요 진짜 너무 좋습니다!!!,0개,2020. 5. 20.
김윤정,"영상이 고급져요
소프님 목소리에  또 요리에
집중하게 되어서 좋아요
맨 마지막 모습은 마치
광고 찍듯이 ㅎ",1개,2020. 5. 20.
oundh,왜이렇게 조회수가 안나오실까..구독자에 비해,16개,2020. 5. 7.
꼴초애니메이션,역시 아무리생각해도 오프닝은 띵~ 이게 딱 소프님같아서 좋네요ㅎㅎ,15개,2020. 5. 7.
강고폴짝,혹시나 마지막에 또 쿰척쿰척 있나싶어서 마지막부분 먼저봤어요ㅋㅋ,8개,2020. 5. 7.
호야,안녕하세요 소프님 다름이아니라 현 소프님에 채널에 올라오느 영상에 자막을 한국어로 작성해도되나싶어서이글을씁니다. 소프님영상에 자막이 자동생성에서 오류가많은것을보고 작막을 수정해드리면 어떨가싶어 이런글을 남깁니다. 혹시라도 자막수정하는것을 해도될까요??,13개,2020. 5. 7.
김보로미,새로운 영상 기다렸어요ㅎㅎ 오랜만에 얼굴 봐서 좋네요 :-),4개,2020. 5. 7.
2TER자극적인음식먹방,소프님 분위기가 뭔가 밝아져서 좋네요 ㅎㅎ,1개,2020. 5. 7.
Ra1nB0w,소프님 백종원씨한테 조언을 구해보시는 건 어떤가요,0개,2020. 5. 7.
gngh15,활발해져서 좋음,8개,2020. 5. 7.
마인스타,107만명에서 더 안올라가노 ㅠ,8개,2020. 5. 7.
문준혁,형 보고 싶었어,0개,2020. 5. 7.
케이TV,그래서 선정되면 소프님이 멘토링 해준다고요?ㅋㅋ,5개,2020. 5. 7.
lazuli,소프님 담궈유 시리즈 해주세요,0개,2020. 5. 7.
도란,제목만보고 다단곈줄 알았잖아요,0개,2020. 5. 7.
연탄현빈,소프님 처음본게 14년도 초6때인데 시간 빠르네요... 처음부터 끝까지 쭉 보기좋습니다 소프님 화이팅 !!,3개,2020. 5. 7.
박현서,윙크할때 같이 하게돼요 ㅋㅋㅋㅋ 소프짱 ㅜㅜㅜㅡ,0개,2020. 5. 7.
MealFriendTV밥친구TV,정말 훈훈하고 멋진 분이네요!!!,4개,2020. 5. 7.
흥민김,형 이제 저 썸네일 시그니처 제스처좀 버려..,5개,2020. 5. 7.
YoungChan,구독자 대비 조회수가 너무 안나오넹,13개,2020. 5. 7.
SunnyJung,살빠지셨나용?! 잘생겨진거같지 갑자기 ㅋㅋㅋㅋ,8개,2020. 5. 7.
코다하우스,이제 공익 홍보도 하시네요 ㅎㅎ 대단하네요 소프횽아.  짱입니다. 저도 도전해 보겠습니다,5개,2020. 5. 7.
SJFoodieLovey,해외도 할수있다면 참 좋겠는데 ㅠㅠ,1개,2020. 5. 7.
이동현,"소프님 한식조리사 실기시험에 산토쿠만써야하나요? 아니면거기선 준칼써야하나요? 셰프나이프써도되나요 
제가칼살껀데 어떤거사야할까요  사키카네쓰구 슌정도 생각하고있어요...",0개,2020. 5. 7.
임성민,오... 도전해보고 싶네요 ㅎㅎ,0개,2020. 5. 7.
Anmingki2482,꽃게탕하고는 다르다고 하더라구요,0개,2020. 5. 7.
천사승희,홍보도 기가 매켜써!!👍👍,0개,2020. 5. 7.
필티비PhilippineStory,좋은소식이네요~ 유튜브와 1인기업의 국가지원정책을 연결시켜 그간 창의적인 청년들이 많은 성장을 하는 계기가 마련되네요! 응원합니다!,4개,2020. 5. 7.
Hwi,예전에 아프리카에서 소프님 처음보고 팬이됐는데 쿡방크리에이터가 되고싶은데 용기가 안나네요ㅠ,0개,2020. 5. 7.
Anmingki2482,게국지 만드는 법 알려주세요,0개,2020. 5. 7.
김뇽뇽,소프님 응원해용 ~,0개,2020. 5. 7.
신딸랑,광고???,0개,2020. 5. 7.
쥐킬,소프님 빠른복귀 기다릴게요 ^^ 보구싶네요^^,1개,2020. 5. 7.
백승인,오프닝 오랜만이에요.,0개,2020. 5. 7.
전성배,"근데 올해 다이아 축제 행사취소 가능성 높습니다.. 코로나 때문에
내년에 해야죠",0개,2020. 5. 7.
정준환,댓글이 와이리 작노 오랜만에 돌아왔는데 근데 조회수 많은거 보니까 다 그냥 먹는거던데 돌아보시는것도 방법일 듯,0개,2020. 5. 7.
LoveTree,22,0개,2020. 5. 7.
메이플토벤대갈,1빠,0개,2020. 5. 7.
윤현구,11,0개,2020. 5. 7.
UrkaNemec,Hello SOF! Nice video 💙 💙 💙 💙 💙 from Slovenia,1개,2020. 5. 7.
병신천지OUT,이정도면 다이아가 낳은 아들 소프인가요? ㅎㅎㅎㅎ 깨발랄하게 말하는거랑 메이크업 하신거 너무 러블리하세요! ㅎㅎㅎ매력적인 입술 시강시강,0개,2020. 5. 7.
진석호,"소프님 채널 재밌게 봤고 요리 많이 배웠습니다.

최근 소프님 영상이 조회수 안나오게 되게 많이 슬픕니다.

단순한 시청자 이지만 소프님의 영상 조회수가 왜 안나올까 고민을 좀 해봤습니다.

1. 영상 길이가 너무 길다.
소프님 영상은 요리영상 + 먹방 + 소통이 함께 섞여 있습니다.
이러니 영상길이가 너무 길어 짧게 짧게 보고싶어하는  사람들에게는 클릭하기가 힘들어 집니다.

2. 한 영상에 여러 종류의 내용이 담겨져 있다.
1번문제점의 연장선인데 요리 + 먹방 + 소통 3개를 동시에 하다보니 이게 요리영상인지 먹방영상인지 매우 애매합니다.
짧은 호흡으로 한가지만 확실하게 하면 좋겠네요.
요리영상 위주로 한 뒤 짧게 플레이팅 한 모습과 한두입 맛잇게 먹는모습을 보여주는편이 즐겁게 볼 수 있을거 같습니다.
영상 중간중간 나오는 소통하는 모습은 따로 편집을 하셔서 요리팁모음영성 이나 부계정을 만드셔서 소통채널 하나 파시는게 더 도움이 될 것 같습니다.

3. 소재와 컨셉
본인만의 레시피도 좋지만 최근 트렌드를 따라서 올리셔야 할것 같습니다.
마라탕 유행할땐 마라를 이용한 영상 올리고 흑당 유행할땐 흑당으로 만들수 있는 요리 올리고
+ 컨셉도 중요하다고 생각합니다.
예를 들어 해산물변태/육류변탸/채소변태/가공식품변태/수비드변태/머스타드변태 같은 컨셉을 잡고 가는편이 인상을 깊게 남길것 같습니다.(본인이 의도하지 않은것처럼 나와야 합니다.)

4. 어그로
어그로좀 끌어주세요.
3번의 연장선이기도 합니다.
소프님 영상 제목이나 썸넬을 보면 너무 정직하고 순한맛이에요.
최근 유행하는 트렌드에 맞춰서 조금은 자극적일지 몰라도 썸넬 및 제목어그로를 제대로 끌어주셔야 조회수가 올라갈것 같습니다.
어그로가 무조건 나쁜것만은 아닙니다.
일단 관심을 받아야 무언가를 할 수 있지 않겠습니까?

5. 루즈함
영상 자체가 루즈한 감이 없지않아 있어요.
진행이 너무 천천히 진행되고 브금도 없어 집중하기가 힘듭니다.
영상의 속도감을 올리고 브금을 깔아주는것만 해도 훨씬 집중하면서 볼 수 있을것 같습니다.




이상 제가 생각하는 소프님 영상이 왜 조회수가 안나오는지에 대한 제 생각입니다.

정말 소프님 잘 챙겨보고 있었는데 이렇게 조회수 안나오는거 보니 마음이 아프네요.

꼭 부활하셔서 200만 300만 구독자수를 거느리시길 바랍니다.",3개,2020. 5. 7.
캐럿CR,소프형님 항상 매년 제철꽃게를 리뷰하고 모든 음식중에 가장좋아하는 음식이 갑각류쪽이란것도 알고있고 청이 한가지 있습니다. (초대형!!!)크레이 피쉬 리뷰 가능한가요? 갑각류 요리 장인 소프형님(박준하)형님께서 갑각류에 환장하는 저와 많은 사람들에게 크레이 피쉬 리뷰를 해주시면 좋겠습니다. 항상 만수무강하세욥!!!                               (버터장조림 출시하고 전력으로 구매했는데 아직도 그맛을 잊을수가 없습니다. 한정판이라면 추가계획이 없는지 판다면 어디에 파는지 알려주실 수 있나요?),0개,2020. 5. 7.
HyeunWooKim,다소 어그로병맛 컨텐츠가 필요하다고봄.. 살릴방법은 그것뿐인듯.. 괴식같은거 누구에게 말안하고 멕여봤습니다~이런거,0개,2020. 5. 7.
문정민,영상을 찍는 방법이 달라지면서 목소리만 들리니 음식을 만드는 과정에 더 집중할 수 있고 담백한 느낌을 주는게 조회수를 떠나 발전하려는 노력과 많은 고민이 보입니다 믿고 기다린 보람이 있네요,170개,2020. 5. 7.
김준형,"시각장애인 구독자입니다, 자취를 하면서 소프님의 요리영상을 많이 참고하고있어요, 옛날에 올려주신 영상들 중에는 나레이션 없이 요리하시는 모습만 나와서 아쉬웠었는데 이번 콘텐츠에서는 나레이션을 넣어주셔서 너무 좋았었습니다, 재미를 위함이셨곘지만 저에게는 작은 배려로써 다가왔네요, 항상 좋은 방송 감사드립니다.",66개,2020. 5. 7.
이명란,라디오 같은 음성과 요리 영상이 잘 어우러져서 보기 좋은거 같아요 기다리고있었습니다!!!,53개,2020. 5. 7.
알로에,생강 씹히면 불쾌한거 매우공감ㅋㅋㅋㅋㅋ,21개,2020. 5. 7.
JinHyeokHa,형 제발 자막이나 방송에 쓰이는 폰트 좀 바꾸고.. 썸네일도 예쁘게 만들어 보자..ㅠㅠ,21개,2020. 5. 7.
오연교,더보기란에 레시피도 적어주시면 감사합니다,27개,2020. 5. 7.
insukjeon,재료 설명좀이 안나와서 좀 아쉽지만 잘봤습니다,4개,2020. 5. 7.
수박씨MrWatermelon,10:35 잘못해서 끝부분 클릭했는데 왜 하정우 배우님이 여기에 있는거야? 형..??,23개,2020. 5. 7.
김철웅,이 영상은 마지막 10:38 을 위해 존재한다..,46개,2020. 5. 7.
1997kg,색감 좀 더 밝으면 좋을 것 같아요. 전체적으로 너무 어두워요 !,15개,2020. 5. 7.
김기훈,소프님의 인생이 담긴 듯한 영상이네요 ㅎㅎ 마지막 표정이 조금 아련해보이는 것은 기분 탓이겠죠 오래 기다린 팬들이 많은만큼 더욱 소프님만의 개성 넘치고 맛있는 요리들 많이 볼 수 있으면 좋겠어요,26개,2020. 5. 7.
DongbumYi,영상이 영 옛날 그 맛이 안 나네,4개,2020. 5. 7.
이원준,다이어트중이르 계란 4개 만이라니...... 다이어트 너무 열심히 하시는거 아니에요???!?!?!,6개,2020. 5. 7.
EnyuZeeMukbang,So incredibly satisfying 😍 keep up the awesome videos!,3개,2020. 5. 7.
룰루랄라,"위에서 아래로 찍는 장면들이 
비교적 어두운 느낌이 있어요.",7개,2020. 5. 7.
도돋,저두 무생채는 직접 썰어서 하는 거 좋아해요!,3개,2020. 5. 7.
김동현,웰컴백 소프님!,5개,2020. 5. 7.
정재연,소프형 이게 얼마만이야...ㅠㅠㅠㅠㅠㅠ,21개,2020. 5. 7.
JohnsK,형 가끔씩 이런것도 올려줘 무작정 재미만 추구하는 사람들도 있는거 같은데 이런것도 좋아유,5개,2020. 5. 7.
백종훈,개인적인 비빔밥 말고 공식적인 비빔밥 해주세요,3개,2020. 5. 7.
혐TUBE,소프님 떡상 가즈아!!!,18개,2020. 5. 7.
승현,나 짜장면을 너무 좋아해서 만들어 볼려고 하다 형 영상보고 짜장면 만들어봄  맛있었음 ㅋ,2개,2020. 5. 7.
Hamingya,9:32 비비는 소리 오져따 ㅜㅜ,3개,2020. 5. 7.
병신천지OUT,이거 진짜 맛있는 비빔밥인데 ㅎㅎㅎ,3개,2020. 5. 7.
YSS,이 영상에 자막만 깔끔하게 넣으면 좋을거 같에요 톡톡 튀는거보다 차분한 느낌으로,2개,2020. 5. 7.
정옐린,화질도 좋고 소프님 목소리가 너무 좋네요 소프님 늘 응원할게요,14개,2020. 5. 7.
박똥꾸,한입만 먹고 갈줄은 몰랐네 ㅋㅋㅋㅋㅋㅋㅋ,1개,2020. 5. 7.
오리얼,마지막 뭐얔ㅋㅋㅋㅋㅋㅋㅋㅋㅋㅋ 너무웃겨,6개,2020. 5. 7.
토토로,"더보기란에 재료들의 비율도 들어가면 좋을거 같아요.
그리구 재치있는 자막이 들어가면 엄청 좋을거 같아요!
영상 편집을 차라리 중간중간 컷해서 루즈해지는 것을 막거나 빨리감기식으로 풀어나가도 좋을거 같아요. 내레이션이 연결되지 않으니까 뭔가 재미를 잃은 느낌이에요.
근데 마지막에 정면보고 한입 딱 먹는건 엄청 깔끔한거 같아요 ㅋㅋㅋㅋ 
신박한 컨텐츠 조아용 앞으로도 꾸준히 부탁드려요!",20개,2020. 5. 7.
류제웅,10:35 컴백 기다렸어요  근데 턱살도 컴백했어요,10개,2020. 5. 7.
설남,ㅋㅋㅋ 마지막에 우는줄ㅋㅋㅋ,2개,2020. 5. 7.
