,youtube_id,comment,like_num
0,햇커피향기,"광고는 하겐다즈 방송은 베라
저렇게 큰통이 후식이라니
통큰햇님 ㅋㅋㅋ",41개
1,문혜정,"저도 아몬드봉봉이 최애인데 어제 이 생방보고 상심이 컸습니다.. 
꿈에서 베라에 갔는데 눈앞에 뻔히 있는 아몬드봉봉봉 안주고 다른거 시키라고 하고... 진상취급 당하는 꿈까지 꿨어요..",30개
2,심아영,처음 시작하실 땐 모르셨겠지.. 아몬드봉봉봉을 대신해서 초코가 왔다는 거슬.. !,27개
3,이윤희,"베스킨라빈스 아이스크림 맛있지요 ㅎㅎ
햇님님 먹는거 보고 요즘에 조금씩 더워지는데
더위가 조금이 나마 가시는거 같네요 😇🤗
햇님님 소통 하시는거 듣다보면 순수한 면이
있으신거 같아서 귀여우세요🥰",13개
4,희희,"하프갤런을 돼지바사먹듯이 사먹는 어른이 되어야지,,",79개
5,빠파용,배라 알바생인데용 초코아몬드 봉봉은 이달의 맛이 아니라서 저번시즌 아이스크림이 몇개 빠져야 판매디핑에 넣을 수 있어용 배달로 초코아몬드봉봉 드실분들은 가까운 매장에 전화문의 하시고 드세용~~,5개
6,문쫑쫑,헐ㅋㅋㅋㅋ저두 오늘 배라갓다가 아몬드봉봉봉 먹어봣는뎈ㅋㅋㅋ기존 아몬드봉봉이랑 똑같은데 아몬드가 더 많이 씹히는 느낌이엇어옄ㅋㅋㅋㅋㅋㅋㅋㅋ맛은 기존 아몬드봉봉이랑 같구! 같이 간 친구는 달고나 먹어서 한입 먹어봤는데 메가톤바 맛!!!이더라구요🤔🤔,21개
7,고구마사줘,"봉봉봉 다나가서 대체맛들만 온 듯ㅠㅠㅠㅠ
이거 뭐 거의 홍철없는 홍철팀 아니냐구요",145개
8,연우,저거 언니랑 한통 먹고 한달동안 베라를 먹지 않았어요...,10개
9,햇쏘리야,늦게 리뷰 하시는 건 많이 봤는데 신상이 없는 신상 방송은 첨 봄ㅋㅋㅋㅋㅋ,147개
10,춘삼이네가족,아몬드봉봉봉 없는 아몬드봉봉봉 먹방...⭐️,13개
11,김한나,아빠는 딸바봉 나의 최애인데 근처에 없어서 속상쓰ㅜㅜㅜ,9개
12,항문에마요네즈뚜껑을껴서별똥을싸보자,언니 아몬드봉봉봉 리뉴얼된거 먹어봤는데 기존의 아봉보다 초코랑 아몬드가 더 많이 들어간거고 그외엔 그냥 아봉이에여ㅋㅋㅋㅋㅋㅋ 우런니 아몬드봉봉봉 기대하셨는데 못드셨엉ㅠㅠㅜㅠㅜㅠㅠㅜㅠ,174개
13,하니튜브Hanitube,입맛을 돋우는 햇님시.. 🥺 햇님언니 영상은 꼭보고 자지만 아이스크림마저 맛있게 드셔서 또다시 배고파짐.....,7개
14,DrHongFreshTV,베스킨라빈스는 가격이 조금 있어서 그렇기 맛은 진짜 맛있어요,5개
15,SongByrdASMR,That is a big bucket of goodness!,2개
16,쓰영윤,언니 31일날 싸리원데이 때매 아봉이 다 팔려서 없었나봐여 저희동네도 어제 품절이더라고여... 아예 통이 텅텅 ㅠㅠ,4개
17,R,ㅋㅋㅋㅋㅋㅋㅋㅋㅋㅋㅋㅋㅋ 아몬드 봉봉봉 먹으려고 배라 시켰는데 아몬드 봉봉봉이 없어 ㅋㅋㅋㅋㅋㅋㅋㅋㅋㅋㅋㅋㅋㅋㅋㅋㅋㅋㅋㅋㅋㅋㅋㅋㅋㅋㅋㅋㅋㅋㅋㅋ,88개
18,bellawoo,"참고로 이건 TMI...일수 있지만...ㅋㅋ
햇님언니가 찾아본 아빠는딸바봉사진은 이달의 맛 선택하고 500원추가하면 싱글레귤러(덩어리한개)를 더블주니어(작은덩어리2개) 로 바꾸어주는 행사를 나타낸 사진이에욤🙂
그래서 아빠는 딸바봉덩어리하나랑 다른덩어리하나가 같이 있는 사진이랍니다   
-이상 한때 베라매니저였던 애청자였습니다ㅋㅋㅋ",17개
19,CURAJang,사람들이 아몬드봉봉봉만 시키나봄니다,3개
20,밤형인간,나도 아이스크림 한 통 안아끼고 먹어보고 싶다..,4개
21,봉이네TV,안그래도 더워서 아이스크림 생각하고 있었는데 햇님이 아이스크림 드시는 거 보니 더 먹고 싶어졌어요 ㅠㅠ,4개
22,눈누,"00:12 한가지맛 다른맛으로 옴
24:20 그게 아몬드봉봉봉임을 발견
언제발견하나 계속봤는데ㅋㅋㅋㅋ너무웃겨ㅋㅋㅋ",58개
23,김너구리,아몬드 봉봉봉 ㅋㅋㅋㅋㅋㅋㅋㅋㅋㅋㅋㅋㅋㅋㅋㅋㅋㅋ 이름 개귀엽다 ㅋㅋㅋㅋㅋㅋㅋㅋㅋㅋㅋㅋㅋㅋㅋㅋㅋㅋㅋㅋ,5개
24,miso,29:36 갑분헨 갑자기 분위기 헨리,9개
25,따개병,신상옶는 신상리뷰라닠ㅋㅋㅋㅋㅋㅋㅋㅋㅋㅋㅋㅋㅋㅋㅋㅋㅋㅋ 참신해서 호다닥 들어왔어요,6개
26,임민희,"와.. 나 베스킨일할때 하프14900원인가했는데  12년전이지만.. 맞나? ㅋㄷ이젠 기억도안나네-_-
그때 파인트가4900원 용량은 안바뀌고 가격만오르네",3개
27,한씽,아닠ㅋㅋㅋㅋㅋㅋㅋㅋ 새로나온 봉봉봉 기대하시고 시킨건데 그것만 대체로 오면 우짜냐고 우런니 광광우럭따..😭😭,66개
28,ChaewonLim,아니 어쩜 아이스크림도 이렇게 맛있게 드실수가 있어요ㅜㅜ 침고여요ㅠㅠㅠㅎㅎㅋㅋ,4개
29,젤리알리,와우 저 사이즈 다 먹는사람 처음봤어,3개
30,김하이,"ㅋㅋㅋㅋ근데 언니 볼때마다 신기한데 ㅋㅋㅋㅋ
아이스크림을 떡 씹어먹듯 엄청 잘 씹어드시네요 ㅋㅋㅋㅋㅋㅋ너무 찰져요 ㅎㅎ",32개
31,전투민족,486? 비밀번호486? 하루에 4번 사랑을 말하고? 근데 그게 아니라구요??? 막 삐삐 암혼가 뭔가 그거인가용??,2개
32,그옴TVGUOMTV맛있는먹방채널MUKBANG,첫입 0:51,5개
33,먹제쉬ASMR,"베라 넘 좋아하는데 케잌 한 판 혼자 먹어본 적은 있어도
저렇게 많은 양을.. 것도 후식^^;",1개
34,이준수,와 그래도 오늘은 후식 한번드셨네,2개
35,dhkim,생방 저만 안보이나요? ㅠㅜ,4개
36,miso,33:31 인스타 아이디의 뜻,24개
37,김김뽀시래기,"언니ㅋㅋㅋ이 안시려워요? 크 언니는 민초는 안좋아하세유,.?",3개
38,crushbomb,선 댓글 후 감상,3개
39,샤론의꽃,언니 폰케이스 핵귀 ㅠㅠㅠㅠ,3개
40,메타몽,판타스틱 트롤로 맛있어요 언니 ㅋㅋㅋㅋ 다음엔 꼭 신상을...,3개
41,YEONHOKIM,지금 생방 아직이죠???,2개
42,흠이,누나 사랑에빠진 딸기는요 !!,2개
43,주유소햇님사건,"신상이라 잘나간건가...
우런니 아봉봉봉 주라주라~~",8개
44,예술하는공학자,ㅋㅋㅋ 햇님님만이 할 수 있는 신상 없는 신상 먹방!! 오늘 퇴근하고 배라 가봐야겠네요~,1개
45,개빗,않이 이럴수가... 나같음 화났을듯 ㅠㅠㅠㅠ,6개
46,반듯한선인장,뭐야 아이스크림 웰케 커;;,1개
47,콩알콩달,안녕하세용 요즘 힘든일이 많아서 불면증이 생겼는데 asmr만 듣다가 그것도 도저히 잠이 안와서 포기하고 여러 영상들을 보게됐어요 그러다 햇님 영상 보게됐는데 못자는 시간동안 넘 재밌게 잘 보고있습니다! 이젠 그래서 그 시간을 즐기게 됐어요 ㅋㅋ 저에게 소소한 행복을 주셔서 감사해요 🤍,53개
48,컁컁,날이 더워지니 베라각 🤍🤍,1개
49,펭씨남극,아몬드봉봉봉ㅋㅋㅌㅌㅋㅋㅋㅋㅋㅋㅋㅋㅋㅋㅋㅋㅋㅋㅋㅋㅋㅋㅋㅋㅋㅋㅋㅋㅋㅋㅋㅋㅋㅋㅋㅋㅋㅋㅋㅋㅋㅋ캐,0개
50,BeenS,‘신상 없는 신상’ 이라는 맛 리뷰하신줄ㅋㅋㅋ,0개
51,윽악,베라 먹구 싶다앙,2개
52,이효진,오 저도 오늘 배라 먹었는데 통했네유 ㅋㅋㅋㅋㅋ,2개
53,IntheSun,요즘엔 피자처럼 예쁘게 담아주는 곳들 있던데~ 저렇게 담아주면 골고루 먹기 힘들어서 짜증남😭😭,0개
54,최우앵,언니 진짜 궁금한테 치아관리 어떻게 해요?,5개
55,기세TVgiseTV,이 영상만 보고 잘게요..,2개
56,가으니,봉봉봉이 없다뇨ㅠㅠㅠㅠ 저희 매장은 맛 없는 경우 대체로 하기전에 전화드리는데ㅠㅠ 에궁ㅠㅠ 우런니 봉봉봉 못먹었다니 우째ㅠㅠ 내가 담아주고싶다아아 서울이 아니라 아쉽네유ㅠㅠㅠㅠ 담에 봉봉봉 맛나게 드셔주세용>ㅗ<,4개
57,박정완,이거 하프갤런이에요??,2개
58,오박,ㅋㅋㅋㅋㅋㅋㅋㅋㅋㅋㅋㅋㅋㅋ아 귀여웤ㅋㅋㅋ,0개
59,장나나,아 오늘 개학이네,1개
60,김수아,언니가 먹는 모든 음식이 맛깔나 보였는데 배라 6시간 알바하고 와서 배라 먹방보니깐 일의 연장선 같네요 ^!^,2개
61,오히믈래용,늘 햇님님 영상보면서 다이어트땜에 대리만족만 하다가 코로나로 4개월째 강제 집콕중이라 햇님님 따라서 비슷하게 3개월 정도 먹었어요! 저도 워낙 잘먹고 위가 커서 그런지 들어가긴 들어가더군요... 20키로 쪘구요.. 그러니깨 임상시험 해본 결과 햇님님은 왜땜에 살이 안찌시는거쥬?! 3개월만에 20키로 시롸냐구여!!!!,17개
62,메쏘,와 초코 맛있게따,1개
63,탠님,우왕,1개
64,박혜빈,햇님님 정도면 베라에서 먼저 아몬드봉봉봉 보내줘야되는거 아니냐구!!!!!!!!!?(아님,0개
65,HyeIn,헉 오늘 베라 먹었는데 통했어요💕,2개
66,뚜딘,이거 빠진거랑 대체한거 표시해줘야지,12개
67,박한별,아니왜안떠가지구..이거보려고 기다렸었능데 ㅠㅠㅠ힝,6개
68,이리,모야.. 이모 너무 귀엽다... 아몬드 봉봉봉이래... 너무 귀여워.....,3개
69,그옴TVGUOMTV맛있는먹방채널MUKBANG,배라에서 나온 국밥인가요?  진짜 맛있게 드시네 ㅠㅠ,5개
70,강냉이탈탈,살다가 아이스크림만 40분 먹는 사람 처음본다..,0개
71,SocialBountyMoneyMakingApp,yo man lets be friends JIr9,1개
72,아에이오우,언니 궁금한게 있는데 채널에 있는 klof sound nerd 요고 새채널인가요??👀,2개
73,젤리알리,아이스크림을 무슨 밥먹듯 퍼먹으니까 뭔가 새롭네요,0개
74,SweetCoco,"언니 아이스크림 한 입 드시고, 두 입 드시고!! 세 입 드시고!!!! 아무말 안하실때 왜케 초 집중하면서 보게되죠? 
하아...되게 조마조마하면서 봤는데... 못 드셨다닝ㅠㅠㅠㅠ",3개
75,KuYj,"저도 얼마전에 아이스크림 먹었는데 베스킨라빈스 아이스크림 먹어보고 싶어요.. 
이제 곧 여름이니 아이스크림 다들 많이 먹으시겠지만 그래도 너무 자주 먹는건 역시 건강에 안좋을거 같다고 생각해요",0개
76,항아,**아이스크림=포크** 로 드셔보세요!!,0개
77,까멜리아,삐삐를아는 82년생은 486을알지요 미사많먹🥰,0개
78,방구,1빠,1개
79,JeeheeHollister,💜,1개
80,YLee,에라,0개
81,Sh,"햇님님 음....앞으로도 승승장구 해야하잖아요? ㅠㅠ 별안간 걱정이긴한데 남자 조심 또조심, 사업조심,,,, 다 조심 해주세요 오래보고싶어요",19개
82,봄이오는소리,"그렇게 먹다가 죽어요..
이동엽올림!",2개
83,크리스찬루부탱,씹을때 입을 너무 여신당 ㅠ.ㅠ.... 소통하시는거라 어쩔수 없나...,2개
