,youtube_id,comment,like_num
0,햄지Hamzy,"첫입 2:11, Start eating 2:11 
전복첫입 8:25, Abalones 8:25 
여름 대비해서 몸보신할게요ㅋㅋㅋ
 
※ 압력솥 8인용짜리라 엄청클줄알았는데 생각보다 작아서 오늘까지만 사용하고 업소용 30인짜리로 
다시 구매했어요ㅠㅠ 
그정도는되야 닭이나 오리 2마리는 들어갈거같아요ㅋㅋㅋㅋㅋ
(근데 압력솥이 생각보다 비싸네요.....)
 
※ 요리장면을 편집해서 금방만든것처럼 보이지만 
기다리는시간이 많아서 너무 배가고팠어요~
하루종일 아무것도 안먹고 첫끼 먹었는데 조금 
지저분하게 먹더라도 이해해주세요 😭😭😭
 
※ 전복들어간거 까먹고 한참뒤에 먹었어요 ㅋㅋ
(깨끗이 닦고 전복 이빨도 제거했어요)
 
※ 뻑뻑살 남은건 짜장이 줬어요~!
 
★예상질문★
Q: 레시피 알려주세요~
A: 영상에 나온게 끝이에요 ㅎㅎ  
(닭대신 오리넣고 삼계탕용 약재파는것 넣으면돼요) 
Q: 안질겨요??
A: 가슴살빼고 부드러운데 닭고기처럼 뼈랑 막 분리되고 그렇게하려면 압력솥에 한시간넘게 삶아야
될것같아요~ (저는40분삶았어요)
Q: 김치 산거에요??
A: 김장김치에요~
Q: 남은음식 버려요??
A: 영상 안찍을때 다 먹어요~!
 
★자주하는 질문★
Q: 몇살이에요? 직업이뭐에요? 남자친구있어요? 
결혼했어요? 등등
A: https://www.youtube.com/watch?v=VEKcM1LP7SQ (햄지's Q&A) 
Q: 사용하는 제품 (주방도구,강아지장난감,악세사리 등등) 어떤건가요?
A: 제가 댓글확인을 웬만해서는 하려하는데 못보고 지나가는것도 많이 있어서 대답을 못해드린분들도 많을꺼에요~ 
인스타로 디엠주시면 사진이나 링크 보내드릴게요♥
Q: 앞에 뭐보면서 드시는거에요??
A: TV음소거하고 보면서 촬영하고있어요~ 
(시선처리때문에)
 
오늘도 시청해주셔서 감사합니다❤😍",436개
1,annaleongpc,"oops,😮🤔🤤😋👍💯 seem like healthy meal,!",18개
2,CynthiaFritze,When she chews that cartilage off the bone 🐯🦁,4개
3,AmyCurtis,I love Peking duck! This one seems tough even after a round in the pressure cooker.,4개
4,shailastar,Here I'm eating. Instant noodles duck flavor with fried chicken n green chillies,3개
5,Mannan212121,"No fancy dress
No extra decoration 
No unnecessary talking
No unwanted expressions 
So naturalistic .....
This is reason...
  I love your video ...
    ""Hamzy""..",575개
6,AsidahOmar,I feel like want to buy instant samgyetang 😂 it’s make me craving..😭,3개
7,nahidakhatun,Such a foodie like hamzy...i have ever seen in my life...shinca!..😲...bt i enjoyed her mukbang video😇..,3개
8,JOY7,"My husband: what are you watching?
Me: a girl eating chicken.
Husband: it’s so noisy. I can hear it from here.  
He is on the first floor and I am in the second floor loft. 😁😝",82개
9,Davis,"Me... cook a whole chicken for 5 people
Hamzy.....cooks a whole duck for herself 
😋😋😋😋😋 good work my favourite mukbang lady 💖",3개
10,SWARAVINES,whoever reading this will be a Successful one day just keep going,195개
11,RachelMarie,I love how clean she is with everything 👌♥️,2개
12,WinwinLlenos,"In my country, we have chicken arroz caldo.",2개
13,The경계선,난 정말이지 햄지님이랑 룸메하고프다- 어쩜 저렇게 보기만 해도 입안에 군침이 돌게끔 요리를 뚝딱해낼 수 있는걸까... 멋져요 햄지님!,11개
14,imnayeonandren,When you are single and you don't need boyfriend to make your life happy,12개
15,CozeASMR,"I love how her intro music sounds like breaking news...
""Tonight on Hamzy...Can this duck really handle the pressure? Find out at 6 o-clock""👩",221개
16,carolCristina,"Amo seus vídeos, pena que não tem tradutor pois não sei os alimentos diferentes que vc faz😪😪..",1개
17,rachellopez,Why are you doing this to me Hamzy?? 🤤🤤,1개
18,MollannaT,Omg when she brought out the rice it was like “okay now it’s really time to eat”. 😂😂🧡,5개
19,EsomASMR이솜,소금 젓가락으로 먹는거 진짜 내모습이다ㅋㅋ,8개
20,LanejaOneal,It look tasty but I'm scared too eat anything cause of the virus,1개
21,CjneelaI,Do you guys ever imagine how it would be like to sit there and eat with Hamzy??? I'll probably just stop and watch her like I do all her videos lol and pet the puppy,23개
22,zenoben,Sounds delicious but without enough seasoning I just can't eat meat.....,42개
23,HimanshuArya,"The best part for me in her video is everything cooking; eating & she is so real .She cook her food like mom's cooked in their kitchen & enjoyed her meal like a queen. 
Thank You 
HAMZY",20개
24,AnnaSavkina,"Всегда интересно смешение вкусов, утка и морепродукты. Спасибо за новое видео)",4개
25,,アワビ鶏肉美味しそう😭最後のもち米？も美味しそうです🤤,1개
26,,"Обалдеть, такая хрупкая маленькая, а целую курицу слопала, казан супа, рис, и еще что то,",3개
27,YustiaDramestalia,"Bissmillah.. 
Mana nih yang lagi puasa? :D 
Sehat teruss kak hamzy. Emot love",2개
28,Wooang우앙,야무져야무져..💗,9개
29,PocholoCubil,"She is so good at eating brooo, im jealous.",4개
30,ArmyAhgase,"Others during quarantine : bore bore and bore..
But
Hamzy during quarantine : Eat Eat and Eat..",39개
31,TabbiNieves,I wonder why she didn't just season it while in the cooker. Instead of dipping in salt n pepper while eating.,3개
32,MickeybelievemeNeverMind,Yeahhhh and I spend most the time on YouTube make me sick.,1개
33,TANYAH369,I hope to cook everything like you  ♥ all menu is look good and delicious.,1개
34,MsHoneylith,The best part is that she knows how to cook too..👏👏🤤,128개
35,,青唐辛子は毎回見てますけど辛くはないのかな？私も食べてみようかしら⁉️辛かったらどうしましょう❗️笑笑🍅🍅🍅🐕🐕🐕,1개
36,NandhiniAmmu,How she eating seasoning or any masala without add anything she is eating meat omg i cant literally i need too spicy,16개
37,BearASMR,Looks delicious. Would love to eat this!,1개
38,sanjanaadhikari,Didn't read the full title and thought it was chicken the whole time lol,34개
39,mukbangeating,"1: watching to hamzy for mukbang content ❌
2: watch it to learning about Korean food recipes ✔️",6개
40,도도네국수,오늘꺼 기가막힙니다!!!진짜최고!!,5개
41,Molly,I wish Hamzy will make a meal for me someday,1개
42,KoriHardi,Always surprised of how she could stand hot soup! This  makes her soup looks so good😍,7개
43,AngelaLamkang,Sis...is to hot make it cool and eat . Your teeth will not strong when you become older... But I like  your eat😋😋😋😋,3개
44,SitiHelwa,Want to learn from hamzy. Eating but your face still clean & neat,1개
45,,鴨美味しいですよねぇ。いい音😆,3개
46,nekokaburi,외식 대표메뉴를 직접 혼자서 압력솥에 끓이는 클라쓰 스케일이 우주급 역시 먹방계의 1인자!!!,11개
47,bravesoul,During the time of Corona me and my family is having Very hard time please friends help us 😭😭😭thank you,0개
48,AngelicaCanaveral,You eat those foods like nobody's business!,3개
49,NabilaPriscilia,proud of you🧡🧡🧡🧡. this is what I will look forward to😻,1개
50,promukbangASMR프로먹방러,This how many people getting hungry watch after this video,6개
51,NurHasanah,hello i'm from Indonesia i really like you because i can get to know better food i always follow you from the first and success is always for you😊,1개
52,AnaMara,Love the fact that you’re so tiny and eat like a wild beast!,3개
53,JH,本日もかわいいです。ありがとうございました。,1개
54,QmangMang,"She can still eat that hot food,, if I were her,, i would wait the food to cool  down a bit😂",33개
55,ZeeshanItresh,I know and I love humzy,1개
56,iwANderer,Its dinner for me right now and I feel hypoglycemic 👀 watching her eat,0개
57,,鴨の水炊きだなんて良い出汁が出て美味しそ😍私も軟骨部分大好き😋,3개
58,loveRoselia,"めちゃくちゃ豪快！
美味しそう！",1개
59,,愛してる〜😭💕,3개
60,단팥앙금,와.진짜 이분 금손도 금손이지만 자세히 보면 치아도 굉장히 건강하신듯.저 오리를 치아로 베어 뜯어드시는거 보면.전 치아교정중이라 불가한데 치아부터 발끝까지 건강햄지,4개
61,입벌려음식들어간다,2:11 Start eating,4개
62,KatrinaLouisePal,"I've been watching your mukbangs for months now and I just love how natural you are. Like not those others mukbangers who wear lipstick, or introduces the food they are going to eat. I love watching you cook your meals, and all about your mukbang Hamzy ❤️. I also love that you don't look at the camera and just eat like no one is watching. So much appreciation for you. 😘",3개
63,sabreenAli,Who wants ot eat chicken after seeing this video 😣😣😣,13개
64,승희최,"우리 햄지님 몸 이 허하신게  기 가 빠지셨나~?!
오리랑전복 넣으시고  몸보신  하셨네요~~~^^
건강한  몸보신 식사 잘하셨으요~^^",1개
65,ClaudineTuitoga,Boiled Duck yummy 😋 ❤️,1개
66,CelinaDelaCruz,You're the best Hamzy! ♥️ Sarangheeeee from the Philippines 🇵🇭,1개
67,,まるまる一羽を料理…かっこよすぎる,5개
68,KianaHubbard,Only if she would’ve let  it boil for a lil bit longer it would’ve been more tender 🤷🏽‍♀️😂,11개
69,nightwolf,"기력이 떨어질때 오리백숙같은
보양식이 최고죠.❗
요리솜씨가 끝내주네요 💯🥰💕💕💕",1개
70,jiminspinkie,"I'm afraid for your throat & esophagus, hamzy nim.. Better let the food cool down a bit a lil first..",3개
71,한지연,햄지님 요리모음 영상   올려주세요ㅠㅠ,4개
72,RosaniPoliMotta,Jesus!! Que saúde 😱😂😂😂 Adoro ver vc comer. A crocancia do legumes..... Tudo 👏👏👏,9개
73,,いつも美味しそうでお腹が空いてきます😁💕,1개
74,EatwithMohsin,"Such A Satisfying Meal ❤️
Looks Tempting 😋
Watching From 🇸🇦💚",13개
75,MelissaElliott,Looks so good 😍,1개
76,바니,주방살림 그만사야지 했는데ㅠㅠ 압력솥 사러 슝~,1개
77,HawraaAhmed,Your so cute omgg 💜💜💜,1개
78,,"お陰様です！
本当豪快で美味しそぉ〜です😊👍💞",1개
79,Rosikamei,"Seeing this is not good for me, especially during quarantine",136개
80,JungYounPark,"햄지님 ~~ 진짜 베고팠나뵈요
어쩜 그렇게 먹음직스럽게 고기를 드시는지... 제가 안먹는 음식이 많거든요 오리고기도 안먹어봤는데
햄지님은 정말 대리만족을 확실하게 해주시네요 압력솥에 푹 고아서 진국이 된 오리백숙에 전복까지...
봄철 보양식을 확실하게 섭취했군요
햄지님은 요리도 잘하고 야무지게 잘 드시고... 그래서 나날이 팬들이 늘어나는거 같아요 그리고 오늘 짜장이 얌전히 앉아서 초롱초롱 이쁜 눈빛에 심쿵했답니다^o^
오늘도 즐거움 주셔서 감사해요~~",3개
81,Eunyoungsuh,She can EAT!!! I love watching her devour her food!!! ✌👋👋,0개
82,DuddDudu,Well i like korean food ..so simple but healthy and yummy❤,1개
83,비둘기맛산도New,햄지~!! 업소용 압력솥 완비!!  요리 실력 겸비!! 이정도면 몸보신 2탄으로 해신탕 콜???,1개
84,TryingtoFood,who is not korean but loves korean food,51개
85,MominasArt,She is so real and beautiful ❤️,0개
86,,"すごいーアワビ粥まで作っちゃうなんて、、🤣
あー韓国行きたい🇰🇷😭💓",1개
87,양념도토리묵,으흐~~들깨초장해서드시면더더더맛있는데ㅜㅜ,1개
88,5,"鳥一羽…
すごい…😮😮",1개
89,sarasherzay,"70% here for Hamzy's cooking
20% here for Hamzy's mukbang
10% here for her cute adorable dog.
May your life be filled with happiness",44개
90,EugeneCooperJr,"She's poetry in motion. 
Have a great week...... 😎🙏✌",0개
91,JuJuu,You're my favorite one Hamzy ❤️ Fighting ❤️❤️,0개
92,HayU,"Admire the doggo , (she/he) still behave while Hamzy eating oh GOD! Please keep posting your videos really really i like it.",0개
93,,너무 맛있고 예쁘게 잘먹어❤,2개
94,김도희,햄지씨는 나이도 얼마 안되는대 오쩜 나이 먹은 나보다 음식을 잘 하세요 이번에는 안질러야지 했는대 햄지씨 먹는거 보고 또 질러 버리게 생겼네요 ㅋㅋ짜장이 이쁜놈 아주 얌전하니 조로코롬 잇대,49개
95,ThuyPham,i really get impressed by her cooking.  wanna know the recipe :) really wanna try it once in my life. look so yummy,0개
96,ZuleimiPeech,Yo pensando que era pollo y estaba algo raro jajajajaja luego ya leí que es pato🤣 con razón,0개
97,KEI,"いつも美味しそうな料理をありがとうございます😄
食べ方最高✨
めちゃ食べてみたい🙆",1개
98,,나는 당신을 너무 사랑합니다,1개
99,Gracezy,"I just finished my 1st ever Chloe Ting’s workout, and I don’t wanna be hungry but here I am again.",48개
100,pangetcako,Healthy dinner! Very delicious..... im hungry already,1개
101,nananase,こんな料理上手だったら今の時期も楽しめるのになぁ…,5개
102,CharlotteSaac,I am so hungry when im looking at her eating...,0개
103,AmirahHatasya,hahaha I thought she's eating chicken but at the end of her video I just realized that it's  duck by finally  reading the title 😱🤣,0개
104,BhupendraSingha,I can't even think of eating my food without salt..how the hell are they eating so deliciously without salt and spices..amazing,5개
105,MariaPuentes,Ay no! Que tortura que me vine a la cama sin cenar y viendo la delicia de pato 😔 sabroso! Saludos linda 🌻🇲🇽,0개
106,,母ちゃんみたいな手つきだ,1개
107,PallaviJugduth,"It’s actually amazing how you never waste anything! Always making a new dish out of leftovers, that looks soo good 👍🏼👍🏼love it! ❤️",0개
108,RamisaMaliha,She kind of looks like Irene of red velvet while wearing glasses.,92개
109,Sirishchhetri,"Watching her video and here I'm eating spicy noodles😋😍😍
I feel like I'm having dinner with Hamzy💙💙
Lots of Love from Nepal 🇳🇵",0개
110,이야채,"01:22 압력솥 개봉 때에 맞춘 짜장이의 오픈'왈' 타이밍 절묘하개!❤ 햄언니 몸보신 제대로 했네요ㅜㅜ 누룽지 삼계탕 먹고싶다 흑흑,, 앞으로도 먹방 오래보고싶응께 몸에 좋은거 많이 먹구 햄언니 튼튼해야함둥!
오늘도 영상 잘 봤어요❤",3개
111,SyazaJaa,She is making her nail accesories but here wow she cooked everything. others women will take care of their nail. i love hamzy,4개
112,,料理の手際の良さに「一刻も早く食べたいっ！」という気持ちがにじみ出ていていて良いです。,1개
113,이지연,"요즘 우리햄지님 따라하는 유튜버분들 많더라구요
전 10만구독자때부터 팬입니다. 따라한다는건 햄지님이 잘하신다는거니까 항상 파이팅하면서 하세요~~오늘은 건강식 쵝오입니다..!",41개
114,,大好き❤️,1개
115,UnicorUnicorn,I just love how real she is n doesnt change  her eating style just to make vids btw lob ya n stay safe everyone,8개
116,HijaabZehra,I thought it was Chicken 😐😐 but it was Duck 😅😅,1개
117,SaziratulLamya,You are so Beautiful.. ❤💛💛💜,1개
118,ElizaAndaya,i am shookt bc i tot Hamzy did eat that w/o even putting some seasonings bc in the Philippines it's only 'hablos' the term for us.,0개
119,AnneLao,Hamzzzy!!! Those Abalones look so good 😋 Happy eating 🤗 I always enjoy watching your mukbangs ♥️,2개
120,,"豪華な水炊きですね✨
食べてみたい😋
料理の手早さ 食べっぷりや
食べ方キレイ✨ 全て最高😃⤴️⤴️  眼鏡似合いますねぇ😊
次回も楽しみにしてます🥰",4개
121,,めちゃくちゃうまそおw,1개
122,SonamDobriyal,Beautiful girl with amazing eating sound,1개
123,SaraManch,didnt read the full title n i kept askin hw can chicken b soo tough....silly me,0개
124,eriA,いつも美味しそうなものしか食べてなくて羨ましい！！😍❤️❤️Hamzyさんお金持ちだ〜🤤✨,1개
125,ChantayChani,Hamzy 🤗❤ I love you but I never know how anybody can eat that skin of chicken or duck 😱🙅🏽‍♀️,0개
126,이뿐소롱담담,1:22 우리 짜장이 압력솥 김 다 빠졌다구 알람해줌♥,25개
127,LetoriaBennett,I bet that broth is banging💖 It looks so good Hamzy😊,0개
128,리리옹리,"흐엉 ㅠㅠ언니이!! 영상이 너무짧아요오오오오오오ㅠㅠㅠ계속 보여주세유유유유유 
오늘도 리얼리티한 먹방 감사해용😍",3개
129,김현미,오리탕엔 머위대가 들어가면 최고지요 햄지님 먹는거 보니 어릴때 엄마가 머위대 듬뿍 넣고 끓여주시던 오리탕 생각나요,1개
130,ReneeLuera,i made the dressing for this and put it in my soup no duck or turkey tell thanks giving.,0개
131,CelsaGarcia,I like the way you never waste food.  That duck looks very yummy.  It's a good idea. 😊💕🍗🥢,0개
132,KalaGurung,I love to watch ur show so much u look like my elder daughter keep uploading videos,0개
133,AnaMaria,Pode comer a vontade mais lembra de da ao cachorro também  gosto muito dos seus vídeos feira de Santana ba Brasil,0개
134,ArvieJaneSanguir,"Your rice soup is similar to ours here in the Philippines, it's called arroz caldo or lugaw.. 😋🤗😊❤❤❤",0개
135,InriBethania,She is not just pretty but clean and has cooking skill😍,38개
136,JamCipcon,I love watching you eating ..and i want to see you eating chicken feet and pizza 😋😋,0개
137,FifiONeil,"ok not gonna lie, that rice porridge at the end got me really craving congee now...",1개
138,ElprocesoDeunadoradora,"I love her videos, she remember me the cooking mama game❤️",0개
139,Na15,"Gente, esse frango tá com aparência de cru. Não foi bem cozido, pelo amor de Deus, não come issoooooooi",2개
140,AfinaBorova,She is lovely ❤️,0개
141,ChayyElliotts,Filipino foods please hamzy!! Saranghae 🥰💛😘,1개
142,ermengardbalasabas,I can't eat this without rice hahahahaha.,0개
143,몽소루,"진짜ㅏ 요리 잘하신다,,헿 잘보고가옇ㅎㅎㅎ",1개
144,ShubhashreeMohapatra,Hii hamzy ❤❤❤❤😘😘😘😘😘😘😘😘😘😘😘,1개
145,RenaChelleNuke,IM DONE WATCHING THIS VLOG 💗,0개
146,WidiEka,I love to watch the way how you cook chiken soup... some time i practice it at home 😃😃🥰😙,0개
147,임현지,햄지님!! 슬기로운 의사생활 산부인과 여우쌤 닮으셨어요!!!!!,1개
148,MousomiSingh,When am cooking something Or chopping vegetable am felling like Hamzy😌,66개
149,,"とり肉の軟骨にアワビ🤩🙌
旨味たっぷりスープのオジヤ👍
最強フルコース🌈✨",3개
150,,❤❤❤❤,1개
151,AlanJoseKho,She's so cute when she devours the food,0개
152,GRASYATv,She's still really pretty even after eating that whole duck thing ♥️ the sound of her chewing is really making me hungry 😋,1개
153,MinGenius,"I like how you film the cooking process, and you’re very pretty 👍 great video content",0개
154,barsaaaa,"All love from India ♥️
You're so preety 🌸",0개
155,경상도가시나,12:04 짜장이 숨어서보기ㅋㅋㅋㅋㅋㅋㅋㅋ,0개
156,RajniKhare,i love you when u r eating... i get jelous and be hungry🤤🤤🤤🤤🤤,0개
157,YukiSaito,"👏👏👏👏👏
Samgyetang with abalone!!!!! 
Gorgeous and exciting!!!!! 
ur family is super cook, right?? Chajang!! 
👏👏👏👏👏",0개
158,SaziratulLamya,But I did not like the food.. 😩,1개
159,RachelMarie,I also love peppers on the side 😋so yummy,0개
160,Alsievina,Take care hamzy ❤,0개
161,emaTaifor,I'm watching this for tenth time. I don't know why.,0개
162,랑랑ASMR,"음 마싰어....
같이 먹고 있었어요ㅎ
오늘도 짜장이는 쇼파를 차지하고 있네요.
귀욤♥",1개
163,KeshavRaoo,I LIKE IT SO MUCH,1개
164,YashaIbrahim,The dish looks so delicious 😋 ❤️,0개
165,JoSivvFroggyHerbert,U r just incredible.. love u so much 💕 from England 🏴󠁧󠁢󠁥󠁮󠁧󠁿 xx,0개
166,amrda,"That duck soup looks delicious, please give me some !!!",0개
167,,Курица жилистая попалась😂😂👍👍👍🤗🤗,1개
168,PaulaFarias,Sei que essa é a cultura deles mas pelo amor de Deus!! A galinha ser cozida na água com alho sem refogar!!tem que ter estômago!!!😱😱😱😱😱,1개
169,UditaChakma,Poor Doggo!! :( so cute!! I feel very bad for the doggo!! :'(,0개
170,EJdeLeon,"I like the way you eat your food, soo cute😍😍😍 looks delicious!",0개
171,LanaHattar,Your r the best Hamzy ❤️❤️❤️,2개
172,,"Такое впечатление, что во рту микрофон, рот закрыт, а чавкает прилично.",3개
173,양재골TV,완전 보양식ㅋㅋㅋㅋㅋ복날도 아직 한참 멀었는데 ㅋㅋㅋㅋ복날에는 무엇을 만들어 드실지 ㅋㅋㅋㅋㅋㅋ,0개
174,LochumloKhenchung,I'm already hungry 🥺🥺🥺lots of love from India 😘😘😘,0개
175,CjneelaI,I literally sit here and watch beginning to end in all your videos. Love you!,0개
176,김태훈,4:57 짜장이 시선 ..,0개
177,COCOPINK,"美味しそうすぎて
羨ましすぎて
嫉妬さえ感じる笑",10개
178,SexyMama,Wonderful ❣️ as usual stay safe 🙏 and enjoy!!,0개
179,,"丸ごと鴨🦆✨✨
韓国の食は豊かね✨✨✨😂",0개
180,ShyneMarjolynRosales,My favorite mukbanger ❤️❤️,0개
181,Riemc,"Awesome😆💕
I wanna go to your house to eat this nice meal !!",0개
182,ResaAndasari,"wow I was surprised this afternoon I saw Running Man episode 180, and now I just opened your channel, the dish is the same as jongkook oppa, it's just that he uses chicken.",0개
183,NuruHatimy,"*I know you sitting on bed
*Hungry  *watching this and it’s RAMADHAN 😭yu fast stay blessed ❤️",5개
184,anisariffin99,u dip it with salt?why dont you put in the soup earlier?,2개
185,AbdulKabir,I don’t really eat duck but the other things looks good😜😎😎😍and do you get you period every month 🩸,1개
186,sollensein,백숙 손 진짜 많이 가는데ㅜㅜ 집에서 직접 해드시다니 너무 멋있어요!!,0개
187,MechanteWesche,국물 색 진한거 ㅠㅠㅠㅠㅠㅠㅠㅠ,0개
188,JamesPapas,I like to go a date with you ❤,0개
189,LarDoceLar,"Eca , frango sem tempero deve ser ruim demais",0개
190,임혜지,짜장이 왜저러구있어ㅋㅋㅋㅋㅋㅋㅋㅋ 귀여워 !!!!,0개
191,debuparida,"Is there a reason why she didnot add salt to th3 chicken while cooking it? She had it along side and took it with the tip of her chopsticks..
This is so far the best eating video for me😊😊",5개
192,이가영,전복에삼계탕 꿀조합👍,1개
193,MARIANOAYVAR,Sinceramente esta comida no se me antojó hoy😅,0개
194,MichelleMyra,Queen of eating everything 💯,10개
195,,"めっちゃ美味しそう🎵
韓国料理大好き😆💕",0개
196,KeiPecaso,I remember love in the moonlight with that chicken.,0개
197,SandhyaVinod,Hi. do you like it kerala. Im your very very fan. Seriously,1개
198,,鳥丸ごと、美味しいだろうな❤️💕💕可愛い❤️,5개
199,RafiyaSyed,Hamzy try Indian food ...love to see u eat it   ....make high ponytail ...its suits u ....take care be safe😍,0개
200,ElkachiElkachi,Hi we want to see a mukbang with your boyfriend eating 🍴 together,0개
201,ImArmy,Класс👍👍👍👍👍👍❤❤❤❤❤❤❤💕💕💕💕💕💕💕💕💕💕💕💕,0개
202,ShansiaBach,Laying on the bed and watch her channel is the best way to get hungry faster😍,0개
203,떠리Eatwithrelishtteori,"와 전복까지,,,,,ㅋㅋㅋ 어쩜 진짜 그리 맛있게
먹는지....ㅋㅋㅋ 침고여요ㅠㅠ잘 먹는 모습 넘 이뻐용❤️",0개
204,NyanbeniNgullie,"I like ur eating style hamzy. U r so natural and u r my favorite.
N u r so beautiful",1개
205,ShivaniSharma,Lovvv ur doggy 🥰,1개
206,SjSendo,This is how we eat y'all,1개
207,삼세SAMSAETV,오리백숙 찹쌀죽까지 전복 부추까지 와벽한 봄철 보양식 식사이네요 비주얼과 리얼사운드 최고입니당 행복한 식사 하세요,14개
208,ShantellePeaflorida,Wish there are more/longer cooking with Hamzy on your videos. 😍🥰,0개
209,,"우크라이나 키예프 우리는 당신과 함께합니다! 글쎄, 난 너무 많이 먹을 수 없어)))))",0개
210,리오꾸TV,와.. 오리백숙 대박 ㅠㅠ 요리완전잘하셔 햄지언니,0개
211,MarisaKhawlhring,Amazing ❤️❤️❤️❤️❤️,0개
212,Izaanskitchen,Does ur mouth has heat proof something i mean ur eating it right away i hope u dnt burn ur mouth..love ur videos hamzy lots of love from Nepal ♥️🇳🇵🇳🇵🇳🇵🇳🇵🇳🇵,0개
213,,"IRAQ❤💚I hope in the next video that you will try Iraqi food because it is very delicious and the most famous Iraqi dishes are (Dolma, Iraqi kebabs🍢, Iraqi kebabs and gravy  Kema🍲) There are more Iraqi dishes other than these, but these are the best and most famous dishes that I have written here💞🌼🌸🐤",2개
214,rashemad,"We are a family eating half a chicken.
You are very voracious!",0개
215,다금DAGUMMUKBANG,오리백숙이라니ㅠㅠㅠㅠ마지막에 죽까지 끓여먹는거 진짜 찐이다....ㅎㅎㅎㅎ,0개
