,youtube_id,comment,like_num
0,햄지Hamzy,"첫입 2:30, Start eating 2:30 
삼겹살로 하는게 정석이긴한데 저는 얇게썬 목살로
만들었어요~ㅎㅎ
 
※ 수박이 아직은 비싸네요😭
 
★예상질문★
Q: 양념 뭐뭐들어간거에요??
A: 설탕, 고추가루, 미림, 다진마늘, 액젓, 간장,
참기름, 후추, 깨
Q: 계량은 어떻게하세요??
A: 저는 인터넷 레시피를 보더라도 어떤 양념이 
들어가는구나 정도만보고 양은 제가 감으로 넣어요~ 
먹어보고 모자라는맛이 있으면 그것만 추가로 넣고 맞추는편입니다!
Q: 수박씨 그냥드세요??
A: 네..... 하나하나 발라내는게 너무 귀찮아요ㅋㅋ
어차피 다 나와요(?)
 
★자주하는 질문★
Q: 몇살이에요? 직업이뭐에요? 남자친구있어요? 
결혼했어요? 등등
A: https://www.youtube.com/watch?v=VEKcM1LP7SQ (햄지's Q&A) 
Q: 사용하는 제품 (주방도구,강아지장난감,악세사리 등등) 어떤건가요?
A: 제가 댓글확인을 웬만해서는 하려하는데 못보고 지나가는것도 많이 있어서 대답을 못해드린분들도 많을꺼에요~ 
인스타로 디엠주시면 사진이나 링크 보내드릴게요♥
Q: 앞에 뭐보면서 드시는거에요??
A: TV음소거하고 보면서 촬영하고있어요~ 
(시선처리때문에)
 
오늘도 시청해주셔서 감사합니다❤😍",440개
1,VioletBlossom,"Я чувствую удовлетворение  своих  вкусовых потребностей, когда смотрю её. После этого я перестаю воспринимать вкусную каллорийную еду, как ""запретный плод"". И мне гораздо легче без неё обходиться. Благодарю тебя, Hamzy🥰",11개
2,HectorGuevara,Hamzy likes her squid very spicy... I counted three times when she added red pepper flakes to the mix.,8개
3,OreoEmesis,I knew Hamzy would be a savage and swallow those watermelon seeds whole!,13개
4,IndaLinda,"Whoever get her as his wife will be very lucky as she work fast, good at cooking and pretty.",6개
5,PujaGhosh,Y was she in so hurry as if she is gonna miss her train 😂,3개
6,AlanJoseKho,She's cute when her mouth burned out by the steaming hot food,21개
7,LnKenni,"She's a bigfan from Pubg maybe 🤔
1:53 Fry Pan im Pubg 😉",6개
8,,"Jjajang is the cutest thing ever ,, I love him 💞 !",6개
9,mykavocales,I feel like her mic is under the table 😂,3개
10,michaelarose,"WHO ELSE LOVES HAMZY FOR HER NATURAL WAY OF EATING??🙋🏻‍♀️🙋🏻‍♀️

small youtuber here",193개
11,EllaLee,I love how she cook😊❤,5개
12,China,The stomach of your husband is blessed.,2개
13,ShieShie,When you're not feeling well and you're watching this. Accck my stomach. So yummy!😍,12개
14,RandomCitizen,This makes me want to buy a wooden spoon 😂,16개
15,MariaicenmoreASMR,"What she watching 
She cant ever hear the sound 🤣
I love the way you eat hamzy",2개
16,,いつも見てます❗料理も参考にしてます,9개
17,zenobia10127,I'm sure her neighbors are jealous of all the delicious smells coming from Hamzy's apartment.,1개
18,봉이네TV,"2:30 eating start
I'm hungry",12개
19,koui,スピード感、食べる勢い、表情、すべてが最高、、、飾らないありのままな姿がもうたまらん、好き😂💕,30개
20,Kookooness,She eats like there's no camera in front of her. I appreciate that.,10개
21,alxxna,"why is her thumbnail feels like she's saying ""where are u looking at this is my food u won't get some""",32개
22,BTSYounivers,"she is leaving her bangs flow these days 😍... 

Beauty with a great Stomach... love her she she eats",1개
23,MehrBaig,"That looks so good while it’s hot.

Edit: I have subscribe Hamzy so now I get every notification",11개
24,FiammaBustos,Admito que está señora tiene un aspecto similar a suga jajaja,1개
25,ExGamer,The thumbnail looks like someone wants to have hamzys food lmao that stare tho,26개
26,AinXoxO,"who doesn't see the white thing until Hamzy eat it


   |
  \/",19개
27,straydreams,I'm watching an old lady eating and smacking food in her mouth 😑 i really need a Life  Lol,1개
28,CozeASMR,"Shes so down to earth, i love that",5개
29,,"可愛すぎます^ ^
美味しく召し上がってる姿見るだけで幸せです^ ^",6개
30,MingCalarde,Her style is so different to others. I like it she's comfortable at home with her daily clothes without speaking anything just eating just. :) the normal days,6개
31,VanyaWilona01EditzG,"마찬가지로 ... !!
편집
👇
❤️",1개
32,RomiHi,チャジャントリミングしたのかな？可愛さ倍増してる😃💞🐶,10개
33,Aisyah,"Hamzy, you eat it looks very good, I'm hungry, even though I just finished eating😌♥",14개
34,btspavedthewayduh,I love how she never change she is still the same old hamzy and her love for her dog is so cute she lets her/him  do whatever it he/she wants to do🥺💜,22개
35,,솔직히 요즘 먹방은 햄지만 봄 먹방할때 말 ㅈㄴ하는거 개싫은데 바로 차리자마자 허겁지겁 먹는게 딱 내 취향,3개
36,REI,サムネのHamzyちゃん、怒ってるのかと思ったw,14개
37,madinabatanova,в промежутках на унитаз бегает бедняжка,1개
38,더블브이ASMR,"The watermelon looks so cool and delicious.🤤
It's really time to eat watermelon.👍",1개
39,JoanneHolmberg,"I don’t get why I’m so fascinated to this channel, but I am. She eats enough for 4 people and hasn’t gained any weight since doing her channel! I love you Hamzy and so do 3 million other people. Congrats on your success🌸",17개
40,SitiMaftuchah,I'm fasting and I'm watching this to the end,14개
41,KatePyle,LOVE how she bare-handed gutted and chopped up the squid!,12개
42,nao,サムネが珍しくカメラ目線でカッコイイと思いました。,7개
43,TaeZamin,I'm starving here🤣🤣🤣but I dnt eat or like sea food 🤣🤣but I started getting hungry while looking at you eating all......,0개
44,,"辛いもの(大好物)がアレルギー反応出てしまってからは動画だけ見て欲を満たしてる😢💗
美味しそう食べたい、🤤",6개
45,Jade,Io aspiro ad avere il suo stesso talento nel mangiare,1개
46,NicholeEliseo,"i don't even care about the asmr part, i just love hamzy! lol shes so cute with her pup. her Q&A video made me really interested in her. i like how she includes the cooking as well.",32개
47,YashaIbrahim,Im so happy when hamzy noticed my comment everyday. Your liitle dog was so pretty today with bee outfit. Dish looks delicious and hamzy is so pretty and the best mukbanger 😍❤️,9개
48,WhoIsNana,everybody gangsta until Hamzy posted a video,1개
49,JavierPerez,Hola soy un suscriptor de México y con el respeto que mereces te ves muy linda con tu caballo así te ves muy bien ☺️☺️☺️,1개
50,JayashreeAnanthakrishnan,Hamzy's eating style is literally the most relatable one in the FOOD SHOW community😇😇,123개
51,ChubbyWhale,Those stare in the thumbnail makes me click so fast! Hahahha Hamzy is one of a kind 🤩🤣,20개
52,solraCnuaJyS,"Eating in the pan

Mood~~",1개
53,양재골TV,오늘은 완전 핸드메이드네요 ㅋㅋㅋ기성품말고 핸드메이드 많이 해주세요👍👍,6개
54,valenGomezlondoo,Me encanta ese ruido cuando comes pero la verdad no se nada de tu idioma así q no se lo q dices jajaj 😏😘😚 pero eso es bueno q te cuides,1개
55,GiGi,I love how you wrote your name on the cutting board ♥️♥️ it’s so cute,8개
56,ChaYa,Onnie.... you become more beautiful these days..... omcong yeppoda....,1개
57,zeynepzdemir,Hamzy is so cute. 😻❤,1개
58,하이,편집 때문인지는 모르겠지만 햄지님은 요리를 시원시원하게 잘하시는것 같아서 요리과정 보는 재미도 있네요👍👍,4개
59,jordanchaske,Even tho I'm native American I gonna say that your so beautiful and I'm still A subscriber to your channel,0개
60,mongnoona,"I love how you cook, hamzy.. and I really wish to know all those ingredients you used so that I could try it myself 🤧",0개
61,CubsChicago1450,Still can’t believe how this Little ass girl can eat that much. My kinda girl 💯,3개
62,bonmihobon,うっわー😳 もうこんな美味しそうなスイカ売ってるんだｯｯｯ!!いいなぁ～🍉🍉,7개
63,paolapitt,"MINHA LINDA QUERIDA HAMZY.,.. APRENDO CONTIGO COMO MANUSEAR OS FRUTOS DO MAR!! E, ESSE TEU AU,AU? VESTIDINHO..... É UM AMOR INCOMPARÁVEL..........",0개
64,OllyLyoli,Кальмары мняжка вкуснятина 🤤🤤🤤🤤🤤👍❤️👍❤️👍❤️,0개
65,JenJen,Did she swallow all the watermelon’s seeds? 😱,1개
66,itsmeCharliced,"me: craving for squid right now😁😁
love your nails☺️😊",0개
67,,"チャジャントリミングしてふかふかだぁ🐩♥️
Hamzyの腕に顎乗せ可愛い過ぎる❤️",4개
68,강주혁,오삼 불고기 내 최에음식인데ㅠㅠㅠㅠㅠ 진짜 맛있게 드신다ㅜㅜㅜㅜㅜ,8개
69,PreetyPajiyar,"I love when hamzy cooks😊
Lots of love from Nepal❤
Stay safe😌",0개
70,김알바,아니 식탁에 세팅할 때 뒤집어진 수젘ㅋㅋㅋㅋㅋㅋㅋㅋㅋㅋㅋㅋㅋㅋ가 배고픔을 다 말해준다,6개
71,marysajona,Omg I wonder how much scalded her gums and tongue are whenever she does mukbangs and the food is super hot! I can’t eat it hot like that and am Asian. Lol,0개
72,XiulyEXO,What I like about Hamzy among the mukbangers I am watching is that the way she prepares her food.. so satisfying. 😍,0개
73,DaisylAnnLlorera,"Annyeong!~

I'm just wondering if what is written on your pinned 😅 if I could read or understand hangul😅

I love your dish yesterday I am looking forward to have it next time😊

Especially, I love soooo much watermelon🍉🍉🍉

Thank you for another mukbang Ms. Hamzy!

Stay healthy, strong and safe. God bless!😊💛",0개
74,BabeeesRynnn,Although i watch this after eating im still starving at her food😭,0개
75,,珍しくサムネの顔が怖いね😅,2개
76,EMMAASMR엠마,"Who else loves her MUKBANG style??🙋‍♂️🙋‍♀️
👇",100개
77,,"イカ……絶対美味しい……♡
そしてサムネwww",1개
78,코로나꺼져,썸네일 보고 깜놀 ㅋㅋㅋ,5개
79,Neilpanmei,The way puppy looking at Her was so swt..worried she might step on the puppy. Hamzy is The best appetizer hahaha,0개
80,taniaramos,"A melhor parte vc na cozinha, muito caprichosa. Parece tudo gostoso...",0개
81,BarbaraLabry,I love it when your dog goes to the salon and gets all dolled up. He looks like a bumble bee in his little shirt. I love your channel. I haven’t missed a video since I found you. You’re awesome!,65개
82,ColleenChristopher,"I love the puppy's outift!!! He looks like a little bee..
🥰🥰",0개
83,PrincessSNOWWHITE,Hamzy is a great mukbanger and chef....Hit like if you agree😍😍😍,1개
84,KatrinaWilkes,I love Hamzy she fascinates me. I  have never seen anyone eat like that.,23개
85,PardonSeagull,"let me say again for the second time,
 you look like Seulgi. 


OKAY, I SAID AGAIN",0개
86,ERICHCHANNEL,Who loves hamzy cooking technique? Make this blue ✋,55개
87,MegaTube1313,I to like eating straight from the bowl 👹💕,0개
88,MrHugeD,I absolutely love how Sssniperwolfe was on an ad lol,0개
89,igot7,😂😂😂😂the thumbnail though ...I  thought she was glaring at me 😂😂,0개
90,다희아몬드,다 씹고 삼키기도 전에 다음 숟가락을 밀어넣는다. 가끔씩 탄산으로 눌러준다 ㅋㅋㅋ,10개
91,HangieTan,"YouTube: how gansta you wanted in your thumbnail?

Hamzy: *stares",116개
92,MEM,"I like watching the Chinese or Korean mukbang cause they actually cook their food, not take out all the time",0개
93,CelsaGarcia,"That looks delicious. I went to a Korean supermarket yesterday here in the U.S and I bought some kimchi and pork stew in a packet. I'm sure it won't be like your homemade, but I can't wait to try it.😉🥘💙",0개
94,Sporeal,Hamzu your hairstyle is so pretty and you are so cute I love you ❤,1개
95,HerikRuiz,"É mais legal ver ela preparando do que comendo, deveria deixar essa parte menor e parte que prepara maior rs",0개
96,SamGurung,Hamzy please adopt me🥺😭 trust me I’ll eat every bit of food you throw in my plate🤤💖,0개
97,오제명,썸네일이 흔한 드라마 부자 아줌마 표정이야.ㅋㅋㅋ,3개
98,ElizaAndaya,salivating : ((( your talent is to make us feel hungry whenever you eat. love you hamzy,0개
99,MariajosileneAbreu,"tô te achando linda com esse cabelo assim, aliás seu cabelo é lindo amor",0개
100,DEFASMR,Who is hungry for a second time? 😂,85개
101,BEV,"She hardly chews her food, it's swallowed whole 😲",0개
102,,Hamzy she look here so Amazing and cute :-D,0개
103,AsmaulHusna,"""Give me some food"" her dog said😂",0개
104,Kukuchanxiacuteee,She literally looks like Irene when she wears glasses,29개
105,farhanahfathima,Anyone else watching while laying in bed hungry???😐,67개
106,Levi1,"I'm hungry. This is too spicy for me, my stomach would be on fire. This little girl can eat.",0개
107,LadyJane,Hamzy love the recipe. It almost seems cajun in the best way. 😘delicious 💗💖❤💘,0개
108,firjatullahnastari,"I think she really listened to what her followers concerns, like she blow her food more often and longer then she was before, and i really appreaciate that. Hope u stay healthy and happy hamzy!",5개
109,KateGumi,"Yum yum and keeeyutee pajamas for you and your fluffy baby, I love seeing him rest into your arm as you eat!! Working hard with that 1 camera and you are doing great job for us viewers. ♥",0개
110,TamannaSaki,Hey dear Hamzy! Love from Bangladesh.. day by day am start loving Korean recipe.. & just try them from youtube.. & wanna say i love you ❤️,3개
111,Pikachupikapika,I love you hamzy❤️❤️❤️,1개
112,jasminlibunao,i love how you cook and eat the foodies 🤤,0개
113,LADY26BUNNY,"Aww, Puppy looks so cute in his little outfit. ❤💕💖 The food looks delicious hamzy. 🤤 Might I add watermelon is my absolute favorite fruit on the planet.🍉",0개
114,박똥꾸,"썸네일이.....  ""안보냐?"" 이러는거 같아서 봅니다....ㅋㅋㅋ",1개
115,FoodWorld,좋은 하루의 의견을 읽는 사람,1개
116,RonaBernadez,Youre a wife material hamzy. You're a great cook. Your soon to be husband will be lucky to have you😙,0개
117,도도네국수,ㅠㅠ오징손질 잘하신당ㅠㅠ그리구 요리에 정석이어딧어용!!햄지님 하고싶은거 다해라아!!,4개
118,FK,I want to live with her and eat those food every day 😭,0개
119,햇반쪽,"ㅋㅋㅋ 아니 햄지님 썸네일 무슨일이에요?
누가 화나게 했어요!ㅋㅋ
전 어릴 때는 수박씨 그냥 먹었는데 이젠 다 뱉어내요.
그냥 먹고싶은데 왜 때문에 그게 안 되네요😳

02:30 오삼불고기 첫 입 😮
02:43 밥도 한 입 🍚
03:18 반숙 후라이 비빔비빔해서 한 입 🍳
03:41 김!
04:32 김치 한 입 😮
04:49 쌈무랑 한 입 😮
07:28 오늘따라 털이 동글동글 어여쁜 짜장이 🐶
08:49 씨원한 사이다 🥤
09:19 짜장이 턱 챡 🖤
11:36 슈박 🍉",67개
120,RaehannahFlores,3:19 i felt the burn-,0개
121,VernicaOliveira,Jesus Cristo I Love yours. Amém,0개
122,loveRoselia,"辛さ慣れしてない人だとヤバそうですけど、辛いのは食進みますよね？(*^^*)
イカたっぷりでいい感じ！
美味しそう！",1개
123,VN,I love how you clean and wash and properly prepare and cook your food.,0개
124,디케이DKASMR,who loves hamzy's mukbang???😘😘😘❤,43개
125,SenyaPuro,My fav mukbanger btw your dog looks cute as always.❤🤗,1개
126,HrundiVBakshi,"Hamzys music is so funky that her dog got an afro! 

Congrats on hitting 3m subs!",0개
127,,"Кальмар, мясо, овощи, рис, яйца, и всё в перемешку!? Мда🤦🏻‍♀️",0개
128,JordanShepherd,doggie so cute looks like he got groomed :o),0개
129,이은실,짜장이이발했네~귀요미,6개
130,muhdsyahmi,It's first time Im see hamzy eat calmly like this😊,0개
131,공듀하마,"저 다이어트 중인데 햄지님이 먹방 하시는 거 매일 보고있어요 ㅠ̑̈ㅠ̑̈ 진짜 대리만족 대박이고 다음에는 파파존스 먹방 해주세요‼️🤤🤤
정말 맛있게 드셔주는 모습 감사합니다😭",1개
132,LoudesNalva,Muito lindo o cachorrinho de roupa de abelhinha mais hoje está com uma cara de desanimada. 🌸,0개
133,똘이행복이뻐꺼아빠,9:18 이뻐요,1개
134,blahblah,"NO TALKING👍
JUST EATING🥰
THE REAL QUEEN OF MUKBANG ♥️",35개
135,danilkyamador,"I would like to know the recipe of this food, it looks delicious. Please does someone knows it? RECIPE...",0개
136,SheallyMaijin,I wonder wht she's looking at? 😂,0개
137,요리하는요자,살찌셨네요~부운건가ㅠㅠ,2개
138,,У меня появился зверский аппетит после просмотра 🙈🙄😟,1개
139,,"300万人おめでとうございます(￣∇￣ﾉﾉ""ﾊﾟﾁﾊﾟﾁﾊﾟﾁ!!
すいか食べたい(@￣ρ￣@)",7개
140,MariaDulceMesa,"Oh my hamzy i feel hungry... 🤤🤤🤤
And your so cute😍 and your dog🤗🤗 i love watching your videos.. 👀😍",0개
141,짜글이,짜장아ㅜㅜㅜㅜㅜ 오늘 왜이랗게 기엽냐ㅠㅠㅠ 내가 제일 좋아하는 오삼불고기ㅠㅠㅠㅠ,0개
142,,サムネ　男かと思った。ﾋｲｨｨｨ!!!!(ﾟﾛﾟﾉ)ﾉ,1개
143,여민정,내사랑 햄지랑 짜장이 영원하라 ♡♡♡♡♡,1개
144,PrarthnaPradhan,Ohhhh wow!! Can I also join with you to eat?? I would love to you are so real and hardworking women who is entertaining us hats of to you and lots of love😆😍😘❤❤❤❤,3개
145,MadelynRago,Her dishes are amazing! So I now know her favorite store fry is octopus and pork of some sort. I just love her eating style. Every American/Canadian should take a page from her book. She the best Mukbang Eater!!!! Love and hugs from America New Jersey!!!!!,0개
146,SmritiandAman,Hamzys dog is also one of the reason why I love to see her videos 💕,0개
147,YeniAmbarsari,"맛있다, 음식 레시피를 공유하십시오🤤",1개
148,SilentBethlehem,Hamzy has the cutest dog.,0개
149,,レシピを教えて、いっも楽しみにして観ています☺️観ていていっも食べてみたくなります☺️,7개
150,SuzettePanday,looks so delicious and i'm feeling hungry😁 i like the color of your nail polish😊,0개
151,RamonaClawson,"Awww, your puppy looks so cute in his little outfit. He looks adoringly at you, hoping for a bite. lol. I'd pass on the squid but the rest looks good and now I'm craving watermelon. LOVE Watermelon, so good.",4개
152,SnehaKemprai,Day by day Hamzy is becoming more beautiful right ..her hairstyle too😚,0개
153,AfiaSweety,"Hey hamzy i m your big fan love u i live in korea but recently i move on my country but daily watch your videos lovely videos
♥️",0개
154,sampris,Hi Hamzy u knw one comedy I tried to eat infrnt of camera bt I was nt able to eat nt even 1 min also bt u r very crazy 😜 girl and I appreciate fr ur every attempts 😍 ❤️ today as usual no more words on ur eating bcz u r always rocking 🍲👍👏,0개
155,laathethe,te esta quedando la cara redonda de tanto comer🤣,0개
156,KeziahClaireManuguid,"Hello Hamzy! I m  from the Philippines. I'm one of you fan. I Always watch your  video. I like the way you prepare the food, I like the way you cook and the way you eat.. 😇",0개
157,RiaSora,Now I'm eating fish soup with rice while watching this video. And I'm still hungry 🤣,0개
158,,今日も美味しそうだ😋,6개
159,안진희,나듕나듕. 오삼이 먹고싶따규~~~~어따 잘먹소~~~,1개
160,웰가wellga,"진짜 매력있네요!
강아지는 진짜 훌륭한 조연출!!
음식을 원하는 모습 진짜 코메디에욬ㅋㅋㅋㅋㅋ",1개
161,안수정,강아지 팔에 턱 대고있는거 너무 귀엽다,1개
162,hioanah,the dog became beedog 😂❤️,0개
163,AnnaDrum12,who's starving in bed watching this?🤤😭,40개
164,JoedyDeGuzman,When you eat you make me hungry,0개
165,lymingho,I FROM 🇻🇳,1개
166,,I would love to drink some vodka with Hamzy with her cookings!,0개
167,,"韓国の料理に興味あって  色んなYouTube動画見てるけど  ダントツ！コメント多いですね💓💞
(*｀ω´)bです",1개
168,,今夜も迫力あって好き！もうスイカ食べてるんだね^ ^,5개
169,lalnunpuii,Omg❤️❤️❤️ literal Queen I love you so much,0개
170,HimanshuArya,"When watching Hamzy's video
Brightness: High 
Cooking: Too good 
Sound Volume : High
Eating : Too good 

Jjajang is adorable 
HAMZY is so pretty",56개
171,LanejaOneal,She makes everything looks good😋😋,0개
172,JunLife,"Every time she is cooking, I get hungry and I want food 🥵",0개
173,Kimboli대한민국만세,Thumbnail is so funny but I know when watching this I'm going hungry. HAHAHA,0개
174,LorenaJimenez,"How cute is Jajaang! Thanks for bringing him back 😊. I'm still waiting for your 3M suscribers celebration, maybe another Q&A, it would be really nice.",0개
175,BethEl,Id love to see a recipe or two!  Dang I love this channel!,0개
176,조서영,"앜ㅋㅋㅋ
썸네일 카메라의식하는 그녀
느므조앜ㅋㅋㅋㅋㅋㅋㅋ
히히히헤헤헷흐흣ㅎㅎㅌㅎㅅㅅ",8개
177,Kpoplovetaehyung,Hamzy ❤️,3개
178,NancyMoirangthem,She is veryyy beautiful in this vedio...extra beautiful💕💕💕💕,0개
179,JudithFierro,I’m in love with your pijama is super cute 💖💖💖💖,0개
180,AkireEloriaga,Her dog is very Cuteee 😍 Hamzy is the BEST 😍😋☺️,0개
181,ReshmaQursheed,Hey Hamzy wattssup ur sooo Beautyfull & u eating Soo nicely I lovedidn't 😍😍😍😍😍😍😍😍😍,0개
182,GETSA15,Lol can't even see the raddish it's sooo white 😂,41개
183,kimozmocheonsa,This looks so delesioce 😅,0개
184,AerichBalanggao,"you really make me hungry all the time, hamzyy 😔😔😔",0개
185,sarahJordan,I love salt on my watermelon very good love coming from the US 🥰,0개
186,H3,시각.청각이 만족되니까 후각도 느껴지는거 같애,0개
187,삼세SAMSAETV,안녕하세요 오늘 넘무도 맛있는 오삼불고기네요 행복한맛  오늘 산촌 생일이에요 축하하여 주세요 감사합니당,3개
188,CenzikiCh,I really like this hairstyle of yours.☺,0개
189,AisyahIstiqomah김,3 million🌼🌻💪💕💙,1개
190,KoriHardi,I was late and there were 1.5M views already😱. Hamzy is incredibly amazing!!!,0개
191,jhenyxz,"I hope you can post all the ingedients or at least the spices/condiments that you used in the dish (for your future videos), because it's yummy! 😊Thanks!",0개
192,CJ171,Hamzy's dog is the most adorable and sweetest little dog ever. I love the way she loves him and I love the way he loves her!,55개
193,SOUND모두의사운드,짜장이햄지님팔에기댈때귀여웡~~~🥰🥰,1개
194,은주김,음식 셋팅때마다 짜장이가 설레ㅋㅋㅋㅋ,1개
195,AnneLisLarsson,whats the name of your cute dog?. Me and my husband have 3 cats whish were resued from a terible life. your meel fore todays looks very tasty. Hi from Sweden on te outer side of the earth.,0개
196,이지현,으흫 처음에 짜장이 너무 귀여워요ㅠㅠㅠㅠㅠㅠ,1개
197,BunASMR,Hamzy always makes such hearty looking meal ☺️,23개
198,JazzPiano,진짜너무배고픈데 너무맛있게드심ㅠㅠ음식도뚝딱!!!,2개
199,PatriciaAbbato,"I Like your dogs bumble bee pajamas, he looks adorable all dressed up. I Watch your Videos all the time, Take Care. What's your dogs name?",0개
200,EmanuelBodia,I just love the way you prepeare the food! ❤️,0개
201,GaigaiMu,"The cover picture of this video is like, dare you touch my food!
I don't, seriously ฅ ฅ",0개
202,tommyamorin,It bothers me a lot when hamzy eats the food in very hot....,0개
203,KimCArah,Hoping to see you trying some Filipinos (Philippines) food also. 😭,0개
204,곰구름,드디어 완벽하게 제 취향에 맞는 먹방을 찾았어요 ㅠㅠㅠㅠ 첫 영상 보자마자 구독 누르고 영상 다 조지고있습니다.. 그동안 이런 먹방을 찾아왔어요 드디어 정착했습니다ㅜㅜㅜ,1개
205,dearnics,"whole else was waiting for it!!!  
btw I’m a small youtuber 🙋🏽‍♀️",0개
206,,アンニョンハセヨ美味しいそうピース✌️もう西瓜🍉食べてるや。,5개
207,AteAshlee,it seems like your getting fat hamzy?! 🙄🧐 hmmmm,0개
208,saponchong,Looks so delicious🤤🤤🤤 and the way you eat makes it even more delicious 😌,0개
209,마인파이,더울땐 라면 추울땐 아이스크림이 최곤데,1개
210,MoniqueVital,Ela mede com a mão :3 Se fosse eu salgava :v,0개
211,,調味料、全部気になる！！！,9개
212,오이,썸네일 마치 내가 한입이라도 뺏어먹을까봐 째려보는 느낌이 강해서 들어옴.....,2개
213,zlemtr,"We loved you naturally, without makeup.  Go back to the core, you don't have any difference from the others.",0개
214,LizaLa,"hamzy is very good at cooking!!


dont y'all think so",0개
215,VaishuJana,I love this 😘😘😍😍 when im watching u Video im getting hungry i love u soo much,0개
216,SadiASMR,"Anyone watching this while lying on bed with fasting?
.
Me: satrving🤩
I lv hmzy",53개
217,safiraaliifa,Nooo i'm full already but why i still feel hungry  😭,0개
