닉네임,댓글,좋아요수,날짜
햄지Hamzy,"첫입 2:35, Start eating 2:35 
살도 너무 꽉차있고 뜸들이는걸 깜빡한것도있고 
그래서 그런지 쏙~빠지는게 안되서 싹싹 긁어서
먹었어요 ㅋㅋㅋㅋ
(비싸서 자주못먹는거라 능숙하지가 못하니 이해해주세요 ㅋㅋㅋ)
 
※ 라면도 라면이지만 내장에 참기름,김가루넣고 
밥 비벼먹으면...........🤤🤤🤤.
 
※ 대게 특성상 깨끗하게 발라먹으려면 시간이 너무
오래걸리기때문에 너무길어지는 부분은 편집했어요저거 다 발라먹으면 1시간은 걸릴거같아서 ㅠㅠ
 
★예상질문★
Q: 대게 어디서샀어요?? 몇키로에요??
A: 러시아대게 6kg에요~ㅎㅎ 
https://bit.ly/3bq5GMAB
Q: 남은거 어떻게 했어요??
A: 못먹은건 촬영다하고 천천히 다 먹었어요~ㅎㅎ
두마리 남은건 부모님 가져다 드렸어요🤣
 
★자주하는 질문★
Q: 몇살이에요? 직업이뭐에요? 남자친구있어요? 
결혼했어요? 등등
A: https://www.youtube.com/watch?v=VEKcM1LP7SQ (햄지's Q&A) 
Q: 사용하는 제품 (주방도구,강아지장난감,악세사리 등등) 어떤건가요?
A: 제가 댓글확인을 웬만해서는 하려하는데 못보고 지나가는것도 많이 있어서 대답을 못해드린분들도 많을꺼에요~ 
인스타로 디엠주시면 사진이나 링크 보내드릴게요♥
Q: 앞에 뭐보면서 드시는거에요??
A: TV음소거하고 보면서 촬영하고있어요~ 
(시선처리때문에)
 
오늘도 시청해주셔서 감사합니다❤😍",535개,2020. 5. 26.
LaLisa,"Unnie I love you🇵🇭
She's so pro and I love it❤️",11개,2020. 5. 26.
alvos,This is the first time I see her actually liking food. Normally she makes faces like she's in pain but today she was all smiles. Finally lol,5개,2020. 5. 26.
,"Привет🙋‍♀️я из Якутии,мне так травится как вы кушаете,здпорово бы вам погостить и кушать вместе  с вами",10개,2020. 5. 26.
falishagomez,"She is tearing those crabs up! Girl, can i join ya with my garlic butter and pepsi !?! Lol",9개,2020. 5. 26.
TEAMSNOWBAL,"tffff whats with the dislikesss:(




love hamzy(ㆁωㆁ)",1개,2020. 5. 26.
ChristianPaulJuan,I can feel and see that she is so happy while eating it😂,6개,2020. 5. 26.
PinkLeonix,Everytime Hamzy eat this kind of food I get extremely sad 😭😭😭😭 Hate being Allergic to Seafood.,204개,2020. 5. 26.
CrazylaH3019,"0:33 it's the funniest video among all of Hamzy Video 😂😂😂

It looks really scary when she cooks it, but it's yummy 😂😂

I love the way she smiles at her food 😌😊,i can relate that, you're really luck Hamzy, Keep Going!",3개,2020. 5. 26.
PlushFurr,"I love how u showed the different thumbnails 😍😍 it almost look like ""a game character to pick to who you wanna "". God bless you and your channel. Keep growing",14개,2020. 5. 26.
Kishiiirams,Watching you eat while I'm having a break down makes me calm.,3개,2020. 5. 26.
BTSYounivers,Anyone noticed Hamzy's tiny smile of her first bite 😍,185개,2020. 5. 26.
RamuPrasad,"2:35 start eating, her smile after first bite 😄😃😀",11개,2020. 5. 26.
TedNguyen,I always break the legs at the joint but now see why she didn’t. She needs something to hold on to when eating the other part.,1개,2020. 5. 26.
faweditng,"Hamzy ilvyo❤️,i'm from Indonesian 🇲🇨",4개,2020. 5. 26.
dimpiasharma,"the most satisfying crab mukbang ever,,,",2개,2020. 5. 26.
,님들 아무이유없지만 좋아요 많이 받고싶어요,49개,2020. 5. 26.
AfiqahAzeman,2:30 I really like her smile when she is so satisfied with the food that she cooked😍😍😍,4개,2020. 5. 26.
EuniceValerio,"She rarely smile at her videos, so when she smiled while eating it makes me smile too😊❤️",15개,2020. 5. 26.
nicaserjas,i love how she puts the time where she starts eating for those people who can't wait 😆❤ she really cares for her viewers ❤❤❤ much love for you hamzyyyy,56개,2020. 5. 26.
TrisTris,"When i look at the dog, i want to say to him, i feel you. He got like 10 times more torture time than us, cause he can smell all the delicious food everyday  😂",49개,2020. 5. 26.
SyanaDelimah,"When she's smile..u know it is a good meal to try 😋
Love ya hamzy❤️",1개,2020. 5. 26.
MarceloRamos,Só eu ou todo mundo ja percebeu que ela da uma risadinha sempre depois que come .... 😂,1개,2020. 5. 26.
뷁키득,1:33 영덕대게의 딸램으로써 꿀팁을 드리자면 대게 다리 잘라 드실땐 몸통부분까지 빠싹 자르시는게 더 먹기 편해요^___^,23개,2020. 5. 26.
hala,i find it cute when she smiles at the food,1개,2020. 5. 26.
NovenaBasco,That smile on her fave when she had the first bite. Lol,124개,2020. 5. 26.
MariacarolinaFernandesalves,Posta com mais frequência amo  ver ❤🇧🇷🇧🇷🇧🇷❤❤🍙🍱,0개,2020. 5. 26.
AmyCurtis,It frustrated me how she was eating the crab 🦀 . Like let me show you how to break it down to get ALL the meat. 😂❤️❤️❤️,1개,2020. 5. 26.
HimanshuArya,Her priceless smile when she enjoying her first bite of crab .She eats in her own style .,29개,2020. 5. 26.
KrystleHernandez,The best part is when she takes that first bite and smiles like oh yeah this is good lol.,0개,2020. 5. 26.
NordingDeToi,"hamzy looks like a cute little hamster when she eats. 😍😍And always naturally, that's what I like about this woman",49개,2020. 5. 26.
BlaCkMOnsterAW,0:21 só eu que senti do caranguejo quando ele abriu os olhos 😞,0개,2020. 5. 26.
RichaRane,"Watching Hamzy eat real crab 🦀 while, me eating my imitation crab 🤭",1개,2020. 5. 26.
EstrellasvousAnn,"Glad this is the right way Hamzy cook crab. I often saw other mukbangers, idk but it’s really harsh they straight away put the alive crab. Good job Hamzy unnie!",1개,2020. 5. 26.
HGMLTV,The way she smiles at her food when she taste at it......i dont know why im smiling too....,84개,2020. 5. 26.
츄혀네,2:30 ㅋㅋㅋㅋㅋㅋㅋ비비면서 웃고계셬ㅋㅋㅋㅋ 언니 이렇게 행복해 보이는 표정 처음인 것 같아욬ㅋㅋㅋ,11개,2020. 5. 26.
FatinTasya,She really happy when she is eating 😂❤,1개,2020. 5. 26.
GiannaGutierrez,"HOLA , HAMZY ....SE VE RIKICIMO ESOS CANGREJOS🤗🤗🤗",1개,2020. 5. 26.
,She smiled before eating.🥰🦀,2개,2020. 5. 26.
CarmenGmez,"Una buena mariscada, si señora! ¿Hay algo mejor que eso?? 😋😋😋",1개,2020. 5. 26.
AlignWithDivine,Ur 1st bite got a big smile on my face ☺️. I am allergic to seafood but oh man !! ... D crabs looks delicious and tempting. Love the way u conduct urself while cooking and eating. D crab presentation was 👌👌👌. Keep it up Gal and loads of love n luck from India. ❤️,1개,2020. 5. 26.
CelsaGarcia,"I really enjoyed this video because I was so amazed that you don't have an issue with the shell. I know you don't eat all of it, but you do eat some shell? I always like that you never waste food. 😊💛🦀",1개,2020. 5. 26.
yesicaaraya,Several times I have seen her smile because of how tasty the food was😅❤,1개,2020. 5. 26.
JiaJanice,"I love uuuuu,,🌸🌸🌸🌸🌸🌸 loveee the fooddd somuchhh,, ahhhhh i wantttt to do as u also,,, carvingggg💜💜💜",1개,2020. 5. 26.
MarinelleFacundo,"How many camera do you want?
Hamzy:  yes",0개,2020. 5. 26.
REI,いや、ふつーに蟹食べたくなるねw,5개,2020. 5. 26.
AkiK,Oh I know and she knows that rice is the bomb 💣 when she smiled mixing 😋,1개,2020. 5. 26.
FaqihudinAnn,"Hamzy, u look so beautiful here 🙂. 
Im from indonesia 👋🏻",1개,2020. 5. 26.
LeoraOlsen,I found golems look alike,1개,2020. 5. 26.
solraCnuaJyS,"Mommy~~~

I want somee~~~",1개,2020. 5. 26.
BrittnyTaylor,I thought you couldn’t eat a certain part of the crab and your just eating anything so idk anymore lol,0개,2020. 5. 26.
ShifakAisyah,"How to treat yourself?

Hamzy: *buys 5 king crabs and eats them alone",180개,2020. 5. 26.
AnnaYunitaKorsianiMuda,can you eat at PojangMacha .  I really want to see it like that time🤗,1개,2020. 5. 26.
ClaytonJuan,Incredible! Watching your mukbang has taught me how to cook—in a good and delicious way. Thank you!,1개,2020. 5. 26.
LeahCruz,"I love how she's smiling bcoz the crab is so good. 
I'm jealous...",0개,2020. 5. 26.
AngelKim,The crabs is just so amazingggg❤️,1개,2020. 5. 26.
Ladiosadeversalle,"Ciao, avevo visto per caso un tuo video un po’ di tempo fa, non mi aveva piaciuto per niente, per la maniera come mangiavi; ma non riesco di smettere di vederti hehe 😅😅 un forte abbraccio da Milano Italia 🇮🇹",1개,2020. 5. 26.
ZhangYixing10,She looked super happy the crab 🦀 must be tased amazing 🤤🤤,1개,2020. 5. 26.
HaimMattabadul,"Hamzy, I never dreamt I would see a 'bucket' of crabs ready to eat... Could not believe my eyes... 🤪",0개,2020. 5. 26.
RMReed,"OMG!! Look so good!
One day I will afford to sit and eat like that...all by myself!!
I must 🔐 the kids out 🚪 🤣😂",1개,2020. 5. 26.
,蟹好きー♡♡♡,6개,2020. 5. 26.
CarolLo,I never seen Hamzy eating so happy like this for months.,0개,2020. 5. 26.
JyotiBhatoy,In this video I thought u was happy because u was laughing ...your quite smile is so beautiful ...be happy ..... God bless u dear.🙏🙏🙏🙏🙏🙏🙏🙏,1개,2020. 5. 26.
ErityaNinfaDelBosque,Hamzy eating crabs 🦀🦀🦀🦀 Really crunchy 👌,1개,2020. 5. 26.
KoriHardi,"It’s nice to watch her eating seafood, since they are hard to find due to this crisis. Cool mukbang, Hamzy!👍",0개,2020. 5. 26.
SanjayKumar,You know I love Korean food it's looks so delicious 😋😋 but unfortunately I didn't try it yet. But when you start eat I have water in my mouth 🤤🤤. I want to try it. And you look so cute when you start eating. It's my dream to come South Korea one day.  I hope my dream come true. 😀😀,3개,2020. 5. 26.
JannahHernandez,When Hamzy smiled for her first bite it was so refreshing i had to replay it. She rarely smiles in her videos🥰,22개,2020. 5. 26.
AkhumlaSangtam,She keeps eating and eating and gets cuter and cuter 💖💖,1개,2020. 5. 26.
Jessica22,aww... that satisfied face at your first bite is everything 😍💓,1개,2020. 5. 26.
PURPLEOKIDKID,"I think  she get salary,, that's why  expensive Crabs Party... Enjoy yur life Hamzy 👍",1개,2020. 5. 26.
Wardayy,2:39 ngeliat dia senyum gw jdi ikutan senyum😭 senyum mu nular mba hamzy,1개,2020. 5. 26.
ShihaniMunasighe,Imagine how much pain guys.what we expect by this my friends,0개,2020. 5. 26.
Xking,"3:46
Bruh you got red",1개,2020. 5. 26.
MunmunAdak,"I downloaded your vidio everyday and watch at night

LOVE From INDIA 
😋😋😋😋😋😋

😷😷stay safe",2개,2020. 5. 26.
EnyuZeeMukbang,I want someone to look at me the way Hamzy looked at the crab in the thumbnail 😍,62개,2020. 5. 26.
paolapitt,"QUERIDA HAMZY,  ME PERDOE COM MENOS ATENÇÃO... É QUE MEU PAÍS ELEGEU UM FACÍNORA E, TENHO QUE COMBATÊ-LO!!!!!!!!!!  BEIJOS.",0개,2020. 5. 26.
,好きなものを好きなだけ食べれるの羨ましい。,5개,2020. 5. 26.
PUGOTO,"Her videos make me so hungry everytime....😋😋😋 I LOVE YOU, Hamzy!!❤️😍❤️",1개,2020. 5. 26.
WilmerAlbatin,"My blood pressure says ""Hi"" to me LOL",0개,2020. 5. 26.
NurHanisAzura,crab + ramen = perfect combo unnie ❤️😍😭,3개,2020. 5. 26.
LhetSantos,"I love watching these two  lovely creatures  pretty young lady  and her superrrr cute puppy makes my day complete..Aside from that im enjoying watching as well seeing this pretty lady eating a mouth watering foods soooo enjoyable watching...Hoping more videos to watch to both of you... .God bless you pretty lady and superŕrrr cute puppy..
.",0개,2020. 5. 26.
SajidShaikh,Hamzy you are looking so cute but where is your mother and father 😊😍😍🤩😘💋💞,1개,2020. 5. 26.
김보리,내가 무슨 부귀영화를 누리겠다고 이 시간에 이걸 봤을까ㅠㅠㅠㅠㅠㅠㅠㅠㅠㅠㅠㅠㅠㅠㅠㅠㅠㅠㅠㅠㅠ엉엉,1개,2020. 5. 26.
Silvinabp,Love when you taking picture for thumbnail,1개,2020. 5. 26.
뽐양,부럽당. 음식 지원도 받고 맛난거 먹으면서 돈도 벌고ㅜ 짱부럽,23개,2020. 5. 26.
CheremiePestao,You're like dancing gracefully while you eat 😍,1개,2020. 5. 26.
,ズワイガニさばける強い女になりたいです🤜🤜🤜,4개,2020. 5. 26.
LeeSarang,Hamzy smiling🤩,2개,2020. 5. 26.
AninditaDutta,"that smile, before havng food. Lovely. . .👌😍",1개,2020. 5. 26.
,食べ残し、贅沢な食べ方✨絶対に美味しいやつ😉👍,6개,2020. 5. 26.
ReikoEnd,"蟹美味しそう🦀
めっちゃ幸せってのが、伝わってくる
器用にホジホジして食べてるのが可愛い😍",7개,2020. 5. 26.
AneesaMehmood,"HAMZAY I really love u and love the way u cook and eat, I watched all of ur fantastic videos ,,buttttttttttt I don't like crab and I don't like seeing u eating crab  🦀 😭😔😭",0개,2020. 5. 26.
AaBb,ลองน้ำจิ้มซีฟู้ดหน่อย🤣,1개,2020. 5. 26.
BeatrizA,I love how she really tries to read all the comments,0개,2020. 5. 26.
liooloo,Korean mukbanger literally slurping everything they eat. I like it?,3개,2020. 5. 26.
,I was expecting fried eggs on the top of your crab roe mixed rice😂😂,0개,2020. 5. 26.
sabreenAli,"I want ot see hamzy breakfast ot dinner routines video 

Who agree 💛💛💛💛👇👇👇👇",1개,2020. 5. 26.
PepEvans,"Put straight in ice water after cooking, then meat is easier to get out",0개,2020. 5. 26.
agnEsortEga,I can see that you really happy with your first bite 🤗😋 yummy!,1개,2020. 5. 26.
saesilking,먹으면서 돈벌고ㅠㅠ개부럽다,11개,2020. 5. 26.
evilusyani,"She smart cook 
Every food she eat alwys has a energy",0개,2020. 5. 26.
CrazylaH3019,"I also wnat a Crab, but i have allergic to crab 😤",1개,2020. 5. 26.
LeoraOlsen,How would you like it i did that same crab thing to you,1개,2020. 5. 26.
BlackSilva,"unnie can i have a favor how to write my name in korean text "" JUN """,0개,2020. 5. 26.
SHIMMYSHIMMYKOKOBOPEXOLBLINK,I love hamzy 💕,1개,2020. 5. 26.
LovelyT,"I like that she killed the crabs humanely. Instantly before boiling them. Others actually boil them alive, which is something that's just inhumane.",0개,2020. 5. 26.
y,"蟹口周り痒くならない?!
苦手なんだけど美味しそうに見えるのは何故😍（笑）",4개,2020. 5. 26.
UlfaTrinovita,OMG I never see your smile like that when your first bite 😄😄😄,0개,2020. 5. 26.
SeoHee,2:30  저 웃음은 찐이다....,30개,2020. 5. 26.
geministar06,I love snow crabs 🦀 You always tempting me...... 😅😋,1개,2020. 5. 26.
SyikinShapie,This feel like watching Haruhi from ohhc,0개,2020. 5. 26.
Rimacat,"OMg😂
😂😂😂this so 🤤🤤🤤😋👏🏻👏🏻🤤🤤🤤🤤
LOVE you❤🍯",0개,2020. 5. 26.
RegianeSousa,Amo te assistir.parabéns cozinha divinamente bem,0개,2020. 5. 26.
,"うわぁぁぁぁ😂😂😂
お顔笑ってますやん🤣💕",11개,2020. 5. 26.
AqilahSaidi,i can see from your smile that this dish is really make me crazy..... i wish i can have it tooo,0개,2020. 5. 26.
MaxBGI,Seriously? What kind of show is this showing someone eat like a barbarian?,0개,2020. 5. 26.
MomodustychinchillaBaby,"When Hamzy smile for food, u know it is really delicious 😋",7개,2020. 5. 26.
MatsumuraAkiko,"蟹～🎵
贅沢や〰️🎵",2개,2020. 5. 26.
CherlineElidor,hamzy 나는 당신이 먹는 방식을 사랑하고 당신의 가족이 건강하고 계속 당신을 사랑하기를 바랍니다,3개,2020. 5. 26.
SabrinaShahrudin,"Is that jjajang voice? It's rough like olders dog, that's cool!!🐶😎 I really love crab😋 but unfortunately I have an allergist after that when I was a kid so I don't have an opportunity to eat crab again 😭😞",0개,2020. 5. 26.
BarbaraLabry,Thumbs up on the background music. 👍🏼,1개,2020. 5. 26.
cydneyclareOntiveros,Pink leonix same I can't even eat my favorite fish even I haven't taste it yet it's my fave,0개,2020. 5. 26.
MIAO,"Hamzy,,, I have never liked watching mukbang videos until now. Been watching your mukbang videos every night  for a month now and I tell you, i enjoy all of them. Love how you are creative, cook your own food, your kitchen is clean,pretty and very organized. Love how all of your food looks.  Also that you are natural in front of your cameras and you definitely are comfortable in how you look in front of the cameras, although you always look awesome. Love how you eat with passion!! Take care Hamzy, stay well. Waiting on your next video now!! 🙂💜🥘🍲🍱🍜🍚🍣🍤",0개,2020. 5. 26.
desyanadyahas,"hamzy so cool,the way she prepare everything is good and clean ...",42개,2020. 5. 26.
AngelaSweetAlbino,"You organized it very well, Hamzy ❤",1개,2020. 5. 26.
도도네국수,손질하는거 개멋져ㅠㅠ나는 무서워서 못하는데ㅠㅠ,1개,2020. 5. 26.
RachelSmith,Great crunches and eating sounds! 😍,1개,2020. 5. 26.
hoon17,"햄지님 정말 제 최애 유튜버십니다
먹방 유튜버중에 제일 취향저격임♡ 
조회수도대박
앞으로도 더 맛있는거 많이많이 드셔주세요 ㅋㅋ구독자  300만명 축하드려여",1개,2020. 5. 26.
아담Adam자취생먹방,"와 대게 ㅠㅠ 대게, 대게라면 전부 다 너무 맛있어보여요!! 햄지님 드시는 게 너무 귀여우셔서 기분 나쁘실 수도 있는데 귀여운 햄스터같아요 ㅠㅠ 너무 오물오물 야무지게 잘 드세요😁😁 저는 처음에 드실 때 햄스터닮으셔서 햄지인 줄 알았어요:)",23개,2020. 5. 26.
janizelisantana,essa comida e muito boa vc sabe mesmo cozinha😍😍😘😘😘,1개,2020. 5. 26.
HL,와 첫입 진짜 깔끔하네 깜짝 놀람ㅋㅋㅋ 옛날에 빠른 햄찌님은 없지만 또 색다른 햄찌님이네요,1개,2020. 5. 26.
MichaelContreras,"Hi hamzy im your big fan. I hope you can help me because of this pandemic, my family has no food even my baby he has no formula milk, i cant provide a money because of the covid lockdown, thats why we dont have enough food to fed my family i hope you can help me 😢🙏",0개,2020. 5. 26.
JovilMartinez,I LOVE YOU A LOT HAMZY ❣️😘 ( Since day 1 ) frm. PHILIPPINES ❤️,0개,2020. 5. 26.
kakang5239,woooow. i think im hungry even though i just finished my dinner. 😂😂😂😂😂😂😋😋😋😋😋,9개,2020. 5. 26.
perriaP,"0:28 вау живые 😯
0:43 🗿",0개,2020. 5. 26.
sakijayS,"Wow ! I saw your smile 😊 cute 💕
Gorgeous dinner with king 🦀 crabs. I want some with butter sauce !!! Yay 😁",1개,2020. 5. 26.
BrandiiKimble,Lol she looks so happy eating crabs. Lol id be happy too. Much love from Texas!!! 😝😝😝😝🔥🔥🔥🔥,0개,2020. 5. 26.
DionneLowe,🍛Yum....Hamzy you make eating that look so easy. I struggle lol 💖🙏🏽😋😋😋,1개,2020. 5. 26.
MeLyric,I love the way she eat the crab . Looks how aggresive she is 😜,23개,2020. 5. 26.
Brandonapuii,Very satisfying when she takeout every meat 🤤,0개,2020. 5. 26.
PutriAmera,I wonder who's the person recording her...,0개,2020. 5. 26.
JANJUNG,If eat crabs 🦀 must to eat with seafood sauce in Thailand 😆it’s very good taste,0개,2020. 5. 26.
PimphanWachiraphan,I want you to eat Thai food very much. Very tasty.,1개,2020. 5. 26.
roku66,"ニコニコしながら　食べてる
いつも　クールなのに
カニ　大好きなんだね　かわいい😍",36개,2020. 5. 26.
HanaKeytReyes,Crabs are my favorite. But now i find it terrifying because of its size hahaha,0개,2020. 5. 26.
RosangelaAlves,Amo 🦀🦀♨️💞 muito 🇧🇷,0개,2020. 5. 26.
TheMarionette78,Happy Hamzy.😍❤,1개,2020. 5. 26.
Kingo,Awww youre smiling! This tells me you really love crabs!,0개,2020. 5. 26.
rurupp,"표정을 못숨기시네 ㅎㅎ
진짜 맛있다는 거죠 ㅠ",3개,2020. 5. 26.
JayDamie,I love crab too 😍😍 omg . Its too delicious 😍😍 ..♥️♥️♥️♥️ Love Hamzy From Malaysia 🥰,0개,2020. 5. 26.
MeoZac,Unnie happy face when she knows it is worth it <3,0개,2020. 5. 26.
Sapphire5492,"Hi there Hamzy!!! Thank you very much for doing a seafood eat down. I just enjoy and love the way you eat seafood!!!  Your seafood eatings are the ones I just love and can’t get enough of!  Thank you once again! Sending you much love ❤️ take care of yourself, be safe and I wish all your loves and your little dog much love as well and may you all be always in good health.",0개,2020. 5. 26.
ThuThuAung,"Why are u so cute babe 😍
Really love u ❤️",0개,2020. 5. 26.
,🦀の解体うまいなあ😀,19개,2020. 5. 26.
LanejaOneal,Omg 😍😍 I want sum hamzy,1개,2020. 5. 26.
WTFood,She’s low key so cute,0개,2020. 5. 26.
MaryChapin,"Saraaaaaaap 😩🤤

🐶♥️ lots of love xx",0개,2020. 5. 26.
CaraWang,I’m glad she’s eating so well 🥺,0개,2020. 5. 26.
MarielledeGuzman,She cleans them so well! 😂,0개,2020. 5. 26.
쉼표쿡앤먹CommaCookEat,야무지셔..아주..못하는게 없으셔..친동생 삼고시포..ㅎㅎ,1개,2020. 5. 26.
HuzylysTaste,Oh mouth watering 😍🤤😂,1개,2020. 5. 26.
JayzelChua,What I love about your channel is that you show us how you prepare your meal. It gives us cooking ideas to try. Keep it up!! ❤,1개,2020. 5. 26.
BunASMR,Hamzy doesn’t waste any part of the crab,154개,2020. 5. 26.
ZeanDelaPea,It so big crab! I'm starving HAHAH first bite si delicious.,0개,2020. 5. 26.
TrnUynKhanh,"Love Hamzy<3
so yummy yummy :)))",0개,2020. 5. 26.
ShannaBananas,Kinda wanna know what the innards with rice taste like,0개,2020. 5. 26.
Lee나나,"아~~~ 첫입 내장밥 참기름에 완젼 꼬소히요^^
대게가 완젼 맛나게 드시는요~ 💚너무넘넘넘 먹고싶어요^^🥺😭",1개,2020. 5. 26.
SK,今晩お疲れ様です。カニ🦀めっちゃ美味しいそうですね。,1개,2020. 5. 26.
jungtae,I'm glad you didnt edit your video this time hsgsgs i mean i still prefer when im watching you eat in normal speed 🤣,0개,2020. 5. 26.
AKEMI,"ヘムちゃん❤️チャジャン君❤️HELLO‼️蟹みそご飯最高に美味そう～😋👏👏👏❤️❤️❤️かぶりつきた〜いよー٩(ˊᗜˋ*)و気持ちいいぐらいの
食べっぷり最高です👏👏👏👏👏💖😉💖",1개,2020. 5. 26.
ShansiaBach,"from the way she smile , she love eat crab so much 🤣😍",0개,2020. 5. 26.
RatihPradnyani,I wanna see you and youre husband eating together😍,0개,2020. 5. 26.
KarishmaRughoo,She is so cute while smiling 😊😊,0개,2020. 5. 26.
RC,You chew the exoskeleton like it's nothing and nothing seems to get caught between your teeth! 😎,0개,2020. 5. 26.
StormyWeather,What does the green stuff on the inside taste like?  Not sure I could stomach it.  😬,1개,2020. 5. 26.
wp,にこにこ美味しそうに食べてめっちゃ可愛い♡,13개,2020. 5. 26.
kayongaynor,"빨리집에롱사용자 문서, 툝ㄴ글로벌세계대백과털어 평촌 쾌유하시길바랍니다.",1개,2020. 5. 26.
TriAgustina,Keep going on Hamzy. Just keep being yourself,0개,2020. 5. 26.
GCF,"당신이 얼마나 달콤한, 당신이 미소 때, 나는 당신이 2:30 분에 미소를 지었을 때 너무 기뻤습니다, 내 요청을 무시하지 않고, 더 자주 미소, 아름다운 감사합니다. 1 억 명의 가입자가 있습니다. 사랑 해요,Hamzy💞❤️",1개,2020. 5. 26.
BestSlimesrecipe,We don't eat this kind of food anyways asmr was amazing,0개,2020. 5. 26.
,こんなふうに食べてみたい😆幸せそうに食べてる〰(笑),22개,2020. 5. 26.
AlecitaDelabarraalvarez,Simplemente delicioso acá en Bolivia es difícil encontrar mariscos cangrejo langosta solo hay un lugar pero es muy caro,0개,2020. 5. 26.
tyrhshkr,Hamzy so cute ~kyopta~❤️,1개,2020. 5. 26.
SelenaCole,Wow! Those are some nice/ hefty looking Snow Crabs ya got there. 💜 Hungry!!!!,0개,2020. 5. 26.
AJH,저..영상보고 인어교주해적단들어가서 바로 대게 5키로 퀵으로사서먹었어여 진짜 햄지언니때문에 미티겠음....,1개,2020. 5. 26.
VedikaSharma,I just love her expressions while she eats...such a cool person...nd her dog is as cute as her💜💜I want a dog like hers too,41개,2020. 5. 26.
Shialacha,"Hi Hamzy! Wonderful video and yummy! Omg tomorrow I am gonna treat myself to some pasta with crab 😋 right now eating noodles, buon appetito :3",1개,2020. 5. 26.
,РАК😍😍😍😍😍КАК ЭТО ВКУСНО ВЫГЛЯДИТ 🥰🥰🥰🥰,0개,2020. 5. 26.
DarthMommy,"That big pot is perfect for menudo , pozole , and tamales 🤤",0개,2020. 5. 26.
DoaaAbas,Someone pls tell is this her nails or fake it's really a strong nails though 😑🤨🤔,0개,2020. 5. 26.
NajRaf,I mean.. that look on her face is happiness! 😋,0개,2020. 5. 26.
RenataSantos,Brazil love hamzy 🇧🇷😍,0개,2020. 5. 26.
Roseuwuwuwuuwuwu,Atleast she's not torturing the food before she eats it that's why I stan,0개,2020. 5. 26.
SuciRammadhani,When i watch you eat I ALWAYS HUNGRY🥺,0개,2020. 5. 26.
봉이네TV,"2:35 eating start 👍👍
It looks really delicious. I'm hungry😢😢",7개,2020. 5. 26.
,"顔も可愛いし、この食べっぷり
最高😍😍",0개,2020. 5. 26.
TamieDavis,I love her smile.  She enjoyed this mukbang...,0개,2020. 5. 26.
JennyChuuTV,"I want to see you try other countries food, like Nasi lemak",0개,2020. 5. 26.
PRAJAKJITPABJATOORAS,"I really want to introduce you the thai seafood dripping. It’s really suit with every type of seafood, hope you try it later ^^",0개,2020. 5. 26.
