,youtube_id,comment,like_num
0,햄지Hamzy,"첫입 3:22, Start eating 3:22 
마산에서 홍합양식을 하시는 구독자님께 인스타
DM을 받았는데 최근 코로나로 인해 홍합출하량이 
급격히 줄어 어민들이 큰 어려움을 겪고있다고해요~
 
제가 큰 도움이 되진 않겠지만 홍합을 좋아하시는 
구독자님들이 조금씩 도와주시면 어민들에게 큰 힘이될수 있을것같아요!

☆구매처 물어보셔서 남겨놓을게요~ 둥이수산홍합 검색하시면 나와용😆
 
※어제 촬영한 영상인데 최대한 빨리 업로드하려고 
편집 열심히 했어요😭
 
※영상 촬영후 홍합탕에 소주 몇잔 더 마셨어요ㅋㅋ
 
★예상질문★
Q: 양념장 레시피 알려주세요~
A: 파,고추,양파,다진마늘,간장,설탕,고추가루,
참기름,깨
Q: 홍합탕 레시피 알려주세요~
A: 대파,양파,청양고추(칼칼한맛 좋아하시는분),홍합
처음부터 넣고 끓여주면돼요~ 간은 소금으로 맞춰요
 
★자주하는 질문★
Q: 몇살이에요? 직업이뭐에요? 남자친구있어요? 
결혼했어요? 등등
A: https://www.youtube.com/watch?v=VEKcM1LP7SQ (햄지's Q&A) 
Q: 사용하는 제품 (주방도구,강아지장난감,악세사리 등등) 어떤건가요?
A: 제가 댓글확인을 웬만해서는 하려하는데 못보고 지나가는것도 많이 있어서 대답을 못해드린분들도 많을꺼에요~ 
인스타로 디엠주시면 사진이나 링크 보내드릴게요♥
Q: 앞에 뭐보면서 드시는거에요??
A: TV음소거하고 보면서 촬영하고있어요~ 
(시선처리때문에)
 
오늘도 시청해주셔서 감사합니다❤😍",440개
1,VedikaSharma,"I wish I could have soju too nd enjoy rather than being locked...
Who else want to have Soju..nd enjoy life..because of Hamzy I could enjoy the lockdown💜💜",21개
2,RubeenaRehan,THE  WIDE SMILE OF HER AFTER HAVING THE FIRST BITE OF FOOD IS SOO SWEET TO WATCH !!!! :) :),6개
3,HrundiVBakshi,2:02 & 3:25- Hamzys subtle smiles telling us that this food tastes damn good.,9개
4,AnneBites,I'm craving for buttered mussel with cheese after I've watched this.,18개
5,김종욱,"안녕하세요 햄지님!
무리한 부탁이였지만 업체 홍보가 아닌 어민전체에 도움이 된다는 말에 선뜻 촬영해주셔서 너무나 감사드립니다.
코로나19로 인해 어려운 우리 어민들에게 큰 도움이 될거같습니다.
일면식도 없지만 큰 도움을 주시는 햄지님 같은분을 위해서라도 저희 모두 힘내서 더 신선하고 좋은 상품으로 보답할수 있게 노력하겠습니다^^
이런 선행이 다른 선행으로 이어져 어려움을 겪는 많은 사람들이 이번 고비를 잘 넘길수 있기를 희망합니다.
다시한번 너무나 감사드립니다^^",99개
6,ISUCKJINTOES,When your early and you don’t see any funny comments:(,20개
7,EstherVltz,Who else never skip the cooking part😂,79개
8,KajalKiran,"Who's always desperate to know what Hamzy gonna eat next ???
👇💕",143개
9,AnnaSavkina,"Приятного аппетита, Hamzy! Замечательная доставка и морепродукты просто супер!)",15개
10,emberccy222,I can feel the happiness from her face while eating all these mussels.. hahaha... good cooking... I am hungry now.. oh my god...hahahaha,3개
11,만두르,"이 온니 이거 진짜 보통 센스가 아닌거시다... 진짜 대중의 마음을 읽는게 쉽지 않은일인데
거슬리는 구석 하나 없이 완벽한 힐링 먹방을 만들어내는게... 진짜 이건 센스 없이 나올 수 없음
ex) 
건강 챙기세요 ㅠㅠ: 건강한 음식 먹음
메뉴가 맨날 겹쳐요ㅠㅠ: 안겹치고 오히려 신선한 메뉴 가져옴
표정이 너무 억지스러워요 ㅠㅠ: 그딴 거 없음
너무 많이 먹는거 같아요 ㅠㅠ: 적당히 먹음

가끔 먹방 비제이들 보면 조금씩 아쉬운 부분 있어서 클릭 잘 안하는 경우가 있는데
이 언니는 아묻따 그냥 클릭 
햄지님 구성능력 진짜 리스펙 합니다👏🏻👏🏻👏🏻",81개
12,FanGirlFanGirlSing,"The way she smiled to that sauce, ah, my heart melted",45개
13,BTSYounivers,I love Hamzy's Eating... it's 100% natural them other mukbangers who take very big bites that really is not normal for us... Hamzy's video makes us be hungry naturally but theirs big bite make us wonder how is it possible take that big bite that we can't focus on food but we see only big bites 🤣... this is why I love Hamzy 100% normal & natural,1개
14,HopeBokingo,"Mussels are actually my favorite food and I usually make baked mussels with cheese and green onions and paring them with rice is awesome
Hahaha gaining weight during quarantine..... I luv ❤❤❤ your videos Hamzy daebak daebak.....",3개
15,dyah22h,"""i can live inside this cave for a really loooooong time""",2개
16,RashiBhattacharjee,she looks so happy whenever she eats. I love it 🥺😭❤,2개
17,MimikyuDisguisePokmon,"Her: ""Eats many but thin""
Me: ""Eats with a teaspoon , gets fat""",47개
18,RaisaAfrin,Her dog is like ain't no pandemic is gonna stop my hooman from eating in a wholesome way,1개
19,HQ,Your happy face when finally you can start eat makes me smile 😂😂😂,2개
20,DeborahChristy,The way she eats ... Am damn loving it.... Love from india,2개
21,DaisylAnnLlorera,"Annyeong haseyo!~ 

I might say that you loved Mussels so much by seeing you smile when your going to eat after cooking😅🍲🍴

Here in the Philippines we call it ""Tahong"" and I loved it sooo much just like how much you enjoyed it. By having a Baked Mussels with cheese and Mussels soup (Daebak)😅

Kamsahamnida for your another video😊

Suggestion: Please try our snacks and have a taste test of it😊 I highly recommend PIATTOS, CHIPPY, NOVA, MR.CHIPS, CRACKLINGS, DINGDONG😊

Again, Thank you! Sta healthy ad safe Ms. Hamzy! God bless😊💛",1개
22,호호,"언니... 사람 사는거 다 똑같나봐여...
진심 난줄....
혹시 술드시고 노래들으면서 춤도추시나영...",28개
23,림이,미쳤나봐...해산물이라곤 싫어하는 내가 홍합이 다 먹고 싶어지네..........ㅠㅠㅠ햄지님 당신 ......👍🏻,56개
24,mrgoatgaming,is it me or does hamzy really enjoy getting hammered lmao,1개
25,YumekaVadam,Sweet puppy boy🥰 This was a delicious feast. Everything looked delicious and went vfc well together. 👏💘,1개
26,UrmilaRawat,I just love her eating with that wooden spoon.😻,2개
27,ZayraMaePedro,I really love seeing how hamzy eats❤❤,2개
28,AsimahHjYassin,"who elso like hamzy's while cooking
👇",56개
29,littlebirdcutie,"she's the first mukbangers that got fatter, i love her bcs it's show how humanly she is compared to another mukbangers",1개
30,lg,"How many mussels for dinner?

Hamzy: Yes.",8개
31,,"Это пожалуй единственное, что мы можем приготовить в России😀",1개
32,marybello,I hope you will have give aways like a box of korean food or korean items.  ❤ your channel is road to 3Million subscribers. looking forward to this.,2개
33,QoriahSiti,"I hope I can eat mussel 😔
Damn it my allergic",2개
34,과몰입주의,외국에선 홍합이랑 굴이 비쌀텐데 햄지님 쌓아놓고 먹으니 얼마나 놀랠까옄ㅋㅋㅋㅋㅋㅋㅋㅋㅋㅋㅋㅋㅋ😂😂😂😂,7개
35,ClaudineAlvarez,"I wish im eating beside u also hamzy 🤤🤤 lovelove hamz, godbless and keepsafe always 😘🥰😇",11개
36,SophiaSummer,My momma eats like this when the foods on the table is....like these😂,1개
37,,"わおΣ(･ω･ﾉ)ﾉ
豪華だね🐚😋",6개
38,LubnaJaseer,She cooks very easily. And everything are very perfect and neat,8개
39,putriindriani,"the real mukbang ""mb hamzy""",1개
40,,腹減った,6개
41,꽃사멜로디,칼쓰는 솜씨가 나날이 나날이 느시네여~~ㅋㅋ  햄지님 영상보고 있으면 저도모르게 몰입하면서 침이꼴각 넘어가여..ㅋㅋ 아무진 우리햄지님 늘홧팅입니당..^^건강잘챙기시고여~~♡♡♡,7개
42,이콜라콜,메뉴선정이 기가막힌다 ㅠㅠㅠㅠ 평생 구독할게여,16개
43,VannieEats,"YESS Hamzy is eating one of my favorites, MUSSELS! Who wants to eat this too?🙋🏻‍♀️😋 I love how she eats many different dishes each day. She is such a great Mukbanger ❤️",39개
44,DanAzman,"I never like mussels, but the way she cooks and present her food. Making me wanting to taste it 🤤❤",11개
45,NurKhalishaMohdAzizi,This is what they called eat with passion,1개
46,sampris,"No more vedios to watch so again watching same vedio only Hamzy ,Without watching ur vedios can’t able to sleep  Hamzy so update new vedio as soon as possible 😍❤️",1개
47,,ムール貝をアサリみたいに食べる、パエリア以外に思いつかんかった,7개
48,EvelinLarissa,"algum brasileiro aqui meu pai, eu não posso ser a única. kkkkkkkkk",1개
49,DulceNarciso,"i love mussle too🤤🤤, hamzy please notify me👏",2개
50,노명희,항상 잘보고 있는 애청자 입니다 오늘의 홍합 메뉴는 정말 굿이네요!~영상보는데 군침이 돌아서 혼났내요 ㅋ 너무 잘드시는 햄지님 땜에 대리만족도 되고 내 배가 든든하내요 ㅋ 항상 응원 합니다~~^^,34개
51,DghuyfJgrtijjj,"참  좋은  일  입니다  서로가   지혜로우시다
공생   서로 돕고  ㅎ
건강식이 많아서  다른  먹방님들보다
안심이 되요  직접 요리  정성도  보이고
요리도 배우고  나이드셔도
우리들도  나이 드니까  죽이나
사찰음식  햄지님   나이들어도
그에 맞게 먹방하셔도  좋습니다 
음식으로  사람을  이롭게 하는
먹방 해 주셔요  건강한 음식 먹방
사실  거의  인스턴트 만 드시는  먹방분들
걱정되요  과식이 만병의  근원이 되는데
인스턴트 너무 드시면   암  걸린다는데
ㅡㅡㅡㅡ자연주의  먹방   자주
보여 주셔요 굿 굿  입니다
햄지랑 자주  산책 가셔요
~~~~^^♡♡건강이 최고  입니다
Ps
편식아이 ㅡ 어린이들   이런  먹방  봐야
쑥쑥  건강하게 잘 자랄듯  ㅎㅎ
세계인들에게  이로운 먹방 꼭  신경써서
해 주셔요    한국 음식도   세계에 알리구요
ㅎ감사  드립니다",4개
52,Peaches,Hamzys dog: she sure eats a lot..😶,11개
53,노바울,"척 ! 척 ! 척 ! 
뭔가 요리할때 장단이 느껴짐~^^
영상 처음부터 끝까지 모든 사운드가 오케스트라로 들렸어요~^^ 대단하십니다~^^",2개
54,mimialeeya,i like the way Hamzy cooking 😁 who with's me? 😆,1개
55,DiannejustineUnito,Love it hamzy! Love the way u eat.. not trying hard just normal 🇵🇭💜💜💜,1개
56,McShock,This is the best mukb. That i've ever seen good job,1개
57,,"Кушаешь заразительно , пойду и я поем чего то .",1개
58,888,大御馳走と美味しいお顔🥰,2개
59,aadhyaSingh,Oh God why I love nail paint more than a food😀🤩,1개
60,ElleFilibuster,My broke ass be eatin' a biscuit and crying while watching this 😂😂😂,2개
61,firramthiahnf,I LOVEEEE THIS CHANELLL OMG😍😍😍😍,1개
62,sxftvbs,"She's so good at her work. I really enjoy watching her cooking, eating. She's amazing ~",1개
63,ginarosdiana,I enjoy how he cooks more than eating it 🤣 but i love it his mukbang.  his cooking skills need to be appreciated,1개
64,NegraAzul,you cooked very delicious it seems to me everything looks very delicious Hamzy I love your videos!!!! 💗💗💗💗💗,2개
65,네모,"햄지님 치킨 라면 이런 음식도 맛있어 보이고 넘 좋지만
햄지님의 팬이 된 이유는 이렇게 건강한 집밥도 많이 영상 올리셔서에요!! 건강하고 맛있는 음식 많이 드시고 오래 유튜브 활동 해주세요~ㅎㅎㅎㅎ",37개
66,Introvert,No make up just simple dress and she just enjoy her food as always ❤️ iloveyou hamzy from 🇵🇭,2개
67,sunghopark,다른건 몰라도 홍합탕에 소맥 딱 한잔만 먹고싶다ㅠㅠ,8개
68,lufellecagampan,I want to taste hamzy's food. Her cooking skill is legit! ❤️❤️❤️,1개
69,stellagigi,Here m watching you thinking 'i wish that was me eating '❤,1개
70,,"今日も楽しく見ました(^-^)
ヘムジさんありがとう☺",7개
71,BTSYounivers,How many mussels You Bought Hamzy... Did you bought for a year 🤣🤣🤣...,2개
72,JayDamie,Omg !!! Tht so delicious . Seafood lover 😍🤩 Love You Hamzy . ❤️❤️❤️❤️ From Malaysia .,1개
73,almibnup,Chop chop asmr is so smoothing 🥰🥰🥰,1개
74,BeeLu,You know it’s really good when Hamzy smile at the first bite 😋😋😋❤️❤️,2개
75,kumicopen9357,動画楽しみに待っていたよー(◍•ᴗ•◍)❤,10개
76,NatraYacob,"Hye Hamzy, i am your fans from Malaysia 💕",1개
77,Opheliakin,Her little smiles in between.💞💞,1개
78,Juno3092,"While watching her cooking, I suddenly remember delicious rendezvous kshow mussle episode... I love her cooking though 🙂",1개
79,,"旨そうなメシ〜🌈💯
今日も元気貰えました🙏♻️",8개
80,Ayes,"“who has been a fan of   Hamzy before 2020🥵” 

(sᴜʙsᴄʀɪʙɪɴɢ ᴛᴏ ᴇᴠᴇʏⓄɴᴇ ᴡʜᴏ sᴜʙs ᴛᴏ ᗰᗴ🍸)",139개
81,cloudyou,"Everytime i watch her videos, i wonder how many cameras are there? 😆",1개
82,,幅広い食材に幅広い料理を手慣れて作ってるけど料理学校とか行ったのですか？,6개
83,햇반쪽,"특별한 맛 표현 멘트 없어도 오늘 햄지님 표정에서 그냥 맛있다!가 느껴져요 🤤

03:22 홍합밥 첫 입 🍚
03:38 홍합탕에 있는 홍합도 냠
04:00 뽀얀 홍합탕 국물 호로록
04:11 고소한 홍합전 😮
06:17 김치 한 입
09:32 시원한 보리차
09:53 응? 갑자기 쏘 주 😳",3개
84,Luwangchanuanjali,Whenever she node her head the food is delicious 😆😆,14개
85,원숭이,진짜 요리 잘하는거 부러워요 ..,45개
86,NadooshMohammad,"I love hamzy, she is so natural and satisfying to watch, the way she eats her food hot is so cool, she is my favorite mukbanger ❤🙆‍♀️",62개
87,ChecheBureche,Fried mussels boiled mussels mussels with rice now i can see muscle in her face when chewing 😂😂😂😂😂😂✌️,2개
88,Amellyasrmlaa14,"Hallo, i'm from indonesia❤️",1개
89,PPPfumi,今晩は✨また美味しそうな夕飯🌃🍴。本当勉強になり、またいつもながら美味しそうに食してますねっ💗,8개
90,Genevievecoelho,ur smile after the first bite ....shows how proud u r of ur creation 😍 love hamzy,0개
91,,ヘンジちゃん、今日も手際よく感心してます。ほんと、食べてみたいです。大好きです！,2개
92,KrizzleChristyKarenDelmoro,I would suggest to dip the mussels in vinegar with soy sauce and with lemon/calamansi. That would be the perfect dipping sauce!,2개
93,Lucero2405,"Hamzy I love your background music, simple and nice to the ears.",1개
94,,"You are loved, with all my heart, I say this to you 😘⁦♥️⁩",5개
95,HannahMoon,I love this!!! but it’s also asking for an allergic reaction 😆,0개
96,FREYAGWENTIME,Love this channel ❤️ from Indonesia,1개
97,,キッチンは　綺麗。手際も良い。,1개
98,SabrinaShahrudin,"It's been a long time that I have a a mussels party😋😢 it's kind of bring back old memories when we were Young🤔😅😂 she's very good at cooking, how grateful who's gonna be her husband ❤️😊 gonna have a delicious meal with the ones you love❤️😊😏",1개
99,sriram,Wonderful cooking hamzy... very cute,3개
100,JingLiu,What a feast! Everything looks So delicious!! Craving for Korean food lately because of hamzy’s video 😝,2개
101,AGHNIYAQINTHARA,"Love you hamzy ❤️❤️from 🇲🇨 ,i really excited when you eats anything ,, n i always see your video 💞💞",0개
102,MaryRoseArcillas,For those who havent taste mussel. Well its really good and yummy esp the mussel soup. It's good for your body too. Tnx u hamzy...,0개
103,TamannaSaki,"Hey dear Hamzy!!!.. love from Bangladesh.. me & my mom, my auntys, my cousins we all love to watch your videos ♥♥♥..they just really like you so much...😍",0개
104,hannavelt,Wow your food to eat is very much healthy.. Stay safe my idol we love you from Philippines God bless you..,3개
105,DivyaVishwakarma,"Hy lalalala hamzy ..
I love uh so much 😍😍
Eating 2 much food🤣",0개
106,ChristineVinuya,I really love watching you while eating a lots of food❤,2개
107,,途中でキムチ食べたくなるのわかるよ！！！！,2개
108,,メニューのバリエーションが豊富で見てて飽きないです😊😊しかもとても美味しそうに食べてて本当に大好きです😍🙆‍♀️,2개
109,444,외국인들은 무슨 맛인지 상상하면서 보는건가?맛을알리가 없을텐데,1개
110,Davis,That’s a lot of mussels 🙈but amazing as always 👏👏,1개
111,,"何て手際が良いのだろう…✨
美味しそう！食べたい！",1개
112,medoriPongen,Damn...that mussle rice looks so tasty..wish I could eat it too😭😭,0개
113,핫핑크,내가 햄지님과 같은거라곤 저 실내복뿐이네ㅋㅋ,1개
114,RohitaHurdoss,Mussle😍 i am starving! Love you Hamzy❤❤,0개
115,COCOPINK,3:24　美味しすぎて今日はニヤけましたね！,7개
116,SweetDreamObsecadaPorImagine,Perfeito 😃,1개
117,,"ルーム貝のフルコース🍽
食材の彩り良くて綺麗で美味しそう✨",7개
118,SunC,"편집 때문일수도 있긴한데,
대충 하는듯 보이는ㄷㅔ,
은근 요리도 잘해... 거참...
ㅋㅋ
내도 먹고싶네요!
오늘도 수고 했어요 햄지...",1개
119,Azurina,"My dad always lose his appetite  but when he watched this video he requested to have same soup for iftar. Thanks Hamzy, you just bring my dad's appetite again. Gonna find some mussels and cook for him for iftar today. 😁😁😁",2개
120,vhopeforever,Primera vez que no se me antoja y se me hace agua la  boca al verla comer😁❤❤❤,1개
121,krug1007,"毎回思うけど料理の手際の良さよ。
それにしてもムール貝の量!!😂",38개
122,,"料理を作る手際のよさはいつ見てもすごいです🎵
しかも美味しそう❤️😀💕
ムール貝たくさんですね✨",2개
123,KhushbuJahan,"Hamzy, Iam your big fan, and you so cute,😘😘😘😘🇧🇩🇧🇩🇧🇩🇧🇩🇧🇩🇧🇩😷😷😷😷😷😷👌👌👌👌💞💞",1개
124,RaniAbigaelbrPurba,"Hamzy, it must bu mussel not mussle 😁😁",2개
125,AmirahHatasya,I LOVE YOUUUU 🙆🏻‍♀️✨❤️❤️❤️🤗✨🙆🏻‍♀️✨❤️❤️ AS ALWAYSSSS HEHE,1개
126,DeeCohen,Nice. I was waiting for you to start drinking some alcohol during this one. Seems like it would be the perfect pairing with that meal!,0개
127,,体に良さそうだし、美味しそう❣️😊👍✨,1개
128,TaeteaTaehyung,I'm watching her again after 2months ....yup feeling great and hungry during fast😋🤣🤣🤣🤣,0개
129,RenaChelleNuke,"Good evening, Hamzy 💗

I'm watching your new vlog right now. Thanks for reacting to my comment on your last vlog. 

MAY 14, 2020 🇵🇭🇵🇭🇵🇭",0개
130,,好き嫌いなくホントに分け隔てなく食べていて、それをアレンジまでして！尊敬です！,23개
131,,"The mussels is French specialty, I think.
I don't know Korean specialty.
It don't have it in Japan 😅😋",1개
132,,こんにちは😃　めっちゃ美味しそう😌😌料理上手に私もなりたい😊最後のお酒？飲みっぷり最高です😊今日も、もちろん高評価👍,1개
133,OOFPandroXX,Girls so skinny but eating that much food? Naw fam,1개
134,,홍합 안 좋아하는데도... 햄찌님 드시는 거 보니.. 와 땡기네요...ㄷㄷ 맛있겠다!,1개
135,KasieMoua,This looks awesome! Have you ever thought about posting up recipes? I'd love to try what you're eating!,0개
136,RoshiniGG,"I love the way u enjoy and eat❤
But why is your dog sitting in same place from last video?",0개
137,,貝のからが大きいから、何か入れ物があった方が清潔かな⁉️リモコンの近くに置くって💦,1개
138,MomodustychinchillaBaby,The cooking part is always the best ❤️❤️,0개
139,,早く韓国に旅行に行きたいです！,1개
140,어그로금지,"메뉴가 항상 새로움 ㅋㅋㅋㅋㅋ
외국인 조회수 노리는 타 유투버랑달라서 더 좋아융",1개
141,SubigyaShakya,I love the way you show how you cook and then eat. It looks really good. 😢😍😍😍,0개
142,AbiaYea,"That smile when she gets the first bite.
Looks like heaven has fallen in the earth!!!",11개
143,MomoLuvbts,"She eats really quickly 
Can u tell me please what k-drama do you watch or even recommend  pls hamzy",0개
144,우민지,"페리카나 신메뉴 
로스핀핫데블맛 양념맛 (대왕닭다리 
페리치즈볼 
츄러스치즈볼",1개
145,JhinChong,Hello beauty hamzy every time I watching your mukbang I always hungry delicious 😋,0개
146,,любимкам огромный привет!!! как же там у вас всё вкусно!!! каждое видео жду с большим нетерпением!!! здоровья и  приятного аппетита!!!,0개
147,박혜경,"양념 간장을 뒤로 가게
하고 홍합전 을 앞으로
댕기면 될텐데
불편해 보이네요",1개
148,이넨도,홍합을 드시고 싶으신분은 양식 요로케 나오는거 드세용 지금 자연산 잡아서 드시면 안대용 독성이있어용 ~,1개
149,TiffanyBrown,"Hamzy be doing her thing with the food. I think she is a chef. Been watching for months. Every day I check for new video, but I know she post every other day.",2개
150,GODSDAUGHTER09,She looks satisfied her food. Lying in bed while watching. My stomach is craving right now you're so bad hamzy...😭😭🤤🤤,15개
151,ErityaNinfaDelBosque,Hamzy 🙋🇪🇸❤️🌹😘💐,1개
152,or,"豪快に食べて見ていてとても気持ちが良い！
チャンネル登録させていただきましたぁ:D",1개
153,고미TVGOMITVASMR,역시 먹방을 잘하려면 요리를 잘하는게 필수구만!!!,1개
154,RenaChelleNuke,"2.96 million subscribed 😍😍
Congrats to you, Hamzy 🤗😘",1개
155,,真夜中に起きて観るものじゃない…お腹すいた😅💦ムール貝かぁ〜美味しそうだな〜☺️姫はキムチからの〜第二ラウンド晩酌タイム🍶に入りました〜😂,1개
156,VAVMEEMAR,Hello I'm your subscribe from Thailand when you cook it looks so yummy😊😁,2개
157,이용이,홍파ㅠㅠㅠㅠㅠㅠㅠ미쳤다 나도홍파할래ㅠㅠㅠㅠㅠㅠㅠ,1개
158,NadiaCharles,Yummy😋😋😋 she always wanna make me eat her food... love you Hamzy... Stay blessed and safe...,0개
159,bonmihobon,いつも美味しそうに🎵モリモリ食べてるけど、苦手な食べ物ってあるのかなぁ～❓🤔💬❓,1개
160,AreebaKhan,I've never tasted mussels  :( ahh! 💔,0개
161,SecretKMh,"Everything u ate, it's look delicious 😋 😍❤️❤️",0개
162,ThisPlanetHasNamjoon,"It's so satisfying to watch you eating deliciously. ❤
can you please do a dessert / bread mukbang?  🥺",0개
163,BiancaMarieTorresZeafla,I would love to try the food you make 😋  looks so delicious all the time!!😱😊,0개
164,AidahBodot,she's so clean i love her,0개
165,UjiKitty,Waaaah seafood 😍 but sadly I can't eat because I'm allergic,0개
166,MaryChapin,"Saraaaap 🤤 i really love ""tahong"" 😋

🐶♥️ lots of love xx",0개
167,EthanNguyen,So excited!... its a mussle party (like who wouldn't be excited) (:,0개
168,rejinagonzalez,Why do you do this to me??!!! 🤤🤤🤤❤❤❤ everything you make is on point! All I need to know is the seasoning you put on everything? Looks like you put the same seasonings and I want to try 😊🙏❤,1개
169,EuniceHan,i love hamzy nails 💕,0개
170,CathaliaCollins,Always watching ur vlog ..  😊❤️,1개
171,BangpitPakkodi,watching your video makes me starving😭❤,0개
172,ChrystyneAnneBartolo,"Wow it's yummy😋😋😋😋
I miss eat ""tahong"" or green shell😂😂😂 that's could here in the Philippines 🇵🇭
I always watch your blog hamzy😊😊😊",2개
173,surayabaharuddin,you know damn well the food is good when hamzy keep smiling,1개
174,팝롤리,햄지님 제 여동생이랑 너무 닮아서 ..동생 보는거같아욬ㅋㅋㅋㅋㅋㅋㅋㅋㅋㅋㅋㅋ,1개
175,더블브이ASMR,"인트로 브금 너무 도전적인것 같구 요리하실 때와 잘 맞는것 같아요 ㅎ
좋아요🥳",1개
176,lovelyjoy,"She eats very calm, I love it!!!",0개
177,CelsaGarcia,"It all looks great, Hamzy.  I've never been a fan of mussels but I'll give them a try someday.   💜😊🥘",2개
178,suga39,"ムール貝美味しそう🥺
野菜もたくさんで
体にも良い料理🥺💓",7개
179,이뿐소롱담담,햄지님 양념간장 만들깨 간장 붓기전에 참기름먼저 넣고 섞으면 참기름 코팅이 잘되서 간장이 더 맛나데요!,19개
180,MaharaniBudiastuti,I really want to eat every dish that you make!! Your cooking skill is amazing,0개
181,Tree,Where’s are invite? Your food always looks delicious.,0개
182,ladyelysia,This is a mussel feast...love it! Cheers!!,0개
183,sindychu신디츄,와 언니 송이버섯 짜장라면 보고 지금 11개째정주행 중이에요... 미쳤어요.. 이렇게 안넘기고 끝까지 다보는 먹방 유튜버 처음이에요  팬될거같아요,1개
184,쁘닝,정말 홍홍홍🤭🤭🤭꿈에서도 홍합 나올거 같아욬ㅋㅋ,4개
