,youtube_id,comment,like_num
0,험멜축구아카데미축구하는김선생,"이강인 안쓸꺼면 보내주는게 맞다!발렌시아 넘들아!!!
시간만 지나간다...저렇게 좋은 선수를..
믿는 도끼에 발등찍혔다..ㅜㅜㅜㅜㅜ",24개
1,이민재,임대 가는게 맞다고 본다 리그1이 라리가 보다 떨어지는거 맞아도 유렵 5대 리그 중 하나임 경기 뛰는게 제일 중요하지,48개
2,조르바,감독의 성향이 답인 것 같음.,34개
3,펭귄고기마시쩡,어딜가도 괜찮으니 주전만..,25개
4,수키츄,"개인적으로 형컴님과 선택이 동일한 
독일 분데스리가 한국인이 많이 거쳐간 아욱국이나 마인츠 정도 ㅎㅎ 가면 구자봉님이 많은 도움을 줄 것 같음ㅋㅋ",34개
5,HokyuLee,"사실 어느리그 어느팀으로 가는거 보다
감독성향이 제일 중요하지.
감독이 의지를 가지고 영입을 하려고 드는건지
아님 구단이 아시아 시장을 노리고 영입하려는지 그 차이가 중요하지.
사실 리그나 팀은 그리 중요한게 아닌걸로 생각한다.
그말은 이강인을 경기에 활용방안이 있는 감독 밑에 가야
이강인이 경기에 출장하고 출장하면서 형컴님 말씀대로 경기운영이나 상황인지 이런게 늘어가는거지.
사실 이강인이 10대라 해도 라리가에서 경기 뛸정도면 이미 기술적으로나 경기적으로나
다른리그에 가도 충분히 경쟁력 있는 얘기지.
기본기로는 타리그에 전혀 꿀릴게 없으니
경험에서 얻을수 있는 것을 갖기 위해 어느팀 어느리그던 뛸수 있는 곳으로 가는게 제일 좋겠다.",24개
6,gubang,네임드 클럽에 목매는거보다 최대한 많이 뛰는곳이 좋다 실력을 쌓으면 좋은 클럽은 알아서 가게 되어있으니,11개
7,CloudO,마르세유 감독이 아시아 시장에 관심이 많아서 마르세유가 유력해보임. 리그 순위도 2위 나쁘지 않고,48개
8,김형래,스피드는 향상 못시켜도 피지컬은 강화시킬수 있다,14개
9,스마트초이스,스페인 내에서 임대가 가장 좋은 시나리오. 언어 문화 적응 절대 무시할수 없음,13개
10,LeeDonghun,명문구단이 무슨 의미가 있겠습니까 많이 뛸수있는 팀으로 가야지요 명문구단은 손흥민 정도 아니면 의미가 없다고 봅니다,15개
11,KevinDeBruyne,중하위권으로 가는게 좋을듯 10번을 쓰는 팀이 별로 없음.,2개
12,깊은삽입이죄라면반으로줄일게,칸진리는 스페인이 잘맞는거 같은데,11개
13,반성현,nice 리스 아니고 프랑스 니스,3개
14,LKM,프랑스리그의 피지컬과 거친플레이가 무서워서 안간다면 이강인은 그정도 선수밖에 안되는거임. 가서 부딛치고 이겨내야지 월클선수지,19개
15,응응,다이아몬드 원석인걸 알면서도 발굴하지 않는 느낌,2개
16,요히리미,그냥 자기가 하고싶은데로 하면 됨 누가 돌을 던지겠냐,3개
17,하이블루HIGHBLUE,일단 어디든 많이 뛸 수 있는데 갔으면 좋겠다ㅠㅠㅠ  강인선수 파이팅!!!,5개
18,조성만,그동안 스페인 라리가에서 기회를 잡지못했던 백승호 선수가 독일 분데스리가로 가서 잘풀렸던 것처럼 이강인 선수도 좋은 팀으로 가서 잘 풀렸으면 좋겠다,16개
19,토착짱깨개자식들,"20세이하 월드컵 직후까지만 해도 쿠보<<<<이강인이었는데




냉정하게 직전시즌 쿠보 >> 이강인이었음

얼른 이적하자. 01년생 아시아 축구선수 라이벌리에서 꼭 승리하길 바람",17개
20,레이디가가,아직이적은  시기상조 ㅠㅠ,2개
21,황성연,이강인 이렇게 못뛰면 카타르월트컵 손흥민 이랑 같이 못뛴다,5개
22,이동현,개인적으로 프랑스는 피했으면 좋겠어요. 리그가 거친건지 잘 모르겠는데 다른 리그보다 선수들 부상이 엄청 잦은것같은데,2개
23,VAMOS희망,이강인선수~현명한 결정 하리라 믿어요. 열심히 응원합니다. 이강인 화이팅~^^,1개
24,곰돌이,일단은 발렌시아의 있다가는 그냥도 실력하락 되겄어 어딜가든 주전으로 뛰는데로 가야해,1개
25,손흥민홧팅,"지금 발렌시아 선수들의 최적의 전술이 442인데 전감독이 만든 선수들이고 지금 감독도 전감독의 선수들로 경기를 하고 있는데,  사실 다른선수들을 대거 바꾸지 않는한 442전술에서 벗어나기 어려울것같다.",3개
26,이기현,1:39 쿠보 오타요,0개
27,상김,쿠봉ㅋㅋ,0개
28,빅보스,어린애들 잘 키워주는 아약스가 좋지않을까 본다,2개
29,김민정,"독일가서 항상 뛰었으면 좋겠네요~
이강인 홧팅~^^",0개
30,이네이트,근데 두분 말씀을 왜케  잘하시지 나도 모르게 시간 가는줄도 모르고 푹 빠져서 봤네,1개
31,JunsComedyfactory,다 까놓고말해서 이강인 피지컬은 라리가 수준에서는  현저히 떨어진다라고 ...,2개
32,톨토스TV,4-4-2는 토탈싸커 힘을 바탕으로한 전술이라 이강인하고는 안어울림....4-3-3 /4-2-3-1 이런포메이션에 어울림,4개
33,김대군,어딜가던 스피드는 올려야 할듯....,0개
34,레이디가가,"마르세유 팀을  거쳐간  수많은 잠재력있는 선수들 이강인하고 너무나 극과극 차이가 분명히   나중에  비교 대상일것이라 추측☆☆☆☆☆ 
☆☆꼭  반드시 비교 분석 해야될부분~~☆☆",1개
35,빅보스,"독일,네덜란드 가 가장 적절 할듯",1개
36,사람,442로하되 다이아몬드형태로하면 그래도할만할텐데..,0개
37,호태대왕,이강인좀 보내줘라.,4개
38,빅보스,"프랑스갈거면... 음... 황의조있는 
보르도도 적응하기는 편할거같긴한뎅..
좀 그렇구",1개
39,신성호,아약스,0개
40,SGJ,난 어떤리그든지 상관없다 생각함 강인이가 필요한건 많이 뛰면서 경험을 쌓아가는거 라고봄 찬밥 뜨신밥 가리지 말고 진정으로 자기를 필요로 하는팀에 가서 뛰었으면 좋겠다,1개
41,parkmotors77,같은 동네 레반떼에 임대라도 갔으면 좋겠어유~~,0개
42,루티니스트,보르도가서 의조랑 쿵짝했으면 좋겠는데 감독이 343덕후라 강인이 공미 안줄 가능성 농후 ㅜ,7개
43,냠냠,강인이 중미 스타일이라서 흠.... 미드자원많아서 잘해야하하는데,0개
44,SJY남성편력자,맨유 가자,0개
45,OhSeokKwon,독일을 거치는게 이강인한테는 진짜 큰 발판이 될텐데....,0개
46,신성호,군대가자...상무,0개
47,새벽녁,쿠봉은 뭡니까??,1개
48,,압박이 엄는 리그앙이 낫지 분데스나 pl은 아얘 불가능하고 리그앙은 피지컬적인 부분이 의미가엄슴 압박이거친것이엄슴,2개
49,jerryLee,이강인 대박,0개
50,Koreanstreetfood,프랑스 두구단은 이강인이 월드클래스로 성장할거라고 100프로 확신하고 있다네요. 구단 스카우터 인터뷰에 따르면 흠,1개
51,트로피없는토중딱,지금 이강인은 일단 리그 앙 가서 실력 키우고 다시 와야됨,0개
52,이짱,많이 뛸수있는 팀으로가 풀타임 뛰는 이강인 보고싶다,0개
53,나8,아스날로 와라 강인아...,0개
54,정우진,마르세유...갔으면 좋겠다,0개
55,집돌이,축구경기도 안열리는데....,0개
56,NanaAllow,K리그 임대와야 할 시국,0개
57,임수린,이강인 그래도 아직 키가 더 크지 않나?? 성장판이 100% 다친건 아닌거 아닌가요??,1개
58,ATTHISTImELETsparty,스페인 하위팀이 낫지 않나,0개
59,KaraJin,강인이 이번에 옴겨야지 파브레가스 정도는 된다.,0개
60,박재혁,"가서 음바페,네이마르 상대하는거보고싶다.",0개
61,김경환,"피지컬은 극복 가능함ㅇㅇ
베라티 보셈",3개
62,마마도,"임대 이후 이적은 별로 달갑지 않은 전개 같다.
뉴캐슬 로 가면 좋은데 자리잡고 빅클럽 가야지",0개
63,콘델,이강인..경기도못뛰고 점점 빛이 바래간다 망할듯,0개
64,은인SK,이강인 관상 보면 24살까지 키 큰다고 본다 고로 스피드 향상도 본인 노력 여하 그리고 리그 수준 및 리그 평균 스피드에 따라 이루어 질 수 있다고 봄.,1개
65,bumyonglee,발렌시아에서 빌빌거리는데 마르세유? 웃고간다 비아냥거리는게 아니라 많이뛸수있는 하위권가서 경기수 쌓아야 된다 잘됬으면 하는 미음,1개
66,ST나얏나,이야!! 형컴님에말이 진짜 딱들어맞는  말입니다..역시  현역에서도 잘하시던분이던대 은퇴하시고도 너무잘 알아봐주시는듯 멎지내여,0개
67,레이디가가,전술문제 탓하는것보다 빠른것은 선수기본재량 센스 예측이 어떤가를 우선으로 봐야되고   색깔있고 개성 독보적인 임팩트 아우라를 주는 선수인지를  보고  가능성을 보는것이죠?!~ 쉽게  말해  될성부른 나무는 떡잎부터 안다  유명 선수들 데뷔전때 경기영상  보면  쉽게 분석가능☆☆☆☆,1개
68,레이디가가,호나우도 같은 선수들이  왜  이름값을 하고  축구팬 마니아들이 열광하 하는지 부터 알아야 ㅠㅠㅜ.....^^-☆,0개
69,신동오,1등?,0개
70,박준성,"잘하는데 너무 아쉬움. 지금 같은 축구에는 이강인이라는 선수의 특징같은게 부작용임.   탈압박좋고 패스뿌리기가 좋은 선수지만  키,몸싸움이 현저히 떨어진다...  물론 다비드 실바  같은 선수도 잘됬지만 그건 흔하지 않은 케이스고...",10개
71,SUHONGShim,"이런걸보면 중미,사이드미드필더
모두 소화했던 박지성 선수가 대단했다고 느끼네요",0개
72,JugyeongKim,발렌시아는 왜 임대를 안 보내주냐 저 나이때 한경기 한결기가 아쉬운데... 뭐하자는 건지,0개
73,BreaktheWall,라리가에서 불란서는 안된다 한국에서 불란서 가는건 좋지만,0개
74,김사람,좀 가라 이제,0개
75,jwk,"입맛에 맞는걸 먹는데 아니라 아예 밥을 못먹고있는데
어디든 밥이라도 주는곳으로 가야죠 ㅋㅋ",0개
76,정보,"뉴캐슬 -> 구단주 변경 -> 좋은선수영입 ->
공격적인 전술 -> 이강인 (임대 or 이적)



응..? 내가 뭘 적은거지,..?",0개
77,장재성TV,진짜 손흥민 이후로 가장 기대하는 선수이기 때문에  한경기라도 출전할수 있는 팀으로 갔으면 좋겠다.. 개인적인 생각은 독일이나 네덜란드 갔으면 좋겠다..,0개
78,까치랑엄지,스피드 같은것이나 체력은 키우면 되는것인데 다들 착각 하고 있슴. 100미터 육상선수가 되는건 힘들겠지만 축구선수로써 필요한 스피드는 근성장 순발력 훈련을 해서 키울 수 있슴 딱봐도 몸이 약함,0개
79,롱뾰로롱,"강인이 스타일이 주변동료가 받쳐주면 시너지가있는데 고만고만한팀에선 기용하기가 애매하지요 수비,헤딩경합 ......",1개
80,김영규,마르세유말고 보르도 가야 합니다 :),1개
81,하바나,"공잡고 전진하는 치달력이 그게... 그것이... 젖히다가 템포가 느려지는게 약점.
라우드럽이나 지단의 젖힘과 또다른 젖힘인데.
이게 해결될수 없나. 
턴이후 반템포 빠른 치달좀 키워줘요.",0개
82,PhilFoden,1,1개
83,cca,프랑스도 좋은 리그이긴 한데 10년 이상 스페인에 머문 이강인 선수가 프랑스에 가서 임대생활 하면 적응이 힘들거 같은데.... 제 생각으로는 스페인 리그에 있는 팀에 임대가는게 맞다고 생각합니다!!!,0개
84,필립람,"FC바르셀로나 또는 레알마드리드가 맞다고 봅니다. 이들 빅클럽 특징들이 유럽 챔스에서 상위 성적이 날 때는 경기운영 잘하는 플레이메이커들이 존재하였죠(이니에스타, 사비, 모드리치)",0개
85,마테라치,임대는 절대 안된다 임대 이적 아니면 이적해서 주전으로 뛸수 있는 곳에서 뛰어라 빅팀들의 유망주가 임대만 전전하다가 망한 꼴 한두번 본게 아니다,0개
86,김요섭,실질적으로 독일리그가 낫지 아시안들도 많이 뛰고 있고 전략적 다양성이 느껴짐. 프랑스가 예전만큼 유망주들이 큰다는 느낌도 없고 가장 중요한것은 구단과 감독의 케어와 필요성이지. 그게 되는 구단을 잘 선택했으면 싶다,0개
87,JeongKim,포백에 수비 역할을 충분히 해줄수 있는 미들 2명 정도가 받쳐주는 포메이션에서 자유롭게 움직일 수 있는 공미로 서는게 이강인에게 가장 맞는거 같아요. 4231이 가장 좋고 아님 다이아몬드 442나 4123도 괜찮죠. 일자 442는 이강인이랑 너무 안맞아요..,0개
88,간상원,Yo lee 돌문으로 와라 유망주 키우기하면 돌문이지,0개
89,스튜삣,개웃기네 ..,1개
90,OeiHoLee,주전에 챔스도 나갈 수 있은 팀에 갔으면 좋겠다. 마르세유 가서 주전이면 가장 Best인데... 이강인은 아마도 어릴 때 부터 본인보다 피지컬 좋은 상대를 만나서 지금까지 성장했기에 피지컬은 큰 문제가 아님. 본인이 공미 스타일이라 공미에 배치되어 주전으로 자주 뛸 수 있느냐가 중요한 문제임,0개
91,JuniHa,저 팀을 하나 파고 싶은데 추천좀 해주세용,0개
92,매우굿굿,개인적으로 네덜란드의 psv아인트호벤도 좋을듯,1개
93,독기,"아니 발렌시아에서 좋은 선수들이랑 맨날 트레이닝하고 구단에서 선수 케어 잘 해주고 대우 잘 해주고 하면  뭐하냐고 실전 경기 경험이 터무늬없이 부족한데..
옛말에 ""경험보다 더 좋은 스승은 없다"" 라는 말이 괜히 있겠어;; 
훈련할때 공 세워놓고 슛 백번 천번 차서 배컴 처럼 기가막히게 슛팅 잘 차게 됐다고 해봐 막상 실전 경기에서는 공 가만히 세워놓고 슛 찰 상황이 프리킥 말고 거의 없을 뿐더러 슛 때리려해도 바로 압박 들어오기 때문에 본인이 평소 공 세워 놓고 차던 만큼 슛팅이 좋게 안나갈거라고 . .
정신없이 움직이는 상황에서 침착하게 슛 때리는법 압박속에서 점차 적응해서 슛 때리는법 이런 상황을 겪어봐야 선수가 발전을 하던지 말던지 하지 백날 트레이닝만 시켜봐 무슨 의미가 있겠냐고ㅜㅜ 
제발 이강인 임대라도 보내줘...
2022월드컵 나 너무 기대된다고 .. 발렌시아 관계자분들아.. 이적은 죽어도 안되면 지발 임대라도.... ㅜㅜㅜㅜ PLZ...",2개
94,juongminkim,"아무리 애지중지 하더래도 선수는 진열해놓는 장식품이 아니라고 뛰면서 경험을 쌓아야 선수 본인이 이런저런 경험을하고 성장하지  지금으로선
뛸수있는 팀으로 가는것이 답인거 같다 프랑스 리그나 분데스리그 하위 팀으로 가면 그나마 지금보단 뛸수있는 기회가 많이 생기지 않을까 그렇캐 생각합니다",0개
95,volitionGJFC,보르도 가서 국대 라인 보여주면 좋겠네,0개
96,성조김,"이강인 선수가 잠재력이 많다 
진짜 선수다 이런 말도 많지만 
월클급 선수들 또는 그에 준하는 선수들은 지금 이강인 선수 나이대에서 이미 주전이니 이적이니 이런 고민없이 꽃피웠던거 같은데
잘하는건 맞지만 중상급 그 이상 그 이하아닌 그정도  느낌 드네요",4개
97,스마트초이스,"장점 몇가지에 단점이 너무나 많음. 
1 스피드가 느리다는점. 
2 스피드가 느려서 볼가지고 전진하는게 힘든점 이때는 몸이 버텨줘야되는데 피지컬이 딸리는점. 
3 체력 또한 약한점. 
4 결정적으로 경기에 뛰지못하기때문에 어느것도 개선할수 없는 현상황.",7개
98,빛나리,난 발렌시아 경기볼때마다 느끼는거지만..왜 우리 강인이가 맨날 교체나 노교체? 발렌 개나리들 진짜 핵춋나 못하더만..거기에 왜 강인이가 주전을 못끼는거야?ㅋㅋㅋ 이해불가임,0개
99,KimYongkook,"이승우꼴 나면, 끝...마르세유가 좋은데 출전기회가 중요.",1개
100,샬룻tv,아약스 음나  아약스가좋을듯한데,0개
101,레이디가가,백승호도 단면적인 부분만 확대 분석 해서 보는 시점이 문제   계속 유시하고 지켜봐야된다 봅니다.   독일명문팀에 이적만 했다해서  성공한것은 아니죠?! 그선수의  존재력이 얼마만큼 작용하고 플레이를 보여주냐에  포커스를 가져야된다 보여집  간략하게  선수들로만 설명 드림 예를 들어  로벤  리베리  레반도프스키   그밖에 선수들있지만 이정도 하겠습니다☆☆☆☆,0개
102,박현준,무작정 발렌시아 욕할순없지 재능있는유망주를 지금 쓰긴싫고 아껴두고 싶은데,9개
103,jh,"임대가 답인거 같은데.. 지금 말세 중원이 발렌시아보다 수준이 높으면 높았지 낮지 않은 상황에
만약 완전이적했다 꾸준히 출전못하면 2년 훅 가고 또 다른팀 찾아야되는 문제가 생길수도 있고
말세가 프랑스 최상위팀 중 하나라 뛸수 있는 경기도 더 많으니 기회가 더 주어질수있고
다만 진짜로 완전이적한다면 분데스가 가장 좋아보임.",0개
104,TV수수,이강인 아무데도 못갈듯,2개
105,농구의신,1빠,1개
106,면윤우,이강인 패스 받은 황의조라..대박 날 듯!!,0개
107,로얄시발스찬,체력 피지컬 보면 그냥 이승우 과 인데 너무 기대 하지 말자  바셀 3총사들 지금 뭐하냐?  장결희는 k3 리그에서도 자리 못잡고 있는데  ....  이승우 벨기에 리그 4경기 출전 끝 ...  백승호 한국 나이로 24살  독일 리그에서  그저 그런 선수  ...   이승우 .장결희도 한국 나이로 23살인데  아직도 유망주 인가?  이강인도 한국 나이로 19살 ..  손흥민은 18세때 부터   함부르크에서 주전으로 날라 다녔는데  ... 19살에도  발렌시아에서  1군 주전으로 자리 못잡고 빌빌 거리는 실력이면  마르세유 가도  몇경기 뛰다가 쫏겨날 가망성이 크다고 보는데 ...,0개
108,정민수,의조형 답답해하면서 뛰지않았나 강인아 도와줘라,0개
109,홍가,아니.. 스페인 4대 구단에서 뛰는데 어딜 가요 ㅋㅋ... 좀 벤치 달구던 말던 그냥 가만히 시기 기다리면 주축될 선수를 왜캐 임대 못보내 안달일까...,2개
110,강명신,독일 추천,2개
111,dyJUNG,쿠보 저거 외계인 대구빡 아니냐?,0개
112,안알랴줌,"아약스 아인트호벤 포르투 셋중에 하나가서 리그에선 양학도 하면서 자기플레이하고
 챔스도 발도좀 담궈서 자신감 쌓아야한다고봄",1개
113,세계최강,국내 유소년리그 슛돌이팀로 복귀하는게 최선 아닐까,0개
114,아하하하하하하하,쿠보 진짜 마빡 왤케 웃기냐,0개
115,12343344,무조건 가야됨,1개
116,라구요,"어딜가든 상관없다.......
발렌시아는 다신 안갔으면 하는 바램........
정말 맘에 안드는 팀이다.
아..... 이탈리아도 빼고..",5개
117,심준석,솔직히 저피지컬로 절대절대 성공못함...,1개
118,FC바로쌀누나,발렌시아 미드필드는 스페인 국적 선수가 2~3명 자리잡고있고 또 모두 다 기본적으로 스페인 축구를 배웠고  강인선수는 쉽지않은데요 다른 리그로 옮겨서하는게  프리미어리그 중하위권 팀으로 옮겨서 거기서 1~2년 뛰고 눈도장 찍고 상위권 팀으로 다비드실바 처럼 그렇게 성공했으면 좋겠습니다 스페인 국적은 아니지만 스페인의 향기가 가득한 이강인 선수 프리미어리그로 올수있다면 라리가 보다는 잘 맞을거라고 개인적으로 생각합니다,2개
119,Hi호이,"이적이나 임대가 답인듯..
주포지션과 역할도 아닌데
기회도 덜받고요
어케 성장하고 당연하듣이 적응 잘한다는게 말이안되는거죠..

언제부터 멀티플레이가 당연한게 된건지 참.. 
다른 포지션에 역할을 하게될때 유망주같은 경험 부족한 선수들이 다시 적응하기까지 오랜시간이 지나야하는데 
그몇년도 못기다리면서 
이강인선수가 못한다 구보보다 아래다 적응못하는거다 이러는건지 참..ㅡㅡ 

유망주중에 주포지션도 ㅇㅏ니고 역할도 안맞는데
주포지션처럼 잘적응하는 유망주가 몇이나 될까요?
1위~50위 유망주중에 몇안될거같은데..

언제부터 당연하듣이 멀티플레이가 유망주한테 되야되는건지 참.. 
주포지션 익숙한 역할을 하면서 충분한 경험을 쌓고

다른포지션 폭도 넒이는거지..
경험많은 케인이나 초특급유망주 홀란드가 윙어같은 포지션을 잘할까?..
다른 포지션도 주포지션처럼 임펙트가 있을까?.. 주포지션에서 충분히 기회받고 성장해서 탑클래스 아님?..",0개
120,12343344,"1군계약은 최악의수였음

차라리 현재 3부에서 계속 풀주전으로 뛰었으면 한단계 발전했을거임 나이에 비해 기회가 없었다고 볼수없다는 개소리하는 사람이 있는데 올시즌문제가 아니라 1군계약하고 나서부터 현재까지 상황을보면 
진짜 욕나오는 상황임 3군에 있다고 콜옵되서 국왕컵 뛸때랑 지금경기하는거랑 비교하면 그때가 훨씬나음 오히려 요즘 스피드가 더떨어짐 모 성장기라 피지컬이 커지는 과도기 상태라 그럴수 있겠지만 그리고 걱정되는게 허벅지 근육부상을 몇번 겪었는데 이거 고질병될거 같은분위기 청소년대회때도 쓰러져서 허벗지 만지는 경기가 많았음 성장기때 경기 못뛰다가 무리하게 뛰면 햄스트링 많이올라옴 경기는 못뛰는데 성장기인 선수가 무리하게 따라갈라고 하니 부하가 걸리는것으로 보임 3군에서 천천히 체력 피지컬 단계단계 만들었어야 되는데 지금 그테크가 완전히 무너짐 ... 솔직히 이강인미래는 밝지않음 쿠보한테 밀린건 확실함 
진짜 이건 무능한 발렌시아애새끼들이 자초한일 오스트리아리그 가는것도 나쁘지않을꺼같음 물론 독일2부보다 아래리그이지만 차근차근 만든다는생각으러 다시시작해야됨 일단 무조건 뛸수있는곳으로 가야됨",0개
121,양성진,지금 강인이는 발렌시아서 주전을 못뜨면 프랑스던 어디던 임대로 가야함 지금 쿠보만 봐도 그냥 유망주시절만 봤을때 이강인이 훨 우위였는데 지금은 쿠보가 훨 잘함 쿠보는 우선 주전으로 계속ㅊ뛰니까 발전을 하게됨 강인이도  많이 뛰어야함,2개
122,레이디가가,"이적보다는 임대차원에서 보내는게 현명한 선택 ☆☆☆☆☆
자꾸 분데스리가 1부와 2부 헷갈리신 분들을위해   백승호 분데스리가 2부리그로 이적!!!!~☆☆☆☆
1부리그 아닙니다 2부리그입니다 ☆팩트☆",1개
123,김어진,갠적으로 보르도 가면 좋겠다 황의조의 완벽한 어시스트가 될수있을 듯,0개
124,이동열,발렌시아와 재계약을 하지 말았어야 했어. 믿는 도끼에 발등찍힌거지. 예전에 이스코 처럼 될까 걱정이다. 한창 자랄 나이에 이게 뭔 개수작이여.,1개
125,간지남,"프리미어로 와라
토트넘은 절대 들어가지 말고",1개
126,비타민C,프랑스는 별루 프리미엄리그나 라리가 가야된다 나머지는 삼류리그다,0개
127,태태,이강인은 아약스 임대 가고 DNA는 바르셀로나니깐 아약스가서 데용처럼 바르셀로나 가자! 못가면 발렌시아에서 주전 먹어보자...,0개
128,정어리,"보르도가면
이강인 스루패스에 황의조마무리 보는거냐
생각만해도 설렌다씨방",1개
129,패피성수동,네덜란드  아약스  아니면   남는것이  좋다고  봅니다,0개
130,hikerFrantz,응 아니야. 이강인은 아무데도 못가고 발렌시아 벤치에서 푹푹 썩다가 이승우 꼴 날거야.,2개
131,Benefit,리그앙은 아쉽긴 하네. 뛸수 있는 epl 중하위권은 오퍼 없나,0개
132,김성한,"가지마라
리그수준이 떨어진다",0개
133,Spurs,442왜쓰는거야 맨날 지면서,0개
134,mildTbrown,"상주상무 와라.
니가 뛰고 싶지 않아도 뛰게 되고, 심지어 경기 끝나고 경계 근무도 설 수 있다.
오라! 상주상무로!",3개
135,김치찌개두루치기,내가 감독이고 내 밑에 이강인이 들어온다면...철저히 외면하겠소.일종의 길들이기요.골든볼 출신 이강인을 본보기로 팀의 기강을 세우겠소.난 이강인의 절제력과 투쟁심이 아쉽소이다.그래서 기회는 주겠으나 그 기회는 제한적으로 주겠소.드리블은 절대 못하게 할것이요.원터치 투터치 안에 전진패스를 주문할 것이외다.이걸 안하면 이강인에게 기회는 없소.,2개
136,문재앙,경기하는거 보니까 솔직히 이승우처럼 거품이 많이 끼긴했어.,3개
