comment,noun,adj,verb
10:35 저 브이 하는 손이랑 입술모양 !!!!!진짜 나 어렸을때 영기님 한창 얼짱으로 핫할때 봤던 그 손가락 그 입모양이당 ㅠㅠㅠㅠ 영기님 여전히 예쁘네요,"['브이', '손', '입술', '모양', '영기', '한창', '얼짱', '핫', '손가락', '입', '모양', '당', '영기']","['여전하다', '예쁘다']","['하다', '어리다', '하다', '보다']"
왘ㅋㅋㅋ 화장 저렇게 하니까 완전 고딩같은ㅋㅋㅋㅋㅋㅋㅋㅋㅋㅋㅋㅋㅋㅋㅋ 요즘 고딩은 안저런가 딱 나때 학생들 같은 화장이당,"['화장', '완전', '고딩', '요즘', '고딩', '나때', '학생', '화장', '당']","['같다', '같다']","['오다', '하다', '저러다']"
"볼터치, 낙서, 세모ㅜㅜㅜㅜ와 잊고있었는데 추억ㅋㅋㅋㅋㅋ","['볼터치', '낙서', '세모', '추억']",[],"['오다', '잊다']"
귀여워ㅋㅋㅋ,[],['귀엽다'],[]
진짜 ㄹㅇ 영기언니 얼짱시대때 언니 엘리베이터 수리자격증있는데 10층 이상 누르지 못한다는 말 듣고 진짜 넘 웃겨섴ㅋㅋㅋㅋㅋㅋ웃으면서 광광움ㅋㅋㅋㅋㅋㅋ,"['영기', '얼짱시대', '언니', '엘리베이터', '수리', '자격증', '층', '이상', '말', '움']",['있다'],"['누르다', '하다', '듣다', '넘다', '웃기다', '웃다']"
아 진짜 너무 추억돋아요 ㅠㅠㅠ 자막칸까지 싸이갬성인 것 섬세해....☆,"['추억', '자막', '칸', '싸이', '성인']",['섬세하다'],"['돋다', '개다']"
언닠ㅋㅋㅋㅋㅋㅋㅋㅋㅋㅋㅋㅋㅋ 진짜 얼짱같아욬ㅋㅋㅋㅋㅋㅋㅋㅋㅋㅋ,"['언니', '얼짱']",['같다'],[]
ㅇㄴ 홈피 너무ㅋㅋㅋㅋㄱㅋㅋ어떡해ㅋㅋㅋㅋㅋ최여주ㅋㅋㅋㅋㄱㄲ,"['홈피', '해', '최', '여주']",['어떻다'],[]
생각해보면 10대 메이크업 스타일은 변해도 빨갛고 하얗고 눈은 검게 하는 큰 틀은 변하지 않는 것 같음,"['생각', '메이크업', '스타일', '눈', '틀']","['변하다', '빨갛다', '하얗다', '검다', '변하다', '같다']","['해보다', '대다', '하다', '크다', '않다']"
영기언니 성격 정말 너무 좋아.... 울 회사원님두 말할 것도 없고❤️ 조합 체고ㅜ,"['영기', '성격', '정말', '울', '회사원', '말', '조합', '체고']","['좋다', '없다']",['하다']
옛날사람ㅋㅋㅋㅋㅋㅋㅋㅋㅋㅋㅋㅋㅋㅋㅋㅋㅋㅋㅋㅋㅋㅋㅋㅋㅋ(저한테 하는 혼잣말입니다.....),"['옛날', '사람', '혼잣말']",['이다'],['하다']
역시 개눈렌즈를 껴줘야 제대로지,"['역시', '개눈', '렌즈', '제대로']",[],['끼다']
ㅠㅠㅠㅠㅋㅋㅋㅋㅋㅋㅋ앜ㅋㅋㅠㅠㅠㅠㅠ,[],[],[]
ㅋㅋㅋㅋㅋㅋㅋㅋㅋㅋㅋㅋㅋㅋㅋㅋㅋㅋㅋㅋ 오늘 영상 너무 재밌어요 두분 넘 잘봤어요!!,"['오늘', '영상']",['재밌다'],"['넘다', '보다']"
두분 그림체가 너무 다른데 몰라 내가 제일 좋아하는 두분이 합치셨다면 뭐 어떡하겠어요..1일 1영상해야죠 모...,"['그림', '체', '제일', '영상']","['다르다', '좋아하다', '어떻다']","['모르다', '합치다', '하다', '하다']"
와우 요즘 콜라보 미쳤다ㅋㅋㅋㅋㅋㅋㅋ선댓클 이지만 분명 재밋겠죠ㅎㅎㅋㅋㅋ,"['와우', '요즘', '콜라보', '선댓', '분명']","['미치다', '재밌다']",['크다']
"와 영기언니는 ㄹㅇ 10대 그시절 얼굴 그대로 
넘 귀엽따 ㅜㅜㅜㅜㅜ","['영기', '시절', '얼굴', '그대로']",['귀엽다'],"['오다', '대다', '넘다', '따다']"
세상에 ㅋㅋㅋㅋㅋㅋㅋㅋ 진짜 추억이네영,"['세상', '추억']",[],[]
회사원님 넘 귀엽다ㅋㅋ진짜 그때 그 시절 10대때가 생각이나네요ㅋ,"['회사원', '그때', '시절', '생각', '이나']",['귀엽다'],['넘다']
꺄❤ 진짜 넘 잘 어울려요ㅋㅋㅋㅋㅋㅋㅋ,['꺄'],[],"['넘다', '자다', '어울리다']"
아 세모랑 낙서ㅋㅋㅋㅋㅋㅋㅋ 나도 초등학생 때 그랬는데ㅠㅠㅠㅠㅠ 진짜 얼짱시대 추억ㅠㅠㅠㅠ,"['세모', '낙서', '초등학생', '얼짱시대', '추억']",[],['나다']
아닠ㅋㅋㅋㅋㅋㅋ 최여주 뭐냐고 ㅠㅠㅠㅠ 언니도 인소 봤구나 ㅋㅋㅋㅋㅋㅋ,"['최', '여주', '고', '언니']",['아니다'],"['이다', '보다']"
헐.. 얼짱시대를 모르다니 ㅠㅠ 진짜 홍영기 한아름송이 등등 미쳤음..,"['얼짱시대', '홍영기', '한아름송이', '등등']",['미치다'],"['헐다', '모르다']"
왘ㅋㅋㅋㅋㅋㅋ추억 돋네요유ㅠㅠㅜㅜ,['추억'],[],"['오다', '돋다']"
아 진짴ㅋㅋㅋㅋ너무 재미지다ㅠㅠㅠ,"['재미', '지다']",[],[]
진짜 오랜만이다... ㅋㅋㅋ ㅜㅜ.. 😭,['만이'],[],[]
아ㅋㅋㅋㅋㅋㅋㅋㅋㅋㅋㅋ그때로 다시 돌아가면 좋겠다 신명나게 한번더 흑역사 쌓을수있는뎈ㅋㅋㅋ,"['그때', '다시', '신명', '한번', '흑역사']",['좋다'],"['돌아가다', '나다', '쌓다']"
와 ...아역배우해도 되겠다....,['아역배우'],[],"['오다', '하다', '되다']"
"아 둘이 쿵짝 잘 맞는거봐 ㅋㅋㅋㅋㅋㅋㅋ 홍영기 증말 귀엽고 말도 잘하고 홍보도 깨알같이 잘하고 크...bbb 아니 너무 대단하지 않아요? 얼짱시대로 뙇 스타되고 자기 사업도 성공시키고 트랜드에 맞춰서 유튭까지 운영하고. 가정까지 만들고... 자기 관리도 잘하고 진짜 멋있음.
그나저나 회사원님 어디 티비프로 엠씨하셔도 되겠어요. 어쩜 이렇게 진행을 잘하시고 컨텐츠도 좋은지...","['쿵짝', '홍영기', '증말', '말', '홍보', '깨알', '얼짱시대', '뙇', '스타', '자기', '사업', '성공', '트랜드', '유튭', '운영', '가정', '자기', '관리', '회사원', '어디', '티비', '프로', '엠씨', '어쩜', '진행', '컨텐츠']","['귀엽다', '아니다', '대단하다', '멋있다', '좋다']","['자다', '맞다', '보다', '하다', '하다', '크다', '않다', '되다', '시키다', '맞추다', '만들다', '하다', '하다', '되다', '하다']"
ㅋㅋㅋㅋㅋㅋㅋ나만 얼짱시대 홍영기로 안거야?ㅋㅋㅋㅋㅋㅋㅋㅋ나도 지금 애들은 아닌가봐.....ㅋㅋㅋㅋㅋㅋㅋㅌㅋㅋ,"['얼짱시대', '홍영기', '안거', '지금', '애']",['아니다'],"['나다', '가보다']"
그땐 몰랐지 그냥 숨만쉬어도 귀여울 나이란걸 ㅋㅋㅋㅋㅋ,"['그땐', '그냥', '숨', '여울', '나이란', '걸']",[],"['모르다', '쉬다']"
"저는 저나이 일때 화장에 진짜 1도관심이 없어서 관심 별로없었는데 
웃기넹 흐흐흐 그때애들진짜 저러고다니긴했지","['나이', '화장', '관심', '관심', '별로', '웃기', '넹', '흐흐', '흐', '그때', '애']","['없다', '없다']","['저러다', '하다']"
마지막에 사진뭐얔ㅋ앜ㅋㅋㅋㅋㄱㅋ앜ㅋㅋㅋㅋㅋㅋㅋㅋㄱ,"['마지막', '사진']",[],[]
와 완전 그때 느낌나요!ㅠㅠㅜ 덕분에 추억여행 제대로 했어요♡,"['완전', '그때', '덕분', '추억', '여행', '제대로']",[],"['오다', '느끼다', '하다']"
캬 이거보니깐 컴싸도 되게유명했는데ㅋㅋㅋㄱ얼짱시대 한번더추억소환ㅋㅋㄱㅋ 나중에봐야지ㅋ오글오글,"['캬', '거보', '컴', '얼짱시대', '한번', '추억', '소환', '나중']",['유명하다'],"['싸다', '보다']"
ㅋㅋㅋㅋㅋㅋ아 30초마다 한번씩 추억에 젖음 ㅋㅋㅋㅋㅋㅋㅋㅋㅋ,"['한번', '추억']",[],['젖다']
"진짜 추억이당 ㅋㅋㅋ 애들 미니홈피 들어가면 다들 아름송이 야상에 컴싸 아이라인 얼굴 뿌옇게하고 눈깔큰 렌즈로 도배되있었는데 ㅋㅋ
그나저나 영기님 너무 예뻐욤~","['추억', '당', '애', '미니홈피', '아름', '송이', '상', '컴', '아이라인', '얼굴', '게', '눈', '렌즈', '도배', '영기', '예뻐욤']",['뿌옇다'],"['들어가다', '들다', '싸다', '깔다', '크다', '되다']"
아 추억대박 ㅋㅋㅋㅋㅋ,"['추억', '대박']",[],[]
추억의 컴싸..ㅋㅋㅋ 재밌게 봐써용~~~~,"['추억', '컴']",['재밌다'],"['싸다', '보다', '써다']"
녕기.... ㅠㅠㅠㅠ,['녕기'],[],[]
ㅋㅋㅋㅋㅋㅋㅋ재밌어요 이번 영상,"['이번', '영상']",['재밌다'],[]
"와 근데 회사원임 진짜 어려보여욬ㅋㅋㅋ
얼짱 메이크업 찰떡이세요","['회사원', '임', '얼짱', '메이크업', '찰떡', '이세']",[],"['오다', '어리다', '보이다']"
ㅋㅋㅋㅋㅋㅋㅋㅋㅈㅋㅈㅋㅈㅋㅈㅋㅋㅈ아 진짜웃음밖에안나온다,"['웃음', '안나']",[],['오다']
두 분 너무 예뻐요ㅠㅠㅠ 눈 네 개가 초롱초롱초롱,"['두', '눈', '개', '초롱초롱']",['예쁘다'],[]
ㅋㅋㅋㅋㅋㅋ ㄹㅇ 패션 ㅋㅋ,['패션'],[],[]
ㅋㅋㅋㅋㅋㅋㅋㅋ추억돋아 ㅋㅋㅋ,['추억'],[],['돋다']
와 진짜 저 개눈렌즈 ㅋㅋㅋㅋㅋㅋㅋㅋ 아이라인 삼각존 블렌딩 했으면 레전드,"['개눈', '렌즈', '아이라인', '삼각', '존', '블렌딩', '레전드']",[],"['오다', '하다']"
트루님이랑 컨텐츠 재밌으셨다면~ 좋아요👍한 번 눌러주세요,"['트루', '컨텐츠']","['재밌다', '좋다']","['하다', '누르다']"
❤️❤️❤️다음에 둘이 우리집 와서 내 옷장 옷으로 코디해주라❤️❤️❤️,"['다음', '우리', '집', '옷장', '옷', '코디', '해주']",[],['오다']
세계관 최강자들의 싸움이다..,"['세계관', '최강', '싸움']",[],[]
이정도면 삼성과 엘지의 콜라보...,"['정도', '삼성', '엘지', '콜라보']",[],[]
"촬영도 너무나 재미있었던 콜라보 영상이었어용😬 
초대해주셔서 감사합니다아아 꺅💕","['촬영', '콜라보', '영상', '초대', '아아']",['재미있다'],"['이다', '해주다', '감사하다']"
지양댓글 이야기 해주는거 넘나 신박하고 좋은것...!! 사실 그런 댓 달리면 팬들 마음이 더 불편함...,"['댓글', '이야기', '박하', '사실', '댓', '달리', '팬', '마음']","['좋다', '그렇다', '불편하다']","['해주다', '넘다']"
헐 트루언니 두번째 블랙 원피스에 롱부츠 너무너무너문머누머누머늠너먼누 예뻐요!!!!!!! 찐 행사장에 꼭 그대로 입어주세요!!!,"['트루', '두번째', '블랙', '원피스', '롱', '부츠', '머누머누머늠너', '누', '행사', '꼭', '그대로']","['멀다', '예쁘다']","['헐다', '찌다', '입다']"
라뮤끄 : (마른세수),['뮤'],['마르다'],['끄다']
트루님 두번째 검정자켓원피스 넘 이뻐요...ㄹㅇ 사고싶어짐..,"['트루', '두번째', '검정', '자켓', '원피스', '짐']",['이쁘다'],"['넘다', '사다']"
ㅋㅋㅋㅋㅋㅋㅋㅋㅋㅋㅋㅋㅋㅋㅋㅋㅋㅋ 라뮤끄님 등판이 필요합니다 ㅋㅋㅋㅋㅋㅋㅋㅋㅋㅋㅋㅋㅋㅋㅋㅋㅋㅋㅋㅋㅋㅋㅋㅋㅋㅋㅋㅋㅋㅋㅋㅋㅋㅋㅋㅋㅋㅋㅋㅋㅋㅋㅋㅋㅋㅋㅋㅋㅋㅋㅋㅋㅋㅋㅋㅋㅋㅋㅋㅋㅋㅋㅋㅋㅋ 라뮤끄 보고 있나 !!!!!!!!!!!!!!!!!!!!!!!!!!!!!!!!!!!!!!!!!!!!!!!!,"['라뮤끄님', '판이', '뮤', '보고']","['필요하다', '있다']",['끄다']
라뮤끄 언니는 과연... 이러한 엄청난 대결을 보며 무슨 생각을 했을까....,"['뮤', '언니', '과연', '대결', '무슨', '생각']","['이러하다', '엄청나다']","['끄다', '보다', '하다']"
ㄹㅇ 양대산맥 아입니꺼... 나 이런 조합은 살면서 처음 봤네 대단하고 멋져요...,"['산맥', '조합', '처음']","['이다', '이렇다', '대단하다', '멋지다']","['살다', '보다']"
"유트루님 두번째 룩, 회사원님 세번째 룩 진짜 넘 찰떡ㅜㅠ 유트루님은 정장st 원피스룩 핏 넘 찰떡아닙니까ㅠ? 약간 포멀하고 각잡힌? 몸 선에 붙는? 고급진 스타일들이 잘어울리는 것 같아요ㅠ 잘나가는 커리어우먼 회계사,변호사 넉낌? 화이트도 넘 잘 받고.,
회사원님은 세번째처럼 약간 품있고 린넨 같은 소재의 편안하고 사랑스러운 룩이 잘어울리시는 것 같아용 분위기 자체가 큐트,러블리 계열이라ㅋㅋㅋㅋ 아메카지 룩도 잘 어울리실듯 !","['유', '트루', '두번째', '회사원', '세번', '찰떡', '유', '트루', '정장', '원피스', '핏', '찰떡', '약간', '포', '몸', '선', '고급', '진', '스타일', '커리어우먼', '회계사', '변호사', '낌', '화이트', '회사원', '세번', '약간', '린넨', '소재', '룩', '분위기', '자체', '큐트', '러블리', '계열', '아메', '카', '룩']","['아니다', '멀다', '같다', '같다', '편안하다', '사랑스럽다', '같다']","['넘다', '넘다', '잡히다', '붙다', '어울리다', '잘나가다', '넘다', '자다', '받다', '품다', '어울리다', '자다', '어울리다']"
트루언니 왜 갑자기 옷 잘입지..ㄷㄷ 세상에 웬일이야,"['트루', '갑자기', '옷', '세상', '웬일']",[],['입다']
헐 트루언니 머리묶고 두번째룩 진짜 너어어어어무 이뻐요 와...기절...,"['트루', '머리', '두번째', '어어', '무', '기절']",['이쁘다'],"['헐다', '묶다', '오다']"
여기에 라뮤끄님도 초대해주세옄ㅋㅋㅋㅋㅋㅋ라뮤끄님 혼자 대환장파티하실거같아욬ㅋㅋㅋㅋㅋㅋㅋㅋㅋ,"['여기', '라뮤끄님', '초대', '라뮤끄님', '혼자', '환', '파티']",['같다'],"['해주다', '하다']"
비하인드를 B채널에 공개하라!!!!!!,"['드', '채널', '공개', '하라']",[],['비다']
트루언니 빡세고 각진스타일 되게 잘어울리신다ㄷㄷㄷㄷ,"['트루', '빡세', '진', '스타일']",[],"['어울리다', '신다']"
유트루 옷 - 시크&섹시 VS 회사원 옷 - 러블리&큐티,"['유', '트루', '옷', '시크', '섹시', '회사원', '옷', '러블리', '큐티']",[],[]
나 진짜 회사원님 게스트랑 텐션올라간거 첨봄 ㅋㅋㅋ,"['회사원', '게스트', '텐션', '봄']",[],['올라가다']
아언니.. 너무조아 육두루랑 회사원..,"['언니', '무조', '두루', '회사원']",[],[]
"하늘 아래 두개의 태양은 없다지만
두개의 태양이 떠버렸다아☀️☀️☀️☀️☀️☀️☀️","['하늘', '아래', '개', '태양', '개', '태양']",['없다'],"['뜨다', '버리다']"
이 언니들 서로 주접떠는거 왤캐 웃곀ㅋㅋㅋㅋㅋㅋㅋㅋ,"['언니', '서로', '주접', '캐']",[],"['뜨다', '왤다', '웃기다']"
"0:21 뭔가 상상이 된다...람뀨님이 시무룩 하게 입 삐죽 내밀고 있는 모습이!!!
=씹덕사...♥😊
라뮤끄:나는 왜...","['뭔가', '상상', '람뀨님', '시무', '입', '밀고', '모습', '씹덕', '뮤']","['삐죽다', '있다']","['되다', '하다', '끄다']"
옷 취향 확고하신 분들이 모였네ㅋㅋㅋㅋㅋㅋㅋㅋ,"['옷', '취향']",['확고하다'],['모이다']
좋아하는 언니 옆에 좋아하는 언니❤,"['언니', '옆', '언니']","['좋아하다', '좋아하다']",[]
아 대박 진짜 개좋아 아아아아아앙ㅇ아아아아아아아아앙아ㅏㅇ아아아아아아아아앙아아아아아아아아아아아아아아아아아아아아아아아악!!! 예뻐 너무예뻐💗사랑스러워🥰귀여워🍒아름다워💋예뻐뒤집어져🤦‍♀️예뻐 너무예뻐💗사랑스러워🥰귀여워🍒아름다워💋예뻐뒤집어져🤦‍♀️예뻐 너무예뻐💗사랑스러워🥰귀여워🍒아름다워💋예뻐뒤집어져🤦‍♀️예뻐 너무예뻐💗사랑스러워🥰귀여워🍒아름다워💋예뻐뒤집어져🤦‍♀️예뻐 너무예뻐💗사랑스러워🥰귀여워🍒아름다워💋예뻐뒤집어져🤦‍♀️예뻐 너무예뻐💗사랑스러워🥰귀여워🍒아름다워💋예뻐뒤집어져🤦‍♀️,"['대박', '개', '아아', '아앙']","['좋다', '예쁘다', '예쁘다', '사랑스럽다', '귀엽다', '아름답다', '예쁘다', '예쁘다', '예쁘다', '사랑스럽다', '귀엽다', '아름답다', '예쁘다', '예쁘다', '예쁘다', '사랑스럽다', '귀엽다', '아름답다', '예쁘다', '예쁘다', '예쁘다', '사랑스럽다', '귀엽다', '아름답다', '예쁘다', '예쁘다', '예쁘다', '사랑스럽다', '귀엽다', '아름답다', '예쁘다', '예쁘다', '예쁘다', '사랑스럽다', '귀엽다', '아름답다', '예쁘다']","['뒤집어지다', '뒤집어지다', '뒤집어지다', '뒤집어지다', '뒤집어지다', '뒤집어지다']"
진짜 세계관 최강자들의 싸움이다 ㅋㅋㅋㅋㅋㅋㅋㅋ,"['세계관', '최강', '싸움']",[],[]
7:04 잉? 트루언니 옷 못입는다매요.!! 겁나 이쁜디,"['잉', '트루', '옷']",['이쁘다'],"['입다', '겁나다']"
솔직히 나는 알람을 보자마자 개그 코드를 기대하고 들어왔음 ㅋㅋㅋㅋㅋ 옷은 보이지도 않는다 그저 두 분이서 누가 더 개그 연기를 잘하는지 지켜봤을뿐 ㅋㅋㅋㅋㅋㅋㅋㅋㅋㅋㅋㅋㅋㅋㅋㅋㅋㅋㅋㅋㅋㅋㅋㅋ합성 도랏어 ㅋㅋㅋㅋㅋㅋㅋㅋㅋㅋㅋㅋㅋㅋㅋㅋ,"['알람', '개그', '코드', '옷', '보이지', '두', '이서', '누가', '개그', '연기', '뿐', '합성', '도랏어']","['솔직하다', '기대하다']","['보다', '들어오다', '않다', '하다', '지켜보다']"
워씌 유트루님 마지막 착장 진심 존예 시상식 포토월 느낌 근데 트루님은 보다보니 금찌스타일 뭔지 알거 같어옄ㅋㅋㅋㅋㅋㅋㅋㅋㅋㅋ,"['워씌', '유', '트루', '마지막', '착', '진심', '존예', '시상식', '포토', '느낌', '트루', '금찌', '스타일']",['같다'],"['보다', '보다', '알다']"
"혼동스러운 동공과 함께 시청하다가
0:58 제발 지양해주세요,, 팬들은 재미와 뜻밖의 잘 어울림을 지향합니다♡( ૢ⁼̴̤̆ ꇴ ⁼̴̤̆ ૢ)~ෆ♡","['혼동', '동공', '시청', '제발', '양해', '팬', '재미', '뜻밖', '어울림', '지향']",[],"['하다', '줄다', '자다', '하다']"
"와 유트루 언니 두번째 검정원피스 장난아니다 진짜 이쁨,,,,저 옷을 사고싶어,,,,","['유', '트루', '언니', '두번째', '검정', '원피스', '장난', '옷']","['아니다', '이쁘다']","['오다', '사다']"
아 이 영상 너무 행복해 순둥순둥하지만 개성있는 두분 내 최애 !!!!🥰🥰🥰🥰🥰🥰🥰🥰🥰,"['영상', '둥순둥', '개성', '최애']","['행복하다', '있다']",[]
유트루님은 마지막 착장 존예 ㅠㅠㅠ 화사원님은 첫번째 착장 넘 찰떡이에여 ㅠㅠㅠ ♥️♥️ 두분 다 코디 넘 이뻐서 고를 수 없어요ㅠㅠㅠㅠ😍😭😭😍,"['유', '트루', '마지막', '착', '존예', '화사', '원님', '첫', '착', '찰떡', '코디']","['이쁘다', '없다']","['넘다', '넘다', '고르다']"
3:55 부족의 상징ㅋㅋㅋㅋㅋㅋㅋㅋㅋㅋㅋㅋㅋㅋㅋㅋㅋㅋㅋㅋ,"['부족', '상징']",[],[]
배경합성한거.... 진짜 찐이다.....ㅋㅋㅋㅋㅋㅋㅋㅋㅋㅋㅋㅋㅋㅋㅋㅋㅋㅋㅋㅋㅋ,"['배경', '합성']",[],['찌다']
두분다 두번째 옷 완전 내 취향..,"['분다', '두번째', '옷', '완전', '취향']",[],[]
내 인생 최애 유투버 2명의 콜라보라니 ㅠㅠ 따흑 ㅠㅠ 클릭을 부르고 좋아요를 누르게하는 두 사람 ㅠㅠㅠㅠㅠ,"['인생', '최애', '유투', '버', '명의', '콜라보', '클릭', '두', '사람']",['좋다'],"['따다', '부르다', '누르다', '하다']"
패션쇼할 때 CG효과들 미쳤냐구욬ㅋㅋㅋㅋㅋ 지금 상황극들이 몇 편이나 펼쳐지는 거얔ㅋㅋㅋㅋ,"['패션쇼', '효과', '지금', '상황', '편이']",['미치다'],"['하다', '들이다', '펼쳐지다']"
이런 록키산맥과 알프스산맥의 만남이라니...... (하 너무좋아),"['록키산맥', '알프스산맥', '만남']","['이렇다', '좋다']",[]
와 너무 새로워 이 두사람 친목 아주 응원해..!,"['사람', '친목', '아주', '응원']",['새롭다'],"['오다', '하다']"
맙소사 어떻게 이 두 분이 만나셨나요ㅠㅠㅠㅠㅠㅠㅠ,['두'],['어떻다'],['만나다']
"라뮤끄님 보고계시나요?ㅋㅋ뷰티유튜브 고인물 크리에이터들의 패션대결보고싶어요ㅋㅋ
라뮤끄님,씬님,윤짜미님,곽토리님ㅋㅋ다보고 싶네요ㅋㅋ","['라뮤끄님', '뷰티', '유튜브', '인물', '크리에이터', '패션', '대결', '라뮤끄님', '씬님', '짜미', '곽', '토리', '보고']",[],"['보다', '보다', '싶다']"
패션컨텐츠아니고 개그컨텐츠ㅋㅋㅋㅋㅋㅋㅋㅋㅋ속았다,"['패션', '컨텐츠', '개그', '컨텐츠', '았']",['아니다'],[]
트루언니 핏뭐야.. 완전 인간 입생로랑💋,"['트루', '핏뭐', '완전', '인간', '입생로랑']",[],[]
말 잘 하는 사람 & 말 잘 하는 사람 넘나 최강 조합ㅋㅋㅋ,"['말', '사람', '말', '사람', '최강', '조합']",[],"['자다', '하다', '자다', '하다', '넘다']"
"최애두분의만남 ㅋㅋㅋ
ㅇㅈ입니다ㅋㅋ","['최애', '만남']",['이다'],[]
진짜 이 정도면 에고이스트에서 협찬 들어와야 한다..ㅎㅎ,"['정도', '에고', '이스트', '협찬']",[],"['들어오다', '하다']"
이사람들ㅋㅋㅋ신이 나부럿구만,"['사람', '신', '나부', '럿', '구만']",[],[]
뭔가 포즈샷 cg가 예능재질이라 더 웃곀ㅋㅋㅋㅋ,"['뭔가', '포즈', '샷', '예능', '재질']",[],"['가다', '웃기다']"
유트루님 12:45 이 부분 쀼세계 김희애 님 느낌도 나고 넘 우아하고 잘어울려요!!,"['유', '트루', '부분', '쀼', '세계', '김희애', '느낌']",['우아하다'],"['나다', '넘다', '어울리다']"
두분다 제가 좋아하는 분들이라 ㅋㅋㅋㅋ 너무 유쾌하게 봤어염 ㅋㅋㅋㅋㅋㅋㅋㅋㅋㅋㅋ 두분 또 재밌는 영상 찍어주세용😘,"['분다', '염', '영상']","['좋아하다', '유쾌하다', '재밌다']","['보다', '찍다']"
6:33 아 왤캐 예쁘지..?,['캐'],['예쁘다'],['왤다']
헐 진짜 이 영상을 누르지 않을 수 없네요ㅋㅋㅋㅋㅋ,['영상'],['없다'],"['헐다', '누르다', '않다']"
"헐 트루언니 .. 걱정하면서 틀었는데 다 너무 잘어울려요 특히 두번째룩 완전 너무 성숙한데 상큼발랄 알파걸같아요ㅠㅠㅠㅠㅠㅠㅠㅠ 어떻게 머리를 묶고 롱부츠를 신을 생각을 했어요,, 울언니 이제 진짜 패피다","['트루', '걱정', '두번째', '완전', '상큼', '발랄', '알파걸', '머리', '롱', '부츠', '신', '생각', '언니', '이제', '패피']","['성숙하다', '같다', '어떻다']","['헐다', '하다', '틀다', '어울리다', '묶다', '하다']"
트루언니 넘 이쁘다 ㅠ회사원언니 맘이넓으셔 ㅠㅠ,"['트루', '회사원', '맘']","['이쁘다', '넓다']",['넘다']
"트루언니가 롱부츠를 소화하다니......심지어 진심 섹시터짐ㅋㅋㅋㅋㅋㅋ
장족의발전이에요!!!!","['트루', '롱', '부츠', '소화', '심지어', '진심', '섹시', '장족', '발전']",[],"['하다', '터지다']"
"트루님 세번째 샤넬같은 화이트룩 너무 잘어울려요!!! 그 착장으로 진짜 파티가세유
그리구 이 세상 모든 여자 분들 다들 눈치 안보고 본인 입고싶은대로 입었으면! ㅋㅋㅋㅋㅋㅋㅋ","['트루', '세번', '샤넬', '화이트', '착', '파티', '가세', '유', '세상', '모든', '여자', '눈치', '안보', '본인']",['같다'],"['어울리다', '그리다', '들다', '입다', '싶다', '입다']"
아직 안봤는데 제목만 봐도 벌써재밌다ㅋㅋㅋㅋㅋㅋㅋㅋ,"['제목', '벌써']",['재밌다'],"['보다', '보다']"
"ㅋㅋㅋㅋ진짜 두분 서로 자존감 높여주는 모습 보기만해도 입꼬리가 올라가요😍
두분다 옷 너무 잘어울리고 이제 너무 잘입으시는데요? ㅎㅎ ❤️","['서로', '자존감', '모습', '보기', '만해', '입', '꼬리', '분다', '옷', '이제']",[],"['높이다', '올라가다', '어울리다', '입다']"
8:44 처음에 광고인줄알고....ㅋㅋㅋㅋㅋㅋ,"['처음', '광고인', '줄알']",[],[]
내가 좋아하는 두 유튜버 이조합 사랑해ㅠㅠㅠㅠㅠㅠ,"['두', '유튜버', '조합', '사랑']",['좋아하다'],['하다']
뭐야뭐야무야!! 다른 쇼핑몰도 해주세요ㅋㅋㅋㅋㅋ 너무 재밌어요,"['무', '다른', '쇼핑몰']",['재밌다'],['해주다']
이 언니들 왤케 귀여웤ㅋㅋㅋ,['언니'],['귀엽다'],[]
8:00 모델인가요?! 트루님 한표!!!!! 두번째 세번째 룩 너무 예쁨..ㅠㅠ,"['모델', '트루', '표', '두번째', '세번']",['예쁘다'],[]
이조합 레전듴ㅋㅋㅋㅋㅋㅋㅋㅋㅋㅋㅋㅋㅋㅋㅋㅋ,"['조합', '레전드']",[],[]
트루님 6:28 진짜  존예탱구리 .........,"['트루', '존예', '구리']",[],[]
두분다 키가 어느정도 있으셔서 걍 다 잘어울려욬ㅋㅋㅋ,"['분다', '키', '정도']",['있다'],['어울리다']
"언니 이런거 넘무 조아여❤❤❤❤

근데 이 영상과 관련이 없긴한뎅....
언니 혹시 곧 여름 이니까 민감성 제모 관련 컨테츠 만들어 주시면 안 되나용🙏ㅠㅠ","['언니', '무', '영상', '관련', '뎅', '언니', '혹시', '여름', '민감', '제모', '관련', '컨', '테츠', '주시']","['이렇다', '좋다', '없다']","['넘다', '만들다', '되다']"
진짜 편집 미친거 아니냐며ㅋㅋㅋㅋㅋㅋ 그나저나 진짜진짜진짜 두 분 너무 귀엽고 예뻐요ㅜㅜㅜ👍👍👍,"['편집', '진짜진짜', '두']","['미치다', '아니다', '귀엽다', '예쁘다']",[]
놀래서 달려옴ㅋㅋㅋㅋㅋ,[],['놀래다'],['달려오다']
