comment,noun,adj,verb
"저 역시1주 정도 밀가루 설탕 끊어봤는데 크게
변화가 없더라구욥ㅠㅎㅎ그리고 저도 회사원님 처럼 피부 컨디션 변화가 심한 피부인데... 요즘 날이 더워져서 수분까지 말라서 그런지 개기름 폭발 입니다...!! 그리고 마스크 덕에 모낭염까지 생겼습니다ㅎㅎ.... 유익균과 수분이 제 개기름과 모낭염의 나쁜균을 이길 수 있는지 궁금해서 이벤트 신청합니다! 마지막으로  항상 영상 재밌게 잘보고있어요! 홧팅!!😆😆","['역시', '주', '정도', '밀가루', '설탕', '크게', '변화', '욥', '회사원', '처럼', '피부', '컨디션', '변화', '피부', '요즘', '날', '수분', '말', '개', '기름', '폭발', '마스크', '덕', '모낭', '염', '유익', '균', '수분', '개', '기름', '모낭', '염', '균', '이벤트', '신청', '마지막', '항상', '영상', '홧팅']","['없다', '심하다', '그렇다', '이다', '나쁘다', '있다', '궁금하다', '재밌다']","['끊다', '보다', '더워지다', '생기다', '이기다', '하다', '보다']"
언니..대단해요..오늘 머리 너무 귀여워요~~어려보여요~~ 요즘 볼때마다 이뻐지는...큽 안 늙어요??나만 시간을 정통으로 맞나..,"['언니', '오늘', '머리', '요즘', '볼때', '시간', '정통']","['대단하다', '귀엽다', '이쁘다']","['어리다', '보이다', '크다', '늙다', '맞다']"
요즘 아토피랑 마스크 콜라보로 좁쌀 여드름까지...ㅠㅠㅠ 스킨케어가 문제인가 싶어서 바꿔보고 싶었는데 회사원님 영상을 보니 저에게 딱 맞는 챌린지와 에센스네요!!!! 저두2주 첼린지 함께 해보고 싶습니다❤️❤️,"['요즘', '아토피', '마스크', '콜라보', '좁쌀', '여드름', '스킨', '케어', '문제', '보고', '회사원', '영상', '린지', '에센스', '주', '첼린']",[],"['싶다', '바꾸다', '싶다', '보다', '맞다', '채다', '해보다', '싶다']"
피부가 좋아지고 싶은데 돈이 없어요ㅠㅠ 그래서 받고 싶어요,"['피부', '돈']",['없다'],"['좋아지다', '싶다', '받다', '싶다']"
꽃가루 알레르기로 고생중이랍니다ㅠㅠㅠ 이 뒤집어진 피부 진정시키고 싶어요!!,"['꽃가루', '알레르기', '고생', '랍니', '피부', '진정']",[],"['뒤집어지다', '시키다', '싶다']"
영상 너무 재밌네용 💙 평소에 라로슈포제 엄청 잘쓰는데 뭔가 K뷰티로 갈아타고싶어서 닥터자르트를 눈여겨 봤는데 영상보고 엄청 써보고싶어졌어용💙써볼 수 있는 기회가 있으면 너무 좋을것 같아용🙋🏻‍♀️🙋🏻‍♀️🙋🏻‍♀️,"['영상', '평소', '라로슈포제', '뭔가', '뷰티', '닥터', '트', '눈', '영상', '보고', '볼', '기회']","['재밌다', '있다', '있다', '좋다', '같다']","['잘쓰다', '갈아타다', '자르다', '여기다', '보다', '써다', '보다', '써다']"
"튀김 끊기로 되겟어??? 하는 의심이 
진짜로 되서 너무 감동이라 3달째 튀김 끊고있읍니다!","['튀김', '의심', '감동', '달', '튀김']",[],"['끊기다', '되다', '하다', '되다', '끊다']"
유학갔다가 엄청나게 타고 손상된 피부로 한국 왔는데ㅠㅠ 왜 저만 이렇게 까맣고 푸석한지ㅠㅠ .. 저도 피부톤 개선과 쳑쳑함을 느끼고 싶습니다!,"['유학', '타고', '손상', '피부', '한국', '피부', '톤', '개선', '쳑쳑함']","['엄청나다', '까맣다', '푸석하다']","['가다', '되다', '오다', '느끼다', '싶다']"
"속당김 진짜 힘든데,,,나중에 올리브영 가면 꼭 사봐야겠어요‼️","['김', '나중', '올리브영', '가면', '꼭']",['힘드다'],['사보다']
임신중기 입성하고 속건조가 심해졌어요ㅠㅠ 좋은것만 먹으려고 하려하였으나 몸은 다른걸 원하더라규요ㅋㅋㅋㅋㅋㅋㅋ밀가루 설탕 목먹고 우울해지는것 보다 행복한 돼지가 더 살기 좋다는 마음으로ㅋㅋㅋㅋㅋ,"['임신', '기', '입성', '건조', '몸', '걸', '규', '밀가루', '설탕', '목', '돼지', '살기', '마음']","['좋다', '원하다', '우울하다', '행복하다', '좋다']","['심해지다', '먹다', '하다', '먹다', '보다']"
"평소에 영상 잘 보고 있습니다^^ 이번 영상보니 점점 건조해지는 제 피부에 닥터 자르트 저 제품을 써보면 속당김이 개선될거 같아요~
회사원님의 이벤트에 당첨되어서 쓰게 되면 정말 기쁠거 같아요😄","['평소', '영상', '보고', '이번', '상보', '점점', '피부', '닥터', '자르트', '제품', '김', '개선', '회사원', '이벤트', '당첨', '정말']","['있다', '건조하다', '같다', '기쁘다', '같다']","['자다', '써다', '보다', '되다', '되어다', '쓰다', '되다']"
피부 안좋아서 고민인분들 진짜 기름이 조금이라도 들어간 음식 한달정도만 안먹어도 피부 완전 좋아져요.. 속이안좋아서 항상 과일만 먹다가 피부 왤케 좋아졌냔 소리들었음,"['피부', '고민', '인분', '기름', '조금', '음식', '달', '정도', '피부', '완전', '항상', '과일', '피부', '냔', '소리']","['안좋다', '안좋다']","['들어가다', '먹다', '좋아지다', '속이다', '먹다', '좋아지다', '들다']"
저는 피부가 갑자기 뒤집어졌습니다.... 집에는 저한테 안맞는거 뿐이고 나갈 수도 없는 이런 환경...ㅋㅋ ... 기초는 비싸서 부담도 되는 부분인데ㅜㅜㅜ 닥터자르트 맨날 올리브영에서 손길 스치고 가격보고 슬퍼하는...ㅜㅜ 화장도 뜨고 정말 갖고 싶습니다!ㅜ,"['피부', '갑자기', '집', '뿐', '수도', '환경', '기초', '부담', '부분', '닥터', '트', '올리브영', '손길', '가격', '보고', '화장', '정말']","['없다', '이렇다', '비싸다', '슬프다']","['뒤집어지다', '맞다', '나가다', '되다', '자르다', '스치다', '뜨다', '갖다', '싶다']"
스킨케어 제품 유목민 이에영 ㅠㅠ 저한테 좋은 스킨케어 제품을 못 찾았는데 써보고 싶어영~,"['스킨', '케어', '제품', '유목민', '스킨', '케어', '제품', '못', '보고']",['좋다'],"['찾다', '써다', '싶다']"
트러블이 너무 잘 올라오는 피부여서 확 안좋아졌다가 좋아졌다가를 계속 반복하고 있는 1인입니당..ㅠㅠ 꼭 써보고 싶습니당!!!!,"['트러블', '피부', '확', '계속', '반복', '인', '꼭', '보고']","['있다', '이다']","['자다', '올라오다', '좋아지다', '좋아지다', '써다', '싶다']"
"언니 믿고 이번년도 초에 샀는데,, 새롭게 업그레이드라니,, 만약에 받으면 업글 전 후를 비교해보고 싶네용","['언니', '이번', '년도', '초', '업그레이드', '만약', '업글', '비교']",['새롭다'],"['믿다', '사다', '받다', '해보다', '싶다']"
-0.3키로라니... 응아 한번 하는 무게 아닌가요 ㅜㅜ 오 닥터자르트 평소 많이 들어본 브랜드인데 악건성이라 넘 궁금합니당!!😌⭐️,"['키', '로라', '한번', '무게', '닥터', '트', '평소', '브랜드', '악', '건성']","['아니다', '궁금하다']","['하다', '자르다', '들다', '보다', '넘다']"
"올해 초부터 속당김과 함께한디 반년째에요ㅜㅜ 예전에 잘 맞던 비싼 퍼스트 에센스(sk2,숨)도 다시 사보고 sns나 유투브로 추천받아서 저렴이 템(토리든, 노니에센스 등등) 사봤는데 근본적인 속당김이 없어지질 않네요ㅜㅜ 속당김 박살내줄 닥터자르트 바이옴에센스 써보고싶습니다!!","['올해', '초', '김', '디', '반년', '예전', '퍼스트', '에센스', '숨', '다시', '유투브', '추천', '저렴', '템', '토리', '노니', '에센스', '등등', '근본', '김', '김', '박살', '닥터', '트', '바이옴', '에센스']",['비싸다'],"['자다', '맞다', '사보다', '받다', '사보다', '없어지다', '않다', '내주다', '자르다', '써다', '보다']"
극건성 민감하고 열이 많아서 쉽게 여드름이 많이 올라와요ㅠㅠ 회사원님의 추천인 바이옴 에센스를 바르고 나아지고 싶어요!!,"['건성', '열', '여드름', '회사원', '추천', '바이옴', '에센스']","['민감하다', '많다']","['쉬다', '올라오다', '바르다', '나아지다', '싶다']"
"와 진짜 보면서 빠져드는 영상이예요 
제 피부타입이 티존은 누가봐도 유분이 많아서 지성처럼 보이는데
볼이나 이마는 속당김이 너무심해서 화장후 갈라지는게 다 보이는정도거든요
(각질은 말할것도 없구요 ㅠㅠ)
아침 저녁으로 매일매일 순하고 촉촉하다는 스킨케어 다써봤는데
스킨 로션은 너무 순하기만해서 촉촉함은 못느끼겠고 
수분크림은 너무 무거워서 아침에 수분크림바르고 화장하면 화장밀리고...
정말 너무너무 써보고싶은 제품이네요 😩

원래 댓글 정말 안쓰는데 
화사원님덕분에 댓글도 써보네요 
매번 유익한 영상 감사합니다 ^^","['영상', '피부', '타입', '티존', '누가', '유', '지성', '볼', '이마', '김', '화장', '정도', '각질', '말', '아침', '저녁', '매일', '스킨', '케어', '스킨', '로션', '만해', '수분크림', '무거워', '아침', '수분크림', '화장', '화장', '밀리', '정말', '제품', '원래', '댓글', '정말', '화사', '원님', '덕분', '댓글', '매번', '영상']","['많다', '무심하다', '없다', '순하다', '촉촉하다', '순하다', '촉촉하다', '유익하다']","['오다', '보다', '빠져들다', '보다', '보이다', '갈라지다', '보이다', '거들다', '하다', '써다', '보다', '느끼다', '바르다', '하다', '써다', '보다', '쓰다', '써다', '보다', '감사하다']"
진짜 써보고싶다 ㅠㅠ̑̈ 마스크껴서 하관만 여드름 폭발인데 저거 쓰면 나아질까요?̊̈ 여드름 사라져도 흉터가 남아가지고 얼룩덜룩한 제 피부에 자비를!,"['마스크', '하관', '여드름', '폭발', '여드름', '흉터', '피부', '자비']",['얼룩덜룩하다'],"['써다', '보다', '끼다', '쓰다', '나아지다', '사라지다', '남다']"
영상을 보니 정말 써보고 싶네요ㅜㅜ,"['영상', '정말', '보고']",[],"['보다', '써다', '싶다']"
자주 재발하는 접촉성 피부염 앓고있어요ㅠㅠ 얼굴에 열도 때문에 속건조도 생겨 꼭 한번 쓰고싶어요~!,"['자주', '재발', '접촉성', '피부염', '얼굴', '열도', '때문', '건조', '꼭', '한번']",[],"['하다', '앓다', '생기다', '쓰다']"
피부에 유익균 많이 주고 저한텐 밀가루 설탕 많이 줄래요ㅜㅜㅜㅜ꼭 써보고싶다,"['피부', '유익', '균', '한텐', '밀가루', '설탕', '꼭']",[],"['주다', '주다', '써다', '보다']"
요즘 마스크로 인해서 엄청 피부가 민감해져 있습니다. 예전 사용했던 화장품도 다 간지러워요 ㅠ.ㅠ 도대체 무얼 발라야할지 모르겠습니다. 구해주세요 회사원A 님!! ㅠㅠ,"['요즘', '마스크', '피부', '예전', '사용', '화장품', '도대체', '무엇', '발라', '회사원']","['인하다', '민감하다', '있다', '간지럽다', '야하다']","['하다', '모르다', '해주다']"
"요즘 악건성인 제 피부가 악악악건성이되고 거의 흑빛이됐어요....그래서 홀려서 들어왔습니다
써보고싶어여!!!!","['요즘', '악', '건성', '피부', '건성', '거의', '빛', '홀려']",[],"['되다', '돼다', '들어오다', '써다', '보다']"
"와 저도 밀가루 끊기 노력중인데.진짜 너무 힘들어요 그렇다고 진짜 체중이 줄어드는건 체감못하고 ㅋㅋ 영상보면서 공감했네요 ㅋㅋㅋ
날씨도 더워지는데 제피부는 요즘 계속 까칠하고 수분보습 해줘도 금방 건조해지는거같아요 수분크림 듬뿍바를때 느껴지는 그 따끔함...! 꼭 써보고 싶네요 ㅎㅎ","['밀가루', '노력', '체중', '체감', '못', '영상', '공감', '날씨', '피부', '요즘', '계속', '수분', '보습', '금방', '수분크림', '듬뿍', '꼭', '보고']","['힘들다', '까칠하다', '건조하다', '같다', '따끔하다']","['오다', '끊기다', '줄어들다', '보다', '하다', '더워지다', '해주다', '바르다', '느껴지다', '써다', '싶다']"
저는 유분때문에 이마에 트러블이 잔-뜩 올라오는 피부타입인데 닥터자르트 바이옴에센스 쓰면서 유수분 밸런스를 맞춰보고 싶어용 매끈한이마를 가져보고 싶숩니다 ㅎㅎ💗,"['유', '때문', '이마', '트러블', '잔', '뜩', '피부', '타입', '닥터', '트', '바이옴', '에센스', '유수', '밸런스', '보고', '이마', '보고', '싶숩니']",['매끈하다'],"['올라오다', '자르다', '쓰다', '맞추다', '싶다', '가다']"
언니와 비슷한 핵민감성 피부입니다 ㅠㅠ언니 추천템으로 광명 찾던 사람이라 바이옴에센스 진짜 궁금하네요...!,"['언니', '핵', '민감', '피부', '언니', '추천', '템', '광명', '사람', '바이옴', '에센스']","['비슷하다', '이다', '궁금하다']",['찾다']
"방금 샌드위치 세개 클리어했는데 29년째 좁쌀여드름+홍조랑 가 족같은 사이가 된 이유를 알겐네요 하하 고등학교때부터 지금까지 닥터다르트라인 쓰는데 바이옴 제품은 안써봤네요
제가 한번 써보고 후기남길게요!","['방금', '샌드위치', '개', '클리어', '좁쌀', '여드름', '홍조', '족', '사이', '이유', '알겐네', '하하', '고등학교', '지금', '닥터', '트', '라인', '바이옴', '제품', '한번', '보고', '후기']","['같다', '다르다']","['하다', '가다', '되다', '쓰다', '써다', '보다', '써다', '남다']"
요즘 에센스 유목민인데 ㅠㅠ한번 써보고 싶네요 ㅠㅠㅠ,"['요즘', '에센스', '유목민', '한번', '보고']",[],"['써다', '싶다']"
예전부터 회사원님 영상에 나올때마다 너무 좋아보여서 닥터자르트 바이옴 에센스 스킨 떨어지면 꼭 사서 써봐야지 했었는데 마침 이벤트를!!ㅠㅠㅠ 기초제품 정착하고 싶어요 흑흑 꼭 써보고 싶어요~~,"['예전', '회사원', '영상', '아보', '닥터', '트', '바이옴', '에센스', '스킨', '꼭', '사서', '마침', '이벤트', '기초', '제품', '정착', '꼭', '보고']",['좋다'],"['나오다', '자르다', '떨어지다', '써다', '보다', '하다', '싶다', '써다', '싶다']"
언니 피부 진짜 너무너무 좋으신데 2020버전 기초루틴영상 올려주실 생각은 없으세용?😭,"['언니', '피부', '버전', '기초', '루틴', '영상', '생각']","['좋다', '없다']",['올려주다']
"밀가루와 고기를 멀리하면 오래 살수있지만 
그렇다면 딱히 오래살이유가없다-는 짤생각나네 ㅋ 
제 기준엔 설탕도 마찬가지 ㅠ","['밀가루', '고기', '멀리', '살이', '유가', '짤', '기준', '설탕', '마찬가지']","['그렇다', '딱하다', '없다']","['하다', '살다', '늘다', '생각나다']"
"예전에 회사원님 영상에서 바이옴에센스를 보고 구매하려고 했으나.. 역시 가격이 부담되더라구요ㅠㅠ
그런데 올해 30살이 되면서 확실히 피부가 칙칙해보이고 잡티도 늘고 이만저만 스트레스가 아닙니다ㅠ
혹시나 이벤트에 당청되서 써볼 기회가 생긴다면 딱! 써보고 좋다! 싶으면 꾸준히 써보려구요ヽ( ᐛ )ノ
돈은 무진장 들겠지만😫꼭당첨되면 좋겠어욥🥰🥰","['예전', '회사원', '영상', '바이옴', '에센스', '보고', '구매', '역시', '가격', '부담', '올해', '살이', '피부', '보이', '잡티', '스트레스', '혹시', '이벤트', '당청', '볼', '기회', '보고', '돈', '무진장', '꼭', '당첨', '욥']","['확실하다', '칙칙하다', '아니다', '좋다', '꾸준하다', '좋다']","['하다', '하다', '되다', '되다', '되다', '써다', '생기다', '써다', '싶다', '써다', '보다', '들다', '되다']"
저도 회사원님이랑 비슷한 피부타입인데ㅠ속건조 땜에 힘들어서 그런데 학생이라서 가격으로도 부담 되고 한 번이라도 써보고 싶어요ㅠㅠ,"['회사원', '피부', '타입', '건조', '땜', '학생', '가격', '부담', '보고']","['비슷하다', '힘들다']","['되다', '하다', '써다', '싶다']"
마스크를 쓰면서 옛날과 다른 루틴으로 스킨 케어를 시도해도 트러블이나 자꾸 뒤집어진 피부를 쉽게 진정시킬 수는 없더라구요!! ㅠ_ㅠ 예전에도 기회가 되어 언니 영상 보고 한 번 구매해서 썼는데 이번에 새로 리부트 된 걸 보니 더더더 구매욕이 샘솟네요...!!! 만성 스트레스+꽃가루로 뒤집어진 피부를 회복하고 싶네요...!! ㅠㅠ,"['마스크', '옛날', '다른', '루틴', '스킨', '케어', '시도', '트러블', '자꾸', '피부', '진정', '예전', '기회', '언니', '영상', '보고', '구매', '이번', '리부트', '걸', '더더', '욕', '만성', '스트레스', '꽃가루', '피부']","['없다', '새롭다', '회복하다']","['쓰다', '하다', '뒤집어지다', '쉬다', '시키다', '되어다', '하다', '하다', '써다', '되다', '보다', '샘솟다', '뒤집어지다', '싶다']"
영상흡입력 엄청나네욬ㅋㅋㅋㅋㅋㅋㅋ 끝나는게 아쉬웠는데 이벤트가 있다니!! 저는 성인이 된 이후 단 한순간이라도 여드름이 얼굴에 없던적이 없어요 그전에는 트러블용 화장품을 전전하다 효과가 없어서 올해초부터 기초적인 수분 보습에 집중합니다 그와중에 바이옴에센스에 피부유익균이 들어있다는 말에 혹하네요ㅎㅎㅎ 솔직히 가격이 쬐끔 비싸서 구매도 망설여지고 구매한다고 해도 팍팍 쓰진 못할거같아서 이벤트 신청합니다!! TMI지만 제가 졸업하고 월급이라는 걸 받으면 내돈내산 할거에요,"['영상', '흡입', '이벤트', '성인', '이후', '단', '한순간', '여드름', '얼굴', '적', '트러블', '화장품', '전전', '효과', '해초', '기초', '수분', '보습', '집중', '와중', '바이옴', '에센스', '피부', '유익', '균', '말', '혹', '가격', '구매', '구매', '고', '해도', '이벤트', '신청', '졸업', '월급', '걸', '돈', '산']","['엄청나다', '아쉽다', '있다', '없다', '없다', '없다', '솔직하다', '비싸다', '같다']","['끝나다', '되다', '하다', '하다', '들다', '하다', '쬐다', '끄다', '망설이다', '쓰다', '하다', '하다', '받다', '하다']"
속건조를 잡아줬던 아이템을 많이 써 봤는데 실제로 잡아줬던 제품은 딱히 없었어요 ㅠㅠ 오히려 유분은 많은데 건조한 느낌? 복합성 피부라서 너무 가벼운 건 건조하고 콧물 정도는 기름지고 그래서 ㅠㅠ 꼭 써보고 싶네요 ㅠㅠㅠ,"['건조', '아이템', '실제', '제품', '오히려', '유', '느낌', '복합', '피부', '건', '콧물', '정도', '꼭', '보고']","['딱하다', '없다', '많다', '건조하다', '가볍다', '건조하다']","['잡다', '주다', '써다', '보다', '잡다', '주다', '기르다', '써다', '싶다']"
"썸넬보고 빵터지신분...?
(나만 그른가?)","['썸넬', '보고', '신분', '그른']",['빵터지다'],[]
"영상 보고 나니 설탕은 줄이더라도 끊지는 뭇하겠네요 ㅋㅋㅋ 행복하게 오래 살고 싶어요,,, 그래도 현대문물로  피부는 좋아지고 싶은 욕심에 신청해봐요!","['영상', '보고', '나니', '설탕', '뭇', '살', '문물', '피부', '욕심', '신청']",['행복하다'],"['줄이다', '끊다', '하다', '싶다', '좋아지다', '싶다', '해보다']"
여름되면서 안그래도 심한 기미가 다시 심해지고있어요... 블루샷으로 개선해보고싶네요오🥺,"['여름', '기미', '다시', '블루샷', '개선']","['그렇다', '심하다']","['되다', '심해지다', '해보다']"
여드름약을 먹으면서 피부가 많이 건조해졌습니다 ㅠㅠ 속당김 때문에 화장도 다 뜨는 느낌이고 ㅠㅠ 살려주세용 😭💙,"['여드름', '약', '피부', '김', '때문', '화장', '느낌']",['건조하다'],"['먹다', '뜨다', '살리다']"
"제 피부는 안녕~?나는 엄쳥 순해♡ 한 화장품도 오지게 따가운 예민하구 민감하답니다...트러블은 잘 안나지만요..
하지만 너무 따가워ㅜ 게다가 얼굴 부위마다 피부톤이 달라요....  그리고 춱춱하다는 화장품을 발라도 속까지 촉촉하진 않았어요...이 영상을 보고 어쩌면 내가 안따가운, 어쩌면 내가 춱춱한 화장품이 있다는 희망을 가지게되었쥬... 한번 써보고싶어요....","['피부', '안녕', '엄쳥', '화장품', '오지', '트러블', '안나', '게다가', '얼굴', '부위', '피부', '톤', '달라', '춱춱', '화장품', '발라', '속', '영상', '보고', '어쩌면', '어쩌면', '춱춱', '화장품', '희망', '가지', '쥬', '한번']","['순하다', '따갑다', '예민하다', '민감하다', '따갑다', '촉촉하다', '따갑다', '있다']","['하다', '자다', '하다', '않다', '되어다', '써다', '보다']"
"저거 다 좋은데 너무 비싸서 정착못하겠던데... ㅎㅎ,,, ㅜ 양이 작은데다가 여름에도 건조해서 바디로션바를 정도로 악건성이라 금방쓰는데 ㅠ 가격은 😭 돈 많이 버는 직장이 되고파,,","['정착', '양', '여름', '바디', '로션', '정도', '악', '건성', '금방', '가격', '돈', '버', '직장']","['좋다', '비싸다', '작다', '건조하다', '고프다']","['하다', '바르다', '쓰다', '되다']"
고3이라서 학교에 가고있는데 하루종일 마스크를 쓰고 있어야되서 피부가 많이 예민해지고 건조해요ㅠㅠ  피부도 많이 안 좋아져서 스트레스 받는데 한번 써보구싶어요!!ㅠㅠ,"['고', '학교', '하루', '종일', '마스크', '피부', '피부', '스트레스', '한번']","['있다', '예민하다', '건조하다']","['가다', '쓰다', '되다', '좋아지다', '받다', '써다', '보다']"
저도 아토피인데 단 거 못 먹으면 너무 스트레스 받아서 매일 알러지약 먹으면서도 단 거를 먹고 있어요..ㅠㅠ 바이옴이 단 거를 먹을 수 있게 도와줄수있으면 좋겠어요🍭🍰🍓💕,"['아토피', '단', '못', '스트레스', '매일', '알러지', '약', '단', '바이옴', '단']","['있다', '있다', '좋다']","['먹다', '받다', '먹다', '먹다', '먹다', '도와주다']"
진짜 써보고 싶다 얼굴에 있는 좁쌀여드름 진짜 없애고싶어요 그리고 여드름 자국 흔적 이런것도 없에고 싶어요ㅜㅜㅜㅜ짜증나 ㅠㅠ 저 당첨되면 저도 밀가루 설탕 아예 끊을거에요 저는 회사원님이 못한 -5kg까지 할거에욬ㅋㅋㅋㅋㅋㅋㅋㅋ,"['보고', '얼굴', '좁쌀', '여드름', '여드름', '자국', '흔적', '에고', '당첨', '밀가루', '설탕', '아예', '회사원', '못']","['있다', '없다', '짜증나다']","['써다', '싶다', '없애다', '싶다', '되다', '끊다', '하다']"
갑자기 피부가 뒤집어져서 ㅠㅠ 스킨케어를 바꿀때가 된 것 같은데 회사원님이 추천해주시니 한번 써보고 싶어용,"['갑자기', '피부', '스킨', '케어', '회사원', '추천', '한번', '보고']",['같다'],"['뒤집어지다', '바꾸다', '되다', '해주다', '써다', '싶다']"
요즘 마스크때문에 피부가 완전히 뒤집어졌어요ㅠㅠ저는 원래 복합성이었는데 민감성이 됬답니다..바이옴에센스를 꼭써보고 싶어요! 아직 민감성이 된지 얼마안되서 저에게 맞는 스킨케어도 아직 못찼아거든요..,"['요즘', '마스크', '때문', '피부', '원래', '복합', '민감', '바이옴', '에센스', '꼭', '보고', '민감', '얼마', '스킨', '케어']","['완전하다', '안되다']","['뒤집어지다', '이다', '되다', '써다', '싶다', '되다', '맞다', '차다']"
"❣닥터자르트 바이옴 에센스❣
좋다고~ 좋다고~ 소문은 자자하게 들었는데 민감한 피부라 새로운 걸 써보는게 두려워서 계속 못 써보고 있었는데 민감함 대표주자 회사원님이 이렇게 잘 쓰고 효과도 낭낭한거 보니 꼭 써보고 싶네요👏👏","['닥터', '트', '바이옴', '에센스', '소문', '피부', '걸', '계속', '못', '보고', '대표', '주자', '회사원', '효과', '낭낭', '꼭', '보고']","['좋다', '좋다', '자자하다', '민감하다', '새롭다', '두렵다', '있다', '민감하다']","['자르다', '들다', '써다', '보다', '써다', '자다', '쓰다', '보다', '써다', '싶다']"
회사원님 오늘도 영상 잘보고 갑니당.  피부가 너무 안좋아서 바이옴 에센스를 써보고 싶어요 ㅠㅠ 바이옴 에센스 쓰면 제 피부도 깐달걀 피부처럼 될수 있을까요? ㅠㅠ,"['회사원', '오늘', '영상', '피부', '바이옴', '에센스', '보고', '바이옴', '에센스', '피부', '달걀', '피부']","['안좋다', '있다']","['보다', '가다', '써다', '싶다', '쓰다', '깔다', '되다']"
