comment,noun,adj,verb
립앤아이 리무버만 순하게 바뀌면 진짜 괜찮을거같아요!! 근데 뒤로 갈수록 브금이 넘 커져서 언니 목소리가 잘 안 들리네요ㅠㅠ,"['립앤', '아이', '리무버', '뒤', '갈수록', '브금', '언니', '목소리']","['순하다', '괜찮다', '같다']","['바뀌다', '넘다', '커지다', '자다', '들리다']"
와 진짜 속눈썹한올한올 지워주는거에 놀랐다 ㅁㅊ,['속눈썹'],[],"['오다', '지우다', '놀라다']"
다른사람들도 낚여야하는데 베플이 너무 모든걸 빨리말해쥼..ㅠ ㅋㅋㅋㅋㅋㅋㅋ😻💋😆😆🌹🌷👏🌈💝🐿🎊🎉아이디어뱅크 회사원님 알라뷰여요 ㅋㅋㅋㅋㅋ😆😻😆😻🌹🐿🎉💐🌺👏✨,"['다른사람', '낚', '베플', '걸', '쥼', '아이디어', '뱅크', '회사원', '알라', '뷰', '여요']",['야하다'],['말다']
와 이거 대박이다 진짜 사고싶어요...맨날 귀찮아서 술먹고 들어오면 못지우고 잘때도있었는데ㅠㅠ 렌즈도 빼주다니ㅠㅠㅠㅠ 75만원쓸만합니다,"['대박', '술', '렌즈']","['귀찮다', '있다']","['오다', '사다', '먹다', '들어오다', '지우다', '자다', '빼다']"
누가 이렇게 정성스럽게 뻥을 치냐곸ㅋㅋㅋㅋㅋㅋㅋㅋㅋㅋㅋㅋㅋㅋㅋㅋㅋㅋㅋㅋㅋㅋㅋㅋㅋㅋㅋ,"['누가', '정성', '뻥']",[],['치다']
처음엔 기계가 디테일하게 화장지워 주겠어? 했는데 정말 세상 좋아졌네요. 첨엔 비싸다고 생각했는데 반영구적으로 쓸수있으니까...시간과 노력을 계산해보면 괜찮을거 같기도 하고 1년후엔 비슷한 상품 저렴이 버젼으로 나오면 그때 구매하는것도  괜찮을듯 해요.,"['처음', '기계', '디테', '화장지', '워', '정말', '세상', '첨', '생각', '반영구', '시간', '노력', '계산', '상품', '저렴', '버젼', '그때', '구매', '해']","['비싸다', '괜찮다', '같다', '비슷하다', '괜찮다']","['이다', '주다', '하다', '좋아지다', '하다', '쓸다', '해보다', '하다', '나오다', '하다']"
언니 저도 언니가 리뷰한거 보고 샀어요!!! 75만원이 아깝지 않은 제품이에요ㅠㅠㅠㅠ 현대의 기술이란,"['언니', '언니', '리뷰', '보고', '제품', '현대', '기술']",['아깝다'],"['사다', '않다']"
제대로 클렌징이 될까 싶었는데 상상 외로 잘되네요ㅋㅋㅋㅋ 언니가 리뷰한 특이한 기계중에 가장 쓸모가 있지 않았나ㅋㅋㅋㅋ싶네요ㅋㅋㅋㅋㅋㅋㅋㅋ (내가 웃는게 웃는게 아니야..),"['제대로', '클렌징', '상상', '외로', '언니', '리뷰', '기계', '가장', '쓸모']","['특이하다', '있다', '아니다']","['되다', '싶다', '되다', '않다', '싶다', '웃다', '웃다']"
와 진짜 혁신적이다ㅋㅋㅋㅋㅋ this is innovation🤭🤭 리부트 컴퍼니 닉값하네요 구성은 75만원 생각하면 부실하지만ㅜㅜㅜ 뷰티산업이 진짜 제일 발전이 대단한듯 정말 놀랐어요,"['혁신', '리부트', '컴퍼니', '닉값', '구성은', '생각', '뷰티', '산업', '제일', '발전', '정말']","['부실하다', '대단하다']","['오다', '하다', '하다', '놀라다']"
하 진짜 이 언니 항상 별 기상천외한 걸 많이 해섴ㅋㅋㅋㅋㅋㅋㅋㅋㅋㅋㅋ 상상도 못함 오옷 드디어 이과가 한 건 했구나!!!!!!!! 하면서 들어왔네...,"['언니', '항상', '별', '기상', '외한', '걸', '상상', '오옷', '이과', '건']",[],"['하다', '하다', '하다', '하다', '하다', '들어오다']"
"헐 지린다,,, 개쩌는데? 근데 비싸서 ㅠㅠ 한 10년 뒤쯤에야 쓰고있을듯...","['린다', '개쩌는데', '뒤']",['비싸다'],"['헐다', '하다', '쓰다']"
오오 가격 좀만 낮추면 사는데ㅠㅠ 별 기대없이 봤는데 성능은 꽤 괜찮네요ㅎㅎ,"['가격', '별', '기대', '성능', '꽤']",['괜찮다'],"['낮추다', '살다', '보다']"
10분 철저한거봐 ㅋㅋㅋㅋㅋㅋ,[],['철저하다'],['보다']
"와 돈만 있으면 나도 사고싶다ㅠㅠㅠㅠ
렌즈 빼주고 마스카라까지 지워준다니 이건 정말 혁신인 것 같아요!!!","['돈', '렌즈', '빼주', '마스카라', '정말', '혁신']","['있다', '같다']","['오다', '나다', '사다', '지우다', '주다']"
헐 완전 혁신이네요 근데 넘 비싸서ㅠㅠㅠ,"['완전', '혁신']",['비싸다'],"['헐다', '넘다']"
이걸위해 풀메하고 카메라 켠 회사원님 리스팩트✨ㅋㅋㅋㅋ,"['걸', '위해', '풀메', '카메라', '회사원', '리스', '팩트']",[],['켜다']
와 채신기술 신기해요ㅠㅜㅠㅠ 75만원 모으면 당장사러가~!~~!! 워터프루프까지 지워주다닝 완전 첨단 과학기술이당!,"['기술', '당장', '워터', '프루프', '닝', '완전', '첨단', '과학기술', '당']",['신기하다'],"['오다', '채다', '모으다', '사르다', '지우다']"
나는 왜... 오늘따라 댓글먼저 안 보고...... 맨날 댓글 체크하면서 보던 애가 왜 하필 오늘은 댓글먼저 안 보고ㅠㅠㅠㅠ,"['오늘', '댓글', '먼저', '보고', '댓글', '체크', '애가', '하필', '오늘', '댓글', '먼저', '보고']",[],"['따르다', '하다', '보다']"
요즘 왜 뿌링계산기가 없어여..?ㅠㅠ 뿌링뿌링..,"['요즘', '뿌링', '계산기', '뿌링뿌링']",['없다'],[]
"ㅋㅋㅋㅋㅋㅋ오와 신기해요!!
ㅠㅠ진짜 세상 너무 좋다ㅠㅠㅠ 점점 라떼꼰대가 되가는것 같아요 진짜ㅠㅠ","['세상', '점점', '라떼', '꼰', '대가']","['신기하다', '좋다', '같다']",['되다']
다른날 봤는데 보고 뭐지..😮이표정이었음ㅋㄱㅋㄱㅋㅋㄷㅋㄱㅋㅋ,"['날', '보고', '표정']",[],"['보다', '이다']"
"정성스러운 구라에 부라자끈을 탁,,,! 치고 갑니다,,,, 총총","['구라', '부라자', '끈', '탁', '총총']",['정성스럽다'],['가다']
어쩐지 텐션이 평소보다 자연스럽고 미묘하게 높음ㅋㅋㅋㅋ,"['어쩐지', '텐션', '평소']","['자연스럽다', '미묘하다', '높다']",[]
ㅋㅋㅋㅋ 진짜 암 생각 없이 뭐 저런게 있냐 하고 보다가 당했네....ㅋㅋㅋㅋㅋ,"['암', '생각', '저런']","['있다', '당하다']","['하다', '보다']"
와..... 너무 생각지도 못한데서 속아서 뻥짐...,"['생각', '지도', '속', '뻥짐']",[],"['오다', '하다', '서다']"
우와....진짜 갖고싶다ㅠㅠㅠㅠㅠㅠㅠㅠㅠㅠㅠㅠㅠㅠㅠㅠㅠ 이세상 기술 발전이 말도 못하네요ㅠ 남친대신 데이트 비용 아껴서 장만하면 참 조을듯,"['이세', '기술', '발전', '말', '남친', '대신', '데이트', '비용', '장만']",['좋다'],"['갖다', '하다', '아끼다', '하다', '차다']"
뻥인줄은 알았지만.. 뻥이지롱이 8분동안 나올줄은..몰라써요ㅠㅠ,"['뻥', '뻥']",[],"['알다', '나오다', '모르다', '써다']"
"와 미친 개 진지하게 보고있는데, 시발..0","['개', '시발']","['미치다', '진지하다']","['오다', '보다']"
뻥이지롱이 8분동안 나올줄은...... ㅋㅋㅋㅋ,['뻥'],[],['나오다']
아ㅋㅋㅋㄱㅋㅋㅋ언니 빌드업이 넘 좋아서 그냥 봐버렸자나요,"['언니', '빌드업', '그냥']",['좋다'],"['넘다', '보다', '버리다', '자다']"
앜ㅋㅋㅋㅋ 댓보고 오ㅓ...지져스 하면서 보고 있는데 구라여서 1차당황 댓구라에 2차당황ㅋㅋㅋㅋ,"['보고', '지져스', '보고', '구라', '차', '당황', '구라', '차', '당황']",['있다'],['하다']
꾸준히 이상한 언니...,['언니'],"['꾸준하다', '이상하다']",[]
아...ㅋㅋㅋㅋㅋㅋㅋㅋㅋㅋ뻥이지롱 왜이렇게 기나욬ㅋㅋㅋ더 얄미워욬ㅋㅋㅋ진짜 영상대박ㅋㅋ댓글보고 봤는데도 빡침...ㅋㅋㅋ하핫,"['뻥', '영상', '대박', '댓글', '보고', '핫']","['얄밉다', '빡치다']","['기다', '보다']"
나 구독 취소할래ㅠㅠㅠㅠㅠ,"['구독', '취소']",[],['하다']
"2:11 ..?ㅋㅋㅋㅋ..?설마하고 영상길이 확인해봤는데 8분 더 남았는데..?
하고 돌려보니까 8:51 여기서부터 노래나오네요 ㅋㅋㅋㅋㅋㅋㅋ언니....속았어 ㅜㅜㅜㅜㅜ흑그ㅡ븦므5ㅂ급","['설마', '영상', '길이', '확인', '보', '여기', '부터', '언니', '았', '븦므', '급']",['노랗다'],"['해봤다', '남다', '하다', '돌리다']"
.....ㅋㅋㅋㅋㅋㅋㅋㅋㅋ하...ㅋㅋㅋㅋㅋㅋㅋㅋㅋ 진짴ㅋㅋㅋㅋㅋㅋㅋㅋㅋㅋㅋㅋ 대박이네 ㅋㅋㅋㅋㅋㅋㅋㅋㅋㅋㅋ 엥????이러고 벙쪄있다가 엥???이러고 끝까지 돌려봤는데 끝까지 뻥이지롱...ㅋㅋㅋㅋㅋㅋㅋㅋㅋㅋ 이언니 철저하다 오늘 당한것중에 제일 철저하다.....ㅋㅋㅋㅋㅋㅋㅋㅋ,"['대박', '벙', '끝', '끝', '뻥', '이언', '오늘', '제일']","['철저하다', '철저하다']","['이르다', '찌다', '이르다', '돌리다', '보다']"
아 썸네일도 지금보니깐 완전 수상햌ㅋㅋㅋㅋㅋㅋㅋ저게뭐야,"['썸네일', '금보', '완전', '게뭐']",['수상하다'],[]
"아 어이없어,, 원래 댓글 보면서 보는데 웬일로 전체화면으로 봤더니만은^^..","['원래', '댓글', '웬일', '전체', '화면', '더니']",['어이없다'],"['보다', '보다', '보다']"
와 대박.... 진짜 처음으로 속앗어욬ㅋㅋㅋㅋㅋ진짜 짱ㅋㅋㅋㅋㅋㅋㅋㅋㅋㅋㅋㅋㅋㅋㅋㅋㅋㅋㅋㅋㅋㅋㅋㅋㅋㅋㅋㅋㅋㅋㅋㅋㅋ,"['대박', '처음', '짱']",[],['오다']
ㅌㅋㅌㅋㅋㅋㅌㅌㅌㅌㅌㅌㅌㅌㅌㅌㅌㅌㅌㅋㅋㅌㅌ댓글보고 엥 (๑′°︿°๑) 뭐가 있다는 말인가? 싶었는데 대박이네....,"['댓글', '보고', '말', '대박']",['있다'],['싶다']
우와 마스카라까지 꼼꼼히 지워지네요.. 75만원이라 그런지 워터프루프도.. 대박이네요,"['마스카라', '워터', '프루프', '대박']","['꼼꼼하다', '그렇다']",['지워지다']
아니 너무 그럴듯하게 시작해서 진짠줄 알았어요ㅋㅋㅋㅌㅋㅋㅋㅋㅋㅋㅋㅋㅋㅋ,"['시작', '진']","['아니다', '그럴듯하다']","['하다', '짜다', '알다']"
"투모로우 바이 투게더 수빈오빠, 범규오빠, 특히 태현 오빠가 좋아하겠는데요??","['투모로우', '바이', '투게더', '수빈', '범규', '태현', '오빠']",['좋아하다'],[]
영상 들어오기 전부터 진짠줄 알았는데ㅋㅋㅋㅋㅋㅋㅋㅋ 댓들도 단합했으면 깜빡 속았을듯ㅋㅋㅋ,"['영상', '진', '댓', '단합', '깜빡', '았', '듯']",[],"['들어오다', '짜다', '알다', '하다']"
ㅠㅠㅠ 만우절인건 알았지만 썸네일 보고 진짜 혹 해서 왔음 ㅠㅠ,"['만우절', '건', '썸네일', '보고', '혹']",[],"['알다', '하다', '오다']"
진짜 컨텐츠 대박이라면서 달려왔는뎈ㅋㅋㅋ,"['컨텐츠', '대박', '면서']",[],['달려오다']
아앀ㅋㅋㄱㅋㄱㅋㄱㅋㄱㅋㄱㅋㄱㅋㄱㅋㄱㅋㄱㅋㅋㅋ2분 동안 걍 보고 있었는뎈ㅋㄱㅋㄱㅋㄱㅋㅋㅋㅋㅋㅋㅋ,"['아씨', '동안', '보고']",['있다'],[]
못된사람ㅋㅋㅋㅋㄱㅋㄱㅋㄱㅋㅋㄱㅋㄲㅋㅋㅋㅋㅋㅋㄱㅋㅋ나 댓글도 안봐서 진짜속았어요 오늘 하루종일 속고 또속습니다..,"['사람', '댓글', '았', '오늘', '하루', '종일', '속', '습니']",[],"['되다', '보다']"
아니ㅋㅋㅋㄱㅋㅋㅋ언니...세상 마상ㅋㅋㄱㅋㅋㅋㅋㄱㅋㄱ,"['언니', '세상', '마상']",['아니다'],[]
제가진짜로 너무간절히 바랬나봐욬ㅋㄱㄱㅋㅋㅋ만우절인거 까먹고있었어욬ㄱㅋㅋㄱㅋ,"['바랬나봐', '만우절']",['간절하다'],['까먹다']
아닠ㅋㅋㅋ 완전 대박 아이템인줄알고 헐레벌떡 들어왔는데 뻥이라니요 ㅋㅋㅋㅋ 아 너무 재밌습니다 .ㅋㅋㅋ,"['완전', '대박', '아이템', '줄알', '헐레벌떡', '뻥', '니요']","['아니다', '재밌다']",['들어오다']
진짴ㅋㅋㅋㅋㅋㅋ 너무 정성스러워서 웃음이 나온다 ㅋㅋㅋㅋㅋㅋ,['웃음'],['정성스럽다'],['나오다']
"ㅋㅌㅋㅋㅋ'뻥이지롱' 보고.. 와 진짜 뻥일까? 하고 넘기는데 .. 넘겨도 넘겨도 뻥이지롱^^...ㅌㅋㅋㅋㅋㅋㅋㅋㅋㅋㅋㅋㅋㅋㅋㅋㅋㅋㅋㅋㅋㅋㅋㅋㅋㅋㅋㅋㅋㅋㅋㅋㅋㅋㅋㅋㅋㅋ
찐 뻥이었다 와우","['뻥', '보고', '뻥', '뻥', '뻥', '와우']",[],"['오다', '이다', '하다', '넘기다', '넘기다', '넘기다', '찌다', '이다']"
와ㅏ아....전설의 레전드급 어그로다ㅋㅋㅋㅋㅋㅋㄱㄱㄱㅋㄱㄱㄱㅋㅋ,"['전설', '레전드', '어그']",[],['오다']
"헐.... 속았다.... 언니 너무해 ㅋㅋㅋㅋㅋㅋ
아이디어 참신하구 조쿠만용","['았', '언니', '아이디어', '쿠', '만용']","['너무하다', '참신하다']",['헐다']
와 진짜 있는 건 줄 알고 진심으로 설레했는데 너무하다 ㅠㅠㅠㅠㅠ언니,"['건', '알', '진심', '언니']","['있다', '설레다', '너무하다']","['오다', '하다']"
아 모얔ㅋㅋㅋㅋㅋㅋㅋㅋㅋㅋㅋ 진지하게 보고 있었는데,"['모야', '보고']","['진지하다', '있다']",[]
이 언니 진짴ㅋㅋㅋㅋㅋ 맨날 요런거 저런거 특이한거 가져와서 75만원짜리 기계!!이러니까 속아버림ㅋㅋㅋㅋㅋ 길이도 넘나 정성스러워ㅠㅠㅠㅋㅋㅋㅋㅋㅋ,"['언니', '기계', '아버', '림', '길이']","['특이하다', '정성스럽다']","['저러다', '가져오다', '넘다']"
아 진짜 ㅋㅋㅋㅋㅋㅋㅋㅋㅋ 저 뻥이지롱 글자 본 후로 웃음이 멈추지 않는닼ㅋㅋㅋㅋㅋㅋㅋ,"['뻥', '글자', '웃음']",[],"['보다', '멈추다', '않다']"
모야 난 몰랐어ㅋㅋㅋㅋㅋㅋㅋㅋㅋㅋㅋ댓글창보고 알아버렸넼ㅋㅋㅋㅋㅋㅋ,"['모야', '난', '댓글', '창', '보고', '알']",[],"['모르다', '버리다']"
한 1분 나오고 화면 바뀔지 알았는뎈ㅋㅋ큐큐ㅠㅠㅠㅠㅠ당했다ㅏㅏㅏㅠㅠㅠㅠㅠ,"['화면', '큨']",['당하다'],"['하다', '나오다', '바뀌다', '알다']"
와 진짜 신박하닼ㅋㅋㅋㅋㅋㅋㅋㅋㅋㅋㅋㅋㅋ,['박하'],[],['오다']
무슨 만우절 농담을 이렇게 정성스럽게 해요ㅋㅋㅌㅌㅋㅌㅌㅋㅋㅋㅋㅋㅋㅋㅋㅋㅋ영상 퀄리티 무엇ㅋㅋㅌㅌㅋㅋㅋㅋㅋㅋㅋㅋㅌㅋㅋㅌ,"['무슨', '만우절', '농담', '정성', '해', '영상', '퀄리티', '무엇']",[],[]
아ㅋㅋ낚였다 진짜..! 취업해서 사야지 하고봤는데,"['낚였다', '취업']",[],"['하다', '사다', '하다', '보다']"
와앀ㅋㅋㅋㅋㅋㅋㅋㅋㅋ 머 다른거 나오는줄 알구 한참 기다렸네,"['씨', '머', '알구', '한참']",['다르다'],"['오다', '나오다', '기다리다']"
너무해..진짜 기대했었는데ㅠㅠㅠ,[],"['너무하다', '기대하다']",[]
"어머,,나한테 꼭! 필요한 기계다ㅜㅜㅜ 하하..뻥이라니","['어머', '꼭', '기계', '하하', '뻥']",['필요하다'],[]
와 이거 나온다는거 기사로 봤었는데 역시 회사원님 바로 사셨군요.... 컨텐츠비를 아끼지 않는 참된 크리에이터...👍👍👍,"['기사', '역시', '회사원', '바로', '컨텐츠', '비', '크리에이터']",['참되다'],"['오다', '나오다', '보다', '사다', '아끼다', '않다']"
영상보다가 너무 어이없어서 입벌리긴 처음이넼ㅋㅋㅋㅋㅋㅋㅋㅋㅋㅋㅋㅋㅋㅋㅋㅋㅋㅋ,"['영상', '입', '처음']",['어이없다'],"['가다', '벌리다']"
아 저 지금 너무 어이없어서 계속 웃음나옴ㅋㅋㅋㅋㅋㅋㅋㅋㅋㅋㅋㅋㅋㅋㅋㅋ,"['지금', '계속', '웃음']",['어이없다'],['나오다']
아니ㅋㅋㅋㅋㅋㅋㅋㅋㅋㅋㅋㅋㅋ8분 내내 뻥이지롱은 너무 심했자나욬ㅋㅋㅋㅌㅋㅋㅋㅋㅋㅋㅋㅋㅋㅋㅋㅋ큐ㅠ끝까지 보고있던 나....대가리 박어ㅠ,"['내내', '뻥', '은', '큐', '끝', '대가리']","['아니다', '심하다']","['자다', '보다', '박다']"
앜ㅋㅋㅋㅋㅋ 낚였다ㅜㅜ..,['낚였다'],[],[]
뻥이지롱 하고 진짜 나올줄 알고 기다리고 있었던거 저뿐인가요,"['뻥', '알', '뿐']",['있다'],"['하다', '나오다', '기다리다']"
? 밥먹으면서 보는데 스킵하고보니 낚였엌ㅋㅋㅋㅋㅋㄱㅠ,"['밥', '스킵', '낚였어']",[],"['먹다', '보다', '하다', '보다']"
아 진짜 너무해 ㅋㅋㅋㅋㅋㅋㅋㅋㅋㅋㅋㅋㅋㅋㅋㅋㅋㅋㅋㅋㅋㅋㅋㅋㅋㅋㅋㅋㅋㅋㅋㅋㅋㅋㅋㅋㅋㅋㅋㅋㅋㅋㅋㅋㅋㅋㅋㅋㅋㅋㅋㅋㅋㅋㅋㅋㅋ,[],['너무하다'],[]
뻥인거 알고 들어왔는데 너무 진짜 같아서 인상쓰고 봤다,"['뻥', '알', '인상']",['같다'],"['들어오다', '쓰다', '보다']"
"언니 ㅠㅠㅠ 이번 영상에서 하신 화장 올려주세요 ㅠㅠ
너무 이뻐요 ㅠㅠㅠ 한번 저도 해보고싶어요 😭
( 물론 언니처럼 이뻐지진 않겠지만요 ㅠㅠ )","['언니', '이번', '영상', '화장', '한번', '언니']","['이쁘다', '이쁘다']","['하다', '올려주다', '해보다', '않다']"
앜ㅋㅋㅋㅋㅋㅋㅋㅋㅋㅋㅋㅋㅋㅋ길게 해놓은게 더 얄미워 ㅋㅋㅋㅋㅋㅋㅋㅋ,['은'],"['길다', '얄밉다']",['하다']
내가 본 만우절 장난 중에 젤 웃겼다ㅋㅋㅋㅋㅋㅋㅋㅋㅋㅋㄱ 아 쉬발 강력해ㅋㅋㅋㅋㅋㅋㅋㅋㅋㅋㅋㅋㅋㅋㅋㅋ,"['만우절', '장난', '중', '젤', '쉬발']",['강력하다'],"['보다', '웃기다']"
하...만우절 .....언니....것도 모르고 진짜 기대했는뎈ㅋㅋㅋㅋ,"['만우절', '언니']",['기대하다'],['모르다']
"와,,,씨 ㅜㅠㅜㅠㅠㅠㅠㅠ눈물난다 으앙 사고싶었는데",['씨'],[],"['오다', '눈물나다', '사다']"
"아닛!!""""!!!!!!!!!!""""""""놀라워라 ㅠㅠㅠㅠㅠㅠㅠ",['아닛'],['놀랍다'],[]
아니 진짴ㅋㅋㅋㅋㅋㅋㅋㅋㅋㅋㅋㅋㅋㅋ어이없어서 벙찜ㅋㅋㅋㅋㅋㅋㅋㅋㅋ아웃경,"['벙찜', '아웃', '경']","['아니다', '어이없다']",[]
ㅋㅋㅋㅋㅋㅋㅋㅋㅋㅋㅋㅋㅋㅋㅋㅋ아 너무 웃겨,[],[],['웃기다']
"와....대단해 10분 와우ㅋㅋㅋㅋㅋㅋㅋㅋㅋ
작정하셨군ㅋㅋㅋㅋㅋ","['와우', '작정']",['대단하다'],"['오다', '하다']"
언니 왜 성의있게 뻥쳐요ㅋㅋㅋㅋㅋㅋㅋㅋ진짜,"['언니', '성의', '뻥']",['있다'],['치다']
영상 수익 창출 하시려고 일부러 영상길이 10분 맞춰서 8분동안이나 뻥이지롱 넣으신건가.. 뭐 유튜버가 영상으로 돈 버는 직업이긴 하다만😭 너무 뻔히 보이네,"['영상', '수익', '창', '일부러', '영상', '길이', '뻥', '건가', '유튜버', '영상', '돈', '버', '직업', '보이']",['뻔하다'],"['추다', '하다', '맞추다', '넣다', '이기다', '하다']"
와 여기서 당하네 상상더못했다 진짴ㅋㅋㅋㅋㅋㅋㅋㅋㅋㅋㅋㅋㅋㅋㅋㅋㅋ,"['여기', '상상']","['당하다', '덥다']","['오다', '하다']"
뭐지함ㅋㅋㄱㅋ,['함'],[],[]
열어 보겠습니다!! 라는 말이 계속 귀에 맴돈다ㅋㅋㅋㅋㅋㅋㅋㅋㅋㅋㅋㅋㅋ,"['말', '계속', '귀']",[],"['열다', '보다', '맴돈다']"
"하......... 난 바보같이 뻥이지롱 보고 응???? 해서
얼어서 몇분간 보다가 화면 멈춘건가?? 
싶어서 유튜브 플레이 시간보고..... 
영상은 돌아가는데...하면서 
아...........!!!!! 함 ㅠㅠ","['난', '바보', '뻥', '보고', '분간', '화면', '건가', '유튜브', '플레이', '시간', '보고', '영상', '함']",[],"['하다', '얼다', '보다', '멈추다', '싶다', '돌아가다', '하다']"
ㅋㅋㅋㅋㅋ렉인줄 알고 유트브 나갔다 들어와서 다시봄ㅋㅋㅋㅋ,"['렉', '알', '유트브', '다시', '봄']",[],"['나가다', '들어오다']"
아 ㅋㅋㅋㅋㅋㅋㅋㅋㅋㅋㅋㅋㅋㅋㅋ진짜 이 언니가,['언니'],[],[]
뭐얔ㅋㅋㅋㅋㅋㅋㅋㅋ 낚였어ㅠㅠ 재생시간 디테일한거봐ㅠㅠㅠㅠㅠ,"['낚였어', '재생', '시간', '디테']",[],['보다']
아..뽐뿌온다ㅜㅠ 한번 사보고싶네요. 짱 펀할듯,"['뽐뿌', '한번', '짱']",['펀하다'],"['오다', '사보다']"
아개빡쳨ㅋㅋㅋㅋㅋㅋㅋㅋㅋㅋㅋ 아니 왜 쓸데없이 설명은 진짜 같이 잘하시는뎈ㅋㅋㅋ,"['개', '설명']","['빡치다', '아니다']",['하다']
진짴ㅋㅋㅋㅋㅋ개허무해요...끄앍앍....,['개'],['허무하다'],"['끄다', '앍다', '앍다']"
아니ㅋㄱㅋㅋㄱㅋㅋㅋㅋㅋㄱㄲㄱㄱ뻥이지롱이 8분넘게라니ㅋㅋㅋㅋㅋㅋㄱ당했다,['뻥'],"['아니다', '당하다']",[]
ㅋㅋㅋㅋㅋㅋㅋㅋㅌ 아니 언니 ㅋㅋㅋㅋㅋㅋㅋㅋㅌㅌㅋㅋㅋㅋㅋ 나 이거 제목만보고 남자친구한테 사달라고 보냈는데 ㅜㅠㅜㅜ ㅜㅜㅜ,"['언니', '제목', '보고', '남자친구', '달라']",['아니다'],['보내다']
"너무 웃겨 ㅋㅋㅋ 귀여워죽겠네 ㅋㅋㅋ
회사원님 아이디어예요 아님 커플 두분 아이디어입니까 ㅋㅋㅋㅋ 졸귀탱들","['죽겠네', '회사원', '아이디어', '커플', '아이디어', '입', '졸귀']","['귀엽다', '아니다']","['웃기다', '들다']"
뭐야...ㅜ 내 클렌징기계 돌려줘요ㅠㅜ.... 거짓말 거짓말이라고해요ㅜㅜㅜㅜ,"['클렌', '징', '기계', '거짓말', '거짓말', '고해']",[],['돌려주다']
하.. 진짜ㅋㅋㅋㅋㅋㅋㅋ 헛웃음밖에 안나옴ㅋㅋㅋㅋㅋㅋㅋㅋㅋㅋㅋㅋㅋㅋㅋㅋㅋㅋㅋㅋㅋㅋㅋㅋㅋㅋㅋㅋ,['헛웃음'],[],['나오다']
어이가 없어서 황당한데 웃겨ㅋㅋㅋㅋㅋㅋㅋ,['어이'],"['없다', '황당하다']",['웃기다']
하...ㅋㅋㅋㅋㅋㅋㅋㅋ 영상 보다 잠들어서 몰랐는데 언니...,"['영상', '언니']",[],"['보다', '잠들다', '모르다']"
와....말그대로 진짜 그냥 어이없어....ㅋㅋㅋ와....,"['말', '그대로', '그냥']",['어이없다'],"['오다', '오다']"
ㅎㅎㅎㅎ와우 이렇게 낚일줄이얗ㅎㅎㅎ 뻥이지롱 보고 뭐지하고 계속보고있었는데 십분이란 시간을 맞추시다니 대단해요,"['와우', '낚일줄', '뻥', '보고', '지하', '계속', '십분', '시간']",['대단하다'],"['보다', '맞추다']"
ㅋㅋㅋㅋㅋㅋㅋㅋㅋㅋㅋㅋㅋㅋ 진짜 골때리네,['골'],[],['때리다']
ㅋㅋㅋㅋㅋ 피드 보고 삼각김밥이 만우절용 영상이군 이랬는데ㅋㅋㅋㅋㅋㅋㅋ 이 영상도 만우절 영상이었던 거예요ㅋㅋㅋㅋㅋㅋ,"['피드', '보고', '삼각김밥', '만우절', '영상', '이군', '영상', '만우절', '영상']",[],['이다']
뛰어버린 내 심장 물어내 당신 ㅠㅠㅠㅠ 기계 개발해주라구여,"['심장', '당신', '기계', '개발']",[],"['뛰다', '버리다', '물다', '해주다']"
와...나 시간지나고 지금 봐서 진짜 의심 1도 안하고 폰 이상해진줄알고 2번이나 껐다 킴 ..,"['시간', '지금', '의심', '폰', '알', '킴']",['이상하다'],"['오다', '지나다', '보다', '끄다']"
뻥이지롱 멍하게 보고있으면 중간중간에 클립영상 나옴ㅋㅋㅋㅋㅋㅋㅋㅋ역시 참고보길잘했다,"['뻥', '중간', '중간', '클립', '영상', '역시', '참고']",['멍하다'],"['보다', '나오다', '보다', '하다']"
하... 순간 이게 뭐징...?ㅋㅋㅋㅋㅋㅋㅋㅋㅋ 띠용0-0 만우절 하루종일 안당했다고 스스로 칭찬하고 잇었는데.. 언니한테 당하다니....,"['순간', '뭐징', '띠용', '만우절', '하루', '종일', '스스로', '칭찬', '언니']","['당하다', '당하다']",['잇다']
"아 엄청 기대했는데...ㅋㅋㅋ
이 영상을 클릭하는 순간 만우절인지 까먹었다...
+이 댓글이 좋아요수 140개?ㄷㄷ","['영상', '클릭', '순간', '만우절', '댓글', '개']","['기대하다', '좋다']","['하다', '까먹다']"
아닠ㅋㅋㅋㅋㅋ... 영상이 이렇게 끝난다고오?ㅋㅋㅋㅋㅋㅋㅋㅋㅋㅋㅋㅋ,['영상'],['아니다'],['끝나다']
아무라 뻥이지롱이지만 8분은 너무 했어요ㅋㅋㅋㅋㅋㅋ,"['아무', '뻥']",[],['하다']
"헉헉헉~~~~당했다
이런기분이구나 ㅠㅠㅠㅠㅠ",['기분'],['당하다'],[]
아...회사원 기대했는데ㅋㅋㅋㅋㅋㅋ웃기네,"['회사원', '웃기']",['기대하다'],[]
얕게 깔리는 BGM이 댓글 다 보고도 그래도 믿은 나를 초라하게 만들어요 언니..,"['댓글', '보고', '언니']","['얕다', '초라하다']","['깔리다', '믿다', '나르다', '만들다']"
아...진짜 언니~~~~~,['언니'],[],[]
아 짜증낰ㅋㅋㅋㅋㅋㅋㅋㅋㅋ,[],['짜증나다'],[]
헐 ㅠㅠㅠㅠㅠㅠ아니 난 오늘 마누절도 아니라서 몰랐어ㅠㅠㅠㅠㅠㅠㅠㅠㅠㅠㅠㅠㅠ,"['난', '오늘', '마누', '절도']","['아니다', '아니다']","['헐다', '모르다']"
아닠ㅋㅋㅋㅋㅋㅋㅋㅋ화면 전환되겠지.?.? 했는데 계속 뻥이지롱 ㅋㅋㅋㅋㅋㅋㅋ,"['화면', '전환', '계속', '뻥']",['아니다'],"['되다', '하다']"
다시보니 언니 되게 능청스러워ㅋㅋㅋ,"['다시', '언니', '능청']",['스럽다'],['보다']
ㄹㅇ ㅋㅋㅋㅋ처음 속음,"['처음', '음']",[],[]
몬가 오늘따라 목소리가 작개 들려요ㅠㅠㅠ,"['오늘', '목소리', '개']",[],"['따르다', '들다']"
와...기대하고봤는데 뭔가싶었네욬ㅋㅋㅋ,['뭔가'],['기대하다'],"['오다', '보다', '싶다']"
"아 육성으로 ""아쒸.."" 했닷...ㅋㅋㅋㅋㅋㅋㅋ","['육성', '아쒸', '닷']",[],['하다']
와 진짜 어떻게 저런기능이 ㄷㄷㄷ 10분이 아깝지 않았어요..,['기능'],"['어떻다', '아깝다']","['오다', '않다']"
