닉네임,댓글,좋아요수,날짜
푸메Fume,"안녕하세요 푸메라니안 여러분🙇🏻‍♀️ 오늘은 살얼음 동동띄운 시원한 냉모밀에 커다란 수제유부초밥 8가지! 가져왔습니다 🙌🏻 (소리질러!!!!) 유부초밥은 집 앞 수제유부초밥 맛집에서 포장해왔어요! (총 18,500원, 서비스로 1개 더 주셨어요!) 맛은 양파소스연어, 제육볶음, 콘마요, 참치마요, 계란, 칠리새우, 소불고기, 불닭 유부초밥.. 헥헥 ❤️ 8가지나 됩니다! 진짜 하나하나 설명하자면 정말 길어질 것 같아요.. 그저 모두 다 너무너무 맛있었어요! 개인적으로는 계란, 참치마요, 소불고기, 연어가 제일 맛있었어요 ! 아.. 톡톡 터지는 콘마요도… (그냥 다 맛있었네요) 제가 먹은 유부초밥중 제일 크고 토핑도 제일 실했어요! 밥 반 토핑 반인데 정말 맛있더라고요! 한가득 크게 베어물고 시원한 모밀 국물 호로록 마시면 천국이 따로없어요..🤭 달달한 유부초밥에 마요나 계란같은 토핑도 잘 어울리지만 빨간 제육이나 칠리새우, 불닭 토핑도 너무 잘 어울리더라고요! 꿀맛 유부초밥에 달큰하면서도 고추냉이 덕분에 알싸한 냉모밀 육수까지 환상의 짝꿍 덕분에 스트레스 팍팍 날려버리네요! 많이 더워진 요즘 날씨에 냉모밀 + 수제유부초밥 조합 드시고 냉모밀 위의 살얼음처럼, 일상에서 받은 스트레스 사르륵 녹여버리셨음 좋겠어요! 오늘도 시청해주신 여러분들 정말 감사합니다 🙏🏻🙆🏻‍♀️

🔥My Instagram : http://instagram.com/fume_yamyam
🐶Sleepy White Fox's Instagram: http://instagram.com/mozziiya

Hi, guys! Today I prepared the Soba (Cold Buckwheat Noodles) with 8 kinds of Giant Inari Sushi(a.k.a Tofu Sushi, Cone Sushi)! Since the weather is getting hot, I wanted to eat cold noodles, so I prepared them with giant inari sushi❤ There were 8 kinds of inari sushi such as spicy fire chicken, corn mayo, eggs, tuna mayo, bulgogi, salmon, spicy stir-fried pork, and chili shrimp, and all of them were so tasty! I usually prefer sushi to inari sushi, but the inari sushi that I prepared today was the biggest and most delicious one I have ever tried! Each sushi has its own flavor, texture, and charm, so it was awesome when I drank the buckwheat soup after having a bite of inari sushi…👍🏻 THUMBS UP!… Because fried tofu and rice were quite sweet, so they went well with spicy toppings! I think cold buckwheat noodles and inari shusi are a perfect duo! In summer, it’s good to relieve stress with cold foods! I hope all of you have a good day with tasty food! Thank you for watching my video today!

Halo semuanya! Hari ini saya menyiapkan Mie Soba Dingin dan 8 jenis Inari Sushi raksasa (a.k.a Cone Sushi)! Karena cuaca semakin panas, saya ingin makan mie dingin, jadi saya menyiapkan mereka dengan sushi inari raksasa! Ada 8 jenis inari sushi seperti ayam api pedas, jagung mayo, telur, tuna mayo, bulgogi, salmon, babi goreng tumis pedas, dan udang cabai, dan semuanya sangat lezat! Saya biasanya lebih suka sushi tetapi inari sushi yang saya siapkan hari ini adalah yang terbesar dan paling lezat yang pernah saya coba! Setiap sushi memiliki rasa, tekstur, dan daya tariknya sendiri, jadi sangat mengagumkan ketika saya meminum sup soba setelah menggigit sushi inari ... 👍🏻 Karena tahu goreng dan nasi cukup manis, maka mereka cocok dengan topping pedas! Saya pikir mie soba dingin dan sushi inari adalah duo yang sempurna! Di musim panas, ada baiknya menghilangkan stres dengan makanan dingin! Saya harap Anda semua memiliki hari yang baik dengan makanan lezat! Terima kasih telah menonton video saya hari ini!

हेलो सब लोग! आज मैंने कोल्ड बकव्हीट नूडल्स और 8 प्रकार की विशाल इनारी सुशी (a.k.a Cone Sushi) तैयार की! चूंकि मौसम गर्म हो रहा है, मैं ठंडा नूडल्स खाना चाहता था, इसलिए मैंने उन्हें विशाल सुशी के साथ तैयार किया! मसालेदार फायर चिकन, मकई मेयो, अंडे, टूना मेयो, बुलोगी, सामन, मसालेदार हलचल-तले हुए सूअर का मांस, और मिर्च चिंराट जैसे 8 प्रकार की अटारी सुशी थी, और वे सभी बहुत स्वादिष्ट थे! मैं आमतौर पर सुशी को पसंद करता हूं, लेकिन आज जो सुशी मैंने तैयार की है, वह सबसे बड़ी और सबसे स्वादिष्ट थी जिसे मैंने आजमाया है! प्रत्येक सुशी का अपना स्वाद, बनावट और आकर्षण होता है, इसलिए जब मैं सुशी के काटने के बाद एक प्रकार का अनाज सूप पिया, तो यह बहुत बढ़िया था ... auseक्योंकि तले हुए टोफू और चावल काफी मीठे थे, इसलिए वे मसालेदार टॉपिंग के साथ अच्छी तरह से चले गए! मुझे लगता है कि ठंडी अनाज वाली नूडल्स और इनारी सुशी एक आदर्श जोड़ी है! गर्मियों में, ठंडे खाद्य पदार्थों के साथ तनाव दूर करना अच्छा है! मुझे उम्मीद है कि स्वादिष्ट भोजन के साथ आप सभी का दिन अच्छा रहेगा! आज का मेरा वीडियो देखने के लिए धन्यवाद!

Chào mọi người! Hôm nay tôi đã chuẩn bị Mì kiều mạch lạnh và 8 loại Inari Sushi khổng lồ (a.k.a Cone Sushi)! Vì thời tiết trở nên nóng bức, tôi muốn ăn mì lạnh, vì vậy tôi đã chuẩn bị chúng với sushi inari khổng lồ! Có 8 loại sushi inari như gà cay cay, ngô mayo, trứng, cá ngừ mayo, bulgogi, cá hồi, thịt lợn xào cay, và tôm ớt, và tất cả đều rất ngon! Tôi thường thích sushi nhưng sushi inari mà tôi chuẩn bị hôm nay là món to nhất và ngon nhất tôi từng thử! Mỗi món sushi đều có hương vị, kết cấu và sự quyến rũ riêng, vì vậy thật tuyệt vời khi tôi uống súp kiều mạch sau khi cắn một miếng sushi inari 👍🏻 Bởi vì đậu phụ rán và cơm khá ngọt, vì vậy chúng rất hợp với các loại gia vị cay! Tôi nghĩ mì kiều mạch lạnh và sushi inari là một bộ đôi hoàn hảo! Vào mùa hè, nó rất tốt để giảm căng thẳng với thực phẩm lạnh! Tôi hy vọng tất cả các bạn có một ngày tốt với thức ăn ngon! Cảm ơn bạn đã xem video của tôi ngày hôm nay!

皆さんこんにちは！今日は冷そばと8種類の巨大な稲荷寿司（コーン寿司）を作りました！暑くなってきたので冷たい麺を食べたかったので、巨大いなり寿司を用意しました！スパイシーファイヤーチキン、コーンマヨ、卵、マグロマヨ、プルコギ、サーモン、スパイシーポーク、チリエビなど8種類のいなり寿司があり、どれも美味しかったです！普段は寿司が好きですが、今日作ったいなり寿司は今まで食べた中で一番美味しいお寿司です！寿司にはそれぞれ味・食感・魅力があるので、いなり寿司を一口食べた後の蕎麦汁は最高でした…👍🏻揚げ豆腐とご飯はとっても甘くて辛いトッピングに合いました！冷やしそばといなり寿司との相性抜群！夏は冷たい食べ物でストレス解消にぴったり！皆様、美味しいお料理で良い一日を！今日は私の動画を見てくれてありがとう！",170개,2020. 6. 2.
angelmanuel,I can't imagine the taste of a cold  noodles.,14개,2020. 6. 2.
ZoyaKhan,"No one : 
Literally no one: 
Not even fume:
Everyone in the comment section: 00:32 eating start",21개,2020. 6. 2.
Nancykk,Damn I wasn't this early ever in my life,16개,2020. 6. 2.
,"蕎麦と稲荷寿司は日本人にも馴染みのある食べ物だから､本当に美味しそうで見入ってました。
日本では蕎麦の薬味に､ワサビや生姜や葱などを汁に溶いて食べます。
韓国でも同じ様に食べますか？",7개,2020. 6. 2.
HimanshuArya,You are my favourite because whatever you eats looks delicious & tempting .You always enjoys your meal with a beautiful smile that is the best moment of your video.,7개,2020. 6. 2.
EnyuZeeMukbang,I like how Fume's hand puppet puppy is just staring at her listening the whole time 😂😍,20개,2020. 6. 2.
RaviStar,😍 I am small boy 🥺 you are bigger than me you can't be my friend 😭😭😭,10개,2020. 6. 2.
BLACKPINKTWICEMAMAMOO,"나는 터키 어 K 팝이고 사람들이 매우 귀엽기 때문에 한국어를 좋아합니다 💕
내 말은, 당신 같은 귀여운 사람들이있다.",11개,2020. 6. 2.
BABUSELVADURAI,I wonder how she's is fit after eating so much of food...wanna have a fit body like her...,22개,2020. 6. 2.
ChitwanBhushanDubey,Fumiiiiiiii and her doggie ❤️❤️❤️ the way she decorates her food 🥺,5개,2020. 6. 2.
,А почему ты кушаешь эти булочки с помощью палочек? Удобнее же руками?...😅❤🤔🤨,2개,2020. 6. 2.
LimmimiASMR,"냉모일 너무 시원하네요.ㅋ
우유초밥은 안에 내용물이 너무 꽉 찻네요.  메뉴 조합이 너무 좋은거 같아요~👍",10개,2020. 6. 2.
쿡준sCookjunASMR,0:33 Start Eating!!❤❤ 냉모밀..ㅠㅠ 냉모밀 완전 맛있죠 진짜루😭 유부초밥 큰거 보기만하고 안사먹어봤는데 맛있겠다..😝❤,20개,2020. 6. 2.
TalCohen,Where is all that food going inside that tiny belly 😅 i cant eat that much food and i x4 size bigger then you,2개,2020. 6. 2.
EatwithMohsin,"Eyes : Satisfied 🥰
Ears : Satisfied 😍
Stomach : Grumbling 🤤
Mouth : Watering 😋",47개,2020. 6. 2.
ElreyJohn,When your big bites makes me satisfied and your smile and the dog so comforting that my headache gone I love your videos so much💕,5개,2020. 6. 2.
AkramBakriEats,0:32 start eating..i love tofu 😋,5개,2020. 6. 2.
봉이네TV,"0:32 eating start🔥🔥
It looks really delicious. I'm hungry😢😢",6개,2020. 6. 2.
,お蕎麦は日本のものと同じなのでしょうか😃？いなり寿司は日本のものより大きくて具沢山でとても美味しそうです！！,11개,2020. 6. 2.
AraMagabo,I really want to try that kind of sushi 😍,33개,2020. 6. 2.
sachikok,"おいなりさん豪華すぎるー
個人的にプルコギのおいなりさんが食べてみたいです",5개,2020. 6. 2.
MonaLuwang,Ur lips r so cute while eating 😘😘I like ur lips............. Luv u frm India🇮🇳🇮🇳🇮🇳,3개,2020. 6. 2.
MelissaAgawin,I've always wondered what cold noodles taste like....is it savory and refreshing at the same time?? 🤔,1개,2020. 6. 2.
NadiaNadia,Love you lot fume sister ...I never miss your show ❤️,4개,2020. 6. 2.
EYasu,"0:33 start eating 🍜🍝
1:07 eating sushi 🍣🦪🦐

めっちゃ美味しそうー！いいなぁ🥺🥺",12개,2020. 6. 2.
navajyotigogoi,Lock down I cannot get noodles those are in lockdown hit like,1개,2020. 6. 2.
SonakshiImrith,Hi Fume. Hope you're enjoying good health 💜✨,3개,2020. 6. 2.
MitsuriKanroji,"You make the food look so delicious while I don't even like tofu lol, pretty as always Fume! Keep the nice video up <3",1개,2020. 6. 2.
,美味しそう💕💕猛烈にお蕎麦といなり寿司が食べたくなった😳😳😳いなり寿司になにか乗せて食べたことない！これは絶対美味しい！,4개,2020. 6. 2.
아리Army,Seguro estuvo delicioso  !~ me encanta tus videos !! Buenas vibras ( suerte) ❤❤❤💕💕,10개,2020. 6. 2.
hellybelly,I've not seen sushi like that before but DAMN that looks so good 😍😍 I love cold soba 😋😋😋,2개,2020. 6. 2.
Misato,"暑くなってきたから、蕎麦いい♥️
変わり種お稲荷🎶美味しいそう☺️",6개,2020. 6. 2.
ShariqAhmed,The cutest part of your videos are at the need. That hand puppet puppy is so adorable 🐶🥺☺️❤️,3개,2020. 6. 2.
아담Adam자취생먹방,요즘 날씨에 딱 맞는 메뉴선택이에요!! 진짜 시원해보여요😁😁 초밥도 맛있어보이지만 시원한 냉모밀이 진짜 맛있어보여요:) 배고프다 ㅠㅠ,8개,2020. 6. 2.
NadiaNadia,You know I see your face just super eating show ❤️❤️❤️❤️❤️❤️❤️❤️❤️,3개,2020. 6. 2.
Jourryelroblox,Hello fume from philipines 🇵🇭🇵🇭🇵🇭,2개,2020. 6. 2.
AnaRodrigues,私はあなたのASMRが大好きで、とても満足しています。ブラジルから来ました。日本、中国、韓国からの事を見るのが大好きです。Googleの翻訳者rssrsrrにいるので、日本語のみを話します。,2개,2020. 6. 2.
LuizCarlosBezerradaSilvaJunior,Eu sempre fico muito animado quando assisto a Fume 😊😍❤❤,2개,2020. 6. 2.
음미하는시아SiaEnjoyEating,"시원한 냉모밀에 여러가지 토핑 듬뿍 들어간 유부초밥♥♥♥
 꿀맛 조합에 감탄 또 감탄 합니다😭
 모밀 국물 먹을 때 소리 대박!!!",3개,2020. 6. 2.
Mnbyl,"quisiera poder atravesar la pantalla y sacar toda esa comida super deliciosa 😋🤤
Pd: Eres muy bella 🌺",2개,2020. 6. 2.
SHIYA,日本のいなり寿司と違うんですね。(^o^),5개,2020. 6. 2.
HoaTran,Fumeeeee reply me. I just sayyyy hi with me plzzzzzz. Loveeee youu so much,3개,2020. 6. 2.
YZAU호주YZASMR,시원한 냉모밀에 유부초밥 한입가득 ♡ 최고입니다 ㅜㅜ,5개,2020. 6. 2.
더블브이ASMR,"I ate sushi yesterday too.
You're on the same page with Pumé.^^
But what else do you want to eat?🤤",1개,2020. 6. 2.
VannieEats,The inari (tofu sushi) looks so delicious with all those toppings! 😍 It goes perfectly well with the soba. Fume’s meal looks really delicious today!,25개,2020. 6. 2.
FeniRamasari,아주 좋은 식사 ... 멋진 비디오,3개,2020. 6. 2.
NamSoominNam,언니 제가 배탈이 나서 매운음식을 못먹는데 그냥 미친듯이 매운음식 먹어주시면 안되요?(국물있는거로요) 혹시 실례가 된다면 죄송해요🙏,2개,2020. 6. 2.
,So gooooood lLove you,6개,2020. 6. 2.
MatjogyoASMR맛조교,"0:33  첫 푸메님 스타트
유부초밥이 단지별로 있는 아파트 같아요
101동  102  103동 🤣🤣❤️❤️❤️",2개,2020. 6. 2.
gmhny,"2 days ago I said i craved for cold noodles, how did you know?! 🤣",1개,2020. 6. 2.
SaraMohamad,My lovely Fume you always make my stomach cry from your cute eating way just hope if i can find this kind of food here in Egypt 🥰🥰🥰🥰,1개,2020. 6. 2.
,"お蕎麦といなり寿司や～✨
いなり寿司がモリモリ具だくさんで美味しそう❤️
お蕎麦は天カス入れてほしい～😊
もっと美味しくなるにょ！",2개,2020. 6. 2.
ShariqAhmed,I don’t like sushi that much but Fume made it look so freakin tasty 🍣😋😍❤️,1개,2020. 6. 2.
DayanaMachuca,Se ve delicioso espero algun dia probar esos platos tan llamativos,1개,2020. 6. 2.
AkunuriSnigdha,U eat very well😜❤❤.,4개,2020. 6. 2.
SoIAmcOmfUsION,I like the video immediately when I saw the doggy AWWWWW,1개,2020. 6. 2.
EwicMukbang,Yummylicious food with beautiful ❤FUME❤ Love Watching From 🇵🇭Philippines🇵🇭 #EwicMukbang 😊✌,1개,2020. 6. 2.
fionaretnoeeambarini,I’m craving bucketwheat noodles so bad T-T,20개,2020. 6. 2.
하영,"제 마음속엔 먹방유튜버 Top 3 안에 #잘드시고 이쁜 푸메 유튜버로 뽑혔어요 !!! 이히힛 걍 그렇다구요 ,, 유부초밥 한입에 와아앙 먹는거 햄스터 같아요 🐹❤",2개,2020. 6. 2.
ma5717,"麺類動画とても大好きです
日本語字幕もとても楽しく拝見させていただいてます^ ^",2개,2020. 6. 2.
꼬양이,저희 집쪽에 저런 유부초밥집있는데.. 요즘 시국땜시 못먹었는데 드시는거 보니까 너무 먹고싶어요 ㅠㅠ....,2개,2020. 6. 2.
DivyaShelar,Your are so pretty n beautiful 😍😍🥰,3개,2020. 6. 2.
marleidybejaranobeltran,"HEY I LOVE THIS VIDEO  ,🥰🥰🥰🥰 DEAR LOVE COLOMBIA .",1개,2020. 6. 2.
,"Fumeさんに、稲荷🍣食べて貰いたかったです😌🌸💓

冷たいお蕎麦と一緒に召し上がって下さるなんて💤🎠💤夢💤🎠💤みたいでした✨

ありがとうございます😆💕✨

普通に🍣がお好きだったんですね✏️📑💦

稲荷🍣は、種類沢山有るから、何が好きなのかとか、お気に入りの稲荷🍣が知りたかったです😌🌸💓

暑く成っている韓国だから、身体に気を付けて、元気でいらして下さい🙏",1개,2020. 6. 2.
Kyu,"왕유부초밥 비주얼이 끝내줍니다.😍😲😎
넘 커서 2~3개 먹어도 배부를거 같아요.😆😆😆
모밀국수까지 여름에 탁월한 메뉴네요.😊😋🤓😄
푸메님 오늘도 영상 올리느라 고생했어요.🍀👍👍👍",2개,2020. 6. 2.
,"お蕎麦にいなり寿司て日本食と似てる〜　けど！いなりの具が珍しいです^ - ^
お蕎麦は辛くなくて醤油味なんでしようか？",1개,2020. 6. 2.
ShyEmpressSerena,Each sushi looks so gorgeous and interesting :) Thank you dear Fume .. :),1개,2020. 6. 2.
효진먹방hyojinASMR,냉모밀 너무 좋당 ㅠ 헝 유부초밥 비쥬얼 취향저격이고...,2개,2020. 6. 2.
RituBarman,Your skin is so glowing 😊.. love you siso❤️,2개,2020. 6. 2.
AndreFaria,Lindaaa ❤❤❤😃😃,3개,2020. 6. 2.
omame,fumeちゃんアニョハセヨ〜(*‘ω‘ *)美味しそうなお蕎麦ですね〜🥰,2개,2020. 6. 2.
KULINERRECEH77,i want to try it sis  😍😍 look so so delicious  ❤❤,1개,2020. 6. 2.
구독하면인생성공함,옥수수콘이랑 참치마요 진짜 개맛있겠다ㅜ.ㅜ,3개,2020. 6. 2.
TheDancetrio,My favourite ❤️😍,2개,2020. 6. 2.
허남철,"푸메님 ~
안녕하세요 ~
항상 좋은영상 ~
감사합니다 ~^^
모밀,유부초밥~
맛있겠네요 ~
맛있게 드세요 ~
영상잘봤습니다 ~
항상 건강조심하시고요 ~^^",1개,2020. 6. 2.
BlissLife,매번 눈 허공에 치켜뜨는 부분만 조금 신경쓰여서요 😢 너무 예쁘고 잘드시만 의견 반영 부탁드립니다,1개,2020. 6. 2.
,ホントにいつも美味しそうに食べてる😉👍,2개,2020. 6. 2.
김수정,"먹고싶다 먹고싶다 먹고싶다 먹고싶다 먹고싶다







배고프다 배고프다 배고프다 배고프다 배고프다 ㅠㅠ",2개,2020. 6. 2.
0교시자취영역0CLASS,캬.... 시원하게따 목구멍으로 다 넣어버리고싶네...,2개,2020. 6. 2.
,I MaRym in lraq l love,2개,2020. 6. 2.
밍키MINKYASMR,도제 유부초밥 넘 좋아하는데 푸메님 드시는 거 보니까 저도 넘 먹고싶어졌어요🤤🤤🤤,2개,2020. 6. 2.
Nagoya2020F,蕎麦は韓国の人も食べるのかな？☺️稲荷美味しいそう〜♪辛い稲荷絶対美味しいgood👍,1개,2020. 6. 2.
차송,푸메님 강아지랑 같이 먹방해주시면 어떨까욤ㅠㅠ 같은 음식모양에 강아지가 먹을수 있는 음식으로ㅠㅠ 깜쮝쓰 할꺼 같아용🤭🤭,2개,2020. 6. 2.
,日本食だ~😍美味しそう！！！,2개,2020. 6. 2.
으석,왜 내 집 근처에는 저런 유부초밥 집이 없는 걸까..,1개,2020. 6. 2.
AysunKorkut,"Are you from korea? 
I'm from turkey❤❤❤",1개,2020. 6. 2.
,食べっぷりが最高でした💕😁💕いつも楽しみにしてますよ👍👍,3개,2020. 6. 2.
AngelMarieRBalen,I love mayo too ☺😋. Everytime you eat i'm starving.😋 ❤,1개,2020. 6. 2.
까운맨GOWNMANASMR,1:06 어우... 진짜 맛있게한입하시네..,2개,2020. 6. 2.
에덴아자르,진짜 음식조합 잘 짜시는분인듯... 항상 응원합니다^^,2개,2020. 6. 2.
JaxonSALEDRAB,I wanna be able to eat like her and have a skinny body!  How??? So jealous,0개,2020. 6. 2.
NIKORO,食べっぷりが良すぎて笑ってしもた（笑）変わったいなり寿司も美味しそうだね！,1개,2020. 6. 2.
하마,잘 먹는 모습이 참.. 아름다우신 푸메님..,2개,2020. 6. 2.
Roman,푸메Fume   your in one of my vids,1개,2020. 6. 2.
보라봉BRBASMR,와 여름에는 시원한 냉모밀이죠 😭😭😭,1개,2020. 6. 2.
Arenas,الفيديو جميل حقا لقد استمتعت فيه شكرا لك أحبك 💖,2개,2020. 6. 2.
Ranya,Thank you for the French soutitle !♥️,1개,2020. 6. 2.
1Subbefore2021Challenge,"If you are reading this...
 
 
(I hope you are doing well!)",1개,2020. 6. 2.
GAPTEEASMR,Eating start 0:32,11개,2020. 6. 2.
ChellASMR,Such a nice combo 😋,2개,2020. 6. 2.
FarahNawaf,I really love you 🥺❤️❤️,1개,2020. 6. 2.
감자포차,벌써 여름 ㅋㅋㅋㄱㄱ 냉면 먹으로 지금 갑니다 ㅋㅋㅋㄱㅋㅋㄱ 못참아,3개,2020. 6. 2.
김감자,와씨... 어제도 푸메님 영상 보다가 못참아서 야식 시켯는데... 오늘도 시키겟군뇨...,1개,2020. 6. 2.
,انتي جدا لطيفه وجميله واستمري يا قلبي ❤ واتمنى ان توصلي 10مليون مشترك لانكي تستحقينها جدا وانا احبك من اعماق قلبي ❤♥♥♥♥😍😘😘😘😘,2개,2020. 6. 2.
jinkaisabas,love you fume ❤️ yummy food 🤤,1개,2020. 6. 2.
이지현,"너무 이쁘게 잘먹는 푸메씨 ^^
너무 먹고싶어요~
항상 잘보고 있어요 
홧팅!!!",1개,2020. 6. 2.
shahdTheDimondStar,I like you are finishing all food😋😍💗,2개,2020. 6. 2.
TasnimGaagai,احبك كثيرا لي عربي يحط لايك,2개,2020. 6. 2.
김철환,메일 보기만 해도 행복 푸메 : ),1개,2020. 6. 2.
hwang소명,"구독눌러요
푸메먹방보고 풀고
허당듀오란 먹방보고 스트레스풀고 자려고해요
허당듀오란 체널은 먹거리가 빈곤한데도 느낌오는 먹방같아 스트레스가 확 풀리네요",1개,2020. 6. 2.
서완덕,푸메님의 반려견 포메라니안은 평소에 미용 하고 있나요?😃,1개,2020. 6. 2.
행복한지호맘,ㅋㅋㅋ저거 숟가락이냐 앞접신데,1개,2020. 6. 2.
C조르바,어쩜이렇게 맛있게 예쁘게 드십니까...,1개,2020. 6. 2.
MahmoudH,lOVE UUU!!!!!!!,2개,2020. 6. 2.
,넬 리ㅈ의 마 음을 너무 사랑해😊,1개,2020. 6. 2.
선미는근면해Goyangbubu,요즘 날씨가 더워서 시원한게 땡겨요 그쵸!!,1개,2020. 6. 2.
JusangASMR주상전하,0:33 Start eating,8개,2020. 6. 2.
이구역대가리는한시연,헐 저거 2개만먹어도 엄청배부르던데..언니 은근 대식가ㄷㄷ,1개,2020. 6. 2.
NguynAnhThNguyn,Who love fume asmr??,7개,2020. 6. 2.
syasya,sedapnya🤤🤤~love you sister💖💖,1개,2020. 6. 2.
IanEsperida,Watching this at 2:00am is already a torment for my  hungry self hahahahha,0개,2020. 6. 2.
SavaNariman,I'm so so hungry 😋 please give me food 🥘,1개,2020. 6. 2.
바나나,와 유부초밥 크기 대박이당... 어디껀지 궁금,1개,2020. 6. 2.
DarinHasso,I Love you ❤❤❤ ich liebe deine Videos und l Love you ❤❤❤❤❤❤❤❤,1개,2020. 6. 2.
SunnyKim,아 맛잇겟다 냉모밀🙅‍♀️💜,1개,2020. 6. 2.
NaveedASMR,Who else thinks that she is super cute?😍😍😍💜,0개,2020. 6. 2.
지아,푸메님 ㅜㅜ 너무 맛있게 드셔서 유부초밥 않좋아하는 저도 다 먹고 싶었어용 ㅜ !!,1개,2020. 6. 2.
한마음,오늘 진짜 역대급으로 먹고 싶다 ㅠㅠㅠㅠ,2개,2020. 6. 2.
AngelinaGiselleGracia,Im not late :3 can you give me love 🥺,0개,2020. 6. 2.
LizzyWoodhouse,"7:04 how dare you run away from me, you ungrateful food?",0개,2020. 6. 2.
luviewalling,so refreshing!!!!!!,2개,2020. 6. 2.
선미창,시원하겠당 ㅠㅠ,2개,2020. 6. 2.
부산아놀자,저도 이렇게 먹어봤는데 맛이 최고 ㅎㅎ,2개,2020. 6. 2.
김예린,면 드시는 소리가 너무 좋아서 계속 오게 돼요!,1개,2020. 6. 2.
kirukiru02,ahhh i've been craving those sushi~ looks good xD,0개,2020. 6. 2.
BellBell,당신은 너무 귀엽다 ♡,2개,2020. 6. 2.
조해인,항상 맛있게 먹어주셔서 감사할 따름입니다,1개,2020. 6. 2.
AnotherASMR,OMG these tofu  pockets look so delicious!! Love that we get to see your dog in every video ❤️❤️,3개,2020. 6. 2.
VieraCampos,Ily fume🥺💖,1개,2020. 6. 2.
에옹,내일은 냉모밀이다 ㅠㅠ,1개,2020. 6. 2.
LeslyLpez,LUV U SO MUCH💛,2개,2020. 6. 2.
아카테스,한국사람 손,2개,2020. 6. 2.
JUON,메뉴 선택 너무 좋아요 오늘 점심은 이거다,1개,2020. 6. 2.
LetiziaSalazarPrez,Wow looks all very rich and dey,1개,2020. 6. 2.
정요,한번 밖에 안 흘리는게 신기하다,1개,2020. 6. 2.
SosoSoso,i love you so matsh fume 💗💗💗💗💗💗💗💗,2개,2020. 6. 2.
동석ASMR,와 유부초밥 큼직하니 맛있겠다ㅎ,1개,2020. 6. 2.
SaraLopezAraujo,Hello I love youu💓💓💓💓❣️💖,2개,2020. 6. 2.
