닉네임,댓글,좋아요수,날짜
징징이오,이런 먹방 유튜버가 어딧어 ㅜㅜㅠ...  붕어빵파셔서 기부하실때도 멋있어서 놀랬는데 언니 날개는 어디숨겨놧어요....? 제 롤모델이에요,42개,2020. 4. 27.
viennekayette,i'm fasting but i wish i could eat this rn :<,1개,2020. 4. 27.
JAVillafuerte,Waaaaahhh!!! Watching this makes me hungry 😂😅,0개,2020. 4. 27.
zkkii1346,I swear Fume makes the most bomb ass looking meals 😋,4개,2020. 4. 27.
NafisaNaib,"When I see your videos l start getting hungry, and then I start eating food. But now this Ramadan month so,i can't eat .for this I am upset",0개,2020. 4. 27.
LolliPops,This channel is totally underestimated 😊👏🏻,6개,2020. 4. 27.
김타사보르,이뻐도 너무 이쁜거아님?ㅎㅎ,1개,2020. 4. 27.
SutapaMishra,You are so beautiful i am indian girl your smile is so pretty ❤️,1개,2020. 4. 27.
GiaMendez,That's so amazing I want to try that recipe too. Your dishes are beautiful thank you for sharing.,0개,2020. 4. 27.
ShurleyKhan,Me : watching in ramadan with fast.,0개,2020. 4. 27.
ShawnKnudsen,I could see her being a member of Red Velvet.,74개,2020. 4. 27.
LorennaKelly,Um abraço direto do Piauí - Brasil ❤🙋,0개,2020. 4. 27.
mominataj,"Omg unnie, ur so pretty💜you look like a member of a kpop grp",0개,2020. 4. 27.
toryh,Must be pretty good for you to keep looking so shocked after every bite lmaoo the pure pleasure,1개,2020. 4. 27.
OhatYoung,와 세상에ㅠㅠㅠㅠㅠ갖은 치즈가 들어간 맥앤치즈...거기에 랍스터테일까지ㅠ♡ㅠ 진짜 침넘어가네요ㅠㅠㅠ 푸메라니안분의 요청레시피였군요!! 소리도 넘 좋지만 마음까지 훈훈해지는영상입니다ㅠㅠ♥ 사연 보내주신 푸메라니안분도 이렇게 맛있게 드시는 푸메님  영상보시고 좋아해주셨으면 좋겠어요!!! 빨리 건강해지셔서 다같이 맛있는 음식 먹길🙏🙏🙏 푸메님도 늘 건강하시구요!!!,1개,2020. 4. 27.
킹태민,"우연히 지나가다가 이댓글을보셧을

모든분들이 행운이가득하기를

기도합니다",38개,2020. 4. 27.
17SARAH,"어떻게 이런 요리법을 생각해 있습니까?
どうやってこのような調理法を思いつきますか？",1개,2020. 4. 27.
milkee,my cravings </3,0개,2020. 4. 27.
LourdesMaria,Fofurinha😍😍😍 de cachorro..e essas delicias que vc faz hummmm,0개,2020. 4. 27.
,ちっちゃい木のフォークから、でっかい木のスプーンが、サッと出てきた所面白いです。,0개,2020. 4. 27.
DULCEMARIABACAPENALOZA,Que rico lastima que acá la langosta es carísima y tan solo me conformo con los macarrones 😭😭😭que quesos son los que usaste gracias saludos desde México 🇲🇽💋❤️,23개,2020. 4. 27.
NurmaAmalia,"i'm very happy to see you while eating, especially when your hair is in a ponytail👍🏻😉

i'm your new fans bytheway🙋🏻",1개,2020. 4. 27.
LatedraShaw,"I’m a new subscriber, food looks amazing!! & Wow what you said about the chef situation was a blessing ❤️",0개,2020. 4. 27.
놀라라으악,한국인 댓글 찾는 분!,1개,2020. 4. 27.
AlexandreDaSilva,Que coisa mais linda 🦐🦐🦞🦞🦐🦐🦐🦐🦐🦐😋😋😋🇧🇷🇧🇷🇧🇷🇧🇷🇧🇷🇧🇷🇧🇷🇧🇷🇧🇷🇧🇷🇧🇷🇧🇷🇧🇷🇧🇷🇧🇷🇧🇷🇧🇷🇧🇷,0개,2020. 4. 27.
hallabol,요리 레시피도 준비해 주시겠습니까? 요리법에 대해 알고 싶습니다. 요리법이 우리에게 도움이 될 것입니다.  🙏🙏,1개,2020. 4. 27.
JMPIANO,공감:저희집에왕뚜껑이있는데왕뚜껑먹방안보면그거못먹을거같아요.,1개,2020. 4. 27.
AnaMaria,Amo seus vídeos  porque tem a tradução pra entender feira de Santana ba Brasil,1개,2020. 4. 27.
NisrinaFadhilah,HEY WHY YOU WATCHING THIS DURING RAMADHAN??,6개,2020. 4. 27.
AnaCamilaSanAntonio,"hello sister💖stay safe
""philippines""",3개,2020. 4. 27.
Sofihkpoper,Aaah eu olho seus vídeos pra dormir realmente muito satisfatório amo você 💕💕,1개,2020. 4. 27.
yeri,"Just found this Channel and i already love it <3
New Subscriber here!🙋🏻‍♀️💗",0개,2020. 4. 27.
PhilipAurea,I miss seeing her cute little dog in the beginning and at the end of all her videos 😅,2개,2020. 4. 27.
윤서,언니는 진짜 날개 없는 천사다 ㅜ💖💖💖💖💖💖💖👍👍👍,1개,2020. 4. 27.
Cantetinza17,Looks Delicious! Now I want to make some too.🤤,0개,2020. 4. 27.
탐앨리스,"Fume is such a kind-hearted person 💚, Generous heart😊 . I hope the man recovers soon 🌈🌸.",0개,2020. 4. 27.
kaeza,I need this exact recipe!,0개,2020. 4. 27.
PrincessVinluan,I'm craving for it🤤,0개,2020. 4. 27.
예원,"저번에 댓글로 못 적었었는데 푸메언니, 항상 좋고 다양한 먹방 영상 보여주려고 매번 노력해 주셔서 감사해요 🥰 매번 인트로에 직접 요리해 주시거나 설명해 주시는 부분을 보면 제가 요리하는 것을 너무 좋아해서 유익하다는 생각을 많이 하고 있어요 😊 제가 모르는 것도 많이 배우구요 ㅎㅎ 오늘 랍스터 테일 조리하는 영상보고 또 놀라면서도 멋있다고 생각했어요 ☺️ 믿고 보는 푸메언니, 오늘도 영상 잘 보고 갑니다 😎 좋은 밤 되세요 항상 응원합니다! 🤍",57개,2020. 4. 27.
SeanLim,is my first time watching your videos and it makes me crazy.. you make me feel super hungry >.<,0개,2020. 4. 27.
ChassityOubre,"OMG, Everything looks sooo delicious",0개,2020. 4. 27.
CookingWithJoJo,Just got a Laptop and your videos look EXTRA DELICIOUS! lol ;),1개,2020. 4. 27.
LeticiaVilasboas,Cade os Brasileiros? 🤭❤❤,1개,2020. 4. 27.
HOUASMR호유,Wow Mac & Cheese ... Who wants to watch a video and eat ???🙋🏻‍♂️🙋🏻‍♂️🙋🏻‍♂️🙋🏻‍♂️,3개,2020. 4. 27.
julliChan,Kasamoks face expression oi. Lami na unta 😂😁,0개,2020. 4. 27.
yayo4nasal,You know what they say... that sound when you stir that mac and cheese 🍑🍑🍑,0개,2020. 4. 27.
,"口いっぱいに頬張る姿が気持ちいいです
思わす登録しちゃいました",0개,2020. 4. 27.
KALANAMADUSARA,That microphone was located in her mouth🙄,11개,2020. 4. 27.
KapuananiE,0:00 cute doggy 🥺🥴,3개,2020. 4. 27.
,"Одно удевляет как у них столько в рот помешаеться я с этого удевляюсь,тут одну сушу не съесть целиком , а тут столько.",3개,2020. 4. 27.
khukktila,밤에 보면 진짜 안된다 ㅋㅋ🤤,0개,2020. 4. 27.
AdrianocostadaconceioConceio,Sou muito seu fan vc e maravilhosa amo seus videos estou sempre te acompanhado amo todos os vídeos lindaaaa,0개,2020. 4. 27.
elaine03,"Oh wow, thank you so much for the recipe!",0개,2020. 4. 27.
,私も食べたい♡,6개,2020. 4. 27.
,"Ох радная, с твоей любовью с сыром к нам бы в год так 1998 после дефолта. Мы всей семьёй ели сыр, рыбу речную и то что на огороде вырасло, а огородик маленький 4 сотки, ибо в городе. Я мелкая была, но сыр до сих пор ненавижу",0개,2020. 4. 27.
신려월,~~하신다고 하더라 '구요'~ 억양이 너무.. 조선족같아요... 좀 고쳐주세용..,0개,2020. 4. 27.
sadiashahab,I'm in fasting n I become crazy my stomach is making voice like gur Gur🥺🥺 I wanna eat that ..,0개,2020. 4. 27.
초초이,"푸메님 나중에 이 메뉴 해주셨음 한데...
바로~~엽떡 짜장맛 제일 메운거랑 그 위에 치즈를 올리고(치즈폭탄!!)그리고 사이드 메뉴로 주먹밥이랑 그냥 보통엽떡도 같이 준비해주셨음 합니당~!믿어보겠음니다!!",0개,2020. 4. 27.
MineeLuvv,Seriously I crave everything she eats without even knowing how it tastes😋😋,45개,2020. 4. 27.
justsomeone,I thought it was Park Cho-rong from Apink in the thumbnail 💀☠,0개,2020. 4. 27.
selychannel,"Sis, 나는 젓가락 포크 스푼을 정말로 좋게 원합니다. 어디에서 사야합니까?🙏🏻",1개,2020. 4. 27.
Dasplash,That looks so good 😊,0개,2020. 4. 27.
JulieA,"This too, is one of  my favorite dish. Definitely comfort food.  Praying the subscriber gets well, and will soon enjoy eating dishes like this.❤🙌🙏🏽
Thank you Fume for dedicating this video to them. You are such a beautiful person. ❤
Food looks so delicious!!🦞🦞🦞🦞🦞❤❤❤🦞🦞🦞",3개,2020. 4. 27.
,"大きい…！プリプリ…！美味しそう🥺
シェフの方、これみて元気になると良いですね！",13개,2020. 4. 27.
JasmineLelea,"Hi Fume!! I was hoping you could do another BBQ video? That's my favorite video so far, and I'd love to see more! 😊",0개,2020. 4. 27.
blackcat,一口の大きさが素晴らしい✨,0개,2020. 4. 27.
,生エビも好きだけど、火を通したエビの食感がたまらなく好き,0개,2020. 4. 27.
shisu42,お綺麗なのに1口のサイズが大きい…。ギャップ萌え…(*´▽｀*),0개,2020. 4. 27.
ReynalynEsmeralda,What a delicious meal 😭 Fume can I have some 😁😊❤️,4개,2020. 4. 27.
LindaSinclair,I subscribed! You are a fabulous cook...l like your videos 🤗🤗🤗❤,1개,2020. 4. 27.
Rajlama,Wow you're so beautiful im from Nepal,0개,2020. 4. 27.
VietnamLife,우와 ㅠㅠ 랍스터라니요...,0개,2020. 4. 27.
pijjachuu,"man, i really want to know her skincare routine",0개,2020. 4. 27.
AmyliaFadzillah,Me: Eating Cucumber and ginger while watching this ..,56개,2020. 4. 27.
Roqia,IM From Iraq 🇮🇶🇮🇶🇮🇶,0개,2020. 4. 27.
ChloeBrown,I want Fume to cook for me waaaaaaaa 😭,0개,2020. 4. 27.
,"いつも美味しそうに食べている所を見ています♪
これからも応援してますね(*^^*)
健康に気をつけて頑張ってください♪",0개,2020. 4. 27.
FarahFarfoura,The food looks soo good but having to raise your arm that high to eat really triggers me😅 it seems so uncomfortable (hope its not),0개,2020. 4. 27.
Deeya2019,"Believe me , my mom would be the happiest person on earth if I cleaned dishes like that ! 😅😂🤣❤️👍🏻💫",69개,2020. 4. 27.
d90uAnytime,あー😍💕もう大好き❤お料理も上手で美味しそうだし、美人だし　口にいっぱい入れたあと目をつぶって幸せそうな顔も　ホント可愛い😍,0개,2020. 4. 27.
보현,언니 영상 매일 챙겨보는데 너무 잘드시고 예뻐요ㅜ,0개,2020. 4. 27.
최보옹,"힝 맘도 이뿌다 이언니,,,,,,",1개,2020. 4. 27.
김민,"마음씨가 너무 이쁘시네요ㅠ,,그리고 너무 맛있어보여서 군침돌아효ㅠㅠ😭최고,,",0개,2020. 4. 27.
cookie,find a girl that looks at you the way fume looks at her food 😂,44개,2020. 4. 27.
혁햐햐JinLee혓효과,현 시점에서 가장 중요한 Ilikee,0개,2020. 4. 27.
,応援しています❣️,0개,2020. 4. 27.
SreelakshmiSreejith,Lol 😂 here we are hungrily watch you eat.... For some reason your eating brings me satisfaction 😆😆,0개,2020. 4. 27.
,美味しそうすぎる,0개,2020. 4. 27.
novembercherry4,I'm gonna have to make that some time soon.  Everything looks good.,1개,2020. 4. 27.
OuMunySorya,Hello I'm from Cambodia and I really love watching your channel😍,0개,2020. 4. 27.
,これ絶対美味しいやつだ…,0개,2020. 4. 27.
JBdiva81,I have to get lobster after this video. Made my day. Thanks!!!,0개,2020. 4. 27.
ShariqAhmed,So early again 😍💙,6개,2020. 4. 27.
Jasmuuhhn,Woah you are extremely pretty 😯,2개,2020. 4. 27.
글리,푸메님 직접만든 수제비 먹방 찍어주세욥♡,1개,2020. 4. 27.
Hookups,I love the use of the Minecraft sound effect!,0개,2020. 4. 27.
AgungFrandiansyah,Mau ngumpulin netizen Indonesia yg nyasar kesini. 😂😂,1개,2020. 4. 27.
AdrianaA,thank you for uploading this at night so i can watch this after i break my fast XD -muslim subscriber,3개,2020. 4. 27.
KodaWolf,"Please just take normal bites of food. It’s painful watching mukbangers shove heinous amounts of food in their mouths. I understand that mukbang is supposed to help people who are alone feel as if they’re eating with company, or gain from watching someone else eat food. I myself enjoy mukbang and can tolerate most of the eating sounds. However, I don’t like how sensational mukbangers try and make something as simple as eating, hence the overly large bites and ridiculously large serving sizes and eating very unhealthy gluttonous foods. If any of you guys know of mukbang channels where they eat normal sized meals that aren’t heavy in calories, feel free to mention some in the replies.",4개,2020. 4. 27.
AkeniIstigfarin,Oh noo i watch this while fasting 😂,0개,2020. 4. 27.
tdcsr777,料理上手ですね(^^),0개,2020. 4. 27.
RessaJameloGuadamor,Learning and enjoying at the same time 😊😍 that's yummy though! 😍,0개,2020. 4. 27.
WandaMoar,I am happy you made this video for the sick chef.,0개,2020. 4. 27.
,めっちゃ美味しそう,0개,2020. 4. 27.
AdriannaRodriguezRafeequllah,Please repeat this menu sometime in the future... 🙏😋🤤🤤🤤😋🙏,0개,2020. 4. 27.
SHAWTY,오늘 옷 색깔 너무 이뻐용💖,0개,2020. 4. 27.
malapz,The way u eat the lobster tail is just so satisfying to see and the sound too u just made my day worth so much LOVE THE VIDEO BE SAFE EVERYONE!,63개,2020. 4. 27.
AikaBUTA3,美味しいんだろうなぁ～,0개,2020. 4. 27.
StephanieAlvarez,I drooled the whole time 🍽🤰🏽,0개,2020. 4. 27.
박지은,ㅋㅎㅋㅎㅋㅎㅎㅎㅎㅋㅎㅋㅎㅋㅎㅋ --구요! 할때 너무 웃겨 ㅋㅎㅋㅎㅋ,1개,2020. 4. 27.
성유민,"내가 들으려고 적는 
랍스터버터치즈구이
4:25
9:41",0개,2020. 4. 27.
sosoOkour,بيششهي❤,0개,2020. 4. 27.
sudenazMurt,Bu da  ORUÇLU HERALDE çünkü AYI gibi yiyor,3개,2020. 4. 27.
,我的天啊~好滿足哦！！,0개,2020. 4. 27.
barbaraVitriaConceioFalco,Eu sou do Brasil e amo seus vídeos🇧🇷🇧🇷❤❤❤❤,0개,2020. 4. 27.
NastyaTaehyung,"Today is a special day, my onni's birthday",52개,2020. 4. 27.
JosephAhn,"저랑 음식 취향이 비슷하시네요 ㄷㄷ
맨날 맛잇는것만 드시네요. ㅎㅎ",0개,2020. 4. 27.
minkqueen,"정말 맛있게 먹네요~
눈알을 조금덜 굴려주시면요.  매번영상을 잘보고있어요.
  눈알만 조금덜~~^^",0개,2020. 4. 27.
IsabellaRodrguez,"Oh, Fume, you're so sweet 🥺",0개,2020. 4. 27.
tashfiqridzuan,You so cute 😍😍,0개,2020. 4. 27.
ShariqAhmed,Damn! One of the most difficult thing is watching this video while fasting 😫🤤😋,37개,2020. 4. 27.
antoniocarlosbarbosa,Come mto..to fora..mto gata mas comilona kkk,0개,2020. 4. 27.
없음이름,아놔 자기전 힐링영상 찾고 있었는데 이놈의 유튜브 알고리즘 날 너무나도 힘들게 하는군.. ((꼬르륵..,0개,2020. 4. 27.
김노랑,먹는 모습 너무 예뻐요ㅠㅠ,0개,2020. 4. 27.
Tor,ทำอาหารออกมาน่ากินมากครับ🇹🇭🇹🇭🇹🇭💓💓,0개,2020. 4. 27.
BlinksBlackjack,"Who loves sea food??
Wen u don't have but can only watch:'(",51개,2020. 4. 27.
랑랑ASMR,예쁘고 맛있게 잘 드시고 부러우면 지는건데 완전 집니다^^,0개,2020. 4. 27.
이가은,껍데기는 가라 ㅋㅋㅋㅋㅋㅋㅋ,0개,2020. 4. 27.
AleriaTalley,Okay but like your skin is the definition of flawless😭... Korean beauty products are beyond amazing it scares me 💀😍✨,0개,2020. 4. 27.
성장하는훈이,했구요~ 했구요~하는데 너무 귀여우셔 ㅎㅎ,0개,2020. 4. 27.
NithaAprilia,I'm from Indonesian,1개,2020. 4. 27.
허윤진,"오 알고리즘에 떠서 썸네일에 홀린듯이 왔는데 너무 맛있어보여요,,",0개,2020. 4. 27.
HAnhVNg,My replay button broke and I have officially dying from starvation,0개,2020. 4. 27.
Dilara,Interesting to know in what time you ate the menu. Can you write it in all of your next videos? It looks so tasty everytime you cook! 😍 Best regards from Germany (:,0개,2020. 4. 27.
푸메Fume,"금일 영상은 녹음기에 문제가 있어서, 기존 영상에 비해 소리가 많이 작아요. 죄송합니다. 많은 양해 부탁드립니다. 오늘 안녕하세요 푸메라니안 여러분🙇🏻‍♀️ 오늘의 먹빵..❤️ 단짠단짠 다양한 디저트 입니다! 에어프라이어로 한 번 바삭하게 구운 여러가지 빵에 조각 롤케이크, 누가크래커에 설큐빙까지 준비했어요! 정말 다양하게 준비했어요! 녹음기가 문제가 있어 소리가 많이 아쉽지만 😭 진짜 맛있었답니다! 종류는 영종도쪽에서 구매해온 육쪽마늘 크림치즈빵, 치즈바게트, 먹물치즈빵, 블루베리타르트, 앙버터랑 아티제 스트로베리화이트롤, 몽샹 82의 누가크래커랑 설큐빙 준비했어요! 단 음식, 디저트류를 좋아하기는 해도 유난히 잘 먹는 편은 아니지만 (응..?) 다양한 종류의 빵들을 번갈아서 먹으니 식감도 맛도 더 맛있었던 것 같아요! 육쪽마늘빵은 안에 크림치즈가 한가득 들어가있어서 완전 취저.. 치즈바게트랑 먹물치즈빵은 기대했던것 보다 치즈가 덜 들어가서 약간 아쉬웠지만 (다 먹고나서 이런소리…..) 치즈맛 빵들과 달달한 타르트, 앙버터, 누가크래커랑 설큐빙까지 함께 먹으니 더 맛있었어요! 대만디저트라는 설큐빙 (머랭 페스트리라고 하더라고요) 은 처음 먹어봤는데 완전 기대이상이었어요! 쫀득하면서도 비스킷? 빅파이? 같은 느낌이 나서 뭐라 형용할 수 없는 식감인데 개인적으로 너무 맛있게 먹었어요! 완전 추천드려요! 누가크래커도 대만에서 유명한 크래커집보다 도톰해서 맛있었어요 (저는 딸기맛을 좋아하다보니 특히 딸기맛이…🍓) 기운이 없는날엔 이런 디저트류가 최고인 것 같아요 💖 오늘도 시청해주신 여러분들 정말 감사합니다 🙏🏻🙆🏻‍♀️❤️

🔥My Instagram : http://instagram.com/fume_yamyam
🐶Sleepy White Fox's Instagram: http://instagram.com/mozziiya

Because of some problems during the recording, the sound volume in this video will be lower than my regular videos. I seek your understanding. Sorry for the inconvenience caused.

Hi guys! Today I brought dessert! I bought eight kinds of dessert : Strawberry swiss roll, Cheese baguette, Cream cheese garlic baguette ball, Squid ink cheese bread, Red bean butter pretzel Blueberry tart, Taiwanese-style Nougat and Nougat cracker from different bakeries! There were some bread that wasn't as good as I expected, but it was really good in general! I had the bread with milk so the bread was even softer and butterier! I really enjoyed eating them! I can't really eat sweet food like dessert a lot in one sitting, but I was really happy having various kinds of bread and cake! When you have no energy, eating dessert is the best solution! Thank you for watching my video today! Hope you enjoyed watching it!

* Karena beberapa masalah selama perekaman, volume suara dalam video ini akan lebih rendah daripada video biasa saya. Saya mencari pengertian Anda. Maaf atas ketidaknyamanan yang ditimbulkan.*

Halo semuanya! Hari ini saya membawa makanan penutup! Saya membeli delapan jenis makanan penutup: Strawberry swiss roll, baguette keju, bola baguette krim keju bawang putih, roti keju tinta cumi-cumi, roti lapis mentega kacang merah Blueberry, tart Nougat dan cracker Nougat gaya Taiwan dari berbagai toko roti! Ada beberapa roti yang tidak sebagus yang saya harapkan, tapi itu benar-benar bagus secara umum! Makan roti dengan susu membuat roti terasa lebih empuk! Saya sangat menikmati memakannya! Saya benar-benar tidak bisa makan makanan manis seperti makanan penutup dalam satu kali duduk, tetapi saya sangat senang memiliki berbagai macam roti dan kue! Ketika Anda tidak memiliki energi, makan makanan penutup adalah solusi terbaik! Terima kasih telah menonton video saya hari ini! Saya harap Anda menikmati menontonnya!

* रिकॉर्डिंग के दौरान कुछ समस्याओं के कारण, इस वीडियो में ध्वनि की मात्रा मेरे नियमित वीडियो से कम होगी। मैं तुम्हारी समझ चाहता हूँ। असुविधा के लिए क्षमा करें।*

हेलो सब लोग! आज मैं मिठाई ले आया! मैंने आठ प्रकार की मिठाई खरीदी: स्ट्रॉबेरी स्विस रोल, चीज़ बैगूएट, क्रीम चीज़ गार्लिक बैगुएट बॉल, स्क्विड इंक चीज़ ब्रेड, रेड बीन बटर प्रेट्ज़ेल ब्लूबेरी टार्ट, अलग-अलग बेकरियों से ताइवानी-शैली नौगट और नूगाट पटाखा! कुछ रोटी थी जो मेरी अपेक्षा के अनुसार अच्छी नहीं थी, लेकिन यह वास्तव में सामान्य थी! दूध के साथ रोटी खाने से रोटी भी नरम हो गई! मुझे वास्तव में उन्हें खाने में बहुत मज़ा आया! मैं वास्तव में मिठाई नहीं खा सकता हूँ जैसे कि एक मिठाई में बहुत कुछ है, लेकिन मैं वास्तव में विभिन्न प्रकार की रोटी और केक खाकर खुश था! जब आपके पास कोई ऊर्जा नहीं है, तो मिठाई खाना सबसे अच्छा उपाय है! आज का मेरा वीडियो देखने के लिए धन्यवाद! मुझे आशा है कि आपने इसे देखने का आनंद लिया है!

* Do một số vấn đề trong quá trình ghi, âm lượng âm thanh trong video này sẽ thấp hơn các video thông thường của tôi. Tôi tìm kiếm sự hiểu biết của bạn. Xin lỗi vì sự bất tiện gây ra.*

Chào mọi người! Hôm nay tôi mang món tráng miệng! Tôi đã mua tám loại món tráng miệng: Bánh cuộn dâu tây, Bánh mì phô mai, Bánh baguette kem phô mai, Bánh mì phô mai mực, Bánh quy bơ đậu đỏ Blueberry, Bánh quy Nougat kiểu Đài Loan và bánh quy Nougat từ các tiệm bánh khác nhau! Có một số bánh mì không tốt như tôi mong đợi, nhưng nói chung nó thực sự tốt! Ăn bánh mì với sữa làm cho bánh mì thậm chí còn mềm hơn! Tôi thực sự rất thích ăn chúng! Tôi thực sự không thể ăn thức ăn ngọt như món tráng miệng rất nhiều trong một lần ngồi, nhưng tôi thực sự rất vui khi có nhiều loại bánh và bánh! Khi bạn không có năng lượng, ăn tráng miệng là giải pháp tốt nhất! Cảm ơn bạn đã xem video của tôi ngày hôm nay! Tôi hy vọng bạn thích xem nó!

※録音中に問題が発生したため、この動画の音量が通常の動画より低くなっています。ご理解をお願いいたします。ご不便をおかけして申し訳ありません。*

皆さんこんにちは！今日はデザートを持ってきました！いちごスイスロール、チーズバゲット、クリームチーズガーリックバゲットボール、イカ墨チーズパン、小豆バタープレッツェルブルーベリータルト、台湾風ヌガー、ヌガークラッカーの8種類のデザートを購入しました！思ったほど良くないパンもありましたが、おおむね美味しかったです！牛乳でパンを食べるとパンがさらに柔らかくなります！食べて楽しかった！デザートのような甘いものは一度にたくさん食べることはできませんが、色々なパンやケーキが食べられて本当に良かったです！エネルギーがないときは、デザートを食べるのが一番です！今日は私の動画を見てくれてありがとう！楽しんでいただけましたでしょうか！",145개,2020. 5. 31.
thejeon,"in turkey, bread is like a main meal. turkish people eat bread in every eating time. breakfast, lunch, dinner... but in korea it is like a desert. that is... a little bit interesting for us 😅",106개,2020. 5. 31.
봉이네TV,"0:45 eating start😍😍
It looks really delicious. I'm hungry😢😢",12개,2020. 5. 31.
BABUSELVADURAI,I wonder how she stays fit even after consuming so much of food.If you think like me make this like button go blue👇👇👇,43개,2020. 5. 31.
RobertaMorais,"Uau, deve está uma delícia... parabéns você sabe mesmo o que é ter bom paladar. Brasil te ama...",5개,2020. 5. 31.
YumniAzhani,"In Malaysia we called the biscuits that tasted like Choco pie is ""Kek Batik"". 😍✌",2개,2020. 5. 31.
EYasu,"0:44 start eating 🌭🥖🍞🥐🥞🍔
3:09 drink milk🐄🍼🥛

美味しそうなパンだ😍😋",7개,2020. 5. 31.
LivKim김리브,"Who else wants a FUME Q/A? 🙋🏻‍♀️🙋🏻‍♀️🙋🏻‍♀️🙋🏻‍♀️
👇👇👇",65개,2020. 5. 31.
