,youtube_id,comment,like_num
0,방구석리뷰룸,오늘은 Gamsung 영상을 한번 시험해봤습니다 ㅋㅋㅋ! 갓구글!! 정말 좋으니까 플레이북에서 외국책 사서 공부하세요,25개
1,WadeLee,난 진짜 이 분이 테크유튜버중에 제일 유용한것같음 유일하게 알람까지 켜놓고 봄,43개
2,오규찬,실험이 아니라 좋은데요!? 처음에 채널 잘못들어온줄 알았습니다. 영상 자체가 부드러워서 좋네요,18개
3,JuikEom,"아이고, 구글 서적을 활용할 생각을 미처 못했네요! 외국어 공부의 의미는 아니지만, 잠깐 검색해봤는데도 필요한 해외 원서들이 무료로 풀린 경우가 제법 있어서 무릎을 탁 치고 갑니다. 별개로 해외 아동용 오디오북은 정말 대박이네요. 당장 투입할 예정입니다. 감사합니다.",12개
4,wisdomly,와.. 난 방구석님 때문에 기계 제대로 쓰는거같아 진짜 넘 감사해요 영상 감성감성하네요 그 비싼 카메라로 찍으신걸까요?? 크~ 좋습니다,5개
5,하루,"와.. 이번 영상 분위기 무슨일인가요.. 👀✨✨
언제나 더 나은 방법을 찾아 공부하시는 모습 정말 멋져요 ♥",9개
6,최호영,오늘 영상 분위기가...ㄷㄷ,8개
7,Eric,완전 최고 ㅋㅋㅋㅋㅋㅋ 당장 다운로드하러 갑니다 완전 나를 위한 영상!!,7개
8,JihoJang,오오 대박인데요!! 오늘도 양질의 정보 알려주셔서 감사합니다~~^^,4개
9,병주원약주원,와 여태 구글북 보면서도 전혀 모르고있었네요 ㅋㅋㅋ 감사합니다,1개
10,EunhwakJo,좋은 영상 감사합니다. 그런데 패드화면을 찍은 폰카 영상의 울렁거림(?)이 아쉽습니다. 밝은 환경이 아니라서 그런걸까요.,1개
11,Sh,저도 jlpt1급 준비 중인데 원서 읽기는 쪼까 어렵고 오디오북 괜찮아 보이네요ㅎㅎ,4개
12,JuwonJung,"방구님은 일본어 공부 필요도 없잖아요 ㅠㅠ
구글 밑 무료화 되었네요 이것도 한번 다뤄봐 주시면 좋을꺼 같아요",3개
13,사람,안경 너무귀여워욬ㅋㅋㅋ,0개
14,인성이,우와 ㅋㅋㅋㅋㅋㅋㅋ 오늘 영상느낌👍😉,0개
15,맛나라,구글번역기 진짜 조아용 호홍~,0개
16,사회부적응자,음성번역이 쵝오다. 우선 발음이 정확한걸루다가 해야겠네요,4개
17,우기woogi,영상 잘 봤습니다! ㅎㅎ 궁금해사 그러는데.. 혹시 맥북에어2020도 나중에 리뷰 해주시나요?,0개
18,단짝친구,저 저번에 인스타 메시지 드렸던 초등학생에요!,2개
19,leeqba,말풍성 확대 미쳤네....대박이네요.,5개
20,OscarJo,오우 영상 톤이 너무 좋은데요? 방구룸님이랑 분위기가 너무 찰떡.. 계속 이렇게 밀어도 되겠는디유?,2개
21,chobbang,형 안경 어디꺼에요? 형이한건 다조아보여ㅜㅜㅜㅜ,0개
22,립밤중독,영상 분위기 좋네요!,0개
23,FinnG,인스타보고 기대했는데 영상미 떡상 오오 🤟🤟🤟,2개
24,정석희,가면 갈수록 영상 분위기가 더 좋아지시는거 같아요. ㅎㅎ 영상 잘 보고 갑니다.,0개
25,JYH,이 구도 좋아요!,3개
26,Yongsdiary일기쓰는용이야,요새 원서 읽기 시작했는데 때마침 요런게 올라왔네요! 저는 기본앱 도서(books)를 이용해서 읽는데 기본앱이라 연동도 좋고 영어는 자료 많은 듯해요. 그래도 편리성은 리디북스가 최고 좋은 듯싶어요. 여러 제스쳐같은 게.. 그나저나 오늘 분위기 깡패네요!! 어두운데도 깨지지않고 고급지게 잘나오다니.. 무슨 비법인가요 ㅎㅎㅎ,0개
27,미아페TV,항상 고마워요 ^^ 꼭 필요했던 건데 일본어 소설이나 일본어 만화를 찾으니까 안 나오는 데 어떻게 하나요 ?   꼭 가르쳐 주세요 ^^.,0개
28,정섭,새로운 조명 변화 이쁘네요!!👍,1개
29,손태봉,이건 진짜 지려따....크....,0개
30,ChiHyungCho,배경 어둡게 하니까 뭔가 느낌있고 좋은듯...ㅋㅋ,1개
31,단짝친구,꺄꺄꺄꺄꺄꺅갸갸갸갸갸ㅑ꺄ㅑ꺄ㅑ갸ㅑㅑ 완전 재밌어!!!!!!!!!!,5개
32,참새짹짹,우와 마침 일본 원서로 공부하고 싶었는데 너무나 유용한 정보 얻어가요! 엄청 좋네요!,0개
33,GwanpyoHong,자격증 시험 끝나면 영어공부 할 계획이었는데 이거 너무 좋은 영상이에요!! 좋은 영상 감사드려요~,0개
34,Brandon,구글 플레이 북뿐만 아니라 킨들의 사전기능에서 구글 번역을 쓸 수 있더라구요,1개
35,SoYoungChoi,"전자기기는 도구이지 그것으로 뭘 하느냐가 중요하다고 생각하는데, 오늘도 실용적인 정보 배우고 가네요 ㅎㅎ",2개
36,강코라,방구석님 첫 댓글 달아요 영상 유익합니다 앞으로도 꾸준한 활동 부탁드려요 감사합니다 ^^,0개
37,정원진,조금 어두워지니 색다른 느낌이네요 😄,0개
38,우지범,방구님 티가 너무 예쁜데요 정보 공유해주세요!,0개
39,뽕나무귀신,헐헐헐 정말감사합니다,1개
40,윤터키,이번 영상은 색감이 참 좋네요. 촬영장비가 바뀐건가요~?,1개
41,Catcher456M,엄훠 구도도 엄청 좋아요,0개
42,공영진,아이패드로 뭐해야하나 하다보면 방구석님보고 많이 따라하고 있어요 감사합니다!,1개
43,개발자맛TastelikeDeveloper,조명이 어두워졌는데 마음에 들어요 방구석님!,0개
44,주영림,영상 분위기가 인스타에서도 봤지만 뭔가 개발자 느낌나네요ㅋㅋㅋ 이런 갬성 좋은 것 같습니다,0개
45,YongJoLee,"저도 요즘 전공서적 구매해서 보고있습니다.






인쇄본보다 2배가량 저렴해서 만족하고 보고있어요.






아이패드 6세대로 보고 있는데 조만간 프로 모델이 오니까 더 쾌적하게 볼수 있을것 같네요.",4개
46,hoyalee,"방구석님 영상 거의 1일 1영상 이상 보고 있습니다. 지난 영상에는 댓글이 잘 안달려서 영상과 다른 내용이지만 글올립니다. 매직키보드의 트랙패드에서 카톡특정문장 답장할때 꾹 누르면 답장쓰기가 뜨는데, 손을 띄면 없어지더라구요. 답장쓰기 할려면 결국 터치를 해야할까요? 오늘 영상도 잘 봤습니다 ^^",0개
47,Dosh,유용한 팁 늘 감사합니다!! 좌측 뒷편에서 나오는 화면보호기? 같은 건 어디서 찾아볼 수 있을까요?,0개
48,RykerLejeune,한글책 보는데 폰트가 맘에 안드네요..사용자 폰트 넣는 법 없나요...,0개
49,RoysungjunBaek,안경이 예쁘네요 ㅋ,0개
50,JIHWANSHIN,안경 바꾸셨나요? 지적여보여용,1개
51,아이잉이이잉,조명은 어떤 조명 사용하시는가요?,1개
52,코코넛,방구석 리뷰님 영상이 정말 제일 보기 편하고 정보면에서도 유용한거 같아요,0개
53,샤키코리아,애플 못지 않은 갓구글~,0개
54,LaviedeJae,다른 언어 책도 읽을수 있을지 찾아봐야겠네요,0개
55,죠스바,왜 계속 매직 키보드에 눈이 가지;; 하핳,0개
56,MIBAELEE,se 리뷰 보러왔다가 꿀팁얻어가요!,0개
57,NLPlusAlpha,"참말로 실용적인 정보들 값지다
당신때문에 생애 첫 패드를 결국질렀으니
사후 관리까지 잘 부탁드립니다요😚",1개
58,이주호,방구석님.. 영어책이나 일본어책 쉽게 검색하는 방법 좀 알려주세요..영어로 된 책들의 차트를 볼 수도 있나요?,1개
59,SungyoonLee,방구님 티셔츠 사고싶다....,0개
60,Rearth러스,따뜻한 조명 세팅으로 인해서 조금 더 영상이 세련돼 보입니다 ㅋㅋ 공유해 주신 정보 또한 대박 유익!,0개
61,Unbegriff,구글 북스 안에서 한국책 이북들도 타사에서 구매하는 것보다 더 싸더라고요ㅎㅎ 애용합니다,0개
62,다몽키의잡다한TV,얼굴이 작아보이는 효과가!!,1개
63,GEOSONGTV,"제 이름이 원서라 깜놀. 원서를 구매하고 원서를 보고.. 이 영상은 어떤 카메라와 마이크로 하신건가요? 저 온라인 강의 하는데, 너무 고생스럽습니다. 도와주세요.",0개
64,느끼자보고,이번에 와이파이 버전으로 아이패드 사신 이유가 궁금 해영,0개
65,박진수,"믿고 보는 방구석리뷰룸~~
구독하면서 패드 활용도가 엄청 늘었어요~~^^",0개
66,류다혜,갓구글 갓방구석👍👍👍,0개
67,JPark,"방구석님, 킨들 사용은 하지 않으시나요?",0개
68,chEB,"Apple과 Google 서로 라이벌이지만
아이러니하게도 macOS, iOS디바이스와
구글 서비스가 가장 궁합이 좋음;;",0개
69,Timetoshine,미쳤네.... 구글 번역 일본어는 거의 완벽이던데 대박이네요,0개
70,JPark,킨들 언리미티드로 오디오북도 같이 사용하시면 신세계입니다. 한 달에 1만 1천원 정도. 넷플릭스로 영어 공부하는 크롬 앱도 정말 많답니다~~~.,0개
71,옹달샘,빨간모자까지 쓰셨으면 라이브아카데미라고 생각할뻔....ㅋㅋㅋㅋㅋ,0개
72,LHR,오랜만에 영상보는데 인물이 훤칠해지셨습니다😍,2개
73,정재환,근데 저는 아이폰으로 하려는데 구글 플레이가서 책을 사서 이용하라네요,0개
74,first길다하트,일본 만화 잡지 사놓고 이걸 어떻게 해야하나 했는데 구글번역이 좀 괜찮다고 하시니 사용해 봐야겠어요ㅎ일본어를 읽을줄은 아는데 무슨 말인지는 몰라서..ㅎㅎㅎ내가 읽어서 잘 인식할까 싶지만 손으로 쓰는것보단 편하겠죠😂😅,0개
75,레몬한조각,"원서를 자주 봐야하는 사람으로서 e book을 노타빌리티나 굿노트같은 다른 어플로도 열 수 있게 해주거나, 제공되는 도서 앱의 필기 기능을 더 향상시켜줬으면 하는 바람이 있네요..ㅠㅠ 그래도 가볍게 사용하기에는 꽤 생산적인 방법인 것 같습니다!
영상 잘 봤습니다😊",0개
