,youtube_id,comment,like_num
0,yeondukong연두콩,"Cc Click please☝🏻🖱❤️
렌즈 - 오렌즈 스페니쉬 써클 브라운이였음.. 글씨 s로 시작해서 씨크리스로 인줄알았다네유😂
지난주에 남한산성 잠시 다녀와쑬때
20분안에 후딱한 메컵이여유~~💓 요새 하두 메이크업 안해서 적응이 안대유~~",226개
1,Chunnia,14년.. 맞아요 그 시절이 생각나네요 아무도 연두콩님이 하시겠다고 한 일을 이해못했다고하니 그때가 어땠는지도 좀 떠오르고 지금 트렌드가 확실히 달라졌는데 연두콩님이 혜안을 가지고 진짜 잘 선택하신게 맞죠,134개
2,Mild,두콩님 왜이렇게 살이 빠지셨어유ㅠㅠㅠㅠ 밥도 꼭 잘 챙겨 드세요!! 원래도 작았던 얼굴 엄청 작아져서 놀랐어요ㅠㅠ두콩님응원 덕분에 정말 힘이 많이 되었습니다! 공부 열심히 해서 저는 내년에 캠퍼스 스토리 많이 들려드릴게요!항상 감사합니다! 오늘도 행복하세요♥,83개
3,토마토맛토,화상강의 첫날 어떤 남학생분이 마이크 켜놓은줄 모르고 엄마랑 대화하는 소리 들렸어욬ㅋㅋㅋㅋㅋㅋ못들은척 애써 웃음을 참고계시던 교수님 얼굴이 레전듴ㅋㅋㅋㅋ,54개
4,wonday예원,"헉 이번 메이크업 너무 예뻐용,,,,",21개
5,예나,이렇게 귀염뽀짝한 생물이 존재하다니..😢😢,38개
6,갈겨라,와 썸넬 넘 예뻐서 놀랐네,40개
7,댕룽,"그러고 보니까 언니...
그..한때 유명했던
얼굴에 흙묻은 강아지 닮았ㅇ ㅓ...
인간 말티즈 두콩 언니..🧡한번 찾아봐유",34개
8,S2S2,2:30 대학생언니 몰래 틴트발라본 초딩동생같아유ㅠㅠ 귀여워ㅠㅠㅠ 도대체 어딜봐서 서른이야~~! 언니 밥 잘 챙겨먹구 건강챙겨요ㅠㅠ 면역력 키우려면 밥이 최고여!💙,34개
9,Soyoung,아몰랑몰랑 우런니 최고!!!  일단 우런니 최고 댓글달고 나 영상 열번 돌려본다 !!!! 내 소원 있다면 언니랑 소갈비 먹끼 빨리 코로나 꺼죠죠 ㅠㅠㅠㅠ!!!!!,46개
10,최주영,사강을 교수님께서 위아래 반전으로 올리셔서^^ 컴퓨터로 못듣고 핸드폰 뒤집어서 들었어요. 힘들었답니당ㅠ,12개
11,곽별,언니..ㅠㅠㅠ 언니 앞머리 볼때마다 너무 이뻐서 그런데ㅠㅜㅜㅠ자르는 법이랑 앞머리 팁들 공유좀 해주시면 안될까요ㅜㅜ!!,4개
12,mena,얼마만의 겟레디윗미 ㅠㅠㅠㅠ 전 언니의 생활밀착유튭도 넘 좋지만 뷰티유튜버로 입덕한 저는 grwm 너!무! 좋아요ㅠㅠㅠㅜㅜㅜㅠㅜ,22개
13,빛한,언니....진짜 나이 거꾸로 드시는 거죠? ㅠㅠㅠㅠㅠㅠ 모든 사랑 독차지하는 어린 구ㅏ여운 막내 공주 같앙6퓨ㅠㅠㅠㅠㅠㅠㅠㅠ,15개
14,이체루,정말 내 인생에서 이렇게 코랄 잘 어울리는 사람은 언니가 처음이자 마지막이에요 ㅠㅠㅠㅠㅠㅠㅠㅠㅠㅠㅠㅠ,9개
15,낑송,온니 ㅠㅠㅠㅠ머리 펌이 너무 이뻐유ㅜㅠㅠㅠ 화장도 너무 이뻐유 ㅠㅠㅠㅠㅠ오늘 눈화장이 특히 이뻐유 ㅠㅠ제가 짱웜따리(?) 인데 늦개강 하게되면 꼭 따라해볼래유❤️ 그리고 지는유 오히려 집에만 있으니까 입이 터져서 살이 막 쪄서 문제예유ㅠㅠㅠ 온니도 한끼만 드시지 마시구 맛있는거 많이먹구 행복하슈유❤️,12개
16,오조오조,"언니 영상 보는 게 요즘 집순이 생활에서 최고의 행복이라죠 ,, 오늘도 영상 즐겁게 볼게용 🍀💚",11개
17,CH96,"꺄아>.< 이게 얼마만의 겟레디윗미에여!!! ㅠㅠㅠㅠ 늘 이렇게 예쁜 메이크업 알려줘서 감사해오><💚💚💚 저 23살에 언니 영상 보고 처음으로 색조 화장을 시작했어요 ㅠㅠ언니 메이크업이 저한테 찰떡이라 ,, 언니 오늘도 영상 너무 감사해요💛💚💛💚💛💚",5개
18,HannaJang,친구네 싸강 썰ㅋㅋㅋㅋㅋㅋㅋ화상강의 때 여학생이 엔터를 누르자 엔터를 누르자 하면서 노래를 불렀다고윸ㅋㅋㅋㅋㅋ진짜 듣고 빵터졌어요. 저만 그러나요 근데 교수님이 공개 처형을.. 아 여학생이 노래를 잘 부르네요 모두가 듣고 있죸ㅋㅋㅋ 이랬다고하네욬ㅋ,15개
19,,ヨンジュちゃんが可愛すぎて、1人で「可愛い〜！！！！！」って叫んでました。,1개
20,남유램,졸귀ㅠㅠㅠ 언니 사랑해,4개
21,여진좌,무ㅜ야 떵싸다가 여자보고 반한 건 처음이에요 언니..대박 이뻐 모야모야,3개
22,하늘에서온천사,ㅋㄴㄹㅌㅌ몰뽑아.. 기둥뽑아ㅋㅋㅌㅌ완죠니 귀여워여 🙈🐵 오늘도 화장 디따 잘되구 이뻐요!̆̈ 저도 간만에 화장할때마다 어색하궁 쌩얼이 익숙해져서 크킄ㅋㅋㅋ@@ 렌즈도 대따 이뿌네여🐥 립도 징짜 잘어울리시능거가타여 👍👍,3개
23,박하은,헉 ... 화장영상 오랜만이다유ㅠㅠㅠㅠㅠ 언니 점점 이뻐지셔 증말..❤,4개
24,예희Yehee,"연두콩님 오늘도 역시 넘 귀엽고, 예쁘네유~ㅜㅜ 영상 재밌게 보고 갈게유우~!!",1개
25,호호호호호호,나중에 나갈땨 같이 보면서 준비 할게유ㅠㅠ 나가고 싶어 죽겠네유..,2개
26,박지수,울 두콩이 언니~~ 넘 코랄코랄 복숭복숭 동글동글 귀여우면 반칙아니에요?? 넘 이쁘자너유❤,2개
27,darling,않이언니....너무 예뿐건 말해뭐해고 말투 왤케 더 귀염뽀짝해졌쥬?!!!?? 하 언니라고 하기 민망할 정도로 너뮤끼여워욕!!!!!!!❣️❣️❣️❣️❣️ 연두콩님 끼여웍!!!!,1개
28,남유램,언니 렌즈 정보 알수잇어용..?? 너무 이쁘ㅠㅠ,2개
29,에틴,언니 사랑해요ㅠㅠ 얼마만에 같이 준비해요ㅠㅠㅠ❤️❤️🥰🥰,2개
30,mHa,언니는 왜 나이를 안먹는거 같어요ㅠㅜ!! 나랑 친구라 해도 사람들이 믿겠어🤭💕,1개
31,김지원,연두콩언니 목소리들으면 되게 위로가 되네요 !ㅠㅠ(요 몇일 너무너무 힘든 하루들 겪었어요 ㅠㅠ),1개
32,한지영,언니 진짜 너무 예뻐요ㅠㅠㅠㅠㅠㅠㅠㅠㅠㅠㅠㅠㅠ,0개
33,홍홍홍,썸네일 장인 ㅠㅠㅠㅠ 존예 귀염뽀짝은 연두콩님을 두고 하는말인듯 ㅠㅠㅠ 근데 블러셔 진짜 잘어울려요 인간 블러셔 연두콩,0개
34,오설,"어떤 교수님은 원격강의 할 때 학생들이 잘 듣고 있는지 보시겠다묘 카메라 키라고도 하세요. 그건 딱히 문제는 아니지만, 우리집 강아지가 자꾸 책상위로 올라오고 노트북 가리고 관심 끌려고 난리쳐서.. 부끄럽답니다..",3개
35,주희콩,이영상을 얼마나 기다렸는가,2개
36,웅캬캬,울언니 오늘도 너무 사랑스러워유 ...,1개
37,N뮤뮤,"아니 울 언니 왤케 살이 빠졌대요 퓨ㅠㅠㅠㅠㅠ 하루에 한끼먹지 마시구 세끼 꼬박꼬박 잘 챙겨드세요 언니💓💞💘💗💕 저도 대학생이라서 요새 싸강듣지만 전,,, 다 녹음되어있는 파일로 듣기 때문에 울학교 노잼,,, 암튼 울 언냐 요새 코로나 땜시롱 난리인데 더 몸 건강히 챙기세요 언니 오늘도 잘 보고 가용💞",2개
38,이지원,헉 저희집에서 남한산성 얼마 안걸리는데 ㅠㅠㅠㅠ,1개
39,차태식,생얼이 너무 애긴데...? 이 얼굴이 어떻게 서른이냐구ㅠㅠㅠㅠ,0개
40,변백현사랑해,언니 정말 사랑스럽게 생긴거같아요ㅠㅠㅠㅠㅠ지켜주고싶게 생겼어욥ㅜㅜㅜ넘 귀ㅜㅜㅜㅠ❤️❤️❤️❤️,1개
41,OWOL,언니 나는 원래 고양이상 악개인데 첨으로 사랑에 빠지게 된 강아지상이 언니야 사랑해ㅠㅜㅠㅠㅠ...,0개
42,유갱이,썸네일 너무 이뻐서 호다닥 달려왔어유 ㅠㅠㅠㅠ 미모 미쳤다리,0개
43,Tnalss,"오늘도이뻐유ㅜ
낼 화장하면소 또 볼거에유 🥺❤️❤️",1개
44,hyeonseo,"썸네일 너무 이뻐서 들어왔슈 ~ 💜
맨날 이렇게 귀여운 옷은 어디서 들고온대유 
이날 입은 옷 궁굼해유",0개
45,정소희,아무리봐도 오늘 존예탱탱 ㅎㅎ 항상이쁘시지만 오늘 뭥징 @@,2개
46,김사랑,교수님께서 교수님 집에서 촬영을 하셔가지고 말로만 들었던 교수님네 강아지가 자주 등장했어요ㅎㅎ,0개
47,김사랑,"이번에 립 보고 또 장바구니에 넣어버렸어요 ㅋㅋ 아, 그리고 저는 영어학원에서 온라인 수업을 듣는데, 화면에 가끔씩 동생들이 난입해서 마이크 뺏어가는 경우도 있었어요..!!",1개
48,Chloeee,꺄라아아악 겟레디윗미 너무 좋아요🥺💓,1개
49,김아라,"요즘 마스크써서 화장을 대충하고
다니는데ㅠㅠ 뭔가.. 두콩님 영상보면서 대리만족 하게되는:) 💕",0개
50,예림,언니 넘 이쁘셔유ㅠㅠ 항상 언니 영상보면서 용기도 얻고 힐링하기도 해요♡ 코로나 조심하시고 좋은 하루 되세욤😊,0개
51,주희콩,그냥 연두콩님 다 하고 싶은것들 다 하시유❤️❤️❤️,1개
52,박수진,"안녕 두콩언니? 덕분에 삼주째 야금야금 리벤지 정주행중이야! 처음에는 미쳐가지고 계속 보다가, 요새는 낮에는 일하고 밤에 자기전에만 한편씩 보고있어! 좋은 미드추천 고마웡🌝 앞으로도 종종 부탁해🌼 건강조심!",1개
53,ssh00,언닌 왜 갈수록 어려지시나유ㅠㅠㅠㅠ 오늘도 여전히 예뻐유❤️❤️,0개
54,딸기,일찍 왔지요 ❤️❤️,1개
55,정민아,너무 사랑스러뷰ㅠㅠㅠㅠㅠㅠ😭😭😭😭😭😭😭😭😭♥️,0개
56,SooYummy수야미,아이그 너무 상큼해서 샌애기 같구만유 💚💚저두 낼 립 먼저 바르고 메이크업 해볼게유 💚💚영상 고마워유 💚💚,1개
57,김가윤,6:41에 셰이딩을 안한걸 몰랐던 이유는 두콩님이 원래 턱살이 없으셔서 그래요!!,1개
58,yeeunP,"연두콩님 미모 다 거품이라면서요...








언빌리버블...
어도러블... 어메이징... 어썸 연두콩님>,<",1개
59,쮸쁘미,악ㅠㅜㅠㅠ너무 예쁘시잖아요,0개
60,지금은희망으로,요정님이 따로 없네 흐미 예뻐죽겄슈 💓,2개
61,작콩,언니 너무 이뻐요ㅠㅠㅠㅠ,0개
62,선구름Suncloud,썸네일 보고 너무 귀여워서 홀린듯이 들어왔어요....💗,0개
63,정원숙,언니 너무 이뻐요 코로나 조심 하세용~~,1개
64,권나연,오늘 또 힐링하러갑니다유 항상 감사혀유❤️❤️❤️💜🥳😊💜💜언니영상보는건 시간이 아깝지않아유 ㅠㅠㅠ💜🙏🙏시간이값져유 언니영상보는순간은🥰🥰,1개
65,연소,요즘 영상 자주올라와서 연두부로써 넘 기뻐요💚💚💚오랜만에 외출이라니..그래도 코로나 조심하세요😭😭항상 좋은 영상 넘 고마워요❤요즘 집콕인데 언니 영상올라와서 넘 기쁩니다💚,1개
66,디카취,인간살구가 따로 없네요 ㅎㅎ❤️연두콩님은 나이를 안드시는 듯..저만 나이를 먹나봐요,1개
67,민서MINSEO,"깜찍 앙증 귀여운 연두콩님 💚💚💚
ㅋㅋㅋㅋ 넘넘 귀여워요 🥰🥰",0개
68,미깰라띵뿡빵,언니... 왜 벚꽃놀이 영상 없어진 것이여유 ㅠㅠ 이제 슬슬 꽃 피길래 재탕할라구 찾아봤는데 없어가지구 넘 슬퍼유 엉엉 아니면 2020 버전 벚꽃놀이 메컵 어때유 꽃 보러 가지는 못하지만 집에서 기분이라도 낼라구유 ㅠㅠ ㅠ,0개
69,Mild,저 빨리왔나요?? 먼저 댓글 달구 다 보면 다시 댓글 달게요!!,1개
70,규리,언니 반묶음 해주세여.......ㅠㅠㅠㅠㅠㅠㅠㅠㅠㅠㅠㅠㅠㅠㅠㅠㅠㅠㅠㅠㅠㅠㅠㅠㅠ❤️❤️,0개
71,김수아,"와,, 내리는데 썸네일이 넘 예뻐ㅓ서 안 들어올 수가 없엇네요 ㅜㅜ ❤️❤️❤️❤️❤️",0개
72,지현,언니!!!코에 하이라이터 하실때 쓰신 브러쉬 어디꺼예용ㅠㅠ 너무 좋아보여서용,0개
73,뽀양피뷰,진짜 예쁘다...거울만 봐도 행복할듯,0개
74,뽀잉,헐 겟레윗미 너무 조아요😱💗 메크업 짱예뻐여 진짜...,0개
75,옴뇸뇸,두콩언냐 영상이다아💛,1개
76,김지니,헐 블러셔 패키지 귀여워..🥺,0개
77,유자,2:45 헉 영상보다가 깜짝놀랬어요😆 제 댓글이 영상에 나오다니!! 완전 대박ㅠ 언니영상 다보고 또 싸강들으러갑니다...(오늘은 맥주없어요오..ㅎ) 이번 영상 진짜 넘 이뻐여💚,0개
78,챨스네집,어머. 인트로 영상에서 부터 두콩두콩 ~~,0개
79,서희주,난 진짜 우런니 편집이 제일이야 ... 언니 ... 날 가져요 ...❤️❤️ 진짜 어딜 봐서 서른 ..? 중학생이라해도 난 믿을게 .. 사랑해 두콩언니 🙆🏻‍♀️,0개
80,Oasisunni오아시스언니,연두님 넘 상큼하구 말도 이쁘게 하시구❤ 요런 착하구 귀엽고 야무진 동생 있었음 좋겠어용😊,0개
81,박민영,"진짜 너무이뻐요!! 항상영상 재미있게 보고있습니다 조금 부끄러운 말이지만 진짜.....                  





사랑해요!!!!❤️❤️❤️",0개
82,corvok,연두콩님 솔직히 이번 영상 매우 커여우신거 아시나요?,1개
83,손삭,7:26 반묶음 짱이쁘다,0개
84,GY가영,진짜 넘 귀여우시당!!,0개
85,꽥꽥오리는,언니 오늘도 예쁘시네요 .. ㅠㅠㅠㅠㅠ,0개
86,서영,뭐시여 내가 두콩언냐 겟레디윗미를 을마나 좋아하는디 알림이 지금온겨!!!!!! 시방 당장 볼게유😤❤️,1개
87,소원,우와 미처ㅓㅅ써흫 3분전이다 우아 존버는 승리한다 ..!!♥️♥️,0개
88,윤서,와 화장 진짜 잘하신다...!!!!😍,0개
89,담소05,저는 너무 집콕해서 메이크업까먹은거같아요..ㅠㅠ,0개
90,ChaeYoung,와... 썸네일에 미친듯이 끌려왔습니다... 오늘도 아름다우셔❤ 영상 잘 볼게여!! 감사해여🌸🌸,0개
91,migivlog,コーラルメイク可愛いです💕,0개
92,궁그매,왴ㅇ케 이쁘셔요 ㅠㅠㅠㅠㅠㅠㅠ,0개
93,김해자,언니 봄 블러셔 추천해주세요 ㅜㅜㅜ,0개
94,채롱언니,언니 나이를 어디로 드시는거쥬..ㅠㅠ최강동안👍,1개
95,에스포뷰티SFORBEAUTY,와 연두콩님 영상 잘 보고 있습니다^^ 저희 채널에 재미있는 메이크업 콘텐츠가 있으니 놀러오세요 ㅎㅎ,0개
96,태디,눈이 진짜 보석이다..,0개
97,윌벤져스사랑해,싸강 곧 듣는데 기대되욯ㅎㅎㅎㅎㅎ 엉니 겟레디 오랜만에보니까 넘 쥬나요,0개
98,임슬기,헐 연두콩님 어제 딱 데일리 메이크업 올려달라구 했는데 이렇게 통해버리기 있나욤~!!🤍♥️🤍♥️,1개
99,하수진,진짜 동안이시다....❤️,0개
100,심은,언니 알림뜨자마자 왔어요!! 요즘 언니영상 정주행하는게 제 유일한 삶의낙..💚💚💚💚,1개
101,지민,헙 썸넬보고 들어왔어ㅛ..,0개
102,박초현,이번 영상 레전드 진짜 이뻐요,0개
103,DI,언니 영상 속 브러쉬 정보 주세요 ㅠㅠ,1개
104,김예빈,근데 언니•• 20학번은 억울하고 돈 아까워 웁니다 😭 (예체능••••) 그리구 언니 혼자있어도 꼭 밥 챙겨드세요!!! 한국인은 밥심이라구욧!,0개
105,,저는 휴학생이라 싸강 귀엽다고 생각했는데 애들은 등록금아깝대요ㅠㅠㅠ,0개
106,이효림,잘보구가요옹❤️ 메이크업 영상도 넘 좋아요옹💕,0개
107,조미희,두콩님 ㅠㅠㅠㅠㅠ 영상속에 입으신 옷 넘 궁굼하용 ㅠㅠㅠㅠㅠㅠㅠㅠㅠㅠ 😭,0개
108,김김,영상 잘봤어용 ㅎㅎ저눈 과 교수님 두분이나 실시간 강의를 하셔서 ㅠ원래2시에 일어나는데 일찍일어나는게̌̈ 넘 힘두네욥..쩝 다 제가 게으른 탓이쥬 ㅋㅋ강의하다가 교수님이 제이름 부르면서 질문하셨는데 모르는거라 어버버하는거 동기들이 다보고ㅠㅍ퓨ㅠㅠㅠ 서럽고 부끄러워요 언니ㅜㅜㅠㅠ그리구 원래 개강하면 투머치백 맨날 매줘야하는디..그것두 아쉽구 그러네유~ 사랑해유❤️,1개
109,현아,두콩님 오랜만에 브러쉬들 추천하는 영상도 괜찮으시다면 보고싶어요 !!☺️,0개
110,유하린,언니 대박이에요 왜이ㅓㄹㅎ게 이쁘지 천우희 닮았어요 🤭,0개
111,선영은,꺄 온니 사랑해여♡,0개
112,김콩이,ㅎㅎ이뻐요~🥰눈화장도 음영 장난 아니네요,0개
113,TaewonJung,레전드다 너무 예뻐요..,0개
114,달덩어리,언니는 뭘해도 너무 예뻐요~~♡♡,0개
115,ucha,可愛い好き〜(  ˊᵕˋ  )♡,0개
116,피리토끼Piritokki,기요웡 ㅠㅠㅠㅠㅠㅠ,1개
117,이희숙,어구 귀엽고 사랑스러워라♡♡,1개
118,김예은,넘 예뽀요 언니... 저런 색감 너무 찰떡..,0개
119,세롱이,처음에 입술 바르실때 와색이쁘다 라고 생각했는데 뒷부분에 또 바르시는색보고 감탄 했어용🤩 색조합이 너무 예쁘세요 !,0개
120,JuHui,언니 제가 얼마전에 페리페라 쉐딩 1번을 샀는데 너무 붉은 끼가 돌아요ㅠ 웜톤인데 쿨톤인 쉐딩을 사야되나요?ㅠㅠㅠㅠㅠ 자연스럽게 하고싶은데 무슨 쉐딩을 써야될까요?,0개
121,윤경열,연두콩님 메이크업 넘이쁘세요♥ 영상잘보고가요^^,1개
122,다현,김태리 배우 닮았어요ㅠㅠ,0개
123,유키,前髪のセットの仕方を教えてほしいです！,0개
124,김진덕,언니 너무이쁘다...🥰,0개
125,김민정,짱귀여.........,0개
126,원댕,귀여워요 두콩 언닝💜,0개
127,포도쨈,태연인줄 알았네여 너무 예뻐요 코랄도 잘 어울리고 데일리 메이트크업으로 참고해도 예쁠고같아요ㅠㅠ갓연두ㅠㅠㅠㅠㅠㅠㅠㅠㅠㅠ,0개
128,와딘,언니 저도 공부하느라 화장 다 까먹었는데 이거 보고 초고속 메컵하고 나가야짘ㅋㅋㅋ (낼 두달만에 친구만나효~ㅠㅠ),0개
129,또잉이,이쁘네유 ••• 코로나 조심혀유 ~~ !!,0개
130,신다인,이 화장 그대로 내일 외출 갈겁니다!!!!!!,0개
131,남승경,저는 그냥 언니가 좋아유~☺,0개
132,주희,아 이언니 진짜 너무 이쁘네????,1개
133,례힘,"두콩림,, 지가 많이 아껴유💚",0개
134,EUNBA은바,언니 제가 진짜 여드름 안나는 피부인데 한번 약  잘 못먹고 2달 동안 엄청 고생하고 있는데 ㅠㅠㅠ 나아질 방법이 없을 까욤..ㅠㅠ,0개
135,,かわいい！,0개
136,푸딩,저도 연두콩님이랑 또래인데 나이들고 얼굴살 빠졓어요ㅋㅋ,0개
137,WooDong,우와 이쁘다 ㅎㅎ,0개
138,KangDanity,可愛すぎ,0개
139,l혜린,"그렇다 두콩언니는 구냥 매일매일이 리즈셨던것이닷!😯😍
이번 메이크업 진짜너무너무 예쁘고 귀욥구 언니랑도 잘 어울리구 따라해보고시퍼여ㅠㅜ!!
두콩언니 왜 점점더어려지시구 예뻐지시구 귀요어지시구 그러시는거쥬! 심쿵하게💗",0개
140,뇸뇸,언니 에뛰드 허쉬 쿠앤크 팔래트로도 화장해주시면 좋겠어요ㅠㅠ💓,1개
141,조수아,진짜 너무 동안이시당,0개
142,이윤진,언니.. 살 너무 빠지셨다고 하니까 걱정되네여.. 건강하세요😭,0개
143,박주애,너무 예뻐요♥,0개
144,민트,두콩님 정말 고등학생이라해도 믿을 것 같아요..!🙈,1개
145,CoffeezombieGreat,0:39 헠 ~ 누구세요?,0개
146,요하,너무 예쁜디,0개
147,뀨잉뀨잉큐,저는 사이버강의를 ppt만 달랑 올리고 끝이네요😭 등록금이 아까워 죽겠어요ㅠㅠ,0개
148,,언니는 나이를 진짜 안먹나봐...나만 먹나봐...,0개
149,NetnapaKaewmuwang,말할 태국어가 있습니다. 매우 귀여워서 태국에 자주 오십시오.,0개
150,다빙꾸,넘예뽀여온니..,0개
151,신민민,조아써! 내일 화장은 두콩님과 함께 한다! 내일 아침에 봐여 두콩님ㅎㅎㅎ (꾹참고 안보고 내일 아침에 볼 예정),0개
152,김민채,아유 한끼 먹으니까 빠지쥬 ㅜㅜ 아유 걱정이구먼유 한끼가 뭐여유.. 그래도 두끼는 먹어야쥬 건강이 최고여유 아프면 안도ㅑ유!! 잘 챙겨드셔야쥬 저희 교수님은 과제를 그렇게 내주셔유.. 차라리 학교 가고 싶구먼유..,0개
153,섬소녀,언니 비제이 하콩언니랑 둘이 너무 닮았으용!!,0개
154,박혜인,오늘 역대급 미모 두콩님....🥺20학번 샌애긔라구 해도 믿겠어요 ~~~~>_<,0개
155,jinyeongkim,편집자님이 따로 있으신가요??? 편집 스타일?이 너무 좋아요ㅠ,0개
156,해인,두콩님 넘 사랑스러워용 ㅠ,0개
157,서현,쌩얼이 이렇게 예쁘다고요?!😆❤,1개
158,minngkimm,"언니 상상만큼 싸강은 좋지 않답니다.. 공대등록금이 얼만데 실험도 안하고,,, 좋은데 나쁜 이기분",0개
159,2주스,오늘 머리부터 화장까지 한층 더 존예십니다ㅠ,0개
