,youtube_id,comment,like_num
155,Queenofthorns,"Omgg💜 ME ENCANTO EL VIDEOOO😭llegué tarde:( Pero aquí estoy ya jaja
💕Por fin pude verte hablando español, no esperaba menos de mi youtuber favorita💕💕💕  Y te ves tan linda como SIEM-PREEE🤩💖
A mi parecer tienes un amplio vocabulario y super fluido, además lo hablas excelente🙌🏻🥰 Y tienes razón al decir que tu voz suena muy tranquila, a mí hasta me relaja y me encanta, creo que es muy tierna😍💜
Ahora éste es mi video FAVORITO jeje🙌🏻❤💖 Gracias por subirlo🥰 te quiero muchomucho😘😘 Saluditosss",0개
156,FabiolaPalacios,"Me encanto como quedo tu maquillaje 😻, ademas hablas perfecto el español 👌🏽 🧡.",0개
157,CarolinaGri,"Me encanta tu voz en español y coreano❤️❤️❤️ todo va a estar bien! Me encantó, eres muy bonitaa!!! Saludos desde México!",0개
158,JuranyMuozMartinez,"Me encantas tus videos especialmente los de español claro 😁
Tengo una pregunta... Como te acoplaste al cambio de culturas que es tan diferente entre ambos países.... Saludos desde Colombia 🌹❤️🌺",0개
159,BrisaCarelf,"Hola~~ Me gustan tus videos y tus maquillajes,aparte de que puedo entender algunos videos ya que me encanta cuando hablas español. Lo hablas muy bonito y fluído.

Me dicen el nombre de la canción?:(( porfis,la del inicio.

Saludos desde México",0개
