,youtube_id,comment,like_num
0,전혜진,빤스자랑쟁이... 못말려 진짜..,21개
1,이예린,도대체 저만큼 늘어나는 팬티가 있는 이유가 뭐야ㅋㅋㅋㅋㅋㅋㅋㅋㅋㅋㅋㅋㅋㅋㅋㅋㅋㅋㅋㅋㅋㅋㅋㅋㅋㅋㅋㅋㅋㅋㅋㅋㅋㅋㅋㅋㅋㅋㅋㅋㅋㅋㅋㅋㅋㅋㅋㅋㅋㅋ 그만큼 편하다는건가?ㅋㅋㅋㅋㅋㅋㅋㅋㅋ,23개
2,Skyophelia,아닠ㅋㅋㅋㅋ 여기가 뷰티채널을 빙자한 속옷전문채널이얔ㅋㅋㅋㅋㅋㅋ 얼마있다가 뷰티영상보다 속옷방송잌ㅋㅋ더많아지는거 아니죠???,16개
3,백척,아이앀ㅋㅋㅋㅋㅋㅋ 저 썸네일보고 어떻게안들어왘ㅋㅋㅋㅋㅋㅋㅋ,992개
4,권현지,"씬님채널 :방앗간
권현지: 참새 
여긴 방앗간이고 저는 참새입니다. 지나칠 수가 없네요 빵꾸난 빤스가 참 인상적이네요🤪",842개
5,최현서,역시 태생이 속옷유튜버였어..씬님은...👙👙,695개
6,정민교,나는 왜 뷰티유튜버의 속옷 리뷰 알림에 이리도 열광하며 달려오는가.......,421개
7,처돌이,이 썸네일보고 어떻게 안들어와욬ㅋㅋㅋㅋㅋㅋㅋㅋㅋㅋㅋㅋㅋㅋㅋㅋ,578개
8,서윤채,모짜렐라 치즈도 저렇겐 안 늘어날텐데,195개
9,얌얌야미야미,14:44 언니 이거 안샀어요? 언니한테 찰떡인데,216개
10,Hansum,언니의 빤쮸사랑을 보고 하나 조심스래 추천합니댜.. 베이코(한국꺼)라는 사이트에  풍기인견이라는 빤쮸가 있습니다. 정말 강추 완전 편해요.. 널널한 옷입으면 안입은듯한 착각을 느낄 수 있습니다..:),183개
11,용담,이정도면 씬님 팬티사러 미국가시죠?ㅌㅌㅋㅋㅋㅋㅋㅋㅋㅋ,292개
12,랄루랄루,첫번째 샵 뭔가ㅋㅋㅋㅋㅋㅋ.... 밖에서 보기엔 안도 삐까뻔쩍 할것같은데 의외로 들어가니까 약간 돈키호테식 DPㅋㅋㅋㅋㅋㅋㅋㅋ 한번 가보고싶어요ㅋㅋㅋㅋㅋㅋㅋ,214개
13,용담,참새와 방앗간이라니...... 씬님에게 속옷가게란... 마음의 고향같은 그런거...?★,238개
14,o3o,16:27 와... 발음 영어사전튼줄,21개
15,후앵,14:44 이거 너무 이쁜데여???ㅠㅠㅠ,445개
16,킹태민,"지나가다가 우연히 댓글이마주쳐

모든사람들이 행운이 가득하길빕니다

오늘하루모두 수고하셨습니다",49개
17,투명케찹병,ㅋㅋㅋㅋㅋㄲㅋㅋㅋㅋㅋ 경기도 방구석에 앉아서 미국 빤스 트렌드 알 수 있는게 넘 웃겨ㅜㅜ,20개
18,JinAh,언늬.. 속옷 하울 영상 올라올 때마다 얘기하는건데 제발 킴 카다시안이 낸 언더웨어 라인 Skims 하울 해주세영 ㅜㅜㅜㅜ,130개
19,김소현,"언니 진짜 진지하게 나중에 속옷 브랜드 런칭해줘요..
ㄹㅇ 잘 될거 같다고요ㅋㅋㅋ",56개
20,SimBa,"빤스 안 보구 계속 루키 보고 있었는데
16:03 루키야 뭐 봤길래 꼬리 움직임이 그래?ㅋㅋㅋ",32개
21,JiHyeLee,6:23 앜ㅋㅋㅋㅋ내가 대신 당황스러워...,54개
22,jko,14:43 아닠ㅋㅋㅋㅋ이 부분 전까진 다 가슴 모자이크인데 여기부턴 갑자기 모자이크가 왜 배로 가욬ㅋㅋㅋㅋㅋㅋㅋㅋㅋㅋ,51개
23,MustardMayo,19:25 뒤에 구경하는 하츠도 놀라는 늘림 파워 팬티 ㅋㅋㅋㅋㅋㅋㅋㅋㅋㅋㅋㅋㅋㅋㅋㅋㅋㅋㅋㅋㅋㅋㅋㅋㅋㅋㅋㅋㅋㅋㅋ,66개
24,아프리카청춘이다,"나 : 아 이제 자야지...
유튭 : 야 속옷하울 영상 보러왕
나 : 아 뭐래...
유튭 : 빤스 개잘늘어나는것도 있는데?
나 :",22개
25,이은채,"썸네일이 참 씬님 스럽네요ㅋㅋㅋ




제 스타일 이기도 하고여(크흠...)",61개
26,yeeunkeem,6:20 웃겨서 죽겠어욬ㅋㅋㅋㅋㅋㅋ,12개
27,썰면한접시,시작부터 똥구멍에 바람ㅋㅋㅋㅋㅋㅋㅋㅋㅋㅋㅋㅋㅋㅋㅋㄱ,44개
28,KimZoe,2:20 가게 내부는 뭔가 들어가면 안 될 법한 인테리어야,35개
29,의대생연붕이,모짜렐라 치즈도 저렇게 안늘어날텐데 ㅋㅋㅋㅋㅋㅋㅋㅋㅋㅋㅋㅋㅋㅋㅋ......,23개
30,렘,와 대박 근데 진짜 와 대박 팬티가 와 실뜨기 실보다 실이 덜 들어갔을 거 같고 좋네요 와,30개
31,서네,모짜렐라 인 더 빤스☆ ㅋㅋㅋㅋ썸넬 보고 허겁지겁 왔습니다ㅋㅋㅋㅋ,27개
32,RIMRIM,아 세상에 내 웃음 동영상 올라왔네여 아 진짜 행복햌ㅋㅋㅋㅋㅋㅋㅋㅋㅋㅋ언니 다른 동영상도 좋고 재밌고 보면 행복하지만 속옷 리뷰가 진짜 제 웃음벨ㅋㅋㅋㅋㅋㅋㅋㅋㅋㅋ이런거 좋아해서 죄송해요ㅠㅠㅠ근데 언니 표현력도 진짜 찰져여ㅠㅠㅠ엉엉 재밌어ㅠㅠㅠㅠ언니 덕분에 진짜 또 한창 웃었어요ㅠㅠㅠ감사해요 허엉ㅠㅠㅠ,28개
33,LaLaHa,언닝언닝 그 곽토리님이랑 옷 바꿔입는 컨텐츠 마지막 옷 정보 뭔가요!?!ㅠㅠ 아직 답글이 없으시네유,35개
34,silverChoi,나 ...이언니 속옷 살때마다 완젼 설램 ㅋㅋㅋ 돈 벌어서 속옷만 살것 같은 기세와 눈빛 ㅋㅋㅋㅋㅋㅋ,10개
35,JihyunKim,"19:26 아 놔 진짜 빵터짐!! 근데 에어리 진짜 소재 너무 부들부들 짱 좋아요!! 단점은 씬님도 말씀하셨지만 자주 입으면 늘어나서 1년이상 못 입음 ㅎㅎ 
22:21 으악!!!!!으하하하ㅏ하하카ㅏ카캭 크크큭!!!",17개
36,김민지MinjiKim,20:02~20:08 뒤에 회색고양이 이때보고 진짜 조각상인줄 그래서 움직일때 깜짝 놀랐어ㅠ,10개
37,도연,근데 씬님 한국 부라자들도 하울 찍어줘요ㅜㅜㅜㅜ 한국부라자들 넘나리 불편해서 지대짱나,8개
38,김나경,6:51 ㅋㅋㅋㅋㅋㅋㅋㅋㅋㅋㅋㅋㅋㅋ이정도면 세뇌수준아닌가여,24개
39,밴드오브브라더스,"아 친구분
오마이가쉬
진심 리얼 oh my goshhhhhㅋㅋㅋㅋ
팬티 허벅지 늘리는데
나쓰러졌네 어이구우우우",13개
40,행운성,존버 성공이다,18개
41,김승재,아니 이제 여기 뷰티말도 속옷 채널이얔ㅋㅋㅋㅋㅋㅋㅋ언제부텈ㅋㅋㅋㅋㅋㅋㅋㅋㅋㅋㅋㅋㅋㅋ 저 매일 언제 나오나 기대중이었움ㅋㅋㅋㅋㅋㅋㅋ,21개
42,이숨,인생팬팈ㅋㄱㅋ앜ㅋ늘어날때 진짜 깜짝놀랬네,7개
43,spacedaughter,스크롤 내리다가 웬 치즈가????하고 다시 봤더니 팬팈ㅋㅋㅋㅋㅋㅋㅋㅋㅋㅋ,4개
44,베키박스Beckybox,19:25 ㅋㅋㅋㅋㅋㅋㅋㅋㅋㅋㅋㅋ앜ㅋㅋㅋㅋㅋㅋㅋㅋㅋㅋㅋㅋㅋㅋㅋㅋㅋㅋㅋㅋㅋㅋㅋ 아 진짜 웃다가 뒤로 넘어갓넼ㅋㅋㅋㅋ 앜ㅋㅋㅋㅋㅋ 사랑해여 언닝ㅋㅋㅋㅋㅋㅋㅋㅋㅋㅋㅋㅋㅋㅋㅋㅋㅋ,3개
45,박정하,25분 순삭ㅋㅋㅋㅋㅋㅋㅋ 너무.속옷 하울인데 왜이리 재밋죠,1개
46,강도연,19:36 아니 ㅋㅋㅋㅋㅌㅌㅋ어ㅐㅋㅋㅋㅋㅋㅋ아 너무눗곀ㅋ큐ㅠㅠㅠㅠㅠ,6개
47,jun금손이지니,아 진짜 누가 속옷유튜바 1등하래요 씬님땜에 좋아 미치겠네ㅋㅋㅋ,17개
48,피곤도키도키,24:04 웃음버튼ㅋㄱㅋㄱㅋㄱㄱㄱ앜ㅋㄱㄱㅋㄱㄱㄱ,7개
49,안녕하세요,ㅋㅋㅋㅋㅋㅋㅋㅋㅋㅋㅋㅋㅋㅋ아니 이언니 미쳤나봐ㅠㅠ 뒤로 갈수록 미쳤어ㅋㅋㅋㅋㅋㅋㅋㅋㅋㅋ❤️,5개
50,UE,"에어리 진짜이쁘네ㅜㅜ 
아그거랑 털 슬립 강추 개강추ㅋㅋㅋㅋㅋㅋㅋㅋㅋㅋㅋ",0개
51,킹나무,우리나라 탑 팬티리뷰 유투버ㅋㅋㅋㅋㅋㅋㅋ,4개
52,김주희,"그녀의 신상
이름,씬님
특이점,뷰티유튜버에서 뺀티 브라자전문유튜버로 전직",10개
53,나야나,귀엽다면서 엉덩이 흔든거 ㅋㅋㅋㅋㅋ 빵터졌어요 ㅋㅋㅋ 씬님 속옷 후기 넘 재밌어요!,3개
54,l양갱,이러다가 팬티런칭해서 홈쇼핑에 나오는거 아니에여 ㅋㅋㅋ그럼 살래,2개
55,BonnieKim,바로똥을싸다뇨 언닠ㅋㅋㅋㅋㅋㅋㅋㅋㅋ아 진짜 너무 웃겨,1개
56,kelly1225,남 빤스사는거 보는게 이렇게 재밌는 일인감...🙈,4개
57,버나,이언니는 돈쓸때도 재밌냐ㅠㅠ내가본 광고가 아깝지않아ㅋㅋㅋㅋㅋ,4개
58,뭐야넌,아니 해시태그 씬님팬티 먼데 ㅠㅠㅠ큨ㅋㅋㅋㅋㅋㅋㅋㅋㅋ큐ㅠㅠㅠㅠㅠㅠㅠㅠ,10개
59,양양,"숨김없고 가식없고~~!!
언제 5탄을 볼 수 있을지 ㅠㅜ 코로나 조심하세요오❣️",4개
60,Seol예지,ㅋㅋㅋㅋㅋㅋㅋㅋㅋ너무 웃곀ㅋㅋㅋㅌㅋㅋㅋ 그놈의 매칭팬팈ㅋㅋㅋㅋㅋㅋ,2개
61,파이Pie,속옷 맞깔나게 알려주는 뷰티유튜번 언𓆗𓂭 바께 없을꺼여 ㉵ 징쫘 부라자부터 y빡에다㉮ 종기나서 네모팬티 샀다가 디게많이 실패를 했다는 그런 이야기 이야 🤩 네모팬티 살뻔했다㉮ 내 통장쓰를 지켰다는 전설⍤⃝𓂭 ..😂,13개
62,mmm,하 이 언니 뷰티유튜버인데 속옷리뷰가 진짜 너무 맛깔남;; 하 이러시면 너무 좋다구요,1개
63,,아 진짜 빤스 사는거 너무 재밌어ㅋㅋㅋㅋ,2개
64,윤하,ㅋㅋㅋㅋㅋㅋㅋㅋㅋㅋㅋㅋㅋㅋㅋㅋ언니 가둬두고 속옷리뷰만 찍게하고싶어요ㅜㅜㅜ여기가 맛집ㅋㅋㅋㅋㅋㅋㅋㅋㅋㅋㅋㅋㅋ저두 저번에 언니리뷰보고 미국에서 빅시랑 에어리 다녀왔어요 많이 건지진 못했지만ㅜ0ㅜ,1개
65,용담,저 빤티 요가할때 땅기는 그 손수건같이 생긴거 아니에요...?,6개
66,CHAENI,ㅌㅌㅌㅋㅋㅋㅋㅋㅋ봐봐 하면서 보여주니까 실시간 영통하는거같앸ㅋㅋㅋㅋㅋㅋㅋㅋ대답하구있는 나를 발견,1개
67,,진짜 언니 속옷 리뷰 영상 너무 재밋어요ㅠㅠㅠㅠㅠ한국에도 저런데 있엇으면ㅜㅠ,3개
68,yuejin,인스타에서 보고 얼마나 기다렸는지 몰라요ㅠㅠㅋㅋ 속옷 쇼핑은 역시 씬님과 함께♥,6개
69,이진,ㅋㅋㅋㅋ 아 시작부터 존나 웃기다 전 참새구요 여긴 방앗간이에요 ㅋㅋㅋㅋㅋㅋㅋㅋㅋㅋㅋㅋㅋㅋㅋㅋㅋㅋㅋㅋㅋㅋㅋㅋㅋ 언니!! 진짜 사랑해!!,4개
70,꿀꽈배기,아니 무슨 빤쓰가 모짜렐라피자처럼 늘어나네 ㅋㅋㅋㅋㅋㅋㅋㅋㅋㅋㅋㅋ,2개
71,꼬마마법사,19:25ㅋㅋㅋㅋㅋㅋㅋㅋㅋ아진짜 미쳤냐곸ㅋㅋㅋㅋㅋㅋㅋㅋㅋㅋㅋㅋㅋㅋㅋㅋㅋㅋㅋㅋㅋ,1개
72,홍석천머리끈,9:02 이게 뭐얔ㅋㅋㅋㄱㅋㄲㅋㄱㅋㄱㅋㄱㅋㅋㅋㅋ,6개
73,이채원,진짜 궁금해서 그런데 언니 속옷 서랍한번만 보고 싶다..얼마나 많을까 궁금해 ㅋㅋㅋㅋㅋ,1개
74,눈누난나,새벽 두시에 팬티 리뷰를 보는 날이 올 줄이야..씬님최고,4개
75,Resonance,으앜ㅋㅋㅋㅋ 썸네일 보고 한참 웃얶넼ㅋㅋㅋㅋㅋㅋㅋㅋㅋㅋㅋㅌㅋㅋㅋㅌㅌㅋㅋㅋㅋㅋㅋㅋㅋㅋㅋㅋㅋㅋㅋㅋㅋㅋㅋㅋㅋㅋㅋㅋㅋㅋㅋㅋㅋㅋㅋㅋㅋㅋㅋㅋㅋㅋㅋㅋ,2개
76,치즈떡볶이,썸넬 보고 들어왔는ㄷㅋㅋㅋㅋㅋㅋㅋ ㅁㅊㅋㅋㅋㅋㅋㅋㅋㅋㅋㅋㅋㅋㅋㅋ 왜 그렇게 늘려욬ㅋㅋㅋㅋㅋㅋㅋㅋㅋㅋㅋㅋㅋㅋㅋ 얼굴은 왜 넣는거에욬ㅋㅋㅋㅋㅋㅋㅋㅋㅋㅋㅋㅋㅋ,2개
77,이션이,방구뀌는 구멍뭐옄ㅋㅋㅋㅋㅋㅋㅋㅋㅋㅋㅋㅋㅋㅋㅋㅋㅋㅋㅋㅋㅋㅋㅋㅋㅋㅋㅋㅋㅋ진짜 한번도 만나본적없는데 자꾸 왜 10년지기 옆집언니같냐고ㅋㅋㅋㅋㅋㅋㅋ개웃겨진짴ㅋㅋㅋㅋㅋㅋㅋㅋㅋ,2개
78,TotoroKim,루키ㅋㅋㅋㅋㅋ 등돌리고 있는거 너무 귀엽😂,3개
79,슭곰발,6:23 아언니진짴ㅋㅋㅋㅋㅋㅋㅋㅋㅋㅋㅋㅋㅋㅋㅋㅋㅋㅋㅋㅋㅋㅋ공감성수치오져서 제가 다 악 소리 냈어옄ㅋㅋㅋㅋㅋㅋㅋㅋㅋㅋ,13개
80,moomininahat,언니 속옷 하울 너무 재밌어서 안 볼 수가 없자나ㅜㅜ 첫 번째 수영복 안 사신 거 같지만 잘 어울렸어용 그리고 나중에 니플 패치 추천도 함 해주세용ㅜㅜ,1개
81,링링쓰,앝ㅋㅋㅋㅋㅋㅋㅋ진짜 씬님 천재에요 너무 재밌어,1개
82,보라고미,"믿보씬속뷰 ㅋㅋㅋㅋㅋㅋㅋㅋㅋ
믿고 보는 씬님 속옷 리뷰
존잼 폭ㅋ팔ㅋ 기대를 져버리지않는ㅋㅋㅋㅋㅋ",2개
83,김소영,빅시 진짜 예뻐서 어느순간 고르고 있다는거 핵공감이에요ㅋㅋㅋㅋㅋ근데 여긴 면팬티도 불편햌ㅋㅋㅋㅋㅋㅋㅋㅋㅋㅋ,1개
84,쌀람,이러다가 제가 나중에 미국가면 투어 내팽겨치고 빤쮸사야해!!!만생각나겠어요🤣 ((1브라 3빤스 언제나 기억중이에요...)),2개
85,박지윤,10:16 에 왜 영상이 뒤로감기 되있죠...?,1개
86,장은지,진심 썸네일 역대급이닼ㅋㅋㅋㅋㅋㅋㅋㅋㅋㅋ 안들어올수가 없자나요 씬님,1개
87,유소연,씬님 저 나중에 빅토리아 시크릿 가면 씬님 영상들 꼭!! 정주행하고 갈게요 ㅋㅋㅋㅋ 씬님 덕분에 좋은 정보를 많이 알게 되는 것 같아요!!! 😁👍,1개
88,OgigoB,후크없는게 찐으로 최곤데.. 없는거 입기 시작하면 있는거 쳐다도 안봄..,1개
89,SUN,"기다렸던 영상중 하나였어요ㅎㅎ 
허벅지~~~공감ㅠㅠㅋㅋㅋㅋㅋ
역시~~👍👍👍👍👍❤❤❤",1개
90,쭈야JJOOYAsMAKEUP,썸네일 대박이에여 팬티같ㅋㅋㅋㅋㅋㅋ,2개
91,hyunjinmin,"씬님 속옷 리뷰 너무좋아요!!!
피부도 예민하고 가슴은 커서 
편한 브라찾는게 너무 힘들거든요ㅠㅠㅠㅠ
국내는 죄다 편하구 예쁜 브라는 작은사이즈만 
있어서 따라서 구매하기좋아요",3개
92,고라니,외국은 진짜 속옷 다양하다ㅋㅋㅋㅋㅋㅋ,1개
93,Chloe,꺄라아ㅏㅏㅏㅏㅏ제가 좋아하는 속옷하울 벡시하울♡♡♡♡♡ 씬님이라서 해줄수있는 컨텐츠ㅠㅠㅠㅠ,1개
94,강민석,원조 속옷유튜버라고 해도 될듯ㅋㄱㅋㄱㅋㅋㅋ,5개
95,옹찌,6:22 ㅋㅋㅋㅋㅋㅋㅋㅋㅋㅋㅋㅋㅋ 대리 머쓱..^^;;,1개
96,마지,참새 방앗간ㅋㅋㅋㅋㅋㅋㅋㅋㄱㅋㄱㅋㄱㅋㄱㄱㅋㄱㄱ,2개
97,H헤르미온느,털슬립 너무 예뿌당....아 빅시도 처음부터 너무 예쁘다ㅠㅠㅠ,1개
98,강도연,"대박 대박 대박 ㅠㅠㅠㅠ 진짜 최고로 기다리던 그 영상 ,,,,🥺🥺🥺❤️❤️❤️",2개
99,,ㅋㅋㅋㅋㅋㅋㅋㅋㅋㅋㅋㅁㅊㅋㅋㅋㅋㅋㅋㅋ 썸넬보고 너뭌ㅋㅋㅋㅋㅋㅋㄱ웃겨섴ㅋㅋㅋㅋㅋㄱㄱ,2개
100,sun,17:59 이거 그거생각나욬ㅋㅋㅋㅋㅋㅋㅋㅋㅋ하이킥 정보석 우왕우왕우왕ㅇ~,0개
101,YJkim,언니 배 블러처리하신거 너무ㅋㅋㅋㅋㅋ 귀여우심ㅋㅋㅋㅋㅋㅋ 뒷태블러도ㅋㅋㅋㅋㅋ 우리 안구보호에 사명감 있으신ㅋㅋㅋㅋㅋ 사랑해요 씬님💞 이번 하울 보고 또 팬티 100장 따라살듯ㅋㅋㅋㅋ,0개
102,6류,아 빤쓰 부라자 영상 올라와서 너무 행복하다 ㅠㅠㅠㅠㅠ 잘 볼게요!!!!!,1개
103,경수,이제 속옷 진짜 만들어도 될것 같아욬ㅋㅋㅋㅋㅋㅋ 그냥 믿고살께욬ㅋㅋ 이렇게 팬티마니사는 사람은 제 인생에 처음이에옄ㅋㅋㅋ,0개
104,수현,언니 검은색 수영복 완전 청순 귀요민데ㅜㅜㅜㅜㅜㅜㅜ아쉽...😢,8개
105,haeinkim,22:01 아닠ㅋㅋㅋㅋ여기부터 말투뭐얔ㅋㅋㅋㅋㅋㅋㅋㅋㅋ 건성건성한듯 신경써주는 말투,5개
106,YUN쏘오오옥,ㅋㅋㅋㅋ언니 뷰티영상만큼 너무 좋아욘><,1개
107,뚜뚜,너무ㅋㅋㅋㅋㅋㅋ웃기고ㅋㅋㅋ그와중에 친구분 목소리 너무 좋아용~❤,0개
108,손톱NAILARTSONTOB,언닠ㅋㅋㅋㅋ속옷 리뷰 채널 같아욬ㅋㅋㅋㅋㅋ왠지 언니도 뭔가 더 신나보이구ㅋㅋㅋㅋ,1개
109,정회림,아 ㅋㅋㅋㅋㅋㅋ진짜 너무 조하 ㅋㅋㅋㅋㅋㅋㅋ쿠쿠ㅜㅜㅠㅋㅋㅋㅋㅋ,0개
110,채식냥이,뷰티와 속옷의 콜라보도 언젠가 해주시지않을까 기다려봅니다...❤️ ㅋㅋㅋ,2개
111,EB,빅시 설명 넘나 정확ㅋㅋㅋㅋㅋㅋㅋㅋㅋㅋㅋㅋㅋㅋㅋ 빅시 안사 ㅋ 불편해 ㅋ 하는데 어느새 장바구니엔 가득......아 그리고 저도 에어리 갠팬이에욬ㅋㅋㅋ 에어리 노와이어 브라 사고 여기 정착.. 깔별로 샀읍니다....,0개
112,가니메데ganymede,방구 세단계로 뀌어서 어따 쓰게욬ㅋㅋㅋㅋㅋㅋㅋㅋㅋㅋㅋㅋㅋㅋㅋㅋㅋㅋㅋㅋㅋㅋㅋㅋㅋㅋㅋㅋㅋㅋㅋㅋㅋㅋㅋㅋㅋㅋㅋ,1개
113,은삐의일상,핰ㅋㅋㅋㅋㅋㅋㅋㅋㅋㅋ아침에 일어나자마자 봤는데 오늘하루 웃으면서 시작할 수 있었어요ㅋㅋㅋㅋㅋㅋㅋㅋㅋ속옷 리뷰 너무 쥬아요,0개
114,유채원,진짜 씬님 영상 재밋기도 하지만 말투가 진짜 편하고 재밌어서 다른 유튜버보다 좋다...,1개
115,율라이프,"앜ㅋㅋㅋ팬티늘리는 장면에서 진짜 빵터졌네옄ㅋ
이정도면 광고비 받아야해요ㅋㅋㅋ 당장주문하로 갑니다",0개
116,빵야빵야,ㅋㅋㅋㅋㅋㅋㅋㅋㅋㅋㅋㅋㅋㅋㅋㅋㅋㅋㅋㅋㅋㅋㅋㅋㅋㅋㅋㅋㅋㅋㅋㅋㅋㅋㅋㅋㅋㅋㅋ아니 팬티가 ㅋㅋㅋㅋㅋㅋㅋㅋㅋㅋㅋㅋ왜케 늘어나요 ㅋㅋㅋㅋㅋㅋㅋㅋㅋㅋㅋㅋㅋㅋㅋㅋㅋㅋㅋㅋㅋㅋㅋㅋㅋㅋㅋㅋㅋㅋㅋㅋㅋㅋㅋㅋㅋㅋㅋㅋㅋㅋㅋㅋ아 🌈존💕 ㉯ 🦄웃긴다진짜,1개
117,MmmmM,19:32 고양이 인형인줄알았어여 ㅋㅋㅋㅋㅋ❤️,11개
118,화란,아닠ㅋㅋㅋㅋ 언니 나 저 썸네일을 지나칠 수 없었어,2개
119,이은송,"06:24 ㅋㅋㅋㅋㅋㅋㅋㅋㅋㅋㅋㅋㅋㅋㅋ 유 캔 패스◠‿◠,,,",0개
120,PetitGot,빤스 장사하시냐고욬ㅋㅋㅋㅋㅋㅋㅋ왤케 마니 사,0개
121,영영영00,아닠ㅋㅋㅋㅋㅋㅋㅋㅋㅋ저는 참새고 여긴 방앗간입니다 너무 귀여워요ㅠㅠㅠㅠㅠ 나도 써먹어야지... 아 맞다 언니가 해서 귀여운거구나,0개
122,니이모를찾아서,14:44 헐 이거 진짜 이쁘다 언니한테 잘어울려 내가 봤던 씬님 불화자피팅중에 젤 이쁘다 ㅜ ㅡ 나도 이거 사고싶릉,0개
123,뚜루뚜루루,언니 진짜 최고다요 속옷전문유투바ㅠㅠㅠㅠㅠㅠ언니덕분에 색다른 속옷들 알게 되었어요.. 고마워여..,0개
124,말랑이,빤스 자랑쇼 나 너무 좋아 ㅠㅠㅠㅠㅠ,0개
125,놀고먹는옆집부부,어머 ㅋㅋㅋㅋ와이프 데려가야겠다 ㅋㅋㅋㅋ,1개
126,naHyo,ㅋㅋㅋㅋㅋㅋㅋㅋ저는 참새구요ㅋㅋㅋㅋㅋ,2개
127,EunbiYoon,썸넬보고 고무밴드인줄 알았잖아요ㅋㅋㅋㅋㅋㅋ,1개
128,아롱아롱,재밌고 유익합니닼ㅋㅋㅋㅋㅋㅋ메컵영상보다 속옷영상때매 구독해써용ㅋㅋㅋㅋㅋㅋㅋ,2개
129,한시,아ㅋㅋㅋㅋㅋㅋㅋㅋㅋ옛날에 했던건줄 알고 그냥 넘기려다 오늘뜬거보고 바로 달려왔자나여....❣️,0개
130,thecage,"아 젤재밌어 ㅎㅎㅎㅎㅎㅎㅎㅎㅎㅎㅎㅎㅎ 진짜 속옷은 편한게 최고입니다......
저도 이제 노브라 인생 일년차 넘엇읍니다...",1개
131,김지나,메이크업도 잘 하시는 속옷 전문 유튜버,1개
132,진실하다Jinsilhada,에어리 찹살떡 팬티 이름이 뭐에요ㅠㅠ 영상이 깨져서 안보ㅇ...,0개
133,김서영,나도 미국가서 사이즈에 제한받지않고 자유롭게 자고싶다ㅠㅠㅠㅠㅠㅠㅠㅜ나중에 혹시라도 미국 여행가면 하루종일 속옷만 살 것 같아욬ㅋㅋㅋㅋㅋㅋㅋㅋ,0개
134,김윤아,아 너무 좋아요 ㅠㅠㅠㅠㅠ속옷하울 ㅠㅠㅠㅠㅠㅠㅠ 언니영상보고 저도 브라쇼핑하러 간건 안비밀 ㅋㅋㅎㅋㅋㅋㅋ,0개
135,DGk,언제나 언니의 속옷리뷰가 잼는건 왜죠 ㅋㅋㅋㅋㅋㅋ 오늘도 잼게보고가요 ㅋㅋㅋㅋ,0개
136,vv용량없어서만든채널,ㅋㅋㅋㅋㅋㅋㅋ 추운곳 가면 안대는거 ㅇㅈ♡,0개
137,TTINNA,절대로 지나칠 수 없는 썸네일이였다..,2개
138,또딘또디닝,아놔 이언니 속옷영상 존잼ㅋㅋㅋㅋㅋㅋㅋㅋㅋㅋㅋㅋㅋㅋㅋㅋㅋ 안볼수없음,1개
139,SueYang,"너무 웃긴 씬님. I LOVE Aerie! Their swimsuits are the best. And because of your video, I bought a bunch of bralettes and undies on AE just now! :)",0개
140,JK,"에어리 온라인에서는 온라인 온리만 파는것도 있고 종류도 더 많고 좋아유.. ㅎㅎㅎ 
씬님 덕에 게으름뱅이는 무슨 브라를 살지 영상보고 결정했슴돠 ㅋㅋ",0개
141,최러브,"난 언니가 속옷리뷰할때 제일 행복해,, 언니 제발 속옷브랜드 내줘,,, ♥",1개
142,JEONGEUNIM,"08:13 이 브라 정보하시는 분 완전 취저에요..
소화불량 브라ㅠㅠㅠㅠ

씬님.. 근데 진짜 속옷 컨텐츠 최곤거 같아요.. 에어리 사러 갑니다..ㅎㅎ",1개
143,한명만판다,썸네일 뭐예요 ㄱㅋㅋㄱㅋㄱㅋㄱㅋㄱㄱㅋㄱㅋ,0개
144,유니,ㅋㅋㅋㅋㅋㅋㅋ썸넬 진짜 ㅋㅋㅋㅋ 뭔가 빨리보고싶은데 혼자 숨어서 보고싶다 케케켘,0개
145,채은,썸넬보고 누가안들어왘ㄱㄱㅋㄱㅋㄱㅋㄱㅋㄱㅋㄱㅋㄱㅋㄱㅋㄱㄱㅋㄱㅋㄱㅋㄱㅋㄱㄱㅋ,2개
146,샤원,6:20깨발랄 씬님ㅋㅋㅋㅋㅋ6:23저 분 진심 당황 했을듯 이 아인 뭐지 싶었을 듯ㅋㅋㅋㅋㅋㅋ17:07뭔가 어린이 브라 같은 느낌?!?19:26어머어머어머어머,0개
147,Leeaakakkk,썸넬 대박이다진짴ㅋㅋㅋㅋㅋㅋㅋㅋㅋㅋ보는순간 바로 재생할 수 밖에 없엌ㅋㅋㅋㅋㅋㅋㅋㅋㅋㅋㅋㅋ,0개
148,허지혜,속옷하울이 젤 재밋어ㅋㅋ,1개
149,HLee,ㅋㅋㅋㅋㅋㅋㅋㅋㅋㅋ 이제 여행가면 속옷쇼핑 엄청 열심히하게 될거같아욬ㅋㅋㅋ 나도 씬님이 봤던 팬티구경해야지~..!,0개
150,SunnyC,"진짜진짜진짜 aerie 는 찐이에요 ㅜㅜㅠㅜ
캠페인자체도 너무 좋고",0개
151,최영빈,씬님 속옷쇼핑하울영상 안본사람이 젤 부럽다 너무너무 재밌어서 무한반복 보는중인데 첨볼때가 젤 짜릿해,0개
152,EunhyeLee,"사각팬티리뷰영상보면서 정주행중인데 ㅋㅋㅋ
으악 너뮤 잼있어요!!!!ㅋㅋㅋ",0개
153,고딩순돌공부하라고해줘여,1:11 아니 가릴데 하나도 안가리면 그게 속옷이얔ㅋㅋㅋㅋㅋㅋㅋㅋㅋㅋㅋㅋㅋ,0개
154,HeeJeongKim,왜이렇게 빤쮸에 집착하는고양ㅠㅠㅠㅠㅋㅋㅋㅋㅋㅋㅋㅋ 귀엽,0개
155,예나,"언니... 저 언니 덕분에 브라렛 알아보고 있어요.... ㅋㅋㅋㅋㅋㅋ큐ㅠㅠㅠㅠㅠㅠㅠ 아 볼때마다 속옷 뽐뿌와여,,,, 역시 속옷은 편한게 최고져!!!!!",0개
156,주원,19:17 부터 고양이가 뒤에서 유심히 쳐다보는데 넘넘 귀여워요ㅎㅎ🐱,0개
157,아나스타샤,썸네일 보고 기겁하면서 들어왔네 후우...,1개
158,신다희,빅시 한번도 안가봤는데 ㅋㅋㅋㅋㅋㅋ 언니 영상덕에 내적친분 오지네요 ㅋㅋㅋㅋㅋㅋㅎㅎ,0개
159,GagaKim,ㅋㅋㅋㅋㅋㅋㅋㅋ개웃 ㅕ 처음부터,1개
