comment,noun,adj,verb
"육사시미라는 말보다 다른 단어가 있으면 좋겠네요.
외국인들이 한식인데 일식으로 오해하는 경우가 많을 듯한데","['사시미', '말', '다른', '단어', '외국인', '한식', '일식', '오해', '경우', '듯']","['있다', '좋다', '많다']",['하다']
I'd love to know how the soups are made,[],[],[]
복희님 영상은 다른 먹방 영상보다 맛있게 보여서 맨날 끝까지 봐요❤️❤️,"['복희', '영상', '다른', '먹방', '영상', '보', '끝']",['맛있다'],['보다']
Amazing video as usual! I just can't stop myself from wondering if she has a certain skin care routine cuz girl her face is glowing beautifully!,[],[],[]
Love you B🙏❤️,[],[],[]
다이어트 하면서 대리만족 하기 ㅠㅠㅠ❤️❤️❤️❤️ 늘 잘보고 있어요 ㅠㅠㅠㅠㅠㅠㅠ💜,"['다이어트', '대리', '만족']",['있다'],"['하다', '하다', '보다']"
That looks so good 💞,[],[],[]
마지막에 다먹었네요..하는거 진짜 귀여워옄ㅋㅋㅋㅋㅋㅋㅋㅋㅋㅋㅋㅋㅋㅋㅋㅋㅋㅋㅋㅋㅋㅋㅋ,['마지막'],['귀엽다'],"['먹다', '하다']"
Why did you make me so hungry 😭😭😭😭 although I just ate,[],[],[]
우리 할머니께서 되게 좋아하실것 같은 분..,"['우리', '할머니']","['좋아하다', '같다']",[]
자막 웃겨가지고 집중이 안되네 ㅋㅋㅋㅋㅋ,"['자막', '집중']",['안되다'],['웃기다']
If I could only eat half of all that lol I don't know how you do it 😂 just one piece and I'm already beyond full! 🤣,[],[],[]
WOWZA 😲🤤🤤 this looks absolutely epic!!,[],[],[]
嘴巴好大呀~,[],[],[]
0:22 언니 이 때 음식 소개할 때 아이유 목소리 닮았어용 💖💖,"['언니', '음식', '소개', '아이유', '목소리']",[],"['하다', '닮다']"
ㅋㅋㅋㅋㅋㅋ하 너무 귀여우셔... 행복해하면서 먹다가 다 먹어갈때쯤의 아쉬워하는 미세한 표정변홬ㅋㅋㅋㅋㅋㅋㅋㅋㅋㅋㅌㅌㅋ,"['표정', '변화']","['귀엽다', '행복하다', '아쉽다', '미세하다']","['먹다', '먹다', '갈다']"
8:02 당연히 6회일줄 알았는데 7회ㅋㅋㅋㅋ 언니 귀여워요♥️,['언니'],"['당연하다', '귀엽다']",['알다']
"Я тоже люблю сырое мясо, яйца, мозги...😉",[],[],[]
Always satisfying ❤️,[],[],[]
"육회 밥버거라니 헐〣( ºΔº )〣
침질질... ...ㅗㅜㅑ","['육회', '밥버거', '침', '질질']",[],['헐다']
언니 진짜 복스럽게 드시는 것 같아요ㅠㅠ 와전 소리도 깔끔하구 드실때도 이쁘게 드시고 얼굴도 이쁘시고.. 아 배고파,"['언니', '복', '와전', '소리', '얼굴']","['같다', '깔끔하다', '이쁘다', '이쁘다', '배고프다']","['들다', '들다', '들다']"
아니 ㅠㅠㅠㅠㅠㅠㅠㅠㅠㅠㅠ 내가 세상에서 제일 좋아하는 육회ㅣ아우아으ㅜ타카니나,"['세상', '제일', '육회', '아우', '타카', '니나']","['아니다', '좋아하다']",['앗다']
진짜 복희홀 예능에 나가두 되겠어여🤪🤪 으악 보키홀!!!,"['복희', '홀', '예능', '보', '키홀']",[],"['나가다', '되다']"
Linda 😍 come com estilo maravilhosa 🤩,[],[],[]
❤️❤️❤️❤️복희언니 오늘도 최고ㅠㅠㅠ,"['복희', '오늘', '최고']",[],[]
"i love how she finished her food and i also love whenever she smiles while eating, it makes me smile too.🥺",[],[],[]
"I wish I could afford atleat one of the dish in the video💫💫😭😭😭😭😭😭😭😭😭😭😭😭😭

My mouth is running with water",[],[],[]
I turned my captions on...then it read her freaking mind,[],[],[]
복희 님 오늘도 맛있는 먹방 감사드려요^^~♡,"['복희', '오늘', '먹방', '감사']",['맛있다'],['드리다']
복희님 영상 보면 항상 대리만족해요ㅠㅠ 진짜 복스럽게 잘 드시고 편집도 완전 재치있게 잘하세요 ㅎㅎ 잘보고가요 💕,"['복희', '영상', '항상', '대리', '복', '편집', '완전', '재치']","['만족하다', '있다']","['보다', '자다', '들다', '하다', '보다']"
언냐 그냥 우리집에서 살래 ..? 언니가 보는것만 봐도 배불러 ㅠㅠㅠ 진짜 언니 사랑해 ㅠㅠ❤️❤️,"['언', '그냥', '우리', '집', '살', '언니', '언니', '사랑']",['배부르다'],"['보다', '보다', '하다']"
"자막 누가 단거임ㅋㄱㅋㄱㄱㄱㅋㅋㄱㅋㄱㅋㄱㅋㅋ
백김치 ㅅㅂㅜㅡㅜㅜㅋㄱㄱㅋㄱㄱㅋㄱㄱ","['자막', '누가', '임', '백김치']",[],['달다']
3:08 육회 후 불어먹는거 졸귀...,"['육회', '불어', '졸귀']",[],['먹다']
"Buat editor subtitle indonesia, i love you wkwkwkwk",[],[],[]
"Now I'm confused on what is the real happiness of the world

Love or Food?",[],[],[]
にほんじーん！,[],[],[]
복희언니 오늘은 밥버거네용 진짜 맛있었겠당~♥♥복희언니 오늘두 예뻐용♥♥따룽해여~~,"['복희', '오늘', '밥버거', '복희', '오늘', '따룽해']","['맛있다', '예쁘다']",[]
이 영상 재생이 안되네여,"['영상', '재생']",['안되다'],[]
Ilove your mukbang girl❤️,[],[],[]
"i just finished a bunch of work, its 1am and so i said i was gonna watch one youtube video before bed, and so youtube recommended this. thank you youtube",[],[],[]
"Reasons to love Boki : 
1.She is so natural.
2.She always enjoys her meal with a beautiful smile. 
3. She is pretty.",[],[],[]
0:21 무한반복,"['무한', '반복']",[],[]
"육회와 보키가 있으니 세상 그 무었보다도 아름답다고 하시더구나
ㅡ나의 헛소리 명언 1중...","['육회', '보키', '세상', '무었', '헛소리', '명언', '중']","['있다', '아름답다']",['하다']
선댓글 후시청 합니닷...뭉티기❤️,"['선', '댓글', '시청', '합', '닷', '뭉티기']",[],[]
Someone know which mic she's using ? it has an amazing sound♥,[],[],[]
볼때마다 느끼는건데 입진짜 크시다.. 넘 부럽ㅠㅠ,"['볼때', '입', '크시']",['부럽다'],"['느끼다', '넘다']"
복희언늬 항상 매 영상마다 하나두 안 남기시구 깔끔희 드시는거 너무 좋아요!💗,"['복희', '늬', '항상', '영상', '하나']","['희다', '좋다']","['남다', '깔다', '끄다', '들다']"
"우와, 진짜 배고파지는 영상이네욤..ㅠ😭 복희님, 복희님 볼 때마다 행복합니다!ㅠ 이런 채널은 나만알고싶은 채널♡","['영상', '욤', '복희', '복희', '볼', '채널', '채널']","['배고프다', '행복하다', '이렇다']",['알다']
직접 만든 음식들 영상 찍어서 올리는것도 좋을거같아요ㅠㅠ레시피 너무 궁금함,"['직접', '음식', '영상', '레시피']","['좋다', '같다', '궁금하다']","['만들다', '찍다', '올리다']"
that beef tartare reminded me of that Mr bean ep in the restaurant where he be hiding bits of the beef all over the table LOL,[],[],[]
와 육회 . 소고기 지린다. 잘시간인데 너무합니당ㅜㅜ,"['육회', '소고기', '린다', '시간']",['너무하다'],"['오다', '자다']"
My IDOL💗,[],[],[]
I wish I could also eat this much and still stay beautiful and skinny like her😝,[],[],[]
언니 단발하고 빨간 체크무늬 입으니까 진짜 백설공주 같아요 ..,"['언니', '단발', '체크', '무늬', '백설공주']","['빨갛다', '같다']",['입다']
1:50 여러분이 원하는거...일수도있고 아닐수도있고😝,"['여러분', '수도']","['원하다', '있다', '아니다', '있다']",[]
"Is it healthy or okay for the body to eat raw meat? I’m from germany and we don’t eat that here. So I’m confused 😂



Btw: Ly Boki 💖",[],[],[]
원본 영상 올려주세요,"['원본', '영상']",[],['올려주다']
"I am Egyptian and I love the Koreans, I love EXO, and I love Korean food very much .. and I love South Korea",[],[],[]
아니 이언니 드립이 아주 미춋네ㅋㅋㅋㅋㅋㅋㅋㅋㅋ 짱이에요 언니  친동생하고싶어요,"['이언', '드립', '아주', '미춋', '짱', '언니', '친', '동생']",['아니다'],['싶다']
진짜 육회사시미 밥버거라니...진짜 신선한데 너무 맛있어보여요 ㅠㅠ 복희님 인기가 많으신 게 단순히 깔끔하고 맛있고 시원시원하게 드시는 거 말고도 메뉴선정도 엄청 고민 많이 하시는 게 느껴져서 더 그런 것 같아요 ㅠㅠ 항상 힐링하게 해주셔서 감사합니다😁😁😁,"['육회', '사시미', '밥버거', '복희', '인기', '게', '메뉴', '선정', '고민', '게', '항상', '힐링']","['신선하다', '맛있다', '많다', '단순하다', '깔끔하다', '맛있다', '시원시원하다', '그렇다', '같다']","['보이다', '들다', '하다', '느껴지다', '하다', '해주다', '감사하다']"
아 언니 넘 맛있게 드셔ㅠㅠㅠ진짜루ㅜㅠㅠㅠㅠ,"['언니', '진']",['맛있다'],"['넘다', '들다']"
여러분 육회 구워 드셔보세요 진짜 달달 육즙 아주 하 진짜 그냥 한번 구워서 드셔보세요,"['여러분', '육회', '달달', '육즙', '아주', '그냥', '한번']",[],"['굽다', '들다', '보다', '굽다', '들다', '보다']"
Raw beef really isn’t my thing... well 🤔🤥. Lol,[],[],[]
8:03 자신있게 육회! 를 외쳤는데....,['육회'],[],"['자시다', '외치다']"
"Omg u are so cute while eating
Anyways love you and take care💜",[],[],[]
ㅠㅠ 항상 맛있게 푸짐하게 잘 먹으시는 복희님이 너무 좋아요ㅠㅠㅠㅠ,"['항상', '복희']","['맛있다', '좋다']","['푸다', '지다', '자다', '먹다']"
i always watch you please notice me(philippines)❤❤❤❤❤❤❤❤❤❤❤❤❤❤❤❤❤❤❤❤❤❤❤❤❤,[],[],[]
Always the best ASMR 😢😢😢💕💕💕💕 Im hungry!!!!,[],[],[]
항상 꾸준히 ~구독자늘엇다고 다른누구들처럼 게으르게 하시지도않고 ^^정말 멋있어요♥한결같이~앞으로도쭈욱~부탁드려요♥,"['항상', '독자', '고', '누구', '정말', '쭈욱']","['꾸준하다', '게으르다', '멋있다', '부탁드리다']","['늘다', '하다', '않다']"
WOAH IM EARLY!!,[],[],[]
Omg you have the biggest mouth I’ve ever seen!,[],[],[]
너무 바빠서 이제 보게 됐는데 이게뭐야.. 한 상 가득 푸짐하게 차려놓고 저렇게 맛있게 먹다니.. 야무지게 먹는 복희님 모습 보니까 피로가 싹 풀리는 느낌이네요 😭❤️,"['이제', '게뭐', '상', '가득', '복희', '모습', '보', '피로', '싹']","['바쁘다', '맛있다', '야무지다']","['보다', '돼다', '하다', '푸다', '지다', '차리다', '먹다', '먹다', '풀리다', '느끼다']"
복희님이 드셔서 또 유부초밥이 땡기네유....오늘도 잘보고 갑니당!! 팽이버섯먹방도 부탁드려유ㅠㅠㅠ,"['복희', '유부초밥', '유', '오늘', '팽이버섯', '먹방', '부탁', '드령']",[],"['들다', '땡기다', '보다', '가다']"
"日本はユッケ無くなったから、めっちゃ羨ましい〜😭✨
美味しそう〜😂💕💕
韓国のユッケまた食べたいな〜🤤",[],[],[]
"자막은 설정에서 활성화 해주세요 💗

안녕하세요 복희예요 🥰
주말에 비도 오고 뭔가 꿀꿀한 기분에 뭘 먹을까 하루종일 고민하다가 기력 충전을 위해 ! 도가니탕을 가져왔습니당 🤗
오랜만에 배달로 ! 모둠 수육에 도가니탕 두개 시켰는데 도가니탕이 하나만 왔더라고요......😱😱😱
한 그릇 더 올때까지 기다릴까 하다가 수육이 식어서 건조해질까봐 그냥 가져왔어요 흡,,
밥이라도 많이 먹기위해 꾹꾹 담고^^ 
한번 더 끓여서 가져왔는데 뜨끈뜨끈하니 국물이 찐~한게 찐짜 맛있더라구요 찐맛집 ! 👍🏻
먹으면서 점점 기운 나는 느낌은 기분 탓이 아니겠쥬? 
국밥 먹을때 밥이랑 국 따로 먹다가 말아먹는걸 좋아해서 중간에 말아먹었는데 역시나,,, 오늘도 너무 맛있게 잘 먹었어요 희희 
수육도 부들부들하고 부추랑 같이 겨자간장소스에 찍어먹으니까 jmt ! 
다들 더운 여름이 오기전에 몸 보신 도가니탕 한그릇씩 합시다요👏🏻💕

Hello everyone ! This is Boki 🥰
Today the weather is cloudy and I wanted to eat something energetic, so I prepared a healthy menu.
I brought some healthy ox knee bornsoup and assorted beef !
The texture of the meat was chewy and chewy, so I liked it.
It was so delicious and satisfying to eat with rice.
Enjoy your meal too 🙏🏻💕

🍎복희 daily instagram🍎 @_luvmun
🍒Mukbang instagram🍒 @eatwithboki","['자막', '설정', '활성화', '복희', '주말', '비도', '뭔가', '기분', '뭘', '하루', '종일', '고민', '기력', '충전', '위해', '도가니탕', '배달', '수육', '도가니탕', '개', '도가니탕', '하나', '그릇', '수육', '그냥', '밥', '먹기', '위해', '꾹꾹', '한번', '끈', '국물', '게', '맛집', '점점', '기운', '느낌', '기분', '탓', '쥬', '국밥', '밥', '국', '중간', '역시', '오늘', '수육', '부추', '겨자', '간장', '소스', '여름', '기전', '몸', '보신', '도가니탕', '그릇', '복희']","['안녕하다', '꿀꿀하다', '건조하다', '뜨끈하다', '맛있다', '아니다', '좋아하다', '맛있다', '희다', '희다', '부들부들하다', '덥다']","['해주다', '오다', '먹다', '하다', '가져오다', '두다', '시키다', '오다', '하다', '기다리다', '하다', '식다', '지다', '가져오다', '담다', '끓이다', '가져오다', '뜨다', '찌다', '찌다', '짜다', '찌다', '먹다', '먹다', '먹다', '말아먹다', '말아먹다', '자다', '먹다', '찍다', '먹다', '들다', '하다']"
복희님이 감자탕 쓱싹하고 볶음밥드시는거 보고싶다...☆,"['복희', '감자탕', '쓱싹', '볶음밥']",[],"['들다', '보다']"
is anyone else concerned about her Cholesterol levels from all the meat that she eats? 😳😧,[],[],[]
"She's always satisfies and fulfill my thoughts on how you're going to eat this food,this makes me so hungry.",[],[],[]
나만 그런가. 오늘 뭐먹지 고민되는 날엔 이언니 동영상을 한번 쭉 훑어본다. 그럼 무조건 답나옴ㅋㅋㅋ,"['런가', '오늘', '고민', '날', '이언', '동영상', '한번', '쭉', '무조건', '답']",['그렇다'],"['먹다', '되다', '훑다', '보다', '나오다']"
복희 언니는 막 색깔별로 디저트 단 것만 모아두지 않고 항상 제대로 된 한끼 식사로 먹어줘서 너무 좋아요♡ 플레이팅도 깔끔하고 최고의 조합들인 다양한 음식을 볼 수 있어서 지루하지도 않고ㅎㅎ,"['복희', '언니', '막', '색깔', '별로', '디저트', '단', '아두', '항상', '제대로', '끼', '식사', '플레이', '팅', '최고', '조합', '음식', '볼']","['좋다', '깔끔하다', '다양하다', '있다', '지루하다']","['않다', '되다', '먹어주다', '않다']"
뼛속까지 한국인이라 모든 양식 준다고 해도 국밥이랑은 못 바꿔...,"['뼛속', '한국인', '모든', '양식', '해도', '국밥', '못']",[],"['주다', '바꾸다']"
"You are my mom's stress reliever😂😂
She loves the way you eat it",[],[],[]
댓글 빨리다는 사람들 하트눌러주는거 쉽지않을텐데 일일이 찿아가서 눌르는거 짱이다,"['댓글', '사람', '하트', '일일이', '찿', '아가서', '짱']",[],"['달다', '누르다', '쉬다', '않다', '누르다']"
5:37 you can hear something moving near the mic it vibrated on my headphones 👀.,[],[],[]
"Food always looks so good! 🥺🥺🥺 I’ve already eaten, but I’m sure I’ll be looking for food after watching this! 😂😂😂",[],[],[]
"복희언니 영상을 네가 매일보는이유
1 먹는게 시원시원함
2 맛있게먹음
3 예쁨
4 매뉴선정이 한번도 안겹치고
다 맛이는 것만 고름 

복희언니 짱❣
+좋아요👍 112게 감사합니다ㅎㅎ","['복희', '영상', '일보', '이유', '먹음', '뉴', '선정', '한번', '안겹', '맛', '고름', '복희', '짱', '게']","['시원시원하다', '맛있다', '예쁘다', '좋다']","['먹다', '감사하다']"
"문복희님 인기 많은 이유 : 다른 사람들이랑 같이 먹는다든가, 안 먹고 말 많이 하는 등등의 다른 거 안하고
진짜 찐으로 항상 맛있고 예쁘게 세팅해서 먹는거에만 집중해서 영상 올려주심, 
게다가 먹는게 항상 다양하고 음식들 조합이 요리사수준🥰
예쁜 얼굴과 화장으로 보는 재미는 덤.
항상 깔끔하게 먹는것도, 인기비결
음식 세팅도 너무 예쁨. 항상 칼같이 정돈되고 색 조합까지 완벽...(옷 색까지..!) 👍👍👍최고최고","['복희', '인기', '이유', '다른', '사람', '말', '등등', '다른', '항상', '세팅해', '집중', '영상', '주심', '게다가', '항상', '음식', '조합', '요리사', '수준', '얼굴', '화장', '재미', '덤', '항상', '인기', '비결', '음식', '세팅', '항상', '칼', '정돈', '색', '조합', '완벽', '옷', '색', '최고', '최고']","['많다', '맛있다', '예쁘다', '다양하다', '예쁘다', '깔끔하다', '예쁘다']","['먹다', '들다', '먹다', '하다', '찌다', '먹다', '하다', '올리다', '먹다', '보다', '먹다', '되다']"
"복희님은 항상 조회수나 사람들이 많이 클릭할 만한 메뉴에만 치중하지 않고 그 날 그 날에 맞는 음식들을 선정해주셔서 너무 좋아요♡ 덩달아 든든해지고 건강 걱정 덜하게 되는 기분이라 보기 편안하네요ㅎㅎ 앞으로도 누구보다 복희님이 행복한 먹방, 기대할게요😊","['복희', '항상', '조회', '수나', '사람', '클릭', '메뉴', '치중', '날', '날', '음식', '선정', '덩달아', '건강', '걱정', '기분', '보기', '누구', '복희', '먹방']","['좋다', '든든하다', '덜하다', '편안하다', '행복하다', '기대하다']","['하다', '하다', '않다', '맞다', '해주다', '되다']"
I should really start eating before I watch these. 😂❤️,[],[],[]
국밥을 이렇게 맛나게 먹는 사람 처음 봄,"['국밥', '맛', '사람', '처음', '봄']",[],"['나다', '먹다']"
"箸とスプーンをノールックで持ち替えてるのが地味にすごい笑
机の下がどうなってるのか気になる",[],[],[]
매일 예상치 못한 드립에 터지는건 나 뿐만이 아닐거야...,"['매일', '상치', '못', '드립', '뿐']",['아니다'],['터지다']
I love how she has the same love in her eyes from the first bite till the last one.,[],[],[]
"Why is Youtube drugged?
Views: 37
Likes: 3
Comments: 1",[],[],[]
The way Boki takes her big bites is just so satisfying! 😍,[],[],[]
why JYP entertainment didn't tell us that shin ryujin is sidelining as a mukbanger,[],[],[]
"헐 도가니탕 먹방.. 
저 아이디어들은 도대체 어디서 날아오는거죠","['도가니탕', '먹방', '아이디어', '도대체']",[],"['헐다', '날아오다']"
나 살면서 한번도 도가니탕 먹은적 없는데.. 다시 먹고싶다.. 음..? 하여튼  진짜ㅠㅠㅠ언니ㅠㅠ 살앙해요❤ 진심.,"['한번', '도가니탕', '적', '다시', '음', '하여튼', '언니', '살', '진심']","['없다', '앙하다']","['살다', '먹다', '먹다']"
오늘 모던하우스 갔다 왔는데 언니가 쓰는 식기구들 몇 개 발견돼서 박물관 관람한 느낌이었어요...,"['오늘', '모던', '하우스', '언니', '식기구', '개', '발견', '박물관', '관람']",[],"['가다', '오다', '쓰다', '돼다', '느끼다']"
00:59 탱그러움.... 분명 처음 보는 표현인데 왜 어색하지가 않지...? 한글의 위대함,"['움', '분명', '처음', '표현', '한글']","['그렇다', '어색하다', '위대하다']","['보다', '않다']"
When she gives a smile expression while chewing the food inside I instantly caught up it tasty part of food,[],[],[]
6:41 ㅠㅠㅠㅠㅠ언니 밥 안말고 드실까봐 걱정했네요 괜한 걱정😂😂😂,"['언니', '밥', '걱정', '괜', '걱정']",[],"['들다', '하다']"
When your mouth is literally a black hole-,[],[],[]
"Wow ur are the most cleanest mukbanger 
Anyways love ya girl and take tare💜",[],[],[]
복희님! 먹방 잘 보고 있어요! 저는 항상 그렇게 크게 크게 드시는 모습이 복희님만의 매력이라 생각해요:) 근데 저희 어머니께서 치과에서 근무를 하시는데 복희님이 드시는 걸 보시더니 저렇게 무리해서 입을 벌리면 턱 관절에 좋지 않아서 나중엔 티스푼으로 겨우 밥을 먹어야 한대요ㅠㅠ 물론 복희님이 기본적으로 입이 크신 것도 있겠지만 너무 무리해서 하시진 않으셨으면 좋겠어요 복희님의 건강도 중요하니까요ㅠㅠ! 항상 맛있는 영상 올려주셔서 감사하고 오늘도 영상 잘 봤어요!😊,"['복희', '먹방', '보고', '항상', '크게', '크게', '모습', '복희', '매력', '생각', '저희', '어머니', '치과', '근무', '복희', '걸', '입', '턱', '관절', '나중', '티스푼', '겨우', '밥', '대요', '복희', '기본', '입', '복희', '건강', '항상', '영상', '오늘', '영상']","['있다', '무리하다', '좋다', '있다', '무리하다', '좋다', '중요하다', '맛있다']","['자다', '들다', '하다', '하다', '들다', '보다', '벌리다', '않다', '먹다', '크다', '하다', '않다', '올려주다', '감사하다', '자다', '보다']"
먹방에서 도가니탕은 처음,"['먹방', '도가니탕', '처음']",[],[]
"Hi .. everyone EID MUBARAK....I am watching this late cause I was watching the moon of EID....And also watching Boki is cool 😘 cause I can eat whenever I want 😋😋😋😋😋
#loveyouallandBOKI😘😘😘😘😘😘",[],[],[]
11:53,[],[],[]
She's always eating a proper meal and not some instant foods. I love her always ❤️,[],[],[]
"When you put the rice into the soup! THAT'S the moment I've been waiting for! Yesss! That's how us Asians do it baby!! 🎉🎉 
With love from the Phillippines 😘😘",[],[],[]
와 국밥 먹을 때는 시원한 냉수...진짜 잘드시기 전에 잘먹을 줄 아시는 분...,"['국밥', '냉수', '아시']",['시원하다'],"['오다', '먹다', '들다', '먹다']"
"No one:

Literally no one:


Filipino Subtitles:

(Kumain ng chopstick)",[],[],[]
진짜 언니는 신이 내린 선물이야..이게 아니고서야 이렇게 예쁠 수 없지..내가 진짜 존경해..,"['언니', '신', '선물', '고서', '존경']","['아니다', '예쁘다', '없다']","['내리다', '하다']"
Am I the only one who feels it? That this girl resembles Ryujin Itzy,[],[],[]
"다이어트중인데
내가 먹방영상을 보면서
먹고싶어서 포기하고 그냥 시켜먹고싶고
그러는사람도 있지만
난 꼭 살빼서 복희님처럼
먹어야지 이생각만 하는중이에요..
ㅠㅠ 고맙습니다","['다이어트', '먹방', '영상', '포기', '그냥', '사람', '난', '꼭', '복희', '생각', '중이']","['그렇다', '있다', '살빼다', '고맙다']","['보다', '먹다', '시키다', '먹다', '먹다', '하다']"
This honestly looks so aesthetically pleasing.💛💙,[],[],[]
She literally has the most cute face ever,[],[],[]
"복희언니.... 애니멀스타일 감자튀김 요청합니다....ㅠㅠ

Requesting boki to eat animal style fries!! 🍟🍟🍟","['복희', '애니멀', '스타일', '감자', '튀김', '요청']",[],['하다']
I like her because she eats so cleanly and having biggest bite,[],[],[]
"3 or 5 yrs from now, I would like an update on her health 😂",[],[],[]
"Oh, today she is very cute.:33",[],[],[]
"Curious what’s there below the table, why they always put the spoon down there?🥴",[],[],[]
no matter how full i am i always get hungry when this cutie eats T.T,[],[],[]
옛날엔 먹방 보는데 방해 될까봐 자막 안 키고 봤는데 이제는 자막과 먹방이 어울리는 것 같아서 자막은 필수가 된 것 같아요!,"['옛날', '먹방', '방해', '자막', '키', '이제', '자막', '먹방', '자막', '필수']","['같다', '같다']","['보다', '되다', '보다', '어울리다', '되다']"
"""anyeonghesaeyo, boki yayo""
man if you only know how many times i rewind/replay this line. she s soooooo cute everytime she does her greetings.",[],[],[]
"Hug back kita agad
1 Like👍🙏🏾
1subscribed🙏🏾
Babalikan kita agad
100% legit🙏🏾",[],[],[]
"Challenge to my self:
watch Boki without feeling hungry at all.

After awhile...
me: FAILED",[],[],[]
Hi my grandma watches you every day she loves you can you give her a hi pls thank u so much,[],[],[]
0:38 아무리 귀여워도 그만 돌려봐,[],['귀엽다'],"['돌리다', '보다']"
왤케 허전하나 싶었는데 자막을 꺼놨었네... 처음부터 다시 재생해야겠다.,"['자막', '처음', '다시', '재생']",['허전하다'],"['싶다', '끄다', '하다']"
"I love how you eat everything, when i eat i also have to finish everything ☺️",[],[],[]
1:23 수육 먹고 싶어서 신난 모습이 토끼같이 넘 귀여워요ㅋㅋㅋㅋㅋㅋㅋㅋㅠㅠㅠㅜ,"['수육', '모습', '토끼']","['신나다', '귀엽다']","['먹다', '싶다', '넘다']"
이언닌 진짜 다양하게 먹어줘서 너무 좋아ㅠㅠㅠㅠㅠㅠㅠㅠ대리 만족,"['닌', '대리', '만족']","['다양하다', '좋다']",['먹어주다']
