comment,noun,adj,verb
4:55 한국인 특; 불어먹는 거는 솔직히 국룰이지~ ㅋㅋㅋㅋㅋㅋㅋㅋ 귀엽누,"['한국인', '특', '불어', '국룰', '누']","['솔직하다', '귀엽다']",['먹다']
I always love the sound 😍,[],[],[]
"Can I suggest some food you can eat?

-breakfast mukbang (pancake, coffee, omelette, bacon, etc) or korean breakfast food
-pasta with chicken (spaghetti, carbonara, lasagna etc)
-street food mukbang (tteokbeoki, kimbap, fish cake, chicken feet, dumpling etc)
-yangnyeom chicken w/ noodles and rice or w/ noodles only 
-dessert mukbang (cupcake, donuts, ice cream, cookies, etc)
- fast food mukbang (kfc, Jollibee, Mcdo, etc)
-burrito, taco bell, nachos etc
-snack mukbang (chips)

I know you already tried some of this but I want you to try it again 😊🤗",[],[],[]
"먹뱉이라 하는 사람은 귀가 있는거임?
복희 한번에 삼키는 스타일이 아니라 씹으면서 삼키는 타입이라 먹는 와중에도 꿀떡꿀떡 소리 들리는데 ㅋㅋ","['사람', '귀가', '임', '복희', '한번', '스타일', '타입', '와중', '꿀떡', '꿀떡', '소리']","['있다', '아니다']","['먹다', '뱉다', '하다', '삼키다', '씹다', '삼키다', '먹다', '들리다']"
今めちゃくちゃ食べたい…ムルフェ誰か作って(´；ω；｀),[],[],[]
복희님은 어떤음식을 먹어도 엄청 여유롭게 드심 입이크셔서 그런가 허허..,"['복희', '음식', '드심', '입', '런가']",[],"['먹다', '여유롭다', '크다']"
"보키언니...저 편의점먹방이
은근 중독성있어소..맨날 편의점먹방만봐욤..
그래서말인데... 편의점먹방2탄만들어주시묜
안돼욤???ㅠㅠㅠㅠㅠ 부탁드려영..ㅠㅠㅠ","['보키', '편의점', '먹방', '은근', '중독', '편의점', '먹방', '욤', '말', '편의점', '먹방', '묜', '안돼욤']","['있다', '부탁드리다']","['보다', '타다', '들어주다']"
She never fails to amaze me 🥺,[],[],[]
"언니가 국물먹는거 너무조아용 ㅋㅋㅋㅋㅋㅋㅋ
한가득 담아서 물마시는느낌이랄까요? 
속시원해서 제 속이 다 뻥 뚤리는거같은느낌에에요","['언니', '국물', '무조', '물', '느낌', '랄', '속', '뻥', '뚤리', '느낌']","['시원하다', '같다']","['먹다', '담다', '마시다', '끄다', '속이다']"
물회 with sea urchin is my favorite👄🥢✨,['물회'],[],[]
I just love to see your eating...... ❤❤,[],[],[]
"진짜 복희님 진짜 메뉴상(?) 줘야한다
항상 새로운 메뉴로 보여주니까 누가 언니의 이런 모습에 안 반하겠냐고......","['복희', '메뉴', '항상', '메뉴', '누가', '언니', '모습']","['야하다', '새롭다', '이렇다', '반하다']","['주다', '보여주다']"
"4:55 언니 왜 불어드세욬ㅋㅋㅋㅋㅋㅋㅋㅋㅋㅋㅋㅋㅋㅋㅋㅋ 면먹을때 한국인 특징 ,,","['언니', '불어', '면', '한국인', '특징']",[],"['들다', '먹다']"
I love how she eats her food so genuine. Thank you boki for your videos! 🧡🤟,[],[],[]
나도 언니 하트 받고 싶어..최대한 일찍 온건대..!!!언니 댓이랑 하트 한번도 못 받아봤어요ㅠㅠㅠㅠㅠ언니는 내 지구야..내 하루의 중심..(오마이걸 데스티니),"['언니', '하트', '최대한', '일찍', '건대', '언니', '댓', '하트', '한번', '못', '언니', '지구', '하루', '중심', '마이걸', '데스티니']",[],"['나다', '받다', '싶다', '받다', '보다']"
복희님 제발 소속사 no no 영상 스타일 이대로가 제일 좋아요,"['복희', '제발', '소속사', '영상', '스타일', '제일']",['좋다'],[]
"今日は暑くて、扇風機かけながら見ています。

カレイのお刺身、食べてみたい。",[],[],[]
13:08 와 끝냈다....,[],[],"['오다', '끝내다']"
하... 이거 내 혓바닥이라도 먹을ㅅㅜㄷ에베베ㅔㅂ,"['혓바닥', '베베']",[],['먹다']
Wow. Water sashimi. First time hearing that 🤩😍,[],[],[]
4:54 차가운소면 불어드시는복희님 ㅋㅋㅋㅋㅋㅋㅋ,"['소면', '불어', '복희']",['차갑다'],['들다']
언니 이렇게 맛있는 거 혼자 먹으면 나 우럭ㅠㅠㅠ,"['언니', '혼자', '우럭']",['맛있다'],['먹다']
hi goodmorning watching from davao city ❤,[],[],[]
5:12 천재다 진짜 두 장 동시에 찍기,"['천재', '두', '장', '동시', '찍기']",[],[]
I feel like no one eats more satisfyingly than Boki,[],[],[]
0:27 헐... 매실 할때 눈빛 모야... 세상 얼음 다 녹아내리겠네... 나도 녹ㅇ ㅏ ㄴ     ㅐ ㄹ          ㅕ,"['매실', '눈빛', '모야', '세상', '얼음', '녹']",[],"['헐다', '하다', '녹아내리다', '나다']"
4:12 재밌어서 다시 돌려봄ㅋㅋㅋㅋㅋ,"['다시', '봄']",['재밌다'],['돌리다']
복희님은 진짜 메뉴선정이 대박인거같애요ㅠㅠㅠ 영상보고나면 먹고싶어서 미치겠어요 으가가가가ㅏㅏㅠ,"['복희', '메뉴', '선정', '대박', '애', '영상', '가가']","['같다', '미치다']","['보다', '먹다']"
언뉘...곧 400만명도 가겠다ㅏㅏ 보키언니!! 1000만명 가즈아~맛있게 먹는것도 좋지만 몸관리 잘하세요 ㅠㅠ 코로나 꼭 조심하구여💖💖,"['뉘', '보키', '가즈', '몸', '관리', '코로나', '꼭']","['맛있다', '좋다']","['가다', '먹다', '하다', '조심하다']"
진짜 백설 공주 같이 생겼다. 아니 진짜 실사판아니야? 아니 진짜 아니... 실...사파안 백공...안희 진짜 ... 백설 공주 복희 안희 진짜하 아니진짜 백설 공주네 아니 진짜 ....,"['백설', '공주', '실사판', '니야', '실', '파안', '공', '백설', '공주', '복희', '백설', '공주']","['아니다', '아니다', '아니다', '희다', '희다', '아니다', '아니다']",['생기다']
"아놔 울 보키언니 한국인이라고욧... 한국인 댓글 위로 올려줘요,,","['울', '보키', '한국인', '욧', '한국인', '댓글', '위로']",[],"['놓다', '올려주다']"
4:54 후 부는거 무엇 ㅋㅋㅋㅋㅋㅋ,['무엇'],[],['불다']
근데 복희님은 구독자가 엄청 빨리 느시네요. 이 속도면 400만 가시겠어요,"['복희', '독자', '속도']",[],"['늘다', '갈다']"
진짜 언니랑 밥 한번 먹어보고 싶어요 ㅋㅋㅋㅋㅋㅋㅋㅋ 왜 똑같은 음식도 같이먹으면 더 맛있을것같지,"['언니', '밥', '한번', '보고', '음식']","['똑같다', '맛있다', '같다']","['먹다', '싶다', '먹다']"
물회는 .. 안좋아하는뎅 ㅠㅠㅋㅋㅋㅋ 어케 ㅠㅠ 일케 맛있게 먹는거징 ㅠㅠ 회도 막 두터운데 ㅠㅠ 저렇게 잘 먹는거 보니까 ㅠ  저까지 막 먹고 싶어지네여! 못져멋져 역시 복희찡 짱이야😊😊😊❤️❤️❤️❤️😍😍😍😍,"['물회', '뎅', '일케', '징', '회도', '막', '보', '막', '지네', '역시', '복희', '짱']","['좋아하다', '어떻다', '맛있다', '두텁다', '멋지다']","['먹다', '자다', '먹다', '먹다', '싶다', '지다']"
"I love the way you eat. I always wait for your next upload mukbang video, it's very satisfying. 😘😍",[],[],[]
자막유심히본거 오늘 처음인뎈ㅋㅋㅋㅋㅋ자막왜이래옄ㅋㅋㅋㅋㅋㅋ구린데 웃곀ㅋㅋㅋㅋㅋ,"['자막', '유심', '오늘', '처음', '자막']",['구리다'],"['보다', '웃기다']"
물회는 진짜 전부터 복희가 짱ㅠㅠ 국물까지 다 마셔줘서 너무 희열느낌 금방 전에 올린물회보고왔는데 오늘 이렇게 또 새로운 물회라니 넘행복희,"['물회', '복희', '짱', '국물', '느낌', '금방', '물회', '오늘', '물회', '행복']","['희다', '새롭다', '희다']","['마시다', '올리다', '보고오다', '넘다']"
"You’re the reason why I’ve decided to create my very own mukbang channel Boki. Please stay healthy, keep safe and God bless! I’m MJ from the Philippines",[],[],[]
"보기만....... 보기만해두 맛있어 보여여ㅠㅠ
진짜 쵝오!","['보기', '보기', '만해', '쵝오']",['맛있다'],['보이다']
4:58の時そうめん冷たいのにフゥーってした時のボキちゃんめちゃくちゃ可愛かった(*´ω｀*),[],[],[]
그저 그런 음식 먹을 땐 자막에 드립만 가득한데 정말 맛있는 음식 먹을 땐 중간중간 너무 맛있단 말과 함께 음식 얘기가 가득해요ㅋㅋㅋㅋㅋㅋㅋㅋㅋㅋㅋ 잘 먹는 복희 언니 보고만 있어도 행복...💛,"['음식', '땐', '자막', '드립', '정말', '음식', '땐', '중간', '중간', '말', '음식', '얘기', '복희', '언니', '보고', '행복']","['그렇다', '가득하다', '맛있다', '맛있다', '가득하다', '있다']","['먹다', '먹다', '자다', '먹다']"
물회 너무죠아여..... 소면까지 완벽 ㅠㅠㅠㅠㅠㅠ 와 진짜 노량진 가고싶다.....,"['물회', '소면', '완벽', '노량진']",['좋다'],"['오다', '가다']"
海鮮苦手だけどbokiちゃんが美味しそうに食べてる姿は可愛すぎる🥺,[],[],[]
ITZYのリュジンにそっくり！！可愛いです💓　そして美味しそう、😋,[],[],[]
진짜 메뉴 너무 좋아 너무,['메뉴'],['좋다'],[]
"いろいろな魚を食べていて美味しそう☺️
なまこって食べたことがないので、料理の中に入ってるところ、初めて見ましたw
魚によって音が違って面白かったです！",[],[],[]
내가 먹방은 항상 건너띠거등 허지만 이릏케 길게 본 먹방은 처음이여,"['먹방', '항상', '건너', '띠거등', '허지만', '이릏케', '먹방', '처음']",['길다'],['보다']
해산물 진짜 좋아하눈뒈ㅜㅜㅜㅜㅜㅜㅜ❤️❤️❤️❤️,"['해산물', '눈뒈']",['좋아하다'],[]
진짜 시원하게 잘드신다...,[],['시원하다'],['들다']
물회진짜마싯겟다ㅠㅠㅠㅠㅠㅠㅠㅠㅠ아미쳐..,"['물회', '아미']",[],"['마싯다', '치다']"
Lindaaa ♥️♥️,[],[],[]
메뉴선정 도랏다구ㅠㅠㅠㅠㅠ♥️♥️♥️♥️♥️,"['메뉴', '선정', '도랏다구']",[],[]
Watching while taking an online examination 😁😁😁❣️,[],[],[]
you're so pretty eonnie! 😍,[],[],[]
하ㅠㅠ물회진짜새콤달콤 시원하깃 쫀득쫀득 소리예술이이여온니 👍👍,"['물회', '콤달콤', '깃', '쫀득쫀득', '소리', '예술', '온']",['시원하다'],[]
진짜 밥 먹을때 마다 맨날 보는데 자린고비 같아ㅠ,"['밥', '마다', '고비']","['자리다', '같다']","['먹다', '보다']"
看姐姐吃饭感觉好幸福啊！姐姐加油！,[],[],[]
복희님ㅠㅜ 이시간에 너무해요ㅋㅋㅋㅋ,"['복희', '시간']",['너무하다'],[]
the food looks delicious,[],[],[]
처음부터 소리 미쳤따..!!물회 참 좋아하는데ㅎㅎ복희님 덕분에 오늘도 대리먹방 하고 가네요☺️💜,"['처음', '소리', '물회', '복희', '덕분', '오늘', '대리', '먹방']","['미치다', '좋아하다']","['따다', '차다', '하다', '가다']"
4:56 불어 먹기!,"['불어', '먹기']",[],[]
"0:37 Start eating!!!! 
Who else loves Boki???? 🍎🍎🍎🍎💗💗🥰🥰🥰",[],[],[]
"Omg, that sounds soooooo delicious!",[],[],[]
"회가 어쩜 저리 꼬득꼬득 소리가 나는지ㅠㅠ
소면 가득 넣어 드셔서 너무 좋아여","['회', '어쩜', '저리', '꼬득꼬득', '소리', '소면', '가득']",['좋다'],"['나다', '넣다', '들다']"
Boki you should to a cooking tutorial on how you prepare your mukbangs especially the ramen and seafood ones 😩😭❤️,[],[],[]
보키~ 물회라니... 메뉴선정 굿이에요ㅠㅠㅠㅜㅜㅜㅜㅜㅜㅜㅜㅜㅜ,"['보키', '물회', '메뉴', '선정', '굿']",[],[]
I’m early today!!! ☺️,[],[],[]
OMG!!! i dunno know what to say.... i am great fan of your's.... i have watched almost have of your videos... few days back only i have came across your videos.. and i was just overwhelmed.... lodzzz of love from INDIA :|) :|)....,[],[],[]
Amazing appetite and amazing big bites even the drinks she always finishes. She's pretty and cool 👍❤️,[],[],[]
"Boki over here eating a whole meal for a family. 
Me pouting chili powder in my mouth so I won't get hungry hungry",[],[],[]
I love that you'er eating law food!!!! Hope you  had a great day! Love from canada,[],[],[]
언니... 진짜 언니 엄청 초창기 때부터 지금까지 보는 동안 영상을 끝까지 안본적이 없어 .. 언니 너무 잘머거 .. 언니 너무 이뻐 .. 언니 자막 너무 웃겨서 지루하지도 않아 .. 언니 너무 시원시원해 .. 언니 입 크기 독특해서 조아.. 언니 사랑해 ... 내 사랑 받아 ..❤️❤️❤️,"['언니', '언니', '초창', '기', '지금', '동안', '영상', '끝', '본적', '언니', '언니', '언니', '자막', '언니', '언니', '입', '크기', '언니', '사랑', '사랑']","['없다', '이쁘다', '지루하다', '시원시원하다', '독특하다']","['보다', '머거다', '웃기다', '않다', '하다', '받다']"
와...와.......와ㅠㅠㅠㅠㅠㅠㅠㅠㅠㅠㅠㅠㅠㅠㅠㅠㅠㅠㅠㅠㅠㅠㅠㅠㅠㅠㅠㅠㅠㅠㅠㅠㅠㅠㅠㅠㅠㅠㅠㅠㅠㅠㅠㅠㅠㅠㅠㅠㅠㅠㅠㅠㅠㅠㅠㅠㅠㅠㅠㅠㅠㅠㅠㅠㅠㅠㅠㅠㅠㅠㅠㅠㅠㅠㅠㅠㅠㅠㅠㅠㅠㅠㅠㅠㅠㅠㅠㅠㅠㅠㅠㅠㅠㅠㅠㅠㅠㅠㅠㅠㅠㅠㅠㅠㅠㅠㅠㅠㅠㅠㅠㅠㅠㅠ,[],[],"['오다', '오다', '오다']"
"Sub mukbang mantap lezatnya
LIKE👍✔☺😊",[],[],[]
I’m so torturing myself by watching this while fasting 😭😭😭,[],[],[]
언니 자주자주 업로드 안해도되니까 우리 오~~~~래 봐요ㅠㅠㅠ 진짜 제가 많이 아껴요😍😍,"['언니', '업로드', '우리']",[],"['하다', '되다', '보다', '아끼다']"
메밀소바 했나여 ㅠ? 안하셨다면 꼭 해주세여ㅠ,"['메밀', '소바', '꼭']",[],"['하다', '하다', '해주다']"
지금 밤에 이거보고있는데 배고파 미치겟다ㅠㅠㅠ,"['지금', '밤', '보고']","['있다', '배고프다', '미치다']",[]
아니 자막 진짜 ㅋㅋㅋㅋㅋㅋㅋㅋㅋ 볼 때마다 언니의 드립력에 놀라고 갑니다...ㅋㅋㅌㅌㅌㅌㅌㅋ,"['자막', '볼', '언니', '드립']",['아니다'],"['놀라다', '가다']"
마라탕 드셔주세요ㅠㅠㅠ,['탕'],['마르다'],['들다']
"Create a mukbang that you also eat the plates, etc. 🤣🤣🤣",[],[],[]
요즘 같은 날 진짜 먹고싶운데 외국이라 ㅠㅠㅠ 대리만족 하고가요 ㅠㅠㅠ🙈🙈,"['요즘', '날', '외국', '대리', '만족']",['같다'],"['먹다', '하다']"
"왜 죄다 영어야 ㅜㅜㅜ 몰라몰라 일단 모르겠고 
언니 넘 예뻐요 ㅜㅜ 정말 💗💗","['영어', '몰라몰라', '일단', '언니', '정말']",['예쁘다'],"['모르다', '넘다']"
Bro I swear i don’t think there’s a video that I have not watched on this channel 😍😍 love you Boki❤️❤️,[],[],[]
i really like it when she always wink at the end 💛,[],[],[]
도다리로 걸어가 ㅋㅋㅋㅋ 엌ㅋㅋㅋㅋ엌ㅋㅋㅋㅋ,['도다리'],[],['걸어가다']
"원래 먹방영상을 잘 안보는데 복희님 영상이 유독 소리가 좋고, 이런 말 할 나이는 아니지만 복스럽게 드셔서...이쁘시기도 하고.... 제가 유일하게 보는 먹방유튜버이십니다...결론 복희님 사랑합니다!!!!!","['원래', '먹방', '영상', '복희', '영상', '유독', '소리', '말', '나이', '복', '기도', '먹방', '유', '튜버', '니', '결론', '복희', '사랑']","['좋다', '이렇다', '아니다', '이쁘다', '유일하다']","['자다', '보다', '하다', '들다', '하다', '보다', '하다']"
1:17 큰그릇에 담긴 물회를 작은그릇에 옮겨서 마시는 우런니 클라쓰...,"['그릇', '물회', '그릇', '우리']",['작다'],"['크다', '담기다', '옮기다', '마시다', '크다', '쓰다']"
오늘 자막 미쳤다ㅋㅋㅋㅋㅋㅋㅋ,"['오늘', '자막']",['미치다'],[]
물회ㅠㅠ 진짜맛있게 드시네요ㅠㅠㅠ물회먹고싶다..,"['물회', '물회']",['맛있다'],"['들다', '먹다']"
"1:02 그럼 입안에 아쿠아리움 차리시면 되겠당ㅎㅎ
(자막 키고 보면 임안은 거의 아쿠아리움이라 되있어요)","['입안', '아쿠아리움', '자막', '키', '임안', '거의', '아쿠아리움']",['그렇다'],"['차리다', '되다', '보다', '되다']"
복희언니 짜파구리 먹방도 해주세요ㅠㅠ,"['복희', '짜파구리', '먹방']",[],['해주다']
와~~오늘은 해삼물 날?.아~나 해삼물 진짜 왐전 좋아하는데..ㅠㅠ해삼물 먹구시프어어어ㅓㅇ..ㅠㅠ,"['오늘', '해삼', '물', '날', '해삼', '물', '왐전', '해삼', '물', '시프', '어어']",['좋아하다'],"['오다', '먹다']"
"No one:
Muslims 10 mins before iftar:",[],[],[]
복희 자막드립 너무좋아요ㅋㅋㅋㅋ이제 없으면 허전희~~~ ㅋㅋㅋ,"['복희', '자막', '드립', '이제', '전희']","['좋다', '없다']",['허다']
i love watching your videos so much boki !! you’re amazing,[],[],[]
I watch your asmr every day even I am fasting,[],[],[]
5:13 오늘도 한 수 배웁니다,['오늘'],[],"['하다', '배우다']"
"마지막에 어떤음식이 가장 맛있었는지 얘기해주세요♥
그리구 팬애칭 뭔가요 ㅠ","['마지막', '음식', '가장', '얘기', '팬', '애칭', '뭔가']",['맛있다'],"['해주다', '그리다']"
지금날씨에딱ㅜㅜㅜ,"['지금', '날씨']",[],[]
"복희 언니 메뉴 선택은 진짜 최고bb
언니 영양사해도 되겠어요🙊 이정도면 학교 식단보다 낫다😆 맨날 다양한 음식에 조합도 즁말 좋아요!!! 진짜 음식에 대한 전문가라는게 느껴진달까?ㅋㅋㅋㅋ😉","['복희', '언니', '메뉴', '선택', '최고', '언니', '영양사', '정도', '학교', '식단', '낫다', '음식', '조합', '즁말', '음식', '대한', '전문']","['다양하다', '좋다']","['하다', '되다', '가르다', '느껴지다', '달다']"
물회 진짜 시원해보인다..,"['물회', '시원']",[],['해보다']
Who's here before 1 million views? 🙋,[],[],[]
지금 응급실와서 링거맞고 있는데 복희님 영상보면서 아픈거 잊어가고 있어요 복희님 좋은 영상 찍어주셔서 감사해용 💓 💓,"['지금', '응급실', '링거', '복희', '영상', '복희', '영상']","['있다', '아프다', '있다', '좋다']","['서다', '맞다', '보다', '잊다', '찍다', '감사하다']"
이언니 유튜브 켜놓고 소리만 들어도 내가 다 행복함.. ㄹㅇ 힐링 영상ㅠㅠ,"['이언', '유튜브', '소리', '힐링', '영상']",['행복하다'],"['켜다', '들다']"
"자막은 설정에서 활성화 해주세요 💗

안녕하세요 복희예요 🥰
오늘은 푸라닭의 매드갈릭치킨을 가져왔습니당🍗 사이드로는 신메뉴 꼬친새우 두개 ! 🍤🍤
치킨이 달달짭짤하면서 한입먹자마자 마늘향이 뙇!!! 하고 들어오더라구요 
마늘치킨같은거 좋아하시는 분들에게 딱 .. ❤️ 그것은 저^^
겉은 쫀득하고 속은 촉촉해서 부드럽게 술술 넘어가는 느낌 희희
꼬친새우는 안에 통통한 새우가 들어가있어서 씹는 식감이 좋았어요 👍🏻
고추마요소스랑 잘어울려서 찍어먹으니까 더 맛있었고 치킨살이랑 같이 꽂아먹어도 존맛탱,,
오랜만에 치킨타임 너무 행복했어요 😘
오늘도 잘 먹었습니당 🙏🏻💕

-푸라닭에서 협찬을 받았습니다

Hello everyone ! This is Boki 🥰
Today, I brought garlic soy sauce chicken and fried shrimp skewers.
The chicken was sweet and salty, and as soon as I took a bite, the taste of garlic came into my mouth !
I usually like garlic soy sauce chicken, so it was really delicious 👍🏻
I liked the texture of the fried shrimp because it had a whole shrimp in it.
It goes well with mayo sauce, so it's good to dip it in and eat it with chicken meat together was so delicious too 😋
Enjoy your meal too 🙏🏻💕

🍎복희 daily instagram🍎 @_luvmun
🍒Mukbang instagram🍒 @eatwithboki","['자막', '설정', '활성화', '복희', '오늘', '닭', '매드', '갈릭', '치킨', '사이드', '메뉴', '꼬친', '새우', '개', '치킨', '달달', '입', '마늘', '향', '뙇', '마늘', '치킨', '그것', '겉', '쫀득', '속', '술술', '느낌', '꼬친', '새우', '식감', '고추', '마', '소스', '치킨', '살이', '존맛', '치킨', '타임', '오늘', '닭', '협찬', '복희']","['안녕하다', '푸르다', '짭짤하다', '같다', '좋아하다', '촉촉하다', '부드럽다', '희다', '희다', '통통하다', '좋다', '맛있다', '행복하다', '푸르다']","['해주다', '가져오다', '먹다', '하다', '들어오다', '넘어가다', '새우다', '들어가다', '씹다', '어울리다', '찍다', '먹다', '꽂다', '먹다', '자다', '먹다', '받다']"
"Вкусняшка,а вы ЗАМУЖЕМ???Если нет,найдем тебе жениха на Сахалине!!!",[],[],[]
아 진짜 한국인 댓글 따로 외국인 댓글 따로 봤으면 좋겠다ㅠ 한국인 주접이 안 보여...ㅠㅠㅠㅠ,"['한국인', '댓글', '외국인', '댓글', '한국인', '주접']",['좋다'],"['보다', '보이다']"
I lowkey thought she was Nayeon from twice,[],[],[]
"Who is fasting Ramadan and whatchin this 😂😂 ...it makes u appreciate food more wich is one of the main goals  behind fasting 😇😇
HAappy Ramadan for those who is doing it and stay safe evrybody  !",[],[],[]
"I was so bored so I decided to listen to Japanese music from the anime Demon slayer then after listening to so many music I went through YouTube and I saw you posted a new vid 
Me:finally a new posted video from boki",[],[],[]
"0:51 

It’s confirmed, Boki is a wide jawed, big Handed monster",[],[],[]
E렇게 해ya an묻힌dadeonde 적당he English 섞어seo 댓글nam겨야 jo금이라do 올라감 YouTube shake it 들이 feel터를 껴놨Na,"['렇', '해', '적당', '댓글', '겨', '금', '터']",[],"['묻히다', '섞다', '올라가다', '들이다', '끼다']"
"<수고하셨습니다>
어려운 영어중 보물같은 한글을 찾으셨습니다 축하합니다^^","['수고', '영어', '보물', '한글', '축하']","['어렵다', '같다']","['하다', '찾다', '하다']"
"삼키는 부분 편집 확실히 줄었고 전보다 최대한 안 자르고 보여주려고 하시는 것 같은데?
말투 부드럽게 라이브 요청 정도는 하는 거 오히려 좋은 것 같은데 너무 강압적으로 센 말투로 사실이 아닐수도 있는 거 사실화해서 댓글 쓰지 마셔요...~","['부분', '편집', '전보', '최대한', '말투', '라이브', '요청', '정도', '오히려', '강압', '말투', '사실', '사실', '댓글']","['확실하다', '같다', '부드럽다', '좋다', '같다', '아니다', '있다', '화하다']","['삼키다', '줄다', '자르다', '보여주다', '하다', '하다', '세다', '쓰다', '마시다']"
"boki: here's our next friend
me: hi fren",[],[],[]
사람들이 하도 씹밷이다 뭐다 하길래 집중해서 봤는데 삼키는 소리 잘들리는데...?,"['사람', '씹밷', '집중', '소리']",[],"['하다', '하다', '하다', '보다', '삼키다', '들리다']"
"No one:


Me: choking on my own saliva while watching her eat..",[],[],[]
Everybody gangsta till Boki unhinge her jaw like a snake,[],[],[]
복희누님은 음식을 대하는 태도가 너무 좋아여 억지로 먹는게 아니라 보는 사람도 군침 돌게 만드는 my QUEEN,"['복희', '누님', '음식', '대하', '태도', '억지로', '사람', '군침']","['좋다', '아니다']","['먹다', '보다', '돌다', '만들다']"
잘만삼키시는데 먹뱉ㅇㅈㄹ,['잘만'],[],"['삼키다', '먹다', '뱉다']"
Can we al take a moment and apreciate her cuteness and profesionalism while eating? 🐰❤,[],[],[]
아니 외국인들 한국먹방 진짜 좋아하네ㅋㅌㅋㅌㅋㅋ 외국인들 댓 주르륵 있어서 새삼 놀람..,"['외국', '한국', '먹방', '외국', '댓', '주르륵', '새삼', '놀람']","['아니다', '좋아하다', '있다']",[]
She is the only mukbangers that I love to finish watching till the end of each videos. Just love the way she eat.❤️☺️,[],[],[]
영어댓글 너무많아...... 싸우스코리아앙큼상큼복희팬들.. 열심히 댓글달도록하세요!!,"['영어', '댓글', '스코리아', '복희', '팬']",['많다'],"['싸우다', '댓글달다', '하다']"
Who think that she really looks like Ryujin from ITZY?,[],[],[]
"I watched her videos so much that I literally say ""Annyeonghaseo, bokki-eyo"" at the same time as her 😂 ♡︎",[],[],[]
"What I like about her is, she doesn't give over acting reactions unlike some mukbangers.",[],[],[]
Bawang bawang apa yang nggak ada di rumah? Bawang toyip ini yang terjemahin siapa si kasi ig nya :'),[],[],[]
shes so cutee when she eats like i could never😍,[],[],[]
she takes very big bites but they seem so small inside her mouth 😂,[],[],[]
Need someone  who will look at me like how she looks at her food 😅,[],[],[]
Me watching this while ı'm on a diet...,[],[],[]
I like her style she eat big bite and see to camera like a boss,[],[],[]
복희님은 항상 처음 한입 먹고 카메라 🥺표정으로 쳐다보세욬ㅋㅋㅋㅋㅋ,"['복희', '항상', '처음', '입', '카메라', '표정']",[],"['먹다', '쳐다보다']"
コップにゆで卵入ってるんかと思った,[],[],[]
Boki Mukbang makes my day! Who agrees?🙋🏻‍♀️ The way she bites into the chicken and the sounds are so satisfying. And she is always so cute!❤️,[],[],[]
한국인 댓글이 안보이는 1인,"['한국인', '댓글', '인']",[],['보이다']
