,youtube_id,comment,like_num
153,AkanshaRajput,The food looks so delicious and tempting....And really fume you're Very very cute...I wonder how your skin is so good after having all these spicy food!!!!,0개
154,yamimachamling,One of my favorite YouTube channel:),0개
155,VaughnHart,When you took that first bite of the crab you looked so beautiful. 😍,1개
156,SarahSadia,야  Fume! 채널이 정말 마음에 듭니다. 당신은 내 모든 시간을 좋아하는 YouTube 사용자입니다,0개
157,단밤태태,일욜 점심은 크림 진짬뽕이다 냠냠😋,1개
158,콩이먹방Tv,힘 포메 너무이뽀여 ㅜㅜ,0개
159,김예원,일부러 환공포증 있는 사람들 배려하셔서 패션후르츠 안보이는곳에 둔거죠.... ㅎㅎ,0개
160,SHIYA,humeちゃん凄いおいしそうですd(≧▽≦*d),0개
161,LimmimiASMR,"와 크림진짬뽕이란것도 있었네요.
안먹어본 라면이 너무 많아요.
너무 맛있게드시네요.
늦은시간 대리만족 제대로 하고갑니당^^",0개
162,유영민,언니 면 영상 10분컷ㅋㅋㅋㅋㅋㅋ,0개
163,이경진,1:24 첫입❤,0개
164,조윤하,"빅토리아 탄산수 진짜 지금까지 먹었던 탄산수중에서
제일 거부감 없는 탄산수였오요..",0개
165,329,安っぽいのねww,0개
166,LilyPotato,Your channel has grown so much! I was here when it was at 1k!,1개
167,Phyllisxoxo,Aww I’m hungry with all the delicious looking food,1개
168,강정우,딱 제 이상형입니다ㅎㅎ 잘보고있어요ㅠㅠ,1개
169,BangtanWorld,"☺You are so beautiful!!!☺
How about making a hashtag for fume lovers!!🤔
#fumesquad☺ or #FumeFusions 😊",2개
170,조유빈,식사 다하시면 머리 풀으시는 거 너무 귀염,0개
171,SameenaAzmi,by eating shes smile was awosome who agreed,1개
172,ednasmith,That looks really yummy! Thanks for sharing your vlog❤️🇬🇧,0개
173,HoaTran,I was late because i have a cough huhu !!!!😣😣😣😣 Plzzzzz don't hate me . Loveeee you,0개
174,Rich,woah I never knew there was a milk ramen?! I want to try it now,0개
175,WonheesRamen,I wanna know the recipe to this!,0개
176,,いつも見てます！大好きです❤️,0개
177,,いつも見てます！大好きです❤️,0개
178,Animeplanet,So cute when you eat💜💜💜💜,16개
179,hannahbovo,I really like your stlye of eating,0개
180,elaine03,I made this one too and it's  delicious. Thank you!,0개
181,KimNsreen,Loveeeeeeeeeeeee 🥺💗,3개
182,ChrisRolls,"I’ve noticed that Koreans are the only Asian folks that incorporate cheese and “creaminess” into their Ramen.

That is why I love them since I’ve been doing it since birth. Lol",3개
183,MaiLefamilycucsngphp,"See your food, look you eating make me hungry.",0개
184,anBB,"너무예쁘게 적당히
맛있게예뿌게귀엽게머귬
메뉴도좋공 입도 크게크게잘먹구 
아구애쁌 ㅜㅜ💕",0개
185,BENSPAGHETTIMukbang,"Hi Miss Fume, before I started my channel, you are one my favourite mukbangers I usually follow, in short, you inspired me to make mukbang videos, I really enjoyed watching you eating with tingling sound but on my channel, it's not like Asmr because I don't have hitech equipments, hihihi😁,, but maybe soon I can do Asmr,, just keep uploading, I always enjoyed your videos,, you deserved your million subscribers Miss Fume, you are an  inspirations to all small mukbangers like me. Greetings from Philippines 🇵🇭 ❤️. Keep uploading Miss Fume.!💕",0개
186,절대못잃어권지용,언니 빨대도 유리 빨대 쓰시는거 정말 배우신 분... 넘 좋아용 🥰🥰,0개
187,EYasu,"1:24 start eating🍜🍝

いつも本当に美味しそう😋😍見てて幸せ！",0개
188,KimLizeth,"Wow, it looks delicious💗😋",0개
189,먹거리Meokgeori,"식욕을 땡기는 맛있는 영상!!
푸메행님 최고^^ 😋😋👍",0개
190,HoaTran,Plzzzzzz reply. Loveeeee youuuuuu !!!!😙😙😙😙 Plzzzzz replyyyyy plzzzzz,1개
191,최아민,"으악!! 모르거 저녁에 보았어ㅠ
다이어트는 내일부터^^",0개
192,FoodCraverAsmr,great looking meal especially the shrimp looked so appetizing 👍🙂,0개
193,AbantiDas,The dish looks soooo tasty,0개
194,dhw,와 너무 먹고싶어요ㅠㅠㅠㅠㅠ,0개
195,꿱꿱,중식?잡채볶음밥랑 깐쇼새우 등등 먹어주세요!!,1개
196,PurpleHaze929,That looks so delicious. Wish I could eat this right now.,0개
197,monikadanko,私はYouTubeであなたを愛しています❤️❤️,0개
198,KendraG,The food looks so good! Great video! ✨,0개
199,YOU,飯テロ動画、ありがとう。,0개
200,LetsHangOut,"Omg. Hungry atm, and this is not doing me a favor. 😭🤤🤤🤤🤤🤤🤤",0개
201,쩡이와댕댕이ZengandDaeng,오늘은 크림진짬뽕하고 게다리튀김까지 먹어서 보기 좋네요! 맛도 꽤나있고요♡,0개
202,imhungry,i already ate but when i saw you’re notification i was ready to get hungry again,0개
203,허남철,"안녕하세요 ~
푸메님 ~
좋은 영상 ~
감사합니다 ~
맛있게 드세요 ~^^
영상 잘봤네요 ~^^
주말, 휴일 잘보내세요 ~
건강조심하시고요 ~^^♡",0개
204,IsadoraAlmeida,"푸메 언니, 너는 제일 먹방 내가 좋아하는 
사랑해요 ♥💞🇧🇷",0개
205,이학주,너무 맛나게 이쁘게 귀엽게 드시네요,0개
206,HimanshuArya,"No one 
Literally no one 
Today I see your new video notification in  instagram before you tube.",14개
207,meriametv마르얌,"⁦🇲🇦⁩⁦❤️⁩⁦🇰🇷⁩
사란해🙆🏻‍♀️",0개
208,대한민국SouthKorea,너무 예뻐 사랑해,0개
209,azazelangst,love watching this instead of eating. so therapeutic ❤,2개
210,LorenzoLouis,Starting to be Fume fan: right now.,0개
211,kamiluuh18,Watching this after doing Chloe Ting's work out 🙄🙄🙄,0개
212,SoyoSoyo,애니메이션 보면 자꾸.아주 좋아해요.♡ ♡,0개
213,saraha,I really like when you eat without the spoon :),0개
214,suinee,요새 부쩍 너무 안씹어드시는 것 같아요👀 맛있게 드시는 것도 좋지만 전처럼 야무지게 꼭꼭 먹어주시면 좋겠어요 ㅎㅎㅎ,0개
215,백수스트릿,푸메 봣을때 몇십만명 구독자 였는데 어느덧 226만..,0개
216,mercury,色が全部赤だとひいてしまう💦なので久しぶりに見たよ☺️,0개
217,SandaraCo,"Yummy. You're so pretty noona""😍",0개
218,MAIDAYS,"I see this in 23:50 pm,and know im starving🌚😌",0개
219,Ahsenetin,터키에서 인사드립니다 🇰🇷❤️🇹🇷💜,0개
