닉네임,댓글,좋아요수,날짜
권수연,"막창 대창 이런것들 불호하는 편이지만 너무 맛있어보이네요ㅜㅜ
혹시 이런분들 계실까요 내가 싫어하는 음식이지만 맛있어보여서 먹었더니 맛없어서 그걸 또 속은 내가 멍청하다고 느껴질때 있으신가요...?
혹쉬 나만 이런거??",3개,2020. 5. 17.
hjanelim,"200만 유튜버가 댓글도 소소하게 달아주시고 보기 좋네영 ㅎㅎㅎㅎ
오밤중에 불닭볶음면 너무 먹고 싶어요 😂",0개,2020. 5. 17.
머리가맥주있네,헐 오늘 막창이랑 불닭 완전 땡겼었는데ㅠㅠ 요즘 다이어트하는데 푸메님 덕에 매일 대리만족 거하게 하고 있어요ㅋㅋㅋ,0개,2020. 5. 17.
홈밥노라HOMBAB,진짜 찐텐이닭... 불닭먹고싶닭...,0개,2020. 5. 17.
aninditatresaValerina,Aahhh i wanna eat spicy ramen 🤤,1개,2020. 5. 17.
CookingDeeLites,I think your channel is amazing👍❤️😁,1개,2020. 5. 17.
HiliSherf,"I sub 😉
I everything wait for your videos 🥰",0개,2020. 5. 17.
KimSoHyunUnnie,The other hand holding the spoon looks like it's not ur hand lol,5개,2020. 5. 17.
최가은,와 ㅋㅋㅋㅋ맵찔이라 핵불닭은 꿈도 못 꾸는데ㅠ ㅠ.. 매운 라면에 고기에 쌈 싸먹는 게 제 꿈이에요,0개,2020. 5. 17.
경희방송성경낭독책읽기,우와! 진짜 탐스럽게 드시네요 먹고싶어요 ㅜ,1개,2020. 5. 17.
86,"プメさん、おはようございます😄
麺、辛くなかったですか?
いつも、綺麗に食べて凄いですね🤗🤗
毎日、応援📣してます♥",0개,2020. 5. 17.
쩡이와댕댕이ZengandDaeng,오늘은 핵불닭볶음면부터 막창을 먹어서 보기 좋네요! 너무 맛있겠네요♡,0개,2020. 5. 17.
DOPEMANTV,Hey Fume! Good to see you,0개,2020. 5. 17.
monaco9593,"푸;  푸짐하게 잘드시는 푸메님!!
메;  메번 맛나게드시네용^^",1개,2020. 5. 17.
,면은  푸메님이  제일  맛있게  드시는것같다  내기준에...,0개,2020. 5. 17.
