닉네임,댓글,좋아요수,날짜
EdaTarhan,I want to eat this delicious food right away 😍😍😍,3개,2020. 5. 9.
MallakOutako,"*هل يوجد عربي هنا 
احبك♡💕💞✌*",1개,2020. 5. 9.
tumangamingNABIL,気になった,1개,2020. 5. 9.
조이랑,왜케소리가줄어들고커지는게 많지.. 잡음이라해도 너무자주그러니 거슬리네요.. 맛있겠다,0개,2020. 5. 9.
지수,밀가루 줄이려고 노력중인데ㅠㅠㅠ유튜브 처음 들어오자마자 짜파구리라니요... 푸메님 딱 저것까지만 먹어야겠어요ㅠㅠㅠ 저는 열무 김치랑 먹을래요ㅎㅎㅎ😉😉,2개,2020. 5. 9.
시현,너무 맛있게드셔서 끝까지  다보고 다시 처음부터가서 돌려보는중이에요ㅠㅠ,0개,2020. 5. 9.
김동권,항상 맛있게 잘 드셔서 너무 좋아요 ㅎ,1개,2020. 5. 9.
FernandaFerreira,"Esses temperos desses macarrão instantâneo é muito ruim pra saúde; e ela comi bastante isso, meu Deus..",3개,2020. 5. 9.
LABLINKARMYParklisa,Soy la única que piensa que Fume es muy cute ❤️❤️😊,1개,2020. 5. 9.
MarcellinaDewinta,I watch this makes me full 🤤🤤🤤,3개,2020. 5. 9.
H2,"와 음료에서 좋아요 구독 눌렀다 ...,,,..,,,,,,.,... 담엔 마시는 장면 좀만 더 길게 보여주세용 ><",0개,2020. 5. 9.
karlsonsimonEATS,"Mouthwatering 🤤🤤 now I’m hungry, again! Lol!",0개,2020. 5. 9.
ArdiBanjar,개는 정말 귀엽고 귀엽다😘😘,0개,2020. 5. 9.
NurulfatinSyazwani,i'm hungry now😭😂,1개,2020. 5. 9.
ShariqAhmed,Fume ate all of this food without ruining her lipstick and I can't even eat food with a chapstick on 😅😂😂🤣🤣👌🏻,51개,2020. 5. 9.
,Oh no!Now is midnight and i am hungry now why give me look this movie ah,15개,2020. 5. 9.
,丸飲みってレベルで噛んでないw,0개,2020. 5. 9.
llamaJeong,군대 입대하기 전에 100만 넘으셨었는데 핸드폰 받으니까 200  넘으셨네여!! 축하드려요!!!,0개,2020. 5. 9.
muharsyad,"Hello ms, iam from indonesia
I like your'e video😍can you review indonesian food😁",0개,2020. 5. 9.
AlaguMeena,"Fume :eating noodles
Me:gets hungry😣😥",35개,2020. 5. 9.
EvergreenAngel,Love😍 I'm from nepal🇳🇵🙏 i like your every video 😊😍,0개,2020. 5. 9.
,"我渴望韩国面😭😭😋
عربي اثبت وجودك بالايك😝",0개,2020. 5. 9.
rosietoh,Love your videos!! Can you please make a video of. You making different kinds of Kimchi? ❤️,0개,2020. 5. 9.
,The really fan who is fasting and still watch asmr video of this cute girl 😢,4개,2020. 5. 9.
Sunnyxox,i love watching these type of videos when I’m on diet 💀,32개,2020. 5. 9.
송진,언니 좀 씹고 삼키세요ㅠㅠ 몸에 안좋아요!!,1개,2020. 5. 9.
SakuraYamashita,"How can she still look so cute and pretty and perfect while eating but when it’s me I just look like mess. Lol
And is it only me or does it look like she didn’t chew the noodles and just swallow them instead? How can she do that? I would of choked if I had done that",1개,2020. 5. 9.
AnningNewme,Even your makeup looks spicy🔥,2개,2020. 5. 9.
영,아!!!!! 푸메 너무 좋아!!!,0개,2020. 5. 9.
EatwithMohsin,"Yumm I Am Hungry Now 😋
Stunning As Always ❤️
Hope You Had  A Fantastic Day 😍",5개,2020. 5. 9.
꼬냥이,아가 졸려ㅎㅎ기여어♡,0개,2020. 5. 9.
FeleenaL,Unniee... How can u eat so much and still look gorgeous!!,0개,2020. 5. 9.
,"麺全然噛まずに飲み込んでますね！🥺
でも痩せてるしお肌つやつやだし綺麗だし大っきい口で食べてるのに食べ方美しい🥺",0개,2020. 5. 9.
GachaRoses,Oh god it’s 4 AM for you right now! I guess I can still say goodnight right?😴❤️,0개,2020. 5. 9.
Moazzamairtiqa,"Love you soo much❤️
Love from Pakistan 🇵🇰✨",3개,2020. 5. 9.
AbdullahAlshamali,i love you saranghe 🍒✨❤️,1개,2020. 5. 9.
지릴라,"푸메님 갱얼쥐 항상 얌전하다고 느꼈는데 산책가서도 얌전하네요 ㅠㅠㅠㅠㅠ 귀여워요 ㅠㅠㅠㅠㅠ..
갠적으로 푸메님 면 먹방 조아요 ㅋㅎㅎㅋㅎ",0개,2020. 5. 9.
AbigailEsmane,"와, 너무 맛있어요! 나는 약간을 원한다, 나는 편의점에서 약간을 살 예정이다!",0개,2020. 5. 9.
joii,"와우, 괜찮아😭👅",0개,2020. 5. 9.
NingJones,Fume. I’d love to know where to get the “straw” you use in your cup !?!,37개,2020. 5. 9.
,噛まないのΣ（・□・；）,0개,2020. 5. 9.
Oonglimlepcha,"My favourite mukbanger unni.💝
One happy soul who eats well, has a cute dog and Is away from all the unnecessary dramas going on.❤",1개,2020. 5. 9.
홍지환,보면 볼수록 강아지도 푸메님 닮은 듯,0개,2020. 5. 9.
GachaRoses,She has a talent of always making me smile❤️😊,0개,2020. 5. 9.
,不會很撐嗎！😂🤣,0개,2020. 5. 9.
Rzhxoxo,It’s ramadhan and I’m fasting 🥺,0개,2020. 5. 9.
이밍,짜파구리 컵라면이라니! 너무 맛나보여요 ㅠㅠ 언니 다음엔 살살치킨이랑 웨지감자 한번 드셔주세요!! 푸메언니가 살살치킨 먹는거 한번 보고싶어요 ❤️ 매번 맛있는먹방 올려주셔서 감사해요 😊,0개,2020. 5. 9.
MamtaJha,It looks so yummy😍,0개,2020. 5. 9.
,食べてる動画見てると、激辛も大食いも出来ないの分かってるのにいけるんじゃ？思ってしまう,7개,2020. 5. 9.
안녕자두,"왜 면을 안씹어여,,,ㅠ",0개,2020. 5. 9.
KimJeNa,U r the reason why I always looking for Wi-Fi everyday :),1개,2020. 5. 9.
YasFanny,WHAT JUST ME LOOK SHE CRY?,0개,2020. 5. 9.
서수빈,언니 씹으세요....!!!!!!!!ㅠㅜㅠㅠ,0개,2020. 5. 9.
LyraLeona,"Hi from Philippines 😊❤
Hope everyone is doing great ❣️",4개,2020. 5. 9.
RudiPermana,"Noodle.. that I fume of.. 🍝

Amost everyday I eat it",0개,2020. 5. 9.
먹제쉬ASMR,"라면은 역시 김치와 함께~~
김치들이 하나같이 맛있어 보여요,
꾸울꺽~~!",0개,2020. 5. 9.
AartiThakur,Eating n earning😂😂😂 what could be more good than this. 😂😂,0개,2020. 5. 9.
fauziaharti19,Pen makan jadinya😂❤❤,1개,2020. 5. 9.
dosoonYim,강아지 이름이 뭐에요....🤗🥰,0개,2020. 5. 9.
HilmanKanzi,"안녕하세요, 저는 인도네시아에서 왔습니다.",0개,2020. 5. 9.
써자매쓰Sseojamaeth,푸메님.영상보고.앵그리 짜파구리 사서 먹어봐야겠네요! 침뚝뚝,0개,2020. 5. 9.
땡땡이,푸메님은 삼키는거까지 편집없이 다 보여줘서 편하네요~,0개,2020. 5. 9.
s,"麺は飲み物ってこんな感じよね👏🏻👏🏻♥️
食べ方が綺麗だからいつも見とれちゃう🥺",16개,2020. 5. 9.
DaniellaRamsawak,All these food she's eating not a weight gain. Where does it all go?,3개,2020. 5. 9.
kookaiT,ดูหลายคลิปแล้ว เหมือนเคี้ยวอาหารไม่ค่อยละเอียดเลย สูดเส้นบะหมี่ แล้วกลืนลงคอเลย,0개,2020. 5. 9.
전다빈,맛있겠다 ㅜㅜㅜㅜㅜㅜㅜㅜㅜㅜ,0개,2020. 5. 9.
이지유,짜파구리 어 나도 먹었는데..,0개,2020. 5. 9.
박모찌,중간에 광고때문에 몰입도 떨어져요...,0개,2020. 5. 9.
EncepRusmin,あくさんがtめにゅかいいつ,0개,2020. 5. 9.
,韓国の人まじで胃どうなっとんのwww,0개,2020. 5. 9.
