,youtube_id,comment,like_num
144,레몬,"멕시칸 에서 사고를 쳣군요~~😊😎😉
저도 구매 해서 먹어 볼께예~
넘~~~ 맛잇게 먹는 푸메님 짱!♡
소리가 예술 입니당~~
푸메님 궁금해서 물어 봅니다?
큰둥근얼음각 으데서 구매를 햇어예???
홈프.시장그릇집.다이소.탑마트등등~
가보아도 얼음각 안 보여예ㅠㅠ",1개
145,,"韓国に行けたらﾌﾟﾙﾀﾞｯｸﾁｷﾝ🐔🐓🍗や、✨🆕✨新しく発売✨🆕✨されたｶﾙﾎﾞﾌﾟﾙﾀﾞｯｸﾁｷﾝ🐔🐓🍗も、食べてみたいです💤🎠💤

🧀豚カツ、良いなぁ～🌠🌠🌠

外はすっかり温かいから、ﾓｸｼﾞちゃん風🍃気持ち良いよね✨",1개
146,JaxonSALEDRAB,I love her food appetite!! How can she finished all that food!!!,0개
147,파토난코치,치킨은 뭐다? 단백질이다,1개
148,최쑤기,"요 근래에도 나온 불닭치킨에  이번엔 까르보치킨까지 
불닭시리즈네염ㅋㅋㅋ 맛있으면 0ㅋㄹㄹ!!!  
사이드메뉴까지도 어쩜😢😢😢😢 면까지 
준비해주시는 쎈쑤 ♡ 
푸메님 매운것도 넘 맛있게 드셔요~~^^😄",1개
149,RaisyaStudio,"I like the way  you eat, it's so clean ❤️",0개
150,fansberatbangetgenhalilintar,Tim telen ludah sini kita satu server 😂😂,2개
151,,น่ารักเกินไปแล้ว    ><  너무 귀여워 ><,0개
152,xxdarkheadxx,"I’m eating carbo spicy noodles right know 😂


Wow thx fume so much for the heart. This is the first time I’ve ever got a heart 

Thx for the 80 likes. The highest I’ve ever gotten before",85개
153,이현서,"흑흑 매운거 잘 못먹지만 진짜 맛있겠다... 

+이 언니는 말도 한국어고 자막도 한국어인데 왜 댓글은 다 영어지...?",0개
154,oshima,カルボブルダックポックンミョン大好き💕,0개
155,김레이나,"불닭 스틱은 어떻게 구매 하나요...??
인터넷엔 안 나오는데요 ㅠㅠ",1개
156,,귀여워🥰,1개
157,DattaNetke,when you are eating it's sounds amazing🌹 lots of love❤️❤️🏩 and hugs from India 🇮🇳🥰,0개
158,skywalker,까르보불닭 좋아하는데 꼭 먹어야겠네요,2개
159,최우식팡인,항상 응원해요🥰🥰🥰🥰 혹시나 피드백이아닌 안좋은 댓글은 절대절대 보지마세요 사랑해용,0개
160,MrsPayne,"Why did I watch this before going to sleep?!?😭😭😭 Fume, you make me hungry now😩😩🤦🏻‍♀️❤️",0개
161,,食べっぷり最高ですね。韓国はチーズのびるの流行ってますね。美味しそう。音もいい感じ。美人ですね。,8개
162,almajdmjd,i always wonder how they clean the wood surface after dropping hot red pepper souces on it,0개
163,,"いつもみてますさいこうです！
ありがとうございます！",0개
164,hc,치즈돈까스 치즈 늘어나는 거 실화?,1개
165,Jun,와.. 먹방 오래봐서 왠만한 먹방보고 미친듯이 먹고싶다는 생각은 안드는데.. 이건 보자마자 할말을 잃음..😧😧,2개
166,목지에요,제가 방금 까르보불닭 생각한건 또 어찌 찰떡같이 아시고... 하트나 받아주시죠 ♥,17개
167,권짬마,까르보불닭치킨은 덜 맵겠죠?,1개
168,MaibamDwijamani,Please share us your skincare routine. Ur amazing💖💖,1개
169,은동이의일기장,"푸메언니 저도 불닭먹을래요 ㅠㅠㅠㅠ
저의 채널도 놀러오세욤♥️",1개
170,동석ASMR,하 배고파ㅜㅜ,1개
171,쿡준sCookjunASMR,오오오 까르보불닭치킨!?? 까르보불닭 완전 맛있는데ㅠㅠ.. 맛있겠다아아...❤️😊,23개
172,먹제쉬ASMR,"아.. 너무 맛있겠어요!
눈뜨자마자 치킨시켜야지ㅋ",1개
173,catchun,"綺麗なのにたくさん食べるし、ニコニコ笑顔なところが大好きです(*´˘`*)

表情が素敵で、見習いたいです✨✨",0개
174,AclRight,영상 초반에 나오는 강아지 너무귀엽네요,1개
175,SYC,私はあなたのファンです💕💕,0개
176,NadiaNadia,Sister you just super eating .....so yummy chicken Fri pls Chess bills....I'm eat❤️,24개
177,RizkiaAinurrahmah,"Wow, that really looks perfect⊙﹏⊙",1개
178,스마sma,저 밤에는 이제...언니 영상 못 볼 것 같아요.....👁 너무 힘들어요...😩😩😩,2개
179,불닭TVBuldakTV,"🔥공식왔닭 불-하🐔
이 영상을 불닭TV가 좋아합니닭👍",0개
180,NuhaBaharoun,I love how she started eating the chicken from the bottom,0개
181,EatWithChloe클로이,"않이... 불닭치킨에 이어서 까르보불닭치킨이라니요😱😱
멕시카나 열일하네요😍😍",10개
182,ednasmith,Watching from🇬🇧 your food looks soo delish ❤️,0개
183,강나영,"너무 좋아요  먹고싶네요 
푸메먹방  최고에요",2개
184,김보민,"유튜브 최초라니 대단하시내요
항상 응원할께요 코로나조심하세요",1개
185,RubyRalph,I would hate to be her toilet 😂,0개
186,DeekshaGopal,"0:24 
Sorry, I paused to see that beautiful man on the box hehe💕",35개
187,karlsonsimonEATS,YUMMMM!! The Carbo flavor is my favorite!! 😆😆😆,0개
188,초초천재,오 ㅏ이건 진짜 미쳐따리💜💜,0개
189,JK,"엄청 급하게 드시고, 사실 조금 지저분하게 드시는 편인데 불편하지가 않고 자꾸 보게 됨",0개
190,JennyU,치킨무 먹는거 어디서 많이 본 거같은데 ㅋㅋㅋ,1개
191,,カルボって普通白なのに🤔もうカルボって名前にする必要あるのかな？🤔,0개
192,,"美味しそう(*`∀´*)
ブルダックのカルボナーラなら食べれそう
ドレッシングもあるから  作ってやってみたいと思います",0개
193,FoodCraverAsmr,The spicy fried chicken was looking so appetizing 👍🙂,0개
194,junkiyo,めっちゃ汚い食べかた🥶🥵,0개
195,쿠킹박스COOKINGPARKS,다리를 슬림한쪽부터 드시는....너무나 신기한 관경 그와중에 돈까스 치즈 늘어나는거 미쳤구요ㅠㅠㅠㅠㅠㅠ,0개
196,BigPockets,"Question, where do you find these noodles and wings? 
They look so delicious & I would love to try them!",0개
197,노명희,오늘도 맛있게 드시는 모습 대리만족 하고 갑니다~~치킨은 진리 입니다~ㅋ 오늘도 수고 하셨습니다~^^,0개
198,술시루SulSIRU,치킨 넘 깨끗하게 잘 발라서 드시네요♡,1개
199,Yelena,와 뒤집어지게 맛잇겟다 우ㅜㅜ,0개
200,NihArikA,"When I see you I always feel satisfied 😌😊 & hungry 🤤🤤
By the way love you & love your videos 🧡🧡💕💐🌼",1개
201,HavvaNurGnseven,Türk yokmu be TÜRKLER belli edin kendinizi 🇹🇷❤️🇰🇷,1개
202,EATWITHDANI,Her skin is gorgeous ❤️,0개
203,LeyMin,더는.. 못보겠습니다.. 왜이리 맛있게 드십니까 ㅠㅠㅠㅠ 흐어엉,5개
204,WannableArmy,Awwwn danielll❤️,4개
205,AnastasiaAyunAlvinus,Love this❤,1개
206,이가온,항상 재밌어욥!!!,2개
207,꾸깃아씨,1:44 곡괭이ㅋㅋ,0개
208,Yetzypink,Porque tu perrito siempre está dormido o siempre tiene carita de dormido? :3 lo amo 💗🐶🐾🐩,1개
209,kj,Omg u make the carbo noodles look so good but I CANT GET INTO IT,0개
210,amirijaz,Your. Videos are amazing but when you mix food than you eat it combinatioon amazing😂😍😘,1개
211,Yuuta,That looks so tasty😋want some also greetings from Germany.,0개
212,먹거리Meokgeori,"오늘도 영상이 무척 맛있습니다 ㅋㅋ 🤣🤣
푸메행님 최고^^ 👍👍",4개
213,요지,"흐어 방금 이거 보면서 불닭먹었는데 또 먹고싶자나요
불닭에서 헤어나올순없어.....",1개
214,오나의정국님,치킨은 언제나 옳다,0개
215,YokYok,Why Turkish subtitles in Spanish? 😂 And now English,25개
216,김규민,0:45자몽에다콜라...,0개
217,남우기Namwoogi,너무 맛있게 드신다........ ㅜ,3개
218,taestar,you're so pretty and good video btw !! <3,0개
219,parkjimin,"who is here while fasting      love from dubai love  u🎉🎉🎉😍 
EDIT; thank u i never even got 7 likes thanku so much love u",78개
220,ChynaWilson,So I always wanted to know where the crunch came from I think they just eat the bone,0개
221,Delightfulgirl,"I suck with spicy food, yet I still love this video so much 🤤",0개
222,,まじで食べ方汚い笑,0개
223,검정포메루루,저는 오늘 할머니가 치킨 사주신다고 하셔서 치킨 매니아 순살 후라이드 시켜먹었어요!,0개
224,이름,양이 적어도 너무 적네요... 눈물 난다,0개
225,,"까르보불닭이 매우면 이 치킨도 맵겠죠...? ㅜㅜ 맵찔이는 웁니다,,",0개
226,TiffySibal,Love here from the Philippines💖 your lowkey one the best mukbangers ever!!,14개
227,weirdokidzz,My favorite video so far 😭😭😭 I'm craving for noodles and chicken,0개
228,ShubhaUdupi,Common mukbangers! Please avoid using gloves when u eat...it is food and u r eating it...it feels like u r  performing a postmortem😅,0개
229,VeenaSinha,I haven't ate chicken from 4 months! Now I'm starving for it 😫,7개
230,이지Eazy,푸메님 말투 졸귀>< ~~~요오~~~,0개
231,,お腹すいてきます😂😂,0개
232,LeenaB,These mukbang channels definitely gain more views during Ramadan,0개
233,GeniusGamerM,I'm watching these mukbang videos and all of my friends are like .....🤨,0개
234,KimSoHyunUnnie,Wow that's so spicy Fume,1개
235,TashaLee,언니 이번영상이 그어떤영상보다 젤 행복해보여요:D,0개
236,saadallahelkhoury,"Wow sooo delicious , Sahtein 👍😋😍❤️",1개
237,LadyLuve,This is how you get attention into asmr:,0개
