닉네임,댓글,좋아요수,날짜
푸메Fume,"구독과 좋아요는 🥰🙏🏻 안녕하세요 푸메라니안 여러분🙇🏻‍♀️ 오늘은 새로나온 앵그리짜파구리 3개 & 집김치 4가지! 파김치, 총각김치, 오이소박이, 겉절이 가져왔어요!  짜파구리의 명성이 전세계로 뻗어나갔죠?! 그래서 그런지 앵그리짜파구리로 아예 출시되었길래 준비해봤어요! 🥰  짜장라면은 김치! 짜장라면은 김치맛이 8할이라고 생각합니다! 짜파게티류는 다양한 김치를 준비하는게 ★가장 맛있게 먹는 방법★이라고 생각해요. 집에 김치종류가 더 있기는 한데 자리가 모자라서 다 가져오지는 못했어요 🤭 여튼 앵그리짜파구리는 완전 기대이상이었어요! 앵그리너구리랑 짜파게티랑 따로 섞어 먹는 것 보다 더 맛있어요! 너구리와 짜파게티의 장점을 잘 조합해서 만든 라면같았어요! 약간은 칼칼하면서도 짜파게티의 달달함이 완전 잘 어우러져서 개취…. ❤️ 양은 좀 적은편인 것 같아서 드신다면 최소 2컵 부터 낭낭하게 드시면 될 것 같아요! 특히 김치들 다양하게 얹어서 먹으니까 제.젤.맛…. 뭐가 제일 맛있었다고 꼽기 어려울 정도로 다 맛있었어요 흑흑… 파김치는 양념이 치덕치덕 달달하면서도 매콤해서 역시 짜장라면과 잘 어울렸고요! 좋아하는 총각김치와 오이소박이 역시 시원해서…. 👍🏻 겉절이도 부추맛 가득, 칼칼해서 너무너무너무 맛있었어요.. 면을 너무 빨리 먹는다는 의견들이 있어서 매번 면을 먹을때는 나름대로 씹으면서 먹으려고 노력하지만.. 역시 10분도 안돼서… 증발해버리네요 😭 아무튼, 기존에 짜파구리 좋아하셨던 분들은 드셔보시는 것 왕 추천이에요! 너무 만족스러웠어요! 그리고 기회되시는 분들은 김치류도 여러종류 준비하셔서 드시면 더 맛있게 드실 수 있을거에요 💦 오늘도 시청해주셔서 감사합니다 오늘도, 내일도 맛있는 하루 보내세요 😘 


🔥My Instagram : http://instagram.com/fume_yamyam
🐶Sleepy White Fox's Instagram: http://instagram.com/mozziiya


Hi, guys! Today I prepared newly released Angry Chapaguri! Chapaguri X3 with 4 Types of Home-made Kimchi (Green Onion Kimchi, Ponytail Kimchi(Radish Kimchi), Cabbage Kimchi, Cucumber Kimchi! Chapaguri is a combination of Korean Black Bean Noodle Ramen “Chapaghetti” and Spicy Udon Ramen “Neoguri”! Korean people like to combine different kinds of ramen! Chapaguri was widely known all over the world after it had appeared in the movie “Parasite”! This cup noodle version of Chapaguri has been released recently, because, I guess, it’s so popular these days! Now we don’t need to combine those two kinds of ramen anymore 😂 Moreover, it was even tastier than the mixture of two kinds! I was surprised because it was more delicious than I expected! It seems that the good things of the two ramen are well combined! Also, it was spicy enough, and I could feel Black Bean Noodles’ sweet and deep flavor! Especially, it was perfect with four different kinds of kimchi! As for black been noodle ramen, I think kimchi is so important! It was a good decision that I prepared various kinds of kimchi! Each kind of kimchi has its own charm! Not only could I experience different kinds of tastes, but it was even more delicious! I want to recommend you to prepare several kinds of kimchi when you eat black bean noodle ramen! Thank you for watching my video today!


Halo semuanya! Hari ini saya menyiapkan 3 cangkir mie kacang hitam pedas yang baru dirilis yang disebut Chapa-Guri yang marah! Saya juga menyiapkan 4 jenis Kimchi buatan rumah (Kimchi Bawang hijau, Kimchi Ponytail (lobak Kimchi), Kimchi Kubis, Kimchi Mentimun! Chapaguri adalah kombinasi Ramen Mie Kacang Korea Hitam ""Chapaghetti"" dan Udon Ramen Pedas ""Neoguri""! Korea orang-orang suka menggabungkan berbagai jenis ramen! Chapaguri dikenal luas di seluruh dunia setelah muncul di film Parasite! Chapaguri versi mie piala ini telah dirilis baru-baru ini, karena, saya rasa, ini sangat populer akhir-akhir ini! Sekarang kita tidak perlu menggabungkan kedua jenis ramen itu lagi 😂 Selain itu, rasanya lebih enak daripada campuran dua jenis! Aku terkejut karena itu lebih lezat dari yang aku harapkan! Juga, itu cukup pedas, dan aku bisa merasa hitam rasa mie kacang yang manis dan dalam!


Terutama, itu sempurna dengan empat jenis kimchi! Adapun mie kacang hitam, saya pikir Kimchi sangat penting! Itu adalah keputusan yang bagus bahwa saya menyiapkan berbagai jenis kimchi! Saya ingin merekomendasikan Anda untuk menyiapkan beberapa jenis kimchi ketika Anda makan mie kacang hitam! Terima kasih telah menonton video saya hari ini!


हेलो सब लोग! आज मैंने नए जारी मसालेदार काले बीन नूडल्स के 3 कप तैयार किए जिन्हें नाराज चपा-गुरी कहा जाता है! मैंने 4 प्रकार के घर-निर्मित किम्ची (हरी प्याज किम्ची, पोनीटेल किम्ची (मूली किम्ची), पत्तागोभी किमची, ककड़ी किम्ची) भी तैयार की! कोरियाई ब्लैक बीन नूडल रामेन ""चपागेट्टी"" और मसालेदार उडोन रेमन ""निओगुरी"" का संयोजन है! लोग विभिन्न प्रकार के रेमन को जोड़ना पसंद करते हैं! चपागुरी फिल्म पारसाइट में दिखाई देने के बाद पूरी दुनिया में व्यापक रूप से जाना जाता था! चपागुरी का यह कप नूडल संस्करण हाल ही में जारी किया गया है, क्योंकि, मुझे लगता है, यह इन दिनों बहुत लोकप्रिय है! अब हम उन दो प्रकार के रेमेन को अब संयोजित करने की आवश्यकता नहीं है, इसके अलावा, यह दो प्रकार के मिश्रण की तुलना में भी स्वादिष्ट था! मुझे आश्चर्य हुआ क्योंकि यह मेरी अपेक्षा से अधिक स्वादिष्ट था! इसके अलावा, यह काफी मसालेदार था, और मैं काला महसूस कर सकता था बीन नूडल्स का मीठा और गहरा स्वाद!


विशेष रूप से, यह चार अलग-अलग प्रकार की किम्ची के साथ परिपूर्ण था! काले सेम नूडल्स के लिए, मुझे लगता है कि किम्ची बहुत महत्वपूर्ण है! यह एक अच्छा निर्णय था कि मैंने विभिन्न प्रकार की किमची तैयार की! जब आप काले सेम नूडल्स खाते हैं तो मैं आपको कई तरह की किमची तैयार करने की सलाह देना चाहता हूँ! आज का मेरा वीडियो देखने के लिए धन्यवाद!


Chào mọi người! Hôm nay tôi đã chuẩn bị 3 chén mì đậu đen cay mới được phát hành có tên là Chapa-Guri tức giận! Tôi cũng đã chuẩn bị 4 loại Kim chi làm tại nhà (Kim chi hành tây, Kim chi đuôi ngựa (Kim chi củ cải), Kim chi cải thảo, Dưa chuột Kim chi! Mọi người thích kết hợp nhiều loại ramen khác nhau! Chapaguri được biết đến rộng rãi trên toàn thế giới sau khi nó xuất hiện trong bộ phim Parasite! Phiên bản mì cốc này của Chapaguri đã được phát hành gần đây, bởi vì, tôi đoán, ngày nay nó rất phổ biến! không cần kết hợp hai loại ramen đó nữa Hơn nữa, nó còn ngon hơn cả hỗn hợp của hai loại! Tôi ngạc nhiên vì nó ngon hơn tôi mong đợi! Ngoài ra, nó đủ cay và tôi có thể cảm thấy đen mì đậu 'hương vị ngọt ngào và sâu sắc!


Đặc biệt, nó rất hoàn hảo với bốn loại kim chi khác nhau! Đối với mì đậu đen, tôi nghĩ Kimchi rất quan trọng! Đó là một quyết định tốt khi tôi chuẩn bị nhiều loại kim chi! Tôi muốn khuyên bạn nên chuẩn bị một số loại kim chi khi bạn ăn mì đậu đen! Cảm ơn bạn đã xem video của tôi ngày hôm nay!",393개,2020. 5. 9.
itsyourarlet,"No one:
Literally no one:

Me:
Watching while fasting.",587개,2020. 5. 9.
allaboutkpop,WHO ELSE WACHING THIS IN the BED and starving,165개,2020. 5. 9.
GafarMohammed,"Me: Teacher can I eat 
Teacher:no 
The back of the class:

😂😂😂",13개,2020. 5. 9.
KimTaehyung,I love the most when u give a nice smile after eating ur first bite ..... just love u ..,8개,2020. 5. 9.
KhulanBayrmagnai,"I really love her because she's one of the rare people that put their hair up on a ponytail when they eat cuz if they don't, it just looks not nice and uncomfortable for me.",71개,2020. 5. 9.
yoongiskitten,"my family : sleeps peacefully

me : watches this every midnight",50개,2020. 5. 9.
KoreanLover,"I notice if she is eating noodles, she doesnt chew it well. She only chew maybe 2 to 3 times then swallow immediately.",56개,2020. 5. 9.
Dilan33,💕HARİKASIN TÜM GÜN SENİ İZLİYORUM 👍😍VE SANIRIM BAĞIMLI OLDUM😂,15개,2020. 5. 9.
DaniellyTops,"O melhor é ver o sorrisinho dela enquanto come, tão fofa💖",2개,2020. 5. 9.
zazamukhtar,I love how Fume prepares her noodles. her noodles always looks so appetizing and doesn't look dry like other mukbangers,36개,2020. 5. 9.
AliAlassdi,나는 아랍 채널을 사랑하고 한국 내 국수를 시도 할 수 있도록 노력하겠습니다,12개,2020. 5. 9.
nawal10,Who cares about the food when her skin is this flawless 😍😍,50개,2020. 5. 9.
NusijHong,2:25 언니..안씹고 걍 삼키시는데ㅜㅜ 그러면 위에 안좋아요ㅜㅜㅜ,21개,2020. 5. 9.
Katy,麺動画と時いつも思うんですけど、口に入れてから秒で飲み込みますよね笑笑,2개,2020. 5. 9.
DerekRibbeck,Are you supposed to cook the eggs 1st and then put them on your noodles!,1개,2020. 5. 9.
luckyjaybarangan,"how did she enjoy her mukbang when she just chew it less than 15 times every take??? lol.. it feels me choking seeing it, but not bad though,,, I'd like to have one soon😁",1개,2020. 5. 9.
AminaBegum,I’m literally fasting and my mouth is going crazy,35개,2020. 5. 9.
고미TVGOMITVASMR,just lying here imagining whats the food taste like,176개,2020. 5. 9.
ElreyJohn,I love it. The big bites and the slurping sounds. I want to try this after this pandemic 🤗,1개,2020. 5. 9.
xcuseyoubitch,instead of watching people eat lemme watch how to use chopstick,2개,2020. 5. 9.
MustaffaBhat,"Don't you ever dare to watch those videos while fasting because now I'm craving real bad🙃😪




So yeah that period of time ended too let's get it eid mubarak everyone😍",23개,2020. 5. 9.
FacelessChef,I would really like to try this noodles!! Spicy is good :),1개,2020. 5. 9.
NadiaNadia,1 mint ago sisters.....fume shows it's big eating show....❤️,25개,2020. 5. 9.
GracefullyWendy,"Can't wait for lockdown to be over here in my place  , can't wait to get some fire noodles and  CVfoods!!! 
I've been craving for them since forever😧😧",1개,2020. 5. 9.
Aqilahofficial,It looks like it's sticky ... but the sound of the noodles is very ticklish ..😁🤣🤣,14개,2020. 5. 9.
rheannegonzales,"Dancing balloon in front of the store😂 Love you fume, and your choice of foods💕💓",1개,2020. 5. 9.
VinishaPrincy,OMG😭 my mouth starts watering 😭❤.. I need to eat this,9개,2020. 5. 9.
TastyASMR,"This is how many people loves Fume's dog 
⬇️
⬇️
⬇️",222개,2020. 5. 9.
audreyloke,she kinda looks like jiho from oh my girl,15개,2020. 5. 9.
yueherngchow,"Me watching this video: (saliva everywhere )

My sister:OMG the floor is saliva!!Help!!!!😭",5개,2020. 5. 9.
samasy,一口がおっきくて音も顔も綺麗で好き！！！！,4개,2020. 5. 9.
KittyVioe,"Your videos calm me down, cause instead of feeling emotions I get hungry 😂",1개,2020. 5. 9.
PiePieASMR,"Watching her eating makes me hungry
Who is same?",63개,2020. 5. 9.
,これは…いつか絶対に通販で買おう✨,2개,2020. 5. 9.
chiekoyagi,もっとよく噛んで食べて❤,2개,2020. 5. 9.
,咀嚼音たまらない〜！そして、美味しそうな大根！！！,1개,2020. 5. 9.
wellaconnie,"And now Im hungry watching fume eating!🤤🤤🤤hmmmm...tasty! I loved your blogs fume!😍now I know what to eat right now during lockdown!😊

I think fume is a little bet fat now? It's because of the lockdown?🤔",1개,2020. 5. 9.
민투닝,ㅠㅠㅠㅠㅠ다 넘넘 조은데 넘 몇번 안씹고 넘기시는거같아여ㅠㅠㅠ조금만 더 씹어삼켜주셔요🥰,3개,2020. 5. 9.
Reason4Termination,A single girl with a dog is dead end for the love life :'D,16개,2020. 5. 9.
Nur,"فيديووو يجننننن ولطعم 😭😭😭😭عود اني ما ماكله بس احسه طيببب 😭💗💗💗💗💗
ايلافيوو 💜",13개,2020. 5. 9.
moka,めっちゃ美味しそ〜！,2개,2020. 5. 9.
snehlatasingh,Are u just swallowing all noodles? I don't think u r eating.,7개,2020. 5. 9.
aneesaeriL,"The foods look so good, she is eating it deliciously,, when can i eat some jajangmyeon too 😭😭😭😭",5개,2020. 5. 9.
,色んなキムチがあっていいなぁ。美味しそう！,1개,2020. 5. 9.
PaidPaijah,Is she put the microphone inside her mouth 😌 It sounds so clear,8개,2020. 5. 9.
CozeASMR,Who else wishes they can taste Fume's cooking? All her dishes look delicious,95개,2020. 5. 9.
JinHyung,I should do this on my next EatJin episode 😂😂,13개,2020. 5. 9.
,大根をよこせ！やばいww,1개,2020. 5. 9.
박민서,"공부할때 마다 푸매님 영ㅈ상 틀고  무엇가를 하면 집중잘 되는것 같아요
(저만에 생간입니다)",1개,2020. 5. 9.
,ほんと一口でその量食べれるのすごいし好き,3개,2020. 5. 9.
MineeLuvv,"Who else is fasting while watching this ?
*So hungry now*😭😭",97개,2020. 5. 9.
SmilewithDipanwita,That sound makes me hungry than eating 🤤,0개,2020. 5. 9.
,ちゃんと噛んで〜😂,2개,2020. 5. 9.
DianaYusof,Where are you from sis? I like you eat 😊 from Malaysia 😀 🇲🇾,1개,2020. 5. 9.
,モッパン自体は美味しそうですごくいいのに、あまりにも咀嚼回数が少なくて本当に心配になる…もっと味わってほしい…,1개,2020. 5. 9.
KurniaKhairunnisaa,you should chew the noodle more:( the after effect wont be that good when you keep eating like that..,0개,2020. 5. 9.
튜브도성,푸메님 볼때마다 느끼는데 여왕의교실 이영유양 닮은거같네요.,1개,2020. 5. 9.
THICCQUEENMAMAKEEPDEMBOYZPROUD,I’m sorry I know this isn’t mukbang related but can you tell us how your skin is so glossy and clear???🥺💕,6개,2020. 5. 9.
국밥빌런,짜파구리를 아예파는구나 처음봤네....ㅋㅋㅋㅋㅋㅋㅋ,0개,2020. 5. 9.
ParisaDlshad,I’ve been a fan before 2020❤️🥰love you fume🍯🥰👑,6개,2020. 5. 9.
siinimiini,하.. 역시 면 먹방은 언니가 최고에여 그중에서도 꾸덕면은... 진짜 미쳐요🤤 저는 후루룩 소리 나는거보다 왕창 집어서 한입에 와앙 넣어버리는거 완전 좋아하거든요...😋,11개,2020. 5. 9.
pournamigd,why nobody is talking about how gorgeous she is!!!! 😍😍😍😍what a clear skin she has ♥️♥️♥️♥️,0개,2020. 5. 9.
RofidahBerlianti,Ohhh I wanna try those foods! It looks delicious😍🤤😭,0개,2020. 5. 9.
AngelaJung,"FOR ME, SHE REMINDS ME OF OH MY GIRL'S ARIN 🥰",0개,2020. 5. 9.
GauriPatil,You know you are a true foodie when you flirt with your food. 😂❤,6개,2020. 5. 9.
WaKanda,"There is a legend here in our community that when you eat twin fruits like banana, chance is, you will have twin babies. 😁",7개,2020. 5. 9.
,食べながら微笑んでるのが可愛すぎて大好きです💖💖,0개,2020. 5. 9.
황승수,She's BEAUTIFUL ❤️,8개,2020. 5. 9.
BabitaSingh,Why don't you do a show on spicy food like chilly Hunter,0개,2020. 5. 9.
MARIAM,"احبك مره واعشق فديوهاتك🖤🥺🥺💓انا صايمه اتفرج😂😂😂
كم شخص صايم ويتفرج هنا؟😂😂
اشترك بقناتي اذا انت عربي",47개,2020. 5. 9.
DizzyWalffles,Her face in 2:21 lmao so iconic😊😇... who agrees with me?👍 (This comment is no hate if you see it that way I am truly sorry) Love you & your videos keep doing what your doing.💗,1개,2020. 5. 9.
유주형,항상 맛있게 드시고 진짜 팬이에요ㅠㅜ!!항상 응원합니다,0개,2020. 5. 9.
10AOI,"美味しそーー食べたくなる、、
それと美人すぎる💓💓",2개,2020. 5. 9.
,美味しそうすぎるし可愛すぎる❤️❤️,0개,2020. 5. 9.
JENOMEATS,Dog’s very cute 😍,6개,2020. 5. 9.
소리아,앵그리 짜파구리 진심 맛이쑤ㅠ 짜파구리 별로 안 좋아하는데 저건 진심 맛있네요ㅠㅠ,2개,2020. 5. 9.
CrazyGalFromNewBedford,I try and slurp my noodles like them but I can’t there legit pros,6개,2020. 5. 9.
CM,"Me: doesnt even like noodles
Also me:",0개,2020. 5. 9.
AphamKonyak,Her skin😍😍😍😍I'm in love with her skin indeed😋😊,0개,2020. 5. 9.
MineeLuvv,"Who else is watching this in bed with a lake on your mouth??
👇😭😭",123개,2020. 5. 9.
BoyfriendBestfriend,"Awww I love her sweet voice, her cute face, her own style..everything!! I like it..I hope you had enjoyed doing this!!😍😘❤",2개,2020. 5. 9.
arielzshellii,Awwww I also have that toy from ‘Pets’!,0개,2020. 5. 9.
kimtarou,美味しそう!,1개,2020. 5. 9.
georgiarose,I'm gonna ask my brother to buy ramen after this. Ah I'm so hungry watching this!!,0개,2020. 5. 9.
Shelly셸리,Who’s laying hungry on bed?🥺,52개,2020. 5. 9.
Heaven,Does Black Bean noodles taste good? 😭,1개,2020. 5. 9.
HaruoShigihara,カップラーメンはカップで食べるから美味しいのですお皿に乗せると何故か美味しくなくなる楽しい動画ありがとう！！,0개,2020. 5. 9.
S,3:30 大根をよこせ！笑,0개,2020. 5. 9.
YarsiHalida,Hi! I'm from indonesia😀^^,1개,2020. 5. 9.
VeenaSinha,Can I accompany you in eating?? It looks so delicious~,8개,2020. 5. 9.
MILKYWAY,comments from Indonesia!,1개,2020. 5. 9.
ShrimpTail,I’ve said it a million times and I’m gonna say it again she looks like Park rose,19개,2020. 5. 9.
CrazyGalFromNewBedford,I love her but she needs to put up new videos I think I’ve watched every single one 🤣🤣🤣,0개,2020. 5. 9.
채널시댕시골댕댕,이거진짜 맛없던데...ㅠㅠ흠,0개,2020. 5. 9.
MaryAnn,Hi. Love from PH🇵🇭❤❤❤,4개,2020. 5. 9.
떠리Eatwithrelishtteori,세상 깨끗하게 드시는분!!🧡,1개,2020. 5. 9.
ALLFORONE,I love her. She so beautiful 😍,0개,2020. 5. 9.
너구으리당,진짜 먹방 잘 안보는데 이거보면 왜 먹방보는지 알거같음... 매일 밤 자려고 asmr 찾는데 항상 보게되서 라면을 끓이게 됨....,3개,2020. 5. 9.
pipiss0,아니 언니 반칙이야ㅜㅜ밤에 이걸 봐버려써🤦‍♀️😂❤️,0개,2020. 5. 9.
레몬,"푸메님 단정한 모습이 먼저 눈에 들어오네요
칠레레팔레레 긴 귀고리도 아니고
목걸이도 아니고
깔금한 하고 정리된 모습의 푸메님이
넘 조으네예~~~♡
앵짜구리 맛잇게 보입니당~~
셋팅을 전갈하게 해서~
더~ 먹음직 스러운것 같으네예~
김치3종류가 우찌 그리도
빛깔도 조은지~ 젖가락 들고 띄~가고싶네예 ㅋ
영상잘 보앗어예~~
응원해요~~~🧡💛💚💙💜💖🎵🎶💃",13개,2020. 5. 9.
HasteeDoshi,She's literally the best Mukbanger I've ever seen ♥,17개,2020. 5. 9.
MrsLidiaLaw,"hi i like to eat you and spend it in large portions, always healthy yes i come from indonesia🇮🇩",0개,2020. 5. 9.
NizamMahesa,ㅗㅁㅕ ㄴㅁㅛㅁ ㅇㅁㄷㅕ ㅕㅜㅇㅑㅜㄷㄴㅕㅁ,1개,2020. 5. 9.
RamonaClawson,"That looks so good, better than my tuna sandwich I just had. lol Your dog is so cute.",0개,2020. 5. 9.
SicaASMR,So pretty even when eating <3,0개,2020. 5. 9.
MelchorToraja,Please chew whatever you are eating! It's bothering hahaha,1개,2020. 5. 9.
구프로,웃으시는거보니깐너무이쁘시다~^^♡!,1개,2020. 5. 9.
이정숙,"항상잘보고잇습니다  선행하시는거 보고 좋아하게됫습니다  항상건강챙기세
요",2개,2020. 5. 9.
고은아,짜파구리 언제쯤 나오나기대했는데~끓여먹고싶어도 라면 두개가필요하니 혼자서는 잘안먹게됐었는데~~대박 드디어 나왔군요~~^^언능 쟁여야겠어요~~푸메님 항상 맛있는음식과 꿀정보 너무감사드려요~~앞으로도 열심히 챙겨볼께요~~❤,3개,2020. 5. 9.
VaughnHart,Your hands are quite beautiful. :-) How's life over there? I was just reading about Itaewon's new cases.,0개,2020. 5. 9.
MalsawmzualiSathing,I watched mukbang while I was getting hungry to make me gets more hungry 😑,0개,2020. 5. 9.
성빈,제.. 제가 푸메님 영상이 이게 처음인데... 그... 4번만 씹고 삼키신 거 편집한 거... 아니시죠...? 입 속이... 블랙홀... 😳,0개,2020. 5. 9.
LovelyMalones,hello beautiful 😍❤️💗,0개,2020. 5. 9.
refaniajuanitha,0:26 ㅋㅋㅋㅋㅋ,2개,2020. 5. 9.
안뇽,나무 숫가락 인줄알았는데 나무밥주걱...... 엄청맛나보여요...,1개,2020. 5. 9.
라일리,너무 맛있게 드셔서 지금 바로 사러갑니다💕,0개,2020. 5. 9.
,３回くらいしか噛んでない😭😭🤣,0개,2020. 5. 9.
갑니다요마님,여기 먼데? Bi8fdrukouffthjiiuyㅋㅋ,0개,2020. 5. 9.
SammiYu,"好羨慕你ㄛ⋯⋯
又漂亮又瘦。又能享受美食",0개,2020. 5. 9.
farhanahfathima,Who else just watches her videos and starve?🙃,47개,2020. 5. 9.
,この大きいスプーンどこ探しても無い😭,0개,2020. 5. 9.
,kaltupunuーdoru😍👍❤️❤️❤️,1개,2020. 5. 9.
86,"プメさん、おはようございます😄
チャパゲティ美味しそうですね😋😋
あと、やっぱり葱のキムチと大根のキムチが凄く食べたいです😋😋
今日も、プメさんを観れて良かったです🤗🤗
毎日、応援📣してます♥🥰🥰",2개,2020. 5. 9.
edelweissfdlh,Salfok mukanya glowing bet hehe😂😂,1개,2020. 5. 9.
AngelinaCativo,I wonder if her tounge gets numb whenever she eats spicy😂,69개,2020. 5. 9.
katygoria,"o kimchi <3, meu pai, eu amo essa mulher!!",0개,2020. 5. 9.
ADTurtle,I can't  even  eat I cup of noodles,1개,2020. 5. 9.
DalenaIna,Cantik banget siiiihh😍😍...from Indonesian  👍,1개,2020. 5. 9.
FariIslam,She look so pretty so beautiful      so cute that sometime I just watch her video  to see her face,0개,2020. 5. 9.
,هل من عربي موجود هنا ولا انا لحالي مين صائم حط لايك واشتراك فديتكم,57개,2020. 5. 9.
이이,와 정말 별로 안씹고ㅠ넘기시네요ㅎㄷㄷ 건강에 안좋을수도 있을꼬겉어요ㅠㅠ 구치만 잘보고갑니당!,0개,2020. 5. 9.
,自動通訳の内容が面白くて凄く好き,0개,2020. 5. 9.
박야옹,헥 언니 씹으면서 드셔야죠 ㅜㅜ 건강에 해로울까 걱정이에요 근데 언니 면 먹방이 너무 중독성있어요 키키❤️,0개,2020. 5. 9.
JonKarmanASMR,OMG!!!!!! I was like how can you eat it all??????? it's too spicy 🌶 🥵,1개,2020. 5. 9.
JoseDan,I love your dog. Is way to cute!,3개,2020. 5. 9.
송혜선,언니 혹시 남주혁씨 아니세요? 세번씹으시네ㅋㅋㅋ저도 저거 먹어보고싶은데 근처에서 파는걸 못봤어요ㅜㅠ울고있습니다,1개,2020. 5. 9.
TheObserver,Omg this is the best meal ever 😲,0개,2020. 5. 9.
,謝謝你🙏每次影片都翻譯成中文字幕～真的很用心😘！ASMR頻道中最喜歡你的😍,0개,2020. 5. 9.
아르헨티나,2:23 꿀꺽,0개,2020. 5. 9.
K요니,면은 거의 씹지 않고 삼키기....  그저 놀라움,41개,2020. 5. 9.
AnaCarolina,"Very cute!!
Brazil love you!🇧🇷❤🇰🇷",0개,2020. 5. 9.
ColeandDylanSprouse,she's so damn beautiful ^^,0개,2020. 5. 9.
으앙,끓여봐요 짜장의 숲♡,1개,2020. 5. 9.
MaronPaclian,Our angel keeps on kicking in our mommy's tummy. Seems like someone is hungry 😂🤰🏻,2개,2020. 5. 9.
,麺を食べてる動画が1番好きです！豪快な一口と、麺をすする様が気持ちいい☺️,21개,2020. 5. 9.
,吃就吃好好，不用一直拿布娃娃，麵條沒有冒煙，也一直那邊吹,0개,2020. 5. 9.
eliananiunamenos,근데 한컵 양 실화냐.. 너무 적은디,0개,2020. 5. 9.
JessiVigil,My favorite Mukbang Channel!! Fume is so beautiful.,0개,2020. 5. 9.
육미애,푸메찐펜,1개,2020. 5. 9.
