닉네임,댓글,좋아요수,날짜
백승찬,"푸메님ㅠ 미안해요😢 늦게왔어용ㅜ
어제 일이 생겨서..ㅜㅜ 지금이라두 영상보고 얼른 댓 써욤💕😘
ㅎㅎㅎ 푸메님이 맛있게 드시는 모습 보니깐 저두 덩달아 기분이 좋아지네욤😄😄
오늘영상도 잘보고가요〰〰 푸메니임😍
사랑함니당ㅎ",0개,2020. 5. 29.
AnnaSavkina,Очень аппетитно))) Спасибо за новое видео),3개,2020. 5. 29.
창식이,늘 ~ 잘 시청 하고 있습니도 ㅎㅎ,1개,2020. 5. 29.
JulianaGural,"Enjoy eating unnie, love lots🤎",0개,2020. 5. 29.
udiptakumar,I love watching your vedios...😁👍,2개,2020. 5. 29.
TashiDemaa,Oooo god i am on diet and you are making me hungry😢,0개,2020. 5. 29.
VaughnHart,You really are a wonderful person... from what I see. 😍 😀 What has you so stressed? The bite of the coriander sounded really great! 🧔🏿👍🏾,0개,2020. 5. 29.
SunnieFoo,I'm hungry even though Im done eating my lunch,0개,2020. 5. 29.
MJLee,"Yummm!! It looks so tasty. Now I HAVE TO make it myself. 
Honestly, I want to eat whatever you're eating, Fume XD",0개,2020. 5. 29.
,"画像が鮮明で凄く綺麗😃
臨場感が伝わります😃",0개,2020. 5. 29.
princessogieva,"Fume u make me Soo hungry 
Watching you eat is so satisfying",1개,2020. 5. 29.
ASMRTonkichi,So delicious 😍💕💕,1개,2020. 5. 29.
쩡이와댕댕이ZengandDaeng,오늘은 매운마라상궈랑 중국식고기물만두까지 먹어서 아주 보기 좋은 것 같아서 좋네요♡,0개,2020. 5. 29.
NiniSarr,"Hello Fume, I watch you most every day and I enjoy and like your video and you're puppy best wishes from south of  France Cannes 🙏🙏🙏😍😍😍🇫🇷❤️❤️❤️❤️",0개,2020. 5. 29.
먹거리Meokgeori,"마랑상궈^^ 
최고😋😋👍",1개,2020. 5. 29.
DINOSHI,I always watch 푸메 먹방 videos in an empty stomach just right before i go to sleep ㅋㅋㅋㅋ,0개,2020. 5. 29.
MennaMohammad,"나는 너무 많이 굶주리고 있어, 내가 물기를 가질 수 있습니까? 🙁",0개,2020. 5. 29.
선물단타고수감프로,"영상 잘보고갑니다 ~
엄지~~~~~~~~~👍(척)",1개,2020. 5. 29.
움쪽,푸메님... 요즘 과제때문에 많이 힘드신가요..? 떨어지는 재료를 보시고 낙제를 생각하셔서... 저도 덩달아 슬퍼졌네여...으흑으흐흑,1개,2020. 5. 29.
,❤ifrom iraq🇮🇶🇮🇶🇮🇶 ilove 😍😍😍you,4개,2020. 5. 29.
BENSPAGHETTIMukbang,"Your dog is so charming,, 🐶🐕,,
I love watching you eating 😍😋",0개,2020. 5. 29.
아아아앙,안녕하세요  언니들~~♡♡♡,1개,2020. 5. 29.
ChhouChanrachana,We love you fume♥️💦,0개,2020. 5. 29.
,看起來好好吃🤤🤤🤤,0개,2020. 5. 29.
VannieEats,The spicy dry pot look so good with the dumplings!! I wish I can have a bite 😍,4개,2020. 5. 29.
UmeKulsum,Me and my family enjoys watching ur video..🥰love from india ♥️,1개,2020. 5. 29.
미정,"마라샹궈,마라탕 둘다 아직 못먹어봤는데
너무 맛있게 드셔서 꼭 먹어보구 싶네요😆",0개,2020. 5. 29.
SalmaAhmed,OMG food be jealous of how beautiful fume is 😂😂😂,0개,2020. 5. 29.
Alifahh,Onna❤,1개,2020. 5. 29.
이선균목소리나병훈,아.... 마라샹궈에다가 이과두주 먹고 싶다...★☆,0개,2020. 5. 29.
KimRoen,"Fume, Can I Ask You Something? When this Covid 19 is over can you come to the U.S. and cook for me?? PLEASE!!!! 
Everything you eat looks sooooooooooooooo good!!!! PLEASE cook for me everday.😂🤗😘",0개,2020. 5. 29.
FatmaaAzaly,"i love you ❤️😘♥️ f,,,",4개,2020. 5. 29.
뿌룩,왕 저도 샹궈 이렇게 해 먹고싶어요ㅠㅠㅠㅠ 그저께 도전했다가 실패해서 마라향만 나는 짠 마라샹궈 먹었어요 또륵...,0개,2020. 5. 29.
PetiteEats,It looks so good!,0개,2020. 5. 29.
nctscoffeemaker,언니 너무 귀엽다!! 🐰🌸,0개,2020. 5. 29.
다금DAGUMMUKBANG,오늘도 눈도 귀도 호강하고 갑니당....💛💛,0개,2020. 5. 29.
이건민,강아지 넘 귀여워요,1개,2020. 5. 29.
SingHwaLim,好吃吗。,1개,2020. 5. 29.
AnotherASMR,Great video!! Love the dumplings 💛💛,0개,2020. 5. 29.
starbucksmania,오늘도 잘 보고 갑니다ㅎㅎ,1개,2020. 5. 29.
알파카파카파까,평일 마무리를 언니 영상으로 하니까 너무너무 기뻐요 꺄웅 주말 햄보카게 보내세요 🥰🥰,0개,2020. 5. 29.
DorothyYork,喜欢喜欢😍，不过中文名是“麻辣香锅”哦😁，不是“马拉香国”😂,0개,2020. 5. 29.
보햐밍,"푸메님, 오마이걸 지호님닮으신것  같아요!!😋
오늘 영상도  재밌게 잘 봤어요!!!🥰🥰",0개,2020. 5. 29.
chanme,日本語字幕やめちゃったんですか😭😭？,0개,2020. 5. 29.
LorieJeanMontao,Hungry right now and your video is satisfying enough 😍😍,1개,2020. 5. 29.
김샤엣,깔끔해서 좋네용 ㅠㅠ,1개,2020. 5. 29.
갸꿀띠,난 마라탕도 못먹는 초보지만... 왜맛있어보이지ㅎㅎ 언제봐도 예쁘시군요~~,0개,2020. 5. 29.
HoaTran,Remember take care yourself (covid-19). How are you ????,2개,2020. 5. 29.
류가이,누나 섹시해요ㅜㅜ,1개,2020. 5. 29.
JUNGKOOK,سلام عليكم عرب 💜💜💜,3개,2020. 5. 29.
DannaSaa,YOU ARE THE BEST!!!!! LOVE U SO MUCH!!,1개,2020. 5. 29.
PattyMin,Hi Fume it looks delicious 😋💕,0개,2020. 5. 29.
DrAcula,"pretty face, perfect skin, beautiful eating manners, cannot put on weight after all the eating.... are you a goddess?",0개,2020. 5. 29.
MahimaThapa,I think you hv gained a lil weight due to lockdown😅most of us hv gained weight this year,0개,2020. 5. 29.
GAKMAN,LOVE YOU,1개,2020. 5. 29.
SayokoTakano,Muito barulhos  para refeição me deixa triste,0개,2020. 5. 29.
,"넌 정말 좋아! 그냥 당신이 먹는 기쁨과 아름다움,심지어 침을 흘리고. 당신에게 행운을 빌어 요!😊👌👏",0개,2020. 5. 29.
NadiaNadia,Hi my princess sister ....how are you...you looking so pretty coz red colour t_ shirt... thanks ...love u.....pls 1 love for me❤️♓😍,2개,2020. 5. 29.
미노러빗,사실 언니 매일 마라 영상만 올라와도 전 다 이해해요 마라는 일주일에 한 번씩 수혈 안해주면 진짜 죽을 수도 있어요 진짜 전 무조건 일주일 일마라,0개,2020. 5. 29.
HaramKim,퓨메님 영어 잘하시내요 아유는 자막!,0개,2020. 5. 29.
OishiAsmr,The sounds are so good!!,0개,2020. 5. 29.
Ak,양념 중매우맛있겠다❤항상예쁘다아∼,0개,2020. 5. 29.
Mentalaine,Favourite mukbanger of all time ❤️✨,0개,2020. 5. 29.
조해인,"언니, 너무 사랑해요❤🧡💛💚💙💜",0개,2020. 5. 29.
FitriNizam,Terima kasih kakak sudah menyertakan bahasa indonesia dlm komentar...  Salam sayang buat kakak dari indonesia.. 😘😘😘,0개,2020. 5. 29.
최서진,마라샹궈 항상 어려운 음식이라고만 생각했는데 영상보고 지금 먹고싶다는 생각이 바로 들엇어요😽💖,1개,2020. 5. 29.
