,youtube_id,comment,like_num
0,푸메Fume,"안녕하세요 푸메라니안 여러분🙇🏻‍♀️ 오늘은 까르보불닭볶음면 덕후라면 필수로 먹어야 하는! 새로나온 멕시카나 까르보불닭치킨🍗과 까르보불닭볶음면 & 멕시카나 치즈돈까스 & 미니수작핫도그까지 준비했어요! (Feat. 데빌코코소스) 💕 20일에 출시하는데 미리 먹어볼 수 있었어요 💞 (+ 레전드급 치킨을 제공해주신 멕시카나 진심으로 감사드립니다!) 결론부터 말씀드리자면 ★까르보불닭볶음면 좋아하는 저에겐 진짜 레전드급 양념치킨이었어요★ 까르보불닭 양념이 바삭한 치킨위에 치덕치덕 한가득 발라져 있는데… 면으로 먹어도 맛있는 양념이 치킨과 만나니까 더 JMT이에요.. 지난번 불닭치킨도 맛있게 먹었는데, 오늘 준비한 까르보불닭치킨은 더 맛있어서 깜짝놀랬어요.. 달달하고 고소하고, 끝맛은 살짝 매콤한게 너무 제 스타일 😭👍🏻 많이 맵지 않아서 매운음식, 불닭치킨 못드시는 맵찔이 분들도 맛있게 드실 수 있을 것 같아요!(까르보불닭도 매워서 못드시는 분들은 사이드메뉴 같이 챙겨드시면 좋을 것 같아요)! 준비한 사이드메뉴 바삭한 치즈돈까스도 치즈가 쭉 늘어나서 너무너무 맛있었고요, 서비스로 주신 쫄깃한 수작미니핫도그까지… ㅎ ㅏ…. 정신줄 놓고 먹었네요… 까르보불닭치킨위에 까르보불닭면 올려먹으면 매우진짜 맛있어요! 함께 드셔주세요.. 소스도 함께 온 불닭마요 그리고 따로 추가한 불닭소스, 데빌코코소스(매콤달콤새콤 뭐라 형용할 수 없는 맛있는 맛) 까지 함께먹으니까 그냥 까르보불닭 덕후의 환상의 한 끼 였습니다.. 지금 출시기념으로 까르보불닭치킨 주문하시면 미니핫도그도 증정중이니까요, 까르보불닭 좋아하시는 분들은 꼭! 제발! 드셔보셨으면 좋겠어요 🥺 친구랑 함께 먹는다면 불닭치킨 한 마리, 까르보불닭치킨 한 마리 해서 번갈아 먹는것도 맛있을 것 같아요! 오늘도 시청해주신 여러분들 정말 감사합니다 🙏🏻🙆🏻‍♀️

🔥My Instagram : http://instagram.com/fume_yamyam
🐶Sleepy White Fox's Instagram: http://instagram.com/mozziiya

Hi, guys! Today I prepared Carbo Fire Fried Chicken with Carbo Fire Noodles, Cheese Pork Cutlets, and the Mini Corn Dog! Carbonara Fire Noodles is a popular spicy ramen because it’s creamy and less spicy than Fire Spicy Noodles! Last time, I enjoyed Fire Noodles flavored Fire Fried Chicken so much! And I heard the news that Carbo Fire Fried Chicken has been released recently and I was curious about it, so I prepared it! The conclusion is, it was super tasty! I was so surprised! As soon I took the first bite, I came to think “it’s the best...!” I really love Carbo Fire Noodles as well as Fire Noodles! I was really happy due to lots of Carbo Fire Noodle sauce on chickens which is a perfect shot on my preference! The creamy and spicy sauce went perfectly well with chickens as well as noodles! Also, cheese pork cutlets, chewy mini corn dog, and three kinds of sauce (Fire sauce, Fire Mayo sauce, Devil sauce(Coconut Flavored Spicy Sauce)) helped me enjoy the meal so much.. I think it would be the best chicken to someone who likes carbo fire noodles! In my opinion, Korean fried chickens are so various and continually improve! I hope you could try this! Thank you for watching my video today!
Hai kawan! Hari ini saya menyiapkan ayam goreng pedas carbonara dengan mie api karbonara, irisan daging babi keju, dan hot dog mini Korea! Mie api Carbonara adalah ramen pedas yang populer karena mie ini krim dan kurang pedas daripada Mie Pedas Api! Terakhir kali, saya sangat menikmati mie api rasa ayam goreng api! Dan saya mendengar berita bahwa carbonara fire fried fried telah dirilis baru-baru ini dan saya ingin tahu tentang hal itu, jadi saya menyiapkannya! Kesimpulannya adalah, itu super lezat! Saya sangat terkejut! Segera setelah saya makan gigitan pertama, saya berpikir, ""ini yang terbaik ...!"" Saya sangat suka mie karbonara api dan mie api! Saya sangat senang karena banyak saus pedas carbonara pada ayam yang merupakan pilihan sempurna untuk preferensi saya! Saus kental dan pedas cocok sekali dengan ayam dan mie ramen! Juga, irisan daging babi keju, hot dog mini renyah, dan tiga jenis saus (saus pedas, saus mayones pedas, saus pedas rasa kelapa) membantu saya menikmati makanan begitu banyak .. Saya pikir ini akan menjadi ayam goreng terbaik untuk seseorang! Menurut pendapat saya, ayam goreng Korea sangat beragam dan terus meningkat! Saya harap Anda bisa mencoba ini! Terima kasih telah menonton video saya hari ini!
हाय दोस्तों! आज मैंने कार्बोनारा फायर नूडल्स, पनीर पोर्क कटलेट, और कोरियाई मिनी हॉट डॉग के साथ कार्बनारा मसालेदार तला हुआ चिकन तैयार किया! Carbonara फायर नूडल्स लोकप्रिय मसालेदार रेमन हैं क्योंकि यह अग्नि मसालेदार नूडल्स की तुलना में मलाईदार और कम मसालेदार है! पिछली बार, मैं आग नूडल्स स्वाद आग तले चिकन इतना मज़ा आया! और मैंने यह खबर सुनी कि कार्बनारा फ्राइड चिकन को हाल ही में जारी किया गया है और मैं इसके बारे में उत्सुक था, इसलिए मैंने इसे तैयार किया! निष्कर्ष यह है, यह सुपर स्वादिष्ट था! मैं बहुत हैरान था! जैसे ही मैंने पहली बार काट लिया, मुझे ख्याल आया, ""यह सबसे अच्छा है ...!"" मुझे वास्तव में कार्बन नूडल्स के साथ-साथ आग नूडल्स से प्यार है! मुर्गियों पर बहुत सारे कार्बारा मसालेदार सॉस के कारण मैं वास्तव में खुश था जो मेरी पसंद पर एक सटीक शॉट है! मलाईदार और मसालेदार सॉस मुर्गियों के साथ-साथ रेमन नूडल्स के साथ पूरी तरह से चला गया! इसके अलावा, पनीर पोर्क कटलेट, कुरकुरे मिनी हॉट डॉग, और तीन तरह के सॉस (मसालेदार सॉस, मसालेदार मेयोनेज़ सॉस, नारियल के स्वाद वाली मसालेदार चटनी) ने मुझे भोजन का आनंद लेने में मदद की .. मुझे लगता है कि यह किसी के लिए सबसे अच्छा फ्रोजन चिकन होगा! मेरी राय में, कोरियाई तली हुई मुर्गियां बहुत अधिक हैं और लगातार सुधार करती हैं! मुझे आशा है कि आप यह कोशिश कर सकते हैं! आज का मेरा वीडियो देखने के लिए धन्यवाद!
こんにちは、みんな！今日はカルボナーラ焼きそば、チーズポークカツレツ、韓国のミニホットドッグのカルボナーラスパイシーフライドチキンを用意しました！カルボナーラ消火麺は、クリーミーで火の辛い麺よりも辛くないため、人気のスパイシーラーメンです。前回は、焼きそば風味の焼きそばが大好きでした！そして、最近カルボナーラの火焼き唐揚げが発売されたというニュースを知り、気になったので用意しました！結論は、それは超美味しかったです！びっくりしました！一口食べた途端、「最高だなぁ〜」と思いました。私は本当にカルボナーラのファイヤーヌードルとファイヤーヌードルが大好きです！鶏肉にカルボナーラのスパイシーソースがたっぷり入っているので、本当に嬉しかったです。クリーミーでスパイシーなソースは鶏肉やラーメンとよく合いました！また、チーズポークカツ、クリスピーミニホットドッグ、3種類のソース（スパイシーソース、スパイシーマヨネーズソース、ココナッツ風味のスパイシーソース）がとてもおいしかったです。私の意見では、韓国のフライドチキンはとても多様で、絶えず改善されています！ぜひ試してみてください！今日は私の動画を見てくれてありがとう！",393개
1,FahdAlan,Oh mein Gott sogar i like🥵 this i love you❤🔥,15개
2,Mel,0:00 what’s the song that you used called? 😊,5개
3,MaryElaine,i love how you genuinely enjoy your food while eating and how u effortlessly look cute at the same time unlike those mukbangers who tries too hard to look cute while eating lol ♡♡,5개
4,SSONGASMR,How many people love fire noodles????😍😍😍❤️❤️❤️,3개
5,ItsMEELyshaa,Will forever be my favorite 😌❤️ I love when she eats chicken and the cheese pork cutlet looks soooo amazing 🤤❤️,8개
6,AndreaisthebestHy,Anyone else wonder how she still looks so gorgeous after eating all of that!! 😩😱,2개
7,LAllenCole,"Love this video Fume. 🥰❣️ I love how satisfying your videos are.
Can’t wait for the next one. 🦞🧀🙏❤️",5개
8,GnesisNavarro,Is it just me or do y’all like how Koreans speak like their voice is so calming 👌🏻🤗😌,0개
9,lolzamano,"0:03 

You are the most beautiful thing in the world 💜💜💜💜",1개
10,senayalman,Hi from Turkey 💚 i love you 💜,9개
11,XxSunflowerxX,Yum 😋 I wish I could handle that much spice!☺️ also I subbed💗,7개
12,JustMe,"3:24 ""I found true happiness"" 😂😂😂 Honestly, same. I would too",17개
13,Samirrez,I love you my bebyyy😭😭❤ kiss in Algéria 😘,3개
14,도자도영,지금이시간부터 저기있는 치킨이 땡김이내여 ㅋㅋ,3개
15,NguynAnhThNguyn,I like watch to fume asmr so so much! =)),8개
16,MarelizGonzalez,I wanted to know if she feel hungry when she’s editing the video because right know I’m starving 😋,11개
17,소정,인스타 떠돌아다니는 영상으로만 보다가 드디어 이름 찾아내서 구독했어요 정말 식사하는 모습이 너무 곱고 보기만 해도 배부른 것 같고 보면서 같이 웃게 되더라구요 그냥 먹방 뿐만 아니라 사람이 너무 좋아보여서 열심히 찾아냈네용 ㅋㅋㅋ,20개
18,hellybelly,I found the carbo fire noodles at an Asian supermarket at last!!! Finally tried it 😍 it is so good! Love your videos! That crunching sound is 👌,1개
19,andimitavlog,나는 당신의 비디오를 볼 때 침을 흘렸다😇😇,4개
20,HimanshuArya,"No one 
Literally no one 
She still looks so pretty eating something so spicy .",193개
21,ZoeAlice,¿cómo es posible que no le pique? yo con uno de esos estaba desesperada,1개
22,EekyKinger,Today we eat together so yes looks so cute like it's  real 😍😗🍝,28개
23,JimmyTrubka,"You look like a cartoon character, so cute",1개
24,MukeshSemwal,This looks very delicious sis😋.....pls  save some for me too🥺,2개
25,ShariqAhmed,4:28 that’s truly so satisfying to watch 😋❤️💯🙌🏻,9개
26,배고픈보보씨,으아아앙ㅜㅜ너무 맛있게 먹잖아요ㅠㅠㅠ지금 밥 먹으면서 보고있는데 너무 배고파요ㅠㅠㅠㅜㅜㅜ저는 매운거 못먹는데도 너무 먹고싶어요ㅠㅠㅠㅠㅠㅜㅜ,4개
27,유유닠유민uniqeyumin,진짜 언니 먹방은 막 먹고 싶어지고 한 입에 때려박는게 포인트예요 ..사랑함니다 ...,2개
28,sanduushehara,Who else think eating like that and being thin and so gorgeous like her is kind of impossible!! 😅☺️,208개
29,0교시자취영역0CLASS,"헐,, 그렇담 불닭시리즈 그대로 나오것네 ?ㄷㄷ",3개
30,Overthinking,"Shocked to see pretty girl eating lots of food
Then my finger auto click",5개
31,서하쓰,"푸메님,혹쉬 먹방을 찍으시는데 살이 안 찌시는 비결이 있을까요?",2개
32,,いつ見ても豪快な食べっぷりで最高です！,4개
33,,美味しそうに食べるなぁ､､､食べたい(´・ω・｀),2개
34,,カリカリ、シャクシャク、カリカリ、シャクシャク、ゴクン(*´ω`*),1개
35,비자무,내맘에 쏙들게 발골하는 유튜바 처음봄,2개
36,이수빈,인형 진짜 강아지인 줄 알고 먹으면 어쩌지...? 하고 생각했다...,2개
37,VannieEats,"Fume’s dog is so adorable! 😊 The Fire carbonara noodles with the chicken look really tasty, it is making me feel hungry now 😍",52개
38,MahaGaraween,Who else is fasting?😂,157개
39,HanaWalid,1:45 she was like it’s BloOdY GoOd I imagined Ron in harry potter saying that lol,14개
40,,日本人1人目かしら？！いつも美味しそうに食べる姿に癒されています✨チキンもとても綺麗に食べられてて凄い😮,10개
41,TweetyNemo,OMG!!!! I LOVE YOU A LOT♥️!!!! YOU ARE LOOKING SO GORGEOUS😍!!! AND YOUR EAGERNESS TO EAT IS ADDICTIVE🤤!!!!! I LOVE THE WAY YOU HAVE YOUR FOOD.... YOU ARE A PERFECT WOMAN🤩 I WANNA MEET YOU ONCE IN MY LIFE!!!🥺 I'LL COME KOREA JUST TO MEET YOU ATLEAST ONCE!!!!💝 BE A QUEEN FOREVER👸🏻,1개
42,mapo07,"カルボのブルダック美味しそう…！🤤✨
私もまた食べたい！💕
チキンも美味しそう…✨",2개
43,TheCreator,Fun Fact : Your mouth was watering during the video 🤤,94개
44,sunyoungcho,4:10 까르보 불닭면 먹는건 요기서 부터!,2개
45,ONCEBLINK,美味しそう!(∩´∀`∩)💕,2개
46,NayaSan,I love you fume you are make me hungry while I fasting in RAMADAN ❣❣👍,1개
47,iiKrystalii,"i'm fasting rn..
and IM STARVINGGGG :o",1개
48,김엉겅퀴,세상 새초롬 이삐 생겨서 말투 정감 무엇💕,3개
49,EricGroom,I have yet to see Fume this excited about food. Chireka,1개
50,SicaASMR,Love it! Gonna eat them next time! :),2개
51,YoyoAl,"You are great, I love you so muchFeel hungry with this video, follow you from Syria😘😘😍
Love ❤❤❤",1개
52,JessyJoon,"O Yoongi na embalagem 💜 Yoongi in the packaging, so cute 💙",0개
53,JUNKOOKJEON,I love you you my favvv asmr mukbangerrrrrrrrrr ad I spekaing In the Korean I know little korean language,1개
54,,ホントに可愛い〜❤❤,1개
55,더블브이ASMR,"I'll have it tomorrow.
Thank you for the new menu.😋",1개
56,쿡준sCookjunASMR,1:16 Start Eating!!❤️❤️,43개
57,JakeilahYoung,Another favorite mukbanger of mine! Anyone else love her reactions to the food? She’s so adorable 😍,0개
58,Rahul2012,"me: you make me......HUNGRY
10 second later.....
mom: SON DID YOU EAT EVERYTHING IN THE FRIDGE?!
me: oh no",8개
59,chimmychiminie95,나는 당신의 소리를 정말 좋아합니다! 나는이라면을 정말로 좋아하지만 가장 좋아하는 것은 신라면과 검은 콩라면입니다. 어떤라면이 가장 좋아합니까?💜,1개
60,으앙,다 못알아 듣겠는건 저 뿐만 아니라 여러분도...♡,1개
61,Rkitchen,綺麗なのに、豪快な食べっぷり、大好きです❤️,15개
62,PennyBurton,I absolutely love how you de bone chicken 🍗 👑💖,1개
63,TeribiniAlice,4:24 I was waiting for this😂,6개
64,JonalynCastor,you're so cute eating chicken unnie💙 I'm a new fan of yours btw.,0개
65,ltznoor,クリエイティブに進みましょう♥️なぜクリエイティブなのですか？😁🙂,1개
66,HOUASMR호유,"1:16 Start eating!!!🥰🥰😋😋😋😋
Who thinks Fune is beautiful ??
Me 🙋🏻‍♂️🙋🏻‍♂️🙋🏻‍♂️🙋🏻‍♂️",88개
67,빰빰,맛있는거먹으면 속도기빨라짐ㅋㅋㅋㅋ 2배속인줄,2개
68,moudleen234,I can see you put a lot of effort into your videos and I love it!!!,1개
69,박건하,7:15 자막 오타,1개
70,정선영,"푸메님 ~너무 맛있게 드시는게 좋아요 
눈으로만 보는것만으로도 배부르는거같아요ㅠ요새 다이어트때문에 먹지도 못하고있어요ㅠㅠ인바디 체지방높아서 건강상태가  식단조절 해야된다합니다ㅠ
맛있는 영상잘보갑니다~영상또기다릴께요~!!",8개
71,CookieLin,The way you eat is making me hungry!! And You are so pretty when you are eating 😍😍💕💕,20개
72,Riiichan,"日本人ですがスパイシー愛好家です😍❤️
fumeさんの動画を見ながら、同じものを食べたくなります😘😘",1개
73,효진먹방hyojinASMR,윙 치킨 ㅋㅋㅋㅋㅋㅋㅋㅋㅋㅋㅋ,2개
74,김체리,나 방금 밥먹었는데....왜또 배고프지...?,4개
75,Mahmudakhan,when she smiles after testing the food.. 🤗😍,0개
76,,กินน่าอร่อย😆หิวเลย❤️,1개
77,yungi,"How the trick do you look so pretty eating , I look like a fudging hippo when I eat!",0개
78,SquishyParkJimin,Having all the stores in my area closed hits different while watching this video,0개
79,On1yLagras,바삭바삭 오도독 오독..😭🤭❤️,1개
80,금기봉,이거이거 딱 우리 야식 먹을시간 맞쳐서 올린거죠!!,1개
81,김윤서,푸메님이 직접 후라이드치킨 사신다음 짜장불닭 소스 발라먹어도 괜찮을것 같아용~~♡♡,12개
82,허니스킨먹방로그honeyskinMukbanglog,진짜 이정도면 불닭파티에옄ㅋㅋㅋㅋ아 맛있겠다ㅠㅜ제가 젤 좋아하는게 까르보불닭인디ㅜㅜ,1개
83,민트초코다은,이거먹으면 처음에 안매운데 마지막에 메원요. ㄷㄷㄷ 근데 존맛탱,1개
84,JUON,강아지 항상 졸린표정ㅋㅋ 너무 귀엽다,3개
85,suminahori,美味しそうだし かわいい❣️🥺❣️🥺,2개
86,추기맨,와 먹는방법 배워갑니다ㄷㄷㄷ 저도이제 치킨무는 푸메님 처럼 한줄씩!,1개
87,사형놈,"푸메님 ㅠㅠ 80만이 엊그제같은데
오랜만에 오니까 200만명이 넘었네요 ㅠㅠㅠ
축하해요~ 앞으로 자주 올게요",1개
88,YAHo,새벽에 이거보는데 너무너무 배고파용~ 너무맛있게드셔요^^,4개
89,illyirdiyana,I watch this while i'm fasting😂and shared it to my fasting friends😂✊,3개
90,지민망개,먹고싶다 아~ 새벽에 이영상을 보면 안되는것이였다,2개
91,,"엽떡 순한맛도 못먹는데 먹을수 있을까요? 
고추 바사삭은 먹을수 있습니다!",1개
92,ASMRMuKbang맛형,1:16  Start eating😋😋😋😋😋,12개
93,HasnaAtea,당신은 너무 아름답습니다❤️❤️❤️💕💕💕💕💕,1개
94,RassaSoares,Ela come tanto e é tão magrinha! kkkkk Qual é o seu segredo ????,1개
95,SHIYA,humeちゃんd(≧▽≦*d)今日もおいしそうに食べますね…karikarisakusakuでしたね❤︎*。,1개
96,Jyeon,4:10 ㅋㅋㅋㅋ너무귀여워요,1개
97,AprilLamaschingona,"my mouth watered while watching this video , everything looks so good 🤤💞",0개
98,AbuFahad,how do you bring this much items in lockdown,2개
99,유진JUNG,푸메님 어디서 봤나 했더니 오마이걸 지호님 닮으셨네 두분다 너무 이뻐요,1개
100,이love희영,근데 전부다~까르보불닭치킨이전부 어제꺼야ㅋ,1개
101,올리브로일,언니는 어케 치킨 먹는 것도 이뿨요...🤩,2개
102,KylaEdwards,Love the subtitles! You seem like you would be so much fun to hang out with 😋,0개
103,rosyAh,"아니 까르보치킨!?하고 들어왔다가 돈까스 와사삭 소리에 더 놀라게되는거 뭐죠..!?취저,,,",8개
104,jaewanyou,미인이신 대다가 어쩜 이리도 드시는모습도 이쁘신지 특히 드시기전 말하시는게 조곤조곤 또박또박 말하시는게 너무 좋네요 드시는것도 깔끔하게 잘드시고 보는내내 즐거움이 있었습니다 앞으로 잘주 즐겨 볼꺼같아요!!,0개
105,JulianasantosTamiris,Eu quero fazer esse frango 😍😍 alguém sabe o q vai nele pra ficar vermelho assim?,0개
106,LuizCarlosBezerradaSilvaJunior,"Eu amo quando você põe as legendas, adoro ler o que você escreve, é amável. 😄😚😝❤",2개
107,은주김,"와........진짜 맛있어보여여.....
(밤이어서서 침이 주르륵......)",0개
108,,ㅎㅎ엏ㅎ나재ㅔㄴㅍㅊ노노놓ㄴㅇㅇㅎㅎㄷ 살해 북한군,0개
109,백달,얼굴도 예쁘신데 먹는것도 복스럽게 먹는게 참 예쁘시네요 ㅎ,1개
110,김율리Yully,먹고싶잖아 ㅠㅠ 푸메닝다음에는 오리고기 구이도 해보는거  어때요?,1개
111,AH,"最近ASMRというものを知ってチャンネル登録させていただきました！！
めっちゃ大好きです♡♡
特にチキンの食べ方が綺麗すぎて良い音すぎて♡♡
ダイエット中だけど私も食べたくなります！
プルダック？辛いラーメン食べてみたくて、近々買う予定です♡♡
Fumeさんもわんちゃんも可愛すぎるし本当に大好きです(๑♡ㅁ♡๑)",0개
112,RosieKim,불닭마요소스랑 불닭소스는 그냥 주는건가요?? 너무 맛있어 보이네요ㅠㅠ🥺,1개
113,AkramBakriEats,Look so spicy..who love fume eat 😍😍😍,22개
114,,韓国のチキンは本当に美味しそうですね🥺💕麺を巻いて食べる食べ方は試したことがないので、今度ぜひやってみたいです❣️,1개
115,허남철,"안녕하세요 ~
푸메님 ~
항상 좋은영상 ~
감사해요 ~
맛있게 드세요 ~
영상잘봤습니다 ~
항상 건강조심하시고요 ~^^♡",1개
116,오승연,"언니,,이 시간에 이 영상,,,너무한거아니에요?😭",2개
117,선미는근면해Goyangbubu,"요즘 치킨 신메뉴가 정말 많이 나오네요!
그냥 불닭이었으면 매워서 못먹을텐데 까르보불닭이니까 한 번 도전해보겠습니다!!!",1개
118,Lapassion,We not gonna talk about how she just ate that chicken like that-,11개
119,Animeplanet,You are so cute when you eat💜💜,1개
120,경이,까르보 불닭치킨 리뷰영상찾고있었는데 딱 제가 찾는영상이에요ㅜㅜ야식으로 시켜야겠어요 보자마자 구독했답니다 저도 푸메라니안이되겠습니당🥰,2개
121,JennieRJane,I love her greetings. The way she said anneohaseyo yeorobuuunnn. Omgg on repeat,0개
122,정민,어떡하지 너무 맛있겠다ㅠㅠㅠㅠ지금 아무것도 안 먹은 공복 상태인데 뭘 먹어야할지...사러 나가야하나 귀찮은데 ㅠㅠㅠㅠㅠ 보니까 치킨먹고 싶기도 하고 ㅠㅠ,0개
123,오리,와 언니 구독자수 언제 이렇게 늘었어요..대박 10만명대가 얼마전같은데 까르보불닭치킨 맛있어보여서 오랜만에 치킨 시켜먹어볼까봐요ㅠㅠ,2개
124,QueenJennie,Fume l lovə you ❤,2개
125,JungHoseok,Love from nepal🇳🇵❤,1개
126,1Subbefore2021Challenge,"„Who else is watching this while bored in quarantine??😴😷

(I hope you are doing well!)",41개
127,yuliarizkyandina,"혹시 언니가 다음에 치킨 먹을 때, 저한테 좀 주세요. 안됄까?? ♡♡♡♡",1개
128,mizukihoriguchi,なんでこんなチキン🍗の食べ方上手なん❓凄い、骨だけにするのは食べるコツあるんでしょうね🥺カルボブルダック食べたくなってくる🍜,1개
129,AnyaTay,"The carbo fire noodle tastes so good! Thanks for sharing, I just got here in time",0개
130,prettygreeneyes,Ouuuu yes that chicken looking so good u sharing I love hot and spicy food ♥️♥️🤤🤤,0개
131,NehalMhagag,I follow you for along time and I love uu from Egypt😍❤,0개
132,말이와나MariwaNa,ㅜㅜㅜ 저도 오늘 불닭볶음면 먹어야겠다..ㅜㅜ 🤤🤤,1개
133,YOUNIVERSE,Waittt~ is that kang daniel? 🧐🤔,4개
134,체라,"어머! 콜라에도 과일을 넣어먹는군..
까불치킨 안맵다고 하시니 저도 마미한테 사줘사줘!사달라고 때 써봐야겠네용",3개
135,suprajasaravanan,Fume! I love the way your eat! Btw do you like BTS!💜,0개
136,,1口で入るの凄い！！！！,0개
137,냥소당,그와중에 감자칩 먹고있는 나,1개
138,LEAHJEON,핫도그랑 치돈도 멕시카나에서 사이드로 시키신건가요?!,1개
139,EMMAASMR엠마,이 시간에 치킨 돈까스 볶음면이라니😂😂😂😂참을수가 없네요,21개
140,요배고파,이거 정말맵던데..혀 괞찮으실지모르겠어욥..ㅎㅎ,1개
141,,"Класс 
Я сейчас худею и решила вести канал)))
Уже -43 кг 😍😍😍",10개
142,KaderKaya,This subtitles not Turkish :d,1개
143,NatanneLima,Quanta Delícia amo seu canal 💜,1개
