닉네임,댓글,좋아요수,날짜
MOREDUALITY,"AHHH ME ENCANTA❤
Eres muy talentosa 🇰🇷
Una fan desde México 🇲🇽",29개,2020. 5. 8.
AnaH,love all the outfits so simple but yet fashionable ❤️,4개,2020. 5. 8.
ArmyForever,"Que linda!! Todo te queda muy lindo 😃🌺

PD: Ya estaba esperando nuevo video jaja",20개,2020. 5. 8.
HarleenQuinzel,Your style look like Soojin from (G)I-DLE 😍❤,10개,2020. 5. 8.
azalleajinvely,"나 유튜브 댓글 언니한테만 단다 ,,,!! 언니 룩북 진짜 기다렸어 ㅠㅠࡇㅠ 언니 패션은 뭔가 유니크한데 또 예뻐서 자꾸 자꾸 보게된다 ㅠㅠㅠ사랑햐 ㅠㅠ🤍🤍",6개,2020. 5. 8.
LizbethRamrez,"love each outfit and give yourself precious ♥ ️, hermosa:3 saludos desde México b.c.s 🇲🇽",1개,2020. 5. 8.
LuBlink,"Girl ur a queeennnn, u look so good with that outfits",5개,2020. 5. 8.
kara,Thank you for uploading! All these outfits are so pretty.💕,2개,2020. 5. 8.
LenaNguyen,loved this ! your so gorgeous and I love your style and makeup !! 😫😍,1개,2020. 5. 8.
Maryam,Thanks! I watched everything i wanted in 33 seconds I don’t have to watch the rest of the video😁,0개,2020. 5. 8.
JenniferDefoy,It makes me feel like I should try to add more colour to my wardrobe. Especially more pastels.,1개,2020. 5. 8.
쿠크다스오돌뼈,희주 요즘 왤캐 열일하냐~ 이 말이야. 나는 짱팬이니까 기쁘다~ 이 말이야. 그런데 너무 힘들까봐 좀 걱정도 된다~ 이 말이야.,4개,2020. 5. 8.
KhattGidfx,"I love your videos, they are very relaxing and aesthetic to watch p💖✨",1개,2020. 5. 8.
DenisaMariaDuma,"Woh estaba esperando un video de looks, muchas gracias. 
Todo te queda genial !!! Eres muy linda. 🤗 

Saludos desde España ❤",2개,2020. 5. 8.
JJ,희주 언니 바지 추천 영상 보고 싶어요 ㅠㅠ 핏.. 미쳤다..,1개,2020. 5. 8.
LisetAcevedo,"Me encantan todos los outfits AAA, saludos desde Paraguay❤",6개,2020. 5. 8.
LidiaGarca,¡In love! I'll take these tips to dress when the quarantine ends haha.💗,6개,2020. 5. 8.
앙팡망,이번 영상미 진짜 체고ㅠㅠㅜㅠㅜ,0개,2020. 5. 8.
Menevse,"I love your style, it suits you so well! You can make anything look pretty 😍",0개,2020. 5. 8.
EellaE,진짜 너무 매력있고 예뻐요ㅠㅜ,0개,2020. 5. 8.
최해솔,아 파스텔ㅠㅠ❤️❤️,0개,2020. 5. 8.
ayabaadi,OMG 그녀는 너무 귀여워요 그녀가 어렸을 때 어땠는지 궁금합니다,0개,2020. 5. 8.
유멍멍,으엥 언니 진짜 너무 예뻐요... 안어울리는게 없어!!!!!❤️ 진짜 너모 조아💜 언니 영상 언제 올라오나 항상 기다려여어💗,0개,2020. 5. 8.
남주혁NARAE,뭔들안예뻐 울히주언늬 ㅠㅠㅠㅠㅠㅠㅠㅠ 넘보고싶드앙😭❤️❤️,0개,2020. 5. 8.
DaliaChing,"Tan linda como siempre 💓💓😍
Saludos hermosa  , cuidatee 💓",1개,2020. 5. 8.
조주현,역쉬~언니는 컬러풀한 색깔들이 착붙임!!,0개,2020. 5. 8.
SaraKhatib,"Miss you sweety , btw your style is amaaaaaaazing ommmg i looove it keep going and don't care about haters💜💜💜💜sarangheeeeyooo💜💜💜💜💜💜",2개,2020. 5. 8.
호두,진짜 최고된다.......,0개,2020. 5. 8.
최인어의육지적응기,피부가 뽀야셔서 어떤 옷을 입어도 어떤 머리색이여도 다 이뻐여 부러워요,0개,2020. 5. 8.
김소라,저세상외모다...언니진짜너무예뻐요ㅠㅠ😍😍😍,0개,2020. 5. 8.
hyejii혜지,"이번영상 왜이렇게 살빠져 보이지 🤔 
살빠지지마여 이세상에 희주님을 1그램도 잃을 수가 없어어어 (주접) 

어쨋든 옙흐다🤍",0개,2020. 5. 8.
김아영,최고 존예ㅜㅜ❤️❤️❤️ 어쩜 옷이 다 어울려요😍😍,0개,2020. 5. 8.
Mio,可愛い可愛いめちゃくちゃ可愛い😍😍😍😍、,0개,2020. 5. 8.
셩꼬,지그재그 진짜 열일한다... 어느 유튜버든 다 지그재그광고... 근데 난 되게좋음 브랜드제품이 아니라 쉽게 접할수있는 인쇼만 모여있어서 어떻게 코디해야할지 한눈에 들어와서 좋음ㅎㅎ,0개,2020. 5. 8.
샨블리,세일러문 실사화같아여🥰진짜 이뿌닷,0개,2020. 5. 8.
okeydokeysmokyeee,너무너무 예뻐 누니누니 부셔 ㅠㅠㅠㅠㅠㅠㅠ🙈🙈🙈🤟🤟🤟🤟❤️❤️❤️,0개,2020. 5. 8.
KarenHazielVillarrealMartin,Que linda eres ~<3 mis looks favoritos fueron el 3 y el 5 muy linda saludos uwu,0개,2020. 5. 8.
비니삐니,헣 팬츠들 거의 품절이에여ㅠㅠ제가 늦었나봐요 아쉽네요 희주님 영향인가봐여..!,0개,2020. 5. 8.
soberry,밤새서 기다리다가 30분 남기고 자버렸네 ..... 언니 너무 오늘 옷 취향저격이다요 진짜 다 사버리고싶네 .... 🤦‍♀️,0개,2020. 5. 8.
정진아,옷이 예쁜 것도 있지만 언니가 예뻐서 더 예쁘게 보인다 역시 패션의 완성은 얼굴이다••• 기억하자••• 영상 퀄리티 짱이다••• 언니랑 함께한지 이제 4년이다 ㅎㅎ 행복하다•••,0개,2020. 5. 8.
장유진,"언니 저는 무쌍 같은 속쌍인데 언니 화장법 보고 많이 배워가요! 옷도 너무 이쁘게 잘 입으시는것 같아요❤ 언니가 제 롤모델이랍니당🥰
유익한 영상 많이 올려주셔서 고마워요! 
항상 응원할게요😊",0개,2020. 5. 8.
양지원,언니 정말 안어울리는 색이 뭔가요!!!ㅜㅜ왜이렇게 다 찰떡이얌 다음 생은 무조건 언니로 태어날래,0개,2020. 5. 8.
신화영,"난 진짜 언니 룩북 너무 좋아요❤
언니 너무 좋아요❤",2개,2020. 5. 8.
김하은,희주언니..사랑해요...진짜 예쁘다는 말론 부족해요 완전 골져스 스플렌디드ㅠㅜㅜㅠㅠ 옷도 완벽하게 잘 어울리세요!!! 목소리까지 깜찍하셔... ☺️❤️,0개,2020. 5. 8.
김보라,언니 윤훼이랑 헤이즈 섞엿어여 너무이뻐여...❤️🥺,0개,2020. 5. 8.
caendure,"하 진자 언니 슈퍼모델해야댐,,,,,",0개,2020. 5. 8.
YuriCruz,Wooo que hermosa te vez me encantan tus outfit deves algun modelo😍,0개,2020. 5. 8.
SheetalBehera,"I love this video, it is really so therapeutic",0개,2020. 5. 8.
수연suyeon,와 언니 허리 얇은거 실화인가..,0개,2020. 5. 8.
Mia,"Oh my, these looks are so cute",0개,2020. 5. 8.
이승연,"코디들이 다 제 취향이네요ㅎㅎ
덕분에 좋은 옷 찾은것같아요ㅎㅎ",0개,2020. 5. 8.
유미화,희주언니는 안어울리는색이 뭐냐며~~~💜🧡💛💚💙🤍🖤🤎❤️ 안어울리는옷이뭐냐며~~~~,1개,2020. 5. 8.
방울토마토,색감 천재♥,0개,2020. 5. 8.
써유니SSEOYOONY,"언니 피어싱 위치 소개, 피어싱 소개 영상 한번 찍어주세요 🥰🥰",0개,2020. 5. 8.
다밍,"언늬 미모는 오늘도 열일~~,,💜💜",0개,2020. 5. 8.
caritae,"Ame todos, ¡gracias por las ideas hermosa! 💗",2개,2020. 5. 8.
GregorioAlarcon,Les filles coréennes sont très belles <3,0개,2020. 5. 8.
팡궁디팡,존예❤️❤️❤️❤️이런 룩북 더 많이 올려주세용~,0개,2020. 5. 8.
ILynNewYork아이린뉴욕,세상에 넘나 공주님같아유💚🧡💛  빨리 봄놀이가고싶은 룩들이에용😍,0개,2020. 5. 8.
Januarybihh,뭐야 왤케 예뻐,0개,2020. 5. 8.
,とてもかわいいです🤍,0개,2020. 5. 8.
이빨요정,다른 룩북은 안봐도 언니껀 본다구,0개,2020. 5. 8.
유정,민트컬러 넘나 착붙 ♥,0개,2020. 5. 8.
토마토,파스텔...! 너무좋아요!!🤍,0개,2020. 5. 8.
softdevil,"adoro como te vestís, eres súper hermosa! 💖",0개,2020. 5. 8.
귀여운외계인,로블리❤️,0개,2020. 5. 8.
JYYoon,지금 반말 겟레디 보다가 알람 떠서 바로 왔어용!!!,1개,2020. 5. 8.
UhooYeah,희주님 이번 스타일링들 다 편해보이는 옷이어서 좋아요 ㅠㅠ 저 불편한옷 극혐하는데 이번 스타일링은 편하게 따라 입을수 있을거 같아요,0개,2020. 5. 8.
김지은,온니는 오늘도 이쁘시군요 !!!❤️❤️❤️,0개,2020. 5. 8.
yumilim,희주님 너무 예뻐요ㅠㅠㅠ❤️ 정말 메이크업부터 스타일까지 모두 다̆̈ 취향저격 당했어요ㅠㅠ😍 아 혹시 희주님 키가 어떻게 되시는지 알수있을까요..?̊̈!,1개,2020. 5. 8.
Yaeejii,나는 당신의 비디오를 정말 좋아합니다 .내가 프랑스에서 왔기 때문에 나는 당신과 같은 스타일이 없습니다 하지만 당신의 동영상이 저를 즐겁게하고 다른 것을 생각하게하기 때문에 당신이하는 일에 대해 당신을 크게 존경합니다 ♡ .Love u so so much from France ❣🦋,0개,2020. 5. 8.
베라,오늘의 언니도 너무 예쁘네요💕,0개,2020. 5. 8.
인라,"언니 기다렸다구요💜💜💜💜 
요새 날이 많이 더워졌는데 봄이지만 시원하게 입을 수 있는 룩(?) 한번 찍어주세요!
언니영상보고 지금 지그재그앱 깔러 갑니다•••🤭",1개,2020. 5. 8.
SungA성아,드디어..💖💖💖,0개,2020. 5. 8.
LizbethRamrez,Que preciosa todo te quedó Muy bonito:3 ❤️ so cute,0개,2020. 5. 8.
AishaCean,"I just subscribed to your channel today,I love it 💖",0개,2020. 5. 8.
흰,언니 헐 저 언니만 기다렸어용!!!악!!!사랑해요.....항상...,0개,2020. 5. 8.
satan,패션의 완성은 머다?  와꾸,0개,2020. 5. 8.
스린,언니 미모에 치인다 💜,0개,2020. 5. 8.
RithikaPatel,Your so pretty btw can u plz drop a updated skincare routine plz and thank you 💜,0개,2020. 5. 8.
ScarlettPonce,Me encanta tu estilooooooo! 🤭 ¿Qué tal las cosas en Corea? ¿Están un poco  mejor ya?,0개,2020. 5. 8.
하늘,오마이걸 승희랑 진짜 닮았어요!!,0개,2020. 5. 8.
SabrinaRamrez,"Dios mío yo te sigo desde hace mucho tiempo y no me canso de verte, maquillando te, viajando, o probando te topa, eres muy hermosa te quiero demaciado 💞",0개,2020. 5. 8.
정다휘,다양한 색상이 모인 팔레트같은 희주언니🎨🎨🎨,0개,2020. 5. 8.
GloriaArstegui,"Todos los looks están hermosos😍😘😉.
Me encanta tu estilo🤗☺️",0개,2020. 5. 8.
PhanieG,Wow 💕 ¡Me encantaron! Los colores son preciosos ♥️,0개,2020. 5. 8.
TanyaFernndez,HERMOSA 🦋❤️ ponle subtítulos en español saludos BESOS🦋🦋❤️❤️,0개,2020. 5. 8.
MariePresto,I wanna be as skinny as her :(,0개,2020. 5. 8.
AnyelCaldern,"Me encantó el look #1 y el collar de mariposa era súper lindo... El otro fue el look #4 es hermoso la combinación de los colores y los accesorios ... Me gustó el vídeo, saludos ..! 💖🦋",0개,2020. 5. 8.
AlyOmed,서 링 해 ☀️ 💋🧿,0개,2020. 5. 8.
eelink,완전 인간 봄 같애요 상콤상콤 🥰🥰,1개,2020. 5. 8.
NobodysSaviour,Amo como te quedan distintos tonos de lavanda y violeta 🥺🥺,0개,2020. 5. 8.
PiaAaaaA,"sos re linda, me encantan tus vídeos 👌🏽",0개,2020. 5. 8.
AYGS12,Estos colores y tipos de prendas me recuerdan a Britney Spears en los 90s,0개,2020. 5. 8.
혜린,희주님 키가 몇인가요 ?? 😭😭😭 아시는 분 댓글 부탁드립니다 😭😭!!!,0개,2020. 5. 8.
,"제공해 주셔서 감사합니다
채널 아래에 룩 링크를 입력하려면 어떻게합니까
아니면 입장 할 수있는 권한이 필요합니까?
 
감사합니다",0개,2020. 5. 8.
VickyCaballero,"Eres muy linda, te admiro mucho saludos desde Panamá 🇵🇦❤️✌️😘",0개,2020. 5. 8.
,В этом видео прекрасно все,1개,2020. 5. 8.
구예지GOOYEJI,"ㅠㅠㅠㅠㅠㅠㅠㅠㅠㅠㅠㅠ미챳다,,,,,,,,인간팬톤",1개,2020. 5. 8.
NewYou,희주님 저 뻥 안치고 3분전에 언니 작년에 올렸던 최애 상의 하울 보고있었어요❤️❤️텔레파see,0개,2020. 5. 8.
zarakimJennie,Wow you really beauty 😍,0개,2020. 5. 8.
,榫眼裡應外合安置安心上學難受過多多數千秋意念誦唸小型病毒測試顯示屏,1개,2020. 5. 8.
mimidetae,Eres perfecta con o sin maquillaje❤😻,0개,2020. 5. 8.
MAYMOREIRA,Bella enserio muy bella todo te queda bien ❤❤,0개,2020. 5. 8.
설탕맛쿠우,눈꼽도 안떼고 보러와써뉸뉴🧡💛💚💙,0개,2020. 5. 8.
지나,너모 아뽀,0개,2020. 5. 8.
eldAh0pe,Es completamente mi estilo ... te quiero linda 💓💕💜,0개,2020. 5. 8.
MemeMakeup,I love your style so much!!,0개,2020. 5. 8.
김퍼그,히주님 키가 어케되시나오 ?,0개,2020. 5. 8.
panpan,"The app doesn’t has another language, i don’t know Korea😭",0개,2020. 5. 8.
MaximM,"Están bien bonitos los oustfits, me encantó el vídeo
( ╹▽╹ )",1개,2020. 5. 8.
GabrielaMorales,Eres hermosa!!,0개,2020. 5. 8.
MelissaGarduo,Te pareces a una de las muñecas Bratz :3,0개,2020. 5. 8.
AngyOrtegaHernndez,Tienes nueva suscriptora ❤️,1개,2020. 5. 8.
화민,"Yoos' 당신은 너무 예뻐요 
달콤한 천사를 보는 것과 같습니다
당신 Look 너무 귀여워서 좋아♥️",0개,2020. 5. 8.
AnaReyes,"Skincare video please.
Hi from San Diego,Ca",0개,2020. 5. 8.
juadalupejazminprietojuarez,Preciosa como siempre 😍😍😍😍,0개,2020. 5. 8.
sararubii,El primer outfit me hizo acordar a Jennie,0개,2020. 5. 8.
BenAissaChoukri,"Me encantan, eres súper guapa, ya necesitaba un video tuyooooo❤❤❤",1개,2020. 5. 8.
seungchim,Me encantó :3❤,0개,2020. 5. 8.
AgostinaIbarra,No entiendo coreano pero si es un video sobre ropa lo tengo que ver cuanto antes 🤣💓,0개,2020. 5. 8.
TueGler,Look 1😍,0개,2020. 5. 8.
SincerelySolimar,I love everything about this video!!,0개,2020. 5. 8.
Catalinamiamor,YOO NO OLVIDES HABLAR EN ESPAÑOL uwu dijiste en un video que te lo recordáramos y aquí estoy ☺️,0개,2020. 5. 8.
juanitagallego,Venga esta mujer es hermosa 💖,0개,2020. 5. 8.
AndyRomn,Eres perfecta 😙😍❤,0개,2020. 5. 8.
Jvi,siiiiiiiiiii🖤,0개,2020. 5. 8.
BomjumKarlo,Love ur videos 💕 would love more if u could add eng subtitles,0개,2020. 5. 8.
menacolors,"Divina ❤️ ,amo la moda asiática",0개,2020. 5. 8.
XimeEuphominnie,Ella es como la versión femenina de Park Jimin o soy solo yo?,0개,2020. 5. 8.
AishaCean,"I just subscribed to your channel today, ❤️",0개,2020. 5. 8.
나처럼likeme,정말 하나의 광고같은 영상 넘 잘 봤어요. 스타일이 가볍게 입기 좋을것같아요 ~~,0개,2020. 5. 8.
홍지윤,키하고 몸무게가 어떻게 되세요?,0개,2020. 5. 8.
ElizabethGaln,Qué guapa! Me encanta 😍,0개,2020. 5. 8.
RANRAN,super beautiful！,0개,2020. 5. 8.
mekk,I don't get it like.. U use English but where is is the english subtitle,0개,2020. 5. 8.
ErickZone,"Con cualquier look te vez hermosa 😍
I love you ❤️",0개,2020. 5. 8.
lee밍,인스타 스토리 보고 왔어용><,0개,2020. 5. 8.
5733,wow you are. so soo cute i love your cloths but from were you buy,0개,2020. 5. 8.
Jooniepop,YOU ARE SOOO ADORABLE AND BEAUTIFUL,0개,2020. 5. 8.
SaraiRivera,Que lindo vídeo como siempre. Saludos,0개,2020. 5. 8.
StephaniaSotelo,"Realmente me encanta tu forma de vestir, te admiro mucho.💗",0개,2020. 5. 8.
MayerliAriza,Wow me gustaron mucho los look ^^,1개,2020. 5. 8.
SusanaAgramonte,Bellissima siempre ❤️💕😘💐👍,0개,2020. 5. 8.
DannyGalvis,Me encanta tu estilo al vestir y al maquillarte  😊 saludos desde Cali Colombia🇨🇴,0개,2020. 5. 8.
LandieYao,I'm so happy you posted!! 😍😍😍,0개,2020. 5. 8.
PaolaCampoj,"me encantaron los look 🤘 especialmente el número dos y tres💜
Los colores pastele te sientan muy bien🙌😊 🇨🇱",0개,2020. 5. 8.
맞는말만함,언니 영상편집 무슨앱으로 해요??,0개,2020. 5. 8.
osamasame,👌♥️,0개,2020. 5. 8.
예블링,우왓 일빠!!!!♡♡,0개,2020. 5. 8.
ArdillaCarlos,es bonita tiene buenas convicciones  de look🌷🌷🌷🌷🌷🌷,0개,2020. 5. 8.
AlyOmed,You are soooooooooooo beautiful I love you so much 💋💋,0개,2020. 5. 8.
Matilda,😍😍😍😍😍,0개,2020. 5. 8.
수빈,언니는 진짜 뭘 입어도 잘 어울리네요💞,1개,2020. 5. 8.
안은솔,"이건 머리 튜토리얼 필수다 언니 꼭 올려줘요 ,,, 제발요 ㅠㅠㅠㅠㅠㅠㅠㅠㅠㅠㅠ",65개,2020. 4. 29.
youtubeseriez,Her hair her skin her lips everything is on point,20개,2020. 4. 29.
nicollechirinos,Un que no entienda coreano y tampoco tenga subtítulos en español lo voy aver 😂😂❤️❤️❤️,83개,2020. 4. 29.
아쁨,"왜 희주님이 바르는 립스틱은 다 뽐뿌오는지,,👄이거 헤어스타일링 하는법도 궁금해용",32개,2020. 4. 29.
dezzzym,It doesn’t have subtitles but for some reason i feel like i can understand what she’s saying after watching almost all her vid. 너무 예쁘다🥰,23개,2020. 4. 29.
jungkookpop,me encantó el maquillaje💗💗 por cierto! yoo me recomiendas alguna cushion o base para piel grasa? gracias te amooo me encantan tus videos💗💗💗💗💗,23개,2020. 4. 29.
전지은,희주님 메이크업 영상이 제일 재밌어요😭❤️ 뭔가 기분이 좋아진다고 해야될까...?❤️,22개,2020. 4. 29.
Tievoli,와 진짜 이쁘신것같아요.. 제 동생이 보길래 우연히 보게되었는데 피부도 좋으시고 인기정말 많으실 것 같아요!! 특히 목소리도 하이톤이셔서 영상보는 내내 귀도 즐거웠답니다. :D,22개,2020. 4. 29.
PamAg,"Oh i don't understand
Also me: I'm gonna keep watching to the end💗💗💗",2개,2020. 4. 29.
nuriapamela,"Hermosa como siempre. 😍
Como se que quieres practicar el español te recomiendo que veas La casa de Papel💖💖 stay safe",19개,2020. 4. 29.
MelanieVilla,"Te amo yoo!!! Me encantan tus videos sigue asi, saludos de Ecuador ❤",5개,2020. 4. 29.
BolitaMochi,"Tan hermosa, amo todo de ti,adoro tu voz 💜✨",11개,2020. 4. 29.
정진아,언니 진짜 이런 영상 너무해! 나 단발로 잘랐잖아 이 영상만 보고 머리 결정할 걸 너무 후회 중 🤤 근데 언니 뭔가 벚꽃 병아리••• 🌸🐥 이잉 너무 귀여워 깨물고 싶다 건강 조심하세요 저 임파선염 때문에 항생제 먹으면서 고생 중••• 영상으로 힘냅니다 빨리 보고 싶다 내 친구들도 언니 실제로 보고 싶어한다 내가 언니 실물 엄청 예쁘다고 자랑했어 ✌🏻 사랑합니다 병아리님 💛🐤🐣🐥,9개,2020. 4. 29.
ShavDance,That hairstyling tutorial please 😭💕,4개,2020. 4. 29.
LuBlink,"Yoo ese look del pelo te queda muuuuuy bien, te queda kawaii y te queda muy lindo con ese maquillaje, seguí así HERMOSA!!!! ❤️❤️❤️",11개,2020. 4. 29.
부루룽,ㅁㅊ 이 언니가 최고다,8개,2020. 4. 29.
ladiesnght,Te amo sos una genia😭❣️,9개,2020. 4. 29.
유지를유지하라,꺄아아아악 썸넬 미쳤다 언니 사랑해 🌷♥️,7개,2020. 4. 29.
,딱 심심할때 어떻게 알구 영상을 똭!!!곧 여름이 다가오는데 언니랑 너무 찰떡이 계절같아요💙,5개,2020. 4. 29.
soberry,언니 진짜 난 언니의 핑크를 좋아해 언니의 모든걸 사실 다 좋아해 오늘도 레전드 찍으셨다 ✨🤍,3개,2020. 4. 29.
우당탕쪈,웨이브잔뜩 언니오늘도 잔뜩 예쁘세요 💗,5개,2020. 4. 29.
ContainedFire,"I love how you're doing your thing with the make-up videos, but you seriously are on a level to be on cover on Vogue!",1개,2020. 4. 29.
AndyRomn,"Diosa❤👀
Haz mas videos en español! Porfis 😍❤",5개,2020. 4. 29.
방소현,희주님 오늘 진쨔 조녜에요ㅠㅠㅠ❤️혹시 이 영상에서 하신 헤어 스타일링 방법도 영상으로 올려주실 수 있나요??🥰🥰🥰,2개,2020. 4. 29.
닝닝냥냥비뱌뷰,와 진짜 안어울리는 색깔이 뭐에요 핑크도 어울리고 주황도 어울리고 언니 hoxy..유니콘?,9개,2020. 4. 29.
KimYerin,"언니 너무 예뻐요ㅠㅠㅠ 인트로부터 미쳤,,,❤️❤️",3개,2020. 4. 29.
밍밍,썸넬.... 화보인줄...ㅠㅠ 그으냥 존예에여ㅠㅠㅠㅠ 머리는 왤케 또 잘 어울려서 우는중ㅠㅠㅠ 이번 화장도 또또 찰떡이네요!!! 영상 맨날 올려주세요ㅜㅜ,0개,2020. 4. 29.
럽멜,허어어어얼 진짜 쫀예 아닌가여 ??? 사랑해영💖💝🐣,3개,2020. 4. 29.
Nika,Me encanta ver tus videos antes de que les pongas subs para practicar mi coreano (escuchando) y vuelvo a ver el video con subtítulos para saber si me equivoqué o no hahaha. Como siempre te ves super linda <3,3개,2020. 4. 29.
arinct,핑끄 메이크업 너무 예뻐요 ㅜㅜㅠㅜㅜ 생얼도 예쁜 희주언니 🥺❣️,1개,2020. 4. 29.
디카프리오왕자님,러블리가 사람이라면 바로 언니 당신 ❤️😆,2개,2020. 4. 29.
valentinacastro,"Heejoo es tan diva, me encanta!",3개,2020. 4. 29.
Jooniepop,YOU ARE SOOOOOOOO ADORABLEEEE AND PRETTY,3개,2020. 4. 29.
정다휘,ㅜㅜㅜㅡㅡㅠㅜㅜ 완전 핑크빛 그자체잖아요ㅠㅜㅜ,1개,2020. 4. 29.
진서,정말 이 언니ㅠ 항상 볼 때마다 하이틴 영화 주인공 같아요ㅠㅠ🤍🤍🤍🧝🏻‍♀️⭐️✨ㅠ존예,1개,2020. 4. 29.
비비빅정재현똥꼬,와 너무 이뻐요ㅜㅠㅠㅠㅜㅠㅠㅠㅠㅜㅠ으갸갸갸갸,1개,2020. 4. 29.
Sanshine,HERMOSAAAA ❤️,7개,2020. 4. 29.
NaomiDenisse003,"¡Me encanto tu maquillaje! 😍Yoo's beautiful,  y si haces un video imitando el maquillaje latino ? Seria muy curioso ver como te queda a ti el maquillaje fuerte ♥️. Saludos desde BC, México.",3개,2020. 4. 29.
nrhy,진짜 피부 무엇..ㅜㅠ,0개,2020. 4. 29.
혜성,썸네일 보고 머리 튜토리얼도 같이 있나 해서 들어왔는데 없네유ㅠㅠㅠ 다음에 시간 되면 꼭 올려주세요 넘 이뻐요 ㅠㅠㅠ,0개,2020. 4. 29.
삥뽕,오마이갓 ㅜㅜ 당신 넘 예뻐ㅜㅜㅜㅜ❤️,0개,2020. 4. 29.
SonneLee,진짜 이런 쨍한 핑크가 잘어울릴 수 있다니 넘나 대단하고.. 머리도 찰떡이네요. 저도 헤어 튜토리얼 보고 싶어요!!,1개,2020. 4. 29.
여니,히주언니.. 핑쿠도 찰떡.. 오늘 메이크업 영상 보니까 왜인지.. 언니가 만들고 있다던.. 립 올른 보고싶어졌어요ㅠㅠ!!!!!,0개,2020. 4. 29.
okeydokeysmokyeee,전 어케 딱 11시반에 일어난가죠..? 텔레파시><,2개,2020. 4. 29.
베어,넘 예뻐요ㅠㅠㅠㅠ,0개,2020. 4. 29.
박은비,"이뻐,, 언니 너무이뻐요,, 정말 그말뿐 ㅠㅠ 사랑해여 증말룽❤️❤️❤️",0개,2020. 4. 29.
오름oreum,희주님 항상 네일아트가 독보적인 거 같아요 :') 디자인은 네일샘이 정해주시는건가요? 어디에서도 볼 수 없는 ㅠㅠ 넘 예뻐여,1개,2020. 4. 29.
써유니SSEOYOONY,언니 사랑해요 진짜,2개,2020. 4. 29.
방탄사랑,희주님 오마이걸 승희 닮았어여!존예...♡,1개,2020. 4. 29.
dams,헐ㄹ렁ㅇ헐ㅇ엉ㅇ 언니는 뭐든 다ㅏㅏ어울리고 이뻐용ㅠㅠㅠ 목걸이 어디꺼에요?????,0개,2020. 4. 29.
유멍멍,언니가 바르면 뭐든지 예뻐... 언니 평생 영상 올려줘여😣❤️❤️❤️,0개,2020. 4. 29.
eunkyulKim,목소리 진짜 너무 좋으신것 같아요!!❤️❤️❤️      웜톤이시라고 들었었는데 (맞는 정보인가요?)핑크가 진짜 너무너무 잘 어울려요!! 사랑해요❤️❤️❤️❤️,0개,2020. 4. 29.
민카,희주언니 인스타 보자마자 달려왓슴돠💗,1개,2020. 4. 29.
졍국,너무이뻐 자쥬올려줘요ㅜㅜ❤️,1개,2020. 4. 29.
팡궁디팡,와 얼굴 줌한거 항상 궁금했는데 멀리서 보던 그 피부 현실이었네...완벽한 당신..,0개,2020. 4. 29.
쁘띠,빠글빠글 머리 너무좋아요ㅠㅠ 저두 요즘 펌해서 저런느낌인데 메이크업도 한번 참고해야겠어요😚,0개,2020. 4. 29.
혜원,일어나자마자 언니 영상 .. 난 오늘 운 다 쓴게 분명해 ... 사랑해 ♡ ❤️,0개,2020. 4. 29.
김아영,요즘 언니 영상만 보고 있어요ㅜㅜㅜ넘 이뻐,1개,2020. 4. 29.
김미애,알바 끝나고 보는 영상 너무 행복해요ㅠㅠ 황금연휴에 일하는 사람 저여저여..ㅎㅎ 그래도 언니영상보고있으니까 진상들때문에 스트레스 받은게 다 사라지는중ㅠㅠ❤️ 오늘 진짜 너무너무 귀엽고 진짜 너무너무 이쁘고💗💗 오늘 해어스타일도 그렇고 메이크업도 너무 이쁘고 진짜 아름다움 끝판왕!!❤️❤️,0개,2020. 4. 29.
BonnyBonny보니보니,넘무 죠아용 원래도 이뿐데 더 이뿨 U R so pretty😍,1개,2020. 4. 29.
방울토마토,아 색 천재,0개,2020. 4. 29.
기미찡Msfreckles,말할 때 자꾸 보이는 희주님의 귀여운 아랫니 두개가 너무 귀엽고 사랑스러워요🥺❤️,0개,2020. 4. 29.
은제로,공주님이당 진짜루 ... 히주공주님🤍💖,0개,2020. 4. 29.
남주혁NARAE,"머리 웨이브넣은거 넘예쁘댜 먹방브로그 다이어트브이로그도 재미게따요 언닌 오늘영상도 체고야,,,💖💖",0개,2020. 4. 29.
UUuu,언니 영상보면서 힐링할께용❤️🥰,1개,2020. 4. 29.
정윤서chyoonsir,요즘 희주님한테 빠져서 어제도 하루종일 희주님 영상들만 봤어요..❤️,1개,2020. 4. 29.
김채은,이거 보자마자 섀도우 팔레트 바로 샀잖아요!!! 색이 너무 예뻐요 진짜 ㅠㅠㅠㅠ,0개,2020. 4. 29.
Arii3,"Ayy sos tan hermosaa, te re admiro x tu linda personalidad y x tu conocimiento he aprendido mucho de lo que me gusta con tus videos..saluditos desde Argentina TE QUIEROO!!💖💖😙",3개,2020. 4. 29.
모모,희주님 렌즈 모끼신거에용~~?!!! 넘나 영롱쓰,1개,2020. 4. 29.
JJ,"오마갓 썸넬 레전드에요 ,, 후 ,,, 그리구 희주언니 룩북 존버 중,,,,",1개,2020. 4. 29.
