comment,noun,adj,verb
"Es cierto que las chicas manejando un Jeep se ven muy modernas y con autoridad. Es elegante pero juvenil. Da fuerza, a mi personalmente me encantan. 
Por cierto, yo solo tuve que usar seis meses las pastillas para el acné y me funcionó muchísimo. Sufría de acné y cara grasosa, ahora mi cara es seca y puedo lubricarla al mismo tiempo que es muy agradecida. En mi periodo me salen uno o dos barritos, pero jamás como antes. 
Me encantan tus vídeos, y más cuando hablas en español. Un besoo",[],[],[]
Your boyfriend is so open minded is so refreshing to see and also you guys make a super cute couple🙌🏻🙌🏻🙌🏻,[],[],[]
"Fueron varias preguntas interesantes, me gusta como piensan, se ve que tienen buena conexión ☺️ y lo del bullying creo que siempre hay y no solo a los extranjeros, realmente a mi me ha pasado que aún cuando yo llevaba alguna comida con olor, por que en México hay varias comidas igual con diferentes condimentos pues uno intenta que no huela tanto, suele ser vergonzoso, pero ya de grande no sucede igual, normalmente pasa en la adolescencia que sale el bullying.",[],[],[]
YOU ARE SOOOOOOOO PRECIOUS AND CUTEEEEEEE,[],[],[]
"Ay que bonito dijiste ""nalgita"", que bonita pareja hacen los dos ♥️",[],[],[]
남친 분이 기본 질문 외에 플러스 질문이랑 리액션 해주시는거 넘좋!!!!! 희주언니를 점점 더 알아가는 느낌이라 참 행복하네용ㅎㅎ 다음 영상도 기대할게용!,"['남친', '기본', '질문', '외', '플러스', '질문', '리액션', '언니', '점점', '느낌', '다음', '영상']","['좋다', '희다', '행복하다', '기대하다']","['해주다', '넘다', '알다', '차다']"
ㅋㅋㅋㅋ남친분 목소리랑 말투만들으면 쾌활한 아재미뿜뿜ㅎㅎ,"['남친', '목소리', '말투', '아재미뿜뿜']",['쾌활하다'],['만들다']
아닠ㅋㅋㅋ남자친구분 유재석인줄ㅋㅋㅋㅋㅋㅋ MC을 왜 이렇게 잘 보시는거에욬ㅋㅋㅋㅋㅋ 두 분 케미 체고💓,"['남자친구', '유재석', '두', '케미', '체고']",['아니다'],"['자다', '보다']"
남자나 여자나 젖꼭지 있는 건 다 똑같잖아... 내가 유스 뷰티를 좋아하는 이유!,"['남자', '여자', '젖꼭지', '건', '유스', '뷰티', '이유']","['있다', '똑같다', '좋아하다']",[]
자존감에 대한 생각을 하지 않는 것 너무 공감돼요,"['자존감', '대한', '생각', '공감']",[],"['하다', '않다', '돼다']"
남자친구분 진짜 멋있으신거같아요 탈브라에 대해 좋은생각가지고계시고 크롭탑에대해서도 자신감을 심어주셔야할거같다 하셨을때 대리감동 ㅠㅠ 희주님도 좋은말씀해주셔서 감사합니다!!,"['남자친구', '탈', '브라', '대해', '생각', '롭탑', '대해', '서도', '자신감', '대리', '감동', '주님', '말씀']","['멋있다', '같다', '좋다', '야하다', '같다', '희다', '좋다']","['가다', '크다', '심다', '하다', '해주다', '감사하다']"
Cuando crezca me voy a maquillar como tú/ When I grow up I'm going to put on makeup like you ♥️✨,[],[],[]
"Time Line ✨

1:13 피부과에서 처방 받는 피지 조절약 지금도?
2:56 언니만의 징크스가 있다면?
3:34 제일 좋아하는 계절과 이유
4:40 좋아하는 사람의 유형은?
5:18 타투 몇개 있어요?
5:30 지금 바른 립 컬러는?
6:02 나시탑&브라탑 입을 때 어떤 누브라&패치
7:10 유스뷰티 크루들과 왓츠인마이백 해주세요!
7:35 지프의 장단점, 컬러 선택 이유
10:46 유튜버가 아니였다면 어떤 직업?
11:29 크롭탑 입을 때 시선,신경
12:18 인생 계획 세우나요?
12:59 운전면허 한번에 따신거에요?
13:57 해외에서 오래 사셨나요?
14:49 제일 좋아하는 음식
15:17 운전 누구한테 배우셨어요?
15:41 자존감에 관하여 희주님에게 고마움
16:44 이 차가 언니의 첫 차인가요?
17:07 지금의 직업을 어떻게 갖게 되었는지
18:53 외국 살면서 힘들었던 점&극복 방법
21:07 잘하는 것 vs 좋아하는 것

이번 영상도 체고 🙏🏻💙","['피부', '처방', '피지', '절약', '지금', '언니', '징크스', '제일', '계절', '이유', '사람', '유형', '타투', '몇개', '지금', '립', '컬러', '나시', '탑', '브라', '탑', '입', '누', '브라', '패치', '유스', '뷰티', '크루', '왓츠', '마이', '지프', '장단점', '컬러', '선택', '이유', '유튜버', '직업', '크롭탑', '입', '시선', '신경', '인생', '계획', '운전면허', '한번', '해외', '제일', '음식', '운전', '누구', '자존감', '관', '주님', '고마움', '언니', '첫', '차', '지금', '직업', '외국', '점', '극복', '방법', '이번', '영상', '체고']","['있다', '좋아하다', '좋아하다', '있다', '어떻다', '아니다', '어떻다', '좋아하다', '희다', '차갑다', '어떻다', '힘들다', '좋아하다']","['받다', '바르다', '해주다', '세우다', '따다', '사다', '배우다', '하다', '갖다', '되어다', '살다', '하다']"
남자찡구 분 완죤 프로 리액션러 아님니까 ?! 티키타카 큐엔에이 넘 기엽짜나욧- 언니 사랑해요 진쨔룽  ㅠ ㅠ🤍🎀,"['남자', '완죤', '프로', '리액션', '러', '티키타카', '큐', '에이', '엽', '욧', '언니', '사랑', '진쨔룽']",['아니다'],"['넘다', '짜다', '하다']"
남자친구 쪼잘쪼잘ㅋㅋㅋ리액션도 넘 좋으시고 짹짹 새같네요 넘 두분 티키타카 좋아보이셔요,"['남자친구', '리액션', '짹짹', '새', '티키타카']","['좋다', '같다', '좋다']","['넘다', '넘다', '보이다']"
으악 드라이브영상 보고싶었는데ㅠㅠㅠ 스타일링 메이크업 다 넘 예쁘고 두분 잘 어울리시고 말투 텐션 넘 귀여우시고 🥺 저도 요새 장롱 탈출하려고 운전연습 한참 하고있는데 이 영상 보니까 낼 당장 하러가야겠쓰요 희주언니 사랑합니다❤️,"['드라이브', '영상', '스타', '일링', '메이크업', '말투', '텐션', '요새', '장롱', '탈출', '운전', '연습', '한참', '영상', '보', '낼', '당장', '언니', '사랑']","['예쁘다', '귀엽다', '희다']","['보다', '넘다', '자다', '어울리다', '넘다', '하다', '하다', '하다', '쓰다', '하다']"
남자친구분ㅋㅋㅋㅋㅋㅋㅋ긍정적엔 사람이 좋아 ! 하시니까 바로 너털웃음ㅋㅋㅋㅋ,"['남자친구', '긍정', '사람', '바로', '털', '웃음']",['좋다'],['하다']
언니 남자친구분이랑 같이 있을 때 세상 행복해보여서 부러어염🥰🥰 저도 언니같이 연애해보고 싶어여~~😆❤️,"['언니', '남자친구', '세상', '행복', '부러', '염', '언니', '연애']",['있다'],"['해보다', '해보다', '싶다']"
"I UNDERSTAND NOTHING BUT I JUST WANNA SEE HER BF 🤣
Edit: Okay she still didn't reveal him HAHAHA bummer ;;
Edit x2: I CAN ALREADY TELL HOW THEY MATCH OMG His voice seems serious but he's actually talkative??? ""I'm always pretty"" ""Yeah, you're right"" acckk this makes me sad being single fml",[],[],[]
6:52 남친 생각 너무 머시따,"['남친', '생각', '머시']",[],['따다']
ㅋㅋㅋㅋㅋㅋ재밌게 보다가 인종차별 화장실 부분에서 눈물 한방울 흘리고 갑니다ㅋㅋㅋㅋㅋㅋㅋㅋ⭐️,"['인종차별', '화장실', '부분', '눈물', '방울']",['재밌다'],"['보다', '흘리다', '가다']"
11:18 저도 언니가 유튜브 해줘서 너무 행복하고 제가 유후여서 너무너무 행복해요💜💜💜,"['언니', '유튜브', '유후']","['행복하다', '행복하다']",['해주다']
언니 운전하는것도 진짜 좋아하고 큐엔에이도 진짜 좋아하는데 두개 합친건 뭐 말이필요가없됴... 진짜 언니 평생 함께해요 우리 사랑해요✨🤍,"['언니', '운전', '큐', '에이', '개', '말', '필요', '됴', '언니', '평생', '해', '우리', '사랑']","['좋아하다', '좋아하다', '없다']","['하다', '합치다', '하다']"
"Por favooor! Te imploro los subs en español! Ni siquiera entiendo el inglés ✌😬
Unnieeeeeeeee! También sería cool la idea de hablarle español a tus amigas por 24 horas. 
Por los subs latinos, please!! Saranghae 💜💜 o como sea que se escriba",[],[],[]
남친분 리액션 부자시네요 ㅋㅋ,"['남친', '리액션']",['부다'],[]
어머어머러머 언니 남친!!!!! 목소리 출연이라니니니!!!!!,"['러머', '언니', '남친', '목소리', '출연', '니니']",[],[]
역쉬.. 언니 겉도 속도 너무 멋진사람... 최고에요......,"['역쉬', '언니', '겉', '속도', '사람', '최고']",['멋지다'],[]
"언니 남자친구분 진행력 무슨일이에요 ㅋㅋㅋㅋㅋㅋ
언니 말에 다정하게 공감해주시고 두 분 대화가 너무 듣기 편안해요 ◡̈ 다음에 다른 토크 영상도 기대해도 될까욤 •• 일단 오늘 23분 순삭 ,, ❤︎","['언니', '남자친구', '진행', '일이', '언니', '말', '공감', '두', '대화', '듣기', '다음', '다른', '토크', '영상', '될까욤', '일단', '오늘', '순삭']","['다정하다', '편안하다', '기대하다']",['해주다']
13:40초에 결혼 몇 살쯤에 할 생각이냐고 물어봤는데 운전면허에 대한 질문으로 되어있어용,"['결혼', '살', '생각', '고', '운전면허', '대한', '질문']",[],"['하다', '물어보다', '되어다']"
난 진짜 이 언니가 너무 좋다... 💖 다이어트 하는데 언니 영상 보면 다이어트 자극 받아요 엄청! 저도 언니처럼 예뻐지고 싶어요 😭 성공하면 돌아올게요 어엉ㅇ ㅠㅜ,"['난', '언니', '다이어트', '언니', '영상', '다이어트', '자극', '언니', '어엉']","['좋다', '예쁘다', '성공하다']","['하다', '보다', '받다', '싶다', '돌아오다']"
넘무 좋은 컨텐츠야 ㅠ,"['무', '컨텐츠']",['좋다'],['넘다']
헐 이런 컨텐츠는 처음인 거 같아요•••❤️ 너무 독특하고 창의적인••• 하지만 언니 얼굴에 더 눈이 가는 건 뭐죠 🤪 너무 보고 싶은 희주님 진짜 보고 싶은데 볼 수가 없으니까 화가 나 🤬 남친님이랑 롱런~~ 하십쇼 형님 사랑합니다 뿅뿅뿅,"['컨텐츠', '처음', '창의', '언니', '얼굴', '눈', '건', '보고', '주님', '보고', '볼', '수가', '화가', '남친', '롱런', '쇼', '형님', '사랑']","['이렇다', '같다', '독특하다', '희다', '없다']","['헐다', '가다', '싶다', '싶다', '하다', '하다']"
남자친구와 함께하는 희주님 뭔가 기분좋고 편안해보요옹ㅎㅎㅎㅎㅎㅎ 보면서 마음이 몽글몽글...!,"['남자친구', '주님', '뭔가', '기분', '편안', '옹', '마음']","['희다', '좋다']","['하다', '해보다', '보다']"
12:55 awww eso sonó muy cute  UwU,[],[],[]
희주님 남친분 말씀하시는것도 마인드도 너무 퍼펙트해요 !! 이정도면 믿고맡길수있겠어😆😆,"['주님', '남친', '말씀', '마인드', '퍼펙트', '정도']",['희다'],"['하다', '하다', '믿다', '맡기다']"
4:58ㅅㅂㅋㅋㅋㅋㅋㅋㅋㅋㅋㅋㅋㅋㅋㅋㅋㅋㅋㅋㅋㅋㅋㅋㅋㅋㅋㅋㅋㅋㅋㅋㅋㅋㅋㅋㅋㅋㅋㅋㅋㅋㅋㅋㅋㅋㅋㅋㅋㅋㅋ,[],[],[]
영상보는동안 입꼬리가 내려가지를 않아서 쥐가날정도..언니 영상보는거 내 삶의 낙이에여 오늘도 사랑해요❤️,"['상보', '동안', '입', '꼬리', '쥐', '날', '정도', '언니', '영상', '삶', '낙', '오늘', '사랑']",[],"['내려가다', '않다', '보다', '하다']"
언닝 항상 답글 너무 감샴당❤️❤️언니 큐엔에이가 젤 재밋아요 ㅠㅠㅜ!!,"['언닝', '항상', '답글', '감샴당', '언니', '큐', '에이', '젤']",['재밌다'],[]
언니 목소리는 너무 귀엽구 사랑스럽구... 운전하는 모습은 존멋... 내면도 단단하구.. 진짜 안좋아할 수가 없어여😭💖,"['언니', '목소리', '운전', '모습', '존멋', '내면', '수가']","['귀엽다', '사랑스럽다', '단단하다', '좋아하다', '없다']",['하다']
드라이브 하면서 QnA 해주시니까 정말 편안하게 들을 수 있어서 좋았어요!! 다음에는 눕방 같은거 해주셔도 좋을 거 같아요❤️,"['드라이브', '해주시', '정말', '다음', '방']","['편안하다', '있다', '좋다', '같다', '좋다', '같다']","['하다', '들다', '눕다', '해주다']"
"Hogoks 드라이브 하시는거 올려주시면 완전 좋을거같다고 올리려는데 올라왔다,,!🥺😖어쩜좋아 너무좋아 머리부터 발끝까지 다~ ~~~사랑해요오~!~💓","['드라이브', '완전', '어쩜좋', '머리', '발끝', '사랑']","['좋다', '같다', '좋다']","['하다', '올려주다', '올리다', '올라오다', '하다']"
이런 아이디어 뱅크 희주언니쓰~!~! 그냥 너무 죠아보료🥺💕,"['아이디어', '뱅크', '언니', '그냥', '보료']","['이렇다', '희다', '좋다']",['쓰다']
내 질문은 업따 ㅜㅜ 슬푸지만 영상 잘봣어용 ٩(ˊᗜˋ*)و,"['질문', '업', '슬푸', '영상', '잘봣어용']",[],['따다']
"언니 운전하는거 너무 머시따 ,, 💃💃","['언니', '운전', '머시']",[],"['하다', '따다']"
그래서 언니 타투가 몇개라구요..?,"['언니', '타투', '몇개', '고요']",[],[]
남자친구분 목소리만 들리는데도 언니랑 성격 엄청 잘 맞을거 같아보여요 언니가 완전 행복해 보인다고 해야하나!??표정이???? 암튼 희쥬온니 행복하셔요💗💗💗,"['남자친구', '목소리', '언니', '성격', '언니', '완전', '표정', '희쥬온']","['같다', '행복하다', '행복하다']","['들리다', '자다', '맞다', '보이다', '보이다', '하다']"
훗 너무 좋은영상쓴,"['훗', '영상']",['좋다'],['쓸다']
"Me encantó ,espero tanto a verlo subtitulado jajaja ,no entendí nada pero me lo ví completo 💜💜💜💜🌌te amo mucho ,cuídese ✨",[],[],[]
12:56 12:56 아 너무 귀여워요ㅠㅠㅠㅋㅌㅋㅋㅋㅋㅋㅋ 귀여워서 5번 돌려봤어요ㅠㅠ으악💜,[],"['귀엽다', '귀엽다']","['돌리다', '보다']"
Omg i didnt know u have a bf >< wish u all the best in ur relationship,[],[],[]
"언니 로아큐탄 부작용 심해서 지금 생산 중단됐구,, 대체제로 2차약 생긴거래유ㅠㅠ 그리고 부작용은 간수치 올라가서 술 불가,,이고 그외에 탈모나 엄청난 건조,,약 끊고 한달 내에 임신시에 기형아 출산확률이 엄청 높대요ㅠㅠ","['언니', '큐', '부작용', '지금', '생산', '중단', '체제', '차약', '랭', '부작용', '간수치', '술', '불가', '외', '탈모', '건조', '약', '달', '임신', '시', '기형', '출산', '확률', '대요']","['심하다', '엄청나다', '높다']","['타다', '돼다', '생기다', '올라가다', '끊다']"
저도 나중에 면허따서 돈 많이 벌면 지프차 살꺼에여!!! 지프 내가 원하는 차 ㅠㅠ 넘 멋있어❤️,"['나중', '면허', '돈', '지프', '차', '살', '지프', '차']","['원하다', '멋있다']","['따다', '벌다', '넘다']"
오늘 저도 저쪽 드라이브 하고 왔는데 시작부터 그 동네야서 놀랬어요 ㅋㅋㅋ,"['오늘', '저쪽', '드라이브', '시작', '네야']",['놀래다'],"['하다', '오다']"
"언니 인스타 보고 존버타다가 바로 왔슴돠~!~!
+ 저희 아빠도 맨날 세차할 때마다 비와요ㅋㅋ큐ㅠ","['언니', '인스타', '보고', '존버타다', '바로', '왔슴돠', '저희', '아빠', '세차', '비', '큐']",[],['하다']
역쉬 울언뉘 너무 좋앙❤️👍,"['역쉬', '뉘']",['좋다'],[]
누브라 얘기할때 남친분 심쿵ㅠㅠ...!!!!!,"['누', '브라', '얘기', '남친', '심쿵']",[],['하다']
스물아홉에 결혼하고싶다할때 남자친구분이 가장예쁠때? 라는 말에 난 항상 이쁘다고 받아치시는거 너무 맘에듭니다❤️❤️❤️❤️❤️❤️,"['스물', '아홉', '결혼', '남자친구', '가장', '말', '난', '항상', '맘에듭니']","['예쁘다', '이쁘다']","['하다', '하다', '받다']"
희주님의 가치관을 엿볼 수 있는 이런 큐앤에이 너무 좋아요 💖 토크쇼 보는 줄 알았어요 ㅋㅋㅋㅋㅋㅋ,"['주님', '가치관', '큐앤', '에이', '토크쇼']","['희다', '있다', '이렇다', '좋다']","['엿보다', '보다', '알다']"
언니ㅠㅜㅜㅜㅠ너무 좋아요 사랑해요 오래오래 건강하게 영상 올려주세요💖,"['언니', '사랑', '오래오래', '영상']","['좋다', '건강하다']","['하다', '올려주다']"
77ㅑ~~~~ 오늘 9시에 업뎃된다던 재밌는 영상이 이건가여~~~? 나 너무 설레~~~~~💓💓💓💓,"['오늘', '업뎃', '영상']","['재밌다', '설레다']","['되다', '이다']"
"언니 증말 이렇게 귀여울꺼야😤❤️
사랑해 증말","['언니', '증말', '여울', '사랑', '증말']",[],['하다']
오늘도 미모열일한다,"['오늘', '미모']",[],[]
I loved this video! Thank you for inspiring me with your answers. I am learning Korean now and I hope to become a stable youtuber. I love your content so much. One of my goals is to make videos speaking Korean fluently. I also am looking to buy a jeep too! I can tell that we would be great friends  :),[],[],[]
Thank you for the subs! I love your boyfriend's comments to the questions too. Would love to see more videos with him in it~,[],[],[]
"Wish I could speak your language, but so happy about the subtitles! 😍❤️",[],[],[]
언니 남친이랑 티키타카 너무 재밌어요!!!둘이 얘기하면 너무 재밌을 것 같아요 이런 영상 너무 죠타!!!언니가 편하다 생각하는 사람들이랑 있을 때의 귀욤미가 너무 좋다구욤❤️그리구 언니 저랑 생각하는게 너무 비슷해서 영상 볼 때마다 너무 신기ㅜㅜㅜ,"['언니', '남친', '티키타카', '얘기', '영상', '죠타', '언니', '생각', '사람', '귀욤미', '욤', '언니', '생각', '영상', '볼', '신기']","['재밌다', '재밌다', '같다', '이렇다', '편하다', '있다', '좋다', '비슷하다']","['하다', '하다', '그리다', '하다']"
언니 나랑 취저 나도 지프 드림카에요ㅜㅠ 아직고딩이어서 못산다 ㅠㅠㅠ,"['언니', '취저', '지프', '드림', '카', '고딩']",[],"['나다', '사다']"
와 남자친구분 공감을 너무 잘해주시는데요? ㅋㅋㅋㅋ 두분 같이 있으면 웃음이 끊이지 않을꺼같아요!! ㅎㅎㅎ,"['남자친구', '공감', '웃음']","['있다', '같다']","['오다', '해주다', '끊다', '않다']"
"Jijiji, me da gusto verte aunque no entendí casi nada, obviamente solo las pocas palabras que dijiste en español, saluditos de una mexicana en Italia 😂🤗😘",[],[],[]
ㅠㅠ 언니 너무 예뻐요 😭😭😭,['언니'],['예쁘다'],[]
ㅋㅋㅋㅋㅋㅋ아니 그래서 타투 스페인어로 뭐라고 하신간가요 ㅎ ㅎ ㅗ,"['타투', '스페인어']",['아니다'],"['뭐라다', '하다', '가다']"
Los subtitulos en español🙁 pero igual lo vere eres hermosaaa❤🤷‍♀️,[],[],[]
5:36지금받은립 이거 물어봤었눈데!!!ㅠㅠ읽어주시고 답해주시다니 감사해오❤❤행복감동뮤ㅠㅠㅠ😭😍,"['지금', '립', '답', '감사', '행복감', '뮤']",[],"['받다', '물어보다', '읽다', '해주다', '해오다']"
꺄 왔당!!!❤️❤️🙈💜💗,['꺄'],[],['오다']
헐 언니 나랑 여름좋아하는 이유 똑같아요 🥺🤍 활기넘치고 생동감있는 여름 쵝오,"['언니', '여름', '이유', '활기', '생동감', '여름', '쵝오']","['좋아하다', '똑같다', '있다']","['헐다', '넘다']"
"목소리만 들어도 두 분 너무 잘 어울려용💖💛
질문 읽어주시는데 너무 재밌어요ㅋㅋㅋㅋ최구최구","['목소리', '두', '질문', '최', '최구']",['재밌다'],"['들다', '자다', '어울리다', '읽다']"
언니 네에~이거 너무 좋아요...힐링되는 영상이다🥰,"['언니', '힐링', '영상']",['좋다'],['되다']
Quisiera este vídeo igual pero en español 😭❤,[],[],[]
언니 뭐얏뭐얏  말하는것만 들어도 너무 잘 어울리잖아 ❤️❤️❤️❤️,"['언니', '뭐얏뭐얏', '말']",[],"['하다', '들다', '자다', '어울리다']"
인스타 스토리보구 존버했저염 사랑슨해요오 ❤️❤️,"['인스타', '스토리', '보구', '존버했저염', '사랑', '슨해']",[],[]
이런 주제의 영상은 너무너무 좋아용!!!!!!!!!!!!!!!!!!! 다음에 또 해주세요♥️,"['주제', '영상', '다음']","['이렇다', '좋다']",['해주다']
"언니 운전 잘하시는것 같아서 넘 멋진데 말하는건 또 넘나 뀌여워요><
마침 제가 무한리필 훠궈집 딸래미인데 강남 오실 일 있으시면 언젠간 꼭 한번 들러주셨으면..!!ㅎㅎㅎ 팬미팅으로 훠궈같이 먹는거 어때용❤️","['언니', '운전', '말', '뀌여워', '마침', '무한리필', '훠궈', '집', '딸', '래미', '강남', '젠', '꼭', '한번', '팬미팅', '훠궈']","['같다', '멋지다', '있다', '어떻다']","['하다', '넘다', '하다', '넘다', '오다', '들다', '먹다']"
기다렸오요🧡😖 선댓후영상입니당🙈❣,"['선', '영상']",['이다'],['기다리다']
"당신 은 매우 아름 답 습 니 다, 당신 을 사랑 합 니 다. 당신 은 매우 아름 답 습 니 다, 당신 을 사랑 합 니 다. ❤👊","['당신', '은', '매우', '아름', '답', '습', '니', '당신', '사랑', '합', '니', '당신', '은', '매우', '아름', '답', '습', '니', '당신', '사랑', '합', '니']",[],[]
나중엔 차 소개도 해쥬세요!! 워츠 인 마이 카!!,"['나중', '차', '소개', '워츠', '인', '마이', '카']",[],['해주다']
남자친구분 리액션 너무 좋으시다 나도 리액션 장난 없는데 히주씨 아직 여자친구 자리는 나있죠?,"['남자친구', '리액션', '리액션', '장난', '주씨', '여자친구']","['좋다', '없다', '자리다']","['나다', '나다']"
진짜 실질적인 도움이 되는 답변인 것 같아요 감솨함당 꾸벅,"['실질', '도움', '답변', '감솨', '꾸벅']",['같다'],"['되다', '하다']"
희주언니 완전 귀용용,"['언니', '완전', '용용']",['희다'],[]
"Eoniiii, Eng sub pleaseee😢😞🙏",[],[],[]
"남자친구분과 캐미 쩔어요!!!! 공감도 정말 잘해주시고 부연설명과 정리 무엇!!!! 진행도 잘해주시고,, 와 
자주 두분이서 영상 찍어주세용🤍❤️
히주님을 엄청 사랑하시는게 느껴집니다 
넘 사랑해서 섬세하게 다 알고 챙겨주시려는 모습이랄꽈,,,","['남자친구', '분과', '캐', '쩔어요', '공감', '정말', '부연', '설명', '정리', '무엇', '진행', '자주', '영상', '주님', '사랑', '사랑', '알', '모습', '랄꽈']","['밉다', '섬세하다']","['해주다', '해주다', '오다', '찍다', '하다', '느껴지다', '넘다', '하다', '챙기다']"
앗싸룽❤️❤️❤️,['앗싸룽'],[],[]
점수 맞춰서 교.육.과.에 갔대...뇌섹녀...,"['점수', '교', '뇌섹녀']",[],"['맞추다', '가다']"
will you be adding eng subs? ❤️✨,[],[],[]
"Necesitoo subtítulos! No entendí nada pero aquí estoy. 
Amo este canal 🖤",[],[],[]
"Me encanta tu voz en español, es tan dulce y tierna !! Saludos desde México!! 🤠🇲🇽",[],[],[]
been refreshing and refreshing your channel for english subs and finally!! yay! thank u! 🥰,[],[],[]
러블리💖,['러블리'],[],[]
언니 학생이 사기에 덜 부담스러운 제품으로 ‘퍼플메이크업’ 다시 한번만 해주세요!!💜,"['언니', '학생', '사기', '덜', '제품', '퍼플', '메이크업', '다시', '한번']",['부담스럽다'],['해주다']
"저는 한겨울에도 크롭을 입는 자,,, 인데요 ㅎㅎ 그냥 입고싶은 거 입고 다닙시다>_<! 이것도 하고싶고 저런것도 해보고 싶은데 남들 시선때문에 신경쓰여서 포기한다면 세상엔 너무 포기해야할 것들이 많아요... 시도해보지않으면 나의 취향, 결국 나라는 사람을 알 수 있는 기회도 그만큼 줄지 않을까요 ㅠㅠ? 뭘하든 멋지고 아름다우니 원하는거 다 해보며 삽시다❤️💙","['한겨울', '크롭', '그냥', '남', '시선', '때문', '신경', '포기', '세상', '포기', '시도', '취향', '나라', '사람', '알', '기회', '뭘', '아름', '다우니']","['많다', '있다', '멋지다', '원하다']","['입다', '이다', '입다', '입다', '다니다', '하다', '저러다', '해보다', '싶다', '쓰이다', '하다', '하다', '하다', '해보다', '않다', '않다', '하다', '해보다', '사다']"
결론은 아자아자 화이팅!,"['결론', '화이팅']",[],[]
기다렸슨다 💚💚💚,['슨'],[],['기다리다']
우앙 언니 영상 역시 꿀잼★ 언니 가디건은 오디꺼예요? 완전 찰떡템♥,"['언니', '영상', '역시', '꿀잼', '언니', '가디건', '오디', '완전', '찰떡', '템']",[],[]
Ahh porque no hay subtítulos en español? ㅠㅠ.... bueno igual te seguiré amando 🥺❤️ cuídate mucho~ ^^,[],[],[]
남자칭구분이랑 나이차이 많이 나셔요?? ㅎㅎ 말투에서 뭔가 오빠오빠미가 느껴지시네용  😊😊두분 케미가 보기좋네욯ㅎㅎㅎ,"['남', '자칭', '구분', '나이', '차이', '말투', '뭔가', '오빠', '오빠미', '케미', '보기']",['좋다'],"['날다', '느껴지다']"
