comment,noun,adj,verb
"오.. 피부도 진짜 예쁘고 립도 진짜 깔끔하게 발리고 마스카라도 넘 예쁜데 이게 토니모리가 일낸건지 언니가 잘 소화하셔서 그런건지 모르겠어요. 언니가 워낙,, 피부도 좋으시고 예쁘시고 그러다보니 오히려 좋은데.. 좋은가? 싶어지네요😅","['피부', '립', '발리', '마스카라', '토니모리', '언니', '소화', '언니', '워낙', '피부', '오히려']","['예쁘다', '깔끔하다', '예쁘다', '그렇다', '좋다', '예쁘다', '그렇다', '좋다', '좋다']","['넘다', '내다', '건지다', '자다', '하다', '모르다', '보다', '싶다']"
제품들은 지속력이 좋고 전 언니가 좋아요💕,"['제품', '지속', '언니']","['좋다', '좋다']",[]
렌즈...렌즈...렌즈정보가 시급합니다아,"['렌즈', '렌즈', '렌즈', '정보']",['시급하다'],[]
마스카라 쳐도 왜 안 나오죠...?,['마스카라'],[],"['치다', '나오다']"
"5:11 ah, siempre quise una máscara delgada jsj solo consigo las que te dejan harto producto de pestañas porque son así para que se note y no me gusta",[],[],[]
Estoy feliz de ver tu bella cara y tu contenido de nuevo !!!!🥰💕💕💕,[],[],[]
렌즈 정보 좀 알려주세요 ㅠㅜ,"['렌즈', '정보']",[],['알다']
"Aaaah q hermosa💖, tus videos siempre me alegran",[],[],[]
렌즈 어디 제품이예요 ㅜㅜ?,"['렌즈', '어디', '제품']",[],[]
"희주님 영상에서는 쿠션 1호 스킨 베이지 라고 자막이 떠있는데 더보기란에는 2호 웜 베이지 라고 쓰여있어요!! 어떤 걸 쓰신 걸까요? 그나저나 제대로 저격당했슴다 다 사러 갑니다 내일 후,,,","['주님', '영상', '쿠션', '호', '스킨', '베이지', '자막', '보기', '란', '호', '웜', '베이지', '걸', '제대로', '저격', '내일']","['희다', '어떻다', '당하다']","['뜨다', '쓰이다', '쓸다', '걸다', '사르다', '가다']"
Pretty with makeup or without💖,[],[],[]
화면이 좀 뿌옇네욤,"['화면', '욤']",['뿌옇다'],[]
"Eres muuuuy hermosa,💙 amo tu piel demasiado linda ✨No entiendo mucho lo que dices pero te maquillas muy preciosa🌈",[],[],[]
(조용히 구독을 누른다),['구독'],['조용하다'],['누르다']
저 섀도우 팔렛 on going 인가요?,"['섀도우', '팔렛']",[],[]
"Te maquillas super bonito, lo gua intentar, saludos desde mx ✌🏼💖",[],[],[]
렌즈 뭔지 알려주세요!!,['렌즈'],[],['알다']
"살앙해요...,,,,,",['살'],['앙하다'],[]
아..개이뻐,['개'],['이쁘다'],[]
사진빨이요..? 그냥 언니가 예쁜 거잖아요..,"['사진빨', '그냥', '언니']",['예쁘다'],['잖다']
Ahora me hace falta esa cara preciosa 😔🥺,[],[],[]
Ooohhh I'm so early,[],[],[]
YOUR biggest fan from the Nederlands ❤❤❤,[],[],[]
뷰러를 안했는데 원래 속눈썹이 그렇게 올라가있는거에요?????,"['뷰러', '원래', '속눈썹']",[],"['하다', '올라가다']"
"Me encantó el vídeoooo, estoy segura que voy a intentar este maquillaje ¡Muy lindo! I LOVE UUU",[],[],[]
Plss add English sub!!,[],[],[]
"Tan linda como siempre, voy a tratar de recrear el maquillaje 💞",[],[],[]
Te amooo hermosa😭❣️,[],[],[]
? 희주님이 사진빨 안 받는 날도 있나...요? 대충 나 같은 미개한 중생이 하면 뭐 망하진 않을 메쿠이겠군요 ㅎ....오늘도 희주님 영상 잘 봤어요 요즘 드는 생각이지만 옛날보다 제품 소개하고 더빙? 실력이 엄청 느신 것 같아요 성장하는 희주님과 함께 할 수 있어서 너무 좋네요 🌟,"['주님', '사진빨', '날', '대충', '중생', '메쿠', '오늘', '주님', '영상', '요즘', '생각', '옛날', '제품', '소개', '더빙', '실력', '주님']","['희다', '있다', '같다', '미개하다', '망하다', '희다', '같다', '성장하다', '희다', '있다', '좋다']","['받다', '하다', '않다', '이겠다', '자다', '보다', '들다', '늘다', '하다']"
Estas bien hermosa con maquillaje o sin maquillaje  💜💅,[],[],[]
소중한 희주언니,['언니'],"['소중하다', '희다']",[]
저 언니 렌즈 정보 좀 알수있을까요??ㅠ,"['언니', '렌즈', '정보']",[],['알다']
넘예뻐!!!!!!!!!!!!!!!!!!!!!!!!!!!!!!!!!!,[],['예쁘다'],['넘다']
you make me want to buy every product you put on your lips 😩,[],[],[]
색감깡패,"['색감', '깡패']",[],[]
안녕하세요 희주님은 카메라 뭐 쓰시나용?,"['주님', '카메라']","['안녕하다', '희다']",['쓸다']
Kisses from Brazil >•<,[],[],[]
يجنن وجذاب ومليان كياته وبنوتي وطبيعي وإفرش و و و و و و حاجات كثير 😂من الاخر عجبني👍💕,[],[],[]
"혹시 화장품 광고 찍으신거 있으세요?
얼굴이 너무 익숙하고 어디서 본 듯한..","['혹시', '화장품', '광고', '얼굴', '듯']","['있다', '익숙하다']","['찍다', '보다']"
동영상 시작부분 너무 혼자 심취해있는거같아서 항마력딸려서 그냥 넘김ㅋㅋㅋㅋㅋ오글오글,"['동영상', '시작', '부분', '혼자', '심취', '항', '마력', '그냥', '넘김']",['같다'],"['하다', '딸리다']"
HELLO!!!! ❤❤❤❤❤,[],[],[]
"Yoo siempre es bonita, cualquier maquillaje le queda bien, es la mejor 😭💜",[],[],[]
me encanta como te maquillas sigue asi <3,[],[],[]
why is that pink eye-shadow can be so different on people... mine looks like i've cried all night!! definitely because of the way i look!,[],[],[]
브러쉬는 어느 걸 쓰세요?,"['브러쉬', '걸']",[],['쓸다']
"Porfavor por lo menos pudes colocar subtitulos .
Me encantan tus videos💜",[],[],[]
Anyone else not speak a word of Korean but is watching anyways? 🙋🏻‍♀️🙋🏻‍♀️💕,[],[],[]
I can’t say it enough your skin girl is amazing !!! Updated skin care routine please ❤️,[],[],[]
Soy a la única que no le aparecen los subtítulos en español ??,[],[],[]
is it just me that doesnt have the eng subtitles?,[],[],[]
2:01 와 진짜 긍정적이라 부럽다 나였으면 시팔 옷세트인데 왜 다르냐 욕했을텐데 정말...부럽,"['긍정', '옷', '세트', '욕', '정말']","['부럽다', '다르다', '부럽다']","['오다', '나다', '하다']"
La coreana más hermosa del mundo!!!❤️ demasiado linda,[],[],[]
"2:28 와 존예,,,,,,,,",['존예'],[],['오다']
"학생인 나는 오늘도 다짐한다
희주 언니처럼 출근할때 선글라스 끼고
멋있는 인생 행복한 인생을 살꺼라구!
애완견도 키울꺼라구! ♡
희주언늬 겁나 믓쪄부러~♡!🤩🥰","['학생', '오늘', '다짐', '언니', '출근', '선글라스', '끼', '인생', '인생', '애완견', '늬', '믓쪄', '부러']","['희다', '멋있다', '행복하다', '희다']","['하다', '하다', '살다', '키우다', '겁나다']"
10:58 이부분 넘 웃곀ㅋㅋㅋㅋㅋㅋㅋㅋㅋ,['부분'],[],"['넘다', '웃기다']"
Como le haces para ser tan bonita?🥺💗,[],[],[]
Acaso soy a la única a la que no le aparecen los subtítulos en español?,[],[],[]
"OMG SHE KNOW PONYO, OMG OMG OMG, no lo puedo creer estoy re loca solo porque Yoo conoce a ponyo
""Ponyo ponyo ponyo es un pequeño pez, en las profundidades de los mares la puede ver! ❤️❤️❤️
Edith:gracias por los likes hace poco que me uní a yt y nunca tuve tantos likes, los amo!!!! ❤️❤️",[],[],[]
6:13 희주님 H 이니셜 목걸이 어디 제품인가요?ㅠㅠㅠㅠㅠㅠㅠㅠㅠ,"['주님', '이니셜', '목걸이', '어디', '제품']",['희다'],[]
Hello from NY! Feels weird seeing people live somewhat normal lives right now.,[],[],[]
"Tus outfits son hermosos siempre te ves tan Bella !!! Además tu  perrito es súper tierno 💗💗 gracias por el vídeo , eres la mejor !!!",[],[],[]
14:27 립알려주세용 ㅠㅠㅠ🥺,['립'],[],['알다']
Estoy esperando los subtítulos pero aún así ya me lo ví y le di me gusta por qué eres un amor (◍•ᴗ•◍)❤,[],[],[]
희주님 이번에도 너무 재밌게 봤어여!희주 언니의 먹방 도 보고싶네요!되게 맛있게 먹을수 있는거 같애요 ㅋㅋㅋ 사랑해여 💓,"['주님', '이번', '언니', '먹방', '애', '사랑']","['희다', '재밌다', '희다', '맛있다', '있다', '같다']","['보다', '보다', '먹다', '하다']"
10:48 언니 저도 이거 본방보면서 해봤는데 ㅋㅋ 안되더라구요 ㅜㅜ,"['언니', '본방']",['안되다'],"['보다', '해봤다']"
언니 사랑해요ㅠㅠㅠ징쨔 너무 매력적이고 예쁘시고ㅠㅠㅠ볼 때마다 계속 반하게 되는...❤️ 저는 올해 대학 간 새내긴데 언니 보면서 자극받아서 스페인어 열씨미 배우고 있습니당!!(온라인이긴 하지만요..😭) 저도 언니처럼 믓찌게 스페인어 할 수 있게 되길!!❤️,"['언니', '사랑', '징쨔', '매력', '볼', '계속', '올해', '대학', '간', '새내기', '언니', '스페인어', '열씨', '온라인', '만요', '언니', '믓찌', '스페인어']","['예쁘다', '반하다', '밉다', '있다', '있다']","['하다', '되다', '보다', '자극받다', '배우다', '이기다', '하다', '하다', '되다']"
Watched it and is patiently waiting for english subs ❤️,[],[],[]
12:11 핑크 블레이저랑 선글라스 어디껀지 알수있을까요 🥺?,"['핑크', '블', '레이저', '선글라스', '어디껀']",[],['알다']
"4:33
ㅠㅠㅠㅠㅠㅠㅠㅠ귀여워쥬금(● ˃̶͈̀ロ˂̶͈́)੭ꠥ⁾⁾",['쥬금'],['귀엽다'],[]
3:06 저거 차종 뭔가용 ㅜㅜ 넘 예뻐용,"['차종', '가용']",['예쁘다'],['넘다']
"4:37에 립 어떤건가요?ㅠㅠ넘 예쁜걸료,,,","['립', '건가', '걸료']",['예쁘다'],['넘다']
6:42 트레이닝세트 넘궁금해요 !!!!٩(♡ε♡ )۶,"['트레이닝', '세트']",['궁금하다'],['넘다']
히주쓰 다여트 하면 안 돼야ㅜㅜㅜㅜ 왜냠 지금 면역력이 젤 중요한 시기이기 때문에 잘 먹어야한다는 논리🤭,"['주', '다여트', '왜냠', '지금', '면역', '젤', '시기', '이기', '때문', '논리']","['중요하다', '야하다']","['쓰다', '하다', '돼다', '자다', '먹다']"
언니 영상초에 나온 셋업 정보좀요ㅠㅠ,"['언니', '영상', '초', '셋업', '정보']",[],['나오다']
엉엉 희주님 브이로그가 제일 좋아요 아 사실 언니의 모든 영상이요...🙊❤️❤️ 희주님 영상은 항상 기분 좋아지고 행복해지는 것 같아요ㅠㅠ힐링하는 그자체...🌷❤️ 진짜 모든 부분이 하이라이트긴 한데 4:28 말이 돼액~?!이랑 포뇨포뇨 계속 돌려보고 있오요ㅋㅋㅋㅋㅋㅠㅠ보는 제가 다 즐거운 느낌..!!✨ 그리고 후추 볼 때마다 심장이 진짜 멎을 것 같아요 너무너무 귀여워요...정말 행복한 영상이네요 또 봐야게쒀요 사랑해염❤️😆,"['엉엉', '주님', '브이', '로그', '제일', '사실', '언니', '모든', '영상', '주님', '영상', '항상', '기분', '힐링', '자체', '모든', '부분', '하이라이트', '말', '액', '포뇨', '포뇨', '계속', '보고', '느낌', '후추', '볼', '심장', '정말', '상이', '사랑', '염']","['희다', '좋다', '희다', '행복하다', '같다', '있다', '즐겁다', '같다', '귀엽다', '행복하다']","['좋아지다', '하다', '기다', '돼다', '돌리다', '보다', '멎다', '보다', '쑤다', '하다']"
꺄앙 영상 7초전 좋아ㅠㅠㅜㅜㅜ,"['꺄앙', '영상']",['좋다'],[]
5:58 모야 흥얼거리는데 잘불러 언니 왜다잘해요,"['모야', '언니']",[],"['흥얼거리다', '잘불르다', '하다']"
ㅜㅜㅠ언니 옷들 정보도 알고싶어유..😭💛,"['언니', '옷', '정보', '어유']",[],['알다']
후추 꼬질꼬질 머리 너무 귀여워 ㅠㅠㅠㅠㅠ,"['후추', '꼬질꼬질', '머리']",['귀엽다'],[]
ㅁㅊ브이로그 너무 좋아 더 친해지는 기분쓰라구🥰,"['브이', '로그', '기분']",['좋다'],"['친해지다', '쓰다']"
후추ㅠㅠ너무 존귀 🐶 밥 먹을때마다 애절하게 쳐다보는 귀여운 강쥐..🤍,"['후추', '존귀', '밥', '강쥐']","['애절하다', '귀엽다']","['먹다', '쳐다보다']"
음료수 다르게나와도 모르는 거 도대체뭐얔ㅋㅋㅋㅋ 성격이 보인다ㅠㅠ.. 진짜 넘 착해요 언니,"['음료수', '도대체', '성격', '언니']","['다르다', '착하다']","['모르다', '보이다', '넘다']"
플리마켓 너무넘 기다리는 중...ㅜㅜ 얼른 종식되고 언니를 만나고 싶어요 !!!! ㅠㅠㅠㅠㅠㅠ  만약 하면 악세사리도 플리마켓에 나올까요? 햐... 안나와도 좋으니 언니가 빨리 플리마켓하게 코로나가 사라져쓰면! ㅜ3ㅜ,"['플리', '마켓', '중', '얼른', '종식', '언니', '만약', '악세사리', '플리', '마켓', '햐', '안나', '언니', '플리', '마켓', '코로나']",['좋다'],"['넘다', '기다리다', '되다', '만나다', '싶다', '하다', '나오다', '사라지다', '쓰다']"
언니 플리마켓 진짜 진짜 가고싶어여...와우 빨리ㅠㅠㅠㅠㅠㅠㅠ코로나 무찌르고 합시다!!!,"['언니', '플리', '마켓', '와우', '코로나', '무']",[],"['가다', '찌르다', '하다']"
언니 ㅠㅠㅠㅠㅠ반팔티추천 영상 올려쥬세요 ㅠㅠㅠㅠㅠㅠㅠㅠㅠ 흔한 브랜드 말구 귀엽고 예뿐걸로 ㅠㅠㅠㅠㅠㅠㅠ,"['언니', '티', '추천', '영상', '브랜드', '뿐것']","['흔하다', '귀엽다']","['올려주다', '말다']"
"세상에,,어쩜 이렇게 사랑스러울수가있어요ㅠ 저 오랜만에 봤는데 진짜 모델짬바 어디 안가고,,모든게 찰떡이구ㅠ가족들끼리 화목한것도 너무너무 보기 좋구ㅠ다이어트 안해도 넘 예쁘니까 너무 무리하지말아요ㅠ언니ㅠ몸 상하면 내 마음도 상하니까,,🌹다음에는 점프수트도 입어주시면 안되나요😘민트 점프수트 착붙일것 같아요✨","['세상', '어쩜', '모델', '짬바', '어디', '모든', '찰떡', '이구', '가족', '끼리', '화목', '보기', '다이어트', '안해', '언니', '몸', '상하', '마음', '상하', '다음', '점프수트', '민트', '점프수트', '착']","['사랑스럽다', '좋다', '예쁘다', '무리하다', '안되다', '같다']","['보다', '가다', '넘다', '입다', '붙이다']"
Imagine being this pretty i wouldnt know how to act 😭😫 keep safe always!! 💖,[],[],[]
포뇨 너무 귀엽쟈나여ㅠㅠㅠㅠㅠㅠㅠㅠㅠ♥️♥️♥️♥️,['포뇨'],['귀엽다'],[]
와 언니 진짜 멋쟁이ㅠ 아 너무 이뻐요❤️,"['언니', '멋쟁이']",['이쁘다'],['오다']
"ㅋㅋㅋㅋㅋㅋㅋㅋㅋㅋㅋㅋㅋㅋㅋㅋㅋ 티비에 나온거 저도 가족이랑 보면서 다 따라했었는뎈ㅋㅋㅋㅋㅋㅋㅋㅋㅋㅋㅋ 저도 궁둥이에서 걸리더라구요 ^.^,,,,,,","['티비', '가족', '궁둥이']",[],"['나오다', '보다', '따르다', '하다', '걸리다']"
헐 언니 항상 보면서 패션 취향저격이었는데ㅠㅠㅠ 플리마켓이라니ㅠㅠㅠ 참여하고싶어요♡♥,"['언니', '항상', '패션', '취향', '저격', '플리', '마켓', '참여']",[],"['헐다', '보다', '이다', '하다']"
5:18 엥 뭐야 귀여워,[],['귀엽다'],[]
"wow, so many youtubers updates at the same time 🥺",[],[],[]
"보통 장난감 엄마 앞에서 사면 혼나는데 후뚜맞!!
ㅋㅋㅋㅋㅋㅋㅋㅋ 같이 노시는 모습 너무 보기 좋아요 ♡","['보통', '장난감', '엄마', '사면', '후뚜', '노시', '모습', '보기']",['좋다'],"['혼나다', '맞다']"
언니 사랑해용 ㅠㅠㅠㅠ,"['언니', '사랑']",[],['하다']
마트에서 마스크를 구매하셨다니..행운아...🌟,"['마트', '마스크', '구매', '행운']",[],['하다']
12:14 헐 언니 저도 쎄이 좋아해요 ㅠㅠ 넘 멋있는 아티스트 🥺🥺,"['언니', '쎄이', '아티스트']","['좋아하다', '멋있다']","['헐다', '넘다']"
"후추가 젤 부럽다...이쁜 언니랑 맨날 같이 있어서❣️ 
삼일째 착장 너무 희쥬님 찰떡...!!","['후추', '젤', '언니', '삼일', '착', '희쥬님', '찰떡']","['부럽다', '이쁘다', '있다']",[]
짜장면 시켜먹은곳 어디에요 ㅠㅠㅠ중국음식 사랑하는데 ㅜㅜ 5:41 이때 립도 궁금해용 여리여리청순슨 이뽀요 💕💕,"['짜장면', '곳', '어디', '중국음식', '사랑', '립', '청순', '슨', '이뽀']","['궁금하다', '여리다', '여리다']","['시키다', '먹다', '하다']"
언니너무 귀엽당 오늘ㅠㅠㅠ,"['언니', '오늘']",['귀엽다'],[]
브이로그 너무 좋아요ㅠㅠㅠㅠ ❤️,"['브이', '로그']",['좋다'],[]
언니 목걸이 정보좀용ㅎ옹 ㅜㅜ 넘이뻐여,"['언니', '목걸이', '정보', '옹']","['좋다', '이쁘다']",['넘다']
브이로그 맛집 유스뷰티🤍🤍,"['브이', '로그', '맛집', '유스', '뷰티']",[],[]
"언니 혹시 남자친구분이 외국이신가요 ,,?!","['언니', '혹시', '남자친구', '외국', '가요']",[],[]
0:08 ポニョ？！？！？！？！ㅋㅋㅋㅋㅋㅋㅋㅋㅋㅋ,[],[],[]
희주님 처음에 나오는 고데기 품명궁금해요☺️,"['주님', '처음', '품명']","['희다', '곱다', '궁금하다']",['나오다']
하 너무 예뻐 사랑스러워 영앤리치 프리치 꽃길만 걸었으면 조케쏘 ❤️❤️❤️❤️❤️❤️❤️❤️,"['앤', '리치', '프리', '치', '꽃길', '조케쏘']","['예쁘다', '사랑스럽다']",['걸다']
언니ㅠ 이런 소소한영상 자주보여주라꾸요ㅠ❤️,"['언니', '영상', '자주', '라꾸']","['이렇다', '소소하다']",['보여주다']
핑크 츄리닝세트 어디 제품인가요?ㅠㅠ,"['핑크', '츄리닝', '세트', '어디', '제품']",[],[]
플리마켓하면 언니만나러 꼭갈거에요 ㅜㅠㅠㅠ🥺🥺그나저나 지프와 희주 넘 잘어울리믄것💚,"['플리', '마켓', '언니', '꼭', '지프']",['희다'],"['만나다', '갈다', '넘다', '어울리다']"
언니.. 온세상 좋은 수식어 다 붙여주고파..,"['언니', '세상', '수식어']","['좋다', '고프다']",['붙이다']
호피무늬바지 정보 알고싶습니다!🤭🤍🤎,"['호피', '무늬', '바지', '정보']",[],['알다']
언니 저는 언니의 콧노래가 좋아요 정말 달콤하거든요❤️,"['언니', '언니', '콧노래', '정말']","['좋다', '달콤하다']",[]
요즘 내 최애 유튜버 ..ㅠㅠㅠ,"['요즘', '최애', '유튜버']",[],[]
"I don't even understand Korean, but I watch all your videos even without subtitles because you're so beautiful and your face is the one of the most absolute stunning I've seen in my life ❤️",[],[],[]
후츄 ㅠㅠㅠㅠㅠㅠㅠ 넘 사랑스러워용 ㅠㅠㅠ,['후츄'],['사랑스럽다'],['넘다']
"Hi eonni... I missed you so much!❤❤
even though i did not understand anything you have said,  I have still watched this vlog.😊",[],[],[]
"ERES TAN LINDA, I can't :( <3 ☁🌈💛",[],[],[]
아 그냥 사랑해 계속 기다렸어 언니 그냥 1일 22929영상 올려줘 부탁이야 언니 영상 안 보면 현기증 남 ㅋ 사랑해 ❤️,"['그냥', '사랑', '계속', '언니', '그냥', '영상', '부탁', '언니', '영상', '현기증', '남', '사랑']",[],"['하다', '기다리다', '올려주다', '보다', '하다']"
진짜 멋있게 사는고같아요.. 선글라스 끼고 출근하기.. 제 로망스 ㅠㅠ 지프차까지ㅠㅠㅠ 언니처럼 살고싶네오😊❤️,"['는고', '선글라스', '끼', '출근', '로망스', '지프', '차', '언니', '네오']","['멋있다', '같다']","['하다', '살다']"
후.. 영상 너무 힐링,"['영상', '힐링']",[],[]
핑크블레이저랑 핑크립 정보 궁금해요ㅠㅅㅠ🧡,"['핑크', '블', '레이저', '핑크', '립', '정보']",['궁금하다'],[]
아 미친 사무실 울집하구 진짜 가깝다 지나가다 마주치구 시퍼요ㅠㅠㅠㅠㅠ,"['사무실', '집', '시퍼']","['미치다', '가깝다']","['하다', '지나가다', '마주치다']"
으아 후추ㅠㅠㅠㅠㅠㅠㅠ귀여워ㅠㅠ🐶❣️,['후추'],['귀엽다'],[]
영상너무너무이뻐요 혹시 카메라 뭐쓰실까요?? 아시는분 ㅠㅠㅠㅠㅠ 정말꼭알고싶습니다,"['영상', '혹시', '카메라', '아시', '정말', '꼭']",['이쁘다'],"['쓸다', '알다']"
언니 브이로그 많이 많이 찍어주세요ㅠ너무 재밌어요🤭♥️(;´༎ຶٹ༎ຶ`),"['언니', '브이', '로그']",['재밌다'],['찍다']
"4:50 쯤부터 나오는 언니 뒤에 있는 진열장? 선반? 같은거는 어디 꺼인지 알려주실 수 있나용? 곧 이사가는데 저런거 찾고 있었거등요💓 완전 심플하구 깔끔쓰한게👍 짜장면보다 저게 더 눈에 들어와 버렸네요ㅠㅠ
언니 일상 브이로그 넘 재밌어요 싸랑해용🍓❤️💖","['쯤', '언니', '뒤', '진열', '선반', '어디', '이사', '완전', '심플', '게', '짜장면', '눈', '언니', '일상', '브이', '로그', '싸랑']","['있다', '같다', '있다', '있다', '재밌다']","['나오다', '끄다', '알다', '가다', '저러다', '찾다', '하다', '깔다', '끄다', '쓰다', '들어오다', '버리다', '넘다', '하다']"
희주님 븨로그 징쨔 오랜만에 보는것 같아요ㅠ 영상에서 자주보여주세요!! 오늘두 건강한 하루되세욥!!!❤❤❤💋💜🌹,"['주님', '븨', '로그', '징쨔', '영상', '자주', '오늘', '하루', '욥']","['희다', '같다', '건강하다']","['보다', '보여주다', '되다']"
우왕 첫번째,"['우왕', '첫']",[],[]
3일내내 이쁘세요 ♥️,[],['이쁘다'],[]
So you can sing do amazing makeup natural and so skin like on top of that you look like a model...what talents don’t you have 🥰💗,[],[],[]
언니 핫핑쿠 자켓이랑 썬글라스 어디거에요!!?!?!?!ㅠㅠ 미쳤어요 너무 이뻐요 ㅠㅠㅠㅠㅠ 요즘 데일리룩 하울 찍어주세요ㅠㅠㅠㅠ엉엉 내 워너비,"['언니', '핫핑쿠', '자켓', '썬글라스', '어디', '요즘', '일리', '하울', '엉엉', '워', '너비']","['미치다', '이쁘다']",['찍다']
출근을 너무 예쁘게 하시는...,['출근'],['예쁘다'],['하다']
"전 요런 일상영상도 넘좋하요,,,🖤 언니도 보고싶고 후추도 다시 보고싶꾸 ㅜㅜ","['요런', '상영', '언니', '후추', '다시']",['좋다'],"['넘다', '보다', '보다', '꾸다']"
글고보니 가수 SAAY님이랑 닮았어요!!고양이 같은 매력😻,"['글', '가수', '님', '고양이', '매력']",['같다'],"['보다', '닮다']"
13분쯤 핑크자켓에 한 립이 뭔가요?!:),"['핑크', '자켓', '립', '뭔가']",[],['하다']
"No entendí nada, pero amé el vlog❤️ hace mas videos de este estilo, cariños de Chile 🇨🇱 🥰",[],[],[]
Please always include english sub. I'm indonesian and adore u so much! Much love 😍,[],[],[]
"16분짜리 브이로그가..5분마냥..순삭...넘잼써요..,,,더올려주세효오😫","['브이', '로그', '순삭', '잼', '효오']",[],"['넘다', '써다', '올려주다']"
언니ㅜㅜ그냥 일상이 화보에요,"['언니', '그냥', '일상', '화보']",[],[]
언니 브이로그 보는 순간만큼은 너무 편안하고 힐링돼요😭❤️ 정말 힐링 그 자체💕,"['언니', '브이', '로그', '순간', '힐링', '정말', '힐링', '자체']",['편안하다'],"['보다', '돼다']"
희주님~~~~! 브이로그 넘 좋.. 혹시 처음에 입었던 연두색세트는 어디서 구매하셨어요~? 😊 ㅎㅎ 그리고 후추 뇸뇸귀여워요ㅠㅠㅠ🐶,"['주님', '브이', '로그', '혹시', '처음', '연두색', '세트', '구매', '후추', '뇸뇸']","['희다', '좋다', '귀엽다']","['넘다', '입다', '하다']"
"ポニョ歌ってる！！
かわいい♡",[],[],[]
"01:02 혹시 고데기 정보 알려주실 수 있으신가용 ,,?? 😆😆","['혹시', '정보', '가용']","['곱다', '있다']",['알다']
세상에나 박시한 네이비 반팔티 정보 알려주실 수 있나요 ㅠㅠㅠㅠㅠ모든 옷이 아주 그냥 ...찰떡..♥︎,"['세상', '박', '시한', '네이비', '티', '정보', '모든', '옷', '아주', '그냥', '찰떡']",['있다'],['알다']
언니 영상 자주자주 올려쥬세요😢 제 인생의 낙 히쥬님♥,"['언니', '영상', '인생', '낙', '히쥬님']",[],['올려주다']
"지프 넘 예쁘죠🤍 희주님이랑 찰떡,, 차 나오면 리뷰도 해줘요 희주님🥺💛💛","['지프', '주님', '찰떡', '차', '리뷰', '주님']","['예쁘다', '희다', '희다']","['넘다', '나오다', '해주다']"
"Siempre tan hermosa, divertida y comilona 😂❤️espero estén todos bien,😊 acá en argentina seguimos en cuarentena.
Me encantó el juego de los peces 🐠, yo lo tenia cuando era niña 👧 cuidado que el 🐶no se tragué los peces 🙈🙉
Saludos 🥰💋",[],[],[]
헐 꽃들 너무예뻐용!!!  며칠전에 인터넷에서 저런 꽃들 심어진 거 봤는데 같은 공간인가봐요 넘예쁘네요🌷🌹💐🌼🏵🌻,"['꽃', '며칠', '인터넷', '저런', '꽃', '공간']","['예쁘다', '같다', '예쁘다']","['헐다', '심다', '보다', '보다', '넘다']"
