닉네임,댓글,좋아요수,날짜
Cookingtree쿠킹트리,"*자세한 레시피 설명은 유튜브 자막 기능을 켜서 확인해주세요~
딸기와 초코 스펀지 시트로 체크케이크를 만들었어요~
시트를 1.5cm 두께로 자르고 사이에 크림을 발라 순서대로 쌓아 만들고 초콜릿 가나슈로 코팅했는데 단정한 느낌의 케이크가 된 것 같아요~
딸기 가루를 넣어 딸기 향이 은은하게 나서 맛있더라구요~
단순해 보이지만 손이 많이 가는 편이라 시간은 오래 걸리지만 색다른 케이크라서 재미있게 만들었어요~
크림치즈에 딸기잼을 넣어 초콜릿과 함께 어우러지는 딸기 맛이 좋은 것 같아요~

 
시청해주셔서 감사합니다~♥
Thank you for watching~
 
▶영상을 좋게 봐주시고 좋은 마음으로 제안을 주시는 건 감사하지만
   자유로운 영상 제작을 위해 광고와 협찬 등은 받지 않고 있습니다~^^
 
▶Community Subtitles
 
If you can translate into another language,
I would appreciate it if you could use the link below to add subtitles to this video~^^
다른 언어로 번역이 가능하신 구독자님들께 도움을 요청드립니다~
아래 링크를 통해 자막을 추가해주시면 감사하겠습니다~^^
http://www.youtube.com/timedtext_cs_panel?c=UCtby6rJtBGgUm-2oD_E7bzw&tab=2
 
▷인스타그램 : https://www.instagram.com/cooking_tree/
▷블로그 : http://blog.naver.com/winterhaha",68개,2020. 4. 23.
BoBoCooking,Who else watches these knowing they're too lazy to try making it?,305개,2020. 4. 23.
DzDznQu,"Let's be honest




WHY ARE WE HERE TOTURING OURSELVES BY WATCHING THIS CUZ WE ARE ALL STARVING??? ( or itz just me?)",251개,2020. 4. 23.
JYTwinsASMR,Who else thinks Cooking Tree has the best recipe and the videos are so good and relaxing? 😍 ❤️ 🙋‍♂️🙋‍♀️,125개,2020. 4. 23.
emilyyang,when she stabbed the fork in the side of the cake ngl my heart hurt,39개,2020. 4. 23.
markhyuckstation,when you don’t have a cake leveler:,76개,2020. 4. 23.
somebodystopkimtaehyungkim,"her: draws a heart in the batter
me: :)",10개,2020. 4. 23.
Oryza,1:50 the heart made me smile,61개,2020. 4. 23.
humantanghulu,I feel so British watching someone make a battenberg cake,19개,2020. 4. 23.
TheBeatifullAngels,"Algún día abriré una cefeteria y haré todo esto, luego, te invitaré para que veas lo que he logrado. Gracias, res una de mis grandes inspiraciones uwu",37개,2020. 4. 23.
yerimsissy,"ok, that's so perfect",26개,2020. 4. 23.
EliRhodes,why does every video on this channel make me so inexplicably happy,17개,2020. 4. 23.
JulianaPadilla,I'm watching this late at night and I'm Hungry right now...,19개,2020. 4. 23.
MonserratEscobar,"I don't know if it's because of the quarantine but I love to see this I even subscribed, and I don't regret anything 😎💖",25개,2020. 4. 23.
장정현,진짜 금손이자 능력자이심ㅠㅠ,19개,2020. 4. 23.
지니어스민트바닐라,딸기 초콜릿 케이크 단면이랑 겉면이 예쁘네요 맛있을거 같아요 😍😍,9개,2020. 4. 23.
KitKatCandy,"OMG! This video has everything: cuteness, patience, love, perfection.....I'm lost in ♥️🥰",13개,2020. 4. 23.
도킹Doking,300만 축하드립니다🙏 영원한 베이킹 팬으로써 항상 감사드립니다❤💜🧡💚💛,14개,2020. 4. 23.
세상의모든취미세모취,The section looks like a toy cube :),17개,2020. 4. 23.
isabellynuggs,these videos are so relaxing to watch during quarentine,8개,2020. 4. 23.
Kiri,Am I only one who watches these when I’m starving so that I feel full even though I’ve have not eaten yet idk if that makes sense,4개,2020. 4. 23.
AbigailNarvaez,"Cooking Tree: Uploads a new video
Me: click as fast as i could😳💓",12개,2020. 4. 23.
냠냠보이YumYumBoy,포크로 딸기 초콜릿 케이크 뜰 때마다 침이 고입니다,6개,2020. 4. 23.
벌꿀,터키쉬딜라이트도 만들어 주세용❤❤,5개,2020. 4. 23.
오븐을데워요Ode,체크무늬가 너무 이뻐요 :) 속이 더 이쁜아이!!,3개,2020. 4. 23.
HSH,그거 이름 뭐더라 베턴버그?? 같이 생겼네요 너무 예뻐요!!,5개,2020. 4. 23.
지거니,오늘도 영상 잘 봤습니다💙 근데 ㅠㅠ 빵 자르실때 손가락 다치셨었나요?? 밴드 붙이셔서  🥺🥺조심하세요❣️❣️,5개,2020. 4. 23.
김정애,넘 촉촉 맛있어보여요~ 쿠킹트리님 레시피 진짜 맛있고 쉽고 너무좋아요^^ 대만카스테라 3번만들어 먹었는데 넘 맛있어요~ 👍👍👍,3개,2020. 4. 23.
오디너리키친OrdinaryKitchen,"thank you for making my weekends fun~
each week I've been baking one of your recipes and they all turn out delicious even if i fail",2개,2020. 4. 23.
팜프엉안,오늘도 영상 보고 힐링하고 갑니다~ 딸기와 초코가 있어서 케이크가 맛있을 것 같네요^^ 오늘도 맛있는 디저트 만들어 주셔서 감사합니다~ 재미있는 베이킹 하세요💕,2개,2020. 4. 23.
문수미,1드응~~~~~! 오래기다림,3개,2020. 4. 23.
,구독자 300만면 축하드려요❣❣❣,4개,2020. 4. 23.
SungKim,딸기가루를 구할수 없다면 생딸기글 졸여서 쓰면 안될까요?,3개,2020. 4. 23.
라벤더,구독한지 얼마 안됏는데 반했어요ㅋㅋㅋ,2개,2020. 4. 23.
루루,으어 썸네일 너무 먹고싶게 생겨서 들어왔다 저런케익 어디서 구하나요ㅋㅋㅜㅜ,2개,2020. 4. 23.
LovelySalmon,우와악 신기하다!!! 마법사가 즐겨 먹을 것 같은 비주얼이어요😍,2개,2020. 4. 23.
아리온,보다보나까 입에 침고임..,2개,2020. 4. 23.
황민재,구독자 50만명부터 구독해서 영상을 보았습니다 항상 좋은 영상 감사드려요 구독자 300만명 짐심으로 축하드립니다 400만명 가즈아!!!,1개,2020. 4. 23.
유화,믹싱볼 어디서 사셨는지 알 수 있을까요??,3개,2020. 4. 23.
김현정,"딸기 초코 체크 케이크네요^^

색다른 느낌의 케이크라서 저도 뭔가 맘에 드네요😍😍
항상 좋은 디저트/음식 만들고 영상 찍어서 저같은 시청자들이 보기 편하게 만들어주시고 업로드 해주셔서 감사합니다❤",2개,2020. 4. 23.
먹거리Meokgeori,대박 비주얼!! 👍👍😍😍,3개,2020. 4. 23.
IMah거상,볼때마다 채망 너무 예쁘네요ㅠㅠ 어디꺼 쓰시는 건지 여쭤도 되나요..,1개,2020. 4. 23.
AnnoymusPerson,사랑이다. I love it. 😍,2개,2020. 4. 23.
태린,왜 가운데 손가락 다치셨어요ㅠㅠㅠ 맴 아프게..,3개,2020. 4. 23.
FoxSnowTravelArt,으아~ 정말 예뻐요:) 맛나겠네요~~,2개,2020. 4. 23.
CasualCookery,I have to try this amazing cake at least once in my life! 😍😍😍,0개,2020. 4. 23.
lalala,진짜 비주얼적으로도 엄청 맛나보인다...츄릅...ㅠ 만들 엄두는 안나고 그냥 디저트가게 차리세요ㅠㅠ 제발요ㅠ 너무 먹고싶어요 흑흑,1개,2020. 4. 23.
J,딸기향 나는 스펀지 케이크부터 침고이는데 초코 스펀지랑 합쳐서 체크케이크라니.. 미치는 맛이겠다.. 일단 비주얼부터 미치겠는데요..?,1개,2020. 4. 23.
유수현,아 저 한 조각만요ㅠㅠㅠ 공부하느라(?) 당 떨어졌는뎅힝 ㅠㅠ,1개,2020. 4. 23.
,綺麗でオシャレで凄すぎます😆,0개,2020. 4. 23.
LavenderCandyAJ,I love your guys videos! They make me so calm and relaxed 😌,1개,2020. 4. 23.
왈왈왈,저번에 크레이프 변형인가? 맛있겠다...,2개,2020. 4. 23.
DOODLES,좋은 비디오 주셔서 감사합니다,1개,2020. 4. 23.
vera,"beautiful cake as always! 
12:56 but this moment hurts me XD",0개,2020. 4. 23.
IIamblossom,I used the apple cookie recipe for making cookies for people in my neighbor hood but insead of apple flavor I did lemon and made lemon cookies for the spring!!,1개,2020. 4. 23.
이쁜이이쁜,내가 이 채널을 알고 있다는 것이 정말 행운이야,1개,2020. 4. 23.
뭉개moonggaerecipe,"왁!!!! 삼백만!!! 축하드려요🥳🥳
쿠킹트리님 사랑해여❤️❤️",1개,2020. 4. 23.
MaKaylaSereal,Wow! It Is Beautiful! I Bet It Tastes Amazing.,1개,2020. 4. 23.
NatashaASMR나타샤,으아아아 정말 맛잇어보여요 ! 💖💖 ㅠㅠ 꼭 따라해봐야겠어요,1개,2020. 4. 23.
muto,300만 축하드려요!!!,2개,2020. 4. 23.
cherryday,BEAUTIFUL as always - would be a perfect afternoon snack,0개,2020. 4. 23.
환한미소를지어주쎄요,여기 메이킹 부늬기 항상 너무 좋아요 ㅎㅎ 디자인도 예쁘고,0개,2020. 4. 23.
AdriAnomaly,Always love the attention in your work!!!! Thank you!,0개,2020. 4. 23.
김제노베파,08:57 햄...맛살....해앰......,0개,2020. 4. 23.
LapisLazuli,When you saw too many recipes on the channel that you remember what you are supposed to do next xD,1개,2020. 4. 23.
달에놀러간김뽀,쿠키트리님 영상은 항상 힐링되요♡,0개,2020. 4. 23.
루룰루,빵 자를때 쇠막대기 대고 자르시는데 이거 이름이 뭐에요? 사고싶은데 모르겠어요😭,0개,2020. 4. 23.
EnnazorRellim,Always makes me laugh the way they make Sylvanian family members watch them make desserts and then demolish them.  Cooking lessons for Syvanian family members!,0개,2020. 4. 23.
,Спасибо за замечательный рецепт!!!,0개,2020. 4. 23.
민마카롱MINMACARON,썸네일보고 체스판인줄,0개,2020. 4. 23.
핑구핑구피피핑구,나중에 어른되서 독립하면 이분 영상 꼭 다 만들어볼거임,0개,2020. 4. 23.
ShinyAbel,"Omg i got the taste, its beautiful",0개,2020. 4. 23.
12,완소 힐링 힐링♡♡,0개,2020. 4. 23.
ilikecatsandstuff,"It's 12 pm , I'm starving.",1개,2020. 4. 23.
ClaireS,Awesome video. Thank you for sharing generously. May I know which brand of baking paper or mould are you using in this video? Is it silicone baking sheet?,0개,2020. 4. 23.
Phyllisxoxo,"This looks sooooo yummy.. I love watching videos like these, but so lazy to bake them.",0개,2020. 4. 23.
HMthepotato,holy moly I'm early :O,2개,2020. 4. 23.
FlorenciaGuzman,"Es tan perfecto, Que me vuelve loca cuando lo Inca por todos lados con el tenedor !!!!!!!!!! Diooosss",0개,2020. 4. 23.
NeaAndrea,"Beautiful cake as always!!! 😍But, If I don't have strawberry powder, what can I replace the ingredient with?  Would it be possible with Strawberries or a strawberry jam? 😟",2개,2020. 4. 23.
SabrinaR,I will make this! (someday) (eventually),0개,2020. 4. 23.
임지연,최고에요........❤️❤️❤️❤️❤️,1개,2020. 4. 23.
큰사랑,초콜릿 흘린부분 어떻게 처리하나요? 아까워서요 ㅎㅎ.녹인 초콜릿 남은부분 활용하는 방법도 알려주시면 좋을것 같아요~,0개,2020. 4. 23.
장지철,와 이건 진짜 한땀한땀 장인정신이 들어가야하는 디저트네요...! 그만큼 너무 예쁘고 맛도 좋아보여요!,0개,2020. 4. 23.
CherryColaa,Why do i watch this channel on fasting day 🙃?,0개,2020. 4. 23.
isnak,Cute cube◾️◾️\( ⬛️〰️⬛ ️)/~♥~,0개,2020. 4. 23.
YOSHIOISHI,Lovely recipe! Someone can't wait to taste the batter  at 8:11 😂,0개,2020. 4. 23.
WispyHollow03,You are an artist 😍 (with great patience too),0개,2020. 4. 23.
AkshayTata,curious - what do you do with the leftover material in the process?,0개,2020. 4. 23.
KoriandrOfTheStars,THESE REMIND ME OF KIPLING BATTENBERGS OMG,0개,2020. 4. 23.
RomyArg30,Unless im getting well paid  no way im doing all that work,0개,2020. 4. 23.
뽀얌,와씨 식욕자극 미쳐 먹고싶다,1개,2020. 4. 23.
EssioFootCosplay,12:56 GASP YOU NAUGHTY BEAN,0개,2020. 4. 23.
JaneDoe,"Wow so cool, just one question, the cake batter doesn’t need Bálint powder? Thanks is u can respond",0개,2020. 4. 23.
bunbun,Wow looks so good really want to try to make it,1개,2020. 4. 23.
TryingtoFood,"you put so much effort in your videos

it motivates me to work hard for my videos as well",2개,2020. 4. 23.
CrystalBaptiste,Hi. Can anyone give me the ingredients in tablespoons or cups?,0개,2020. 4. 23.
EmmelineLeng,why do i love these so much? 😂😂😂,3개,2020. 4. 23.
,Amazing looks good,2개,2020. 4. 23.
anupaasok,Love your cooking .... Keep up the good work 👌,0개,2020. 4. 23.
콩이먹방Tv,안에모양 참이뿌네요,1개,2020. 4. 23.
IlyasY,Aww what happened to your finger?😯😣,0개,2020. 4. 23.
IfiH,Looks so good. Going to try soon.,0개,2020. 4. 23.
rainhadopijama,can you try cooking brigadeiros? they're delicious but are extremely sweet lol,0개,2020. 4. 23.
,Wow!! You are really artist .nice continuation 🤗,2개,2020. 4. 23.
elifnurparmak,I love lying on my bed and watching your videos,0개,2020. 4. 23.
DuaaFraij,Who else saw that heart at 1:53? So cute :D,0개,2020. 4. 23.
UurdmandakhNamuun,i miss you! cooking tree🎂🍰😍😍😍,2개,2020. 4. 23.
NatthachaKamolsri,~หิวเลย~😭😂,1개,2020. 4. 23.
PamelaShinmar,"Colours of delicate mushroom pink and dusty cinnamon both match elaborately with chessboard patterns.  
Beautiful cake",0개,2020. 4. 23.
YuriLin,I almost cried at 12:55,0개,2020. 4. 23.
HngNguyn,wonder which kind of cake she could't create 🤔,0개,2020. 4. 23.
SoTasty,It fascinating. I crave it,0개,2020. 4. 23.
smallie210,Do you create these recipes yourself? Very talented,0개,2020. 4. 23.
CookiesInspiration,This video is so wonderful 👍😍👍,0개,2020. 4. 23.
Dung,Xem cho sướng con mắt đã cái tai chứ hổng bao giờ làm :> măm măm nhìn ngon,0개,2020. 4. 23.
IVANNAPINES,Eso es extremadamente delicioso :3,2개,2020. 4. 23.
Claudia,Enak nih 😍,0개,2020. 4. 23.
MerhawitIsak,Are any of the cakes for sale?,0개,2020. 4. 23.
VideoRicetta,Mamma mia! Che bellezza! Bravissima!,0개,2020. 4. 23.
kimberleykimura,i wanna make this but ill get even more fat,1개,2020. 4. 23.
chocomoco,Yummy. I want taste,3개,2020. 4. 23.
SandraScarlet,Delicious 😍,1개,2020. 4. 23.
Smiley,Super delicious cake recipe ....,0개,2020. 4. 23.
Eliana,"1.  Place a bowl of eggs on a pot of hot water, add sugar, honey, and vanilla extract, stir and mix until the temperature reaches 40 degrees.  2 .  Whip until a rich ivory-colored foam is obtained with a hand mixer, then sift through the flour and mix.  3.  Put a little bit of the dough in a bowl of melted unsalted butter and milk (temperature 50 to 60 degrees), mix, put in the main dough, mix, and transfer about a third of the dough to another bowl.  |  4 .  Mix the mixed dough with strawberry powder + warm milk and pink and white food coloring. Mix the other dough with cocoa powder + warm milk.  5.  Pour two pieces of dough into the mold, flatten it, and bake and cool for 30 minutes in an oven preheated to 170 degrees.
 6.  Cut the top, bottom, and edges of the cooled sheet and prepare it by cutting into a long rectangular shape.  7.  Add strawberry jam to cream cheese, mix fresh cream and mix to make cream.  8 .  Apply the cream between the chocolate and strawberry sheets alternately, and stack 2 times.  9.  Cut off both ends, apply the cream evenly over the ground, and set for 30 minutes in the freezer.  10.  Pour ganache of about 28 to 30 degrees onto the cake and coat it.
For ppl who need this",2개,2020. 4. 23.
VanSine,Enjoy baking?,0개,2020. 4. 23.
LolaLuppens,"I would do this but that's an insane amount of ganache that gets lost or that I have no idea what to do with.
ALSO HOW DO YOU MOVE A CAKE?",3개,2020. 4. 23.
momof2,Bravo!!!,0개,2020. 4. 23.
noraMonserrat,Exquisito y bello. Felicitaciones,0개,2020. 4. 23.
mayikimberlylozabarahona,Me encanta 😋😎 y es delicioso con un te frio. Saludos desde Bolivia 🇧🇴,1개,2020. 4. 23.
mojisalahshoor,"Awesome👌👌👌
You are perfect 🌹",0개,2020. 4. 23.
dlooali,Wow😲❤️❤️❤️,1개,2020. 4. 23.
anupaasok,😭why are you being so cruel.. by eating the whole cake.. it's not fair in this quarantine time 😭....,0개,2020. 4. 23.
AnonymousPerson,Who else is watching this at 2 AM?,0개,2020. 4. 23.
WineStory,I wanna make my wall full of these cakes. So pretty and if i am hungry i can eat the wall.,3개,2020. 4. 23.
RoloYoung,This is art,0개,2020. 4. 23.
MariVassoller,Perfect,1개,2020. 4. 23.
syiirahx,❤️❤️,0개,2020. 4. 23.
UurdmandakhNamuun,Strawberry or chocolate 🍓 🍫,3개,2020. 4. 23.
CakeJunkie,nice job. I love it so much,0개,2020. 4. 23.
Weeblum,Did anyone else think it looked like a Minecraft block at first?,0개,2020. 4. 23.
SakuraMikan,"I see that cooking tree and some other bakers whips the whole eggs until it rises in volume when making cakes
Can someone explain the differences between doing that and the traditional separating the eggs and creaming the yolks while creating a meringue with the whites",0개,2020. 4. 23.
vic,:),0개,2020. 4. 23.
,Magnificent,0개,2020. 4. 23.
Noctis,MaireWink tiene que hacer este pastel,1개,2020. 4. 23.
KpopForLife,"Sorry but how can some one not like chocolate
What's going on in the people that disliked heads 🤔🤔",0개,2020. 4. 23.
Emilce,Me encantan tus recetas pero no voy a hacer tanto quilombo para hacer una torta tan chiquita lpm,0개,2020. 4. 23.
SonuVj,I like the way you cook,2개,2020. 4. 23.
MaiMai,You’re so talented!,6개,2020. 4. 23.
EverythingwithAG,♥️♥️♥️♥️,1개,2020. 4. 23.
SomeshElegaonkar,I'm having Daal-Rice while watching this video and suddenly it started to taste like Strawberry and Chocolate 😂,0개,2020. 4. 23.
GolosinasArgentinas,Nice!,1개,2020. 4. 23.
LearnEnglishWithMe,Best shef 😃❤❤❤❤,2개,2020. 4. 23.
LearnEnglishWithMe,❤❤❤❤,1개,2020. 4. 23.
howtobakeit,😋👌❤,1개,2020. 4. 23.
LourdesJuarez,Nadie escribiendo español? Ok.,0개,2020. 4. 23.
ChocochefKolping,Buena receta gracias,0개,2020. 4. 23.
김예령,이곳은 곳 외국어로 도배될것입니다,4개,2020. 4. 23.
CarolLima,😋,0개,2020. 4. 23.
GloriaXiong,Nobody here is disturbed by the fact that a fork is being stuck in the middle of the cake ? 0:24,0개,2020. 4. 23.
Karenannking,Yummy,1개,2020. 4. 23.
XyzSame,"Looks nice, but a LOT of work. (Lots of cut off pieces that need to be eaten, too ;) )  I can see how I would try to spoon the batter in clumps into the form, hoping it does not sink and mix. OR: to bake each separate then spoon out pieces of cake balls  (round balls) and layer them into a form, the ""cement""would be cream, or a light butter cream filling, maybe the odd spoon of molten chocolate or strawberry jam thrown in - or even strawberries, then press lightly (if at all). 

it would be more like a Pavlova.

I also heard about a method where you have a cake roll (or two with different batter in this case), then you fill them (lightly), cut them up into slices and layer them into a form standing up.

Holding it all together with whipped cream or butter cream. That should also make for interesting patterns and not quite as much work.",0개,2020. 4. 23.
BeccyandtheMachine,Adverts are annoying!,0개,2020. 4. 23.
sumosimsim,😘😘😘😘😘😘😘😘😘,2개,2020. 4. 23.
예르방,1,2개,2020. 4. 23.
NrAzanizaSyahira,Everytime I saw the word STRAWBERRY it reminds me Twice Chaeyoung and today is her birthday OMG.....she should watch this 😂 and I'm sure she like whenever it's strawberry 😂😂,4개,2020. 4. 23.
MariaCucina,Like,0개,2020. 4. 23.
GilbertoGuzman,Nice😋😉😊😙,1개,2020. 4. 23.
BryanGuegan,Chocolate and strawberry cake as always... Please use new various ingredients Idk...,0개,2020. 4. 23.
