닉네임,댓글,좋아요수,날짜
SmiteeBhugowandeen,Is it possible to have the measurements in terms of cups instead of units please?,0개,2020. 5. 22.
SandyLe,"So pretty ! 

Where can I buy the plastic piece she uses to line the mold with? Or what is it called?",0개,2020. 5. 22.
ArcticFox,My dad would kill for some of the cooking supplies you have-,2개,2020. 5. 22.
keirahoech,these videos make me sleepy,0개,2020. 5. 22.
SheannVillena,I'm so early there is no ads yet,0개,2020. 5. 22.
LetciaGontijo,"First to watch 🥰🥰🥰🥰
From Brazil!",0개,2020. 5. 22.
MnChayMiNgy,Look beautiful anh so great with heart cake 😙😙😙,1개,2020. 5. 22.
PixiePlays,do you have to wipe the pan with oil for each crepe you cook?,0개,2020. 5. 22.
AyeshaRasul,It's so cute 😍🤧,0개,2020. 5. 22.
SaraMorais,Perfect 😍,0개,2020. 5. 22.
JrkyBentez,WoW! Algo especial para enamorar... 💖😆😊,1개,2020. 5. 22.
cherrycherry,I wish to make this once I have my own kitchen,0개,2020. 5. 22.
miralu,18 seconds ago. i'm here now👍🏿,18개,2020. 5. 22.
YasmineChr,Could someone tell what is thhat cream !  How can i make it myself,0개,2020. 5. 22.
ShortGus,How come I get fat just watching these...,0개,2020. 5. 22.
laramiaizz,I love the stove..,0개,2020. 5. 22.
youpurplei,How can you make it looks so easy to make?,0개,2020. 5. 22.
FlorianSurez,They make it look sO easy;,0개,2020. 5. 22.
lunarwxrld,Its basically the microsoft purple eye games cake lmao,0개,2020. 5. 22.
