comment,noun,adj,verb
"ㅋㅋ 초반쯤 김치도 호호 불어드시는거 ㅋㅋ 밧지롱ㅋ
넘나 맛나게 드셔요 !!
엠브로님~~^^👍👍😊","['초반', '김치', '호호', '불어', '밧', '맛', '엠', '브로']",[],"['들다', '넘다', '나다', '들다']"
짜파게티 먹을따 흰 옷은 국룰이져^^ㅋㅋㅋㅋ,"['짜파게티', '옷', '국룰']",['희다'],"['먹다', '따다', '지다']"
와 처갓집에 짜파게티면 국룰인정 잘어울리겠다ㅜㅜ이 밤에ㅜㅜㅜㅜㅜㅜ,"['처갓집', '짜파게티', '국룰', '인정', '밤']",[],"['오다', '어울리다']"
뭐만하면 국룰이라하시네,"['만하', '국룰']",[],['하다']
3:14 아니 형ㅋㅋㅋㅋㅋㅋㅋ 김치는 왜 불어먹는거얔ㅋㅋㅋㅋㅋ,"['형', '김치', '불어']",['아니다'],['먹다']
흐미 내가 먹고 싶었던 조합인데 ㅠㅠㅠㅠ이렇게 먹어주시구 👍 처갓집본사에서 ㅋㅋㅋㅋㅋ이거보고 짜파캐티랑 콜라보 하는거아니야?,"['흐미', '조합', '처갓집', '본사', '보고', '파캐티', '콜라보']",[],"['먹다', '싶다', '먹어주다', '짜다', '하다']"
3:13 김치불어먹기 ㅋㅅㅋㅅㅋㄹㅋㄹㅋㄹㅋㄹㅋㄹㅋㅋ,"['김치', '불어', '먹기']",[],[]
"슈프림 양념치킨은 무슨맛이에요.....?
진짜 궁금해서 그래요... 우리동네 처갓집이 없어요...","['슈프림', '양념치킨', '맛', '우리동네', '처갓집']","['궁금하다', '그렇다', '없다']",[]
순간 면 보고 진짜 짜장면인줄,"['순간', '면', '보고', '짜장면']",[],[]
와 새로운 조합인데 시도해 보고 싶다!!! 강화도 시골에서 사는 청년들입니다 주식이 라면인데 이 조합 꼭 해먹어야겠네요!!! 방송 넘 잼나게 보고 가요~!,"['조합', '시도', '보고', '강화도', '시골', '청년', '주식', '라면', '조합', '꼭', '해먹', '방송', '보고', '가요']",['새롭다'],"['오다', '하다', '싶다', '살다', '들이다', '겠다', '넘다', '재다']"
3:13 뜨거운 김치인가용 ㅋㅋㅋㅋ,"['김치', '가용']",['뜨겁다'],[]
ㄹㅇ 짜계치네 ㅋㅋ 짜파게티 생계란 슈프림치킨,"['짜파게티', '생', '계란', '슈프림', '치킨']",[],['짜다']
3:13 김치는 왜 불어먹는가..,"['김치', '불어']",[],['먹다']
엠브로님 인스타 사라지신건가요ㅜㅜㅜ? 링크 타고 들어가도 안뜨네요..,"['엠', '브로', '인스타', '건가', '링크', '타고']",[],"['사라지다', '들어가다', '뜨다']"
아ㅠㅠㅠㅠㅠㅠㅠ그냥 먹방 재능신이야ㅠㅠㅠ,"['그냥', '먹방', '재능', '신']",[],[]
"넘 헬쓱해지셨어요~~
얼굴형이 v라인","['헬쓱', '얼굴', '라인']",[],"['넘다', '하다']"
1:36 꺼억~,[],[],[]
내일 메뉴 짜자ㅇ..ㄹ..ㅏ..면..(메모),"['내일', '메뉴', '면', '메모']",[],['짜다']
왜 자꾸 이 시간대인거야....😭😭😭😭,"['자꾸', '시간대']",[],[]
엠브로님의 펴지지않는 미간을 보니 저건 진짜 믿고 먹어야하는 조합이다,"['엠', '브로', '간', '저건', '조합']","['밉다', '야하다']","['펴다', '않다', '보다', '믿다', '먹다']"
김치는 왜 불어서 드시는거죠?ㅋㅋㅋㅋㅋ,"['김치', '불어']",[],['들다']
엠브로님 다 드시고 현타 오신건가요 ㅋㅋㅋ,"['엠', '브로', '타', '건가']",[],['들다']
너무 맛있게 잘 먹으시는 엠브로ㅎㅎ,['엠브'],['맛있다'],"['자다', '먹다']"
3:12 김치 불어먹어요 ㅋㅋ,"['김치', '불어']",[],['먹다']
와 이 시간에 이런 먹방 ㅠㅠㅠㅠ,"['시간', '먹방']",['이렇다'],['오다']
"캬아 이시간에 이걸올리면 어뜩해요 ㅜ
너므좋잔아욬ㅋㅋ","['캬', '시간', '걸', '므']","['어뜩하다', '좋다']","['올리다', '자다']"
엠브로님 왜 치킨 한마리밖에 안드세용!?ㅠㅠㅠㅠㅠㅠㅠ,"['엠', '브로', '치킨', '마리']",[],['들다']
왤캐 맛있게 드시지 아 배고파서 밥먹어야것다,"['캐', '밥']","['맛있다', '배고프다']","['왤다', '들다', '먹다']"
진짜 브로형 맛있게 먹는다...,['브로'],['맛있다'],['먹다']
진짜 엠브로는 전설이다.. 하트한개만주라형,"['엠브', '전설', '하트', '만주', '형']",[],[]
와우..세개나 드시다니 한개반이면 물리던데!!부럽,"['와우', '개', '이면']",['부럽다'],"['들다', '물리다']"
와 진짜 미쳤다.......,[],['미치다'],['오다']
"처갓집 진짜 맛있습니다. 

제 치킨 NO.1

슈프림 + 간장/치뿌림 세트로 드셔보세요

간장은 치밥에 개꿀 치뿌림은 맥주랑 개꿀","['처갓집', '치킨', '슈프림', '간장', '치', '세트', '간장', '치밥', '개꿀', '치', '맥주', '개꿀']",['맛있다'],"['뿌리다', '들다', '보다', '뿌리다']"
김치도  후~~불어 먹는 센스ㅋㅋㅋㅋ,"['김치', '불어', '센스']",[],['먹다']
3:13 저기 오빠 김치를 왜 불어먹어...?,"['저기', '오빠', '김치', '불어']",[],['먹다']
영상 중간쯤 이면 호호 불어 먹을만큼 뜨겁진 않을텐데 습관이무섭,"['영상', '중간', '이면', '호호', '불어', '습관']","['뜨겁다', '무섭다']","['먹다', '않다']"
야식 먹어 배부른데...아~후식으로 짜파게*먹으러 갑니다~~후~~~~,"['야식', '후식']",['배부르다'],"['먹다', '짜다', '파다', '먹다', '가다']"
다이어트 하는 사람한테는 너무 맛있어 보인다... 칼로리범벅...♡,"['다이어트', '사람', '칼로리', '범벅']",['맛있다'],"['하다', '늘다', '보이다']"
짜파게리 비비는 소리가 미쳤다 ㅠㅠ,['소리'],['미치다'],"['짜다', '파다', '비비다']"
짜파게티에 흰색 후드티... 너무 불안해,"['짜파게티', '흰색', '후드', '티']",['불안하다'],[]
왜항상 엠브로님 먹방은 밤에 뜨는가....,"['항상', '엠', '브로', '먹방', '밤']",[],['뜨다']
모든 음식을 불어드심ㅎㅎ그렇게 뜨거운가요~~~김치마져ㅎㅎ김치부는거보고 빵터짐요ㅎㅎㅎㅎㅎㅎㅎㅎ,"['모든', '음식', '불어', '드심', '김치', '보고']","['뜨겁다', '빵터지다']","['기다', '지다', '불다']"
왜 김치를 불어드시나요 ㅋㅋㅋ,"['김치', '불어']",[],['들다']
왜 이시간에 이걸 봐버렸을까..... 맛있게 드셔주셔서 감사합니다,"['시간', '걸']",['맛있다'],"['보다', '버리다', '들다', '감사하다']"
"엠브로님 너무 맛있게 드셔서 내일 당장이라도 시켜야할 듯한 ㅜ 
아프리카 티비때부터 봤는데 항상 넘 잘 드시는거 같아요ㅠㅠ 항상 응원해요!!","['엠', '브로', '내일', '당장', '듯', '아프리카', '티비', '항상', '항상', '응원']","['맛있다', '야하다', '같다']","['들다', '시키다', '보다', '넘다', '자다', '들다', '하다']"
"나 엠브로 진심 사랑해 ,,,,,,,","['엠브', '진심', '사랑']",[],['하다']
형 처갓집 순살 뻑살30퍼 쫄깃살70퍼라는데 뻑살은 괜찮나요? 쫄깃살인때는 많이 시켜먹었는데 바뀐뒤로 엄두가 안나서,"['형', '처갓집', '살', '뻑살', '쫄깃살', '퍼', '뻑살', '쫄깃살인때', '뒤', '엄두', '안나']",['괜찮다'],"['시키다', '먹다', '바뀌다']"
엠브로님.. 어릴때부터 많이봤는데 점점 늙어가시는게 보이네요 ..,"['엠', '브로', '점점']",[],"['어리다', '보다', '늙다', '보이다']"
하...이 형 나 괴롭히는데 선수인듯 처갓집 좋아하는거 어떻게 알고 딱...올렸지..? 넘나 괴롭쓰,"['형', '선수', '듯', '처갓집', '알']","['좋아하다', '어떻다', '괴롭다']","['괴롭히다', '올리다', '넘다', '쓰다']"
얼음트레이는 어디서 살 수 있나요/?ㅋㅋ,"['얼음', '트', '레이', '살']",['있다'],[]
새벽2시 반에 이 영상을 보는 제 잘못이 큽니다,"['새벽', '반', '영상', '잘못']",[],"['보다', '크다']"
브로님~ 매번 영상 잘보고 있습니다! 선하신 분들 같아 재밌게 애정하며 보고있습니다~ 위 무리갈까봐 걱정돼유! ㅠㅠ 건강검진 꼭 받으시면서 영상 찍으세용! ^^,"['브로', '매번', '영상', '애정', '위', '무리', '걱정', '유', '건강검진', '꼭', '영상']","['있다', '선하다', '같다', '재밌다']","['보다', '하다', '보다', '갈다', '돼다', '받다', '찍다']"
형 다시 말라져가고 있어..무슨 일이야,"['형', '다시', '무슨', '일이']","['말르다', '있다']",[]
아 짜파게띠ㅠㅠ 아..... 너무너무 먹고싶다,['띠'],[],"['짜다', '파다', '먹다']"
오우 ㅎㅎ 르쿠르제 냄비 이쁘네용 오늘 구도가 살짝 바뀐것 같은데 더 좋아요😆✨,"['오우', '르쿠르제', '냄비', '오늘', '구도', '살짝']","['이쁘다', '같다', '좋다']",['바뀌다']
취향이같네  ㅋ 나도 처갓집 좋아합니다ㅎㅎ,"['취향', '처갓집']","['같다', '좋아하다']",['나다']
zzzzzzzㅋㅋ브로님 진실의미간,"['브로', '진실', '의미']",[],[]
살빠지신 것 같았는데 진짜 빠지신 거였군요..!,[],"['살빠지다', '같다']","['빠지다', '이다']"
김치는 왜 불어먹는거야 ㅋㅋㅋㅋㅋ,"['김치', '불어']",[],['먹다']
06:18 왜불어? 왜자꾸 불어?,"['불어', '자꾸', '불어']",[],[]
브로님 진짜 힐링 되네요^^ 계속 맛있게 먹는 영상 올렺주세요❤️❤️,"['브로', '힐링', '계속', '영상', '렺']",['맛있다'],"['되다', '먹다', '줄다']"
요즘 처갓집 떡이랑 뻑살 주더라고요.. 초심 잃음..  저의 집 매장만 그런건가..ㅠㅠ,"['요즘', '처갓집', '떡', '뻑살', '초심', '집', '매장']",['그렇다'],"['주다', '잃다']"
진짜 이컨텐츠 최애,"['컨텐츠', '최애']",[],[]
뭐야...머리 왜 예뻐..,['머리'],['예쁘다'],[]
쇼파에기대면서 미끄러지듯바닥에 앉는모습이 나인줄ㅋㅋㅋ,"['쇼파', '바닥', '모습', '나인']",[],"['기대다', '미끄러지다', '앉다']"
"저 김치는 왜 불어드시나요?? ㅋㅋㅋㅋㅋ
잘보고 갑니다~~","['김치', '불어']",[],"['들다', '보다', '가다']"
이거 볼려고 밤 샘,"['밤', '샘']",[],['보다']
3:10 먹방 유튜버 국룰 모든 음식 불어먹기,"['먹방', '유튜버', '국룰', '모든', '음식', '불어', '먹기']",[],[]
아 이시간에 보면 안될꺼 같은데 나도 불 올릴 삘인데...,"['시간', '불', '삘']","['안되다', '같다']","['보다', '나다', '올리다']"
처갓집 치밥은 ㄹㅇ 국룰이지~,"['처갓집', '치밥', '국룰']",[],[]
이제 asmr버전은 안만드시나요? 검정배경 너무 좋았는데 ㅠㅠ,"['이제', '버전', '검정', '배경']",['좋다'],['만들다']
3:12 김치는 왜 후 부는 거야? 뜨거워?,['김치'],['뜨겁다'],['불다']
자막 원래대로 해주요ㅠ아님 자동이라두 불편해서요ㅠ,"['자막', '원래', '해주', '자동']","['아니다', '불편하다']",[]
예전에는 엠브로님도 잘생겼을때가 있었는데...언제 삼촌이 된걸까ㅋㅋ,"['예전', '엠', '브로', '언제', '삼촌']","['잘생기다', '있다']","['되다', '걸다']"
다이어트 중인데 지옥의 영상이다 왜 나는 홀린듯이 클릭을 해버렸는가 ........아는맛이 젤루 무서워,"['다이어트', '중', '지옥', '영상', '홀린', '듯이', '클릭', '해', '맛', '젤루']",['무섭다'],"['버리다', '알다']"
ㄹㅇ돌쇠 스탈 개맛있게 먹는다,"['돌쇠', '스탈', '개맛']",['있다'],['먹다']
진짜 좋은 조합. 아이스크림과 짜장불닭면 그리고 치킨까지...,"['조합', '아이스크림', '짜장', '불닭', '치킨']",['좋다'],[]
식은거 훅~부는거 쫌!,"['훅', '쫌']",[],"['식다', '불다']"
아씌!!!! 부러웡..... 배고픈 퇴근길.....,"['아씌', '퇴근길']","['부럽다', '배고프다']",[]
이것저것 조합알아서 좋아요.. 나중에치팅할때 와서 메뉴정해야지😁😁,"['조합', '나중', '치팅', '메뉴', '정해']",['좋다'],"['알다', '하다', '오다', '지다']"
이오빠 ㅋㅋㅋㅋㅋ뭐하나 걸려라식 국룰 ㅋㅋㅋㅋㅋㅋㅋ,"['오빠', '하나', '라식', '국룰']",[],['걸리다']
김치는 왜 ㄴㅋ ㅋㅋㅋㅋㅋㅋㅋ ㅋㅋ,['김치'],[],[]
"안녕하세요 엠브로입니다! 
오늘은 슬기네 집에서 소고기 구워먹어봤습니다 ! 
요즘 너무 배달음식 위주로만 보여드리는거같아서 죄송스러워서 
좋은것좀 보여드릴거없나 생각하다가 이렇게 소고기 준비해봤습니다
벽제갈비 에서 포장했구용 
100만원 조금 넘게 나왔습니당
오잉 뭐 조금 밖에 안먹었는데 저렇게나 많이 나와 하시는분들 계실건뎅
1인분에 11만-12만원 정도 인지라 저정도가 나왔네용
예전 편집자님이랑 식사하러갔을대큰 갈비 먹을대 슬기 못데려 가서 
포장해서 따로 선물로 줬어용
코로나가 빨리 종식이 된다면 야외도 나가고 참치 해체도 하고 문어도 잡고 
다시 한번 신나게 농촌 라이프 촬영도 해볼게엽
요즘 사실 날이 쨍쨍한지라.. 농촌에서 뭔가 만들어 먹기 정말 좋은날인데..
너무 아쉬워요  
그래도 시기가 시기인지라.. 이럴대 더 조심해야 된다고 생각합니다
그렇기에 조금더 조심한 다음 다음에 보여드리는쪽으로 갈게요 ! 
맛은 ! 소고기 맛이지만 정말 부드럽고 맛있어요
꽃등심 같은경우에도 바싹 익혀먹어도 두툼하게썰어서
안쪽은 쫄깃한 느낌이 너무 좋았습니다
그리고 마무리로 먹었던 양곰탕이 너무좋았어요 ! 
얼큰 하면서도 뭔가 국밥 먹는거같은 느낌이어서 좋았습니다 ! 
오늘은 제돈주고 산거구용 따로 협찬 품 없습니당
양곰탕 같은경우 찾아보니 www.bjgalbishop.com 여기 따로 팔더라구여 참고만 하셔용 
오늘도 시청해주셔서 넘넘 감사합니다
다음에도 재미난 야외먹방으로 또 찾아뵐게욥 ! :)","['엠', '브로', '오늘', '슬기', '집', '소고기', '요즘', '배달', '음식', '위주', '로만', '것좀', '생각', '소고기', '준비', '벽', '갈비', '포장', '조금', '오잉', '조금', '뎅', '인분', '정도', '인지', '정도', '예전', '편집자', '식사', '갈비', '슬기', '포장', '선물', '코로나', '종식', '야외', '참치', '해체', '문어', '잡고', '다시', '한번', '농촌', '라이프', '촬영', '엽', '요즘', '사실', '날', '지라', '농촌', '뭔가', '먹기', '정말', '날', '시기', '인지', '생각', '조금', '다음', '다음', '쪽', '맛', '소고기', '맛', '정말', '꽃', '등심', '경우', '바싹', '툼', '안쪽', '쫄깃', '느낌', '마무리', '곰탕', '얼', '뭔가', '국밥', '느낌', '오늘', '돈', '협찬', '품', '곰탕', '경우', '여기', '참고', '오늘', '시청', '다음', '재미', '야외', '먹방', '욥']","['안녕하다', '이다', '같다', '죄송스럽다', '좋다', '없다', '저렇다', '계시다', '신나다', '좋다', '아쉽다', '이렇다', '그렇다', '부드럽다', '맛있다', '같다', '좋다', '좋다', '같다', '좋다', '없다', '같다']","['굽다', '먹다', '보다', '보이다', '드리다', '보이다', '드리다', '하다', '해봤다', '하다', '넘다', '나오다', '먹다', '나오다', '하다', '나오다', '하다', '가다', '크다', '먹다', '데리다', '가다', '하다', '주다', '되다', '나가다', '하다', '해보다', '만들다', '조심하다', '되다', '하다', '조심하다', '보이다', '드리다', '갈다', '익히다', '먹다', '썰다', '먹다', '크다', '하다', '먹다', '주다', '사다', '찾아보다', '파다', '하다', '해주다', '넘다', '넘다', '감사하다', '찾다', '뵈다']"
진짜 형 아프리카때부터 보는데 댓글들이 아무리 무례해도 걍 존댓말 쓰면서 넘어가고 자존심 접는 모습까지 진짜 단지 잘먹어서 좋은게 아니라 형은 인성까지 겸비해서 넘 좋아 앞으로도 계속 꾸준히 형 영상 보고싶어 몸관리 잘해 형 코로나 조심하공,"['형', '아프리카', '댓글', '존댓말', '자존심', '모습', '단지', '은', '형', '인성', '겸비', '계속', '형', '영상', '몸', '관리', '형', '코로나', '조심', '공']","['무례하다', '좋다', '아니다', '좋다', '꾸준하다']","['보다', '쓰다', '넘어가다', '접다', '먹다', '하다', '넘다', '보다', '하다']"
"여러분 친구  잘 사귀세요..
자취방에 소고기 사오는 친구 너무 멋있잖어.. 그것도 벽제갈비..","['여러분', '친구', '자취', '방', '소고기', '친구', '그것', '벽', '갈비']",['멋있다'],"['자다', '사귀다', '사오다']"
애인도 100만원어치 소고기 안사줘요 엠브로슬기는 진짜다,"['애인', '소고기', '엠', '브로', '슬기']",[],['사주다']
진짜 아직 외출 자제해야되는데 그런거 개의치않고 나가는 먹방 유튜버들보면 한숨밖에 안나옴... 엠브로님이 진짜 제일 사회적 거리두기 잘해서 너무너무 고마워요ㅠㅠ,"['외출', '자제', '개', '의치', '먹방', '유튜', '버들', '한숨', '엠', '브로', '제일', '사회', '거리', '두기']","['그렇다', '고맙다']","['하다', '되다', '않다', '나가다', '보다', '나오다', '하다']"
이쯤 되면 슬기님 언더아머 가게 주인인 듯,"['이쯤', '슬기', '머', '가게', '주인', '듯']",[],['되다']
자취방에서 찍은편중에서 제일 표정 좋은듯,"['자취', '방', '편중', '제일', '표정', '듯']",['좋다'],['찍다']
"와... 슬기님도 역대급 반응...
좋아하는 여자를 만나도 저정도로 설래여 하고 행복해할까 싶다ㅋㅋㅋㅋㅋㅋㅋㅋㅋㅋㅋㅋㅋㅋㅋㅋㅋㅋ","['슬기', '역대', '반응', '여자', '정도', '설']","['좋아하다', '행복하다']","['오다', '만나다', '하다', '하다', '싶다']"
슬기님 살빠지신거 같아요ㅠ,['슬기'],"['살빠지다', '같다']",[]
슬기님 좀 홀쭉해진 거 같은데...?,['슬기'],"['홀쭉하다', '같다']",[]
슬기님은 분명 1년6개월 정도 전에 영상을 같이 찍길 잘했다고 생각중이실꺼야... 부럽..,"['슬기', '분명', '개월', '정도', '영상', '생각']",['부럽다'],"['찍다', '하다', '끄다']"
오늘만큼 슬기님이 부러운 적이 없네요.. 소고기 100만원치 사들고 오는 엠브로님 같은 친구가 있으시다니.. 복 받으신 거에여!!,"['오늘', '슬기', '적', '소고기', '엠', '브로', '친구', '복']","['부럽다', '없다', '같다', '있다']","['오다', '받다']"
왼손잡이 슬기가 오른쪽에 앉고 오른손잡이 앰브로가 왼쪽에 앉아서 젓가락질할때마다 서로 살이 맞닿는 그런 커플로서 바람직한 모습... 두분의 꽁냥대는 모습 자주보고싶어요 ㅋㅋㅋㅋ,"['왼손잡이', '슬기', '오른쪽', '오른손잡이', '앰브로', '왼쪽', '젓가락', '질', '서로', '살이', '커플', '로서', '모습', '냥', '모습', '자주']","['그렇다', '바람직하다']","['앉다', '앉다', '하다', '맞닿다', '보다']"
이런 친구가 어디있을까 ㅋㅋㅋ.. 자취방에 소고기 100만원어치 ㅎㄷㄷ,"['친구', '어디', '자취', '방', '소고기']","['이렇다', '있다']",[]
저 방에 고기냄새 1주일은 갈듯 ㅎㅎ,"['방', '고기', '냄새', '주일']",[],['갈다']
"여기서 제일 고통받는분은 편집자님🤧
어떻게 참고 편집하셨는지 대단하세요 ㅋㅋ 슬픈개구리나올때마다 존웃ㅋㅋㅋㅋㅋ

저도 월급나오면 소고기 100만원치 사보고싶네요😃😃","['여기', '제일', '고통', '편집자', '참고', '편집', '개구리', '존웃', '월급', '소고기']","['어떻다', '대단하다', '슬프다']","['받다', '하다', '나오다', '사보다']"
엠브로가 착해.   슬기 자취하고 하니까  방송도할꼄밥도 먹일꼄 .    엠브로  멋져. !,"['엠브로', '슬기', '자취', '방송', '꼄밥', '먹일꼄', '엠브']","['착하다', '멋지다']","['하다', '하다']"
"슬기님 살빠지셨네..요즘 엠브로님과 야외방송을 못하셔서그런지ㅜㅜ 
엠브로님 방송보다 슬기님 팬이 되었지만 두분다 응원합니다👏👏","['슬기', '요즘', '엠', '브로', '야외', '방송', '엠', '브로', '방송', '슬기', '팬', '분다', '응원']","['살빠지다', '그렇다']","['하다', '되어다', '하다']"
"내가 브로님 좋아하는 이유:우선 먹방 유튜버 답게 맛있게 많이 잘 드시고 슬기님, 브로님의 어머니 할머니와 같이 오순도순 얘기 나누시는게 보기 좋고 가식같은 것이 아니라 촬영하고 계시지 않는것처럼 얘기하시는 부분이 좋다. 먹는데 꿀팁이나 맛집들을 알려주신다.그리고 항상 활짝 웃으시는 부분도 정말 좋기 때문에 오래오래 방송하셨으면 좋겠다.","['브로', '이유', '우선', '먹방', '유튜버', '답', '슬기', '브로', '어머니', '할머니', '오순도순', '얘기', '보기', '가식', '촬영', '계시', '얘기', '부분', '꿀팁', '맛집', '항상', '활짝', '부분', '정말', '때문', '오래오래', '방송']","['좋아하다', '맛있다', '좋다', '같다', '아니다', '좋다', '좋다', '좋다']","['자다', '들다', '나누다', '않다', '하다', '먹다', '알다', '주다', '웃다', '하다']"
슬기님 살 너무 빠지셔서 깜놀 ㅋㅋㅋㅋㅋ,"['슬기', '살', '깜놀']",[],['빠지다']
"슬기님 출연료가 있나요?
진심으로  궁금합니다?","['슬기', '출연료', '진심']","['있다', '궁금하다']",[]
6:06 리액션 이렇게 해주면 사줄 맛 날듯 내가 다 뿌듯하네,"['리액션', '맛']",['뿌듯하다'],"['해주다', '사주다', '날다']"
"엠브로님도,슬기씨도 착하고 좋은 친구인것같습니다.
역시 유유상종인가봅니다~~","['엠', '브로', '슬기', '친구', '역시', '유유상종']","['착하다', '좋다', '같다']",['보다']
잘생긴 슬기씨 앞머리 넘겨주고싶..... 히히 퐨이예요,"['슬기', '앞머리', '퐨이']",['잘생기다'],['넘겨주다']
자취방에서 연기나는거봐 ㅋㅋㅋㅋㅋㅋㅋㅋㅋ,"['자취', '방', '연기']",[],"['늘다', '보다']"
두분 오래오래 늙어서도 찐우정나누시길 진심으로 바래요. 인생의 동반자 인것처럼요.,"['오래오래', '우정', '진심', '바', '인생', '동반', '처럼']",[],"['늙다', '찌다', '나누다', '이다']"
슬기형 이번 영상에선 뭔가 살이 빠진거같이 보인당...,"['슬기', '이번', '영상', '뭔가', '살이']",[],"['빠지다', '보이다']"
와...백만원어치ㅋㅋㅋㅋㅋㅋㅋㅋㅋㅋ 나도 딱 한번만 저렇게 원없이 소고기 구워먹어보고싶다...,"['백만원', '어치', '한번', '원', '소고기']",[],"['오다', '나다', '굽다', '먹다', '보다']"
"슬기님 목소리 늠 조아서
지글지글 빗소리같은 고기굽는 사운드에 슬기님 목소리에 엠브로님 곁들여 자야겠어요
저도 꿈에서만큼 소고기 백만원어치 꼭 먹어볼께욥","['슬기', '목소리', '늠', '글', '글', '빗', '소리', '고기', '사운드', '슬기', '목소리', '엠', '브로', '꿈', '소고기', '백만원', '어치', '꼭', '볼', '욥']","['좋다', '같다']","['굽다', '곁들이다', '자다', '먹다']"
슬기자주 나왖 세요~~♡ 이래야 재미가 좋음 ㅎㅎ,"['슬기', '자주', '나왖', '래야', '재미']",['좋다'],[]
슬기 살빼니까 다시 잘생겨지고잇엉~~ 둘이나와야 재미가두배♥,"['슬기', '다시', '재미', '배']","['살빼다', '잘생기다']","['잇다', '오다']"
"슬기씨도   영국남자  친구 처럼
개인 유튜브 먹방 개설 하셔요
ㅡ슬기로운   먹방 ㅡ
찐우정  보기 좋아요","['슬기', '영국', '남자', '친구', '처럼', '개인', '유튜브', '먹방', '개설', '먹방', '우정', '보기']","['슬기롭다', '좋다']","['하다', '찌다']"
슬기형 진짜 밖에 안나가시나봐요.머리가....,"['슬기', '머리']",[],"['나가다', '보다']"
"I've been noticing that theres been no advertisements on your channel, I wonder is youtube is cracking down for some weird reason?  I watched 3 of your latest videos and theres not advertisements at all!",[],[],[]
엠브로의 아프리카 시절을 아는 사람은...정말 이 사람 성공할 수밖에 없다는 거 알 듯,"['엠브로', '아프리카', '시절', '사람', '정말', '사람', '알', '듯']","['성공하다', '없다']",['알다']
"브로님...불닭볶음면이 문제가 아니야....슬기형 잠시 브로형 채널 안나오니까 얼굴 턱선봐......




형턱없?","['브로', '불닭볶음면', '문제', '슬기', '잠시', '브로', '채널', '얼굴', '턱선', '형턱']","['아니다', '없다']","['나오다', '보다']"
한우는 슬기님 입에서 살살 녹고 전 슬기님을 보고 마음이 살살 녹습니다♡,"['한우', '슬기', '입', '살살', '슬기', '보고', '마음', '살살']",[],"['녹다', '녹다']"
서로 친구를 잘두신듯ㅋㅋㅋㅋㅋ 시너지가 어마어마해ㅋㅋㅋㅋ,"['서로', '친구', '시너지']",['어마어마하다'],['두다']
편집자 속마음ㅠㅠㅠㅠㅠㅠㅠㅠㅠㅠㅠㅠㅠㅠㅠㅠ,"['편집자', '속마음']",[],[]
