,youtube_id,comment,like_num
0,엠브로MBRO,"안녕하세요 엠브로입니다 오늘은 랜덤으로 무인도에서 살아남기 1 편입니다 ! 
실내 영상도 있고 농촌라이프도 있지만, 여러 새로운 영상들 제공하고싶어서 또 이렇게 컨텐츠 영상으로도 제작해봤습니다
항상 지루하지 않게끔 채널 운영 잘해보도록 하겠습니당
촬영 도와주신 섬 관리인님 및 기항지에 계신 분들 너무너무 감사합니다
덕분에 재미있게 다녀 갑니다 좋은 추억이된거같습니다
그리고 섬에는 무인도라고는 제목에 되어있지만 산넘어서 한팀이 더 캠핑 하고 계셨다고 하네용 
그래서 말소리나 요런게 조금 들릴수도있어용 참고 부탁드릴게용
섬에는 약 1시간 10분정도 인천에서 타고 들어가서 또 20분 정도 더 타고 들어갑니다
1시간 10분타고 갈때도 기항지를 한곳 들렸다 가게 됩니다
배멀미가 심하신 분들은 꼭 멀미약 드시고 타시길 바랍니다
저날 유난히 파도가 크게 을렁 이긴하였지만 안전하고 안아픈게 최고입니다
그리고 영상에 다친 부분이 나와요 배가 하루에 1-2번밖에 안뜨는곳인지라 
다음날 응급실가서 잘 치료 받았고 현재 잘회복중에있습니다 큰걱정 안끼치게 다음에는구상도 꼭 챙기도록 할게요
오늘도 시청해주신 분들 너무너무 감사합니다 좋은 밤 되시고 다들 즐거운 야식시간 되세요  
*1박2일로 다녀왔구요 무인도에서 캠핑은 개인사유지의 섬에 허락 받고 캠핑을 하였습니다 
*화기 사용 같은경우도 모래쪽 산림에서 벗어난 지역에서 사용하였습니다 :)
*따로 모닥불을 피우지 않았기에 화기에 대한 위험도 또한 없애고 촬영 하였습니다

+)그리고 예능처럼 채널 개편한다고 얘기드렸었는데용
오늘 처럼 이렇게 영상을  쭉 업로드 해볼가합니다
농촌라이프+실내먹방 안고 가면서 예능 컨텐츠형 채널 될수있도록 해볼게요",491개
1,SCKT3011,음식이 컨텐츠가 아니라 사람이 컨텐츠임 둘이 나오면 다 재밌음 ㅋㅋ,451개
2,VannieEats,Eating ramen outdoors seems so relaxing 😍,9개
3,심영,얼마나 익숙하면 짐싸 했을때 왜가 아니라 뭐싸가 먼저나오넼ㅋㅋㅋ,331개
4,오준서,근데 저게 진짜 위험해요 야생에있는 나무들중 독을 가지고있는 종도 있어서 나무젓가락으로 쓸때는 재대로 알고 써야해요,30개
5,JS,"다음에는 꼭 구급상자하나 챙겨가세요!
칼에 다친거보고 순간 심장이 덜컹했네요 ㅋㅋ큐ㅠㅠ",133개
6,음미하는시아SiaEnjoyEating,"무인도에서 살아남기도 함께하는 두분은 참된친구
 냄비뚜껑에 구워먹는 삼겹살 군침나와서 혼났네요😭👍",23개
7,HarryJ,근데 인간적으로 부르스타 가스랑 젓가락은 줘야하는거 아니냐 ㅋㅋㅋㅋ,85개
8,구독하면서울대감,이영상은 편집자님이 엠브로님을 엿맥이는 영상입니다 ㅋㅋㅋㅋㅋㅋㅋㅋ,166개
9,로제파스타,다치셨으면 촬영하시지 마시고 바로 병원부터 가시지 ㅠㅠ 다음부터는 안전한 촬영 해주세요 티비에 나오는 이런 방송은 한두명이서 하는게 아니란거 아시죠? ㅠㅠ 첫째도 안전 둘째도 안전!! 이번편 기대하면서 보다가 걱정만하다 끝났네요. 신박하고 좋은 아이디어지만 처음이라 그런지 ㅎ... 건강하세요!,58개
10,언주황,나무가지로 식사하실 때 조심해야 할 경우가 있습니다  남부지방에 많이 심어져있는 협죽도라는 관상수인데 독성이 강해 목숨을 잃을 수  있으니 조심하시기 바랍니다 야생에서  늘 유의하기 바랍니다,167개
11,FeelGoodFeel,브로님 다리는 괜찮으세요?,140개
12,ayuaoi,컨텐츠는 좋은데 다음엔 좀 더 안전을 생각하는 콘텐츠가 되면 좋겠어요~~ 두분이 무인도 가는게 메인지만 다음엔 응급처치나 찬스 진행할 편집자를 데려갑시다,14개
13,지니어스민트바닐라,오오 무인도에서 먹는 라면이랑 고기랑 해물들 맛있죠 😍😍 어머 범준님이랑 무인도에서 힐링 먹방 하셨네요 🤭🤭 너무 재미있어요 ❤❤,20개
14,KeonahLee,아니 진짜 진심 너무 신선하다 ㅋㅋㅋㅋㅋ 그냥 무인도가 아니라 대식가의 무인도.. ㅋㅋㅋㅋㅋㅋㅋ 디스커버리 충으로써 너무 기대됨,46개
15,JinP,으아니 거기서 찔려서 피가 났으면 빨리 나가든가 해야죠오오오오오오요어!!!!! 컨텐츠가 중요하긴해도 상처는 다른거에욧!!!!!! 배가 없었을것 같지만서도.....,24개
16,DENBAN,컨셉위해서 그러긴한대.. 두분 건강 생각해서 기본 필수품은 지급한후에 해요 ㅎㅎㅎ,3개
17,구독하면서울대감,엠브로님 이거 컨텐츠 대박입니다 진심 너무 신박하고 먹방의 혁신자이십니다! 그냥 먹방은 먹기만한다는 고정적인 틀에서 벗어나 이런 다큐와 예능과 먹방을 섞어놓은 리얼리티 영상 너무 대만족입니다!!!!진심 이런영상 떡상할거같습니다,42개
18,이성훈,"옆에서 보고있던 형이 다 지은 집 보고 ""뭐여 아직 집 짓고 있는겨?""라고 ....ㅠㅠ 브로형ㅠ",10개
19,청순아디,"12:28
거지궁완성..
ㅋㅋㅋㅋㅋㅋㄱㄲㅋㅋㅋㅋㅋㅋㄱㅋㅋㅋㅋㅋㄱㅋㅋㅋㄱㅋㅋㅋㅋㅋ",4개
20,정호연,진짜 편집자 복지가 얼마나 좋은거야 ㄷㄷ갑과을에 경계가 없네 ㅋㅋㅋㅋㅋㅋㅋㅋㅋ,89개
21,탭냐옹이,와... 왜 알람이 안뜬거지 ㅠㅠㅠㅠㅠㅠㅠㅠㅠㅠㅠㅠㅠㅠㅠㅠㅠㅠㅠㅠㅠㅠ,5개
22,이준원,사회적 거리두기 실천이 아니라 사회와 거리두기네,2개
23,야간자취생페르의일본생활요리브이로그,내가보는 유튜버들이 요즘 다들 자연에 목마르셨나ㅋㅋ무인도를 많이 가시네!,20개
24,나는몰라,다음 컨텐츠는 아무것도 없이 그냥 베어그릴스 처럼 갑시다!!!그게 더 개꿀일긋요!!!,2개
25,병아리,"저기 잠시만요.. 나만봤나요??
0:31 에 슬기님뒤에 분은 누구시죠??
그리고 바지는 왜 벗었나요??",2개
26,이진혁,슬기님 백팩 뭔지 아시는분..ㅜㅜ,3개
27,lorineK,여후... 너무 행복한 마음으로 봤는데 ㅠㅠ 칼에베이구 반대발에 묻은 피를 보고 놀랏어요 그때 크게 베이셧던건가요 ㅠ 그래두 엠브로님 프로시네용 하지만! 건강 늘 생각해주세여! 잘뵛어염!,45개
28,권윤재,"3:57  잠깐, 삼겹살 1kg가 33000원? 그럼 100g에 3300원? 무슨 숙성 삼겹살  그런 건가? 너무 비싼데?",1개
29,황가람,"브로형 아무리 컨텐츠가 중요해도 촬영하는 본인이 다치면 안되요....ㅜㅜㅜㅜ
항상 조심하시궁 힘내세요!!!",33개
30,Daone,오늘영상은 편집자님 인성 보는 영상인가요? 편집자님 인성 터졌엌ㅋㅋㅋㅋㅋ,37개
31,,두 분이서 어디를 가든 재밌을 듯 이 컨텐츠도 너무 재밌네욬ㅌㅋㅋㅋㅌㅌㅋㅌㅋㅋ편집자님 졸귀탱....,62개
32,우리종현쩨알이,진심 1세대? 먹방 하시는 분들중 제일 컨텐츠고민 많이 하시고 또 그걸 좋은결과로 만들어내는 분 같아요. 이번에 새롭게 시작하시는것도 기대 많이 하겠습니당!,16개
33,짱윤이,편집자임 매력 쩐당 ㅋㄱㅋㅋㅋㅋㅋ,23개
34,흐음,편집자님 목소리 너무 귀여워서 미치겠음ㅠㅠㅠㅠㅠㅠㅠㅠ 진짜 너무 귀여워요ㅠㅠㅠㅠㅠㅠ,25개
35,doctrine,아니 이렇게 야생에서 사는 깐텐츠 였으면 빨간가면 광저씨도 데려 갔어야져. 그러면 생존키트 없이도 굶지는 않고 살았을텐데.😁👍,1개
36,빼박아저씨야,"칼 ..ㅠㅠ 진짜 위험했네요 ㅠㅠ..
앞으로도 이 컨텐츠가 
잘 이어가기를 응원합니다^-^!!",39개
37,유튭으,슬기님 집에서 누구랑 같이 잔거죠...?,46개
38,노란딱지,편집자 뇌 상태 확인 3:29,34개
39,윤치킥,0:30슬기가 바지도 입지 않고 남자와 같이 잤다?????? 이건 레알이다.........,12개
40,최수용,다리 괜찮으세요...? 영상도 영상이지ㅏㄴ 안전을 항상 제일시 하셔야합니다.. 퓨ㅠㅠㅠ,3개
41,HJLee,칼은 너무 위험했네요 ㅜㅜ,19개
42,클래식,엠브로는 방송피디 했어도 잘했을듯,3개
43,역지사지,"엠브로님 예전 영상들 다시봤는데...
얼굴에 착함이 흐르더라고요...
별풍선유도 방송하지않고..
좋은일 많이 하고...진짜 보기좋아요..
크레이터분중에 손꼽히는 모법사례...
정말 젊은 나이에... 잘 살아가는 모습..좋아요..
그리고 친구분...쓰xx님..ㅋㅋ 함께 영원한 우정 변치마세요...",2개
44,RonRon,아마 편집자님한테 편집하며 제일 재밌던 영상 후보 1위이지 않을까..ㅋㅋ,1개
45,박준우,아이고 ㅜㅜㅜㅜㅜ 다음 촬영 때는 두 분 다 다치는 일 없었으면 좋겠어요ㅠㅠㅠ 브로행 슬기행 편집자님 재밌는 영상 감사합니다 !,1개
46,돌수tv힐링을찾아서Insearchofhealing,편집자님의 목소리...ㅋㅋㅋ. 판타롱 스타킹...ㅋㅋㅋ. 편집자님과 엠브로의 티티카카는 너무 재밌음. 저 바람 소리만 좀 어떻게 해 주셨어도..ㅠㅠ,60개
47,구독하면서울대감,이거그냥 편집자님 사고싶은거만산거같은데요 ㅋㅋㅋㅋㅋ,31개
48,김영진,이번 영상은 편집자님이 다했네 ㅎㅎㅎㅎㅎ,33개
49,후기남기는친구들,12:10 꿈만같던 내집마련이랰ㅋㅋㅋㅋㅋㅋ 편집자님 개웃겨요,1개
50,Tiki,막판에 들어와서 봤는데 편집자님 목소리 듣고 재밌어서 계속 봤어요ㅋㅋㅋㅋㅋㅋㅋㅋㅋ졸귀,11개
51,노란딱지,4:42 편집자님 목소리가 너무 깜찍하자나❤️,20개
52,초보요리사,어머나 슬기님 여친이랑 있으신줄알고 나혼자 깜놀ㅎㅎㅎㅎㅎ,32개
53,JHYoo,ㅠㅠㅠ 칼에 다치신거 다 나으셔서 다행입니다. 콘텐츠도 좋지만 항상 건강 조심하세요... 엠브로님이 건강해야 재밌는 영상을 볼 수 있죠..,22개
54,이아미,"처음에 슬기님 친구분이랑 같이 주무시는것 같은데 ㅋㅋㅋㅋㅋㅋ 
 0:37 슬기님 거의 포기 상태...어디 가는데가 아니라 뭐싸야되....
칼보고...8ㅁ8.. 컨텐츠 생각보다는 몸 아껴주세요..",3개
55,uu,7:08 표정ㅋㅋㅋㅋㅋㅋㅋㅋㅋㅋㅋㅋㅋ,2개
56,031조경주,여기가 요즘 나의 낙인데 보다가 다리 다친거 보고 급놀람 치료 잘 받으세요!,2개
57,호구마,아니 다리 괜찮으신가 진짜 영상보면 피가 좀 보이던데... 감염에 진짜 조심해야함 심지어 하루에 배 몇번 안오는 섬에서 고립되서 상처 크게나면 진짜 위험함,1개
58,사라지고싶냐,엠브로님다친다리 편집자님이 치료 잘해주시길^^,3개
59,xX노바Xx,밀가루 먹으면 장 나빠지고 피부까지 안 좋아져서 밀가루 못 먹는데... 엠브로님 먹방 보면서 대리만족 하고 있어영 ㅠㅜ,1개
60,행복이최고,브로정도는 돼야 유튜버라고 하지 ^^,1개
61,내손이만진거기,1박2일에서 은지원이 낙오했던곳이구나....,1개
62,김정현,편집자 레전드넼ㅋㅋㅋㅋㅋㅋㅋㅋㅋㅈㄴ웃기넼ㅋㅋㅋㅋㅋㅋㅋㅋ바보곰을 이용할줄아는 사람같네,10개
63,imageUn,편집자님은 조금더 준비를 하셔야할거같네요 시도는 좋았는데 허술한부분이있긴하네요,1개
64,RD,아이고 무인도 갔다가 칼빵을ㅠㅠㅠㅠㅠㅠㅠㅠ 피 딱봐도 많이 나신 것 같은데 엄청 걱정 되네요ㅜㅜ,1개
65,홍지우,형 이런 영상 너무 재밌다 근데 형은 힘들지:;.......,2개
66,구독하면서울대감,5:32 뭐 어쩌라구요~,4개
67,띠동갑연상연하커플,꽃게랑 안 먹은지 5년은 넘은 거 같은데.. 뜬금없이 먹고 싶네용ㅋㅋ,1개
68,한지훈,진짜 컨텐츠 잘뽑았다 너무 재밌네,8개
69,VF,슬리퍼 신고 무인도 가는게 더 놀라워ㅋㅋㅋㅋㅋㅋㅋㅋㅋ,2개
70,시도,"엠브로형 영상 볼때마다 참 좋은 사람이라는게 느껴진다.
오늘도 잘보고 갑니다!",49개
71,야미킹덤YummyKingdom,ㅋㅋㅋㅋ 항상 재밌는영상 잘보고 갈게융!🙏😫,4개
72,구독하면서울대감,9:04이건 너무 위험하네요ㅜㅜ,11개
73,박여행자,최고다! 진짜 지금까지 본 엠브로님 영상중에 몰입도 최상입니다. PS:편집자님 펜클럽 있으시나요?,16개
74,도도두두,브로님 컨텐츠도 중요하지만 건강이 항상 최우선입니다 몸 조심하세요 ㅠㅠㅠ,7개
75,roxanneRRR,영상 재밌게 보고 갑니다만 1박2일은 그만큼 응급상황 발생시 지원해줄수 있는 인원이나 물품이 있어서 그냥 재미있게 시청할수 있었지만 이번 영상은 다소 근심하면서 봤네요ㅠㅠ,1개
76,예수,"쌈장이 고추장+된장 이라서
실제로 라면에 쌈장 넣어먹으면 국물도 진해지고 더 맛있어져요 ㅎ
된장찌개맛과 김치찌개맛을 동시에 느낄수있달까",1개
77,서용준,편집자도 단단히 도라이네 ㅋㅋㅋㅋㅋ,2개
78,뚜루뚜뚜루,편집자분 자다깬 목소리 졸귘ㅋㅋㅋㅋㅋㅋㅋㅋ,10개
79,IceDice,"07:24
부르스타를 어디서 막 줏어오는거야..?",1개
80,ChangRyunn,와 진짜 예능프로보는듯 ㅎㅎ 근대 더가혹해보인다 ㅠㅠ,2개
81,박태현,컨텐츠 찍는건 좋은데 다치진 마세요ㅜㅜ 섬뜩했습니다...,2개
82,과일쟁이,앞으론 응급상자 꼭 들고가세요ㅜㅠ 그리고 아무 나무나 주워서 젓가락으로 쓰시면 위험해요ㅠㅠ,6개
83,JJuSaimDang음식솔직리뷰TV,어머나 ㅎㅎ 무인도라니 와우 옥탑방이 이제 왠지 익숙하게 느껴지네요 자는데 깨우는건 언제바두 꿀잼이예요 태어나서 한번도 안가본 무인도 안가봐두 좋아요😆✨,1개
84,노란딱지,최초공개 때 부터 10등 이였느데!!,7개
85,구독하면서울대감,마지막에 인간극장 브금뭔뎈ㅋㅋㅋㅋㅋㅋㅋ,2개
86,luskim,아직 첫작이라 어설픈 것도 있지만 재밋는 컨텐츠네요 ㅎㅎ 역시 컨텐츠 장인!!,2개
87,songh,"안전을 위해 텐트, 모기향, 담요라도 가져가시지.",1개
88,퍼플이언니의취미생활,편집자님 너무행.제일 중요한 수저ㅜㅜㅎㅎ 쌩나뭇가지로 라면 드셨네요. 엠브로님 다치셔서 깜놀 했어융  조심하세요. 담엔 구급상자 꼭 챙기세요. 꽃게랑 쌈장라면 기발한데용?ㅎㅎ,1개
89,퓨어,아 진짜 너무놀랐어요ㅠㅠㅠㅠㅠㅠㅠㅠㅠㅠㅠㅠㅠㅠㅠㅠㅠㅠㅠㅠㅠㅠㅠㅠㅠㅠㅠㅠㅠㅠㅠㅠㅠㅠㅠㅠㅠㅠㅠㅠㅠㅠㅠㅠㅠㅠㅠㅠㅠㅠ.......,1개
90,이,컨텐츠 아이디어 대박적ㅋㅋㅋㅋㅋ,2개
91,코코노에린,엠브로님 다치신거 괜찮으신가요 ㅠ 영상 보는 내내 그게 제일 걱정이 되서... 다행히 응급실 가시고 회복하셨단 정말 다행이네요.,1개
92,사이다원챔유져,사회적 거리두기 최적화 컨텐츠 아니냐,6개
93,NevilleBean,다리 진짜 아프시겠다 ㅠㅠㅠ,8개
94,거냥,두분이면 뭘하든 재밌음ㅋㅋㅋㅋㅋㅋㅋ,1개
95,김보리,엠브로님 슬기님 환상의 콤비 보기가 너무 좋아요. 냄비뚜껑에 구워먹는 삼겹살이 너무 먹고 싶네요. 저도 무인도를 가고 싶었는데 대만족하고 봤어요. 정말 재미있네요.😄👍👍👍👍👍👍👍,1개
96,아담Adam자취생먹방,진짜 엠브로님 먹방 컨텐츠의 한 획을 긋는 거 같아요😁😁처음에 쌈장 덜 넣었을 때 슬기님께서 나쁘지 않아!하셨을 때 단호하게 아니!ㅋㅋㅋㅋㅋ 귀여우세요:),34개
97,이혜미,컨텐츠도 좋지만 안전안전 조심하세요❤️,2개
98,구독하면서울대감,5만원중 33000원을 삼겹살ㅋㅋㅋㅋㅋㅋ,2개
99,carpediemin,1:37 ㅋㅋㅋㅋㅋㅋㅋㅋㅋㅋㅋㅋㅋㅋㅋㅋㅋㅋ편집자님이랑 정말 사이좋으신듯ㅋㅋㅋㅋㅋㅋㅋㅋㅋㅋㅋㅋㅋ,0개
100,마라탕,"개재밌어요 진짜 ㅋㅋㅋ
엠브로님 다리 괜찮으신가욥 ㅠㅠㅠ?",1개
101,진수하,7:50 진텐이네 ㅋㅋㅋㅋㅋ,0개
102,물개지욱TV,다리 다치셔서 속상해요 빨리 나으시길 바랍니다 ㅠㅠ,2개
103,회리,신선하다... 다음화 기대된다...,1개
104,DAPAN,쓰레기 개귀여워,1개
105,sunlee,이런 컨텐츠 완전 좋아.. 그리고 편집자 너무 좋아....,4개
106,권,진짜 자밌닼ㅋㅋㅋㅋ,2개
107,ModulesL,4:45 모기이~,1개
108,YoungskinCare,공중파 예능 보는거 같애요 ~~~무인도에서도 이렇게 재미있는 콘텐츠는 최고!!!!!!,1개
109,똥개,ㅋㅋㅋㅋㅋ엠브로형 영상중에서 제일 좋다,1개
110,kurahonda,처음 이지만 재밋게 보앗습니다. ㅋㅋ 뭔가 pd같은 역할을 해줄수 잇는 사람이 잇엇다면 더 재밌을것 같아요,0개
111,임현묵,4:44 귀여웡; 모기~,0개
112,이동재,편집자 엄청 시크해ㅋㅋㅋ,1개
113,구독하면서울대감,7:49찰지구나,1개
114,도토리,이런 새로운 시도 좋아요ㅎㅎ 티비 예능 보는 것 같아요,8개
115,JayPark,슬기 나오면 케미가 너무 좋음 ㅋㅋ 둘이 너무 재밌어 ㅋㅋㅋㅋ 엠브로랑 슬기는 쿵짝이 좋구먼,0개
116,이동훈,컨텐츠나 편집이 진짜 뭔 공중파 같네...,0개
117,미정,"아구 항시 칼조심!!
많이 아팠겠다ㅜㅜ",1개
118,미쿡,사람은 역시 늘 솔직해야돼 ㅎㅎ 늘 욕심만부리고 거짓부렁이였던 모 먹방 bj와 다르게 승승장구하시길,1개
119,모찌,"5:46응답하라1994. 욕쟁이
민도희인줄ㅋ ㅋ. 목소리똑같으신데 ㅋㅋ",2개
120,최원우,편집자님은 매니저가 아니시니까 준비에 허술한 부분이 있는건 당연하죠 ㅎㅎ. 엠브로님이랑 상당히 선 없이 친해보여서 보기 좋네요,0개
121,LOVE줄무늬,편집자님 영상 길이 좀 늘려주세요!!광고도 좀 팍팍넣고!!,1개
122,우실장,9:07 와...엠브로님 피 진짜 많이 나는데...아우...진짜  엠브로님 다치신 거만 빼면 여느 예능프로 뺨치네요. 두분 조합으로 이런 컨셉 너무 웃기고 신선합니다.,0개
123,오망고,아니 이게 무슨 개고생이야 ㅋㅋㅋㅋㅋㅋㅋㅋㅋㅋㅋㅋㅋㅋㅋㅋㅋㅋㅋㅋㅋㅋ,0개
124,김현진,편집자님 목소리 너무 귀엽고,0개
125,콩챠챠,썸넬이미지보고 삼시세낀줄알고 들어옴ㅋㅋ,0개
126,nullpointer,짐 뭐싸냐고 물어보고 그다음이 왜싸냐니 ㅋㅋㅋ 형 반대로잖아요 원랰ㅋㅋㅋㅋㅋ,0개
127,지송한일상VLOG,꾸러미 내가 해주고싶당ㅋㅋ,1개
128,전지은,너무 잘 넣아줬다ㅋㅋㅋㅋㅋ진짜 물만 줬을듯,0개
129,친질라,편집자님 사투리 완전 귀엽당..,0개
130,양재골TV,"ㅋㅋㅋㅋㅋ앜ㅋㅋㅋ이게 뭐야 ㅋㅋㅋㅋㅋㅋ
신박하니 재밋네요 ㅋㅋㅋㅋㅋ😱👍",0개
131,꽃할매,"끊임없이 도전하시고 변화하시는 모습이
너무 멋져요👍👍❤❤",1개
132,장수연,ㅋㅋㅋㅋㅋㅋㅋㅋ 진짜 둘이 케미 너무 좋아욬ㅋㅋㅋㅋ 아니 근데 짐싸라하는데 왜 저항 안 하고 뭐 싸냐고 그래욬ㅋㅋㅋ,0개
133,꿍꿍이,편집자분 귀엽다요ㅋㅋㅋ,1개
134,홍수염고래,아 대박 ㅋㅋㅋ 새로운 컨텐츠 나왔다!!,1개
135,이제현,와 형님 이건 정말 좋습니다 ... 와.. 아이디어 짱 ㄹㅇ,1개
136,bellesep,"캠핑장비 다 있어도 밤에 추운데 1박하신건가요?
입돌아가요~~",1개
137,큰행님,다리어떡해ㅜㅜ 몸도 챙기세요ㅜㅜ,10개
138,JiEunP,편집자님 뭐 어쩌라구요 할때 너무 누군가와 닮았어 ㅋㅋㅋㅋㅋ매력넘쳐요!,0개
139,주접금지,편집자 왤케 귀엽지 ㅋㅋㅋ ㅠㅠ,0개
140,베이,사회와 거리두기,2개
141,백이,ㅋㅋㅋㅋ아니 보면볼수록 편집자님  알간지님이랑 말투가 똑같네ㅋㅋㅋ,0개
142,00Yullios,진짜 두분 친한게 느껴진다.. 부럽부럽,0개
143,Iris,슬기님 반응 너무 순둥순둥. 해탈하신건가ㅋㅋㅋ 편집자님 나PD님의 얄미움까지 완벽재현 x) 물자수급(?)부터 업그레이드된 편집까지 수고 많으셨어요🌟,5개
144,박베베짱,0:30 옆에 주무시는분은 누구시징,0개
145,두둥등장,놀러간거 다 압니다,1개
146,앨꼼,"재밌는 컨텐츠 보여주셔서 감사합니당❤️
치료 잘 받으셨다니 다행이에요!!
놀랐네용 ㅠㅠ 늘 조심하세요~",0개
147,유리혀기상상채널,아이디어 굿이에요^^ 신선하고 재미있어요♥♥,1개
148,kdmkdminkdm,와근데 진짜 컨텐츠참신하고 대단하다 ㅋ큐ㅠㅠ 그대신 다치지 마시오 ㅠㅠ아래댓글에도 나무를 젓가락으로 쓰면좀 위험할수있때요 ㅠㅠ,0개
149,아잉님,다리 괜찮으신거에요? 너무 걱정되네요. 소독할만한것도 없으셨을텐데요.,2개
150,전민준,편집자 개웃ㄱㅣ다 ㄹㅇㅋㅋㅋㅋㄱㅅㄱㅋㄱㅋㄱㅋ살림,0개
151,청월,엠브로님ㅠㅜㅜㅜㅠㅜ 칼 조심하세요 진짜ㅠㅜㅜㅜㅜ 영상보면서 깜짝놀랐어요ㅜㅠㅜㅜ,0개
152,GMonkey,0:24 자연스러워 ㅋㅋㅋㅋㅋ,0개
153,잡째,"칼에 다친 부분은 응급처치 무사히 하셨다니 다행이네요ㅜㅜ
다음엔 나무젓가락정도는 챙겨서 가주세옄ㅋㅋㅋㅋ",0개
154,전꾸꾸,라면스프 압수 보자마자 슬기님 모자로 치는거 개웃겨욬ㅋㅋㅋㅋㅋㅋㅋㅋㅋㅋㅋㅋ,0개
155,목금토일,헐 여기 옛날 옛날 일박이일 시즌1때 은지원이 낙오된 그섬ㅋㅋㅋ 엠브로님도 일박이일때 기억나서 여기로 가신건가요??,0개
156,멍뭉이,이거 무인도 생존치곤  보급이 너무 좋은데요...ㅋㅋㅋㅋ,0개
157,쏘우지,ㅋㅋㅋㅋㅋㅋㅋㅋㅋㅋㅋㅋ 전 엠브로님이랑 슬기님 둘만 나오면 뭐든 다 봅니다 ㅋㅋ 케미볼려고 봄ㅋㅋㅋㅋㅋㅋㅋㅋ 아 너무웃겨,0개
158,박빈비니,하 칼다친거보고 진짜 너무 식겁했어요 제발 조심조심 해주세요ㅠㅠㅠㅠ안전이 최고🤍🤍🤍🤍🤍🤍,0개
159,김동우,0:29 옆에 누군가 계시는데요...??,0개
160,김정훈,0:30 슬기님 남친이신가요...🤣,0개
161,한유님,자급자족 아님.......,0개
162,올리브그린,벌써 재밌는~,2개
163,카리우스,편집자님이 젤 기분좋은 컨테느구만 좋아좋아,0개
164,도사마살라,다음에는 꼭 구급 상자같은거 챙겨가세요!,2개
165,mangobing27,앍ㅋㅋㅋ 슬기님과 함께하는 컨텐츠는 다 존잼...💙,0개
166,설기로운생활,엠브로님 왜 뒤로갈수록 붓고있는것 같죠...? 아!!! 세분 캐미 너무 좋아요ㅎㅎ,0개
167,황갓,나무가지로 젓가락 하실때 깎아서 사용해야해유ㅜㅜ,0개
168,PhysicalTr4ce,편집자 목소리 ㅈㄴ 귀엽네,0개
169,소영이,앜ㅋㅋㅋㅋㅋㅋㅋ,1개
170,전호연,이거 너무 재미있어요ㅠㅠ 다음에 또 찍어주세요!,1개
171,RyanPark,편집자님 목소리ㅠ 너무 좋으시다,0개
172,에임온유,0:31 슬기형 옆에 누구야 여자얌??ㅎㅎㅎㅎㅎㅎ,5개
173,조희재,음식먹방만 하시는 분이아니라 여러 컨텐츠들을 도전하고 시청자들을 생각해주는 마음 너무 좋아유,0개
174,Hankkwo,와 공중파 예능보다 재밌네  ㅋㅋㅋ,2개
175,lizymccord,거지궁 ㅋㅋㄱㅋㄱ에서 빵터졌어요 ㅋㅋㅋ재밌게봤습니당!!,0개
176,낭만신디중국어중국vlog,12:00 줍줍할만한 쓰레기가 무인도에 많네요? 헐..,0개
177,FlotB,신선 그 자체 컨텐츠 ㅋㅋㅋ,0개
178,살자즐기며,"내가보기엔 5만원짜리가 구리네ㅋㅋㅋ
3만원짜리가 최고급수준 ㅎ",0개
179,정혜영,"사승봉도 은지원 낙오된곳 아니에여?ㅋㅋㅋㅋ
야생감독님이랑ㅋㅋㅋㅋ
진짜 나무깍아서 젓가락맹글고ㅠㅠ
개웃겨진짜ㅋㅋㅋㅋ",0개
