닉네임,댓글,좋아요수,날짜
didi,그 넘어갈때마다 나오는 카드?도 넘 잘어울리고 특히 거실 넘 예뻐요ㅠㅠㅠ 아직 약간 빈 느낌이 드는데 또 어떻게 한별님 느낌으로 채워질까 상상만해도 즐겁네요💫,0개,2020. 5. 16.
Ayoungkim,오~~ 이런거 너무 좋아요 정보 많이 알려주세요 감사합니다,1개,2020. 5. 16.
lizkim,힁ㅠ 올려주셔서 고마워요ㅠㅠ 제 최애 영상이 되었습니다 땅땅!,0개,2020. 5. 16.
Yooosaeluvly,전기벽난로정보좀주세용 ㅠㅠ,0개,2020. 5. 16.
무료,언니 넘모 인테리어 매니저 같아요ㅋㅋㅋㅋㅋㅋㅋㅋㅋㅋ프로느낌...,0개,2020. 5. 16.
쥬jiews,너무 예쁘고 유익한 영상이었어용!!감사합니다~:),0개,2020. 5. 16.
Rebecca,우와아 나도 이런집살고싶다.... 현실은 아가집에 어른 둘 얹혀사는중입니다😢,0개,2020. 5. 16.
댕룽,언니영상은 내 유일한 힐링..😌🙃❤,1개,2020. 5. 16.
mfhsgm,같이 인테리어 하는것 같아서 너무 재밌어요ㅎㅎ 이런 영상 넘 좋아요😆,0개,2020. 5. 16.
RachelKim,언니 ㅜㅜ 기다렸어요오 집 정말 예쁘게 꾸미고 계셨군용~~ 그리구 옷중에 하얀 원피스!!!! 궁금해요오 ~ 하얀 원피스를 하울로 본 기억이 없는데 나중에 옷 설명 영상 찍으신다면 정보 부탁드립니당~,0개,2020. 5. 16.
뿡뿡빵,헉 근데 한국집인데 애초에 저런 인테리어의 집이 잇다니..!,0개,2020. 5. 16.
네모네모스폰지밥,흥어에에에에 너무 예뻐요!!!!!저도  나중에 혼자살게되면 언니처럼 집꾸미고싶어요♡♡♡,0개,2020. 5. 16.
라토마티나,오져부렷다.. 한별님 최고야.. 집 너무 예뻐요 ㅠㅠ 우리나라에도 벽난로가 있는 집이 있다니!! 아치형 문도 너무 이쁩니다ㅠㅠ 인테리어는 더 이뻥!,0개,2020. 5. 16.
뚠뚠,집이 한별한별해요❤️,0개,2020. 5. 16.
