,youtube_id,comment,like_num
246,park러블리,파  놓는 동작  기여워~~,0개
247,이챠륜,다음엔 그냥 비디오 맨 앞에 하루 한끼 타이틀도 나오기 전에 다된거나 마찬가지라고 넣어주세욤🥺,0개
248,쁑,이분 영상 특 음식 다 만들고 항상 정말 맛있어요 하심 귀여우셔ㅋㅋㅋㅋㅋㅋㅋㅋ,0개
249,구한준,"'이제 다된거나 다름 없습니다'가 
진짜 제때에 나오다니!",0개
250,한눈팔기좋은날,대파 놓으실때 너무 공손한 자세로 올리셔서 저도 덩달아 두 손 모으고 시청했어요 ㅋㅋ,0개
251,펭수야팥펭수야녹지마녹지마,나는 한끼님이 대파 썰때가 그릏게 좋드랑 삭삭삭서걱,0개
252,보보,"왜 대파가 없나 했더니 마지막에 ,,, 함정이었군",0개
253,쿡끼리COOKKIRI,크...한끼님의 심플한 느낌은 따라갈수가 없네요,0개
254,행복,레시피가 간단해서 몇개 똑같이 해먹어봤는데 이제까지 실패한거 없이 다 맛있어요 이것도 내일 당장 해먹어야겠어요🥰,0개
255,Angel,did u clickbait us bc the thumbnail didnt have green onion 🤣🤣,0개
256,Gayatrikaskar,"The music gets me every time , I love ur video ,mistakes and DESSERT too  .😹😹😻😻😻😻",13개
257,PrezesMinetti,when the new episode?  we are waiting too long for meals from the master ! :),0개
258,slothpapi,the Farfetch'ds <3,0개
259,Ganmu,1:34 sooo sexy 😍🤣 i love green onions. And i love you ❤,0개
