닉네임,댓글,좋아요수,날짜
은소,순간 썸네일 첨보는사람 있어서 어 난 이런사람 구독한적 없는데..? 했더니 알고보니 커버메이크업이였다,29개,2020. 4. 14.
나토끼,언니는 전생에 메타몽이였을거야..,24개,2020. 4. 14.
뇸뇸뇸,이거 진짜 두아가 봐야해.....,14개,2020. 4. 14.
POOLN,"제목이랑 사진이 두아리파인데 게시자가 사배님이라 들오왔오요...
두아리파 사진 걸어두신줄......?
손이 다이아신거죠???",677개,2020. 4. 14.
나응,언니 자꾸 그런식으로하다간 세계최고밖에 못해요...,437개,2020. 4. 14.
블링크,서양인과 동양인의 얼굴 골격이 너무나도 다른데 이렇게 똑같이 한건 걍 천재 아니냐..언니 알러뷰....❤️,626개,2020. 4. 14.
홍혜린,오늘부터 이사배에 대한 지지 발언을 전언 철회한다. 오늘부터 난 이사배와 한몸이며 이사배에 대한 공격은 나에 대한 공격으로 간주한다.,432개,2020. 4. 14.
닺,비슷한 맥락이겠지만 사배님은 화장뿐만 아니라 인물의 분위기를 잘 표현하시는 것 같아요!! 정말 원 앤 온리 ...,240개,2020. 4. 14.
안소윤,"흐어,!?!?!?!와 언니 화장을 해야지 마법을 부리면 어떡해?",425개,2020. 4. 14.
민주,동서양을 가로지르는 그녀...,177개,2020. 4. 14.
서린,역시..다이아몬드 손이라 쓰고 이사배라 읽는다,268개,2020. 4. 14.
수민,와 두아리파 언니 메이크업 실력도 좋으시네; 뷰티유튜버 하셔도 되게 잘 하실 것 같아요!,121개,2020. 4. 14.
와이케이,이사배 이사아배 이아사배 디아사패 두아라패 두아리파,227개,2020. 4. 14.
lotus00,"인스타에서 보고 ""난 분명 두아리파 팔로우 한 적이 없는데..?"" 하고 보니까 언니더라고요🤦🏻‍♀️🤦🏻‍♀️❤",147개,2020. 4. 14.
당근쥬스토마토케챱,2:05 2:27 띵땅똥땅에 맞춰서 화면 바뀌는 디테일..;;,76개,2020. 4. 14.
한은,"2:25 눈썹 그리니까 갑자기 두아리파로 확 바뀌는거 넘 신기,,",83개,2020. 4. 14.
XLOSS,진짜 뭐야..이쯤되면 언니는 매 커버메이크업때마다 얼굴을 갈아끼우시는게 분명해,103개,2020. 4. 14.
주주,와 ㅋㅋㅋㅋㅋㅋㅋㅋ 썸네일 개오반대 ㅋㅋㅋㅋㅋㅋㅋㅋㅋㅋㅋㅋㅋ진짜 너무 똑같아요,54개,2020. 4. 14.
야채고기,너무 이쁘다 진짜 어떻게 저렇게  똑같게 할 수 있는거지 금선을 넘어 다이아 손인걸 다시 한번 깨달았어요ㅠㅠㅠ,65개,2020. 4. 14.
이율아트LeeyullArt,"사배님 진짜 너무나 대단하신 것이 이번 썸네일에 사배님의 얼굴이 1도 없어서 너무 깜짝 놀랐어요. 
너무 신기하고 아름다워요 😍",111개,2020. 4. 14.
CelynBautista,"Eyy, she snatched that look! Risabae in tan look🔥",8개,2020. 4. 14.
BrandNew,사배언니에게 한계는없구나......진짜 썸넬 골져스 그자체🌞,52개,2020. 4. 14.
,눈화장 잘 어울리는게 ㄹㅇ 신기하다 ㄷㄷ,16개,2020. 4. 14.
lunarsvrant,THIS LOOK IS BOMB!! You need more recognition 😭 admire you and your works! ❤️ 👏🏻,14개,2020. 4. 14.
AllyshiaTran,i literally thought it was dua lipa in the thumbnail omg you're so talented risabae,37개,2020. 4. 14.
벨리곰,"두아 언니 커버 메이크업이라니..!!! 사랑해 갓사배 언니❣
이번에 컴백한 여자아이들이 oh my god이라는 곡을 올화이트 컨셉으로 한 무대가 있는 데, 미연님 메이크업 사배님 버전으로 보고 싶어요! 요청합니다!!",18개,2020. 4. 14.
울적한밤,와 이사배님은 뭔 카멜레온이여 대박 ㅠㅠ 뭐든 다 소화해 ㅠ 멋있어요 진짜,44개,2020. 4. 14.
아소일,경의롭다 못해 무서워여ㅜㅜㅜ 언니 호그와트에서 왔죠? 솔직히 말해요,22개,2020. 4. 14.
Yanaxxi,"wow, you’re really really talented, sabae!!! i love you!",2개,2020. 4. 14.
자말리Jamali,썸네일 누구야 뭐야 했는데 사배언니였어!! 이건 역대급 커버메이크업이다!!!,14개,2020. 4. 14.
영원히워너원,ㅋㅋㅋㅋㅋㅋ  썸네일 보고 어 나는 이런 외국인 구독한 적 없는데..? 했더니 역시 갓ㅡ사ㅡ배,13개,2020. 4. 14.
비숑,와 이건 미쳤다 동양인 얼굴에서 서양인 얼굴이 보인다니 ㄷㄷ 메이크업 기술 장난 아니다,7개,2020. 4. 14.
곰수니이,진짜 천의 얼굴ㄷㄷ....😭,6개,2020. 4. 14.
seungmiKim,오 역시!!! 금손 사배님~~~,6개,2020. 4. 14.
하고싶은게많은나이,와 오마이갓 충격 진짜 멋잇는 여자  언니사랑해여,10개,2020. 4. 14.
정은주,언니ㅠㅠㅠㅠ 싱크로율 대박이다 진짜...❤ 신의 손 천의 얼굴 사배언니🙊👍👍🌌❤❤,5개,2020. 4. 14.
EstherLim,노래랑 브러쉬 움직이는 손길의 박자가 탁탁 맞아 떨어져요 ㅋㅋㅋ,4개,2020. 4. 14.
사니,정말 너무 깜짝놀랐어요...ㅋㅋㅋㅋㅋㅋㅋㅋㅋㅋㅋㅋ진짜 존똑이다,3개,2020. 4. 14.
LA,OMG!!!! You are soooo talented girl!!!! Love you so much!!!!,6개,2020. 4. 14.
최채연,헐 사배언닌줄 몰랐어... 역시금손ㅠㅠㅠㅠ!!!!,3개,2020. 4. 14.
조이로그JoyLog,와 진짜 금손... 🤩,6개,2020. 4. 14.
사랑해요,역시 만의 얼굴 그녀...리...사...배,7개,2020. 4. 14.
아하,크으으으ㅠㅠㅠ 언니 약간 저승길 타고 올라가면 뚝배기 한 대 갈기면서 너 나쁜 짓 많이 했지 애기? 하고 싱긋 웃어줄 거 같은 대마왕같아아요ㅜㅜㅜㅜ,5개,2020. 4. 14.
무넴찌,레전드레전드ㅠㅠㅠㅠㅠ온니사랑해요ㅠㅠㅠㅠㅠ,5개,2020. 4. 14.
세라,두아리파가 이거 봤으면 좋겠다 ㅠㅠ,3개,2020. 4. 14.
GraceOh,"도대체 사배 언니의 한계는 어디일까요?

~그런건 존재하지 않습니다~",8개,2020. 4. 14.
목화,OMG 두아리파 메이크업이라니 ㅠㅠㅠㅠ,4개,2020. 4. 14.
서영주,와 진짜 예술,2개,2020. 4. 14.
김민아,"언니 진짜 개똑같아요 ㅠㅠ ㅋ ㅋ ㅋ ㅋ첨에
인스타 보고 진짜 놀랬자나요!! ㅠㅠㅠ ㅋ ㅋ ㅋ ㅋ ㅋ ㅋ. ㅋ ㅋ ㅠㅠ 역쉬 갓사배❤️❤️",4개,2020. 4. 14.
jinnykim,"와 서양인 메이크업 하니까 눈이 두 배는 커지네..ㄷㄷ
언니 멋져요",3개,2020. 4. 14.
대댕림,순간 두아리파님이 메컵 튜토리얼 올리신 줄 알았어요... 진짜 이사배님은 정말 대단하신 것 같아요,3개,2020. 4. 14.
sugaworld,"헐 ...
썸넬보고 두아리파×이사배 스페셜 콜라보 영상인 줄;;;",2개,2020. 4. 14.
도블리,진짜 갓사배 ㅜㅜㅜㅜㅜㅜㅜㅜㅜㅜ 거의 커버메이크업 신의손수준 ㅜㅜㅜㅜ 언니 멋잇어여,1개,2020. 4. 14.
JisooKim,진짜 메이크업은 이사배 세글자로 정리가능하다,2개,2020. 4. 14.
한유리,매일아침 언니 손만있으면 세상다가진 기분일거같다....🙏,3개,2020. 4. 14.
조세림,사배님 너무 예뻐요ㅠㅠㅠㅠㅠ,2개,2020. 4. 14.
HarunaMaya,"You're amazing as always! 
btw could someone tell me the name of the song at the beginning? :)",1개,2020. 4. 14.
calibuster,와 ㅁㅇㅁㅇ 두아라니.. 얼굴에 두아 나타난다 나타나~~,2개,2020. 4. 14.
컇햫,"이 언니 서양과 동양을 넘나드는 천상계 사람임이 분명해.,, ❤️난 제목만 보고 두아리파가 한국어하는줄 알았어...",6개,2020. 4. 14.
뭐,미친 팝 가수중 젤 좋아하는 두아 커버해주시다니ㅠㅠㅠㅠㅠ,1개,2020. 4. 14.
주영,"와,, 언니 진짜 개머시써😭",1개,2020. 4. 14.
큐영QYOUNG,이번 영상 내꺼하자............. 진짜ㅜ 💍,1개,2020. 4. 14.
dnro,ㅋㅋㅋㅋㅋㅋㅋㅋ 진짜 봐도 봐도 놀랍다 ㅋㅋㅋㅋㅋ,1개,2020. 4. 14.
ZarahRose,OMG you look exactly like Dua Lipa 😍😍😍 Good job 🤙🤙🤙,0개,2020. 4. 14.
양말,"진짜 대박이라 입벌리고 멍때리면서 보다가 영상 디테일 진짜 미쳐요
박자 맞춰서 넘어가는거 봐..",1개,2020. 4. 14.
삐순이,와 진짴ㅋㅋㅋ 보면서도 믿기지가 않넼ㅋㅋㅋㅋㅋ 내가 뭘 본거지🙄,0개,2020. 4. 14.
Saoirse씨얼샤seersha,우와  메이크업이란..진짜..대단하다...,2개,2020. 4. 14.
겨터린gyurin,언니 짱짱맨 진짜루요ㅠㅠ,1개,2020. 4. 14.
성은,언니 정수리 무슨일이에여ㅋㅋㅋ,1개,2020. 4. 14.
1wjdwldms,"와,,, 진짜 서양인 인줄 ㅠㅠㅠㅠㅠㅠ대박이에여퓨ㅠㅠㅠㅠㅠ짐짜",0개,2020. 4. 14.
챈쓰,이러다가 사배언니 얼굴 까먹겠다.. 흐헿... 진짜 최고여유~,1개,2020. 4. 14.
수수,아니ㅋㅋㅋㅋ 빠르게 내리다가 진짜 두아리파 영상인줄알고 들어왔는데 사배님 커버메이크업영상이었음ㅋㅋㅋㅋㅋㅋㅋㅋ,0개,2020. 4. 14.
박회린,부부의 세계 ㅜㅜ 한소희 커버 메이크업 해주세용 ㅜㅜㅜ,1개,2020. 4. 14.
이새별,"누구지 하고 넘겼어요 언니,,진짜 카멜레온ㅠㅠㅠ조녜",0개,2020. 4. 14.
수빵,"인종을 바꾸다니,,, 여윽시 갓사배 실력 어디 안 가져~?",2개,2020. 4. 14.
뽀짝채아,진짜 커버 메이크업 올리실때마다 최고에요ㅠㅠㅠㅠㅠㅠㅠㅠㅠ진짜 금손 👍👍,0개,2020. 4. 14.
fransiskatiaradewi,thats crazy!!!! Ur so talented risaa!!! love from indonesia💓😘,1개,2020. 4. 14.
이지우,와 노래 박자(?)에 따라서 화면 바뀌는거 ㄹㅇ 개천재..❤️❤️,1개,2020. 4. 14.
티미,와 이번 화장도 미쳤지만 편집 개미쳤어...갓사배 영원히 사랑해요ㅠㅠㅜㅜㅠ,1개,2020. 4. 14.
YounaLee,브금 박자 맞춰서 화면 끊는 편집 예술이다..ㅠㅠ,1개,2020. 4. 14.
자기,와 대박 노래 박자 맞춰서 편집한거봐 진짜 편집자님 존경합미다ㅠ,0개,2020. 4. 14.
NiniBlas,미쵸따 미쵸따 ㅜㅜㅜㅜㅜ 저 내일 이러고 나갑니다 눈화장 넘 예뻐요 따라해볼게용 ㅜㅜ,6개,2020. 4. 14.
박재호,와ㅜㅜㅜ 역시 커버메이크업 일인자답다ㅜㅜ,0개,2020. 4. 14.
CB,와... 진짜 너무신기하다ㅠㅠ 금손을 넘어 갓손...✨ 대단해요정말👍🏻,0개,2020. 4. 14.
SuryunKang,와.... 멋있음 그 자체에요!!! 영상보면서 점점 두아리파가 사배님 몸 속으로 동기화되는 느낌?!?!👍🏻 소름이 쫙 돋았어요! 멋있어요❤️,1개,2020. 4. 14.
김지수,ㅠㅠㅠ진짜 멋있구 이쁘고 다해요 언니ㅠㅠㅠㅠㅠㅠ,0개,2020. 4. 14.
박죠,부부의 세계 여다경 메이크업 보고싶습니다 ㅠㅠㅠ,0개,2020. 4. 14.
이지연,언니 신고안할테니까 솔직히 말해요ㅠㅠㅠ 이정도면 언니 메타몽 맞다니까요ㅠㅠㅠ,1개,2020. 4. 14.
연주,와...언니 진짜 사랑해요...ㅠㅠㅠ,0개,2020. 4. 14.
무릎석탄,대박 ㅋㅋㅋㅋ썸넬 보고 제목 영어일줄 알았는데 ㅋㅋㅋ 이사배 세글자 보고 소름,0개,2020. 4. 14.
와랄롤,진짜 언니는....천의 얼굴이야..진짜ㅋㅋㄱㅋㅋㅋㄱㅋㄱㅋㄱㅋㄱㅋ,0개,2020. 4. 14.
댱이,대박.. 누군가 했더니 사배언니였어.. 진짜 못알아봄 ㅋㅋㅋ,0개,2020. 4. 14.
HyeInYu,"l진짜 갓사배..존경합니다..

이거 노래 제목 아시는 분 ㅠㅠ??",4개,2020. 4. 14.
리아,우런니 어디가써ㅠㅠㅠㅠㅠㅠㅠㅠㅠㅠㅠㅠㅠㅠㅠㅠ 울언니는 어디가고 노래잘하는 사람이 와있어ㅠㅠㅠㅠㅠㅠ,1개,2020. 4. 14.
악악,음악 리듬에 맞춰서 장면 넘어가는거 편집자 센스 미쳤다,1개,2020. 4. 14.
BAC,입술 진짜 두아같아여ㅋㅋㅋㅋㅋㅋㅋㅋㅋㅋ,0개,2020. 4. 14.
류연,"돠리빠 너무 똑같고 넘 조타ㅠㅜ두아 사배 최고,,,",0개,2020. 4. 14.
주호희,와 그냥 미쳤다,2개,2020. 4. 14.
자기,ㅇㄴ 진짜 두아언니가와서 공식체널에서 뭐 찍고간줄 알고 들어요ㅏㅆ더니 언니가잇어요,0개,2020. 4. 14.
Iim예지,정말 썸네일 보고 진짜 두아리판줄 알았어요 ㅠㅠ진짜 메이크업계의 금손의 금손의 금손이다🖤,0개,2020. 4. 14.
lily,이건 그냥 미친거다~~  와~~ 진짜~~~!,1개,2020. 4. 14.
지수jisu,"언니 썸넬보고 진짜 두아리파인줄 알았어 대박,,이말밖에 안나와 사랑해 언니ㅠㅠㅠ",0개,2020. 4. 14.
MHK,와... 진짜 오늘 사배님이 탑 유튜버라는거 다시 한 번 느끼고 가요👏🏻👏🏻👏🏻,0개,2020. 4. 14.
소윤,두아언니 여기서 보네??안녕!! 이번에 나온 노래들 짱 좋드라~~!! 메이크업도 잘 하넹...와웅,1개,2020. 4. 14.
,브금 정보좀여ㅠㅠㅠ,0개,2020. 4. 14.
유자맛구름이,헐... 섬네일 보고 사배님 아닌 줄 알고 와 이 메이크업 천재는 또 누구지 하면서 들어왔어요 진짜 금손 천의 얼굴 ~!~!~!,0개,2020. 4. 14.
JINSUKIM,와 진짜 언니 완전 멋져요... 완전..대박 엄청 전문적인 그런모습.. 하.. 멋져요 짱짱♡♡,1개,2020. 4. 14.
이유민,메이크업 진짜 끝판왕이세요 ㅠㅠㅠ 다음엔 가능하시다면 오마이걸 아린 커버해주세요!,0개,2020. 4. 14.
이서우,와.....채널명 보고 사배님인 거 알았네요.. 항상 놀랍네요..,2개,2020. 4. 14.
사랑해김청하,언니 진짜 두아리파가 유튜브 시작한줄 알았어요.....;;,1개,2020. 4. 14.
퀸제이,2:00 노래 박자에 맞춰서 장면 바뀌는 거 좋당...,0개,2020. 4. 14.
박민아,두아리파메이크업하시네넘잘하신다화장ㅎㅎ사배언니,1개,2020. 4. 14.
김민서,나도 화장 저렇게 잘해보고 싶다ㅠㅡㅠ,0개,2020. 4. 14.
김예빈,힉 두아 언니 메컵을 해주시다니...❤️ 두아언니 팬은 광광 웁니다😭😭😭💖💖💖,0개,2020. 4. 14.
LyuHyojin,ㅋㅋㅋㅋㅋㅋㅋㅋㅋㅋ아니 얼굴에서 사배님이 안보임,0개,2020. 4. 14.
앗엔시티멤버수내친구보다많다,"원래부터 대단하신 건 알고 있었지만,,,, 역시 갓사배 진짜 이거 두아리파가 봐야돼 ㅠㅠㅠㅠㅠㅠㅠㅠㅠ 인종 초월,,,,",0개,2020. 4. 14.
,와 진짜 감탄만 나오네... 썸넬 보고 놀라서 들어왔다가 화장 보는데 입이 다물어지지가 않네 짖짜 그냥 메이크업이 이사배고 이사배가 메이크업 그 자체다...,1개,2020. 4. 14.
Ililililill,이거 배경노래 아시는분 ㅠㅠㅠㅠ,2개,2020. 4. 14.
안나,와 너무신기해,1개,2020. 4. 14.
서찹쌀모찌,"대박...우와.. 외국뇨자 구독한적없는데 했는데 ㅋㅋㅋ 왘ㅋㅋ
메컵하는거 내눈으로 보면서도 안믿김 짱이여!",0개,2020. 4. 14.
MARYKIM,어머 두아 아니 사배언니이!!!ㅠㅠ 대박이당 ㅠㅠㅠ 언니는 맨날 잘해ㅠㅠ♡♡ 짱짱,0개,2020. 4. 14.
제제,두아리파도 두아리판데.. 저런 섀도우를 어떻게 소화하는거야 도대체😦,2개,2020. 4. 14.
,썸넬보고 응? 두아리파 뮤비인가? 했는데 사배언니...,2개,2020. 4. 14.
돼지유,누구 두아리파님이랑 친분있는사람 없어여?ㅠㅠ이건 진짜 보셔야데ㅜㅜ,0개,2020. 4. 14.
호비오빠는희망이쩌러엽,와...동양인이 서양인을 소화할수있는게 진짜 대단하다  ((아니아니 그냥 똑같아,0개,2020. 4. 14.
말하는껌,"아 진짜 똑같아 너무 똑같아
백미터 앞에서 봐도 두아리피씨에요 진짜
광대랑 입쪽이 너무 똑같아요🤭",0개,2020. 4. 14.
poi12,난 언니가 학생때 공부 열심히했어서 성형외과 의사했어도 서울에서 부산까지 줄을 섰을거라 장담해,1개,2020. 4. 14.
김민지,다른 사람들이 커버메이크업이라면 언니는 그냥 그사람이 유튜브 하는것 같아...,0개,2020. 4. 14.
SongEe,헐... 진짜 대박이다~ 어떻게 이렇게 매번 완벽하게 해내지요? 진짜 인정 인정. 제가 나름 유명하다는 세계 MUA 유투버 거의 다 봤는데 거의 탑급이십니다~ 👍,0개,2020. 4. 14.
박죠,"갓사배...ㅠㅠㅠㅠ
제목없었으면 진짜 두아리파 인줄 알겠어요 ㅋㅋㅋㅋㅋㅋㅋㅋㅋㅋㅋ




사배님...나래언니 조지나 메이크업이랑 이태원클라쓰 조이서 커버 메이크업 조심스럽게 요청해도 될까요...?🙏🏻ㅠㅠㅠㅠㅠㅠ",0개,2020. 4. 14.
LayTheresa,I was shocked😱I thought you were really Dua!!! Beautiful and talented as ALWAYS 💗,0개,2020. 4. 14.
JiShin,"와 근데 사배님한테 이 메이크업 진짜 잘어울리는 것 같아요...! 
아이메이크업 진짜 너무 예뻐요~♡",0개,2020. 4. 14.
yelimkook,이건 뭐랄까?! 진짜 분장이 아닌 메이크업 느낌인데 분장한것 같아.,0개,2020. 4. 14.
jiuning지어닝,이야..역시 화장 잘하시는 분은 다르시네요ㅜ저도 화장 잘하고 싶어요ㅠㅠ영상 너무 잘봤어요 앞으로도 잘 볼게요♥,0개,2020. 4. 14.
비멜예,와..진짜언니 썸네일보고 누구지 하고 이름 봤는데 이.사.배 와...진짜 갓사배의 능력이 어디까진지 궁금해여..👏👏,0개,2020. 4. 14.
황채원,노래 박자에 맞춰서 화면 바뀌는거 진짜 딱딱 맞아서 쾌감 오져.... 편집자님 너무 열일하시네여,0개,2020. 4. 14.
이유진,ㄱ다렸어요ㅠㅠㅠㅠ,0개,2020. 4. 14.
레모니조앙,진짜 역대급... 처음보는 사람 썸네일애 잇길래 봣더니 사배언니... 진심 이건 레전드다 하고 바로봄👍,0개,2020. 4. 14.
0908Dldpqls,어쩜 저리 피부가 고울까ㅜㅜ 이번 커버메컵도 진짜 쩔어요ㅜㅜ❤️❤️,0개,2020. 4. 14.
사라앙,와...진짜 금손 사배님❤️,0개,2020. 4. 14.
